id,created_at,text,retweets,favorites
286625561881755649,2013-01-03 00:10:33,Click here to watch my statement on last night's vote http://t.co/QTSbuuPX.,9,0
286291887097266176,2013-01-02 02:04:39,Today is the 150th anniversary of President Abraham Lincoln's Emancipation Proclamation. A new birth of freedom indeed.,80,17
281015162423623681,2012-12-18 12:36:50,Senator Inouye was a Medal of Honor winner and a true American hero. I was proud to work with him on Appropriations and other matters.,6,0
280800427778375680,2012-12-17 22:23:33,Click here to read my statement on the appointment of @RepTimScott to the U.S. Senate. http://t.co/1X15Nj9I,9,2
279715660848848896,2012-12-14 22:33:05,No community should fear violence in their schools. We must do whatever it takes to keep this from happening again.,33,2
279715563025088512,2012-12-14 22:32:41,"As a father and grandfather, my thoughts and prayers are with the victims in CT.",11,0
279340126604255235,2012-12-13 21:40:50,I'm still proud of @AmbassadorRice and glad she will continue to serve. Her Republican critics need to stop their mindless partisanship.,78,15
278981179179405313,2012-12-12 21:54:30,Click here to watch my floor statement: time for action on Middleclass Tax Cuts http://t.co/5WuOJZzA,18,2
278573280376549377,2012-12-11 18:53:40,Click here to watch my interview with @MartinBashir @MSNBC http://t.co/8ucRKA46,5,3
278240008463323137,2012-12-10 20:49:22,"Will Bashir at 4pm today. Time for posturing is over. American people voted for action on econ growth, job creation and tax fairness.",4,0
278209547930320896,2012-12-10 18:48:19,Wishing all of my Jewish friends a Happy Hanukkah. Enjoy the latkes!,4,0
277188868959260672,2012-12-07 23:12:30,#FF @edshow @rolandsmartin @tvonetv @@Eugene_Robinson,0,0
277104155502444544,2012-12-07 17:35:53,"Welcome news. Unemployment down, job growth up. need a budget deal to grow econ, create jobs &amp; ask wealthiest 2% to pay their fair share.",21,2
276439215955378176,2012-12-05 21:33:39,I urge all Members of House -- Republicans and Democrats -- to sign Discharge Petition for immediate action on middle class tax cut. #My2K,121,24
276437825736556544,2012-12-05 21:28:08,"Time is now for action. Republicans must compromise on a fair and balanced plan to reduce the deficit, grow economy and create jobs. #My2K",28,5
276436759850672130,2012-12-05 21:23:54,President Obama ran on his economic vision and won the election by some 5 million votes. #My2K,47,6
276435021303250944,2012-12-05 21:16:59,"On Nov 6th, House Democrats won 1 million more votes than the Republicans. #My2K",40,5
276388341782544384,2012-12-05 18:11:30,"Jack Brooks refused to sign the segregationist ""Southern Manifesto"" in 1956 and helped write the Civil Rights Act of 1964. RIP, Mr. Chairman",50,8
276114088378109952,2012-12-05 00:01:43,Time for action on middle class tax cut. Click here to read my statement: http://t.co/NrMQZQZh,20,3
274621994832633857,2012-11-30 21:12:40,Congratulations Leadership Team 113th Congress @NancyPelosi @WhipHoyer  @RepBecerra @repjoecrowley,8,3
274311879952855040,2012-11-30 00:40:23,I am grateful for the support the @HouseDemocrats have accorded me to continue as Assistant Democratic Leader. http://t.co/JgI3ZJc6,44,10
274275723047485440,2012-11-29 22:16:42,RT @RepRichmond: Great meeting with @CloseUp_DC and Ursuline Academy students from LA! Great discussion @Clyburn! http://t.co/tqBtJa4v,5,0
273915616321228801,2012-11-28 22:25:46,House Republicans would be wise to follow the lead of Rep. Cole and give tax cut to 98% of Americans and resolve this mess they created,47,12
273908014413660161,2012-11-28 21:55:34,Democrats embrace our nation's diversity. House Republicans' all-male lineup of committee chairs shows they are woefully out of touch.,18,2
273859586052718594,2012-11-28 18:43:08,RT @NancyPelosi: I join President Obama in his call on Congress to pass a middle class tax cut bill right now.  #My2K,952,0
270955339774562304,2012-11-20 18:22:41,Happy birthday to @VP Joe Biden!  Literally.,38,4
269195899048189952,2012-11-15 21:51:18,Click here to watch my Hardball interview with Chris Matthews on MSNBC. http://t.co/hWrVkxdi,4,1
269163657554964481,2012-11-15 19:43:11,One of the highest honors of my life to receive the Lewis-Houghton Leadership Award from the Faith and Politics Institute last night.,8,1
269116526739718144,2012-11-15 16:35:54,Click here for my letter to the House Democrats about making sure all voices are heard at the Leadership table: http://t.co/6UIwGo5r,7,0
268838892046782464,2012-11-14 22:12:41,It's my pleasure to congratulate @RepMarciaFudge. She will be an outstanding Chair of the Congressional Black Caucus.,22,1
266286704653119488,2012-11-07 21:11:12,I am thrilled that the American people have re-elected President Barack Obama to a second term. http://t.co/bZoPd1kB,17,4
264389490070659073,2012-11-02 15:32:21,"184,000 new private sector jobs in Oct = good news. Congress should pass Obama jobs bill ASAP.",24,3
260377018103902210,2012-10-22 13:48:13,"Sen McGovern was a war hero and strong leader for peace, justice and feeding hungry people throughout the world. May he rest in peace.",11,2
258279113230544897,2012-10-16 18:51:53,Seniors earned their Medicare benefits through lifetime of hard work; Republican budget plan would replace Medicare guarantee w voucher plan,27,5
258274279802675200,2012-10-16 18:32:41,"Republican budget ends Medicare guarantee, and new Kaiser study shows 59% of Medicare patients would pay more for care",17,1
258268709976674305,2012-10-16 18:10:33,Kaiser Foundation study shows Republican Medicare voucher plan would increase premiums for millions of seniors,16,3
257921296548102144,2012-10-15 19:10:03,"I am deeply saddened by the passing of my dear friend, Peatsy Hollings. http://t.co/ZmnuhhEe",1,0
256437935388389376,2012-10-11 16:55:42,“Ryan can’t Etch-a-Sketch away his draconian budget.” Click here http://t.co/CWKzVzr3 to watch my interview on @JansingCo.,8,2
254333522666467328,2012-10-05 21:33:31,#FF @MorningBriefing @pamelaxmpotus,2,0
254274886988623872,2012-10-05 17:40:31,"#FF @chucktodd, @brookebrower,  @dailyrundown",0,0
254246894254039040,2012-10-05 15:49:17,"Today's jobs report shows Pres Obama's policies are working despite the #DoNothingGOP Congress. We need to keep moving forward, not go back.",154,21
253593242472443904,2012-10-03 20:31:55,Big CONGRATS to my friends at @dailyrundown for Sept ratings score! @chucktodd is one of the best in the business; @brookebrower is a pro,7,0
253236594528628737,2012-10-02 20:54:43,"RT @JoeNBC: Great job, Morning Joe team! We ranked #1 in young viewers for September and had our highest ratings in 4 years. Proud of you!",29,0
252823422952943616,2012-10-01 17:32:55,RT @AAPD: Had a chance to check out our summer newsletter featuring @Clyburn @cathymcmorris @RepLoBiondo? http://t.co/KefqVkKt #pwd #dis ...,3,0
251027471443570688,2012-09-26 18:36:27,Wishing all my Jewish friends a peaceful and fulfilling Yom Kippur and culmination of the Days of Awe. Have an easy fast.,7,0
250710273151873024,2012-09-25 21:36:01,"To identify ways you can help get folks #VoteReady, please visit: http://t.co/PFJXAliv",26,3
250708090599641088,2012-09-25 21:27:21,RT if you will get 5 or more friends #VoteReady!,22,0
250695032879853569,2012-09-25 20:35:28,@OfficialCBC wants to know if you are #VoteReady?,3,0
250690284487311361,2012-09-25 20:16:36,Voting registration deadlines approaching: http://t.co/pOOmtQBr #VoteReady,13,0
250688498485571584,2012-09-25 20:09:30,Find a National Voter Registration Day Event near you: http://t.co/w9pfzPLo #VoteReady,10,1
250688237390139393,2012-09-25 20:08:28,Today is National Voter Registration Day: http://t.co/puBinfed #VoteReady,8,1
250621651677491203,2012-09-25 15:43:52,RT @OfficialCBC: Here’s what YOU can do to make sure your community is #VoteReady: http://t.co/EyZTIGlS @OfficialCBC,9,0
249195200809955328,2012-09-21 17:15:40,Clyburn joins Democratic press conference on Republican Do Nothing Congress http://t.co/PSBF7hul,14,3
248908159324934145,2012-09-20 22:15:04,Click here to watch my interview with Martin Bashir on MSNBC http://t.co/AeMmf71D.,12,3
248532089710972928,2012-09-19 21:20:42,I'm very disappointed to see Republicans kill Veterans Job Corps bill on a Senate technicality. America's heroes deserve so much better.,99,12
248149177488531456,2012-09-18 19:59:08,"As the Representative of many of the men and women at Shaw AFB, let me wish happy birthday to the US Air Force and thank all who have served",7,1
246701786763755520,2012-09-14 20:07:44,#FF @Morning_Joe @morningmika @chucktodd @JansingCo @MHarrisPerry,1,0
246690837969395712,2012-09-14 19:24:13,#FF @woodhouseb @MelanieDNC,2,1
245630449337126914,2012-09-11 21:10:37,#SC: Sign-up here for voting-related reminders that link up with your calendar. #VoteReady http://t.co/bppHJXMS,6,2
245622678340390912,2012-09-11 20:39:44,#SC: Sign-up here for voting-related reminders that link up with your calendar. http://t.co/bppHJXMS #VoteReady,4,2
245622323850387459,2012-09-11 20:38:20,#SC: Get the latest information on how to request and mail-in your absentee ballot: http://t.co/qNVfJFYu #VoteReady,16,2
245621606502789121,2012-09-11 20:35:29,1st-time voters: must bring a valid photo ID or a document such as a utility bill with your current name and address. #SC #VoteReady,17,1
245620771983089664,2012-09-11 20:32:10,#SC: Contact the State Election Commission at (803) 734-9060 with questions about voting in South Carolina.  #VoteReady,12,0
245594153654824960,2012-09-11 18:46:23,"#SC: To vote in the November 6, 2012 general election you must be registered by Saturday, October 6, 2012. #VoteReady",40,1
245574245244080128,2012-09-11 17:27:17,Find your polling place in #SC: http://t.co/NZQnJ695 #VoteReady,19,2
243427936873635841,2012-09-05 19:18:37,Great to join credit unions in supporting the important work of children's hospitals. http://t.co/MKojpnPx,6,1
240116804880592897,2012-08-27 16:01:22,Hats off to SC native Larry Doby for his contributions to @mlb and the new postage stamp in his honor.,8,0
236136171497979906,2012-08-16 16:23:45,I applaud @ATT for their campaign to end dangerous and tragic texting while driving. #itcanwait,9,1
235448960393809920,2012-08-14 18:53:01,Wind energy means good jobs. Clemson's turbine testing facility in Charleston = good example. Congress must renew clean energy tax credits,16,0
235435040178335745,2012-08-14 17:57:42,"#SocialSecurity signed into law on this date in 1935. We must protect retirement security for all Americans, safety net for less fortunate",25,1
232570638810902528,2012-08-06 20:15:35,Voting Rights Act signed into law on this date in 1965. We can't afford to turn back the clock in 2012! #VoteReady,50,2
232544686013820928,2012-08-06 18:32:28,Thoughts and prayers go out to the #Sikh community in WI and throughout the country. All Americans deserve to be safe in houses of worship,36,6
231477151164166145,2012-08-03 19:50:28,Tax free Olympic medals? Maybe if made retroactive for Ali &amp; Sugar Ray. And pay 4 it by closing tax loopholes for outsourcing American jobs,11,2
231104607638663168,2012-08-02 19:10:06,Congratulations to Olympic Gold Medal winner Gabby Douglas!  We are so proud of you!,15,0
230794189586186240,2012-08-01 22:36:37,The only thing standing in between the middle income folks and their tax cut is the Republican Leadership in this House http://t.co/imEneIRj,16,1
230014480904515584,2012-07-30 18:58:20,"47 yrs ago today, #Medicare became law. Obamacare extends the trust fund 14 yrs. Republican budget would end guarantee of earned benefits.",28,3
229032354453274624,2012-07-28 01:55:43,#FF @JohnAvlon @NatUrbanLeague @USDA @Morning_Joe @morningmika,1,0
228256809968877568,2012-07-25 22:33:58,Our coastline &amp; tourism industry are too valuable to put in jeopardy for Big Oil interests so I am voting today to protect the SC coast.,6,1
228165819157344256,2012-07-25 16:32:25,"New report out today shows seniors have already saved $4B on Medicare prescription drugs under Obamacare. I say again, repeal is a bad idea",20,0
227893745012584448,2012-07-24 22:31:17,CBO report today shows repealing Obamacare would add $109 Billion to our debt/deficits. Bad idea.,55,3
227886327230771202,2012-07-24 22:01:48,Republican Leaders voted for the Budget Control Act; now trying to blame Pres Obama for the spending cuts it contains. Stop the partisanship,19,1
227879201066340352,2012-07-24 21:33:29,I support Pres Obama's call for Congress to pass the Veterans Job Corps bill to put our returning heroes to work in good jobs.,15,2
227495757610119168,2012-07-23 20:09:49,"Many thanks to all the thoughtful birthday wishes over the weekend via Twitter. Don't forget to ""friend"" me on FB too.",2,0
226346829577592833,2012-07-20 16:04:24,"My thoughts and prayers are with the victims of the senseless violence in Aurora, Colorado. I hope God will comfort them in their grief.",15,2
226097439671738369,2012-07-19 23:33:24,Great joining guest host @capehartj on MSNBC today http://t.co/mj1hrV8k,0,0
226021162801561600,2012-07-19 18:30:19,I've been working closely w Obama admin to expedite the Charleston port project. I appreciate their responsiveness. Good news 4 jobs/economy,14,1
225989297432571905,2012-07-19 16:23:41,I'm honored to receive Lifetime Achievement Award from Minority Media and Telecommunications Council. #MMTC2012,18,2
225627136264900609,2012-07-18 16:24:35,"Happy Birthday Nelson Mandela. Iconic leader for peace, justice and freedom.",21,3
224982766486437893,2012-07-16 21:44:06,"Check out my interview on @Morning_Joe today, http://t.co/TY4Jp6Sd",6,5
223523336062386177,2012-07-12 21:04:50,RT @nokidhungry: Our Congressional #Heroes: @repjoebaca @clyburn @rosadelauro @marciafudge @repmarcykaptur Thank you from the kids! #SNA ...,14,0
223515028475752448,2012-07-12 20:31:50,Republicans wasted $50 Million in taxpayer funds on a political stunt. Use #50millionreasons w your ideas for better uses of $50M,33,1
223180632388411392,2012-07-11 22:23:03,I rise today in opposition to this partisan charade to repeal patients’ rights. http://t.co/3CbY8QIk,19,0
222374180665036800,2012-07-09 16:58:30,"Pres Obama and Democrats in Congress favor extending tax cuts for middle class and working ppl, ending extra tax cuts for wealthiest few",8,0
221273797330878465,2012-07-06 16:05:59,Today’s jobs report is even more evidence that the U.S. House needs to focus on job creation not partisan posturing.,15,2
219909970165104641,2012-07-02 21:46:37,"RT @CHARMEISHERE: @Clyburn DEAR CONGRESSMAN, THANKS FOR THE GOOD FIGHT FOR THE AFFORDABLE HEALTHCARE ACT! Heard U on @WeGotEd Schultz sh ...",3,0
218788597837479936,2012-06-29 19:30:41,#ff @chucktodd @tamronhall @johnlewis @repbecerra @repcleaver @repjohnlarson @whiphoyer @nancypelosi @BarackObama @chucktodd @brookebrower,5,0
218402437596323840,2012-06-28 17:56:13,"Today's ruling by the U.S. Supreme Court on the Affordable Care Act is a big, big victory for the American people  http://t.co/5x0lKoRF",14,1
218091512091779073,2012-06-27 21:20:43,"RT @chull62068Carol: @Clyburn two wrds, Thank You!!!",0,1
218083581313032194,2012-06-27 20:49:12,RT @sharm629: @HouseDemocrats Plz stop being bullied by GOP &amp; NRA; take your lead fr @NancyPelosi &amp; @Clyburn,19,4
218072953299013633,2012-06-27 20:06:58,Thanks to the #MontfordPointMarines for their service and sacrifice.  The Congressional Gold Medal is a long overdue recognition!,8,0
218027114723676161,2012-06-27 17:04:49,Contempt Vote has nothing to do with running the country – they’re just trying to win an election: http://t.co/7fEI7206,16,4
216255650148257793,2012-06-22 19:45:39,#FF @elijahcummings @housedemocrats @oversightdems @askgeorge,0,1
216221788806459392,2012-06-22 17:31:06,Honored to receive Sen Edward Kennedy Memorial Award last night from @DCDemocrats. EMK spent his life advancing the cause of social justice.,4,1
215568196403609600,2012-06-20 22:13:57,Read my statement on contempt vote against Attorney General Holder http://t.co/J0KZxxAH,44,13
215553337884545024,2012-06-20 21:14:55,"Congratulations to Ethel Canty, of Pinewood, SC, 6th Congressional District Artistic Discovery Arts Competition winner",1,1
213360249166512128,2012-06-14 20:00:22,Most important part of Pres Obama's speech today is his plan to use some war savings for nation-building here at home. I agree. #jobs,27,4
213330510506766337,2012-06-14 18:02:11,"Congratulations to our 11,000th follower, @visnryExcllence!  Spread the word",1,1
213306113364467712,2012-06-14 16:25:15,Happy #FlagDay! And thank you to the brave men and women of the @USArmy. Happy #ArmyBDay! http://t.co/kUrnF68H,5,0
211208116971384832,2012-06-08 21:28:33,#FF @MelWattNC12 @BennieGThompson @tjholmes @closeup_DC,1,0
211195424357351425,2012-06-08 20:38:07,Congress needs to get to work now to enact policies that will produce an economy that works for working people. http://t.co/ZRzQeoO5,11,0
210761760926482432,2012-06-07 15:54:54,"RT @PaulPage: CBO Director Elmendorf tells Congress emphatically, stimulus worked, created jobs, and economists agree. http://t.co/lkhYZFat",33,0
210503445826912256,2012-06-06 22:48:27,"RT @NMAAHC 68 years ago today, about 2,000 African-American soldiers helped storm Normandy. http://t.co/B71n5zA6",13,2
210471420277440513,2012-06-06 20:41:11,RT @vannhelton: @Clyburn. My wife has been a teacher for 23 years. Keep pushing to keep her there and adding quality teachers in the cla ...,7,0
210468171952558080,2012-06-06 20:28:17,RT @DeloitteGov: Thanks to @Clyburn for meeting with Operation Next Generation students from North Charleston HS today! #CloseUpONG12,2,0
210445655041257473,2012-06-06 18:58:48,"As we observe the D-Day anniversary, take time to thank our veterans and those who serve today.  God bless America!",8,1
210381346915360768,2012-06-06 14:43:16,RT @kemet2000: @Clyburn Keep pushing the jobs bill Mr. Clyburn.There are too many good teachers being left out of the classroom.,7,0
210035571140198400,2012-06-05 15:49:17,Women deserve #EqualPay for equal work. Important #Senate vote today on #PaycheckFairness Act.,22,2
208632755205050370,2012-06-01 18:54:59,#FF @RepRichmond @RepKathyHochul @RepPerlmutter @repjoecrowley,1,0
208574464219283456,2012-06-01 15:03:22,"Congress must work together to pass the American Jobs Act to create jobs for construction workers, teachers, veterans, long-term unemployed",59,3
207925878624239616,2012-05-30 20:06:07,#EXIM bank supports jobs in SC and US economic growth and competitiveness. Glad to see #EXIM bank bill signed into law today by POTUS Obama,1,0
207859362457329664,2012-05-30 15:41:48,"Congrats to John Doar for winning the Presidential Medal of Freedom. Gutsy guy, hero of the civil rights movement http://t.co/woxSXZFy",6,1
206771398415355905,2012-05-27 15:38:37,Pledge your silence this Memorial Day at 12:01 pm with @IAVA. #GoSilent  ,13,1
203591738403725312,2012-05-18 21:03:47,#FF @HouseAdm_Dems @CAPAC @JCSUniversity @RepTerriSewell @RepJudyChu @DWSTweets @RushHolt,3,2
203574257916182529,2012-05-18 19:54:19,#FF @repbrady @TX20CharlieG @repcleaver @marciafudge @repjohnlewis @JacksonLeeTX18 @repjohnconyers @whiphoyer,2,1
203193760320991233,2012-05-17 18:42:22,"The Voter Empowerment Act: improving access, protecting integrity, and ensuring accountability. Read my statement here http://t.co/8wtQIjmA.",15,4
202847462560505856,2012-05-16 19:46:18,"Need to work on jobs, economy, opportunity for working ppl. Click here http://t.co/8wtQIjmA to watch my take on MSNBC",3,1
201042385143205889,2012-05-11 20:13:34,#FF @HouseDemocrats @RepJohnLarson @WhipHoyer @NancyPelosi,12,0
200991271240732672,2012-05-11 16:50:27,I rise in strong opposition to the Republican Reconciliation bill. Read my full statement here http://t.co/HfeD5ifp,6,0
200646642532229120,2012-05-10 18:01:02,@dwtcarrol Wealthiest 1% needs to pay their fair share so we can provide opportunity for everyone willing to work hard. #AskDems,7,0
200375964994240512,2012-05-10 00:05:27,RT @HouseDemocrats: Join House Dems tmw at 11:30 am EST for a Twitter Town Hall on student loan rates. Ask Qs w/ #AskDems. #DontDoubleMyRate,11,2
199997121036959744,2012-05-08 23:00:04,"I agree w Pres Obama. Congress needs to act on the ""To Do List"" to create jobs and help folks struggling to pay bills bc middleclass squeeze",19,1
199959845456191488,2012-05-08 20:31:56,"Happy Teacher Appreciation Week! Education is so important to success, Congress must act on student loans. #Dontdoublemyrates",14,0
199940950338965505,2012-05-08 19:16:51,"As the father of a classroom teacher, I know how hard they work and their tremendous impact. This week, #thankateacher",28,2
199925773950402560,2012-05-08 18:16:33,Happy Teacher Appreciation Week! Great teachers inspire and empower people of all ages. Don't forget to #thankateacher this week.,22,4
197690937533669376,2012-05-02 14:16:07,"Happy Birthday to my friend, @morningmika. One of the best in the business.",1,0
197416662167863296,2012-05-01 20:06:14,"God bless our troops, intelligence folks and Pres Obama for their courageous mission to take out bin Laden one year ago today. God bless USA",28,3
195963361693925376,2012-04-27 19:51:20,RT @alice5956: @Clyburn You did the right thing! Got 2 kids in college relying on loans; I want 2 be healthy &amp; alive to see them gra ...,3,0
195937088682725376,2012-04-27 18:06:56,"I voted NO today on eliminating health care prevention funding. Republicans shld stop playing politics, targeting women's health.",38,1
195927646444597248,2012-04-27 17:29:25,#FF @AshlyeV @winthropu,1,0
195571168751788032,2012-04-26 17:52:54,RT @DomenicoNBC: Battle for control of Congress tightens considerably http://t.co/KrqNE9Iu,2,0
194869112227373056,2012-04-24 19:23:11,"I agree w President Obama. Congress needs to act now to prevent skyrocketing college loan rates and crushing debt.
#DontDoubleMyRate",37,5
193442682541047809,2012-04-20 20:55:04,"Visit my website to watch my interview on Chuck Todd, http://t.co/g9mcLZCs",2,1
193379789460090882,2012-04-20 16:45:09,#ff @rolandsmartin @chucktodd,0,0
192736258441748481,2012-04-18 22:07:59,"Today is National Golf Day.  #iamgolf bc game teaches core values, is good exercise and enables me to spend time with my grandson.",8,1
192724858696769536,2012-04-18 21:22:41,"I agree with Catholic Bishops, Republican budget fails ""moral criteria"" by unfairly cutting services for ""poor and vulnerable people.""",35,0
192293341310889984,2012-04-17 16:47:59,"Today is #equalpayday. As the father of 3 adult daughters, I know how hard women work. All women deserve equal pay for equal work.",6,2
191991888088276992,2012-04-16 20:50:07,RT @KLB39: @Clyburn Thank you Sir for All you do for Our State and Our Country.. I am from Florence and I stand behind you not 100% but  ...,1,0
191946391021551617,2012-04-16 17:49:20,"Congrats to my friend Rep Ed Towns on his retirement. Your work, service and leadership have made a difference and will be missed.",2,0
190898636492767233,2012-04-13 20:25:56,#ff @chucktodd,1,0
186931432915079170,2012-04-02 21:41:41,Great to be back on @Morning_Joe today. Click here http://t.co/WgLGIvLg to watch the clip.,6,1
185492126094733312,2012-03-29 22:22:23,Click here http://t.co/kk3xfNeh to read my statement on House Republican Budget Resolution,12,2
185464816197042177,2012-03-29 20:33:52,"plsd to team up this am w Cong FCU, sponsors of Cherry Blossom Ten Mile Run for hospitalized children to help them afford treatment.",1,0
185016078861205504,2012-03-28 14:50:45,"Great to visit Monday night with @GUCollegeDems, @TeamBSA
& @NAACP at Georgetown Univ. I always enjoy time with bright young people.",7,0
184693118401130496,2012-03-27 17:27:25,Romney-backed Republican budget ends Medicare guarantee and unfairly hurts middle class to provide big new tax cuts to the wealthiest few.,12,1
184418400498491394,2012-03-26 23:15:47,"Happy Birthday to my good friend Nancy Pelosi, the once and future Speaker of the House.",70,9
184385129697902593,2012-03-26 21:03:35,SCOTUS should uphold #ACA bc every American deserves the right of affordable access to quality medical care,15,1
184368092061765632,2012-03-26 19:55:53,"Ryan budget would end Medicare guarantee, destroy jobs and give more tax cuts to the wealthiest few. I urge Congress to vote NO.",17,3
184363318398550017,2012-03-26 19:36:55,"US House will take up the Ryan budget this week. Fundamentally flawed w misplaced priorities, it must be defeated.",15,2
183253315646271488,2012-03-23 18:06:09,I want to extend my deepest sympathies to my good friend @TheRevAl on his mother's passing. My prayers are with you and your family.,3,1
182938082218217474,2012-03-22 21:13:32,"Great news!!  10,000 Twitter followers as of today.  Spread the word!",4,0
182540030923898880,2012-03-21 18:51:49,Ryan Budget ends Medicare guarantee.Click here http://t.co/XDOmG6rP to read my full statement.,9,1
182525282828304384,2012-03-21 17:53:13,"Only 14 more followers to reach 10,000.  Spread the word to all your tweeps!",12,0
178225101467156482,2012-03-09 21:05:50,I'll be on Washington Watch this week talking about jobs with @rolandsmartin. Don't forget to tune in this weekend.,19,4
178165951898976257,2012-03-09 17:10:47,#ff @NatUrbanLeague @UofSCnews,1,0
178153402155532289,2012-03-09 16:20:55,"Good news! 227,000 new jobs in Feb. 2 years of job growth. More work to do. Congress should pass the Obama Jobs bill. Now.",16,1
177162037204492289,2012-03-06 22:41:35,Congressman Donald Payne will be missed.  Click here http://t.co/7NTMHpe7 to read my full statement.,4,3
175670289668112384,2012-03-02 19:53:55,Congrats to my friend @RepNormDicks. Strong leader for our troops and Democratic priorities.,2,0
