id,created_at,text,retweets,favorites
600286928416731136,2015-05-18 13:08:51,Our children are our future. Join me in celebrating the 50th Anniversary of @HeadStartgov #HeadStart50 #EngageDems,141,75
596721990872014848,2015-05-08 17:03:03,"Sec. @PennyPritzker, @SteveBenjaminSC &amp; I w/ reporters discussing importance of trade &amp; exports to SC's businesses. http://t.co/98cLrQxXuz",12,4
595983020303192065,2015-05-06 16:06:39,"As a former school teacher, I know education is the most important ingredient in the lives of our youth. #NationalTeacherAppreciation Week",17,10
595963152531103745,2015-05-06 14:47:42,"During #NationalTeacherAppreciation Week, remember to #ThankATeacher. Education must never be sacrificed on the altar of austerity.",12,3
594182283688554498,2015-05-01 16:51:10,Difference b/t a moment &amp; a movement is sacrifice. Read about my new bill to honor a true hero of the movement: http://t.co/raIP1N8LLO.,10,5
593198258480128001,2015-04-28 23:41:00,I am pleased to see the Lowcountry of SC has been given the designation of Promise Zone by the Obama Administration http://t.co/joJT3RyOae,11,7
590946737734471680,2015-04-22 18:34:16,"Click here http://t.co/asRuSgSMgd to read my op-ed, ""A Half Century's Legacy at a Crossroads"" in @HuffingtonPost.",7,4
590263482383216640,2015-04-20 21:19:15,"Congrats to @postandcourier on #Pulitzer for #tilldeath, on the disgraceful reality of domestic violence in SC that must be fixed",18,20
588441797933793280,2015-04-15 20:40:32,National Golf Day @wearegolf #NGD15 http://t.co/fiu6zkjiwZ,7,3
588438467081809920,2015-04-15 20:27:17,"pleased to attend @wearegolf National Golf Day event in support of youth golfing and golf industry. For the record, I made the putt #NGD15",11,10
585905215024590849,2015-04-08 20:41:03,Thanks so much to @mitchellreports for having me on her show today.  Here’s the link: http://t.co/fFtxWVdR4d,9,5
582647937613844480,2015-03-30 20:57:48,"RT @CAPAction: As of today, Loretta Lynch has waited longer to be confirmed than the last seven AGs combined. #ConfirmLynch http://t.co/LrP…",169,0
582271548230258688,2015-03-29 20:02:09,Congratulations to @GamecockWBB and @dawnstaley on their win today. They are now onto the Final Four. #goodluck,8,8
581493123597148160,2015-03-27 16:28:58,Congrats to my good friend @SenatorReid on a great career fighting for working ppl. We will miss you in Congress; ur legacy will long endure,22,22
580110614858727424,2015-03-23 20:55:23,"On the #AffordableCareAct's 5th anniversary, we celebrate the law that made health care a right for all, not just a privilege for the few!",16,9
578656329360887808,2015-03-19 20:36:34,Proud to join @RepJohnLewis @WhipHoyer @RepJohnConyers @RepBrady as original cosponsors of the Voter Empowerment Act http://t.co/1VHYwNA5Gd,11,14
578268854775902208,2015-03-18 18:56:53,"RT @SpecialOlympics: Great to see our friend from South Carolina, Rep @Clyburn! Thanks for having Rachell &amp; the @sosouthcarolina team! http…",14,0
577623629283864576,2015-03-17 00:12:59,"RT @HHSGov: #ACAisWorking To date 16.4M uninsured people have gained health care coverage, a historic reduction in the uninsured. http://t.…",54,0
577577742830567424,2015-03-16 21:10:39,RT @SenatorDurbin: Why has the Senate waited so long to confirm such an excellent choice for our next AG? A vote to #ConfirmLynch is overdue,61,0
577467017072095233,2015-03-16 13:50:40,"John Rainey was a good friend, a compassionate human being, an ardent practitioner of the Golden Rule.",8,1
577149575992991745,2015-03-15 16:49:16,"Saddened to hear the news of John Rainey's passing. He was a good friend, a compassionate person &amp; an ardent practitioner of the Golden Rule",3,0
576415750933622784,2015-03-13 16:13:18,I enjoyed discussing educational issues with SC Superintendent @molly_spearman today. Our children are our future. http://t.co/94UmIwp3rJ,6,3
576123376395280386,2015-03-12 20:51:31,Loretta Lynch has waited too long to be our next AG. RT if you agree that Sen McConnell should schedule a vote to #ConfirmLynch.,109,24
576094539523473408,2015-03-12 18:56:56,Loretta Lynch is more than qualified to be our next AG. RT if you agree the GOP should end the games &amp; schedule a vote to #ConfirmLynch,112,32
575643873625645057,2015-03-11 13:06:09,"Inspired by #Selma50, we recommit to the fight for equality &amp; work to defeat barriers to the ballot box. @SpeakerBoehner, let's renew #VRA!",147,80
575474555717709824,2015-03-11 01:53:20,My op-ed on Reflections on Selma can be read in @HuffingtonPost . Read it here: http://t.co/Z9aJrCOiyT.,13,12
575320683305156608,2015-03-10 15:41:54,RT @repjohnlewis: We commemorated the 50th annv of Bloody Sunday. Now it's our responsibility to fix SCOTUS decision that put a dagger in t…,566,0
575022710306267136,2015-03-09 19:57:52,Congress must restore the VRA and tear down unnecessary barriers to the ballot box.,22,16
574978667652251649,2015-03-09 17:02:51,Proud to stand on the right side of history for unfettered access &amp; greater participation in our democracy. #VotingRights,8,11
574962626914050049,2015-03-09 15:59:07,"50 yrs after Selma, the struggle b/t those that want to limit access to the ballot box &amp; those that want to expand it continues.",13,10
574631681518235648,2015-03-08 18:04:03,I was honored to be on the Edmund Pettus Bridge yesterday during the #Selma50 anniversary - here w/ @repbenraylujan. http://t.co/kGsaFxEe4V,18,25
574314194142523392,2015-03-07 21:02:28,"RT @NancyPelosi: Truly honored to join civil rights leaders &amp; colleagues, including my friend @Clyburn for such a special day #Selma50 http…",306,0
574314055688527872,2015-03-07 21:01:55,"In Selma for #Selma50 &amp; the dghter of Viola Liuzzo was asked why her mom came to Selma in '65. She said,""why didn't everyone come to Selma?""",88,60
573952872024555520,2015-03-06 21:06:42,Thank you to President @BarackObama for visiting the @CityofColumbia and Benedict College. What a great visit. http://t.co/E1mD8Cy064,84,50
573928688435216385,2015-03-06 19:30:37,"Thank you to everyone at Benedict College for welcoming the President to Columbia, S.C. http://t.co/N6810063og",16,13
573890781456412672,2015-03-06 16:59:59,"I'm glad so many people came out the greet President Barack Obama as he visits Columbia, SC! http://t.co/bDKzRLzi8O",27,17
572892985043656705,2015-03-03 22:55:06,"Glad we've passed clean @DHSgov funding; now, Republican Leaders need to quit playing Tea Party politics with repeated manufactured crises.",36,21
572888662104522752,2015-03-03 22:37:55,"If the reported quote by Sen. Graham about Leader Pelosi is accurate, he owes her an apology.",85,42
572127302999400449,2015-03-01 20:12:33,I'm pleased to welcome President @BarackObama back to SC on Friday. Read more @thestate: http://t.co/JgwT0KCeuI,52,38
571761551037710338,2015-02-28 19:59:11,Thank you to @ASALH for honoring me with the Living Legacy Award. I also enjoyed seeing my friend Louis Sullivan. http://t.co/GO91AwvbzM,10,1
571425465388261377,2015-02-27 21:43:42,I'm deeply honored to receive ASALH's Living Legacy Award tomorrow: http://t.co/GnAPGlQgMY,8,6
571345819984535552,2015-02-27 16:27:13,TY #AABEPolicySummit for having me to discuss energy equity. We must achieve policies that enable targeted funding to communities in need.,6,3
571008161487790081,2015-02-26 18:05:29,Proud of my 91% score on @LCVoters 2014 Nat'l Environmental Scorecard! Check out all of the votes: http://t.co/7D8RA3rxOp #LCVscore,5,2
570981894008868864,2015-02-26 16:21:06,"Instead of threatening to jail DC's mayor over an issue DC voters support, the @HouseGOP should be focused on avoiding a DHS shutdown.",57,31
570967375714975746,2015-02-26 15:23:25,"Thank you to my Spring Semester interns, James Gates, @francismarionu and Rebecca Wall, from @UQ_News. http://t.co/yBNkmKpXhw",4,7
570944456188239873,2015-02-26 13:52:20,RT @RepJoeKennedy: .@HouseGOP shutdown of @DHSgov would have real impact on MA &amp; jeopardize the federal $ we need for snow recovery. http:/…,145,0
570708717072560129,2015-02-25 22:15:36,"Over 1,500 DHS employees in South Carolina will be affected by the harmful Republican DHS shutdown. #DontShutDownOurSecurity",10,6
570679157350383616,2015-02-25 20:18:08,"""...we conclude that these criminal convictions cannot stand."" All 187 of us cleared Feb.1963, landmark Edwards v. South Carolina case (3/3)",4,5
570678984914182146,2015-02-25 20:17:27,"""The 14th Amendment does not permit a State to make criminal the peaceful expression of unpopular views,"" SCOTUS Justice Stewart. (2/3)",7,7
570678878483718144,2015-02-25 20:17:01,"""It has long been established that these 1st Amendment freedoms are protected by the 14th Amendment from invasion by the States."" (1/3)",2,3
570288921353056256,2015-02-24 18:27:28,I was glad to attend today's White House Champions of Change event for Historically Black Colleges and Universities. #HBCUchamps,15,13
570256945996701696,2015-02-24 16:20:25,I’m pleased to see this long overdue EAC meeting taking place today. Bipartisan action needed to update voting standards. #votingrights,2,2
569988825268686848,2015-02-23 22:35:00,"TY to Ms. Suber &amp; Antione Jackson for having me as your keynote speaker at the Hat, Bowtie &amp; Tea Luncheon this wkend. http://t.co/UpEvSLb02o",9,10
569870650304696320,2015-02-23 14:45:25,Congrats to @johnlegend &amp; @common on their Oscar win. Thank you 4 bringing so many important issues to the forefront. http://t.co/bX8AA2swxi,8,11
568509446504255488,2015-02-19 20:36:29,I enjoyed sitting down with @JudiGatson from @wis10 today to discuss South Carolina State University. http://t.co/eXyUd9kxLj,11,10
568440531065430019,2015-02-19 16:02:38,"RETWEET ---&gt; Over 200,000 people in SC signed up for health care w/ the Affordable Care Act.    #11MillionAndCounting http://t.co/Q79yES2To4",12,4
568125113763307521,2015-02-18 19:09:17,Thank you to @VP Joe Biden and @SecretaryFoxx for visiting SC to discuss the very important topic of infrastructure. http://t.co/rw1kA7ZtNr,15,14
568090552920616960,2015-02-18 16:51:57,RT @RepLujanGrisham: .@HouseGOP should drop their anti-immigrant efforts &amp; join with Dems to fund @DHSgov. #DontShutDownOurSecurity http://…,82,0
567716593527169024,2015-02-17 16:05:58,Enjoyed speaking with @SCETV about my 10-20-30 plan &amp; many other topics. Watch @PalmettoScene at 7:30pm on Thursday. http://t.co/YyCRvJ3lBR,15,8
566722771774738433,2015-02-14 22:16:52,"Maj. Gen. Becker's leadership at Fort Jackson will be missed when he is reassigned this May. 
http://t.co/SKWTKkxxN3 http://t.co/jphuwPBeG4",7,2
566322510242004992,2015-02-13 19:46:22,2 days left! February 15th is the deadline to #GetCovered. Enroll now → http://t.co/5ipy3hNFl8 http://t.co/o3RelJh73s,11,3
566276117754302464,2015-02-13 16:42:02,"It was great to meet with Mayor Muriel Bowser, the Mayor of the District of Columbia.  Thank you for your service. http://t.co/igDatBE3dS",5,3
565176943105310720,2015-02-10 15:54:18,My op-ed on persistent poverty and my 10-20-30 plan can be read in @thestate and the @postandcourier. Read it here: http://t.co/euyiUKxycq,18,8
564795593865064448,2015-02-09 14:38:57,Joining @RepJohnLarson &amp; @RepJoeCourtney @UConn today to discuss college affordability. I'll also be cheering on @GamecockWBB &amp; @dawnstaley.,9,19
564794549906976769,2015-02-09 14:34:48,"MT @RepJohnLarson: Today at 5PM, @Clyburn @RepJoeCourtney &amp; I will hear from @UConn students on college affordability http://t.co/vCjQZ1z33E",4,1
564210351147720707,2015-02-07 23:53:24,I had such a wonderful time visiting with Ms. Elise Jones Martin on her 100th birthday! http://t.co/TZeIvGskky,17,15
564062263753990144,2015-02-07 14:04:58,RT @SenatorCardin: Good celebrating #BlackHistoryMonth this morning with @Clyburn http://t.co/VfrscNsdF1,14,9
563818555729543168,2015-02-06 21:56:33,RT @MClyburnFCC: @Clyburn congratulates @CharlayneHG at #wpcfdinner. #BrendaStarr and Mother key to her Lifetime of Achievement. http://t.c…,7,0
563763289411563520,2015-02-06 18:16:57,Welcome news on the jobs report. Congress needs to focus on economic policies that create and sustain opportunities for all Americans.,7,3
563410383541895169,2015-02-05 18:54:37,Keeping everyone at @UofSC in my thoughts and prayers.  If you’re near campus stay inside until the situation is under control.,58,30
563092229028585473,2015-02-04 21:50:23,"I was honored to remark on the passing of one of my hero's, golfer, Charlie Sifford, on the floor of the House today. http://t.co/jlgeMlnJF0",7,3
563037873180774402,2015-02-04 18:14:24,"An area we need to pay attention to is persistent poverty. This week, I discussed my 10-20-30 plan on the House Floor http://t.co/MWDLKMGOHI",8,8
562998969337651201,2015-02-04 15:39:48,"RIP Charlie Sifford, a great man and trailblazing pioneer for a great game; the Jackie Robinson of golf. http://t.co/xkhW8SZ7lh",9,3
562735603813724160,2015-02-03 22:13:17,RT @HouseDemocrats: House GOP voted 56 times to undermine the Affordable Care Act &amp; force millions of Americans to lose their healthcare. h…,151,0
562669589113217024,2015-02-03 17:50:58,"Today, stories of Americans from across the country show us the Affordable Care Act is working. #PeopleOverPolitics http://t.co/wHXUyBTNoI",6,8
562627377377710080,2015-02-03 15:03:14,"In SC, 161,941 ppl signed up for insurance through the Marketplace but the GOP is pushing another bill to repeal ACA  #peopleoverpolitics",7,6
562620489235828736,2015-02-03 14:35:52,Thrilled that @HHSGov is making an investment in @SCFirstSteps.  Investing in early childhood edu is so important. http://t.co/YJJMeqLCFS,6,6
562618124130717697,2015-02-03 14:26:28,RT @HouseDemocrats: .@HouseGOP will vote for 56th time to repeal/undermine health care for Americans today. Time for #PeopleOverPolitics! h…,189,0
562335488544358400,2015-02-02 19:43:22,"It’s another week in the new Republican Congress, which means another stale attempt to repeal the Affordable Care Act. #PeopleNotPolitics",9,9
561223147362717697,2015-01-30 18:03:20,Final presser of the @housedemocrats 2015 Issues Conf. We must grow our middle class for the future of this country. http://t.co/6NNM96OZzT,10,3
561219379011280897,2015-01-30 17:48:21,"RT @AU4Change: .@Clyburn: Middle class economy is so critical for the future growth &amp; development of this great country, we need to get mor…",3,0
560978389264506880,2015-01-30 01:50:45,Emily and I enjoyed seeing President @BarackObama at the @HouseDemocrats 2015 Issues Conference. #HouseDemsInPhilly http://t.co/7XsoFdQwok,19,19
560908881535041536,2015-01-29 21:14:33,Im excited to announce that I’ll be attending the 50th Anni of the Selma march in AL. It’s time to #embracethefuture while honoring our past,3,7
560884493070778368,2015-01-29 19:37:38,"I am happy to announce the outstanding investment HUD is making in SC to help find a solution to end homelessness.
http://t.co/K18Vw2acWx",9,3
560792173914750976,2015-01-29 13:30:47,.@HouseDemocrats are using this 2015 Issues Conference to discuss ways to grow America's economy &amp; American paychecks! #HouseDemsInPhilly,64,33
560601635152355330,2015-01-29 00:53:39,Discussing the Democratic economic agenda in Philly during the @HouseDemocrats Issues Conference. #HouseDemsInPhilly http://t.co/F0NEg3aJcZ,10,5
560563503438630913,2015-01-28 22:22:08,Great to see my friend DeDe Lea at last night's screening of Selma. We must honor our history and #embracethefuture http://t.co/ZU4gQB6hqk,4,4
560165095041671168,2015-01-27 19:59:00,"Enjoyed serving on the UNION Congressional Orientation on Faith &amp; Governing ""Faith &amp; Values Matter in Congress"" panel http://t.co/FfYU9aankE",4,4
560131158852505600,2015-01-27 17:44:09,Today we remember the victims and survivors of the Holocaust.  The liberation of Auschwitz was 70 years ago today.  #neverforget,29,12
558694361488429058,2015-01-23 18:34:50,#FF @RepCartwright @RepJeffries @replujangrisham @RepGraceMeng @RepBrendanBoyle #DemOutreachEngagementTaskForce (2/2),6,2
558694317955747840,2015-01-23 18:34:40,#FF @NancyPelosi @RepRoybalAllard @NydiaVelazquez @RepBarbaraLee @RepAndreCarson @RepRichmond #DemOutreachEngagementTaskForce (1/2),1,4
558335714690355200,2015-01-22 18:49:42,"As a husband, father to 3 girls &amp; grandfather, I strongly support women’s rights and reproductive freedom. #tbt http://t.co/GYCs5WmvZ5",83,54
558306188786692097,2015-01-22 16:52:22,"MT @rollcall: @Clyburn,on the powerful moment in 'Selma' when his granddaughter put down the phone to watch the film. http://t.co/FVmk181b0w",3,1
558302376055275520,2015-01-22 16:37:13,"RT @rollcall: Rep. @Clyburn , on the powerful moment in 'Selma' when his young granddaughter put down the phone to watch the film. http://t…",9,0
558301976661065728,2015-01-22 16:35:38,"RT @rollcall: Clyburn Offers Personal Perspective on the Relevance, Power of ‘Selma’ http://t.co/fVEfsKr1Ox via @DavidEldridge",3,0
558013137496981505,2015-01-21 21:27:54,You can read our release here: http://t.co/fA40shpFz0,7,1
558013073517064193,2015-01-21 21:27:38,I was thrilled to announce the members of the @HouseDemocrats Outreach &amp; Engagement Task Force today w/ @NancyPelosi http://t.co/UrsljAlJaz,6,5
557962188271681537,2015-01-21 18:05:26,"RT @HouseRadioTV: STARTING NOW News Conference: @NancyPelosi, @Clyburn et al on new Outreach &amp; Engagement #TaskForce. Location: HVC Studio …",4,0
557933150492700673,2015-01-21 16:10:03,TY @newsnation for having me on today. I believe last nights #SOTU solidified our base &amp; it's time to find common ground so we can legislate,8,3
557916624142221313,2015-01-21 15:04:23,The strength of our society &amp; the success of our economy depend on a strong middle class. Inspired by last night's #SOTU!,6,6
557737533480910848,2015-01-21 03:12:44,I look forward to helping working families in the 6th Congressional District during the 114th Congress. #SOTU,8,15
557729807690383360,2015-01-21 02:42:02,It’s time to close loopholes that help the wealthiest few and big corporations.  We need to embrace working men and women. #SOTU,575,703
557727561439264768,2015-01-21 02:33:07,Instead of fighting to cut education funding we should be finding ways to make it more affordable.  Congress should work for all people.,21,10
557727328219176962,2015-01-21 02:32:11,I applaud the #FreeCommunityCollege plan for students willing to work hard for good jobs at good wages. #SOTU,31,23
557726704337448961,2015-01-21 02:29:43,The people of the 6th Congressional District would benefit tremendously w/ a rise in the minimum wage. It’s time to pay our workers fairly.,8,7
557726566307102720,2015-01-21 02:29:10,Equal pay for equal work is a no brainer.  I appreciate the President’s push for this and hope Congress will act soon. #SOTU,19,14
557726467594137601,2015-01-21 02:28:46,There are 43 million private-sector workers w/o paid sick leave. Working families deserve the time they need to recover from illnesses.#SOTU,19,10
557726285544574976,2015-01-21 02:28:03,"Sick leave for working families is not only good for families, but also good for our economy. #SOTU",17,8
557725810694819842,2015-01-21 02:26:09,"I agree w/ the President, we need to lower taxes for working families so we can grow the middle class.",19,7
557725598412709888,2015-01-21 02:25:19,"GOP wants a tax plan to help the wealthy.  We must make sure working families, the backbone of our economy, are treated fairly.",25,8
557722897478057985,2015-01-21 02:14:35,Our economy is creating jobs at the fastest pace since 1999 - unemployment rate is lower than it was before the financial crisis. #SOTU,12,9
557720064112463872,2015-01-21 02:03:19,"I'm pleased to welcome my guest for the #SOTU tonight, Cornell William Brooks, the President and CEO of the NAACP.",16,15
557561132177960962,2015-01-20 15:31:47,RT @repjoecrowley: Our President has been a champ for the middle class &amp; has expanded access to the American Dream. Looking fwd to hearing …,126,0
557216174413344768,2015-01-19 16:41:03,"This #MLKDay, we must acknowledge &amp; address the many challenges we still face in our long march toward a more perfect Union.",25,13
556967756927471616,2015-01-19 00:13:55,"Congrats to my former student, Ambassador James Gadsden, for receiving the Harvey Gantt Triumph Award. #MLKWeekend http://t.co/gi4utQCfn3",11,7
556957043223822336,2015-01-18 23:31:21,"Honored to attend Charleston's YWCA MLK Services today to present the Harvey Gantt Triumph Award to my former student, Amb. James Gadsden",5,5
556642459493482496,2015-01-18 02:41:18,I’ve enjoyed my time in Missouri - this weekend is a perfect time to discuss current     inequalities and helping our country move forward.,25,14
556194094708699137,2015-01-16 20:59:40,Thrilled to announce the enormous investment that the HBCUs in SC will be receiving in cybersecurity education. http://t.co/QQZUHiaDHb,9,2
556156033182470144,2015-01-16 18:28:25,"I am looking forward to visiting Ferguson, Missouri tomorrow with some of my colleagues to celebrate Martin Luther King, Jr. Day.",3,2
556134269358448641,2015-01-16 17:01:56,"There are 43 million workers across the country &amp; 626,085 workers in SC alone who currently have no paid sick leave. It’s time for a change.",4,0
555846556604444673,2015-01-15 21:58:40,Congratulations to my friend and colleague @RepAndreCarson on his historic appointment to House Intelligence Committee.,8,6
555729937706266624,2015-01-15 14:15:16,"Today would have been Dr. Martin Luther King's 86th bday. He inspired so many, myself included, &amp; took an active part in shaping our country",25,16
555468927028183040,2015-01-14 20:58:06,Reminder to @RepGoodlatte re: VRA: 1 oz of prevention &gt; 1 lb of cure.  Sec 4 &amp; 5 are preventative measures.  We must #restorevotingrights,5,1
555459523990003713,2015-01-14 20:20:45,"I included the SC's Poet Laureate poem ""One River, One Boat"" into the Congressional Record today: https://t.co/sjZ7fEFLnQ",13,10
555114736594219008,2015-01-13 21:30:41,I introduced H.R. 295 today which would reauthorize the HBCU Historic Preservation Program. http://t.co/7vizbRYVNU,13,9
554769565557997568,2015-01-12 22:39:06,RT @HomelandDems: .@HouseGOP must end political gamesmanship over homeland security funding. Their tactics send a dangerous message @ the w…,139,0
554287363229106177,2015-01-11 14:43:00,My interview on OnPoint with Cynthia Hardy is airing now on @wachfox. Make sure to tune in to hear our discussion on the 114th Congress.,4,2
553638757682147328,2015-01-09 19:45:40,I applaud the President's plans for #FreeCommunityCollege for students willing to work hard and for good jobs at good wages.,21,17
553612128519979009,2015-01-09 17:59:51,Welcome news on today's jobs report. Congress needs to focus on bigger paychecks for working people.,11,8
553267180750786562,2015-01-08 19:09:09,#tbt from SNWR reminds me of my time as a public school teacher &amp; my desire for Congress to fix the flaws of NCLB. http://t.co/6JPul8toRW,2,5
552576317901004800,2015-01-06 21:23:55,"Just finished my floor speech on how Dems in the 114th Congress will be supporting hardworking American families.  
https://t.co/E2kZkXVm3z",10,10
552568256780058625,2015-01-06 20:51:53,I'm heading to the floor of Congress to discuss the House Republican Rules Package.,5,3
552510713399611392,2015-01-06 17:03:13,"My greetings from @OfficialCBC swearing-in ceremony. I am proud to serve w/ so many friends including @GKButterfield
https://t.co/4PETRGSdn4",3,0
552498164658606081,2015-01-06 16:13:22,I'll be joining @craigmelvin on @newsnation shortly to discuss the 114th Congress.  Make sure to tune in to @msnbc.,5,3
552194131372830720,2015-01-05 20:05:14,My interview w/ @radiotalk will air Sunday morning on @wachfox. We discussed topics from immigration to healthcare. http://t.co/5NPbbTQUfQ,7,3
550352819987836928,2014-12-31 18:08:32,"Looking back on 2014, I thank all of my family, friends, colleagues and constituents for their support throughout the year. Here’s to 2015.",6,8
549932517004808192,2014-12-30 14:18:23,My New Year’s resolution is to continue working hard for SC and put my 10-20-30 plan in the Federal budget.  What is yours?,5,3
548999588980740097,2014-12-28 00:31:16,"Celebrating the holidays with my granddaughter Sydney Reed, a senior at Richland Northeast High School. http://t.co/2ytOm3aDiT",7,16
548582424830283776,2014-12-26 20:53:36,"Today begins the celebration of Kwanzaa, a week-long holiday honoring African culture &amp; traditions. Best wishes to those celebrating today.",23,13
548141259060043776,2014-12-25 15:40:34,Merry Christmas to those who are celebrating today.  It is a wonderful time of year and I wish you all a blessed holiday season.,8,11
547118827855552512,2014-12-22 19:57:48,"Emily and I enjoyed having fried chicken, gumbo and tater cornbread at Dye's Gullah Fixins on Hilton Head. http://t.co/bTU9AJ1e3y",1,6
547050939140833280,2014-12-22 15:28:02,I look forward to seeing the @SelmaMovie about the Alabama city in 1965.  It comes out on Christmas Day. cc: @repjohnlewis,8,7
545987219912396800,2014-12-19 17:01:11,I’d like to congratulate South Carolina’s own @StephenatHome on his final show. He’ll do great on the Late Show &amp; continue to make SC proud.,18,10
545953702558072832,2014-12-19 14:48:00,RT @BradSherman: FACT: 2014 has seen the largest health coverage gains in four decades → http://t.co/K3qsKEQmaW #ACAWorks #GetCovered http:…,187,0
545695909280235520,2014-12-18 21:43:37,An estimated 10 million Americans gained health coverage in 2014 → http://t.co/smSPTmwG1H #ACAWorks #Progress http://t.co/YE5kgTffcO,7,6
545592693343412224,2014-12-18 14:53:29,"#tbt to 1960 at @SCSTATE1896 w/ my wonderful wife, Emily. I look forward to this holiday season w/ her and our family http://t.co/j72ow2feKW",28,47
