id,created_at,text,retweets,favorites
601145460582195200,2015-05-20 22:00:21,RT @TommyForHealth: @CongressmanDan Thank you for sponsoring the Treat and Reduce Obesity Act!,1,0
601145263093325824,2015-05-20 21:59:34,"RT @RepSinema: Introduced a bill w/@CongressmanDan requiring VA to act on warnings about its failures, ending bonuses for bad mgmt.  http:/…",4,0
601141642322644993,2015-05-20 21:45:10,"Last night, I tuned in to #TheVoiceFinale to watch @joshuadavis77 from #TraverseCity perform.  Well done, Josh! http://t.co/pKkuZBhd5y",1,1
601075388274626560,2015-05-20 17:21:54,"Today, I will introduce the Demanding Accountability for Vets Act. When vets don't recieve care, there must be consequences! #veterans",1,0
598912481826873344,2015-05-14 18:07:17,RT @deichinger1: Michigan sportsmen have a great friend in @CongressmanDan. Great meeting today on wolves and public access with @NWFGreatL…,1,0
598873067608211456,2015-05-14 15:30:40,"Yesterday, I met with @MIPOAM during #NationalPoliceWeek.  If you see a cop this week, say thanks! http://t.co/9ySJpvfK9K",1,1
598563981540876288,2015-05-13 19:02:28,COOL standards will have a huge impact on MI.  Read my op-ed: http://t.co/hnLWj0G9bv http://t.co/oWhH7clPGn,9,4
596676229480189952,2015-05-08 14:01:13,".@joshuadavis77 is making #TraverseCity and Northern Michigan proud with his performance on #TheVoice.  Congratulations, Joshua!",2,6
596354237434585088,2015-05-07 16:41:44,"Today is the Vets Assistance Fair in #SaultSteMarie! If you are a vet who needs help w benefits, come by the National Guard Armory before 2!",2,0
595966710735331328,2015-05-06 15:01:51,This week I visited the @USGS Hammond Bay Biological Station.  They are doing great work to fight #InvasiveSpecies! http://t.co/4F7szUzZ6v,4,2
595336613753946113,2015-05-04 21:18:04,"It's #SmallBusinessWeek across the country. If you own or work at a small business in #MI01, send a photo to MI01photos@mail.house.gov!",3,1
593525052550750208,2015-04-29 21:19:34,RT @mihumanities: #POL15 @CongressmanDan Michigan State Champion Coral Brantly with Congressman Dan Benishek this morning in DC. http://t.c…,4,0
593506672867311616,2015-04-29 20:06:32,RT @DoubleRVideo: Thx @CongressmanDan for participating in NAB's Congressional PSAs on Supporting Our Troops https://t.co/PqrdI1wdc3 … @Bro…,1,0
593432923216420864,2015-04-29 15:13:29,RT @ama_rights: .@CongressmanDan AMA Champion #AMARights http://t.co/MVK5IxFMPO,3,0
590945013334441985,2015-04-22 18:27:25,RT @HouseAgNews: #HBD to #HouseAg member @CongressmanDan! Glad to have him on the Cmte. MI-01 has over 1.1 mil acres in #farm land http://t…,6,0
590938210240454656,2015-04-22 18:00:23,"If you see a veteran, be sure to say thank you! It was great to see U.P. Vets from the Honor Flight today! http://t.co/JQnUf5EOJ2",1,2
588348215373758465,2015-04-15 14:28:40,"This morning I met with Patrick Parker, the Chief of the Grand Traverse Metro Fire Department! http://t.co/PlmPjTQjxe",2,3
588336378859167744,2015-04-15 13:41:38,RT @nannburke: .@CongressmanDan backs bill to research toxics’ exposure for children of veterans: http://t.co/nCq5YUJMKJ @detroitnews,2,0
587627737424224256,2015-04-13 14:45:44,RT @yoopphoria: Even Congressmen Benishek loves our yogurt! @CongressmanDan #froyo #loveyoop http://t.co/W3tmgmqkeC,2,0
581117897428361216,2015-03-26 15:37:58,"It was great to meet with Scott Newman-Bale, the President of Business Development @ShortsBrewing in Elk Rapids! http://t.co/VDNae1tsOo",4,0
581116748302323713,2015-03-26 15:33:24,Protect grandma. Save Medicare. http://t.co/poHxxCR6cA,3,2
578909027704414209,2015-03-20 13:20:42,RT @lauradianeappel: .@PennockHealth CEO Sheryl Lewis Blake with @CongressmanDan. Thanks for a thoughtful meeting. #stophospitalcuts http:/…,4,0
578908953943388160,2015-03-20 13:20:24,RT @michpca: Thank you @CongressmanDan for supporting Health Centers by signing Bilirakis-Green #fqhc letter #AccessIsTheAnswer #FixTheCliff,1,0
572771870191316992,2015-03-03 14:53:50,"RT @CareAdvocacy: .@CongressmanDan visiting Christian Park Village in Escanaba, MI http://t.co/gloNFEArzZ",5,0
572416095828779008,2015-03-02 15:20:06,#AsianCarp would be devastating to the Great Lakes.  We must act now to prevent their spread http://t.co/bKGdFVzpSU.,6,3
570615415346503681,2015-02-25 16:04:51,H.R. 529 will allow computers to be included as a covered education expense. http://t.co/bKull6tHaH,3,0
568157300701200384,2015-02-18 21:17:10,RT @EmilyRissman: Great turn out for @CongressmanDan #Veterans Assistance Fair in Cheboygan. @MIVeteran http://t.co/5mvFQWUVPZ,5,0
568072488103616513,2015-02-18 15:40:10,RT @GaylordMichigan: @CongressmanDan  stopped by for a visit today!  #GaylordMichigan http://t.co/09FvcovneE,3,0
565159228789510144,2015-02-10 14:43:54,RT @ASAGrassroots: Thank you @CongressmanDan for meeting with members of ASA this week. #FollowFriday #FF http://t.co/U2R8NIXZ0w,5,0
563100767666851840,2015-02-04 22:24:19,RT @MichFarmBureau: New Michigan #FarmBureau President Carl Bednarski gets acquainted w/ @CongressmanDan Benishek in DC &amp; talks farming htt…,4,0
563065901814407168,2015-02-04 20:05:46,"The last time we updated our #EmailPrivacy Laws, I looked like this! #ECPA http://t.co/z6l3t0e0mJ",6,5
562637932365086720,2015-02-03 15:45:11,RT @AllisonScottTV: Congressional Snowmobile Ride with @RepHuizenga &amp; @CongressmanDan stop at Benzie Manistee Snowbirds @upnorthlive http:/…,10,0
562637867382743040,2015-02-03 15:44:55,RT @MichFarmBureau: Congrats @CongressmanDan &amp; @RepMoolenaar on assignments to many agriculture subcommittees. Good for MI farming! http://…,2,0
560836287587184640,2015-01-29 16:26:05,Small businesses like the Country Dairy Farm Store are the foundation of our economy.#TheRide2015 @RepHuizenga http://t.co/5TPvE3CJGp,4,2
560830099717906432,2015-01-29 16:01:30,Stopped by a VFW post to hear what vets have to say about how to improve services to our nation's heroes.#TheRide2015 http://t.co/vmV4WwG7AN,1,1
560826957269856256,2015-01-29 15:49:00,Just called to congratulate Gunnar Carlson on his appointment to West Point Military Academy. Back to #TheRide2015! http://t.co/FPORtoWciB,1,4
560818715764461568,2015-01-29 15:16:16,#Veterans issues are a priority for me. @RepHuizenga and I are meeting with vets to discuss their issues #TheRide2015 http://t.co/REQy7hNJv0,1,2
560508744078217216,2015-01-28 18:44:32,RT @rollcall: Michigan's @CongressmanDan &amp; @RepHuizenga are off on their 2nd annual congressional snowmobile trek: http://t.co/z9pKTv0oC4 @…,6,0
560449886366494720,2015-01-28 14:50:40,RT @HouseGOP: RT if you agree it's time to #EndTrafficking. http://t.co/7UWvy3GIbV,84,0
557990652412444672,2015-01-21 19:58:33,"Today in the House, we'll look at a bill that will lower energy prices across the country. #AmericasNewCongress http://t.co/S3w2mE0eOM",5,3
557645805134565376,2015-01-20 21:08:15,"Tune in to the #SOTU tonight, and stay tuned for the Republicans Address by @joniernst.",4,1
557635145487093760,2015-01-20 20:25:53,"Tonight, we'll hear from the President – and hopefully he wants to work with us to find solutions.",3,2
555376280133464064,2015-01-14 14:49:58,RT @healthylakes: Thanks @CongressmanDan for cosponsoring the #GLRI Act of 2015! The Act supports the #GLRI @$300M/yr for 5 yrs http://t.co…,7,0
553615816235950080,2015-01-09 18:14:30,The Great Lakes are vital to our way of life in Northern Michigan. http://t.co/NQSaVlEOZm,4,2
553576581760028672,2015-01-09 15:38:36,"RT @WCMUMike: My conversation w/ @CongressmanDan RT @WCMUNews: Benishek discusses new congress, priorities for next 2 years http://t.co/2WN…",1,0
553315976838914048,2015-01-08 22:23:03,"In Northern Michigan, we know that 40 hours a week is full time work. http://t.co/9pizVdNwXE",1,0
553276301822685185,2015-01-08 19:45:24,RT @thehill: Obama motorcade drives by scandal-plagued VA hospital in Phoenix: http://t.co/yX4nthB1QF,11,0
553199099466768384,2015-01-08 14:38:37,Full time = 40 hours. http://t.co/ywyzm2uYWe,3,3
552919581531336704,2015-01-07 20:07:55,"RT @WCMUMike: Checking in with #Mich. US Reps this week. We'll hear from @RepDanKildee Thurs. on Morning Ed &amp; ATC, and @CongressmanDan on F…",3,0
552889689494282240,2015-01-07 18:09:08,New Congress is in session - and ready to work: http://t.co/G9juiWKi3D,0,0
552884674939609089,2015-01-07 17:49:13,"Veterans have put their lives on the line. In return, we should ensure that they have the opportunity for employment when they return home.",0,2
552862434336444416,2015-01-07 16:20:50,The Hire More Heroes Act is only the beginning of #AmericasNewCongress: http://t.co/Ig0UebOWj7,1,1
552854091706425345,2015-01-07 15:47:41,"I'm proud to co-sponsor this bill in the 114th Congress, and I'm glad to see that this is one of our first priorities http://t.co/zSb2zK4lxQ",2,0
552599288359186433,2015-01-06 22:55:11,RT @BeccahAT2015: Kid bro got his passport today. Big thanks to @CongressmanDan for help getting this worked out. #Japan here we come! http…,3,0
552595907951493120,2015-01-06 22:41:45,"Now we continue the work of improving our economy,  fixing healthcare and ensuring that vets receive the care they've earned. #114thCongress",1,3
552591623511896064,2015-01-06 22:24:44,I was honored and humbled to be sworn in to the #114thCongress today.,0,3
544611082342780928,2014-12-15 21:52:55,Our open house in Alpena today was a great success! Thank you to all who were able to stop by! http://t.co/QV6I6BYZfx,1,1
543483217047994368,2014-12-12 19:11:11,This is great news for Mrs. Kinnunen's family! http://t.co/9AVpmS3p3K,3,0
543152883353800704,2014-12-11 21:18:33,For Christmas we want lower energy costs. That's not so much to ask: http://t.co/ySItMqfjdY,0,0
543127973650780160,2014-12-11 19:39:34,Check out this article on the GLRI bill! http://t.co/Gzyb7LXEUT,0,1
543127900808290304,2014-12-11 19:39:17,The Great Lakes are a critical part of life and the economy up here in MI and we need to continue to preserve them for future generations!,0,1
543127757954506752,2014-12-11 19:38:42,"This week we were able to pass H.R.5764, the Great Lakes Restoration Initiative (GLRI) Act of 2014.",0,1
542691954832986113,2014-12-10 14:46:59,December is a chance for us to remember the amazing work our country has produced: http://t.co/skdh299zGZ,1,1
542362976192565248,2014-12-09 16:59:44,Are you looking for a job in Northern Michigan? Head to http://t.co/0hoVUKY9gZ to search through current job openings! #jobs,1,1
542346977447788544,2014-12-09 15:56:10,We need to educate our young people about all the opportunities that are out there for them to secure good paying jobs right here!,1,0
542346853703233538,2014-12-09 15:55:40,Increasing vocational education in Northern Michigan has been one of my top priorities while in Congress. http://t.co/zuUmPgrLe1,2,0
542048475224223744,2014-12-08 20:10:01,What other spots in Northern Michigan do you think should be on this list?,0,0
542048444861665280,2014-12-08 20:09:54,"Traverse City made Huffington Post's ""10 American Spots You Don't Know About Yet, But Should"" list! http://t.co/dP0cnnn1O4",0,0
541972930071388160,2014-12-08 15:09:50,We're making our list and checking it twice. First up? Keystone: http://t.co/37BxcxJhEg,1,1
540944264969326593,2014-12-05 19:02:17,"Marquette had their annual Holiday parade and tree lightning ceremony this week! 
http://t.co/9hz2pe5DQF",0,0
540936828732583936,2014-12-05 18:32:44,Another Senate Dem is regretting #Obamacare: http://t.co/5d1Pu2CO9O,0,0
540626617782239232,2014-12-04 22:00:04,#ICYMI A record-number of millennials are still living with mom &amp; dad. http://t.co/Mp9S2SujFs,0,0
540531930333470720,2014-12-04 15:43:49,"Be careful and watch out for thin ice if you plan on enjoying some ice fishing this winter!
http://t.co/EFeAEuxo8j",0,0
540279412324061184,2014-12-03 23:00:24,"Families across Northern Michigan with disabled children will benefit from tax incentives, while saving money for future expenses.",1,1
540279172351160320,2014-12-03 22:59:27,The ABLE Act will support and empower caregivers and families of individuals with disabilities.,1,0
540279080105836544,2014-12-03 22:59:05,"Today we passed H.R. 647, the “Achieving a Better Life Experience (ABLE) Act.” http://t.co/xYeI4fkpOK",0,0
540140822302568449,2014-12-03 13:49:42,"The hearing will be streaming  live online at the link below!
http://t.co/rXnwqG9ANE",1,0
540140632829075456,2014-12-03 13:48:56,At 10:00 AM EST I will be chairing a House Veterans' Affairs Subcommittee on Health hearing on the VA's Caregiver Program. #veterans,1,1
539875692226560001,2014-12-02 20:16:10,"This will be the 26th year for the Sleighbell Parade!
http://t.co/bgB0pw2DNj",0,0
539875546310930432,2014-12-02 20:15:35,Sleighbell Weekend is a great event in Manistee that brings visitors from across the country to Northern Michigan.,0,0
539869879168692225,2014-12-02 19:53:04,When we work together -- government works. http://t.co/pC3QIZSRcK,0,0
539803667478872064,2014-12-02 15:29:58,Only 29% of Americans think the U.S. economy is doing well. We need real solutions: http://t.co/QOGl4hdYrp,2,1
539545338278064128,2014-12-01 22:23:27,Congrats to Ishpeming High School Football and Munising High School Football for making it to their division championship games this year!,2,0
539532446442987521,2014-12-01 21:32:13,Learn more about the first annual Dentistry For Our Vets! https://t.co/AO9aYKPtWP,0,1
539532301269762048,2014-12-01 21:31:39,"They donated almost $18,000 in treatment services and had several hardworking volunteers who contributed to their time and money!",1,0
539531015275167744,2014-12-01 21:26:32,The John Fornetti Dental Center did some great work last month by offering free dental care to 42 veterans. #veterans,0,1
539476896254541824,2014-12-01 17:51:29,"Here is a great article on safe driving in winter weather!
http://t.co/0TaioqMp4r",0,0
539476882316853248,2014-12-01 17:51:26,"With winter in full swing in Northern Michigan, please take the time to practice safe driving.",0,0
538384189608185859,2014-11-28 17:29:28,I hope everyone had a wonderful and blessed Thanksgiving yesterday! http://t.co/mJGRsbPb4i,1,0
537332770193027072,2014-11-25 19:51:30,How has Obamacare affected your access to care? Tell your story at http://t.co/KbdHbwYhIv http://t.co/DstPmKDvHT,0,0
536929083972943872,2014-11-24 17:07:23,"What are your thoughts on the President's Executive Order on immigration? 
http://t.co/0F1pJ8nLBw",0,0
535200237925957632,2014-11-19 22:37:34,Congrats to Michigan Tech for ranking 24th in a list of schools with the highest starting salaries for new graduates: http://t.co/g402dmvowf,3,0
535178108354457600,2014-11-19 21:09:38,Check out this article that shows the lake-effect over the Great Lakes region!http://t.co/MW3nH0tlrG…/…/nasa_image_great_lakes_snow_ma.html,0,0
535157356293001216,2014-11-19 19:47:11,Thank you to all who work tirelessly to educate and empower our young people!,0,0
535157313821483008,2014-11-19 19:47:01,"This week is American Education Week, where we celebrate our nation's public schools! http://t.co/v3XqvLG3c5",0,0
535125102711820288,2014-11-19 17:39:01,"It was great to meet the Vanantwerp's today in my DC office. They traveled all the way from Benzonia, Michigan to visit Washington!",0,1
534825483696099328,2014-11-18 21:48:26,"Rebuilding the economy, one job at a time. http://t.co/LKaXrWbAFe",1,1
534774865375797248,2014-11-18 18:27:18,"From the @nytimes: ""Cost of Coverage Under Affordable Care Act to Increase in 2015"" http://t.co/ipRQmnb5Mf",2,1
534466092958498816,2014-11-17 22:00:21,These pending rate increases are unacceptable and I am committed to finding a solution.   http://t.co/br50RxnRHb,0,0
534465756055212032,2014-11-17 21:59:00,"Today, we introduced legislation that would require additional oversight by FERC in an effort to stabilize rate increases in the U.P.",3,1
534421383267508224,2014-11-17 19:02:41,"For Americans, #Obamacare means more red tape and more expensive health care. http://t.co/OP9PrJCN3u",0,0
533364225511809025,2014-11-14 21:01:55,Tomorrow marks the start of regular firearm season for deer in Michigan!,1,2
533345416033869824,2014-11-14 19:47:10,"It's great to see a local business working with our veterans in Northern Michigan!
http://t.co/QJiGBKu4sR",0,1
533341287064539136,2014-11-14 19:30:46,Check out the article on the Iron Mountain VA!http://t.co/KFELsPFwoX,1,1
533341192810156032,2014-11-14 19:30:24,Taking care of our veterans remains one of my top priorities and it is great to see the hard work of our local VA recognized!,1,1
533340944373141504,2014-11-14 19:29:24,Congratulations to the Oscar G. Johnson VA Medical Center for being named a 2013 Top Performer on Key Quality Measures! #veterans,1,1
532994599502241792,2014-11-13 20:33:09,"Hope everyone in Northern Michigan is staying warm this week! The U.P. was hit with more than 36 inches of snow!
http://t.co/j3LACrByVa",0,0
532922552688316416,2014-11-13 15:46:52,"You can watch the hearing live at the link below!
http://t.co/dWLs0ioxkK",0,0
532922320097406976,2014-11-13 15:45:56,"What questions do you have about this new law? #veterans
http://t.co/U1J6Ielq5n",0,0
532922215315283969,2014-11-13 15:45:32,"The House VA Committee is holding a hearing about the implementation of the Veterans Access, Choice, and Accountability Act of 2014. #Vets",2,0
532618836672249857,2014-11-12 19:40:00,"Congrats to Ross Richardson who recently found several previously undiscovered ship wrecks in Lake Michigan! 
http://t.co/v6SMHKdQwT",0,0
532263702243074049,2014-11-11 20:08:50,"To our military veterans, on behalf of all the citizens of Michigan’s First District, I say thank you.  We remain forever in your debt.",0,0
532263636044353537,2014-11-11 20:08:34,We thank them for their commitment in fighting to preserve the values that make our nation strong. #VeteransDay http://t.co/oJrFUeKBQq,2,1
532263495723937792,2014-11-11 20:08:01,"This Veterans Day, we recognize every man and woman who has ever worn the uniform of the United States military.",1,0
528272036012244992,2014-10-31 19:47:22,"October is National #DomesticViolenceAwareness  Month. I believe that no woman, man, or child deserves to suffer from domestic violence.",1,2
528195874137333760,2014-10-31 14:44:44,"As a member of the Great Lakes Task Force, I’ve been a strong advocate for the GLRI, which made this possible. http://t.co/cKN5EZgJhC",0,1
528185452768276482,2014-10-31 14:03:19,The delisting of the Deer Lake Area of Concern and the White Lake Area of Concern is great news for Northern Michigan.http://t.co/cKN5EZgJhC,1,1
527905540249518081,2014-10-30 19:31:03,"By working with groups like the Peace Ranch, we can really improve the care of veterans in our area. @peaceranchtc http://t.co/01rn02m3Q8",2,0
527897051842240512,2014-10-30 18:57:19,Peace Ranch does great work there to help Veterans struggling with PTSD- all at no cost to the vets! @peaceranchtc http://t.co/V7pRd7xQop,2,0
527888941832486912,2014-10-30 18:25:06,I had a fantastic time visiting the Peace Ranch in Traverse City this morning. @peaceranchtc http://t.co/FzBEEqwQeU,2,2
527888463404998656,2014-10-30 18:23:12,RT @healthylakes: Great news about AOC delisting in #Michigan! @SenCarlLevin @SenStabenow @CongressmanDan thx for supporting #GLRI! http://…,5,0
527887045902225408,2014-10-30 18:17:34,@nicahojo Please contact my office at 202-225-4735 to learn about the tours offered to constituents visiting Washington! Thanks!,0,0
527556671875604480,2014-10-29 20:24:46,"Until a long term solution to the UP’s energy needs is found, I will continue to fight against these unfair increases http://t.co/zYR3SgVUOv",0,0
527518998532202496,2014-10-29 17:55:04,RELEASE: UP Residents Making their Voices Heard on Rate Increases http://t.co/zYR3SgVUOv #energy,0,0
527494423765323776,2014-10-29 16:17:25,#Michigan  picked the state #Christmas tree – a 63ft blue spruce – from the UP this year. @upnorthlive http://t.co/lPvFChrfJX,2,1
527473980094308352,2014-10-29 14:56:11,@michigantech is hosting the Stanley Cup on Friday! Check out http://t.co/TxPVgZjiOM for additional info &amp; tix,0,0
527458873293410304,2014-10-29 13:56:09,#happyhalloween! Trick or treat times have now been announced for the Iron Mountain area. @IMDailyNews http://t.co/jzTX1D3maE,1,0
527173135473602560,2014-10-28 19:00:44,"The families, schools, and businesses in the UP simply cannot afford the proposed energy rate increases. http://t.co/HNoV6D0HvE",0,1
527166915123634176,2014-10-28 18:36:01,RELEASE: Dr. Benishek Pushes for Long-Term Energy Solution in Michigan’s UP  http://t.co/HNoV6D0HvE #energy,0,0
527149375064391680,2014-10-28 17:26:19,RT @PureMichigan: Are you brave enough to make a #Halloween visit? 13 haunted places in @TravelMarquette: http://t.co/b98qh4UFtI,6,0
527126144882339840,2014-10-28 15:54:01,RT @MQTSocialScene: the @uptravel is the winner of @duluthtradingco #flannelcityfaceoff… http://t.co/beNpNHh2sa,1,0
527125972043456513,2014-10-28 15:53:19,RT @DuluthTradingCo: It's official - The U.P. has been crowned the Most Flannel City in America! Read more: http://t.co/ygFp5Gfw5O http://t…,73,0
526835654567931904,2014-10-27 20:39:42,@GoodwillCapHill @Goodwillnmi I enjoyed learning about your job training programs that help those who experience difficulties to rebound!,0,3
526834449401782273,2014-10-27 20:34:55,RT @GoodwillCapHill: @CongressmanDan Thanks for visiting @Goodwillnmi &amp; your support of Goodwill. Hope you enjoyed seeing the mission in ac…,1,0
526807303841136641,2014-10-27 18:47:03,RT @PureMichigan: Just a few hours left to vote! Who will be crowned the Most Flannel City in America? Vote #UpperPeninsula: http://t.co/SF…,10,0
526782709092610048,2014-10-27 17:09:19,RT @Goodwillnmi: Thanks @CongressmanDan for visiting the Goodwill Inn today! #goodwill #traversecity #northernmichigan http://t.co/eLgrGQCi…,2,0
526777489323216896,2014-10-27 16:48:35,Goodwill Inn provides food and shelter for individuals and families experiencing homelessness. @Goodwillnmi #charity http://t.co/Pz4Pe59hgv,2,2
526771981598076928,2014-10-27 16:26:42,"This morning I was honored to tour the Goodwill Inn in Traverse City, the largest shelter in Northern Michigan. http://t.co/CS3p5t2DDU",4,5
525724673297108993,2014-10-24 19:05:04,@FERC must be willing to address rate hikes fairly and recognize the shared responsibility among energy consumers in the entire system.,0,0
525697781655420928,2014-10-24 17:18:12,ARTICLE: Benishek calls for delays to increase U.P. utility rates http://t.co/3NpgFfuRqC,1,0
525383829557874691,2014-10-23 20:30:40,"I’d like to thank @HillshireBrands in #TraverseCity for giving me a tour of their factory.  Did you know that they make 360,000 pies a day?",0,0
525375653517230080,2014-10-23 19:58:11,"Happy 42nd Birthday to our Marine Sanctuary System, which allowed for the creation of the Thunder Bay Marine Sanctuary! @ThunderBayWreck",2,0
525365839034585088,2014-10-23 19:19:11,RT @PKWalk: .@CongressmanDan who is a member of the GOP doctors caucus urges West Africa travel ban http://t.co/VcVrO7TxIY #tcot,2,0
525365673456054273,2014-10-23 19:18:32,RT @ShopFloorNAM: Thank you @CongressmanDan for your votes on behalf of #manufacturing in the US. #WeAreMFG http://t.co/QD4VSAVFkx http://t…,2,0
525303971595177984,2014-10-23 15:13:21,RT @PureMichigan: #PicturedRocks is decked out for #fall! Fantastic capture by IG fan (at)chrissymaio. #PureMichigan #UpperPeninsula http:/…,119,0
525302575646912513,2014-10-23 15:07:48,"In honor of National Forest Products week, I am celebrating the many uses of our forests here in Northern Michigan! http://t.co/uLbuSgC9nF",1,0
525030925701496834,2014-10-22 21:08:21,My prayers are with our Canadian neighbors during this difficult time.  #OttawaShooting,3,2
525029051451576320,2014-10-22 21:00:55,It was an honor to attend the Credit Union One ribbon cutting ceremony in Traverse City today! http://t.co/upI6l0csHR,0,1
525003866870661120,2014-10-22 19:20:50,"Over 20 years, Mr. Yoder grew his small business making apple boxes.  Now he ships over 25k a year to MI farmers! http://t.co/H1tFdIfZxf",0,2
524957469999919104,2014-10-22 16:16:28,More must be done to address the threat of #Ebola.  Learn more about my views here: http://t.co/Rvslp6rjao,1,0
524940900733300736,2014-10-22 15:10:38,RT @Franchising411: Retweet to thank @CongressmanDan for pledging to save #FranchiseJobs in Michigan from the political appointees at the @…,1,0
524918203030732801,2014-10-22 13:40:26,RT @PureMichigan: Think @TraverseCity is all about cherries? Think again! See 5 more reasons to visit TC via @nvilleledger: http://t.co/Hp7…,17,0
524918049418526720,2014-10-22 13:39:50,"RT @PureMichigan: Day or night, sun or clouds - @SleepingBearNPS is stunning! See tips for a visit via @NatGeo: http://t.co/VVqO1KNi15 http…",74,0
524652235847110656,2014-10-21 20:03:35,The proposed increase in UP energy rates is simply unacceptable.  I have called on @FERC to delay this change: http://t.co/b0rSeYaItG.,0,0
524637893487513600,2014-10-21 19:06:35,I join @gopdoccaucus in calling on @BarackObama to consider a travel ban from #Ebola affected nations in West Africa. http://t.co/ViuUMkJR3j,3,2
524628210009796609,2014-10-21 18:28:07,Thanks to all who came to the NMC Harbor Dedication in Traverse City.The harbor is now deeper and more accessible! http://t.co/YYmQxe2cjK,0,0
507252046391943170,2014-09-03 19:41:26,Happy 50th #LWCF - outdoor economy in Northern Michigan is #jobs.  Need access to continue to protect access to our forests.,3,1
506891961987792896,2014-09-02 19:50:35,If you're in the Iron Mountain are tomorrow make sure to stop by my office! I will be hold office hours from 3-4pm CST.,1,0
