id,created_at,text,retweets,favorites
78851084109623298,2011-06-09 15:48:58,Great breakfast in Antrim this morning.  Looking forward to our meet and greet.  Elk Rapids at 12:30 more info here http://j.mp/jy38KU #mi01,1,0
78562689068187648,2011-06-08 20:42:59,"Forest resources provide raw material for homes, workplaces, books and newspapers. #mi01 has plenty!  http://youtu.be/3iOfaaf_w-Q #tcot",2,0
78556807160807424,2011-06-08 20:19:37,"MI's UP is approximately 83 percent forested, with about 8.8 million acres of forest lands. http://youtu.be/3iOfaaf_w-Q #tcot #mi01",2,0
78545175785381889,2011-06-08 19:33:23,The forest industry is a critical economic driver in the Upper Peninsula of Michigan. http://youtu.be/3iOfaaf_w-Q  #tcot #mi01,4,0
78536846895878145,2011-06-08 19:00:18,There are approximately 550 forestry based businesses in the Upper Peninsula of Michigan. http://youtu.be/3iOfaaf_w-Q  #tcot #mi01,1,0
78532236592418816,2011-06-08 18:41:58,"RT @RepHuizenga: Help our colleague to the North win the  #nmc ""Like"" Rep. Benishek's page here! http://fb.me/Zqm0EJVu #tcot #mi01",1,0
78522379311136768,2011-06-08 18:02:48,"I, along with members the MI Society of American Foresters, are examining how forestry practices result in forest improvement. #mi01 #tcot",0,0
78142880824307712,2011-06-07 16:54:49,Asking for an 18% increase for questionable grants doesn’t sit well with me. http://youtu.be/AGe8j7QbJfE #tcot #mi01 #sgp,2,0
78126987083915264,2011-06-07 15:51:39,"With no plan at all, the Democrats seem to be for bankrupting Medicare.  http://youtu.be/L4tsVueZAB8 #tcot #mi01 #sgp #hhrs",6,0
77758710721675264,2011-06-06 15:28:15,"If you are not already getting updates from my Facebook page, please do by liking this http://j.mp/kLz0C1 #tcot #mi01 #gop",3,0
77744068184125441,2011-06-06 14:30:04,"You should read ""Big Government Spenders, You Should Have Read @Congressmandan's Sign…"" @redstate http://j.mp/kCLQfG #tcot #mi01",2,0
75652177758142464,2011-05-31 19:57:39,"Democrats: ""Shame on You!""  My speech on the House Floor earlier today. http://youtu.be/L4tsVueZAB8 #tcot #mi01",10,0
75580095372333056,2011-05-31 15:11:13,My staff put this together this great video and I'm glad they did! Memorial Day Tribute http://youtu.be/FAu529ggzoM #tcot #mi01,4,0
73875935476191232,2011-05-26 22:19:30,Benishek Supports Amendment To Remove American Forces From Afghanistan http://j.mp/itifNU #tcot #mi01,7,0
73105126587506688,2011-05-24 19:16:35,30k of America’s finest are affected by HR 1383.  Glad 2C the amendment pass yesterday 389-0.  http://bit.ly/l1K4Tx Thanks @CongJeffMiller,2,0
71237279112376322,2011-05-19 15:34:25,@Bromanw you can go to http://bit.ly/jCWyj4 and all the information is there.  Thanks for asking! I look forward to hearing back from you.,0,0
70213257763356672,2011-05-16 19:45:19,I am proud to sign on as a cosponsor of Federal Reserve Transparency Act of 2011. #TCOT and #MI01 don’t forget to follow me on twitter.,8,0
67671894689722368,2011-05-09 19:26:51,Take a look at my Youtube channel and please make sure that you subscribe while there.  http://www.youtube.com/congressmandan #tcot #mi01,4,0
67629711462895616,2011-05-09 16:39:14,"This week, 2 more pro-development bills: HR 1229 & HR 1231 will help to get American oil production underway. #tcot #mi01 http://j.mp/mJ0E1l",9,0
67629521280569344,2011-05-09 16:38:29,"Last week, fast tracked oil leases. If the world sees that the USA WILL produce, fuels cost should come down. http://j.mp/lO5oIR #tcot #mi01",12,0
58659673343148032,2011-04-14 22:35:30,The conversation now changes to trillions. Please take a look at my floor speech from earlier today: http://youtu.be/siTz19DZCkQ #tcot #mi01,4,0
55278996925071360,2011-04-05 14:41:54,"After looking at @RepPaulRyan's plan and @BarackObama's plan, who's serious about America's future? http://youtu.be/Xwv5EbxXSmE #tcot #mi01",14,1
54957064568586240,2011-04-04 17:22:39,"If you missed @RepPaulRyan this weekend, you really should take a look at this: http://fxn.ws/hivHg2 #MI01 #tcot",5,0
53568027710603264,2011-03-31 21:23:07,There is no agreement.  We are still waiting for the Democrat-lead Senate to do their job. http://bit.ly/ftZuRM #MI01 #tcot,8,0
53561945747505152,2011-03-31 20:58:57,The  Natural Resources committee is working to increase production. http://bit.ly/dVPjgs  #MI01 #tcot,1,0
53481901964525568,2011-03-31 15:40:53,On my way to @WalterReedArmy to tour the facility and visit with some of our nation’s finest.  A walk among heroes.  #MI01,2,0
48056365041725441,2011-03-16 16:21:44,My latest op-ed at The Daily Press: Spending Problem is Ignored |http://bit.ly/f8F3d4 #tcot #mi01 #jobs,5,2
44890747773792256,2011-03-07 22:42:42,HHS has now issued over 1000 businesses waivers for Obamacare ...  We call this #winning  NOT! #tcot #mi01,6,0
44869375735508992,2011-03-07 21:17:47,Everyone knows that if you make 40k/yr and spend 70k/yr eventually someone (China?) is going to come take away all your stuff! #tcot #mi01,17,0
38619999442714624,2011-02-18 15:25:00,New banner is up in our DC office... simple Northern Michigan common sense.  http://yfrog.com/gzmiufyj #tcot #mi01,14,1
37912294054690817,2011-02-16 16:32:49,It’s time to make the difficult decisions our country needs.  My input @ TheHill.com: http://j.mp/gHNDXg #tcot #mi01,5,0
32129866329497600,2011-01-31 17:35:31,Please check out my official site at: www.benishek.house.gov!,2,0
