id,created_at,text,retweets,favorites
449193799873736704,2014-03-27 14:38:42,Check out my op-ed in the Leelanau Enterprise about teamwork and protecting access to Sleeping Bear Dunes. http://t.co/8kjL5mGmGr,1,0
449190481063608320,2014-03-27 14:25:30,Officials discuss vocational education opportunities to prepare students for jobs http://t.co/H5VZH8tTRs via Crawford County Avalanche,1,0
448817625041498112,2014-03-26 13:43:55,"Another day, and but another #Obamacare delay http://t.co/siX0QmcEBx",6,0
444184708478689281,2014-03-13 18:54:21,President just signed into law my bill to protect access to @SleepingBearDunes!  Big day for N.Michigan!  #PureMichigan,10,8
441229037604995072,2014-03-05 15:09:34,RT @RepHuizenga: VIDEO:Yesterday the House passed @CongressmanDan's important legislation to protect Sleeping Bear Dunes http://t.co/P4WDsB…,2,0
440979271318650881,2014-03-04 22:37:06,Big win for N. Michigan!  Congress passes our bill to protect @SleepingBearNPS. On to president's desk! http://t.co/txwoxSNzdB,4,2
439410383812837377,2014-02-28 14:42:54,Big news for N. Michigan!  Our bill to protect @SleepingBearNPS will be on House floor on Monday http://t.co/VsX4tYh9He #PureMichigan,3,1
439046103049461760,2014-02-27 14:35:22,Good news that our bill to protect victims of military sexual assault will be considered in the Senate next month! #MJIA,1,2
439044058976378880,2014-02-27 14:27:15,"RT @SenGillibrand: After a setback earlier this week, I'm plsd the Senate has come to an agreement to proceed to consideration of the #MJIA…",26,0
437999481955430400,2014-02-24 17:16:28,"In @TraverseCity today to   
present local veteran Timothy Smith with the National Defense Service Medal for his Navy service.",1,1
432560236621090816,2014-02-09 17:02:51,Disturbing @AP investigation shows evidence of mil commanders refusing to prosecute sexual assault cases: http://t.co/Uvnlyvmf5h #passMJIA,2,0
432559824258482176,2014-02-09 17:01:13,RT @SenGillibrand: .@AP: Dozens of “investigations that appeared to indicate a sex crime but were resolved using lesser charges or simply d…,24,0
431450629391667200,2014-02-06 15:33:40,Joining @RepKerryB in introducing legislation that will force Congress to balance the budget or take a pay cut!  http://t.co/UYbTm8g06r,4,2
431449989710348288,2014-02-06 15:31:08,RT @RepKerryB: .@CongressmanDan and I offered the Spending Accountability Act. Balance the budget or take a pay cut! #MakeDCListen http://t…,3,0
430785557522681856,2014-02-04 19:30:55,Watch my @CharactersUnite video on #MJIA and take a stand of your own: http://t.co/rFzXobXfUc,2,1
428528498685120512,2014-01-29 14:02:10,"From the @RecordEagle, my Sleeping Bear Dunes bill is ready to head to the House floor http://t.co/h6dkvrxl63",3,4
428212218279116800,2014-01-28 17:05:23,@NatResources passed my Sleeping Bear Dunes bill today unanimously!  #puremichigan,1,2
428211404945260544,2014-01-28 17:02:09,RT @RepHuizenga: Great to see @CongressmanDan's Sleeping Bear Dunes legislation pass unanimously out of @NatResources Committee today! #Pur…,3,0
428173673233543168,2014-01-28 14:32:13,What do you want to hear in President's State of the Union address tonight?,3,0
426051859657523200,2014-01-22 18:00:53,RT @Right_to_Life: Gaylord RTL and Gaylord Teens for Life left yesterday for the #MarchForLife #whymemarch http://t.co/CtnjM972hW,3,0
426051204318507009,2014-01-22 17:58:17,"RT @Pontifex: I join the March for Life in Washington with my prayers. May God help us respect all life, especially the most vulnerable",11674,0
426009121876238336,2014-01-22 15:11:04,Inviting N. Michigan March for Lifers to stop by our office and warm up this afternoon! 514 Cannon Building. #whywemarch #prolife,7,1
420927511359262720,2014-01-08 14:38:33,Check out our joint column with @RepHuizenga and @RepWalberg on helping Michigan farmers -http://t.co/rJrEjdytPd,2,0
420156669247885312,2014-01-06 11:35:30,RT @wluctv6: Dan Benishek talks jobs as election year looms. http://t.co/nahcNPi0Z1 #TV6News,2,0
412959369668476928,2013-12-17 14:56:00,Always enjoy hearing the work people are doing throughout Northern Michigan to help each other out. What's your story?http://t.co/QiAPsvVVpV,3,0
400724256511643648,2013-11-13 20:38:02,Victims tell us that only by removing sexual assault cases from military chain of command will they have a fair shot at justice. #passMJIA,15,11
400669584157450240,2013-11-13 17:00:47,The Military Justice Improvement Act would give victims of sexual assault in the military a fair shot at the justice they deserve. #passMJIA,2,0
398153593263366144,2013-11-06 18:23:08,This doctor won't stop fighting to dismantle #Obamacare My column in @DailyPressMI:  http://t.co/grGVcmwRiP,16,11
395146759892004864,2013-10-29 11:15:03,"Rising costs, lost coverage, a website that doesn’t work...Share your Obamacare story here: http://t.co/d9dEsTEZYZ",2,0
392298478283419649,2013-10-21 14:37:00,Obamacare website still not working &amp; these are the guys who are going to be running our health care system!?!http://t.co/UVvQkI9HIX,3,1
391195422347100160,2013-10-18 13:33:51,"The @detroitnews highlights our fight for victims of sexual assault in the military.  
Momentum is growing!http://t.co/pZrHO63a4f #MJIA",7,0
388707815306444800,2013-10-11 16:48:59,"@MichiganRadio Yes. As a doctor for 30 years, I’m used to fixing things. Like the OR, Washington needs to work together to find solutions.",0,0
383367158710804480,2013-09-26 23:07:08,"Amir Hekmati, a U.S. citizen, has been detained in an Iranian prison for over 2 years. It’s time to #freeamir now! http://t.co/U4hjnd9hWc",9,2
379999096758493184,2013-09-17 16:03:39,RT @RepHuizenga: Today in 1787 the Constitution was signed by 38 of 41 delegates &amp; then sent to the states for ratification. Happy #Constit…,60,0
377386380839489536,2013-09-10 11:01:39,I’m going to be voting NO on the President’s plan to attack Syria.  Retweet if you agree! http://t.co/Y9H8DgNphR,196,42
367242951266541568,2013-08-13 11:15:17,RT @SenGillibrand: .@NationalJournal piece on why victims say removing sexual assault cases from mil chain of command is so impt: http://t.…,23,0
362994719959158784,2013-08-01 17:54:20,Momentum continues to grow...the voice of victims is being heard! @petoskeynews http://t.co/da6VYYUwUJ  #Bipartisan #MJIA,8,3
362994118940565504,2013-08-01 17:51:56,RT @BrandonHubbard: Support growing for Benishek's reform bill on #military #sexual assault http://t.co/Dz8aCh64kS #Bipartisan #politics,3,0
362957793659060225,2013-08-01 15:27:36,RT @RepHuizenga: .@petoskeynews: Support growing for @CongressmanDan's reform bill on addressing assault in the military http://t.co/z864pD…,4,0
362699377082507264,2013-07-31 22:20:44,"Our bipartisan legislation to reform military justice is supported by a  growing diverse, bipartisan coalition. http://t.co/hvxL7xM3Iq #MJIA",4,1
362629005100331011,2013-07-31 17:41:06,Announcing a growing bipartisan coalition in the House that have endorsed the Military Justice Improvement Act. #MJIA http://t.co/hvxL7xM3Iq,17,2
359741828142080001,2013-07-23 18:28:30,"RT @pewenvironment: Thanks to @CongressmanDan, @RepMikeMichaud, @davereichert,@AmodeiNevada, and @RepThompson for protecting public lands t…",7,0
359675019053383680,2013-07-23 14:03:01,@NatResources holding a hearing on my Sleeping Bear Dunes bill. Watch live here: http://t.co/HaiXgoSZoZ,1,0
359674808390258688,2013-07-23 14:02:11,RT @NatResources: Live at 10AM: @NatResources Subcommittee hrg on various wilderness bill and other legislation. Watch live online http://t…,4,0
359674542626582528,2013-07-23 14:01:08,@NatResources will be holding hearing today on my Sleeping Bear Dunes bill. You can watch live: http://t.co/HaiXgoSZoZ,0,0
345298193870909441,2013-06-13 21:54:39,Disappointed our sexual assault bill was blocked on the House floor. We will keep fighting for this! #MJIA http://t.co/JoVxPxfWs1,12,2
336535114999808001,2013-05-20 17:33:18,We have a bipartisan plan to address the sexual assaults in the military.  The time to act is now.  http://t.co/JoVxPxfWs1,4,1
332515014936252416,2013-05-09 15:18:52,Proud to write bill that will protect access for hunting and fishing on federal land!http://t.co/kvmpwlvc7e  @NatResources,5,0
324199366116126720,2013-04-16 16:35:27,Our thoughts and prayers remain with all those affected by the tragic events in Boston yesterday #PrayForBoston http://t.co/Ot8ImvVnCf,0,0
317363915304620032,2013-03-28 19:53:48,Medical claims costs will go up by 26% in Michigan by 2017. The President’s health care law is a disaster. http://t.co/Aquh7hJNBl,7,1
299576033676492801,2013-02-07 17:51:06,Proud to be fighting to get our veterans their benefits faster. http://t.co/ZDLMqGaZ @HouseVetAffairs,8,0
299149488830951424,2013-02-06 13:36:10,It’s time the president tells us how he’s going to balance the budget. #RequireAPlan,5,3
298790653771526145,2013-02-05 13:50:17,We need to reduce spending in all corners of the budget—including the Pentagon. http://t.co/M4mFLPiz,4,1
296312361374076929,2013-01-29 17:42:26,RT @NRA: @CongressmanDan Benishek Leads Effort To Protect Northern #Michigan Gun Owners http://t.co/nsFBH9Cg #NRA,3,0
295935555445870593,2013-01-28 16:45:09,Proud to be named to key subcommittees on the @HouseAgNews Committee. http://t.co/ehACQaSE,0,1
294127956341702656,2013-01-23 17:02:24,Washington needs to do its job or not get paid by the American people.  #NoBudgetNoPay,1,0
293769538133192704,2013-01-22 17:18:10,Our Senators have a decision to make...they can address the fiscal crisis or they can  protect their own paychecks.  #NoBudgetNoPay,2,0
291915881460682754,2013-01-17 14:32:24,"President’s proposels will only prevent law-abiding individuals from protecting their homes, children, and businesses. http://t.co/9HUZegrC",14,4
291603937717530625,2013-01-16 17:52:51,We cannot allow our Constitutional rights to be eroded to achieve a false sense of security. http://t.co/ffoFQ9hH,7,0
289008776579784704,2013-01-09 14:00:36,Proud to introduce legislation to protect Sleeping Bear Dunes. http://t.co/EEjz51xY,1,1
286945547984728066,2013-01-03 21:22:05,Proud to be sworn into the 113th Congress and to continue serving the people of Northern Michigan. http://t.co/ZBu6Kt0M,0,0
286820955114831874,2013-01-03 13:06:59,The last thing people in Northern Michigan want to see is the President giving lawmakers a pay raise. http://t.co/9DrHgMkl,3,0
282125523772112896,2012-12-21 14:09:01,I was honored to be named Subcommittee Chairman of Veterans’ Affairs Subcommittee on Health. http://t.co/ifHfzDjS,1,0
218375163954208769,2012-06-28 16:07:50,My statement on #SCOTUS ruling on #PPACA - http://t.co/AsN5qrGK #tcot,4,2
207921100741545984,2012-05-30 19:47:08,"“I believe doctors &amp; patients in N. Michigan want this country to remain on the cutting edge of medical innovation"" - http://t.co/fW2TMudl",2,0
207824626812850177,2012-05-30 13:23:46,Check here to see what the House will be voting on this week! http://t.co/vozv4vVu,1,0
207517580607488002,2012-05-29 17:03:41,"How did you spend your Memorial Day wknd? If you took part in any of the events that we posted on my Facebook, let us know how they were.",1,0
206484783151321088,2012-05-26 20:39:43,I encourage those who are in the area to use the phone numbers listed on my website if you or someone you know needs assistance #DuckLake,0,0
206484673508016129,2012-05-26 20:39:17,"I'm very grateful for the hard work of our first responders, conservation officers &amp; all those who are working to put out the fire #DuckLake",0,0
206484393206882304,2012-05-26 20:38:10,I was briefed on the spread of the fire &amp; containment efforts. #DuckLake,0,0
206484151833067521,2012-05-26 20:37:14,Today I met w/ officials to discuss response efforts to the #DuckLake Fire. http://t.co/I9kZWZzB,3,0
206384333861294080,2012-05-26 14:00:34,Check out my website for updated information &amp; phone numbers - http://t.co/Ir5WeZ3G #ducklake #michigan @RedCross #MI-01,0,0
206151923915685888,2012-05-25 22:37:03,Here are some important phone numbers for those impacted by the Duck Lake Fire http://t.co/hpnA5T0V #Michigan,3,0
205306598946648064,2012-05-23 14:38:02,Attention N. #Michigan students! My office is accepting applications for military service academies (Due 9/17) - http://t.co/iauCXx4A,0,0
205004739090452480,2012-05-22 18:38:33,Want to send a shout out to #Michigan loved ones serving away from home? Use #MayIs4Troops to share your message!,3,0
204583556041801728,2012-05-21 14:44:55,"Proud to cosponsor H.R. 4155, the “Veterans Skills to Jobs Act” - http://t.co/n1BPhLnP #MayIs4Troops #tcot",6,0
203242140984291331,2012-05-17 21:54:37,@MKasiborski Go after your American Dream. Mine was to be a Dr in N. #Michigan - don't give up! Good luck &amp; save your money!,0,0
203153775769305089,2012-05-17 16:03:29,Looking forward to discussing my plan to address #veterans benefit backlog next week – http://t.co/3esO1MGe #MayIs4Troops,1,0
202114008046768129,2012-05-14 19:11:49,Check here to see what Congress is voting on this week - http://t.co/vozzC5Wo,1,0
202046474807296001,2012-05-14 14:43:28,Emergency care was restored in Cheboygan. Great first step! I'm committed to bettering MI-01 and local access to health care #tcot,1,0
200610945259667456,2012-05-10 15:39:11,Congrats to the student teams from the #UP will participate in the nat'l bridge competition on 5/18 in Traverse City - http://t.co/IkUkIZ8n,0,0
200297162419089408,2012-05-09 18:52:19,#POTUS created a #CongressToDoList yesterday. Why wasn’t #Keystone XL pipeline included? I’m pro growth #4jobs #affordableenergy,0,0
200268322825191425,2012-05-09 16:57:43,"Health care slush fund covers spaying/neutering, signage, urban gardening...NOT health care – http://t.co/8Nwr0mhS  #tcot #PPACA",1,0
200209454644465664,2012-05-09 13:03:48,"The father of an #Afghanistan #veteran, I’d like to thank all our servicemen and women. Your service does not go unnoticed #MayIs4Troops",10,1
199944374057046017,2012-05-08 19:30:28,What message would you like to relay to active duty #troops &amp; #veterans? Use “ #MayIs4Troops ” to share your message.,3,0
199916937327816704,2012-05-08 17:41:26,Hosted a telephone townhall with my constituents today. Check my Facebook today &amp; tomorrow for poll question results! #Michigan #tcot,0,0
199878323285921792,2012-05-08 15:08:00,Happy National Teacher Day to all of our educators. Who was your favorite teacher and what did he/she teach you? #Michigan #tcot,1,0
199868976094904320,2012-05-08 14:30:51,RT @HouseVetAffairs: Please tweet messages to veterans and active duty military under our #MayIs4Troops hashtag. We will RT the best ones.,7,0
199848889875042304,2012-05-08 13:11:03,Thank you @HouseVetAffairs Chairman @CongJeffMiller for joining me in my telephone townhall last night. #MayIs4Troops,1,0
199605179748855810,2012-05-07 21:02:37,Here’s my statement on why POTUS needs to approve the #Keystone XL pipeline – http://t.co/kUnVxq6h #tcot #affordableenergy #4jobs,1,0
199569396325298176,2012-05-07 18:40:26,"Tonight I’m holding a telephone townhall with Chairman of @HouseVetAffairs, @CongJeffMiller to discuss vets issues. #MayIs4Troops",2,0
199545777603870720,2012-05-07 17:06:35,This week is National Nurses Week. How do you plan to honor these medical professionals? #tcot #Michigan,1,0
199536697103499264,2012-05-07 16:30:30,"I am a proud co-sponsor of PRENDA, to stop abortions based on race or gender of a baby. #tcot",3,0
199532288936116225,2012-05-07 16:12:59,Interested in what the House will be voting on this week? Check here – http://t.co/Krdwpdsl #tcot,1,0
198495243757297664,2012-05-04 19:32:08,I’m posting the poll results of my telephone townhall to my Facebook today. Be sure to check the results &amp; share your thoughts! #tcot,0,0
198061994232918016,2012-05-03 14:50:33,"I'm supporting HR 4115, the HIRE at Home Act, to help our veterans gain employment when they return home @HouseVetAffairs #MayIs4Troops",0,0
198044038564286464,2012-05-03 13:39:12,"May is Military Appreciation Month. Follow @HouseVetAffairs to learn more about the U.S. military, our troops &amp; veterans #MayIs4Troops #tcot",2,0
197697547119243264,2012-05-02 14:42:22,Just posted some photos from touring Michigan's First Congressional District to my Facebook - http://t.co/ob4DHnHn,0,0
197678759455883264,2012-05-02 13:27:43,"May is Older Americans Month, a tradition since 1963. How do you plan to honor your elders? - http://t.co/wJ0POTvK #OAM2012",1,0
197422901765476352,2012-05-01 20:31:02,.@DeptVetAffairs will hire 1900 new mental health practitioners to better treat our nation's heroes - http://t.co/q1Z9osHG @VeteransHealth,0,0
197408387481337857,2012-05-01 19:33:21,Are you an organ donor? Check out my Facebook page on how to add this information to your personal Facebook page. http://t.co/NGKZiKZQ,0,0
197325677266079745,2012-05-01 14:04:43,Thank you again to the West Iron County Schools for having me visit yesterday. I can't wait to see how this tree grows! http://t.co/vVMQjUMN,0,0
197027699162755072,2012-04-30 18:20:38,Read my news release on an overzealous agriculture #regulation being withdrawn - http://t.co/uvkp68aP #tcot,2,0
196965542064697345,2012-04-30 14:13:39,Congrats to @RepSeanDuffy for advancing to the next round of the #gopnmc,0,0
195936418512642048,2012-04-27 18:04:17,National Park Week is coming to a close. Are you planning on enjoying some of the beautiful parks in #Michigan this weekend? #gopnmc #tcot,1,0
195929277781381120,2012-04-27 17:35:54,Last day of the Twitter round of the #gopnmc - Help me gain more followers by tweeting at me with #FF or RTing me. Thanks for your help.,4,0
195616864859201536,2012-04-26 20:54:29,RT @DLoesch: Happy 3rd anniversary this Sunday to the Democrat senate for failing to produce a budget in 3 years. #3YearsNoBudget,111,0
195595557958455297,2012-04-26 19:29:49,I signed a letter in support of Special Diabetes Program. Diabetes costs US over $174B annually & costs are expected to triple #gopnmc #tcot,1,0
195587496225157120,2012-04-26 18:57:49,Honored to greet N #Michigan heroes today. These WWII vets came to see their memorial #gopnmc #tcot @HouseVetAffairs http://t.co/2OwFzLmq,2,0
195583980182061056,2012-04-26 18:43:49,RT @DanaPerino: What's wrong with this? marine sergeant kicked out for a Facebook post but the EPA administrator gets to apologize and k ...,236,0
195558248806490112,2012-04-26 17:01:34,"#MI-01 residents, check out your local news on Twitter - @MackTownCrier @ChxCourier @MiningJournalMI @TheDMG @TheAlpenaNewsMI #gopnmc",0,0
195542122605195267,2012-04-26 15:57:29,"RT @paulswansen: Today is Day 1,093 without a budget from Senate Dems, and why has no one moved to impeach Sen. Leadership for failure t ...",5,0
195536637420240896,2012-04-26 15:35:41,Thanks for all the new follows! Please keep it up and encourage your friends to follow & RT @CongressmanDan #tcot #gopnmc #Michigan,3,0
195262964469731329,2012-04-25 21:28:13,"Please follow the committees which I’m honored to serve on @NatResources, @SciSpaceTechCmt & @HouseVetAffairs #gopnmc #tcot",2,0
195248079350415360,2012-04-25 20:29:06,Had a great mtg w/students from Mackinac Island HS and Mackinaw City HS. I hope you enjoyed your trip #GOPNMC #Michigan http://t.co/Cuy9xTip,2,0
195236738736721920,2012-04-25 19:44:00,RT @CandiceMiller: Help support #MIGOP in #House #GOPNMC! Follow @CongressmanDan @RepHuizenga @RepWalberg @RepFredUpton,3,0
195203419487731713,2012-04-25 17:31:36,Help me reach 8k followers! RT & join my efforts to bring commonsense reforms to #Michigan #gopnmc #tcot,2,0
194851905103601664,2012-04-24 18:14:49,"Looking for new shoes? Premier & @Nike teamed up to design the ""Petoskey Stone Dunk"" - http://t.co/GJD5mEI1 #GOPNMC #Michigan #tcot",2,0
194830440585117696,2012-04-24 16:49:31,RT @TiffanyMMoore: Help #MIGOP in GOP New Media Challenge #GOPNMC @repjustinamash @congressmandan @rephuizenga @candicemiller @repfredup ...,1,0
194829915768635393,2012-04-24 16:47:26,The House will vote on several #jobs measures this week. See the full schedule here – http://t.co/pXeQnDmC #tcot #GOPNMC,1,0
194439570895544322,2012-04-23 14:56:20,The House new media challenge continues! Help me increase my Twitter presence and encourage others to follow me today! #tcot #gop #Michigan,4,0
193313931765350401,2012-04-20 12:23:27,Don’t forget to “like” me on Facebook! Help me in the House New Media Challenge by liking my page by 5pm today! http://t.co/0VKFPR0S #tcot,1,0
192725525649833984,2012-04-18 21:25:20,Have you “liked” me on Facebook? Help me in the House New Media Challenge by liking my page by 5pm Friday! http://t.co/0VKFPR0S #tcot #gop,0,1
192323168193613824,2012-04-17 18:46:32,"Today, Discovery flew over our nation’s capitol. The shuttle will be @ Air & Space Museum 4/19 #SpotTheShuttle http://t.co/0Uyn7ebR",0,0
190793713717481472,2012-04-13 13:29:00,"#FF Proud to serve on the @SciSpaceTechCmt, @NatResources & @HouseVetAffairs committees. Follow to learn more about our work! #tcot",2,0
190793573044715521,2012-04-13 13:28:27,@NatResources Thanks for the mention!,0,0
189699199665844224,2012-04-10 12:59:48,I'm hosting a meet-n-greet today at Noon at the Rogers City Senior Center. I hope to see you there!,0,0
184654298582487043,2012-03-27 14:53:10,Oral arguments continue today at the Supreme Court on #PPACA & the individual mandate. Looking forward to attending tomorrow. #tcot,0,0
183245715097661440,2012-03-23 17:35:57,Today is the 2nd anniversary of #PPACA. I am committed to its repeal &amp; replacement. Northern MI needs &amp; deserve real health care solutions.,3,0
182550915637706752,2012-03-21 19:35:04,Watch Congress debate legislation to repeal IPAB - a provision of #PPACA that will drastically alter Medicare http://t.co/BIC10FXa #tcot,2,0
182197564374921217,2012-03-20 20:10:59,I'm proud to support a budget that will help the people of Michigan http://t.co/6EnGUPCk #2Futures #tcot,0,1
182094276954558464,2012-03-20 13:20:33,Interested in what we’ve been doing in the @SciSpaceTechCmt? Sign up to receive weekly newsletters: http://t.co/ABrpC8yw #tcot,0,0
181758873055670272,2012-03-19 15:07:46,Congress is back in session this week. Check to see what I will be voting on - http://t.co/Zcvlt2vG #tcot,1,0
180379005483106306,2012-03-15 19:44:40,"In light of recent violence, maintaining our presence in #Afghanistan is no longer in our best interest. It's time to bring our troops home.",1,0
180004260019314688,2012-03-14 18:55:34,A CBO estimate says #PPACA is more expensive than expected. We must repeal &amp; replace w/ commonsense reforms that don’t break the bank.,2,0
167282537847193600,2012-02-08 16:23:59,"RT @WaysandMeansGOP In less than 60 days US will have the highest
corporate tax rate in the industrialized world. We need tax reform
#4jobs",10,1
166979053428027392,2012-02-07 20:18:03,"RT @HouseVetAffairs As sequestration looms, uncertainty remains about #vets programs. America’s heroes deserve to know today. #tcot",1,0
166528088333746176,2012-02-06 14:26:04,Congratulations to Tpr. Bradley Stimac of the Houghton Lake Post recipient of the Trooper of the Year Award.  http://t.co/gHDarqjC,0,0
166527255764410368,2012-02-06 14:22:46,Are you planning to visit DC during your Spring break.  Please visit http://t.co/wAlh25ap for our Washington Visitor's Guide.  #MI01,0,0
162916146490777600,2012-01-27 15:13:30,Support @repjustinamash's H.R. 3814 to keep DOJ from tracking the purchases of multiple guns. Read more: http://t.co/jSsYwXs9 #tcot,4,1
145264368353947648,2011-12-09 22:11:38,Read this article to find out what is happened in New Hampshire to 7600 Medicare Advantage participants. CANCELED http://t.co/CEwOEC5P #tcot,2,1
145176319414648834,2011-12-09 16:21:46,Rep. Paul Gosar wrote an article for the House Doctors Caucus re: healthcare reform. Please share and RT. http://t.co/dhcZ8uj8 #tcot,1,0
144898698458054656,2011-12-08 21:58:36,The House Doctors Caucus released a video addressing Medicare reimbursement rates for physicians. http://t.co/vR8EjP1K #tcot,1,0
142633620438401024,2011-12-02 15:57:59,Obamacare cut $500 billion from Medicare without creating reforms for provider payments. I talk about it &gt;&gt;&gt; http://t.co/NJSI9UwE #tcot,2,0
142330062094606337,2011-12-01 19:51:45,It is becoming obvious that Dr. Benishek has a better grasp of what Obamacare will do than the Administration does. http://t.co/elydClqb,4,1
116531066424147968,2011-09-21 15:15:45,"@teamhoekstra Thanks for the shout out and good luck! FYI
@congressmandan @benishek are the only  accounts I use. No idea who @DanoMI1 is?",0,0
114358795437748225,2011-09-15 15:23:56,"New Video: @RepGeoffDavis explains over-regulation and the #REINS Act
http://t.co/GMnM2fu7 #pledge #accountability #4jobs
#tcot",1,0
91537731116732416,2011-07-14 16:01:10,Reason TV has a great video about why it makes sense to raise the debt limit. http://youtu.be/5KoWRh1Y9IY #mi01 #tcot,3,0
91179920373452800,2011-07-13 16:19:21,"@BarackObama please stop scaring my constituents, BPC reports there is enough $ to pay for SS and more. http://bit.ly/pGrZxN #tcot #mi01",40,2
85443419052310528,2011-06-27 20:24:33,"Please watch this video and share it far and wide, #cutcapbalance needs your support. http://youtu.be/R2AKqE6APD4 #tcot #mi01 #teaparty",27,2
81079530520981504,2011-06-15 19:24:01,@curtisaudette Feel free to contact us if you are wanting a tour.  We also have a guide that you might find useful http://bit.ly/iZa6cT,1,0
79184359093051392,2011-06-10 13:53:17,RT @NatResources #FF @RepMcClintock @CongressmanGT @RepJeffDenham  @RepRivera @RepJeffDuncan @RepTipton @repgosar #tcot,4,0
79183271694569472,2011-06-10 13:48:57,I am part of a social media challenge.  New followers = points...  I would love to be on your #FF list. #tcot #mi01,9,0
