id,created_at,text,retweets,favorites
470735134933921792,2014-05-26 01:16:16,RT @jpurnhagen: @DarrellIssa thin man at the front right clearing Dachau. We just laid him to rest earlier this month. http://t.co/YOUVT1Sq…,34,0
470734713817030656,2014-05-26 01:14:36,"RT @saxon1215: @DarrellIssa My Father : Forrest Pearson 11th Airborne, blown out of a foxhole WWII - barley survived - passed '09 http://t.…",23,0
470734633601339392,2014-05-26 01:14:17,"RT @lisalunu: @DarrellIssa Lawrence Fugate, WWII. http://t.co/EHlpJ1SqB2",13,0
470732255384838144,2014-05-26 01:04:50,"RT @watrmelloncrawl: @DarrellIssa  My dad, WWII/Korea, RM3 on an LST. He passed away 1/13/14. http://t.co/ZWQ8i02VEr",19,0
470732191904067584,2014-05-26 01:04:35,"RT @MushKat: .@DarrellIssa James Grace, Shipfitter 3rd Class, Construction Battalion #WWII #SeaBees 1922-2007 #MemorialDay http://t.co/D2HJ…",34,0
470731223489187840,2014-05-26 01:00:44,@Lexie7703 thank you for your family's service.,0,1
470729940531675136,2014-05-26 00:55:38,RT @CrazyBamaFan28: For those I love I will sacrifice #MemorialDay #InHonorOf  #Veterans http://t.co/OqF0UP0em1,84,0
470728239233921024,2014-05-26 00:48:52,@Rawhide40 glad he finally made it home.,0,0
470728124003782658,2014-05-26 00:48:25,"RT @Rawhide40: @DarrellIssa Earl P. Hopper Jr., His F4D was shot down in North Vietnam in 1968. Remains identified and returned Apr 2009.",15,0
470727806645989377,2014-05-26 00:47:09,"RT @WRM777: .@DarrellIssa  John P. Marshall, Jr. SSGT, US Army, WWII, Ardennes Campaign. My dad.",11,0
470727206898262016,2014-05-26 00:44:46,RT @DaveHatter: @MKRIZSA50 @DarrellIssa - We'll be honoring SSG Lee at the Annual @FortWright_KY Memorial Day Ceremony tomorrow at 10:00am.,4,0
470726091318231042,2014-05-26 00:40:20,RT @CatMom2498: @DarrellIssa T/Sgt Irwin Cohen 61 missions radio gunner B25 Mitchell. Air medal 9 Oak Leaf Clusters http://t.co/svVN4mmsu6,17,0
470725501536198656,2014-05-26 00:37:59,"@WRM777 thx for the tweet, Wayne.",0,1
470725141119643648,2014-05-26 00:36:33,"RT @LeslieBoren1: @DarrellIssa Maj. Barney Jones...I wanted to post this on my original post,.My dad, a True Hero! http://t.co/GrYvAawZl3",20,0
470723776297304064,2014-05-26 00:31:08,"RT @MKRIZSA50: @DarrellIssa 
Daniel Lee, Ft Wright, KY http://t.co/vogH3kOeIZ",10,0
470723734270394368,2014-05-26 00:30:58,"@M0lonLabe thank you for sharing, Daniel.",0,0
470723697410846720,2014-05-26 00:30:49,"RT @M0lonLabe: @DarrellIssa CPL JARROD MAHER KIA 11/12/2004 1st battalion, 4th Marine Regiment http://t.co/R8wLY3ZOPw",24,0
470723475167281152,2014-05-26 00:29:56,"@MelPax Thank you for sharing, Melody.",0,0
470722541561344000,2014-05-26 00:26:14,Are you honoring a fallen loved one this #MemorialDay? I would love to see your photos and honor them with you.,32,40
470721092169261056,2014-05-26 00:20:28,@JennaAWhite thx Jenna,0,2
470720064485076992,2014-05-26 00:16:23,"RT @SlowNeutron: @DarrellIssa My Dad, Col. Jack L Walker, 45 missions over Corsica, Mitchell B25's. Communications and side gunner. God res…",13,0
470719938156826625,2014-05-26 00:15:53,"RT @GeorgeNettleton: @DarrellIssa my grandfather, France 1944. #myhero http://t.co/tp22rObQbm",17,0
470719903998423040,2014-05-26 00:15:45,"RT @mehere01: @DarrellIssa  Guido Filippo 2nd Lieutenant 36th Fighter Group WWII   Europe, flew P47, pilot down 11/5/1944. Age 20 http://t.…",14,0
470716887140425729,2014-05-26 00:03:46,RT @LizzyFreek: @DarrellIssa Honor Guard Kyle David Lassetter Abilene Texas stationed in Washington DC http://t.co/TZFOCZoiE4,24,0
470715915903172608,2014-05-25 23:59:54,"RT @jaketapper: Chief Warrant Officer Deric M. Rasmussen, 33, of Oceanside, Ca., was killed May 11 in Mazar E Sharif. #MemorialDay http://t…",164,0
470712592147968000,2014-05-25 23:46:42,RT @Oldsmobilelady: @DarrellIssa my grandfather paralyzed in WW2 Walter Bedillion 1917-1999 http://t.co/MQFGZ19LBQ,23,0
470712524300492800,2014-05-25 23:46:25,RT @pkruppenbacher: @DarrellIssa MSGT Charles W. Lindewald. Died on '68 in Vietnam. He was on my POW/MIA  bracelet.,20,0
470710765255532544,2014-05-25 23:39:26,Are you honoring someone special this #MemorialDay? Tweet a picture!,21,9
469933805348716544,2014-05-23 20:12:04,"As you enjoy the long weekend, #FridayPuppy reminds you to honor our fallen heroes. #MemorialDay http://t.co/GxWrgUVmu8",204,153
469916202618593280,2014-05-23 19:02:07,"As State has moved away from pushing the Committee to accept an alternative witness, we accepted the Secretary's offer to testify on June 12",38,16
469915917120729088,2014-05-23 19:00:59,"Today, the State Department informed @GOPoversight that Sec Kerry will testify in person, but asked for a postponement.",34,15
469871395917529090,2014-05-23 16:04:05,A moving look at the work that goes into maintaining Arlington National Cemetery for our heroes: http://t.co/w9BLg2CSB1 #MemorialDay,34,11
469559120191041537,2014-05-22 19:23:12,Takin' it back to 1967 in today's #tbt. I was about 14 in this picture. #throwbackthursday http://t.co/Y02McG5NG5,24,53
469557168803676160,2014-05-22 19:15:27,Why is President Obama constantly kept in the dark? http://t.co/PbsEHXIO0e via @GOPWhip,102,53
469550433342857217,2014-05-22 18:48:41,@BarbaraBb6061 Yesterday I voted for House-passed #HR4031 to hold VA leaders accountable when failing to live up to duties to our vets.,19,11
469549744805933056,2014-05-22 18:45:57,"Taxpayers deserve a better ROI. By streamlining responsibility &amp; centralizing budget authority, #FITARA goes a long way toward cutting waste",15,8
469549576756920320,2014-05-22 18:45:17,Today #FITARA passed as part of the NDAA for FY 2014. FITARA will dramatically improve the way gov agencies buy and manage IT systems.,10,7
469546346027167745,2014-05-22 18:32:27,Full press release letter to AG Holder and the #DOJ regarding Jack Smith here: http://t.co/JVnT0C8KYU #IRStargeting,38,19
469545024599113730,2014-05-22 18:27:12,"It's apparent that #DOJ leadership, including Jack Smith, was closely involved in engaging with IRS in wake of Citizens United #IRStargeting",42,20
469544553696206848,2014-05-22 18:25:19,Mtg btwn #DOJ &amp; Lerner in Oct 2010 was to discuss potential criminal enforcement relating to pol speech of nonprofit groups #IRStargeting,34,16
469543345761832960,2014-05-22 18:20:31,"Smith's subordinate, Richard Pilger, told @GOPoversight investigators #DOJ met w/ Lerner in Oct 2010, 2.5 yrs earlier than previously known.",34,15
469542993914253312,2014-05-22 18:19:08,Today @Jim_Jordan &amp; I requested that #DOJ make PUblic Integrity Section Chief Jack Smith available for a transcribed interview #IRStargeting,25,17
469540030890119168,2014-05-22 18:07:21,White House Contacted YouTube during #Benghazi Attack  http://t.co/4ibhLflryX,184,47
469539872361828352,2014-05-22 18:06:43,WH was working on false #Benghazi narrative before Americans were out of harm's way or intelligence community examined available evidence.,232,72
469539634494853120,2014-05-22 18:05:47,The email shows the WH hurried to settle on a false narrative at odds with the conclusions reached by those on the ground. #Benghazi,108,37
469539503141814272,2014-05-22 18:05:15,Emails show that WH reached out to YouTube about an anti-Islamic video while #Benghazi attack was still underway and before CIA talking pts.,191,51
469510809107066881,2014-05-22 16:11:14,"The story of the #DATAAct, how a bill becomes a law in 2014: http://t.co/MJtHh0ZC8a",13,6
469467208436154368,2014-05-22 13:17:59,"House-passed #WRRDA cuts through red tape, strengthens trade, supports 13 million jobs, and contains zero earmarks. http://t.co/gYYJHr2Kes",29,21
469166641017008128,2014-05-21 17:23:38,Those early days of flight are great reminders of the innovation and ingenuity of Americans when they are free from government interference.,43,38
469164390466723841,2014-05-21 17:14:42,"Earhart's Lockheed Vega, pictured, &amp; the Spirit of St Louis are both at @airandspace on the National Mall. #avgeek http://t.co/CLZ5WYEqVM",20,23
469164074300084226,2014-05-21 17:13:26,"Five years to the day later, Amelia Earhart became the first woman to solo across the Atlantic in a red Lockheed Vega. #avgeek",9,12
469163930271903744,2014-05-21 17:12:52,"Photo of the Spirit of St Louis landing in San Diego, courtesy of the @SDASM archives. #avgeek http://t.co/cffRP7TnQP",29,30
469163791943749632,2014-05-21 17:12:19,"Today in 1927, Lindberg completed the first solo transatlantic flight in Spirit of St Louis.",20,26
469142158680014848,2014-05-21 15:46:21,RT @GOPoversight: Clusterboxes in today's Oversight markup of #USPS legislation. Do you have these boxes in your neighborhood? http://t.co/…,13,0
468884235450060801,2014-05-20 22:41:27,RT @GOPoversight: FACT: HR 4670--Secure Delivery for America Act--will save #USPS approx $2 Billion annually. http://t.co/OU7NUPDHGE http:/…,18,0
468831434221035520,2014-05-20 19:11:39,"You can read excerpts of the interview with Director of DOJ's Election Crimes Branch, Mr. Pilger, here: http://t.co/j3nPOqe3iC #IRStargeting",57,17
468831276401971200,2014-05-20 19:11:01,#DOJ refusal to allow Mr. Pilger to provide this info unduly impedes @GOPoversight obligations.,42,9
468831159561236480,2014-05-20 19:10:33,These matters are highly relevant to the @GOPoversight investigation of #IRStargeting.,24,8
468831046990319617,2014-05-20 19:10:06,Also refused to allow Mr. Pilger to answer whether he had communicated with any #IRS official since Lois Lerner's apology for #IRStargeting.,33,5
468830937556729857,2014-05-20 19:09:40,"Among other topics, the #DOJ lawyer refused to allow Mr. Pilger to answer Q's about convos within DOJ in the wake of Citizens United v. FEC.",40,8
468830791590772736,2014-05-20 19:09:05,"The #DOJ unilaterally, and without the agreement of the Committee, limited the scope of the interview to Mr. Pilger's interactions w/ Lerner",46,14
468830623642423296,2014-05-20 19:08:25,"During the interview with Mr. Pilger, a #DOJ lawyer directed him not to answer questions posed by @GOPoversight an astounding 34 times.",81,13
468830432675774465,2014-05-20 19:07:40,"The #DOJ has also obstructed @GOPoversight work during its transcribed interview of Richard Pilger, Director of DOJ Election Crimes Branch.",38,8
468830280426725376,2014-05-20 19:07:03,"As of today, the #DOJ has produced no documents in response to this request. #IRStargeting",79,12
468830085563568129,2014-05-20 19:06:17,"The letter sent to the #DOJ on April 23 requested that these documents be produced by May 5, 2014. #IRStargeting",41,6
468829840393904128,2014-05-20 19:05:19,Plus docs and communications referring or relating to the potential prosecution of tax-exempt applicants for statements made on #IRS forms.,23,8
468829681383661569,2014-05-20 19:04:41,The subpoena also covers #DOJ docs and communications between Lois G. Lerner and employees of the DOJ. #IRStargeting,49,15
468829565524402176,2014-05-20 19:04:13,The #DOJ subpoena covers docs referring or relating to applications for 501(c)(4) tax-exempt status. #IRStargeting http://t.co/j3nPOqe3iC,52,15
468829393465638915,2014-05-20 19:03:32,"Today I issued a subpoena to the #DOJ for documents previously requested by the Committee on April 23, 2014. http://t.co/j3nPOqe3iC",82,29
468783081219178496,2014-05-20 15:59:30,@icanhasbailout the business owners reside in San Diego County. The meeting was held at our DC office.,0,0
468782355633963008,2014-05-20 15:56:37,Speaking with constituents who are small business owners in the electrical field in San Diego County. #CA49 http://t.co/FBPWe9mWSJ,5,14
468730141250957313,2014-05-20 12:29:08,RT @GOPoversight: HEARING TOMORROW: #Medicare Mismanagement. Watch at http://t.co/62NUX2v8wi http://t.co/9OICMLXPzj,31,0
468478112796524544,2014-05-19 19:47:40,Check out this CH-47 Chinook filled with members of the 173rd Airborne. #MilitaryMonday. http://t.co/pKHD9ZWoDp,118,84
468429447822331905,2014-05-19 16:34:18,"Great to see USMC helos working with @CALFIRESANDIEGO, county and local firefighters. NBC7 VIDEO: http://t.co/bBJtvipIPM #CA49",12,17
467805450843717633,2014-05-17 23:14:45,"@PeterVanVoorhis thanks, Peter!",0,1
467722558666600448,2014-05-17 17:45:22,Happy #ArmedForcesDay! Many thanks to all of those who have and continue to serve our great nation. http://t.co/hGh9ScCjCy,72,64
467719131736076291,2014-05-17 17:31:45,RT @MCASMiramarCA: #3rdMAW #CH46s stationed @ #CampPendleton supporting firefighting activities on the base. @USMC #HMM364 http://t.co/Nra0…,60,0
467681818418757632,2014-05-17 15:03:29,CH-46E Phrogs working to protect MCAS Camp Pendleton from the new Pulgas fire on base. http://t.co/nT9JVBREph,34,20
467390421585256449,2014-05-16 19:45:34,"Our thoughts are with the fire fighters, families, &amp; four-legged friends affected by the ongoing fires. #FridayPuppy http://t.co/JfjfMgsMij",124,105
467362141537075200,2014-05-16 17:53:12,RT @GOPoversight: WATCH: @Jim_Jordan on #IRS targeting: American people's First Amendment rights were violated. http://t.co/oIaEGqhGow http…,64,0
467358935683719168,2014-05-16 17:40:28,"The @RedCross shelter at La Costa Canyon High School remains open: 1 Maverick Way, Carlsbad #SanDiegoFire",10,4
467358792624406528,2014-05-16 17:39:53,"The @RedCross is also transitioning Escondido High School to a shelter: 1535 N Broadway, Escondido, 92026 #SanDiegoFire",8,5
467358621249318912,2014-05-16 17:39:13,"The @RedCross is continuing shelter operations at Mission Hills High School: 1 Mission Hills Ct, San Marcos 92069 #SanDiegoFire",15,6
467332609413218304,2014-05-16 15:55:51,"@bennyjohnson @SenTedCruz looks good, but how's it sound?",1,6
467331998093414400,2014-05-16 15:53:25,Our veterans deserve this action and accountability.,33,25
467331950530011136,2014-05-16 15:53:14,"Next wk, House will vote on HR 4031 to make it easier to hold VA leaders accountable by demoting/firing those who fail in responsibilities.",61,33
467331745814441984,2014-05-16 15:52:25,"As #VA scandals across the country come to light, the federal gov must renew its commitment to our vets and work harder to meet their needs.",47,26
467310948781670400,2014-05-16 14:29:47,"Good morning, twitter. Recognize anyone on this list? #tbt http://t.co/a7N7o11dmg via @bennyjohnson",23,9
467310833408933888,2014-05-16 14:29:19,RT @SanDiegoCounty: Shelters still providing assistance to almost 250 people evacuated in #SanDiegoFires http://t.co/szrQKB5bBx,22,0
467055670395949058,2014-05-15 21:35:23,@dcfairbank -- @HouseVetAffairs is doing great work handling the situation. http://t.co/rteAPbVUIY,2,2
467031245889998848,2014-05-15 19:58:20,"PHOTO: Helos at Camp Pendleton to fight fires, incl CALFIRE Sky Crane and Bell 407, and SD Sherriff Blackhawks. http://t.co/hiX8bwJVmr",19,16
467023219573424128,2014-05-15 19:26:27,Reminder: @SDGE is asking for help conserving energy during the fires. Conservation tips here: http://t.co/SZDdOS9686 #SanDiegoFire,18,11
467017667535454208,2014-05-15 19:04:23,"@abdirmo FCC should focus on policies to promote competition &amp; innovation, not more unneeded regs.",6,6
467015090840272896,2014-05-15 18:54:09,"For San Diego residents, don't forget to follow @SanDiegoPD, @SanDiegoCounty, and @ReadySanDiego for emergency updates. #SanDiegoFire",17,17
467014567978352640,2014-05-15 18:52:04,"RT @211SD: City Hall, Faraday Center, Carlsbad Senior Center, Cole Library and the Library Learning Center remain open #PoinsettiaFire #San…",16,0
467009495324184576,2014-05-15 18:31:54,@TXTrendyChick thx!,1,2
467008961947127808,2014-05-15 18:29:47,@MichaelJFarrand YW. This info is also contained in the Committee's press releases. http://t.co/NCPkzTxx3S,2,1
467008433469014016,2014-05-15 18:27:41,@SusanDanzig219 State Dept under Sec Kerry failed to meet its legal obligations to comply with @GOPoversight subpoenas.,10,3
467005569539538944,2014-05-15 18:16:18,"The State Dept has an obligation to comply completely with @GOPoversight subpoenas, absent assertion of executive privilege. #Benghazi",45,15
467005440849903617,2014-05-15 18:15:48,These emails were apparently only turned over as the result of a judge's ruling in a FOIA case. #Benghazi,23,13
467005318703362050,2014-05-15 18:15:19,"These talking points encouraged an emphasis that the attack was ""rooted in an internet video, and not a failure of policy."" #Benghazi",24,12
467005112876285953,2014-05-15 18:14:30,Those previously withheld emails showed that WH official Ben Rhodes coordinated talking points for then-Ambassador Rice.,50,24
467004913890107393,2014-05-15 18:13:42,"On April 17, State Dept sent @GOPoversight a letter saying it was producing previously unreleased emails subject to prior subpoenas.",22,8
467004748294782976,2014-05-15 18:13:03,"Further accommodation will not be possible. Absent an assertion of executive privilege, State Dept has a legal obligation to comply fully.",41,23
467004626177630208,2014-05-15 18:12:34,"State Dept had discussed May 29 as a possible alternative date, and that's when Sec Kerry will be obligated to appear. #Benghazi",46,19
467004506086322176,2014-05-15 18:12:05,"With State's slippery tactics, it's no wonder our friends in the world are losing faith in us and our adversaries doubt our credibility.",59,34
467004362460762112,2014-05-15 18:11:31,State Dept then refused to commit to making Sec Kerry available. #Benghazi,29,9
467004253937336320,2014-05-15 18:11:05,"Shortly after I lifted the subpoena, State Dept back tracked--stating publicly that we should accept 'a more appropriate witness.' #Benghazi",41,10
467004106369150976,2014-05-15 18:10:30,The State Dept also said they were seeking a suitable alternative date for Sec Kerry to testify voluntarily. #Benghazi,22,8
467004001465425920,2014-05-15 18:10:05,I lifted the May 21 subpoena because State Dept made reasonable arguments for accommodation. #Benghazi,22,8
467003511449067520,2014-05-15 18:08:08,The hearing will be about the failure of Kerry's State Dept to comply with three subpoenas for documents as part of #Benghazi investigation.,76,32
467003290409263105,2014-05-15 18:07:15,"I've issued a new subpoena for Sec Kerry to appear for testimony at a hearing on May 29, 2014. #Benghazi",94,43
466725241931436034,2014-05-14 23:42:23,San Diego County fire help request: @SDGE asking for residents to save electricity &amp; gas.  See tips: http://t.co/OnssduC0NX #BernardoFire,25,8
466682459963154432,2014-05-14 20:52:23,You can read my full letter to Sec Sebelius here: http://t.co/KF4UJes5PW,43,22
466682399464513536,2014-05-14 20:52:09,"Absent that, HHS is required to produce all responsive docs to @GOPoversight in unredacted form.",18,11
466682327293120512,2014-05-14 20:51:52,... there may be a proper invocation of executive privilege that would allow HHS to withhold documents.,15,4
466682144220139520,2014-05-14 20:51:08,"If the President or other senior WH officials considered info about HealthCare dot gov prior to launch that affected President's decisions,",12,4
466682028004745216,2014-05-14 20:50:40,Only a valid assertion of executive privilege allows HHS to withhold docs from @GOPoversight.,19,10
466681668527734785,2014-05-14 20:49:14,"In February, representatives of the President's Office of Counsel confirmed that WH was withholding docs for further review.",45,18
466681432803655681,2014-05-14 20:48:18,"More than six months later, HHS still has not fully complied with the subpoena and has deliberately withheld key docs altogether.",50,21
466681278532972544,2014-05-14 20:47:41,"Because HHS did not reply with that request, I was forced to issue a subpoena for the requested docs on Oct 30, 2013.",21,17
466681094625329153,2014-05-14 20:46:58,"In Oct 2013, @SenAlexander and I requested docs related to the disastrous launch of HealthCare dot gov.",23,7
466680783852560384,2014-05-14 20:45:44,This failure to comply fully hinders the Committee's constitutional obligation to conduct oversight of the Executive Branch.,27,17
466680666718224384,2014-05-14 20:45:16,The substantial delays in HHS doc production combined with improper redactions has obstructed the @GOPoversight investigation.,27,16
466680534358589440,2014-05-14 20:44:44,I sent a letter to Sec Sebelius about willful failure of HHS to comply with @GOPoversight subpoena for docs related to healthcare dot gov.,33,22
466674289992019973,2014-05-14 20:19:55,Be sure you're following @SanDiegoPD and @ReadySanDiego for #BernardoFire #4SFire updates.,8,4
466582019540279296,2014-05-14 14:13:16,HIGH SCHOOL STUDENTS: Interested in design and coding? Design and submit an app to the House App Challenge! http://t.co/ge0j6gUuzp,23,12
466371502372581376,2014-05-14 00:16:45,#BernardoFire causing some neighborhoods to be evacuated. Follow @SanDiegoPD for updates.,14,1
465978069497696256,2014-05-12 22:13:23,State Dept to @GOPoversight: Will have Sec Kerry appear before Oversight shortly after Mexico trip. May 21st hearing postponed. #Benghazi,65,26
465952630863585281,2014-05-12 20:32:18,"RT @GOPoversight: ""We didn't run to the sound of the guns."" Cant-miss #Benghazi Q&amp;A by @jasoninthehouse: http://t.co/wX9kNuPWOz http://t.co…",82,0
465923749154656256,2014-05-12 18:37:32,The Washington Monument reopened for visitors today. Be sure to stop by when you're in town! #dc http://t.co/DFNkxEU6Er,31,40
465896031499333632,2014-05-12 16:47:24,@jpraab congrats!!,0,0
465886343873449987,2014-05-12 16:08:54,@AboutTheRock had a pretty good one myself!,1,1
465886022124183552,2014-05-12 16:07:38,"Howdy, twitter! It's a brand new week. How was your Mother's Day weekend?",11,16
465865268963848192,2014-05-12 14:45:10,Marines of the 31st MEU conduct launch and recovery ops in the East china Sea. #MilitaryMonday via @USMC http://t.co/MQF7ujvInP,42,43
465491894714523649,2014-05-11 14:01:30,"And a special Mother's Day thank you to my mom, pictured here in the late 60s with Ricky, Hope, and me. #MothersDay http://t.co/HKqS8Q9KjT",16,66
465491607869865984,2014-05-11 14:00:22,Happy Mother's Day to all the moms out there who love and support us! #MothersDay,29,43
465137858593185792,2014-05-10 14:34:41,"The #DATAAct was signed into law yesterday, &amp; will transform gov transparency by shedding light on runaway spending: http://t.co/c7armaHUYY",57,29
465131298106134528,2014-05-10 14:08:37,"RT @RepKevinBrady: Worth watching--&gt; Chairman @DarrellIssa provides a recap of the EPA hearing, plus key clips of witness testimony. http:/…",23,0
465131198214598656,2014-05-10 14:08:14,@_uptoolate_ that's a great #FridayKitty!,0,0
465130898527383552,2014-05-10 14:07:02,@ladybard lucky staffer for being loved by Truman!,0,0
464861486381166592,2014-05-09 20:16:29,"In honor of National Pet Week, meet Truman - a lucky rescue who found a home with one of my staffers.… http://t.co/nWall2BSM4",22,42
464793395291246592,2014-05-09 15:45:55,RT @GOPoversight: #USPS loses $1.9B in last quarter http://t.co/E9zLirPVHP,21,5
464780332483739648,2014-05-09 14:54:01,"In case you missed it, my segment with @seanhannity last night: http://t.co/G50eGnFsUy #Benghazi",32,22
464577242522476544,2014-05-09 01:27:00,RT @seanhannity: Downward spiral: Shinseki and Kerry subpoenaed while Lois Lerner held in contempt congressman @DarrellIssa joins me at 10p…,90,0
464538818696450048,2014-05-08 22:54:19,Building on the efforts of @GOPOversight the newly formed Select Committee on #Benghazi will work to pull the WH's deception into the light.,85,42
464538475619184640,2014-05-08 22:52:57,Today’s vote to establish a Select Committee on #Benghazi is an important step toward making the WH accountable to the American people.,87,62
464490774198239232,2014-05-08 19:43:25,"#TBT to 1966: riding a bike with a seat fastened specially for my sister, Willow. #throwbackthursday http://t.co/UZkd0plVt4",14,41
464482568591933440,2014-05-08 19:10:48,MT @HouseVetAffairs Here's a list of VA’s recent struggles in cooperating with Congress http://t.co/00qUtf1JkC #transparency,28,10
464455637964181504,2014-05-08 17:23:47,Buried in a March #GAO report: last year's sequester led to only one federal layoff. http://t.co/PtOHyEhcry,74,20
464422411258314753,2014-05-08 15:11:46,Dems won't support White House on postal reform: http://t.co/8CFSZc6Rac #USPS,27,9
464420030940475392,2014-05-08 15:02:18,RT @WW2Facts: A crowd gathers in Times Square celebrating with a newspaper announcing the surrender of Germany. #VEDAY #WWII http://t.co/Qp…,124,0
464419973214265344,2014-05-08 15:02:04,American soldiers marching in the victory parade down the Champs-Élysées. #VEDay #WWII http://t.co/LO8Od5gmcV,82,51
464419882810232833,2014-05-08 15:01:43,"Victory in Europe Day - celebrating 69 years! To America's greatest generation, my unwavering gratitude. #VEDay #WWII",47,38
464399684430491648,2014-05-08 13:41:27,Today's Judiciary hearing is on oversight of the proposed Comcast and Time Warner Cable merger. Watch live here: http://t.co/MbWRvAWaUH,19,7
464190474153390080,2014-05-07 23:50:07,"RT: @SpeakerBoehner: While Lerner refuses to account for her role in #IRStargeting, full force of law should be brought to bear",112,57
464188060943777792,2014-05-07 23:40:32,FULL STATEMENT on House contempt vote here: http://t.co/KzSdSjQGdf #IRStargeting,113,42
464187939963305984,2014-05-07 23:40:03,You can read the @GOPoversight report on Lerner's role in #IRStargeting scandal here: http://t.co/6xkcFjAyR4,53,21
464187854722465792,2014-05-07 23:39:43,"House also approved H.Res. 565, requesting appointment of a special prosecutor to investigate #IRStargeting, 250-168 w/26 Dems voting yes.",156,93
464187610819481600,2014-05-07 23:38:45,"The House approved. H.Res. 574, finding Lerner in contempt, on a vote of 231-187, with 6 Democrats voting yes. #IRStargeting",94,61
