id,created_at,text,retweets,favorites
456131541597302785,2014-04-15 18:06:48,Today marks the 1 year anniversary of the Boston Marathon bombing. We Remember!https://t.co/WkITl6CGFw #BostonStrong #UnitedWeRun,1,2
455809377841463297,2014-04-14 20:46:38,ICYMI: I appeared  on Fox News “America’s News Headquarters” @ANHQDC @FoxNews to discuss Attorney General Holder.  https://t.co/got8Otwdjv,5,1
455018944412135424,2014-04-12 16:25:44,"RT @ANHQDC: @farenthold: We've got to work with the administration, but they are stonewalling every investigation we are doing.",5,0
455013325655789568,2014-04-12 16:03:25,About to go on @FoxNews ANHQ to talk this week's Judiciary hearing with Eric Holder. Don't miss it!,3,1
454748345337401344,2014-04-11 22:30:29,"RT @loudobbsnews: Joining #loudobbstonight are @farenthold, @enderle, @gavin_mcinnes, @jedediahbila &amp; more, 7PM ET",5,0
454303905296678912,2014-04-10 17:04:26,Just voted to hold former #IRS head Lerner in contempt for refusing to testify on her dept.'s political targeting. Next: vote on House floor,10,9
454253212502343680,2014-04-10 13:43:00,Today in @GOPOversight we're voting on holding Lerner in contempt of Congress for refusing to testify on #IRS scandal http://t.co/gH7KX0P5IQ,4,4
454247532944580608,2014-04-10 13:20:26,I Support Equal Pay For Equal Work! RT if you agree! http://t.co/CP0W6CZbCo,6,4
453971525126090752,2014-04-09 19:03:40,"Right now in DC, @PoccaPort Chair Judy Hawley is testifying in the House on the economic benefits of #LNG exports: http://t.co/myXhHDO2Rg",2,1
453896051922329600,2014-04-09 14:03:46,"RT @GaryShapiro: MT @mpetricone: Thank you @RepJeffries + @farenthold! ""Patently Unfair: Why The Senate Must Act to Club the Trolls"" http:/…",2,0
453729413960843264,2014-04-09 03:01:36,"For the latest update from Matagorda Incident Command Post on the oil spill in Galveston Bay, check out my website: http://t.co/SxWfvSrB7t",3,1
453723115705876480,2014-04-09 02:36:35,"Why I didn't question Holder in @HouseJudiciary: If an American failed to comply w/ a DOJ subpoena, they'd be in jail http://t.co/IK1tUVyxZM",34,20
453592295083106304,2014-04-08 17:56:45,RT @hunterw: .@RepJeffries and @Farenthold wrote something for @businessinsider about (patent) trolling http://t.co/bIfGfKv6xR,5,0
453569784727482368,2014-04-08 16:27:18,RT @HouseJudiciary: Attorney General Eric Holder continues to testify before the Committee. Watch live: http://t.co/1LwroA1I1A. #HJC113 htt…,7,0
453537371620130816,2014-04-08 14:18:30,#Holder testifies for the 7th time- maybe today he’ll provide the American people with the answers they deserve. #7thTimesACharm?,13,5
453536809117822976,2014-04-08 14:16:16,NOW: Our @HouseJudiciary hearing on DOJ #oversight with Attorney General Eric Holder. WATCH:http://t.co/hK1Qybyof8,1,0
453405391221964801,2014-04-08 05:34:03,I'll be posting info on the TX City oil spill as it comes out &amp; updates on the cleanup effort on the TX Gulf Coast: http://t.co/Y3P0hqBwAW,1,0
453405258308657152,2014-04-08 05:33:32,"For the latest updates on the March 22nd oil spill in Galveston Bay, you can visit my website page: http://t.co/Y3P0hqBwAW.",1,0
453314504651464704,2014-04-07 23:32:54,#ICYMI: @kiii3news on the TX City oil spill recovery efforts &amp; my response after meeting with response officials: http://t.co/WMwrOtyvzy,1,0
453310086304526336,2014-04-07 23:15:21,"Saturday, I was briefed on the March oil spill &amp; its impact on beaches &amp; wildlife in our area. From @Newscenter25: http://t.co/da7ZbhFPZL",1,0
452615655716831232,2014-04-06 01:15:56,RT @Susannah_Sears: @patbolland @farenthold US Rep. Blake Farenthold on Operation Fast and Furious http://t.co/c9vMUMNe0w,7,1
452603343870111745,2014-04-06 00:27:00,Impressed w/ the great group working hard to protect our wildlife &amp; beaches &amp; confident this will be a great cleanup: http://t.co/XTuqnYgy8U,3,0
452603285791592448,2014-04-06 00:26:46,"Today, @USCoastGuard assured me, weather permitting, the Texas City oil spill situation will be successfully mitigated in a matter of weeks",3,1
452517618780352512,2014-04-05 18:46:22,In Port O'Conner getting briefed on impact and cleanup of the oil spill on the Aransas National Wildlife Refuge. http://t.co/364jkIqwEQ,5,3
452287658236968960,2014-04-05 03:32:35,Grrrrr. 2 hours late. #PastMyBedTime #NothingGoodHappensAfterMidnight http://t.co/JljqqnxgHD,1,2
452111853758328832,2014-04-04 15:54:00,met with a group of exceptional highschool students from Corpus Christi's School of Science and Technology today. http://t.co/OCLxlVEUIB,3,3
451864854736175104,2014-04-03 23:32:31,U.S. Capitol flag half-staff in tribute to those at Fort Hood #PrayForFtHood http://t.co/v0oydZj4Qm,7,4
451767476661932032,2014-04-03 17:05:34,"Met with Hanson, Wesley Shultz from The Lumineers, and Nashville songwriters Victoria Shaw and Gary Burr. http://t.co/fN9PLxtkpi",5,0
451737314319155200,2014-04-03 15:05:43,My staff helping me prep for my meeting with @hansonmusic to discuss copyright #grammysonthehill #MMMBop PHOTO: http://t.co/taLiCgkgAv,4,3
451720766862950400,2014-04-03 13:59:58,"Yesterday, I continued fighting for answers from ATF on #FastandFurious to ensure nothing like it happens again 
http://t.co/LjpynZlQJo",1,1
451515593951567873,2014-04-03 00:24:41,"#PrayForFortHood RT @KXAN_News Rep. Michael McCaul says 4 people, including the shooter, are dead. #FortHoodShooting http://t.co/aG1gHzIFB1",3,2
451506672033595392,2014-04-02 23:49:13,Our thoughts and prayers are with the military community and families of Fort Hood.,11,9
451500323753193472,2014-04-02 23:24:00,RT @WARojas: And here's what @farenthold saw http://t.co/k7K1tryrBZ #grammysonthehill,1,0
451500227909148672,2014-04-02 23:23:37,"RT @WARojas: ""Here. Take a picture for us"" -- @GOPWhip handed @farenthold his phone so he could sidle up to @ladyantebellum http://t.co/e0i…",2,0
451413813221658624,2014-04-02 17:40:14,I'm committed to working to ensure failed ops like #FastandFurious are never again repeated. From our #ATF hearing: https://t.co/AdnrGFE4gl,3,2
451379954123829248,2014-04-02 15:25:41,"New Developments in Fast and Furious Scandal, Old Administration Strategy to ‘Stonewall and Delay’ | @theblaze 
http://t.co/0UOadcFrCb",3,1
451374600996519936,2014-04-02 15:04:25,Proud to be supporting HR4323 reauthorizing Debbie Smith Act to end the backlog of DNA testing in @HouseJudiciary http://t.co/lN3wHXK8l0,4,0
451371107585888256,2014-04-02 14:50:32,NOW: my questioning of #ATF Director … on … WATCH: http://t.co/AN4EFGRTeP,5,1
451365247899926528,2014-04-02 14:27:15,"NOW in @GOPoversight, #ATF Director Todd Jones is testifying before us on #FastandFurious.WATCH HERE: http://t.co/AN4EFGRTeP",5,3
451358034900844544,2014-04-02 13:58:36,"B. Todd Jones, ATF Director testifying before @GOPoversight  heaeing on Reckless Investigative Techniques. http://t.co/3O3oLpymnV",6,0
451035981094088704,2014-04-01 16:38:52,ICYMI: @KIII3News reported aboard the USS Lexington during my 2014 Veterans Summit yesterday. WATCH HERE: https://t.co/7SNIYcCmrG,2,0
451010553776205824,2014-04-01 14:57:50,"We're not doing a good enough job taking care of our vets-it's taking months to keep our promises through the VA."" http://t.co/KyXWRb30Z2",2,0
450968519862009856,2014-04-01 12:10:48,Love flying out of Corpus Christi on the new @AmericanAir A319 mainline jet.  Always lots of friends aboard.,1,1
450834988167348224,2014-04-01 03:20:11,"Today, we helped keep our promises to our veterans by providing info on resources available to them. From @kiii3news: http://t.co/BQpZNebRkX",1,1
450737829409456129,2014-03-31 20:54:07,"REMINDER: Today, I’m hosting my annual Veterans Summit aboard the USS Lexington HAPPENING NOW-5:30 PM). Please RT &amp; spread the word!",1,0
450718408011972608,2014-03-31 19:36:57,"IT’S NOT TOO LATE! Register for the 2014 Veterans Summit going on NOW! 
http://t.co/0rM3zmkUeW",0,0
450717224857108480,2014-03-31 19:32:15,Great turnout at the 2014 Veterans Summit happening RIGHT NOW. http://t.co/lmGEIecPUM,2,0
450714897140035584,2014-03-31 19:23:00,Greeting a WWII Veteran at the summit today http://t.co/XmtOJjtiy3,3,4
450709897169338368,2014-03-31 19:03:07,Hope to see you today at my 2014 Veterans Summit on the USS Lex in Corpus Christi! HAPPENING NOW until 5:30 PM.,1,0
450708182344544256,2014-03-31 18:56:19,Judge Neal addresses the crowd at the Veterans Summit today. http://t.co/ytM925YkyR,1,0
450705787044626432,2014-03-31 18:46:48,Addressing the crowd at my 2014 Veterans Summit http://t.co/gjJIo74pbf,1,0
450696371301928961,2014-03-31 18:09:23,Hope you can join me aboard the USS Lexington for my 2014 Veterans Summit happening TODAY from 1-5:30pm! Register: http://t.co/meMBQGGUVy,0,0
450670457508093952,2014-03-31 16:26:24,"ICYMI: I appeared on @KRIS6News ""News at Sunrise"" to discuss my 3rd Annual Veterans Summit (1 PM- 5:30 PM) today https://t.co/L3rjBBNHv2",1,0
450640984242925568,2014-03-31 14:29:17,Appeared on @domingolive yesterday to discuss the Veterans Summit happening TODAY! WATCH HERE: https://t.co/fKPXXXCrE6,2,1
450599890289442816,2014-03-31 11:46:00,RT @KRIS6News: Congressman Blake @farenthold is live right now on #KRIS6 Sunrise http://t.co/dPV7Au2ZVx,2,0
450325056556912640,2014-03-30 17:33:54,"All veterans, active duty military &amp; their families are invited to attend my Veterans Summit tomorrow. Register here: http://t.co/Dyx3LRJsm3",2,0
450324998839074816,2014-03-30 17:33:41,"This morning, I stopped by @DomingoLive to discuss my Veterans Summit tomorrow (1:00-5:30 pm) on the USS Lexington: http://t.co/tMTGQLhw1K",0,0
449962475002142720,2014-03-29 17:33:08,At #WingsOverSouthTexas with Lago from @1360KKTX at NASKingsville Wings over South Texas airshow http://t.co/3IYggMF0jQ,3,2
449381201615142912,2014-03-28 03:03:22,My Field Rep Capt. Rene Coronado appeared on KRIS 6 News on my behalf to spread the word about the upcoming Veterans Summit. @KRIS6News,1,0
449243996783915008,2014-03-27 17:58:10,@TammaraMaiden1 you do know my step grandmother Sissy is still alive..,0,0
449197961214713856,2014-03-27 14:55:14,Signed onto H.R. 2591 today to support the fair treatment of airline employees &amp; pilots and protect their pensions: http://t.co/uSVZWbPxwN,0,0
448951608081403904,2014-03-26 22:36:19,"RT @RepSteveStivers: Another day, another White House, #Obamacare delay... http://t.co/3vuoVKg6Dt",48,0
448950711355580416,2014-03-26 22:32:45,"Another day, Another #Obamacare delay. @Sebelius claiming no #WH delay of March enroll deadline? More #BrokenPromises http://t.co/eiY076zlKS",7,3
448827590800048128,2014-03-26 14:23:31,NOW: @GOPoversight hearing on #IRS response to targeting scandal with IRS Commissioner John Koskinen. WATCH LIVE: http://t.co/TyA3c18lwa,0,1
448819040963018752,2014-03-26 13:49:32,I sent a letter to the Department of Commerce with my concerns about the US giving up jurisdiction over the Internet http://t.co/vBpW7rIgNE,5,1
448817754783891456,2014-03-26 13:44:26,"Just began the ""Examining the IRS Reponses to the Targeting Scandal"" in the @GOPoversight Committee. http://t.co/V3v6DOz5g6",1,0
448541393418342400,2014-03-25 19:26:16,Met with TX chapter of the National Emergency Number Assoc. in DC to talk 911 &amp; emergency communication issues. http://t.co/VkbSHgLr18,0,1
448522035400957952,2014-03-25 18:09:21,"I stand w/ #HobbyLobby's effort to go before #SCOTUS &amp; defend #religiousfreedom from #Obamacare. RT if you do, too: http://t.co/sU6u7wz3NH",13,7
448225877542043648,2014-03-24 22:32:31,Looking forward to having dinner with the @CCTXChamber tonight in DC to discuss all things Corpus Christi #cbtodc2014,2,1
448189173564862465,2014-03-24 20:06:40,Now: managing house floor to discuss postal naming bills watch live @cspan,5,1
446770030126977024,2014-03-20 22:07:30,"@TRAinDC No, I asked why it's so hard to licence music for videos, we need quick, simple and cheap online clearing house. like @GettyImages",0,0
446769234312318977,2014-03-20 22:04:20,"On Monday, I hosted a Veterans Roundtable to discuss a variety of issues that affect our veterans. http://t.co/YSXkA9vbBq",2,1
446743967195881472,2014-03-20 20:23:56,Meeting with the Port of Houston Commissioners after taking a tour of the port. http://t.co/6LylgIdgRD,1,0
446721987315240960,2014-03-20 18:56:36,Improve definitions in statues to catch true offenders,0,0
446721861100273664,2014-03-20 18:56:06,Attack the demand side,0,0
446721811737485312,2014-03-20 18:55:54,Proposed solution to human trafficking,0,0
446721454982561792,2014-03-20 18:54:29,"We must treat the victims as victims, not as criminals, and get them the help they need",0,0
446720080026402816,2014-03-20 18:49:01,"Thanking Ms. Cheryl Briggs, Trafficking survivor and founder of Mission at Serenity Ranch, for her testimony today http://t.co/ySGzllvJKl",0,1
446714040828456961,2014-03-20 18:25:01,"I am beginning my questioning of the 2nd panel at the human trafficking hearing in Houston, TX http://t.co/koWEjtY2da",1,0
446702231069265921,2014-03-20 17:38:06,The second panel has begun and focuses more on child trafficking http://t.co/D3WuV9fg2y,2,2
446697543020593153,2014-03-20 17:19:28,Panel 2 of the Homeland Security Hearing on human trafficking has begun follow it here http://t.co/jBqOoeAZGq,1,0
446696518997663744,2014-03-20 17:15:24,http://t.co/TC0IMe3xj4,1,0
446696118261665792,2014-03-20 17:13:48,I once again want to thank Chairman @McCaulPressShop for inviting me to the human trafficking hearing. Trafficking must stop in South Texas!,2,1
446694121575813121,2014-03-20 17:05:52,"The hearing has ended, I think we have the ability now to fix human trafficking in Texas",1,3
446693737981558784,2014-03-20 17:04:20,"Finished my questioning, learned social media has allowed traffickers a way around law enforcement. #wecanstoptrafficking",1,0
446692599420956672,2014-03-20 16:59:49,I am now asking question on human trafficking during the Homeland Security Committee hearing in Houston,0,1
446681939085635586,2014-03-20 16:17:27,The all Texas panel has begun asking questions on how to fix human trafficking,1,1
446681402504122368,2014-03-20 16:15:19,"RT @McCaulPressShop: Thanks to Reps Poe, Farenthold, Jackson Lee, Al Green and Gene Green for participating in today's hearing. http://t.co…",4,0
446680119328112640,2014-03-20 16:10:14,"Chief McClelland's testimony has started and is focusing on Texas, his insight is crucial in addressing human trafficking issues",0,1
446674302906408960,2014-03-20 15:47:07,"Sheriff Garcia of Harris County 
Assistant District Attorney Johnson in Harris County
Chief McClelland of @houstonpolice dept",2,1
446673077204561920,2014-03-20 15:42:15,"The witness list:
Special Agent Moskowitz in Immigration and Customs Enforcement
Director McCraw of @TxDPS http://t.co/brkWaxKuXo",3,1
446670949484462080,2014-03-20 15:33:47,Waiting for the first panel to share their insights on human trafficking http://t.co/SbwylXA8hY,1,0
446669808788963328,2014-03-20 15:29:15,"More than 110 imprisoned people freed in Houston yesterday. It is a start but we can do more.
http://t.co/8TXG7kwGh1 via @HoustonChron",0,0
446668619364458496,2014-03-20 15:24:32,The Human Trafficking hearing has started,2,1
446666096381558784,2014-03-20 15:14:30,You can watch the human trafficking hearing live at http://t.co/jBqOoeAZGq,1,0
446662346396950528,2014-03-20 14:59:36,I'm looking forward to talking about how we can address this important issue and work to end this form of modern-day slavery.,1,0
446662263513296896,2014-03-20 14:59:16,I was invited by Chairman Michael @McCaulPressShop to join today's discussion in Houston,0,1
446661868711870464,2014-03-20 14:57:42,About to participate in a Homeland Security Committee Field Hearing on what we can do to stop human trafficking.,1,0
446359221848657920,2014-03-19 18:55:06,"Yesterday, the President recognized 2 heroic South Texas veterans with the #MedalofHonor. http://t.co/6k1i9Rjdiy",1,1
445618071793713152,2014-03-17 17:50:02,RT @CallerAllison: .@farenthold wearing his St. Patrick green to today's Ed Board http://t.co/QgJTTDSDF7,2,0
445550247377637376,2014-03-17 13:20:31,On the air with Lago @1360KKTX,1,0
445550048655720448,2014-03-17 13:19:44,Sorry @VeraGorman @GOPoversight had a subcommittee hearing on that last week.  DOD prefunds Tricare. So USPS not alone prefunding,1,0
444286361550729216,2014-03-14 01:38:17,Had an interesting exchange w/ Grammy winner Maria Schneider at our #copyright hearing: https://t.co/96JwkRCOrQ #JustWantMusicOnMyCatVideo,1,0
444207721479671810,2014-03-13 20:25:48,Talking with Gov @TimPawlenty before our roundtable on tax reform &amp; issues affecting the financial services industry: http://t.co/siaon9nxSE,1,0
444184313371054082,2014-03-13 18:52:47,"NOW: I'm chairing our @GOPOversight subcmte hearing, ""At a Crossroads: #USPS' $100B in Unfunded Liabilities"" WATCH: http://t.co/0RG0VLZOFY",1,1
443464521353814018,2014-03-11 19:12:35,".@GraceDobushToGo THX for the honor! ""Rep. Blake Farenthold might have the most geek cred in Congress"": http://t.co/3VFze6JJWw #GeeksLikeMe",4,2
443457243691114496,2014-03-11 18:43:40,56 percent of Americans share #ZachGalifianakis' sentiments here: http://t.co/Q1412nmHjG #ObamaCare #Trainwreck #BetweenTwoFerns,0,0
443424577213825024,2014-03-11 16:33:52,@tray_pruet DC bound,0,0
443118921458384896,2014-03-10 20:19:18,"RT @EngineAdvocacy: President of @CEA @GaryShapiro interviews Rep @farenthold - lawyer, turned businessman, turned radio host before gov ht…",1,0
443091178519793664,2014-03-10 18:29:03,RT @rachelwolbers: @eburfield @farenthold it's hard for any startup looking to innovate in the regulatory space- anyone investing in drones…,1,0
443089589981696001,2014-03-10 18:22:45,"RT @rachelwolbers: @farenthold we need to look at all solutions to decreasing congestion- building roads is one part, but better technology…",1,0
443088995766247424,2014-03-10 18:20:23,RT @rachelwolbers: @LFlanagan consumer behavior is changing and those shifts will make things more local w/ less need for shipping products…,2,0
443088049891975169,2014-03-10 18:16:37,RT @rachelwolbers: @farenthold any government involvement in data sharing with transportation is going to be bottom up (in cities) not top …,1,0
443087053291810816,2014-03-10 18:12:40,"RT @rachelwolbers: @eburfield we've had a very tough time in the US getting congestion pricing, Americans believe it's their right to drive…",1,0
443086431431712768,2014-03-10 18:10:12,"RT @rachelwolbers: #bigdata panel: the sharing economy is just getting started, we're seeing a huge generational shift and a pay per use mi…",2,0
443085600501940225,2014-03-10 18:06:53,RT @rachelwolbers: @eburfield: we're dealing with a theme of scarcity when talking about transportation in cities- startups and cities have…,1,0
443085573289697281,2014-03-10 18:06:47,"RT @rachelwolbers: @eburfield startups need to talk to cities, but encourage the cities to not pick winners aka uber v. zipcar v. Car2go",1,0
443085556118192128,2014-03-10 18:06:43,"RT @rachelwolbers: @LFlanagan there are a lot of benefits to an open system, you can't just focus on the security and privacy concerns",1,0
443084608843034624,2014-03-10 18:02:57,RT @rachelwolbers: Largely cities are open to ideas about data sharing... But look at the über situation. You need to be mindful of the dea…,1,0
443083176169447424,2014-03-10 17:57:15,RT @rachelwolbers: What is the right framework for transportation data sharing between public-private partnership? @farenthold: consider se…,1,0
443082547283890176,2014-03-10 17:54:46,RT @rachelwolbers: @farenthold we're seeing a decreased transportation trust fund with less gasoline sales- do we switch to a miles driven …,1,0
443081402385702914,2014-03-10 17:50:13,"RT @rachelwolbers: @farenthold we need to make transportation more efficient, particularly in cities where you have a finite amount of spac…",1,0
443080642822414337,2014-03-10 17:47:11,"RT @rachelwolbers: @LFlanagan discusses a number of startups that are making it easier to travel, but the big issue is how much do we share…",1,0
443079113029746688,2014-03-10 17:41:07,"RT @rachelwolbers: Zip car founder highlights the fact that the company took 12 years to build, but blew up when cell phones &amp; parking apps…",1,0
443079101709287425,2014-03-10 17:41:04,RT @rachelwolbers: How do we put in to place transportation sharing that work with cities &amp; fed gov? Answers coming from #bigdata panel htt…,5,0
443075340534317056,2014-03-10 17:26:07,RT @rachelwolbers: Getting ready to live tweet @farenthold @eburfield @LFlanagan panel on big data and blowing up transportation #sxsw #big…,2,0
443071164014133248,2014-03-10 17:09:32,"Sunday, I appeared on @FoxNews @ANHQDC to talk Lois Lerner's refusal to answer our questions on #IRS scandal. #ICYMI: http://t.co/mF3IPqWaVn",3,1
443069051771031552,2014-03-10 17:01:08,Cone see my panel on data and transportation policy at the Radisson Riverside Ballroom with @zipcar &amp; @1776dc at 12:30 pm CT #SXSW,3,2
443055698105364480,2014-03-10 16:08:04,With @TexGov Perry at the Governor's Mansion for the Entertainment Software Association breakfast: http://t.co/HT4kQUWq4G,0,1
442781450661027840,2014-03-09 21:58:18,"#picstitch from the Microsoft Lounge: with @DarrellIssa, trying on digital video virtual worlds, and… http://t.co/GtqlFq2QwT",2,5
442767294247481344,2014-03-09 21:02:03,Thanks @mpaa! MT @TheCredits: Rep. @farenthold nabbing one of our limited edition posters at #thecreditslounge #SXSW http://t.co/fSRSPokbFV,2,1
442710592034320386,2014-03-09 17:16:44,"RT @ontheroadwithiv: Can't wait for ""#BigData &amp; Sensors: Blowing Up Transportation"" panel tmw w/ @lflanagan @farenthold @eburfield! #SXSW h…",3,0
442692368484294656,2014-03-09 16:04:20,About to be on @FoxNews America's News HQ to talk Lois Lerner pleading the 5th on her department's involvement in the #IRS scandal. Tune in!,5,4
442412222266892288,2014-03-08 21:31:08,At #DellVenue at SXSWI with @RepKinzinger @JudgeCarter @judgeand @RepChuck talking to @LisaGatDell,3,0
442391997023019008,2014-03-08 20:10:46,RT @rachelwolbers: Data Foundry tour in Austin! @farenthold  @EngineAdvocacy @DataFoundry @Dell @IBM Geeking out w/Texas.net http://t.co/PA…,2,0
442386522533146624,2014-03-08 19:49:00,RT @EngineAdvocacy: Our own  @juliepsamuels with @farenthold and @repjeffries - 3 leaders on patent reform #fixpatents #SXSW http://t.co/h5…,2,0
442128792950423552,2014-03-08 02:44:53,With Julie Samuels from Engine Advocacy and @Wired's Steven Levy at facebook #SXSW party http://t.co/lY5GX0vHhz,6,3
442065000027680770,2014-03-07 22:31:23,"RT @rachelwolbers: @farenthold &amp; @AlanSchoenbaum we wish that we could have seen CBM &amp; PGR strengthened in the bill, but the legislative pr…",2,0
442064625765711872,2014-03-07 22:29:54,"RT @rachelwolbers: @juliepsamuels bill targets trolling behavior, does not specifically define a troll.",1,0
442064028530393088,2014-03-07 22:27:32,RT @rachelwolbers: @RepJeffries makes great comparison to securities law reform to patent reform- both laws are better off today &amp; stopping…,1,0
442064019785265152,2014-03-07 22:27:30,RT @rachelwolbers: @juliepsamuels bad patents are patents that patent every way to so something instead of a specific way to do something,2,0
442062380525420544,2014-03-07 22:20:59,"RT @rachelwolbers: @AlanSchoenbaum small startups have weapons at their disposal, don't give up and get as much information as you can to f…",2,0
442062365102997504,2014-03-07 22:20:55,RT @rachelwolbers: @juliepsamuels the patent system is out of control and no patent troll will speak up to defend themselves,2,0
442061476585807872,2014-03-07 22:17:23,RT @rachelwolbers: The PTO is definitely underfunded but the Innovation Act is trying to level the playing field for small businesses being…,1,0
442059658543783936,2014-03-07 22:10:10,"RT @rachelwolbers: Text ""trolls"" to 52886 to tell your representative to do something about patent reform!",2,0
442059576649588736,2014-03-07 22:09:50,"My SXSW patent panel: @RepJeffries, Julie Samuels @EngineAdvocacy, Alan Schoenbaum @Rackspace, Michael Petricone @CEA http://t.co/CjUAAUeJGY",2,1
442058779040157696,2014-03-07 22:06:40,RT @rachelwolbers: @AlanSchoenbaum @farenthold @RepJeffries call to action: email @SenatorLeahy and @SenatorReid and tell them to move pate…,3,0
442057802778165248,2014-03-07 22:02:47,RT @rachelwolbers: @farenthold don't underestimate the power of grassroots advocacy to move the senate! go to http://t.co/Xpn5r4gDAj to tel…,1,0
442056885878132736,2014-03-07 21:59:09,RT @rachelwolbers: @juliepsamuels- this problem exists largely in the software space because trolls are armed with crappy software patents …,3,0
442056870325682177,2014-03-07 21:59:05,RT @rachelwolbers: @AlanSchoenbaum- the fundamental reason we have this problem is bc the justice system is not set up for small businesses…,1,0
442054702386397185,2014-03-07 21:50:28,"RT @rachelwolbers: @farenthold &amp; @RepJeffries: heightened pleading, discovery reform &amp; fee shifting are the most significant provisions of …",1,0
442054135970803712,2014-03-07 21:48:13,"RT @rachelwolbers: @juliepsamuels ""the small companies &amp; the startups are driving our economy but they are hit the most often by patent tro…",1,0
442052649727557632,2014-03-07 21:42:19,"RT @rachelwolbers: @RepJeffries ""I thought patent trolls was a bit of a derogatory term and then I realized, it was actually a gentile way …",1,0
442052357988569089,2014-03-07 21:41:09,"RT @rachelwolbers: @mpetricone ""this wasn't a democrat problem or a republican problem, patents are an american problem"" #bipartisantech",1,0
