id,created_at,text,retweets,favorites
306914788531916802,2013-02-27 23:52:42,Doing a live conference call w/ your Congressman tonight from Washington. Keep the questions coming! http://t.co/h6aRTTv2I6,0,0
306908318876704768,2013-02-27 23:26:59,Starting Conference call with your congressman at 5:30 CST.  If we don't call you you can call us. : (877) 229-8493; Passcode: 111392,0,0
306901688588058624,2013-02-27 23:00:39,About to skype in to @kiii3news with @KiiiRudyTrevino to talk sequestration http://t.co/erkoJ44e8B,1,0
306868265509072896,2013-02-27 20:47:50,"RT @tedcruz: .@TexasGOP ""welcomes"" Obama supporters to the Lone Star State. A few things they should know… http://t.co/B60Ine1ho0 #KeepTXRed",67,0
306818289496121344,2013-02-27 17:29:15,The topic of the @GOPoversight subcommittee hearing is reducing fed travel costs #cutwaste,5,0
306818039477833729,2013-02-27 17:28:15,About the Chair the 1st @GOPoversight  federal workforce subcommittee hearing. Starts @ 12:30 &amp; webcase live here:  http://t.co/g5kP5NujsD,0,0
306783457051279360,2013-02-27 15:10:50,it's been 293 days since the House first voted to replace the #obamaquester while #POTUS &amp; Senate Dems have failed to do their part,2,0
306776278407729152,2013-02-27 14:42:19,"&lt;geek mode ON&gt; @GOPoversight ""Time to reform IT Acquisition: The Federal IT Acquisition Reform Act"" &lt;/geek&gt; http://t.co/2g5lGoa4Rm",1,0
306755467995148288,2013-02-27 13:19:37,"Discussing sequestration and Army Organic Industrial Base @ Depot Caucus B-fast with Gen. Via and assistant Secs Mateilla, Hammack &amp; Shyu.",0,0
306424304713748480,2013-02-26 15:23:41,"In response to some of my D colleagues last night, I took to the House floor to talk Sequester.. http://t.co/BlLrRhNx7t",0,0
306420548378976256,2013-02-26 15:08:46,At Judiciary subcommittee hearing on @USAirways and @AmericanAir merger.  Anyting y'all want me to ask?,1,0
306201259751374851,2013-02-26 00:37:23,"On House Floor to honor American Hero, Rep Sam Johnson on the 40th anniversary of his release from N Vietnam POW camp @SamsPressShop",1,0
306078477407371264,2013-02-25 16:29:30,.@FoxNews reporting gas prices in Feb. the highest ever recorded for that month. We need a comprehensive energy solution to stabilize gas $$,2,1
306023272594690048,2013-02-25 12:50:08,"It's Monday that means i""m on Lago @1360kktx.",0,0
304764891426856962,2013-02-22 01:29:47,At National LULAC week 17th Annual Community Leaders Award Banquet at the Omni Corpus Christi,1,0
304671259940229121,2013-02-21 19:17:43,Corpus named as 1 of the top 10 outperforming cities in the recovery My high school friend Gene quoted in the article http://t.co/NUJSk23gXT,0,1
304466141076680705,2013-02-21 05:42:39,@NativeTXDem I'd love to vote NO on  gun reg. props.  Would also love 2C  D's vote against the 2nd amendment... ended well 4 y'all in 94.,0,0
304465198910156800,2013-02-21 05:38:54,@Axslash house has passed sequester replacement.  Talk to the Pres and D senators.,0,0
303941489430523904,2013-02-19 18:57:52,Just took a spin down I-35 in the @google self driving car #waycool #IWantOne #GoogleCar http://t.co/0oFz6sfK,6,2
303901293225848834,2013-02-19 16:18:09,RT @TxDOT: We can't wait! MT @RepRWilliams: Headed 2 @TxDOT #TxTransForum 2 discuss TX #transpo priorities. On panel w/ @RepCuellar &amp ...,6,0
303874542584094721,2013-02-19 14:31:51,Headed to @TxDOT #TransForum to discuss Texas transportation priories heading forward. On panel w/ @RepCuellar and @RepRWilliams,2,0
303576039894949888,2013-02-18 18:45:42,Matagorda County received exciting news Friday. @TenarisUSA to invest $1.3B to build new pipe plant &amp; create 600 jobs http://t.co/2H6OPZPX,1,0
303517907776847874,2013-02-18 14:54:43,It's Monday morning so I'm on KKTX Lago in the Morning 6-9am CT. Have a busy work week in the District coming up! http://t.co/5qZ5ohN8,0,0
302578210019872768,2013-02-16 00:40:41,@keithkurth in Texas for a week.  DM me or call the Corpus Christi office at 361 884 2222,0,0
302481849463209985,2013-02-15 18:17:47,"Heading home to celebrate the anniversary of the best decision I ever made, marrying @darlindebcc",0,1
302119094809948161,2013-02-14 18:16:19,"Attending Oversight energy subcommittee mtg ""The Effects of Rising Energy Costs on American Families and Employers"" @GOPoversight",1,0
301873313175707649,2013-02-14 01:59:41,Attended the @LULAC awards dinner 2nite to celebrate the achievements of ppl who are expanding opportunity 4 Hispanic Americans.,1,0
301790536279392256,2013-02-13 20:30:45,Headed 2 the House floor to talk about the life &amp; service of Chief Petty Officer Chris Kyle. His death is a tragedy we will mourn many yrs,4,2
301546457041887232,2013-02-13 04:20:52,"A video of my #SOTU reaction. http://t.co/lgV2zHJ3 Lots of ideas from POTUS, but no ways to achieve them...",0,0
301544623724167168,2013-02-13 04:13:35,"AAAK!  No audio on my phone  @kiii3news .  The producers are working on it.  As a Radio/TV/Film guy, this is what nightmares are made of.",0,1
301540753077829632,2013-02-13 03:58:12,On @kiii3news  at 10:05 CST to talk #SOTU,0,0
301539263722442752,2013-02-13 03:52:17,"#SOTU in brief: Campaign Speech with no Hows.  We all believe in the American Dream, Mr. Pres. but your policies make it harder to achieve.",5,1
301522332554502144,2013-02-13 02:45:00,"Let's do what works, Mr. President. The Texas model. We've been named the top state for growth the last 8 yrs in a row #SOTU",14,1
301521932002684929,2013-02-13 02:43:25,What we need to do to help biz expand and grow is lower taxes and lessen the burden of complying with gov't red tape.. #SOTU,5,2
301520854314000384,2013-02-13 02:39:08,Agreed Mr. President. Gas prices are too high. They've increased by 92% since you took office. #SOTU,19,3
301520030112301056,2013-02-13 02:35:51,"POTUS says we need to invest in R&amp;D, but the medical device tax in his healthcare plan will deeply hurt companies ability to do so #SOTU",9,0
301518834601426944,2013-02-13 02:31:06,POTUS asks how do we ensure hard work leads to the American Dream? By allowing free enterprise to work #SOTU,1,0
301509707380711424,2013-02-13 01:54:50,Get the facts in real time by following the GOP #SOTU reaction here: http://t.co/xoUz41cg,0,0
301509497493532672,2013-02-13 01:54:00,Hopeful the President will explain how to reverse the trend of declining incomes and rising costs of goods and healthcare at tonight's #SOTU,2,0
301462885438214144,2013-02-12 22:48:47,We need a credible plan to avoid the President's sequester and expand opportunity for hardworking Americans #SOTU,0,0
301401863016828928,2013-02-12 18:46:18,I’m hopeful POTUS won't double down on tax increases and failed polices in tonight's #SOTU We need new solutions to put people back to work,0,0
301352013256609792,2013-02-12 15:28:13,RT @Heather_Poole: I'll take one. Great for parties...MT What will the TSA do with all the x-ray scanners sitting around? @skiftnews htt ...,5,0
301348317378523136,2013-02-12 15:13:32,Interesting fact: today in 1924 Calvin Coolidge became the 1st President of the United States to deliver a political speech on radio.,2,0
301342419197243392,2013-02-12 14:50:06,RT @Heritage: Happy Birthday Abraham Lincoln! Please RT to join us: http://t.co/zPerTPHo,278,0
301098763395665921,2013-02-11 22:41:54,"MT @uschamber announced its 100 best in small business today http://t.co/lisIvi1l
13 of the 100 are in the Lone Star state.",0,1
301037724050259969,2013-02-11 18:39:21,Interesting article today in @politico previewing tomorrow night's SOTU http://t.co/evaH94pt  POTUS said to focus on job creation,0,0
300945450943524864,2013-02-11 12:32:41,"Monday mean's i""m on Lago on @1360KKTX.  District Director Bob Haueter joins us at 6:30 Central. What will  @BarackObama say at SOTU?",0,0
300031473946333184,2013-02-09 00:00:52,"RT @RES2Caller: more on @farenthold, @JulianCastro from D.C. on #PathwaytoCitizenship  http://t.co/dahrUN8F @callerdotcom @callerpolitics",1,0
299658677487534081,2013-02-07 23:19:30,Sent letter 2day w/ @RepFilemonVela 2 Sec. Panetta urging him 2 spare our local military bases from sequestration cuts http://t.co/T2ygu0gl,0,0
299597251154702336,2013-02-07 19:15:25,Blog post yesterday by @danielhalper from @weeklystandard about USPS modification to 5 day delivery. check it out! http://t.co/AuC3JUv7,1,0
299589973928198144,2013-02-07 18:46:30,"RT @RES2Caller: 
@farenthold in the house @Corpus Christi State of City. @callerpolitics",0,0
299585001442406400,2013-02-07 18:26:45,At State of the city listening to Corpus Christi  Mayor Nelda Martinez. http://t.co/NGjIK9xa,0,0
299305800378224640,2013-02-06 23:57:18,I was interviewed on @FoxNews today about the #USPS switch to 5 day delivery. Watch the interview here http://t.co/mIyq53d2,2,0
299247516401164289,2013-02-06 20:05:42,"RT @ChadPergram: Postal Subcmte Chair Farenthold applauds decision by Postal Service to cut 6 day delivery. Says it's a ""core"" goal of G ...",2,0
299247479751340032,2013-02-06 20:05:33,RT @ChadPergram: Postal Subcmte Chairman Blake Farenthold (R-TX): We don't need the federal gov't bailing out the Postal Service.,4,0
299247458712702976,2013-02-06 20:05:28,RT @ChadPergram: Postal Subcmte Chair Farenthold says he would be willing to do a Postal reform bill this year if it can't solve its own ...,1,0
299247325895872512,2013-02-06 20:04:56,"RT @DarrellIssa: .@GOPOversight #USPS subcommittee chair @farenthold calls @USPS's modified delivery ""a step in the right direction"" htt ...",5,0
299177016220073984,2013-02-06 15:25:33,Check out this article from the @callerdotcom about my recent visit to the new VA Clinic in Corpus Christi http://t.co/Ebr8e5Aq,0,0
299173765290545152,2013-02-06 15:12:38,I think it's a responsible plan. RT @ABCPoliticsUS Postal Service to End Saturday Mail Delivery http://t.co/lCysvoxr,0,0
298912159180673028,2013-02-05 21:53:06,I'm going to be on the Eric Von Wade show tomorrow morning @ 7:30AM CST/ 8:30AM EST. Listen live here: http://t.co/iKyfHHPl,1,0
298910915955417089,2013-02-05 21:48:10,RT @ChadPergram: President Obama first proposed the sequester and insisted it become law.  Republicans have twice voted to replace these ...,16,0
298595977701494785,2013-02-05 00:56:43,Voted yes tonight for HR 297 to reauthorize medical residency training programs @dchstx and other pediatric hospitals.,0,1
298471274383044608,2013-02-04 16:41:11,As Chairman of the Subcommittee overseeing Postal issues- its my duty to know these things. The USPS will release a Rosa Parks stamp today.,1,1
298431849678643200,2013-02-04 14:04:32,Last half hour filling in for Lago @1360KKTX. We want YOUR calls 361-560-5589.  Off to DC at 8:30 CST.  IHeartRadio http://t.co/jZ2OjXVl,1,0
298423704638074882,2013-02-04 13:32:10,Congressman Tery Gowdy @tgowdysc joining me at 7:34 as I fill in for Lago today on @1360KKTX Listen at http://t.co/jZ2OjXVl,0,0
298405894109159424,2013-02-04 12:21:23,Filling in for Lago on 1360KKTX.  http://t.co/jZ2OjXVl Live Now.,0,0
298264754454159361,2013-02-04 03:00:33,Dodge Farmer ad moves ahead of godaddy nerd kiss in my book,3,0
298263756641808384,2013-02-04 02:56:35,I'd say #fail RT @DRUDGE_REPORT: Energy Dept: 'Super Bowl City Leads on Energy Efficient Forefront'... http://t.co/r20AzOH4,1,0
297784678381924352,2013-02-02 19:12:54,"If the Pres really went shooting ""all the time"" as he suggests.. he would have a different opinion on 2nd amendment rights. #23EOs",2,0
296655375422324739,2013-01-30 16:25:27,"Hot topics at port of Houston briefing: handling post PanaMex, Eagle Ford and LNG increases in traffic.",1,0
296652432115646465,2013-01-30 16:13:46,At Port of Houston homeland security briefing with @McCaulPressShop @OlsonPressShop @RepGeneGreen @RepAlGreen @JacksonLeeTX18 Randy Weber,0,0
296641542221856770,2013-01-30 15:30:30,At a homeland sec roundtable with @HouseHomeland Chairman Michael McCaul. Discussing how to improve port security. http://t.co/z6QuTE3V,0,0
295705738960048128,2013-01-28 01:31:57,Spoke at the @AIPAC event in Houston. Reaffirmed our steadfast commitment to Israel and preventing a nuclear Iran http://t.co/hq2M38Pe,3,0
295294610564067328,2013-01-26 22:18:16,"Here's something you don't see often. Only 7 seats taken.  Good for me, bad for @United. http://t.co/8PBt8vM5",0,1
295193742246285312,2013-01-26 15:37:27,"@TxSkirt I guess if I used words like ""vexes"" I'd garner more followers.  You are such a wordsmith, Wendy.",0,1
294923397291466752,2013-01-25 21:43:12,Never got my license plate renewal form in the mail.  There goes the rest of this afternoon waiting in line. #fail http://t.co/gr7bkXw3,2,1
294164014089519105,2013-01-23 19:25:40,I supported #nobudgetnopay b/c it holds Congress accountable. America's problems will not be solved by preserving the status quo...,4,0
293750597272870914,2013-01-22 16:02:54,Here are some pics from yesterday's #inaug2013.  I tried to live tweet but there was no service around the Capitol.  http://t.co/vTK9tDAk,0,0
293497327291871232,2013-01-21 23:16:30,Representing South Texas today at #inaug2012 was an honor.  Fitting to celebrate the Constitution &amp; equal rights for all on #MLKday,0,0
293375266787577857,2013-01-21 15:11:28,Gathering with fellow Congressmen on the House floor to head to inauguration,1,1
293094331533905920,2013-01-20 20:35:08,American families set a budget so they can pay their bills. Washington MUST do the same. A balanced budget leads to #theAmericanDream,2,1
292700424971104256,2013-01-19 18:29:54,In the office today as close to 100 South Texans pick up their #inaguration tickets we were able to secure for them. http://t.co/bpglGalC,0,0
292654866621399041,2013-01-19 15:28:52,A step in the right direction: TSA removing backscatter strip search scanners. http://t.co/lf29VzVD (one is used at @CCIntAirport ),0,0
292043797272072194,2013-01-17 23:00:41,"Ok @IngrahamAngle -funny: Given how the GOP base is feeling about Congress post-election, I might have picked a word other than 'retreat.'",3,1
291707022997598208,2013-01-17 00:42:28,"Pres Obama's proposal violates the #Constitution, circumvents Congress &amp; has been proven not to be effective in preventing gun violence!",6,1
286587660439543808,2013-01-02 21:39:57,"RT @GOPoversight: Rep. Blake @Farenthold to Chair New Federal Workforce, U.S. Postal Service, and the Census Subcommittee http://t.co/cb ...",10,0
284460445807542272,2012-12-28 00:47:09,"#RIP General Norman Schwarzkopf, a modern general who restored public faith in America's military. ",1,1
284283632607170562,2012-12-27 13:04:34,RT @lanieflores: Got to interview Congressman Blake Farenthold today. Pretty cool and he's a really nice guy :) http://t.co/DUq1h9R9,2,0
281974403892379648,2012-12-21 04:08:31,@neatknitz already have and then some,0,0
281432343770701824,2012-12-19 16:14:34,"Met @BenAffleck  who is testifying on  evolving security situation in the Congo before  @HASCRepublicans.  http://t.co/orpc8EB2",0,0
280746901488422912,2012-12-17 18:50:51,"RT @GOPLeader: Tonight, the House will observe a moment of silence in honor of the victims of the Sandy Hook Elementary School shooting  ...",61,0
280705786236243969,2012-12-17 16:07:29,Congrats to my friend @RepTimScott -  I guess it will be @SenatorTimScott now.,0,0
280650156217626626,2012-12-17 12:26:26,RT @1360KKTX: Get the week started with Lago. Conressman Blake Farenthold in with Jim this morning. http://t.co/Gr6U14GB,1,0
279701010937675777,2012-12-14 21:34:52,At Texas Tech for my daughter Morgan's graduation http://t.co/Mp4wUxk6,0,1
279629522712817664,2012-12-14 16:50:48,"RT @DailyToreador: Hance is introducing Congressman Blake Farenthold from District 27, TX. His daughter will be graduating from Tech today.",2,0
278880092086743040,2012-12-12 15:12:49,RT @cspan: House Oversight (@GOPOversight @OversightDems) hearing on Human Growth Hormone use in @NFL – LIVE on C-SPAN3 http://t.co/25gT61BN,10,0
278150435066490880,2012-12-10 14:53:26,"RT @SpeakerBoehner: RT @GOPWhip: via @BloombergNews: ""Republicans firm against higher tax rates"" http://t.co/NYxFZ8eM #FiscalCliff #taxes",41,0
277594255441158146,2012-12-09 02:03:22,Congrats to Johnny Manziel for winning the  Heisman Trophy.  Johnny Football and the Aggies... Only in Texas..,2,0
277048952107462656,2012-12-07 13:56:32,Thank a #veteran today as we remember the 71st anniversary of Pearl Harbor and all they have done today to protect our great nation.,10,1
276414347268476928,2012-12-05 19:54:50,4 ATF officials recommended to be fired by ATF review board for their involvement with #FastandFurious STORY: http://t.co/ERwVyxM2,13,0
275980924469002240,2012-12-04 15:12:34,"Attending Transportation &amp; Infrastructure Committee hearing, ""A Review of the Preparedness, Response to and Recovery from Hurricane Sandy.""",0,0
275665156883755008,2012-12-03 18:17:49,Facebook photo album of my @united @boeing #787 #dreamliner tour  @IAH  #aviationgeek http://t.co/Ht6vMrLR,0,1
275627831415947264,2012-12-03 15:49:30,@united tried to talk them into taking the Dreamliner out for a spin.  #noluck.,0,0
275614635904860161,2012-12-03 14:57:04,At IAH about to tour @united #787 #Dreamliner http://t.co/wBMIQ90O,0,1
274608383083020288,2012-11-30 20:18:35,Looks like @united forgot to pay their direct TV bill #upintheair #flyinghome http://t.co/tFaYfkCI,2,1
274571265677864961,2012-11-30 17:51:05,RT @replouiegohmert: #FF #TXGOP # @JudgeTedPoe @SamsPressShop @RepHensarling @RepJoeBarton @PeteSessions @JudgeCarter @farenthold,4,0
274539554143350784,2012-11-30 15:45:05,House has voted to make sure there is no #my2k tax rate hike on any family or #smallbiz. Will Dems cut spending to stop #fiscalcliff?,0,0
273830080873115648,2012-11-28 16:45:53,Have a question for GOP House Members? Tweet them at us from 10-2pm CT using #AskRSC @republicanstudy,0,0
273829550645972992,2012-11-28 16:43:47,ICYMI- @TexasTribune Hot Seat conversation @IslandCampus http://t.co/PrWLzPmg,0,0
273798082527903747,2012-11-28 14:38:44,"@washingtonpost ""To save the nation’s finances, the president has to be bigger than his party"" http://t.co/YJkmapgB",0,0
273155159863988224,2012-11-26 20:03:59,RT @RES2Caller: @Farenthold @RepToddHunter on the hot seat #triblive http://t.co/fPlPUoD0,1,0
273155055673278464,2012-11-26 20:03:34,ICYMI - @ANHQDC interview on Egyptian President Morsi's power grab and whether the peace talks in Israel will hold --&gt; http://t.co/CI08bBX7,0,0
272713099482656768,2012-11-25 14:47:24,ON THE AIR with @ANHQDC at 12:30pm CT discussing President Morsi's power grab and the latest in the Administration's story on Benghazi,0,0
271677694620622848,2012-11-22 18:13:04,"My girls, Debbie, and I wish everyone a Happy Thanksgiving! We are so thankful for the blessings we enjoy in this great nation.",0,1
271282685069103104,2012-11-21 16:03:26,@jennyrogersDC  CBS affiliate in Dallas germ tested various areas on airplane.s  The story is here:  http://t.co/KmFqAVbf,0,0
271260330263453697,2012-11-21 14:34:37,As someone who is on a plane a lot this was disgusting. http://t.co/KmFqAVbf Seatback pocket was the worst! #ThanksgivingTravel #yuck,1,0
271252588295495681,2012-11-21 14:03:51,Did you know that part of every phone bill supports a gvt funded free phone program? My interview on this -&gt; http://t.co/mgBykeQc,0,0
270954971334336512,2012-11-20 18:21:13,"RT @IslandCampus: Join @evanasmith from the @TexasTribune, @toddahunter, and Blake @farenthold for ""The Hot Seat"" at #TAMUCC on Nov. 26! ...",1,0
269617407033757696,2012-11-17 01:46:14,"Tonight's Fortune Cookie, ""Travel is in your future"" yep, about 9 hours and 15 minutes in my future. http://t.co/h3r8Fcb6",0,0
269506774250446848,2012-11-16 18:26:36,RT @DarrellIssa: #FF Your @GOPOversight Watchdogs: @TGowdySC @RepDennisRoss @Farenthold @RepMikeTurner @GOPoversight,19,0
269091042870042624,2012-11-15 14:54:38,I will be presiding over the House Floor this morning starting at 9:45 am CT. Check it out LIVE here --&gt; http://t.co/77C0cRaP,0,0
268730731243659265,2012-11-14 15:02:53,"NEWSLETTER: ""I am optimistic we will start meaningful work on tax reform, job creation and immigration reform."" http://t.co/nTwXMs8z",0,0
267689643556892672,2012-11-11 18:05:59,"Today we recognize our #Veterans  who bravely sacrifice to protect our families, liberties and freedoms. Thank you for keeping America free.",6,2
267403060979044352,2012-11-10 23:07:12,Happy 237th Birthday @USMC! Your sacrifices keep this country the land of the free and home of the brave.,0,0
266943217499521024,2012-11-09 16:39:57,OUR NEW DISTRICT: Check out the new boundary lines for Texas’ 27th Congressional District PIC: http://t.co/vjQaCHsG,2,3
266683014535335938,2012-11-08 23:26:00,"JUSTICE: Man who shot @GabbyGiffords, killed six and wounded 12 in Tuscon shooting sentenced to life in prison PIC: http://t.co/rX6OHLBr",1,0
266615596429500416,2012-11-08 18:58:06,Seeking an out before @GOPoversight calls him back to testify over #FastandFurious Attorney General #Holder announces he may quit.,1,1
266614999261265921,2012-11-08 18:55:43,Disastrous Attorney General #Holder  announces he may quit @justicedept LINK:    http://t.co/rmKJCjSj,0,0
266614410091581440,2012-11-08 18:53:23,HEADLINE: #Holder Announces He Might Not Stay On As Attorney General   http://t.co/rmKJCjSj He should have resigned over #FastandFurious,1,0
266593859558064129,2012-11-08 17:31:43,"@ForeignAffGOP schedules 1st open hearing on #Benghazi for Nov 15. Inviting @StateDept, Secretary of State Hillary Clinton. #WeWantTheTruth",0,0
266352881752489984,2012-11-08 01:34:10,LIVE: #Hu Jintao delivers annual political report to National Congress of the Communist Party. I will NOT let #China eat our lunch.,0,0
266160626886381568,2012-11-07 12:50:13,In other news... did we get the truth about #Benghazi yet?,9,0
265830846953574400,2012-11-06 14:59:47,"It's Election Day, the polls are open in Texas. Go #Vote! #tcot",5,0
264448686497607680,2012-11-02 19:27:34,ON THE AIR with @ARNNRadioNews tonight at 6:15pm CT to talk about today's dismal job numbers and the House Republican plan #4jobs,0,0
264424512714571776,2012-11-02 17:51:31,"Mr. President, where are the #jobs? We can do better! PIC: http://t.co/dPWbabrF",1,0
264397036890255360,2012-11-02 16:02:20,#FF #Libya #watchdogs: @DarrellIssa @JasonintheHouse  @tgowdySC @RepGosar @RepMikeTurner,1,0
264388504610553857,2012-11-02 15:28:26,How does Labor Secretary @HildaSolisDOL respond to persistently high unemployment? See for yourself ---&gt; http://t.co/BE1ASoaP,0,0
264356035987390464,2012-11-02 13:19:25,Unemployment and underemployment rates remain stagnant as incomes continue to decline and the national debt grows. #tcot,0,0
264354038420750337,2012-11-02 13:11:28,"October's jobs numbers remind us that @BarackObama's economic plan hasn't worked, and 7.9% unemployment is the best he can do.",0,0
264347537882894337,2012-11-02 12:45:39,Visiting with @Eric_von_Wade on SportsRadioCC 'till 8,0,0
264184167867236353,2012-11-02 01:56:28,"What did @GOPoversight #Watchdogs get on from @WhiteHouse on #Libya? Stonewalling, delaying, and denying.",2,0
264183533243883520,2012-11-02 01:53:57,An entire forest must've given its life in paper as @GOPoversight asks @WhiteHouse 4 #Libya documents MUST READ: http://t.co/r4XhRuJl,1,0
263701865466834945,2012-10-31 17:59:59,"From my family to yours, have a happy and safe #Halloween PIC: http://t.co/yXZgjeTF",2,1
263262303594618880,2012-10-30 12:53:19,Our thoughts are w/all those affected by #Sandy. To support @RedCross relief efforts text REDCROSS to 90999 or go to http://t.co/UHKQFBw4,0,0
263029577654362113,2012-10-29 21:28:32,"As #Sandy intensifies, my D.C. office will be closed tomorrow. Please direct your inquiries to my Corpus Christi office at (361) 884-2222",1,0
262903441712619520,2012-10-29 13:07:19,On Lago @1360KKTX 'till 9a,0,0
262691052471865345,2012-10-28 23:03:22,"Due to #Sandy, my Washington D.C. office will be closed tomorrow. Please direct your inquiries to my Corpus Christi office at (361) 884-2222",1,0
262362900088373248,2012-10-28 01:19:24,"Wishing my friend @MarcoRubio and his family well this evening, #GetWellAmanda",0,0
261861987707912193,2012-10-26 16:08:57,I Always do! RT @IslandCampus @farenthold We hope you enjoy the summit and your visit to our campus!,0,0
261853727357562880,2012-10-26 15:36:08,At @toddahunter 's  Higher Education and Public Education Summit #how2worldsmeet @IslandCampus #TAMUCC,0,0
260792039619321857,2012-10-23 17:17:22,#ObamaCare Guts Medicare Advantage. How? ANSWER: http://t.co/WBe9zSTt @GOPOversight,9,1
260746549699682306,2012-10-23 14:16:36,NEWSLETTER: Important #Medicare Open Enrollment dates for South Texas Seniors Link: http://t.co/g3uvxivP,2,0
260373168613650432,2012-10-22 13:32:55,Thanks @ShopfloorNAM for recognizing me w/the Manufacturing Legislative Excellence Award. #Manufacturing means #Jobs! http://t.co/dwpbSo9U,0,0
259384059808075776,2012-10-19 20:02:33,RIP #BigTex PIC: http://t.co/wcRAkuSH,2,0
259344520548855808,2012-10-19 17:25:27,.@StateFairOfTX RIP #BigTex 1952-2012 http://t.co/HDLO6GbB,1,0
259342272926203904,2012-10-19 17:16:30,#FF  @CamAndCompany @HEB  @RES2Caller @Soledad_OBrien @RepRibble @Whataburger @RepBuerkle @DelMarCollege,0,0
258985865420873728,2012-10-18 17:40:16,RT @DarrellIssa: Wishing @GOPOversight Watchdog @RepDennisRoss a very happy birthday.  Your @SpeakerBoehner birthday song: http://t.co/J ...,9,0
258955545250258944,2012-10-18 15:39:47,Corpus Christi is at the center of a historic shift in global crude oil trading LINK: http://t.co/Nnsh5PtQ,1,1
258706603207954435,2012-10-17 23:10:35,"NEWSLETTER: Security Failures in Benghazi, #Libya LINK:  http://t.co/x1EoN8Or",0,0
258262925888864256,2012-10-16 17:47:34,ICYMI my @congressblog OP-ED on @GOPoversight hearing on failures that led to the Benghai terrorist attack http://t.co/7dIRZUqo,2,0
