id,created_at,text,retweets,favorites
421361146986504192,2014-01-09 19:21:40,No one with pre-ex conditions can be denied health coverage anymore—remind your kids to sign up! #MomKnowsBest,4,2
421359454689689601,2014-01-09 19:14:57,Ins companies can no longer drop anyone when they get sick. Remind your kids to enroll. #MomKnowsBest,6,1
420936441175085056,2014-01-08 15:14:02,"Read my op-ed in Houston Chronicle, ""No. 1 job for House: Extend emergency unemployment aid"" http://t.co/LCGrRNhCdW",7,2
420696981250379776,2014-01-07 23:22:31,At the White House discussing Unemployment Compensation benefits.,0,0
420696978545061888,2014-01-07 23:22:30,I posted a new photo to Facebook http://t.co/Sj2skuTcXs,0,0
420696975801978880,2014-01-07 23:22:29,I posted a new photo to Facebook http://t.co/0S3pI8zEOJ,0,0
420696973193146368,2014-01-07 23:22:29,I posted a new photo to Facebook http://t.co/DQeEi7MFS8,0,0
420696970580078592,2014-01-07 23:22:28,I posted a new photo to Facebook http://t.co/7NNbuWMYGq,0,0
420696967862157313,2014-01-07 23:22:27,I posted a new photo to Facebook http://t.co/s4346uyhFL,0,0
420696965278482433,2014-01-07 23:22:27,I posted a new photo to Facebook http://t.co/KL9B0nb95n,0,0
420696962698985472,2014-01-07 23:22:26,I posted a new photo to Facebook http://t.co/MggG9EwiTA,0,0
420675949445672960,2014-01-07 21:58:56,"At the WH, @JacksonLeeTX18 , Members of Congress and the President strategize to extend unemployment insurance. http://t.co/iGAK5hrH1E",6,4
420588344901263360,2014-01-07 16:10:50,Senate declares #unemployment is an emergency.  It is an emergency.  Time for the House to extend UI for 3.9 million Americans.,14,6
420356064022777857,2014-01-07 00:47:50,Congratulations to #JanetYellen on her confirmation as Fed Reserve Chair. Another glass ceiling shattered.,20,14
420351844141907968,2014-01-07 00:31:04,"Millions are facing economic emergency, which will turn into catastrophe for them &amp; their families if UI benefits not extended immediately.",4,0
420350462047428608,2014-01-07 00:25:34,Does anyone think $300 average weekly UI benefits discourages jobhunters from seeking work? Ridiciulous. Extend emergency UI benefits now.,7,3
420346944674750464,2014-01-07 00:11:35,On way back to DC to join POTUS at WH to meet &amp; hear untold stories of jobless Texans &amp; others about urgent need to extend UI benefits now.,2,2
419319982712164352,2014-01-04 04:10:49,"RT @birdflyoverlake: ""Extremists have shown what frightens them most: a girl with a book."" - Malala Yousafzai http://t.co/JUL1yTUdOa",19,0
419319086141960193,2014-01-04 04:07:15,RT @Eugene_Robinson: Eugene Robinson: The Affordable Care Act is here to stay. Now let's go further - The Washington Post http://t.co/UuQYN…,53,0
419206782473342976,2014-01-03 20:41:00,POTUS acts today to strengthen federal background check system to keep guns out of potentially dangerous hands. http://t.co/wBpZjL811C,10,6
418480784266125313,2014-01-01 20:36:08,"Happy New Year and wishing for America and the world to end hunger, violence and the lack of safe housing for children",3,2
418480519681044480,2014-01-01 20:35:05,Wishing Barbara Bush a speedy recovery and a quick return home to Pres. HW Bush and Family.,2,4
415310309151109120,2013-12-24 02:37:48,ACA sign-up deadline extended by 1 day to accommodate more than 1 million persons rushing to sign up for #Obamacare. http://t.co/LBPJkoxdoj,10,4
415302771978416129,2013-12-24 02:07:51,"AK-47s have caused more deaths than artillery fire, airstrikes &amp; rocket attacks combined. About 250,000 people killed each year by AK-47s.",15,4
415282429608206336,2013-12-24 00:47:01,I will never forget my friend Mandiba. The world will not soon see the likes again of the great #NelsonMandela. http://t.co/I1H4z16WX0,11,7
415280759956459521,2013-12-24 00:40:23,The recommendations of outside experts is constructive contribution to debate regarding NSA’s surveillance program. http://t.co/DKE8nWPsLD,1,1
415259633251414016,2013-12-23 23:16:26,"I agree with POTUS that violence will harm people of South Sudan and its progress. Conflict must be resolved thru negotiation, not by force.",2,1
413793350697766912,2013-12-19 22:09:57,"I'm honored to be named 'Champion for Children' by First Focus Campaign for my workd in protecting &amp; improving future"" of our children.",4,2
413709779828084736,2013-12-19 16:37:52,"Thanks to the ACA, 7,536,000 Texans no longer have to worry about having their health benefits cut off after they reach a lifetime limit.",19,10
413707905716592640,2013-12-19 16:30:25,"357,000 young adults in Texas have gained health insurance because they can now stay on their parents’ health plans until age 26.",3,0
413707666561572864,2013-12-19 16:29:28,"233,100  TX seniors and people with disabilities have saved $866 on average on prescription drugs as ACA closes Medicare’s “donut hole.”",3,1
411722137041264640,2013-12-14 04:59:41,"Glad that House passed H.R. 3509, ""Assessing Progress in Haiti Act of 2013.” #Haiti still needs our help.  http://t.co/7QC7TEDHVu",4,1
411721191045349376,2013-12-14 04:55:56,I was proud to join my Congressional Black Caucus colleagues in paying tribute to #NelsonMandela on House floor. http://t.co/htZNZdVEHF,5,2
411720176032178176,2013-12-14 04:51:54,"I was honored to pay tribute to Nikki Mayes, the 1st black woman Doorkeeper of the House, upon her retirement. http://t.co/Uzebi0AIwB",2,1
411682114292051969,2013-12-14 02:20:39,Congress must extend unemployment insurance to 3.9 million Americans who remain jobless thru no fault of their own. http://t.co/GKUPj71Zvz,5,2
411677487282663424,2013-12-14 02:02:16,I demanded a clean vote on extending unemployment insurances to 3.9 million Americans who need help.  http://t.co/ip2KYio3T5 via @cspanvl,11,0
411280681554432000,2013-12-12 23:45:30,RT @ajws: Assessing Progress in Haiti Act of 2013 passed the House!!! Thanks @RepEdRoyce @RepEliotEngel @RepBarbaraLee @YvetteClarke @Jacks…,6,0
410837837513113600,2013-12-11 18:25:48,@WaysMeansCmte: Pressure at home builds on House #GOP to #RenewUI via @ThePlumLineGS http://t.co/fwehcMUyns http://t.co/v5CRxSlj95,6,1
410837689198706688,2013-12-11 18:25:12,RT @WaysMeansCmte: Pressure at home builds on House #GOP to #RenewUI via @ThePlumLineGS http://t.co/aWUbGFCepi http://t.co/bvh72j9GnC,70,0
410542940457426944,2013-12-10 22:53:59,Congratulations to @MelWattNC12 on his confirmation as FEDERAL HOUSING FINANCE AGENCY (FHFA) DIRECTOR.,3,1
410526749198270464,2013-12-10 21:49:38,Congratulations to @mtbarra for being named the 1st CEO of a major automaker.,4,1
410458175490387968,2013-12-10 17:17:09,Celebrating the Life of Nelson Mandela http://t.co/kQkaxs3kzx,9,2
410431661172469760,2013-12-10 15:31:48,Honoring the life of Nelson Mandela http://t.co/UYhWYLYK2y,3,1
409166238099578881,2013-12-07 03:43:27,I was honored to share my reflections of #NelsonMandela today with Tamron Hall @TamronHall on MSNBC @NewsNation. http://t.co/UaxJBXMTfz,5,3
408722839928184832,2013-12-05 22:21:33,My prayers and condolences go out to the people of South African and the family of #NelsonMandela who now belongs to the ages.,13,7
408001581968551936,2013-12-03 22:35:32,Please join me for my upcoming 19th Annual Toys for the Kids Event here in Houston next week.,2,0
407941137828433920,2013-12-03 18:35:21,Congresswoman Sheila Jackson Lee supports #Fast4Familes and Comprehensive Immigration Reform,4,1
407938962351591424,2013-12-03 18:26:42,Rep. Jackson Lee supports #Fast4Familes. We need Comprehensive Immigration Reform Now http://t.co/vHU0b1IAxe,5,3
404109983056273408,2013-11-23 04:51:42,"JFK saw nexus b/t 1863 and1963: “this Nation, for all its hopes and all its boasts, will not be fully free until all its citizens are free.",7,4
404108510125760512,2013-11-23 04:45:51,JFK never stopped thinking about America and he understood that we all had a place in that future and a role in bringing it about. #JFK50,4,5
404107541426098176,2013-11-23 04:42:00,No one better symbolized the nation’s vitality and sense of purpose and unlimited possibility than did President John F. Kennedy.  #JFK50,11,5
404107076718170113,2013-11-23 04:40:09,President Kennedy may be gone but he will never be forgotten. His works – the ‘glow from that fire’ – truly lit the world. #JFK50,8,3
403564054762909696,2013-11-21 16:42:23,Looking forward to being on @Crossfire tonight at 6:30pm,5,1
400699798342234112,2013-11-13 19:00:51,Congratulating @nancycbarnes on her appointment as the next Executive VP at the @HoustonChron Look forward to working with you.,2,1
400661527537393664,2013-11-13 16:28:46,"Congresswoman Sheila Jackson Lee, Congressman Gene Green, Congressman Al Green and the City of Houston

Patient... http://t.co/G8UT9xDi4V",1,2
400653228204777472,2013-11-13 15:55:48,Pay attention to your health signs &amp; symptoms. Know which adult &amp; children’s health warning signs merit medical attention #HoustonHealthFair,1,1
400646902502273025,2013-11-13 15:30:39,I am excited to invite you to this Health Fair in order to receive essential health screenings &amp; services for your family #HoustonHealthFair,6,1
400646416764137472,2013-11-13 15:28:44,"The Health Screening &amp; Health Services Fair will be held at the George R.Brown Convention Center in Houston,TX.9am to 1pm in Exhibit Hall A3",3,1
397883167308120065,2013-11-06 00:28:34,Tough play may okay on football field but #bullying and harassment should have no place in #NFL locker rooms.,2,3
397835493779337217,2013-11-05 21:19:07,All #Texans fans continue to pray for Coach Kubiak's speedy recovery &amp; look forward to him returning to the sidelines soon and leading team.,5,3
396431717352755200,2013-11-02 00:21:01,LAX shooting is reminder of need to enact sensible legislation to reduce gun violence &amp; keep dangerous weapons from dangerous persons.,9,6
396430773764374529,2013-11-02 00:17:16,My sympathies and prayers go out to the family and loved ones of the TSO killed today at LAX and to the other victims of this heinous act.,2,2
395619791333236737,2013-10-30 18:34:43,"RT @WhiteHouse: Before #Obamacare, Gregg couldn't afford health insurance.

Now, he's covered for just $32/month.

#GetCovered, http://t.co…",215,0
393939191467626496,2013-10-26 03:16:36,RT @NancyPelosi: This is why we cannot wait any longer to pass comprehensive immigration reform. The #timeisnow: http://t.co/RQnf6o5Qec,389,0
393840959777406977,2013-10-25 20:46:16,RT @AzerbaijanNOW: Azerbaijan - Israel's Best Strategic Ally in the Region: http://t.co/AkPDcWDy8o #AzerbaijanNOW #Azerbaijan #Israel @Pres…,1,0
393840037550649344,2013-10-25 20:42:36,"RT @BettyMcCollum04: 11 years ago today, #Minnesota &amp; our nation lost great leaders. Remembering Paul &amp; Sheila Wellstone as well as Marcia,…",9,0
393839832587567104,2013-10-25 20:41:47,RT @OversightDems: VIDEO: #ACA Website Contractor Senior VP REFUTES @DarrellIssa's Allegation Of White House-Meddling http://t.co/lKTmP6Z086,15,0
391671601621528577,2013-10-19 21:06:01,Read my op-ed explaining how we can reform immigration system and  secure borders this year -  http://t.co/YBcw8wn9yc via @HoustonChron,7,1
391603142489432064,2013-10-19 16:33:59,Bum Phillips was a giant of a man and coach. I considered him a friend. He was a great coach. My sympathy to his family on their loss.,3,1
391354884584263680,2013-10-19 00:07:30,"My thoughts and prayers are with family of Rep. Bill Young of Florida, a colleague, patriot, and dear friend. He will be missed greatly.",1,3
391321213709996032,2013-10-18 21:53:42,"Press Release

LET US NOT FIRE BUT LET US FIX THE LIFELINE FOR SO MANY AMERICANS - THE AFFORDABLE CARE ACT... http://t.co/ATNTDFhJw9",1,1
391306034670628864,2013-10-18 20:53:23,CONGRESSWOMAN SHEILA JACKSON LEE APPLAUDS THE SELECTION OF JEH JOHNSON AS SECRETARY OF HOMELAND SECURITY... http://t.co/A2toCq7LTf,5,3
391278713574158336,2013-10-18 19:04:49,$24 Billion for Speaker Boehner to educate Tea Party Caucus! Could've funded 3 million college scholarships instead. #GOPshutdown,8,3
391277520005255168,2013-10-18 19:00:05,"$24 Billion for Speaker Boehner to educate Tea Party Caucus! Could've funded 320,000 kids in Head Start for 10 years instead. #GOPshutdown",20,8
391276555344703488,2013-10-18 18:56:15,"$24 Billion for Speaker Boehner to educate Tea Party Caucus; could've hired 360,000 teachers instead http://t.co/uipyIhxEbG via @HuffPostPol",5,5
391052582476451842,2013-10-18 04:06:15,Read my op-ed explaining why I voted to end manufactured Tea Party crisis and ensure USA pays its bills. #GOPshutdown http://t.co/sGUJrBBcnC,12,10
390988600122159104,2013-10-17 23:52:01,"Attending the @linkinc Evening of Excellence in Leadership with colleagues @RepBeatty, @RepCorrineBrown, @RepMarciaFudge, and @RepEBJ.",2,3
390667601568747520,2013-10-17 02:36:29,Proud I voted to end #GOPshutdown and prevent default. Now it's time to reopen the government and get to work doing the people's business.,20,12
390629263168114688,2013-10-17 00:04:08,The Senate has acted to answer the call and now the House needs to vote to reopen the government.,8,2
390605514054180864,2013-10-16 22:29:46,Can't Get No Satisfaction #GOPplaylist,31,16
390324323434921984,2013-10-16 03:52:25,RT @BarackObama: An economic shutdown could cripple America's recovery. Tell Congress to #EndThisNow: http://t.co/8t0cNTUAZJ http://t.co/dh…,1200,0
390318902942523392,2013-10-16 03:30:52,We're 24 hours out &amp; the most vulnerable Americans are calling for the retirement of the Tea Party and for real patriots to act for us all.,12,10
390311420933316608,2013-10-16 03:01:09,Americans are looking for unselfish leaders. How many Members of Congress will answer the call to reopen government &amp; save us from default?,17,7
389931048781357056,2013-10-15 01:49:41,GOP has already hurt Americans by shutting down government. It now risks shutting down the American economy and causing global recession.,20,3
388038987475980288,2013-10-09 20:31:18,I am at #whitehouse with President Obama making it real &amp; trying to help our fellow Americans by ending #GOPshutdown and reopening US govt.,12,7
387939372722839553,2013-10-09 13:55:28,Congresswoman Sheila Jackson Lee and other Lawmakers speak on our Military Families and them not receiving Death... http://t.co/jc1NcWPw3F,3,1
387606026515533824,2013-10-08 15:50:52,Dear Constituents of the 18th Congressional District - please send me a brief note on how this Government... http://t.co/DoGXL6bV1l,5,0
387588439832408065,2013-10-08 14:40:59,The poll shows that 65% think Congress should provide funding to keep the government operating &amp; deal with the health care issue separately.,7,5
387245910637297664,2013-10-07 15:59:54,"FACT CHECK - George Stephanopoulos to Speaker Boehner, 'Are You Sure That's True?' http://t.co/ZQTXLLzOUO",11,0
387245601777152000,2013-10-07 15:58:40,"#GOPshutdown in 3 videos: who did it: http://t.co/rPRdFBG2En , who owns it: http://t.co/J2p1BUDYcP , how to end it: http://t.co/FanrtWwVgK",6,1
387245540137639936,2013-10-07 15:58:26,Majority of House wants to pass senate-passed CR. @SpeakerBoehner should end  #GOPShutdown today and let the House vote. #DemandAVote,11,0
385078372184756225,2013-10-01 16:26:53,Jennifer Hudson uncovers the real scandal with the Affordable Care Act: http://t.co/b7ahDTWMHK via @funnyordie #GetCovered,5,0
385078268337991680,2013-10-01 16:26:28,"What is the #ACA all about? It’s your health care, made simple.  Check out http://t.co/7WfY0R0S2Z and #getcovered.",2,1
385078179095797761,2013-10-01 16:26:06,"If you're one of millions of Americans who need health insurance, today is the day to #getcovered! Check out http://t.co/7WfY0R0S2Z now!",3,1
385071385589972992,2013-10-01 15:59:07,http://t.co/46o553ypts http://t.co/dZggq6Nlbs,2,0
384891734653542400,2013-10-01 04:05:15,"House Rs forced a #GOPshutdown. Who pays? The American people, who will see national security severely curtailed by cuts and furloughs.",45,8
384891585671864320,2013-10-01 04:04:39,Congressional Republicans know what it takes to keep government open. Instead they #shutdown the government.  It's just plain wrong.,8,6
384891381593804801,2013-10-01 04:03:50,House Republicans forced a #GOPshutdown that will hurt our economy. Why? To put insurance companies back in-charge of your health care.,42,10
384891279445737473,2013-10-01 04:03:26,"House Republicans just delivered Americans dysfunction, partisanship, and a #GOPshutdown. RT to tell GOP to drop their extreme demands.",10,0
384798143834906624,2013-09-30 21:53:21,RT @RepCuellar: Shutting down government will not stop #ACA – it will just hurt Americans #enoughalready #GOPshutdown http://t.co/fa5vJjrfy…,10,0
384798041649082368,2013-09-30 21:52:57,RT @repmarkpocan: The #GOPShutdown could tank our economy... http://t.co/FqafgPJ7L3 via @CNN  RT if you say #EnoughAlready to Tea Party hos…,15,0
384798019498934273,2013-09-30 21:52:51,"RT @NancyPelosi: A quick lesson on governing well: Do work for the people, Don't shut down the government. http://t.co/xNB5VJ1zkO #GOPshutd…",169,0
384794881836580864,2013-09-30 21:40:23,The #GOPShutdown could tank our economy... http://t.co/3Z8qdQnvqJ via @CNN  #EnoughAlready,12,2
384794809640038400,2013-09-30 21:40:06,RT if you agree. Speaker Boehner should pass a clean bill today &amp; avoid a #GOPShutdown. #EnoughAlready,16,1
384794628269953024,2013-09-30 21:39:23,"#GOPshutdown would jeopardize WIC benefits for pregnant women, infants and young children http://t.co/DHWb9ipIQA",11,1
384794406651301888,2013-09-30 21:38:30,"National Institute of Health researches medical cures for life-threatening illnesses, #GOPShutdown means life-saving research is stops.",5,0
384794304918458369,2013-09-30 21:38:06,"#GOPShutdown means National Park facilities and services will be closed, a huge loss to local economies that rely on travel &amp; tourism.",11,3
384794098193797120,2013-09-30 21:37:16,"Enjoy visiting National Parks with your family? Under #GOPShutdown, all facilities and services will be closed, including the Smithsonian.",9,0
384793985216045056,2013-09-30 21:36:49,"Thanks to #GOPShutdown, the Small Business Admin will stop approving applications for small biz loans, an important driver of our recovery.",3,0
384793863824486400,2013-09-30 21:36:20,#GOPShutdown means housing loans for low/mid income fams in rural communities &amp; start-up business loans for farmers &amp; ranchers put on hold.,4,0
384793707460820992,2013-09-30 21:35:43,"House R's have America on course for #GOPShutdown. Tomorrow, hundreds of thousands of Fed employees face furloughs &amp; many will work w/o pay.",5,0
384752600425308160,2013-09-30 18:52:22,RT if you oppose the #GOPShutdown. #EnoughAlready. http://t.co/zDrzTBmkCK,21,0
384752426462375936,2013-09-30 18:51:41,RT @RepBarbaraLee: Holding the Affordable Care Act hostage is unacceptable!  RT if you oppose the #GOPShutdown. #EnoughAlready. http://t.co…,191,0
384751536221720577,2013-09-30 18:48:09,I posted a new photo to Facebook http://t.co/RZrjeTrmuh,0,0
384692010340585472,2013-09-30 14:51:37,I posted a new photo to Facebook http://t.co/GFSakpKqdX,2,0
384686231528812544,2013-09-30 14:28:39,"#GOPshutdown would jeopardize WIC benefits for pregnant women, infants and young children http://t.co/DHWb9ipIQA",5,0
384686148821319681,2013-09-30 14:28:19,69% Percent of Americans think Republicans “acting like spoiled children” #GOPshutdown,7,3
384685825612455936,2013-09-30 14:27:02,GOP Lawmakers: House Could End Standoff With Up-Or-Down Vote On Clean Bill http://t.co/1qLABMFUgB via @HuffPostPol,6,1
384151779920719872,2013-09-29 03:04:56,"#GOPShutdown proposal is the 43rd attempt to repeal or undermine the #ACA. The score so far is Obamacare - 42, House Republicans - zero!",90,22
383994610940260352,2013-09-28 16:40:24,Government shutdown could cost taxpayers billions via @NBCNews  http://t.co/ZYdNHJtGnJ,5,1
383994425573011456,2013-09-28 16:39:39,"Regular order? MT @BresPolitico House Rs may hold vote on a CR this afternoon, but they still haven't said what will be in the bill",6,1
383732473353363456,2013-09-27 23:18:45,The Simplest Explanation Of Obamacare. Ever. (via @Upworthy) @kaiserfamfound http://t.co/umxMBKfY95,7,3
383408584547004417,2013-09-27 01:51:44,Sign up at http://t.co/4QJdC8guLC: http://t.co/MGEci7sYJl via @youtube,7,1
383408171902976000,2013-09-27 01:50:06,RT @LCHC_CA: Congrats @LULAC @AdelanteSalud @NCLR &amp; others for being named Champions for Coverage by Kathleen Sebelius today!,5,0
383408128122826753,2013-09-27 01:49:55,RT @NancyPelosi: Want to know what insurance premiums will look like under #ACA? Even lower than expected: http://t.co/hCg01378qP #GetCover…,138,0
382688159743496193,2013-09-25 02:09:01,RT @toreyp5: Houston leaders committed to stamping out modern day slavery! @anniseparker @SheriffGarcia @JacksonLeeTX18 @HCSOTexas #shineal…,4,0
382298184828997632,2013-09-24 00:19:24,This is no time for the GOP to shut down the government and lay off 1st responders which puts the safety of Americans &amp; Houstonians at risk.,11,1
382297177235542016,2013-09-24 00:15:24,RT @KennettDems: Mr. President: Stand Your Ground! http://t.co/F6b5e9Rh8L  #ObamaCare #Debt #Shutdown,7,0
381986374896738304,2013-09-23 03:40:23,RT @WilwithoneL: Utterly terrifying account from @MikePflanz of the #westgate attack. Captures just how horrendous it must have been.  http…,13,0
381985956875612160,2013-09-23 03:38:43,The USA stands with the people of Kenya in their grief and resolve to bring the perpetrators to justice and to defeat al Shabaab,6,4
381263477802668032,2013-09-21 03:47:51,Reason #5 for voting against Tea Party #shutdown CR -- defunding Obamacare will force seniors and people with disabilities into institutions,11,0
381262818453909505,2013-09-21 03:45:14,Reason #4 for voting against Tea Party #shutdown CR --  defunds Children’s Health Insurance Program and hurts 11 million kids.,6,3
381262399346454529,2013-09-21 03:43:34,Reason #3 for voting against Tea Party #shutdown CR --  continues the GOP sequester cutting critical investments in education and Head Start,4,1
381261948760764416,2013-09-21 03:41:46,Reason #2 for voting against Tea Party #shutdown CR --  continues the GOP sequester cutting life-saving research to find cures for diseases.,6,2
381260541253001217,2013-09-21 03:36:11,Reason #1 for voting against House GOP Tea Party CR --  will cost up to 1.6 million jobs next year and weakening economic growth,5,0
381167848413863936,2013-09-20 21:27:51,"I voted against House GOP bill because it hurts children, seniors, veterans, working families, and risks government shutdown.",5,2
380688064219054080,2013-09-19 13:41:22,"Join me TODAY for The Human Trafficking Braintrust, entitled “Modern-Day Slavery: STOP Human Trafficking!!!!   ... http://t.co/Hu1vZaLNJA",2,2
380447691568070656,2013-09-18 21:46:12,"Stop Human Trafficking!!!!   Join me  for The Human Trafficking Braintrust, entitled “Modern-Day Slavery: Human... http://t.co/TyUunHo9JT",6,1
377838121783922689,2013-09-11 16:56:42,Members of the Congress remembering 9/11. http://t.co/QNyvifLAuC,4,0
377147610110251011,2013-09-09 19:12:51,Today we must stand by our Spring ISD students and family and I intend to help provide all the support I can give.,1,1
377147489926672384,2013-09-09 19:12:23,All of us mourn the loss of Josh Broussard &amp; continue to pray for his family and friends.,4,1
375377526274547712,2013-09-04 21:59:11,Currently meeting with the Syrian American community of Houston to listen to every voice. The decision is that important.,4,0
375271943110279168,2013-09-04 14:59:38,As a parent my prayers are w/the students &amp; the extended family of Spring HS. This is a tragedy that us adults must work to resolve.,4,3
374337790063808512,2013-09-02 01:07:38,"I commend POTUS for seeking authorization from Congress, the constitutional representatives of the people, so the best decision can be made.",8,5
374077562973995008,2013-09-01 07:53:35,"Constitution wisely places burden of deciding when to use military force on POTUS and Congress, the representatives of the American people.",6,3
373887464072441856,2013-08-31 19:18:12,President is right that all Members of Congress should be consulted before military action in Syria is taken.,16,8
372793532928360448,2013-08-28 18:51:19,#mlkdream50 #DreamDay #50thMOW http://t.co/CAnXLmGR25,0,3
372790515239890944,2013-08-28 18:39:19,"John Lewis, President Carter &amp; President Clinton have inspired us to make freedom ring. #MLKDream50 #DreamDay #50thMOW",2,2
372396590314434560,2013-08-27 16:34:00,"RT @AmericanLegion: Rep. @JacksonLeeTX18 to #ALConvention: ""Legion is one of the greatest fighters for justice, #veterans and #soldiers.""",2,0
372396559578587137,2013-08-27 16:33:53,"RT @AmericanLegion: Rep. @JacksonLeeTX18 to #ALConvention: ""#Sequestration should end now, and we should never touch any #veterans' benefit…",1,0
372392491359547392,2013-08-27 16:17:43,My Dream is to never turn my back on a just cause and to help build the dreams of children. #MOW13 @NowWithAlex @MSNBC,2,2
372033822713335808,2013-08-26 16:32:30,Today is Women’s Equality Day.,11,2
372032585863413761,2013-08-26 16:27:35,"In America, women still earn 78 cents for every dollar men make.",8,0
372031457926991872,2013-08-26 16:23:06,American women have been at the forefront of the cause of women’s equality at home and abroad.,1,1
372030272063025153,2013-08-26 16:18:23,"On the 93rd anniversary of Women’s Equality Day, Americans celebrate the life and legacy of generations of American women",1,1
372028442562142208,2013-08-26 16:11:07,"Enjoyed my interview with @MHarrisPerry on Sunday talking about various issues affecting America   
http://t.co/MlpFNNrfp9",2,0
