id,created_at,text,retweets,favorites
347346542115565568,2013-06-19 13:34:03,"RT @WHLive: President Obama in Berlin: ""No wall can stand against the yearning for freedom, the yearning for peace that burns in human hear…",28,0
347002119565492224,2013-06-18 14:45:26,"Yesterday, the Supreme Court's ruling in Arizona v. ITCA represents a victory for the American people. It is a... http://t.co/IfISZI0eO8",1,1
345625731176480768,2013-06-14 19:36:10,"RT @RepAndreCarson: Honored to speak about the Julia Carson Responsible Fatherhood Act w/@RepDannyDavis, @RepVeasey &amp; @JacksonLeeTX18. http…",1,0
345246725906259968,2013-06-13 18:30:08,Will you support the growing chorus of voices opposing the nearly $20 billion of proposed cuts to the Supplemental... http://t.co/W49KfhiGjA,1,0
344920100144549888,2013-06-12 20:52:14,"RT @PoliticsNation: Tonight tune in to #PoliticsNation at 6pm! Our guests this evening include @faithjenkins1, @JacksonLeeTX18, @TheReidRep…",11,0
344894755056005120,2013-06-12 19:11:32,I will be on Politics Nation on MSNBC with @TheRevAl @ 6:10pm. Make sure you tune in.,2,0
344887091206946816,2013-06-12 18:41:04,http://t.co/28JSU1Kj4o,1,0
344886550506639361,2013-06-12 18:38:55,RT @NancyPelosi: The Judiciary Cmte just voted to restrict women's health choices. 23 male R's on the committee: #WhereAreTheWomen http://t…,378,0
344867002084638724,2013-06-12 17:21:15,http://t.co/D0t7jRJNI6 http://t.co/TPgD21jEMf,0,0
344859901975203840,2013-06-12 16:53:02,http://t.co/D0t7jRJNI6,0,1
344858391665065985,2013-06-12 16:47:02,RT @JansingCo: Should the US government employ fewer contractors? @JacksonLeeTX18 on #JansingCo WATCH http://t.co/f9yHXcDJ8O,3,0
344823422808907776,2013-06-12 14:28:05,@JansingCo Thank you for having me on your show!,0,1
344823000740274176,2013-06-12 14:26:24,RT @JohnnyAI: #NowWatching Rep. @JacksonLeeTX18 on @MSNBC,2,0
344807832484470784,2013-06-12 13:26:08,I will be on MSNBC with @JansingCo in 30 mins.,6,1
344807205939326976,2013-06-12 13:23:38,"RT @RepAndreCarson: In 19 days, student loan interest rates will double, making college far more expensive. #HR1911 isn't the solution. htt…",12,0
344807019766763522,2013-06-12 13:22:54,Good morning! I will be on MSNBC at 9:00am (CST). Hope you have the chance to watch.,4,1
344531876754624513,2013-06-11 19:09:35,"RT @whitehouse: President Obama: Immigration is ""a driving force in our economy, creating jobs and prosperity for all our citizens."" #Immig…",185,0
344531743715495936,2013-06-11 19:09:03,"RT @BarackObama: #ImmigrationReform means ""smarter enforcement, a pathway to earned citizenship, improvements to the legal system."" —Presid…",858,0
344531667647594496,2013-06-11 19:08:45,"RT @TheDemocrats: MT @whitehouse: Here's how President Obama's plan would fix our broken immigration system. http://t.co/rlvuNonWAt, http:/…",20,0
344477685344514048,2013-06-11 15:34:14,It’s an enormous burden to the government – Congress must reign it in now. I plan to introduce amendment reigning in contractors.,3,1
344197191633620993,2013-06-10 20:59:40,I ask the nation to pray for the recovery of Nelson Mandela.,4,1
344196721510842368,2013-06-10 20:57:47,"""Only one current member of the Texas delegation — Sheila Jackson Lee of Houston — can say she has never voted for expanded FISA powers.""",6,1
344195576239382528,2013-06-10 20:53:14,Thank you @BashirLive  for having me on your show.,2,0
344187361422344193,2013-06-10 20:20:36,Watch me live on MSNBC Live with Martin Bashir at 3:40pm(CST).,3,0
344165537896607745,2013-06-10 18:53:53,Watch me on MSNBC live at 3:45pm (CST).,1,0
344132909533388802,2013-06-10 16:44:13,I posted a new photo to Facebook http://t.co/RB4yTewMKl,1,0
344123905381908481,2013-06-10 16:08:27,"RT @whitehouse: Obama: “Our journey to equality is not complete until our wives, our mothers, and daughters can earn a living equal to thei…",249,0
344120854285791232,2013-06-10 15:56:19,"RT @whitehouse: President Obama on #EqualPay for equal work: ""It’s the idea that all of us are created equal.""",138,0
344119541946789888,2013-06-10 15:51:06,RT @dccc: Today is the 50th anniversary of the #EqualPay Act. We still have a long way to go. RETWEET to join in the fight. #equalpaynow,54,0
344117146042900482,2013-06-10 15:41:35,"Average pay gap between women and men is $11,084 a year.  That’s 89 weeks of food or more than 3,000 gallons of gas. #equalpaynow",6,1
344105726685364227,2013-06-10 14:56:13,Did you know that the Equal Pay Act has not been updated in 50 years? That’s why we need to pass the #PaycheckFairnessAct,1,0
344104395153235968,2013-06-10 14:50:55,"50 years after we passed the Equal Pay Act, women still earn 77 cents for every dollar a man earns.  #equalpaynow",3,0
344088145899433986,2013-06-10 13:46:21,"On June 10, 1963, President John F. Kennedy signed the Equal Pay Act into law. And yet, 50 years later, women on... http://t.co/tF1uxSYLUk",16,1
343114885527371778,2013-06-07 21:18:58,I posted a new photo to Facebook http://t.co/t6uZAMjLTT,1,0
343114883103092736,2013-06-07 21:18:57,I posted a new photo to Facebook http://t.co/kKWI9octgv,1,0
343114880590700544,2013-06-07 21:18:56,Meeting with our Veterans. Thank you for your service to our nation. http://t.co/M6m6Zts55Z,1,0
343015938100187136,2013-06-07 14:45:47,Congratulations to Congressman John Dingell of Michigan on becoming the longest-serving Member in the history of... http://t.co/vPxuX04eRP,7,3
342309347650584577,2013-06-05 15:58:02,"Today, I stand with many to honor Cap. Matthew Renaud, Robert Bebee, Robert Garner, and Anne Sullivan. http://t.co/pCpnjUjN3M",3,3
342308565945565184,2013-06-05 15:54:56,I posted a new photo to Facebook http://t.co/GNqW1Nu9SU,0,0
342023766404116481,2013-06-04 21:03:15,"Congresswoman Sheila Jackson Lee remembers a WWII Veteran and an Amazing Public Servant, U.S. Senator Frank... http://t.co/Pg6tjBnsuc",4,1
339028352260243456,2013-05-27 14:40:32,Come out and honor our fallen heroes today at 12pm at the Heights WWII Memorial located at 11th and Heights Blvd!! http://t.co/aMC4m8tnbW,4,1
337613501055004672,2013-05-23 16:58:25,What are you doing Memorial Day? Join us out in the Houston Heights at the WWII Memorial for a flag posting! The... http://t.co/Uuv0Db2q2o,2,0
336947652908433409,2013-05-21 20:52:35,What are you doing Memorial Day?  Join us out in the Houston Heights at the WWII Memorial for a flag posting!  The... http://t.co/vPELmAZzjx,1,0
332574601752215552,2013-05-09 19:15:38,The tragedy on patriots day in boston  deserves a patriotic response to fix our system of domestic security and to save lives,1,1
330336057151324160,2013-05-03 15:00:28,Join me at the Press Conference to save NFISD @ NOON @ Forest Brook Mid Sch 7525 Tidwell Rd - starting now,1,0
330332240519237633,2013-05-03 14:45:18,Join me at the Press Conference to save NFISD @ NOON @ Forest Brook Mid Sch 7525 Tidwell Rd,1,0
324608668983259136,2013-04-17 19:41:52,"Many Americans own iPhones and take advantage of the capability of storing some of your data in the iCloud, which protects your data",3,1
324607625545269248,2013-04-17 19:37:43,just because it is  stored by a company that provides information services to a government agency,1,0
324607606901587968,2013-04-17 19:37:39,This  amendment  will protect individuals private data from being accessed by the government,1,1
324603463206072320,2013-04-17 19:21:11,"Today I will offer an amendment to the H.R. 264, the Cybersecurity Information Sharing and Protection Act",1,1
324566589255069696,2013-04-17 16:54:39,"My amendment to the H.R. 624, the Cybersecurity Information Sharing and Protection Act of 2013 makes clear that... http://t.co/LMuBISqeB5",1,1
324158200918179840,2013-04-16 13:51:52,My prayers goes out to the victims in Boston,8,2
324157626931888128,2013-04-16 13:49:35,"""Boston will overcome""",2,0
323094118119129088,2013-04-13 15:23:35,Glad to be here this morning for the 4th Annual National African American Breast Cancer 5k walk/run! As a... http://t.co/Gm6Zbl5LvF,1,0
322381391700574208,2013-04-11 16:11:27,"Today, me and 49 of my colleagues in the House joined together in urging Senate Republican Leader McConnell, and... http://t.co/Gf4rfr89V4",1,0
322118336748077056,2013-04-10 22:46:10,"Is time to stop Human Trafficking!  Wheeler Avenue Baptist Church--Houston, Texas will host an important... http://t.co/F1SqDC4NAJ",1,0
321743190132654080,2013-04-09 21:55:28,100 million riders shows that we should continue to seek federal funding to expand light rail thru out Houston http://t.co/1sSqbHJgzJ,0,0
321727404760506368,2013-04-09 20:52:45,More needs to be done to close the wage gap that still exists between women &amp; men – including enactment of the  Paycheck Fairness Act.,0,0
321721305437204480,2013-04-09 20:28:31,Women in Texas Still Earn Only 77 Cents for Every Dollar Earned by Men,6,1
321663908417007616,2013-04-09 16:40:26,I look forward to taking the insights I gained from Konia Learning Center back to Washington to address gun violence http://t.co/HjrWVtK9jz,4,1
321663394237259776,2013-04-09 16:38:24,I want to thank the teachers &amp; students of Konia Learning Cent who joined me today to discuss gun free &amp; safe schools http://t.co/n5juoOfi3B,2,0
321650026369658881,2013-04-09 15:45:17,"We rely on our transportation system to move people &amp; goods safely, facilitate commerce, attract &amp; retain businesses http://t.co/ZtbHkL0wI7",2,0
321649420229808129,2013-04-09 15:42:52,"A well functioning transportation system is critical to the Nation’s prosperity. Whether it is by road, or transit. http://t.co/Os4Em5FqJR",2,0
321647883533291520,2013-04-09 15:36:46,100 million riders shows that we should continue to seek federal funding to expand light rail thru out Houston http://t.co/f2Hpc6pmDL,1,1
321647272616161280,2013-04-09 15:34:20,METRO Rail has recorded 100 million boarding’s since service began in January of 2004. http://t.co/tgqkNDglxa,1,0
321277135467724800,2013-04-08 15:03:32,http://t.co/MXhvYnzgrT http://t.co/ICYhk2eBQr,1,0
319562914073808896,2013-04-03 21:31:50,CONGRESSWOMAN SHEILA JACKSON LEE GATHERS THE COMMUNITY TO SPEAK OUT AGAINST GUN VIOLENCE AND TO RAISE OUR VOICES... http://t.co/EB4vBUg0nC,3,1
318829728654053376,2013-04-01 20:58:25,I send my thoughts and prayers to family of Judge Azios. May God comfort them in their time of need.,1,0
316598308896399361,2013-03-26 17:11:33,"Today I will hold an important Town Hall Meeting with the North Forest I.S.D community to engage the teachers,... http://t.co/LUbFiXcI9C",0,0
316597901868556288,2013-03-26 17:09:56,"Today I will hold an important Town Hall Meeting with the North Forest I.S.D community to engage the teachers,... http://t.co/v20VXm0Qkb",1,0
315658266925494274,2013-03-24 02:56:10,Townhall Meeting regarding North Forest Independent School District on Tuesday March 26th http://t.co/YSH2t7ve2x,2,0
314459744242905089,2013-03-20 19:33:40,"Speaking at a Immigration Rally today here on Capitol Hill.

http://t.co/TQDu4rdxuC http://t.co/kjk5jRxTY2",1,0
314442449516912640,2013-03-20 18:24:56,Rep. Jackson Lee talking about Immigration Reform Today and the Caribbean Community http://t.co/TQDu4rdxuC,2,0
312271852565303297,2013-03-14 18:39:46,Members of the Congressional Progressive Caucus (CPC)  I hosted a press conference on Capitol Hill TODAY to... http://t.co/999Oc4HUa8,1,0
311957560066449408,2013-03-13 21:50:52,"CBC's budget protects and enhances Social Security, Medicare, Medicaid, SNAP, TANF &amp; other vital safety net programs for families",2,0
311956622203305984,2013-03-13 21:47:09,"CBC's Budget doesnt endorse any specific recommendations of Simpson Bowles, but supports the goals of a $4 trillion, 10yr deficit reduction",0,0
311956138881081344,2013-03-13 21:45:14,"The CBC Budget raises $1 trillion in new revenue to avoid sequestration, the self-inflicted economic disaster.",2,0
311955987139543040,2013-03-13 21:44:37,The CBC Budget proposes significant investments to accelerate our economic recovery and ensure that our recovery is felt in every community,0,0
311955858504441856,2013-03-13 21:44:07,The CBC Alternative Budget for 2014 puts forth a plan that reduces the deficit and alleviates harm inflicted by austerity measures,2,0
311955348363808768,2013-03-13 21:42:05,The CBC has a long history of submitting fiscally sound and socially responsible alternatives to budgets proposed by both Repubs &amp; Dem,1,0
311892351217975298,2013-03-13 17:31:45,Let’s have a budget that reflects our values,3,0
311892310738747394,2013-03-13 17:31:36,"Democrats have a fair, balanced plan to cut spending responsibly, increase revenues, &amp; create growth with jobs.",0,0
311891890788265985,2013-03-13 17:29:56,The Republican fiscal plan claims to protect Medicare while ending it for future seniors.,0,0
311891310325927938,2013-03-13 17:27:37,"To pay for tax cuts for the wealthy, it could raise taxes on middle class families by as much as $2,000 per year.",2,0
311891201785753601,2013-03-13 17:27:11,"The Republican budget will result in 2 million fewer American jobs next year alone, decrease GDP 1.7 percent, &amp; stall our nation’s recovery.",2,1
311890975393996800,2013-03-13 17:26:17,Republican Budget Committee Chairman Paul Ryan builds on the failed proposals of the last two years by making them worse.,3,0
311570782851567616,2013-03-12 20:13:57,The Republican approach to the budget is putting millionaires and billionaires ahead of the middle class,3,0
311570538101366784,2013-03-12 20:12:59,The Repubs approach to the budget is the same as its approach to the sequester: protecting special interests rather than solving problems.,4,0
311569732253929472,2013-03-12 20:09:47,The Ryan Republican budget is ending the Medicare guarantee and shifting costs to seniors.,1,0
311569583771357184,2013-03-12 20:09:12,The Ryan Republican budget is undermining the health and economic security of the elderly and disabled.,3,1
311569493170216961,2013-03-12 20:08:50,The Ryan Republican budget is protecting the wealthiest at the expense of the middle class.,2,0
311569221601591296,2013-03-12 20:07:45,The Ryan Republican budget will Destroy jobs and put our economic recovery at risk.,3,0
311568460582903809,2013-03-12 20:04:44,The Ryan Republican budget is nothing more than more of the same plan that the American people rejected last fall.,0,0
311562331874263041,2013-03-12 19:40:23,"Instead of targeting those in our  vulnerable communities, Republicans should work with Democrats towards  balanced and bipartisan solutions",7,1
311507899098726400,2013-03-12 16:04:05,Mr. Ryan finally appears willing to accept that revenues must be part of any solution to achieve real deficit reduction.,0,0
311507630575214593,2013-03-12 16:03:01,"It again ends the Medicare guarantee, and shifts costs onto seniors.",1,1
311507515009531904,2013-03-12 16:02:33,The budget again includes trillions in undisclosed &amp; ambiguous spending cuts with little explanation of the policies required to affect them,0,0
311506969607417856,2013-03-12 16:00:23,"The budget put forward by Republicans this week offers no surprises, but plenty of disappointment.",1,0
311141287556415488,2013-03-11 15:47:18,Today I will host an important meeting regarding comprehensive immigration reform and how important producing... http://t.co/EpcgMQanon,5,1
310152342622306304,2013-03-08 22:17:35,"North Forest Independent School District operates an early childhood center, five elementary campuses, two middle... http://t.co/8Lf82HAHsK",0,0
309739134304526337,2013-03-07 18:55:38,VAWA  protects the most vulnerable victims. #VAWA,5,2
309738859032363008,2013-03-07 18:54:33,"It was imperative that we supported the bipartisan, inclusive Senate version of VAWA instead of the partisan Republican proposal #VAWA",4,2
309738639854796800,2013-03-07 18:53:41,Honored to stand alongside President Obama as he signs into law Violence Against Women Act #VAWA,1,2
307237824258793473,2013-02-28 21:16:20,Section 5 of the #VotingRightsAct is constitutional. #VRA,1,0
307237660676734978,2013-02-28 21:15:41,"Section 5 prohibits voting changes that have either the ""purpose"" or the ""effect"" of denying the right to vote on account of race. #VRA",1,0
307237496343891968,2013-02-28 21:15:01,Although the South’s culture has changed in the past 48 year the need for the #VotingRightsAct has not.,0,3
307236893895053312,2013-02-28 21:12:38,"The #VotingRightsAct protects against ""packing"" black voters unnecessarily into safe districts.",1,1
307236773745025024,2013-02-28 21:12:09,Congress reaffirmed the validity of the #VotingRightsAct 6 yrs ago.The Supreme Court shouldnt take away this protection for minority voters.,10,2
307236405673873408,2013-02-28 21:10:41,"The #VotingRightsAct is the ""crown jewel"" of the civil rights law.",1,0
307231645411467265,2013-02-28 20:51:47,The #VotingRightsAct was enacted to stop partisanship. This effort to strike it down is partisan misbehavior.,1,0
307231547654807552,2013-02-28 20:51:23,District lines can’t be gerrymandered in ways that weaken the electoral power of minorities. The #VotingRightsAct protects this.,3,2
307231250249306112,2013-02-28 20:50:12,The #VotingRightsAct was necessary in the 2012 general election to protect against discrimination like voter ID laws.,0,0
307231159568441344,2013-02-28 20:49:51,Voters still face disenfranchisement.E.g- a San Antonio district was redrawn in 2003 to keep 100k Latinos out and a Republican in #VRA,1,1
307230535737028609,2013-02-28 20:47:22,The #VotingRightsAct of 1965 is still necessary. The Supreme Court should not strike it down.,0,0
307226362006097920,2013-02-28 20:30:47,"Today, I along with Reps. Moore, Conyers and Slaughter will debate version of VAWA that protects are most... http://t.co/uRJ8WLvv9F",0,0
307157015346683904,2013-02-28 15:55:13,Its Rodeo Time! http://t.co/kZGIBPMNVJ,0,0
306840681442320384,2013-02-27 18:58:13,“The Voting Rights Act is still one of the most critical and successful pieces of legislation that protects the... http://t.co/2U5xnltXMA,0,0
306438036978278401,2013-02-26 16:18:16,You like Rance Allen? Come out today and join us as Yolanda Adams host a special presentation for Black History... http://t.co/9GnXGLRgEQ,0,1
306083478649331712,2013-02-25 16:49:22,"Please join Gospel Artist Yolanda Adams, V. Michael McKay, Tyscot Records, and myself on tomorrow Tuesday Feb. 26... http://t.co/fEs814L9RQ",0,0
306079578412163072,2013-02-25 16:33:52,"Please join Gospel Artist Yolanda Adams, V. Michael McKay, Tyscot Records, and myself on tomorrow Tuesday Feb. 26... http://t.co/Cgq7zE3Iey",1,0
304283413630812161,2013-02-20 17:36:33,The Congressional Delegation with members of South Korea’s Supreme Court. http://t.co/VxG7cmUM,0,0
304282871168913408,2013-02-20 17:34:24,"Representative Sires, Senator Landrieu, South Korea’s Minister of Health and Welfare Rim Chemin, Representative... http://t.co/AIOp0zk5",0,0
299652082007425027,2013-02-07 22:53:18,The State of Texas should focus more on enhancing its state funding for education in order to improve the... http://t.co/6x4REmpg,2,3
299622438591930368,2013-02-07 20:55:30,good afternoon,5,3
297477693023330304,2013-02-01 22:53:03,Today I had the honor to celebrate and pay homage to a few veterans that served in France during the World War II... http://t.co/OE1ZcAqT,2,1
296360980227690499,2013-01-29 20:55:38,Over one million people have been killed with guns in the United States since 1968. U.S. homicide rates are 6.9... http://t.co/djw8yPGx,4,0
296352602290003968,2013-01-29 20:22:21,"President Obama’s 23 Executive Actions on Gun Control

1. ""Issue a presidential memorandum to require federal... http://t.co/EEB926X7",3,0
296349990274609152,2013-01-29 20:11:58,Just finished meeting with Lone Star College Officials and Students to discuss culture of gun violence http://t.co/IzpVZAye,1,1
296278995517972481,2013-01-29 15:29:51,discussing a concern about Social Security with one of my constituents http://t.co/kKASUfum,0,0
295271402758627328,2013-01-26 20:46:02,"I enjoyed today's luncheon in honor of the Centennial of the the ladies of Delta Sigma Theta Sorority, Inc. Happy 100th Deltas!!",0,0
294528443977191424,2013-01-24 19:33:47,"Beyonce rendered a breathtaking performance and we should applaud for her desire for perfection.

As many... http://t.co/4fRU0i0b",2,0
293834670620164096,2013-01-22 21:36:59,“Today is yet another sad day in our country because of a senseless shooting at the Lone Star College North... http://t.co/fIZKLziI,3,1
291968863300632576,2013-01-17 18:02:56,@mitchellreports Congress must rise above partisan politics and now come together as  to pass these important gun safety laws,1,0
291964041751064577,2013-01-17 17:43:46,@NowWithAlex The American Dream Act would provide a path to citizenship for immigrant students who have grown up in the U.S.,0,0
291963821277458434,2013-01-17 17:42:54,@NowWithAlex Comprehensive Immig Reform is the only logical step in addressing the challenges we are facing at our within our own country,0,0
291960345629708289,2013-01-17 17:29:05,"While no law or set of laws will end gun violence, it is clear that the American people want action. @NowWithAlex",3,0
291958610139959296,2013-01-17 17:22:11,@nowwithalex The safety of America and its children should be at the forefront when it comes to making these gun safety laws,0,0
291958332338622464,2013-01-17 17:21:05,The safety of America and its children should be at the forefront when it comes to making these gun safety laws #PreventGunViolence,4,2
291958008668381184,2013-01-17 17:19:48,@NowWithAlex Congress must rise above partisan politics &amp; now come together to pass these important gun safety laws,1,0
291682578270932992,2013-01-16 23:05:21,At Today's Gun Task Force hearing. We must stop gun violence NOW!!!! http://t.co/SD0X5wVv,6,3
291675133758803969,2013-01-16 22:35:45,"In one year on average, almost 100,000 people in America are shot or killed with a gun.",6,0
291672734453346304,2013-01-16 22:26:13,I have again introduced the Child Gun Safety and Gun Access Prevention Act in the 113th Congress.,2,1
291670670797070337,2013-01-16 22:18:01,I am focused on making sure that we take steps to identify and treat people who have mental illness b4 they can harm themselves or others,2,1
291669012822245378,2013-01-16 22:11:26,What happened just over a month ago in Newtown was an unimaginable tragedy. What happens now is up to each of us here in Congress.,1,0
291668241993060352,2013-01-16 22:08:22,I commend the President for taking immediate and concrete steps today to reduce gun violence.,3,0
291665299432931329,2013-01-16 21:56:40,I look forward to working with Pres Obama and the House Gun Violence Prevention Task Force to find sensible solutions to reduce gun violence,7,2
291663365112217600,2013-01-16 21:48:59,"4 families of the victims of Sandy Hook, of every massacre and every incident of gun violence, there is simply no time to waste",1,0
291657430927028224,2013-01-16 21:25:24,"Pres proposals reflect a series of clear and concrete steps in the effort to rein in, reduce, and prevent gun violence in our country.",2,1
291653321167626240,2013-01-16 21:09:05,Hearing on gun violence is complete. President’s gun proposals offer conrcrete steps. Congress should pass NOW!!!! http://t.co/Lrzpd5qM,8,1
291652892199374849,2013-01-16 21:07:22,"It is now Congress’s responsibility to work with the President to move forward with this plan, which is based on common-sense ideas.",1,0
291651861977632769,2013-01-16 21:03:17,"If even one child’s life can be saved, then we need to act. Now is the time to do the right thing for our children and communities",1,0
291649966521344000,2013-01-16 20:55:45,RT @WhipHoyer: I look forward to working with my colleagues to advance the President’s proposals to reduce gun violence: http://t.co/gIF ...,12,0
291649895188815872,2013-01-16 20:55:28,I just asked about the importance of storing guns in your home in a safe place. #PreventGunViolence,2,0
291648368105648129,2013-01-16 20:49:24,Each day 33 Americans are murdered by firearms. Congress needs to put lives of our constituents over politics #PreventGunViolence,1,0
291647568570617858,2013-01-16 20:46:13,I agree with @BarackObama that #NowIsTheTime to work together to prevent gun violence,2,1
291647271584534530,2013-01-16 20:45:02,"While no law or set of laws will end gun violence, it is clear that the American people want action.",4,1
291644427989037056,2013-01-16 20:33:44,Documents: Read President Obama's gun law proposals and list of executive actions http://t.co/8FOLVv5y,2,0
291644262230147072,2013-01-16 20:33:05,"RT @repjohnconyers: Each day, on average, 33 Americans are murdered with guns, which amounts to 12,000 lives each year.",19,0
291644189559644160,2013-01-16 20:32:47,We must also look at gun violence in other cities too such as Chicago a number of school age kids have been killed with gun.,7,1
291640261560373248,2013-01-16 20:17:11,The safety of America and its children should be at the forefront when it comes to making these gun safety laws.,6,1
291638533771374592,2013-01-16 20:10:19,This Congress must rise above partisan politics and now come together as the President has stated to pass these important gun safety laws.,8,1
291622159544115200,2013-01-16 19:05:15,@msnbc The president and our task force agree that we need a comprehensive approach to reduce and prevent gun violence.,0,0
291622036361605120,2013-01-16 19:04:46,@tamronhall Our Dem gun task force agree that we need a comprehensive approach to reduce and prevent gun violence. #PreventGunViolence,1,1
291611451007827968,2013-01-16 18:22:42,RT @MarkeyMemo: Demanding that the House #GOP vote immediately on President Obama’s #guncontrol legislation. #NowIsTheTime http://t.co/P ...,69,0
