id,created_at,text,retweets,favorites
489492520888729600,2014-07-16 19:31:26,RT @HomelandDems: Hearing on border ports of entry just began w/ @JacksonLeeTX18 WEBCAST: http://t.co/BqtotIk4a5  MORE INFO: http://t.co/EK…,3,0
489488287212765186,2014-07-16 19:14:36,@BofA_Community I enjoyed meeting with Bank of America Student Leaders from my district today. #BoAStudentLeaders http://t.co/jgA4GVIZvn,4,3
489485230773108738,2014-07-16 19:02:27,@BofA_Community I enjoyed meeting the Bank of America Student Leaders from my district today. #BoAStudentLeaders http://t.co/Wwoxu9EwBU,2,1
489483702674927616,2014-07-16 18:56:23,I thoroughly enjoyed meeting the Bank of America Student Leaders from Houston. I was very proud to speak with... http://t.co/BfP0hte1S7,2,0
489466432661381120,2014-07-16 17:47:46,Had a chance to speak with the Bank of America Student Leaders from my district. I thoroughly enjoyed… http://t.co/83CqzFUBBU,0,0
489452125811134464,2014-07-16 16:50:55,RT @vj44: Powerful op-ed by @JacksonLeeTX18 on #MyBrothersKeeper and how it empowers all young people with the tools to succeed http://t.co…,17,0
489424860318552066,2014-07-16 15:02:34,http://t.co/nqakpID5Xn... http://t.co/tKS3evpVxq,3,1
489422630332923905,2014-07-16 14:53:42,"While House Rs waste time and $ on a pointless lawsuit, Dems have a plan to put the #MiddleClassFirst. Learn more: http://t.co/cLcR7B2f6q",3,0
489414649134456832,2014-07-16 14:21:59,Just spoke at a Homeland Security Committee hearing on border security. http://t.co/MXsz2spgd7,2,2
489408406235918336,2014-07-16 13:57:11,I participated in a press conference this morning and supported my colleagues in the House Democratic… http://t.co/JPYnJvQfys,2,0
489395924540858368,2014-07-16 13:07:35,"This morning, I will join @NancyPelosi in announcing the new Democratic economic agenda. #MiddleClassFirst",4,1
489394440625459200,2014-07-16 13:01:41,This week marks 3 months since the kidnapping of over 200 Nigerian schoolgirls. RT  if you care #BringBackOurGirls http://t.co/n4BzCbk70z,12,3
489157143669768192,2014-07-15 21:18:45,It's time to #RebuildAmerica by investing in our roads &amp; bridges. See the condition of infrastructure in Texas → http://t.co/FmTaIA89XX,11,2
489135823812849665,2014-07-15 19:54:02,Had a very productive meeting with @NancyPelosi and members of House Democrats Voting Rights Task Force. #VRA4Today http://t.co/PKBJPiO3dB,5,4
489102082025459712,2014-07-15 17:39:58,"When it comes to alienating Hispanic Americans, “Republicans can’t help themselves"":  http://t.co/dDGs106tSM",4,0
489093096668663808,2014-07-15 17:04:15,A new poll shows what Americans have known all along: @SpeakerBoehner’s lawsuit is a waste of time.  http://t.co/2hpzMOP7ZN #DoNothingGOP,4,1
488793259104542722,2014-07-14 21:12:48,I got to sit down and talk to my wonderful summer interns today. It was great to spend time with these future leaders http://t.co/vUNBg0fy3H,4,4
488781263344762880,2014-07-14 20:25:08,@alexwagner what we need to pass is Comp. Immigration Reform Now. this is a humanitarian issue that must be addressed,2,0
488758363048931328,2014-07-14 18:54:09,"""The truth is that health reform is — gasp! — working.""—@NYTimeskrugman on the clear fact that #ACAworks: http://t.co/mnWx5Gb6U0",3,1
488745135145230336,2014-07-14 18:01:35,How many times do we have to say this? Healthcare is #NotMyBossBusiness. Proud to support #NotMyBossBusiness Bill.,5,3
488701394363645952,2014-07-14 15:07:46,"I was shocked and deeply saddened when I learned of the mass shooting that had occurred in Houston, Texas last... http://t.co/qrEc0BGh0P",2,1
488686826308132865,2014-07-14 14:09:53,Weak gun laws are failing domestic abuse victims. Keep guns from abusers. #FixDVGunLaws #MomsDemand,3,3
488681672758403072,2014-07-14 13:49:24,This is the reality of domestic gun violence in America #FixDVGunLaws #MomsDemand http://t.co/kTzKNTazod,2,1
488670688598056961,2014-07-14 13:05:45,Being a girl in Nigeria should not be a curse. All our girls wanted was to grow &amp; learn. We must #BringBackOurGirls.,5,2
488107479944146944,2014-07-12 23:47:46,"Dr. Freddie Haynes, III, Senior Pastor of the Friendship West Baptist Church of Dallas came down to host with me... http://t.co/Rd52spRROS",6,0
487814274036039681,2014-07-12 04:22:40,My op-ed with Univ. of Houston Professor Ling Zhu explains why not expanding Medicaid is bad for Texas. #ACAworks  http://t.co/LX23cXilnF,5,3
487659209798873088,2014-07-11 18:06:30,Even Republicans are sending a clear message to Congress: The #timeisnow to pass immigration reform: http://t.co/TmPDgpUxPA,3,2
487636200229203968,2014-07-11 16:35:04,FACT: Birth control cuts down on health care costs in America. http://t.co/d6JFzpE5FA #NotMyBossBusiness,6,2
487625152021413888,2014-07-11 15:51:10,"Thanks in part to the ACA, Medicare spending will be lower than expected: http://t.co/zxto6tBVKF  #ACAworks http://t.co/NXe2kCnMSc",3,1
487594205427269632,2014-07-11 13:48:12,RT @JoaquinCastrotx: The humanitarian crisis at the border is a moral test of our nation's conscience. The GOP House must act now to pass e…,277,0
487593096398798849,2014-07-11 13:43:47,"146 years ago, the 14th amendment was ratified to protect equal rights. Today, we must work to ensure every American is equal under the law.",7,4
487592286529019904,2014-07-11 13:40:34,"Yesterday, I was with the President as he delivered a speech in Austin, TX regarding immigration. Feel free to... http://t.co/yxkgd5Rl8s",2,0
487583643997835264,2014-07-11 13:06:14,Our girls are still with terrorists. We cannot stand idly by. We must #BringBackOurGirls.,11,0
487344893178937344,2014-07-10 21:17:31,I joined the President today in Austin &amp; discussed humanitarian crisis on our border on MSNBC. http://t.co/aMTsTHKWlW http://t.co/SlyKFI5iEj,16,9
487338201275957249,2014-07-10 20:50:56,61 percent of small businesses strongly support raising the nation’s minimum wage to $10.10!  http://t.co/gh2Vi4pGAc #RaiseTheWage,4,1
487330643232452608,2014-07-10 20:20:54,Even Republicans are sending a clear message to Congress: The #timeisnow to pass immigration reform: http://t.co/kLB5ZpSTqC,3,1
487304979485818880,2014-07-10 18:38:55,"Contrary to GOP claims, AP reports no “stand down” order in #Benghazi—but Rs will still spend $3.3m to re-investigate http://t.co/WjeoLz3Iyi",4,1
487287708663185408,2014-07-10 17:30:17,Did you know that I have a YouTube account? Make sure you stay up date by subscribing to: Rep. Sheila Jackson Lee http://t.co/GEPP6fsCw9,2,0
487262639299764225,2014-07-10 15:50:40,"I am meeting with @BarackObama in Austin,TX at the Paramount Theatre to discuss my recent trip to the border in South Texas. #UAC",7,2
487254589348261888,2014-07-10 15:18:41,"I am in Austin, TX at the Paramount Theater meeting with the President in regards to my trip to the border. These... http://t.co/pRefwSESeK",0,0
487250120476753920,2014-07-10 15:00:56,Good Morning! Are you following me on Instagram? I have some updated pictures and information regarding some... http://t.co/rTQw48Dxac,2,0
487225628437913600,2014-07-10 13:23:36,Our girls &amp; their loved ones are living a nightmare. We must #BringBackOurGirls. I will not give up until they are home.,10,6
486988499393183744,2014-07-09 21:41:20,Education is extremely vital in today's society. I have a passion for education and today I spoke at the... http://t.co/yg1EGMGR5v,4,0
486958102185787392,2014-07-09 19:40:33,"We're running out of time to renew the Highway Trust Fund. @SpeakerBoehner, it's time to act: http://t.co/oRmgs3UaTR http://t.co/pjAmG1cqiN",5,2
486948321995792384,2014-07-09 19:01:41,Some justice for American mothers who were denied mortgages because they were on maternity leave: http://t.co/8wtRIcqoRX #WomenSucceed,1,1
486942326619914241,2014-07-09 18:37:52,House GOP priorities? 1. Waste taxpayer dollars 2. Ignore job creation. RT if you think America deserves better. http://t.co/HZ1TcKF2zr,6,4
486939029079072768,2014-07-09 18:24:46,Congratulations to San Antonio Mayor @JulianCastro on your new position as the Secretary of Housing and Urban Development.,5,6
486933429955878912,2014-07-09 18:02:31,Today I had the privilege to speak about my experience when I visited the border. These children are seeking... http://t.co/1sI2dnmrqP,2,2
486927033193070594,2014-07-09 17:37:06,I was thrilled and honored to speak at the Education Panel for the National Action Network's 1st… http://t.co/FMNdlrTzUl,2,3
486894435956183041,2014-07-09 15:27:34,I enjoyed speaking with @tamronhall about my recent trip to the Texas border on News Nation #UAC http://t.co/rH45mXnL5O,1,0
486884695830175744,2014-07-09 14:48:52,I'm about to appear live on MSNBC to talk with Tamron Hall on News Nation. Don't forget to tune in at 11 am!,4,2
486884041367769088,2014-07-09 14:46:15,"At the press conference on the southern border crisis with Rep. Joe Crowley, Rep. Xavier Bacerra, and… http://t.co/S5a3L3Krgd",2,1
486859793618178048,2014-07-09 13:09:54,"Today at 10 am, I will join my colleagues @repjoecrowley and @RepBecerra in a press conference to discuss the southern border crisis #UAC",2,0
486857707195219969,2014-07-09 13:01:37,"#BokoHaram terror is not simply a matter of social justice, but a matter of national security.  #BringBackOurGirls",4,0
486856402657611777,2014-07-09 12:56:26,RT @cbrangel: How many taxpayer dollars is the #DoNothingGOP Congress bound to waste? See for yourself and RT: http://t.co/cjtWdBIHTK,55,0
486855134283317248,2014-07-09 12:51:24,Congresswoman Sheila Jackson Lee will hold Press Availability with Democratic Leaders to discuss her recent trip... http://t.co/Q8fQvp30l9,2,0
486619409881255937,2014-07-08 21:14:42,"This July,the @HouseDemocrats will be working hard to address critical issues such as immigration, the Voting Rights Amendment Act, and ENDA",2,2
486601571921571840,2014-07-08 20:03:50,FACT: States that raised the minimum wage saw higher job growth than states that did not. http://t.co/gZxkJwR7Qq #RaiseTheWage,7,2
486595101666574336,2014-07-08 19:38:07,"Those who think raising the wage will lead to job loss have a problem: ""They're consistently wrong."" http://t.co/aGVgkLsxRB #RaiseTheWage",5,2
486593102623571968,2014-07-08 19:30:10,"""Feckless""--just one of the words describing @SpeakerBoehner's pointless lawsuit against Pres. Obama. http://t.co/0RjINhUsQg #DoNothingGOP",7,6
486592143021334528,2014-07-08 19:26:22,Don't forget to follow me on Instagram at SJLTX18.,2,0
486588222500528128,2014-07-08 19:10:47,Unbelievable: @HouseGOP will spend $3.3 mill on its Benghazi conspiracy—more than the entire Vets Committee budget. http://t.co/zJCjAFXlPo,12,5
486585691930099715,2014-07-08 19:00:43,"Nearly 300,000 veterans need us to act. We have a pledge to uphold—it's time for House Rs to join us and #RenewUI: http://t.co/6tmCzlM0nk",6,0
486578438044930048,2014-07-08 18:31:54,Why the @HouseGOP’s failure to #RenewUI is “one of the biggest policy failures Congress has made this year”: http://t.co/3XzR6lSIuV,12,5
486573252865970176,2014-07-08 18:11:18,Tomorrow at 11am I will be on MSNBC speaking on Immigration. I look forward to discussing this important issue.,5,0
486533898495864833,2014-07-08 15:34:55,I call on religious and nonprofit organizations to provide help for the unaccompanied minors on the Texas border #UAC http://t.co/9yfU9JH6uE,13,4
486532104306819073,2014-07-08 15:27:47,"America is better than this. We all come from different backgrounds, but never should we belittle each other no... http://t.co/CvOorJGdHq",2,4
486518770614431745,2014-07-08 14:34:48,http://t.co/Z13nLld64c... http://t.co/tYc7OistXn,4,2
486496087247974400,2014-07-08 13:04:40,#BringBackOurGirls! We are not going away. We will not be silenced until they are rescued.,23,4
486220682054078464,2014-07-07 18:50:18,This headline from WestView News is disgusting. America is better than this. http://t.co/k8kTyWVkj9,4,1
486192541310545921,2014-07-07 16:58:29,"I would like to extend my condolences to the family of Diana Hobby, a woman of great intellect and philanthropic spirit. She will be missed.",5,1
486177125826068481,2014-07-07 15:57:14,I recently traveled to South Texas to attend a Homeland Security Committee Field Hearing on the border crisis. #UAC http://t.co/PNaC4Ldipj,4,1
486170836681117697,2014-07-07 15:32:14,"Are you following me on Instagram for the latest pictures and updates? If not, go ahead and follow me at SJLTX18",1,0
486170278775783424,2014-07-07 15:30:01,RT @tomabrahams: .@GovernorPerry &amp; @JacksonLeeTX18  on border crisis. VIDEO: http://t.co/uFhxKmiABQ @DHSgov @fema @ThisWeekABC,2,0
486161079039700992,2014-07-07 14:53:28,I believe in Justice and Equality for all citizens. I am always working for the betterment of the people. http://t.co/C4k89L1ndZ,3,4
486132766355259392,2014-07-07 13:00:58,Keep up the support to find our girls. Do not let the world forget until every girl is found. #BringBackOurGirls,18,4
485106414332170240,2014-07-04 17:02:36,"We celebrate American Independence Day on the Fourth of July every year. We think of July 4, 1776, as a day that... http://t.co/gp1PhBDfYn",3,2
484746507644846081,2014-07-03 17:12:28,You can watch a live feed of the Homeland Security Committee Field Hearing on Unaccompanied Minors here : http://t.co/kJEryeobht  #UAC,5,1
484741598056828928,2014-07-03 16:52:57,"RT @WhiteHouse: Our businesses have added:
9.7 million jobs over 52 months ✔
More than 1.4 million this year ✔
262,000 in June ✔
→ http://t…",417,0
484735013058248704,2014-07-03 16:26:47,"Today at 12 pm, I will participate in a Homeland Security Committee Field Hearing discussing the unaccompanied minors crisis in Texas. #UAC",7,3
484690364318887936,2014-07-03 13:29:22,Follow me on Instagram at SJLTX18,1,2
484687234885746688,2014-07-03 13:16:56,"Congratulations to Admiral Michelle J. Howard for making #History in the U.S. Navy as not only the first woman,... http://t.co/3QMXknrJlg",7,0
484396017035776000,2014-07-02 17:59:44,I am in Southwest Texas today to explore solutions to the problem of unaccompanied minors fleeing violence and economic desperation. #UAC,7,7
484389400500269056,2014-07-02 17:33:27,"RT @farenthold: Today, @JacksonLeeTX18 @RepZoeLofgren @JoeGarcia &amp; I met w/ @CCharitiesUSA to hear how they care for child immigrants http:…",7,0
484389124917694464,2014-07-02 17:32:21,RT @immigrattorney: Good seeing @RepJoeGarcia @JacksonLeeTX18 @RepZoeLofgren show genuine interest in helping understand the true cause htt…,4,0
484383109723746306,2014-07-02 17:08:27,RT @IsraelSW: http://t.co/5zhqyC43Xw  @JacksonLeeTX18 formally presented a letter condolence to @IsraelSW for the tragic killing of 3 Israe…,5,0
484342478683000832,2014-07-02 14:27:00,Don't forget to follow me on Instagram at SJLTX18!,1,2
484338900656463872,2014-07-02 14:12:47,"Today, on the 50th anniversary of the Civil Rights Act of 1964, we celebrate those who fought so hard for our freedom http://t.co/lqSiFaeXNt",86,56
484327951459442688,2014-07-02 13:29:16,"No, we have not forgotten. We will continue to demand that the Nigerian government #BringBackOurGirls.",8,5
484098736306802688,2014-07-01 22:18:27,"On behalf of the people of the 18th Congressional District of Texas, I want to convey my deepest condolences to... http://t.co/2wYiYxU1EB",2,2
484090992954716161,2014-07-01 21:47:41,Meeting with our Summer Interns here in the Houston District office http://t.co/QbmOOYAnYU,1,0
484021545913024512,2014-07-01 17:11:43,"Over 28 mil Americans, including 2,982,100 Texans, would benefit from an increase in the minimum wage to $10.10 an hour. #RaiseTheWage",12,4
484011977921282048,2014-07-01 16:33:42,"RT @BarackObama: ""One of the things that makes this country great is that we are a nation of immigrants."" —President Obama",2072,0
484011179799760896,2014-07-01 16:30:32,RT @RepDianaDeGette: #SCOTUS #HobbyLobby decision puts bosses’ religious beliefs before workers’ access to healthcare. #NotMyBossBusiness C…,250,0
484009902093131776,2014-07-01 16:25:27,"RT @NancyPelosi: When women find work &amp; life balance, our society thrives. Why hardworking Americans deserve paid leave: http://t.co/FTWxBV…",192,0
483998861179236352,2014-07-01 15:41:35,"One year ago, President Obama announced his Climate Action Plan. Check out the progress we've made to #ActOnClimate → http://t.co/NtNyNsxCks",6,1
483964012846411776,2014-07-01 13:23:06,I finally discovered Instagram! Follow me at SJLTX18.,1,2
483963802413961216,2014-07-01 13:22:16,"#BokoHaram terror is not simply a matter of social justice, but a matter of national security.  #BringBackOurGirls",14,1
483963559094009856,2014-07-01 13:21:18,"Do you want the latest updates? Then, go follow me on Instagram at SJLTX18.",0,1
483677548334030850,2014-06-30 18:24:48,I am working diligently about these unaccompanied children to ensure the best decision is made. http://t.co/65VuIIbOQl,6,3
483651389999308800,2014-06-30 16:40:51,"If you want the latest updates, please follow me on Instagram at SJLTX18.",0,1
483623128757981184,2014-06-30 14:48:33,Please go and follow me on Instagram at SJLTX18,2,1
483596179725615104,2014-06-30 13:01:28,We call for the immediate rescue of the Nigerian girls. RT to #BringBackOurGirls!,11,4
482605424383115264,2014-06-27 19:24:34,Here's what's at stake if House GOP fails to reauthorize funding to fix our crumbling roads &amp; bridges:http://t.co/QOu2poLuF2 #RebuildAmerica,3,1
482554583798251520,2014-06-27 16:02:32,"Instead of punishing &gt;3.1 million Americans still searching for work, @HouseGOP should pass @RepDanKildee &amp; @RepHorsford's bill to #renewUI.",26,9
482512751072657408,2014-06-27 13:16:19,Brutality like #BokoHaram that is unchecked &amp; unpunished poses a threat to innocent people everywhere. We must #BringBackOurGirls!,6,0
482510516624297985,2014-06-27 13:07:26,"In about 20min, I will be discussing my Nigeria trip on the Joe Madison - ""The Black Eagle"" Show. Tune in as we focus on #BringBackOurGirls",4,0
482509608481988608,2014-06-27 13:03:49,Looking forward to going on @MadisonSiriusXM to discuss my recent trip to Nigeria today.,2,1
482290961201233920,2014-06-26 22:35:00,Think we don’t need to update the Voting Rights Act?  Think again.  http://t.co/z86LB6xE3h  #VRA4Today,3,3
482231608733626368,2014-06-26 18:39:09,I have introduced the ‘Justice for Children Now Act of 2014'.It will add 70 Immigration Judges to the Executive Office of Immigration Review,6,4
482229930718416898,2014-06-26 18:32:29,http://t.co/IaFekbrLKb,3,0
482227383815385088,2014-06-26 18:22:22,"Today,I held a press conference to discuss the recent influx of Unaccompanied Children coming across our borders #UAC http://t.co/UXR6MTmmIQ",2,1
482222849638555648,2014-06-26 18:04:21,RT @louiseslaughter: We've got to #ProtectTheZone! Read more about #SCOTUS' #McCullen decision here: http://t.co/i3oWfADGQr http://t.co/CnP…,29,0
482003476684500992,2014-06-26 03:32:38,"My sympathies go out to the loved ones of the victims killed and injured in Abuja, Boko Haram's terror reign must end. Enough is enough!",9,5
481868968740012033,2014-06-25 18:38:09,"Today, I had the pleasure to salute the 2014 Presidential Scholar in the Arts. As I celebrated this young lady... http://t.co/pPE0fEbIpd",3,2
481868150183854081,2014-06-25 18:34:54,"""Tell those who can't seem to hear or understand, that our right is not one to be denied!"" #VRA4Today http://t.co/Yt1KSjYkl2",11,0
481866852272852992,2014-06-25 18:29:44,VRA Press Conference 2014: http://t.co/Ye3OVb8jYW via @YouTube,4,0
481840022870831104,2014-06-25 16:43:08,Throwing out preclearance is like throwing away your umbrella in a rainstorm b/c you're not getting wet. #VRA4Today http://t.co/8B4ITG5LUs,9,4
481836737027911681,2014-06-25 16:30:04,"""The price of failure is democracy itself""--@repjohnconyers on why Congress must renew the #VRA4Today: http://t.co/sHHdsISqUI",3,0
481833923706904576,2014-06-25 16:18:54,@DianeSawyer Congratulations on all of your achievements while with @ABCWorldNews. Good luck with your future endeavors.,0,0
481818505990262786,2014-06-25 15:17:38,Join the movement to restore voting rights protections in the U.S. http://t.co/VYsD0c369J via @civilrightsorg,5,1
481818010131656704,2014-06-25 15:15:40,I will attend the @civilrightsorg rally on restoring voting rights protections in the U.S at 12:30 pm today. #VRA4Today,11,4
481793388686376960,2014-06-25 13:37:49,"Fifty years after Freedom Summer, the Voting Rights Act is needed more than ever: http://t.co/nXCD1sWddR #VRA4Today http://t.co/tTkeUjRTmy",8,8
481788597658742784,2014-06-25 13:18:47,Families of the Nigerian girls are living the most egregious form of violation of their human rights. #BringBackOurGirls #joinrepwilson,9,2
481539742128160768,2014-06-24 20:49:55,I attended a Congressional Gold Medal Ceremony in honor of Rev. Dr. Martin Luther King Jr. and Coretta Scott King. http://t.co/ImtsMjDRcl,3,4
481426390823469057,2014-06-24 13:19:30,"RT @RepWilson: Join me in tweeting #BringBackOurGirls daily, between 9am and 10am. Support the #kidnapped #Nigerian school girls.",11,0
481247208789274625,2014-06-24 01:27:30,Critics who say Hillary is not in touch need 2 know her life story and the fight she has in her 2 help millions of American working families,10,5
481246073693167617,2014-06-24 01:22:59,Hillary Clinton is in touch with millions of families and women who need a fighter for their issues in 2016,11,3
481182170086932483,2014-06-23 21:09:03,I attended the The White House's Working Families Summit today. #FamiliesSucceed #WorkingFamilies http://t.co/W3acrs4Phh,19,19
481131562717937664,2014-06-23 17:47:58,"On the 50th anniversary of Freedom Summer, we remember the sacrifices of brave activists who risked their lives so that everyone could vote.",3,4
481104759206973440,2014-06-23 16:01:27,Aren't children so precious?! http://t.co/lnlYJvt7NT,1,0
481092501907202048,2014-06-23 15:12:45,Let's help #FamiliesSucceed by making sure our workplace policies catch up with our workplaces http://t.co/lkwyfJk89I http://t.co/V2BXuBt53W,3,2
481089880454602752,2014-06-23 15:02:20,Happy LGBT Pride Month! Follow @LGBTEqCaucus to learn more about contributions of the LGBT community. #Pride2014 #LGBTPrideMonth,3,1
481071812055691264,2014-06-23 13:50:32,"RT @vj44: It's not just the glass ceiling that we have to worry about, but the sticky floor as well. #FamiliesSucceed #equalpay http://t.co…",87,0
480069524600131584,2014-06-20 19:27:48,"“A matter of basic decency”-@repjohnconyers, @RepCartwright &amp; @RepHorsford spell out why we must #RenewUI http://t.co/uKTYQWIlRJ",8,5
480067934472372225,2014-06-20 19:21:29,"The White House’s Working Families Summit kicks off on Monday! Check it out: http://t.co/aUzVPtg4Bw. When #womensucceed, #familiessucceed!",8,5
480066918100238336,2014-06-20 19:17:27,There are over 43.7 million refugees and internally displaced people around the world. #WorldRefugeeDay #ShareTheJourney,4,3
480051033679626240,2014-06-20 18:14:20,Progress: Obama administration will work to ensure that #LGBT Americans can take leave to care for their partners. http://t.co/tIYtunDlT0,5,1
480032647008509952,2014-06-20 17:01:16,"Stop by our Height's Office today as we participate in the ""Jazz on 19th Street"" from 6-9pm.  We will feature... http://t.co/iZuHnwcQOo",2,0
480016434010284032,2014-06-20 15:56:50,Gratified the House adopted my anti-Boko Haram amendment to the FY15 Defense Appropriations Act. #BringBackOurGirls http://t.co/maVWCdozdh,0,0
479996653504847872,2014-06-20 14:38:14,"RT @RepWilson: Join the campaign! Tweet #bringbackourgirls daily @ 9am EST, 8am CT, 6am PT. Support #kidnapped #nigerianschoolgirls http://…",55,0
479990019223203840,2014-06-20 14:11:53,"RT @HRC: Stop the Excuses, Texas #GOP. http://t.co/pupAplyHYi via @HRC",42,0
479744663482826753,2014-06-19 21:56:55,"Today, I met with @SteveWorks4You @RepLoisFrankel @RepWilson and others to discuss Nigeria and the Boko Haram http://t.co/JbtAPJjbNq",5,2
479696229799301120,2014-06-19 18:44:28,"Today, President Obama will award the Medal of Honor to an American hero, Marine Cpl. Kyle Carpenter. His story: http://t.co/kNuJjabs2X",4,1
479654086485483520,2014-06-19 15:57:00,"Today at 1pm, I will hold a press conference about Nigeria, the Boko Haram, and an update on the kidnapped girls. #BringBackOurGirls",9,6
479636527455432704,2014-06-19 14:47:14,I will also be joined at the press conference by @RepLoisFrankel @RepBarbaraLee @YvetteClarke @RepBeatty and other Members of Congress.,4,2
479635066549981184,2014-06-19 14:41:25,Today @ 1pm I will hold a press conference with @SteveWorks4You @RepCorrineBrown @RepWilson on Nigeria and the Boko Haram #BringBackOurGirls,5,0
479626546815463424,2014-06-19 14:07:34,"Today, on Juneteenth, we celebrate freedom while acknowledging the sacrifices and contributions made by courageous African Americans.",17,9
479617365173624832,2014-06-19 13:31:05,"Today, we commemorate the ending of slavery in the United States.  Dating back to 1865, it was on June 19th that... http://t.co/f1Nxwh67Ej",16,8
479611407861043200,2014-06-19 13:07:25,RT @RepVeasey: The Senate passed #CIR almost a year ago but House Republicans refuse to give the American people a vote. #TimeIsNow,123,0
479368308479639552,2014-06-18 21:01:25,Nigeria Press Conference Houston Part 2: http://t.co/10vSUAwRBy via @YouTube,3,2
479368307741429760,2014-06-18 21:01:25,Nigeria Press Conference Houston Part 3: http://t.co/F331aqf32i via @YouTube,4,1
479367353793146880,2014-06-18 20:57:38,Nigeria Press Conference Houston Part 1: http://t.co/Vxf1lWwvk3 via @YouTube,3,1
479317170871361537,2014-06-18 17:38:13,3 million Americans were cut off from unemployment insurance and Republicans have no plans to renew support for struggling families.#RenewUI,43,15
