id,created_at,text,retweets,favorites
509783041531985921,2014-09-10 19:18:43,RT @TomCoburn: #WasteWednesday From 2000-2007 Medicare paid up to $92M on medical supplies prescribed by dead doctors &amp; $8.2M on supplies f…,81,0
509753990574530561,2014-09-10 17:23:16,In Judiciary about to get in a debate with Dems who want Libyans to get visas for nuclear and aviation training.,23,9
509538554763296770,2014-09-10 03:07:12,My Qs for Dept of Justice Inspector General. Supposed to have total access for internal reviews. Not so much at DoJ https://t.co/nkYJZijjnt,5,9
509526950059065344,2014-09-10 02:21:06,Boy face plants in Oval Office out of sheer boredom http://t.co/4LrmOGMbNs via @kslcom,10,16
509489011560550402,2014-09-09 23:50:20,House votes to condemn administration over Taliban prisoner swap | TheHill http://t.co/mOMaxo1Xae via @TheHill I voted AYE,38,23
509044341416140801,2014-09-08 18:23:23,RT @AdamSchefter: Big news from @mortreport: Ray Rice released. Finished with Baltimore.,8230,0
509030594765148161,2014-09-08 17:28:45,Introduced a bill today to counter the Obama admin from authorizing training Libyan nationals aviation &amp; nuclear  http://t.co/kODQTedJy6,63,28
509006931848347648,2014-09-08 15:54:44,Greta Van Susteren: White House Pressured Me to Get Fox News to Back Down on Benghazi http://t.co/1Fif2OozK2 @DailySignal,70,17
508758474059431936,2014-09-07 23:27:27,Got a bit dirty riding. So beautiful with the leaves changing. @ Wasatch Mountain State Park http://t.co/7qpsSl1Lst,9,11
508757660137574400,2014-09-07 23:24:13,Over the weekend I rode some ATVs in Wasatch County. That is me hidden on the right. @ Wasatch… http://t.co/6bzyeq9T47,5,6
508484503342309376,2014-09-07 05:18:47,BYU football: Cougars rout Texas again 41-7 (video) | The Salt Lake Tribune http://t.co/KmG0bfqJ4J via @sltrib,3,7
508334725803417600,2014-09-06 19:23:37,"Is nothing sacred? Forest Service says drop chocolate, add fruit to your s'mores | http://t.co/hF8hhEDL79",15,7
508326515604348928,2014-09-06 18:51:00,The Speaker on President Obama. I agree. #immigration  http://t.co/fZKSCirG9W,10,4
508035347130093569,2014-09-05 23:34:00,Outragous. More lost emails at #IRS http://t.co/eVsyjJKHMp,27,16
507950235642265600,2014-09-05 17:55:48,Will be on @FoxNews at the top of the hour #Benghazi,18,16
507725329608474624,2014-09-05 03:02:06,RT @BretBaier: Tomorrow's NYTimes.  http://t.co/bfpYYMvjia,58,0
507723771302510592,2014-09-05 02:55:54,New Book Says C.I.A. Official in Benghazi Held Up Rescue http://t.co/MT3qYMc011,38,16
507723676960432128,2014-09-05 02:55:32,"RT @FNReporting: 13 Hours at Benghazi - The Inside Story 
w/ @BretBaier airs Friday September 5th at 10pm ET
http://t.co/IQMwhlTQSe",158,0
507371988113821698,2014-09-04 03:38:03,Been talking about this problem. Rogue ‘Cell Towers’ Can Intercept Your Data; One Found In Chicago « CBS Chicago http://t.co/OPL6pHOrPF,49,12
507266132193976321,2014-09-03 20:37:25,Planning to be on @gretawire  tonight on @FoxNews,9,10
507156029671342080,2014-09-03 13:19:54,National Review: Chaffetz for Oversight Chairman http://t.co/rNII1AmySq via @NRO,10,6
507020496324812800,2014-09-03 04:21:20,CDC Director: Ebola Outbreak ‘Is Spiraling Out Of Control’ « CBS Atlanta http://t.co/9xH8eUEODJ,30,5
506824625049702401,2014-09-02 15:23:01,States should not expect a federal bailout http://t.co/fRKnmibay6,11,11
506666286214938625,2014-09-02 04:53:50,"Happy Bacon Day: Americans ate more than 1 billion servings in 2013
http://t.co/rXMZeSkKYM So sorry I missed this on Saturday. My bad.",20,24
506629560515850241,2014-09-02 02:27:54,"Mr President, your words are hollow, your facts don't hold water, and America knows it. http://t.co/FH1hvtZmnc",267,171
506475443449384960,2014-09-01 16:15:30,"Moab and Arches high above the Colorado River. Moab Utah @ Canyonlands And Arches Parks In Moab, Utah http://t.co/AB8LkOnEzR",1,5
506465174610776064,2014-09-01 15:34:41,Hummer ride. Moab Utah @ Moab http://t.co/dkJVzXErL5,4,5
506443650885484545,2014-09-01 14:09:10,Zuckerman: Obama ‘Has Lost the Confidence of the Business Community’ http://t.co/ZpkLESE25R via @BreitbartNews,39,14
506094941932515330,2014-08-31 15:03:31,Militia says it 'secured' US compound in Libya http://t.co/UcpkNLO7xh (from @AP),19,3
506093435774697472,2014-08-31 14:57:32,Libya is in chaos. Reported takeover of our Embassy there demonstrates the volatility. US attention and strategy continues to flounder.,37,15
505923750806581248,2014-08-31 03:43:16,With Julie in Moab. Love it here. http://t.co/C4qfeVCkQc,3,11
505501045384957953,2014-08-29 23:43:35,"Nerds, geeks needed to find Lois Lerner's emails http://t.co/gHpV6lLCuW via @theblaze",33,20
505385615781675008,2014-08-29 16:04:55,The 'We Can't Wait' Clause http://t.co/ajtGBTTkmV via @NRO,6,1
505166349321400320,2014-08-29 01:33:37,Rep. Chaffetz 'more fired up than ever' over IRS emails http://t.co/7XtCDTpy4X #IRS,21,19
505006701381427200,2014-08-28 14:59:14,Football is in the air. From way back in the day. #tbt http://t.co/uzIVfepPHK,25,54
504990180575805440,2014-08-28 13:53:35,Going on @FoxNews at the bottom of the hour #IRS #utpol #tcot,7,11
504476223032934400,2014-08-27 03:51:18,Feds: Cost of http://t.co/3oaERdwDSp Estimated $1.7 Billion. ALL Republicans voted NO. Dems Yea | The Weekly Standard http://t.co/aXVbBrVzY5,31,15
504391745660936193,2014-08-26 22:15:37,Good to visit the Reddit office in Salt Lake City http://t.co/FxlUSmUOxd,3,7
504042402567700480,2014-08-25 23:07:28,DOJ attorneys suggest  'lost' Lerner emails likely still exist: Judicial Watch http://t.co/yQ3EHGukT2 via the @FoxNews Android app,66,31
503920144171945984,2014-08-25 15:01:39,My GPS bill would help solve this. For sale: Ability to secretly track cellphone users’ moves http://t.co/Tq632LIgUf via @washingtonpost,6,3
503598946975879168,2014-08-24 17:45:20,Not good.Situation continues to worsen. Libya Islamists Seize Tripoli Airport as Parliament Duels http://t.co/8zLeET291z via @BloombergNews,11,3
502251872330076162,2014-08-21 00:32:32,"Rep. Gowdy  says he will bring prosecutor's focus, fairness to #Benghazi probe http://t.co/sLfuanaefw",48,40
501896837368791040,2014-08-20 01:01:45,RT @SharylAttkisson: Q: Who will be the lead attorney on Benghazi Select Committee? A: Fmr. Army Judge Advocate General under Pres. Obama h…,85,0
501486395618115584,2014-08-18 21:50:48,"Fox News August 18, 2014 Future of public lands: http://t.co/U8RVN7jmUF",8,6
501350202566254592,2014-08-18 12:49:37,Yeah. It is this good in Utah. http://t.co/d0rfQtHA2J,7,18
501348790302179328,2014-08-18 12:44:00,Deer Creek spectacular as always this morning http://t.co/ctU9DV9GUO,2,10
501069533537239040,2014-08-17 18:14:20,This headline sums it up. http://t.co/htdm6AfqSk,6,13
501064992641150977,2014-08-17 17:56:18,"Doing math with Democrats.  ""Math Class"" (Imagined by Kids): http://t.co/sObgyOHMMT",8,6
501024346287009794,2014-08-17 15:14:47,The Clinton way. http://t.co/apCtQplrdw,17,9
500294540616802304,2014-08-15 14:54:48,Utah Republican warns of kids gambling online | TheHill http://t.co/LwoUGNSZZY via @TheHill #utpol #tcot,7,4
500072807339159552,2014-08-15 00:13:42,"RT @Newsweek: Cover story: How Washington opened the floodgates to online poker, dealing parents a bad hand http://t.co/25AjvP4haO http://t…",18,0
500071757181505536,2014-08-15 00:09:32,$2.46T: Tax Revenue for FY14 Hit Record Through July--Gov't $460B Deficit http://t.co/yJWzlm8hS7 WE HAVE A SPENDING PROBLEM NOT REVENUE PROB,70,33
500060692259434496,2014-08-14 23:25:34,Everything's+Amazing+ +Nobody's+Happy: http://t.co/4ro1Ke7XoW,7,6
500003865974943747,2014-08-14 19:39:45,7 puppies today and I think we're done. Mom is a bit tired. http://t.co/smsKA3CIqn,13,26
499988774882127872,2014-08-14 18:39:47,She has had SIX and I don't think we are done yet. http://t.co/bKpnU6Vzhv,8,14
499981476788969472,2014-08-14 18:10:47,"This was the first one. Our dog, Charlie, is having pups today. http://t.co/AeNO0oqEhf",7,20
499981134269526016,2014-08-14 18:09:26,Out of order. Here is number 2. They are Cavaliers. http://t.co/gYCZeAIBlW,6,8
499980733239537664,2014-08-14 18:07:50,And here is number 4 http://t.co/nq4NmerIOb,7,17
499980432197181440,2014-08-14 18:06:38,Our dog is having pups today. 3 so far. http://t.co/azz4GDKiyB,11,31
499979806260203522,2014-08-14 18:04:09,"How Washington Opened the Floodgates to Online Poker, Dealing Parents a Bad Hand. I have introduced leg to solve this http://t.co/vyOTuh2z6w",3,1
499899812322766848,2014-08-14 12:46:17,"US, allies worried about growing Libyan violence | TheHill http://t.co/8bxikgXeYv via @TheHill",9,2
499737258744766465,2014-08-14 02:00:21,Salt Lake City to legalize Uber and other similar companies.  YES!  Good move.  I'm a huge Uber fan. http://t.co/yjqOBGwe58,28,27
499684146369667072,2014-08-13 22:29:18,Outlook brightens for old Cottonwood Mall site in Holladay | The Salt Lake Tribune http://t.co/KO6IEb9RKq via @sltrib,4,3
499610575492902912,2014-08-13 17:36:58,The most open and transparent White House http://t.co/URcnpovMCA,36,15
499609537389662208,2014-08-13 17:32:50,What I Saw During Our Vote To Secure The Border | RedState http://t.co/xC1BdE3G3s,22,8
499393306992721921,2014-08-13 03:13:37,“Law Students Defeat a Patent Troll.” by @TeachingAway https://t.co/pBVXATJUAI Good for them,28,22
499334474396880896,2014-08-12 23:19:50,Obama vacations as the world burns http://t.co/CpU7ZLzxaB via @washingtonpost,109,62
499244133677293568,2014-08-12 17:20:51,"RT @HouseJudiciary: .@RepGoodlatte, @TGowdySC &amp; @jasoninthehouse blast Admin policy allowing Libyan pilots &amp; scientists to study in U.S. ht…",18,0
499243646911512576,2014-08-12 17:18:55,RT @SharylAttkisson: See the chart for where the most convicted criminal illegal immigrants were released: http://t.co/u7qi7ELdqW,102,0
499243505844514816,2014-08-12 17:18:21,RT @SharylAttkisson: NEW: Hundreds of convicted criminals among the thousands of illegal immigrants released prior to sequestration http://…,90,0
499046635645571072,2014-08-12 04:16:04,WH: Repeal Anti-Terorrism Policy for Libyan Nationals | National Review Online http://t.co/FxJvoACnBN via @#,11,3
499024665369513984,2014-08-12 02:48:46,FLASHBACK: Obama Promises No Vacations For Himself As President [VIDEO] http://t.co/nafavJHHg4 via @dailycaller,75,33
498923450090520576,2014-08-11 20:06:34,Obama Admin wants Libyan nationals to be trained in aviation and nuclear sciences.  You can't make this stuff up. http://t.co/yw5JRjrCRz,158,42
498642154177056768,2014-08-11 01:28:48,Patent office masks telework abuses http://t.co/NQxxPvfGZf via @washingtonpost,12,4
497799688641191937,2014-08-08 17:41:09,"Do Your Job, Mr. President http://t.co/nwu4yB9DS1",8,18
497714021286825984,2014-08-08 12:00:44,State Department hires testimony coach to prepare for congressional grillings http://t.co/sImb4vAKEd Wasted $$ #JustTellTheTruth,82,25
497586682599055360,2014-08-08 03:34:44,"No Kidding? HHS Likely Lost Subpoenaed Docs, Too. http://t.co/4HiwN9hfyp",28,10
497586448875675649,2014-08-08 03:33:48,Issa: More Than 20 Obama Officials 'Lost or Destroyed' E-mails After House Launched Probes | National Review Online http://t.co/WfGfjcpWyo,281,86
497152930026254336,2014-08-06 22:51:09,Gov’t watchdogs unite in letter slamming Obama administration transparency http://t.co/eJQ1FOe0vR via the @FoxNews Android app,42,12
497075124030300160,2014-08-06 17:41:59,Gov. Gary Herbert invites senators seeking new monument to visit Utah | Deseret News http://t.co/niDBOBRi6p,3,4
496771387517050880,2014-08-05 21:35:03,“@AP:U.S. official says senior officer killed in Afghanistan insider attack is Maj. Gen. Harold Greene: http://t.co/Xyiq11Nb0K” God bless,11,0
496770435846246400,2014-08-05 21:31:16,RT @dfields: Thanks to @jasoninthehouse for stopping by @snowbird to learn about what we do. @ScottSLC @VisitSaltLake @visitutah http://t.c…,2,0
496736742339518464,2014-08-05 19:17:22,"Cummings, Chaffetz Seek 'Higher Ground' - Bloomberg http://t.co/pSjp91cPz2 via @BNPolitics",8,4
496682735344558080,2014-08-05 15:42:46,MSNBC Morning Joe with Rep. Chaffetz and Cummings…: http://t.co/bk1Nlp5tTV,5,4
496415886677667840,2014-08-04 22:02:25,Rep. Jason Chaffetz and Maryland Democrat build political bridge in Utah - http://t.co/cBKvG7D5pb,9,9
496411282262982657,2014-08-04 21:44:07,Chaffetz escorts a Democrat deep into conservative Utah - http://t.co/aGjn3PoRyZ,5,7
496348820729782273,2014-08-04 17:35:55,Going on @kslnewsradio at the top of the hour with @RepCummings  #utpol,3,3
496329635685486592,2014-08-04 16:19:41,Thanks to @RepCummings  for coming out to Utah and Arches http://t.co/0RYOTCpbdC,16,17
496328953037344770,2014-08-04 16:16:58,Great time at Arches with repcummings http://t.co/7khuznaMAi,1,3
496327657941106688,2014-08-04 16:11:49,At Arches with repcummings http://t.co/7fHdYL54tj,3,4
496310948852809730,2014-08-04 15:05:25,With repcummings and county commissioners first thing this morning discussing public lands http://t.co/qGOy5fMbTw,4,2
496281031373500416,2014-08-04 13:06:32,"After a night on the river, we are going to talk public lands, ESA and meet with county commissioners… http://t.co/85wzmPzShO",6,5
496280376281952256,2014-08-04 13:03:56,Took repcummings out on the Colorado River to talk public lands issues http://t.co/lhityH8ARD,3,6
496279820741779457,2014-08-04 13:01:44,Touring the Moab Utah area with repcummings. I toured his district now he is in UT-3 http://t.co/FbhrWa0OcR,7,6
496035920391716864,2014-08-03 20:52:33,Chaffetz bringing a Democratic House member to Utah http://t.co/X7HJlnUVl9 #utpol #tcot,7,7
495964853870137344,2014-08-03 16:10:10,Barney Frank: Obama ‘lied’ about health plans | TheHill http://t.co/Qvt2CwAqeQ via @TheHill,70,20
495737554483044353,2014-08-03 01:06:58,"Chaffetz brings East Coast congressman to Utah to hear about public lands, other West issues - http://t.co/IhsSwoYhoT #utpol",19,12
495616894208978945,2014-08-02 17:07:30,"RT @gretawire: DNI Clapper lies to the Senate,no grand jury;CIA violates domestic spying law,no grand jury - what if YOU do something wrong…",103,0
495371255642865664,2014-08-02 00:51:25,Chaffetz talks House Border Bill on @FoxNews @gretawire  : http://t.co/Ihu8YelW8d,22,12
495006038043918336,2014-08-01 00:40:10,"Clinton on Sept. 10, 2001: I could have killed bin Laden but 'I didn't' http://t.co/pfPrgqgXk4 via the @FoxNews Android app",38,16
494999816699916289,2014-08-01 00:15:27,Federal Court Releases Hold on Fast &amp; Furious Docs Case http://t.co/MC9wWtL8kD,39,23
494615441101180928,2014-07-30 22:48:05,Speaker Boehner Urges House to Defend the Constitution http://t.co/8lBGBpyGG1 via @SpeakerBoehner,17,11
494614895267024897,2014-07-30 22:45:55,Voted to file a lawsuit against the executive branch Passed the House http://t.co/TTxTPoNanm,14,16
494304576309563392,2014-07-30 02:12:49,Going to get the #Benghazi answers. http://t.co/gVWIzJQPce,26,39
494191050655686657,2014-07-29 18:41:42,New report says 2013 was 'the largest displacement of religious communities in recent memory' http://t.co/B5g1iw6Ejg via @deseretnational,10,4
493858465224609792,2014-07-28 20:40:08,Stunning #s &amp; $$ regarding unpaid taxes. Pay your taxes or you may lose your federal job http://t.co/Z14wBhec5u,20,13
493778243833450496,2014-07-28 15:21:21,Boehner: We're defending the Constitution http://t.co/NeHuAKQpjm via @USATODAY,9,5
493755230174347264,2014-07-28 13:49:55,"They had to do a study to figure this out? Fist bumps less germy than handshakes, study says http://t.co/TLidLz1DmZ via the @FoxNews",14,11
493500273906577408,2014-07-27 20:56:48,Americans really wish they had elected Mitt Romney instead of Obama http://t.co/Sb4VXG6qxG via @TheWeek,47,48
493469070176440320,2014-07-27 18:52:49,"More Than 50 Killed in Benghazi, Tripoli Clashes http://t.co/2uVWwINi0t",17,6
493412416840298496,2014-07-27 15:07:41,Worried about the Spring Canyon fire East of Springville,1,1
493408397996621824,2014-07-27 14:51:43,RT @EmilyMiller: Judge in #Palmer: DC has to allow gun carry for residents and non-residents... ie ALL Americans!  http://t.co/S8coWR1dPE,63,0
493179249721745408,2014-07-26 23:41:10,The Evidence Is In: Patent Trolls Do Hurt Innovation - @HarvardBiz http://t.co/4cgl2EYbzz,17,15
493091937188995072,2014-07-26 17:54:13,Good piece about the lawsuit from the House http://t.co/RM0TY0FLaQ,27,9
493043869093998592,2014-07-26 14:43:13,US evacuates embassy in Libya amid clashes http://t.co/NiSFK32I2d via @YahooNews,11,3
492733076754022400,2014-07-25 18:08:14,House committee slaps White House for ignoring subpoena http://t.co/gAxtBgIUlK via @theblaze,20,8
492716887810138113,2014-07-25 17:03:54,Cell phone unlocking bill just passed in the House. On to the President.,31,7
492356727862353920,2014-07-24 17:12:46,Thumbs up as I destroy this burrito from Cafe Rio in celebration of Pioneer Day. #pioneerday http://t.co/UYQ8PxO6zr,7,12
492274017198673921,2014-07-24 11:44:06,Scored!  I don't recall getting a hit. Must have been hit by the pitch. #tbt @foxandfriends http://t.co/ys2xjCzGco,3,18
492265660798357504,2014-07-24 11:10:54,Happy Pioneer Day! Utah's photo-rich history of Pioneer Day celebrations http://t.co/4dWcxrul6R via @kslcom,6,4
492076234458005506,2014-07-23 22:38:11,"Congrats-2014 NGA Best Bagger Champion-Andrew Hadlock, Macey’s Supermarkets in Sandy, Utah. On The Late Show https://t.co/JD958IOved",7,6
492073735143567360,2014-07-23 22:28:15,Audit the Federal Reserve?  YES! Similar bill coming up in committee tomorrow. Video from last year's fight https://t.co/q2Dvz9Xd03,33,25
491646207781900288,2014-07-22 18:09:24,@PeterHambyCNN Good find about Aug 1 :),0,0
491570361927229440,2014-07-22 13:08:01,"Chaffetz on Oversight: More Results, Less Confrontation http://t.co/lzQuryVRtg via @rollcall",7,2
491269921339211776,2014-07-21 17:14:11,Issa: Special prosecutor needed for uncompromised IRS probe http://t.co/PyckTwGYXq via @utsandiego,59,20
491247133136531456,2014-07-21 15:43:38,"If we could get the Senate to act on the 240 House-passed bills they have stopped, I would prioritize this one. http://t.co/WIngWvYbbt",83,31
491246536655781888,2014-07-21 15:41:15,A Future without Electricity  http://t.co/ObiwTzTHmA via @NRO,9,4
491048368895184896,2014-07-21 02:33:49,House v Senate http://t.co/PZAnSRgA5a,75,44
490914125468295168,2014-07-20 17:40:22,Gut Check: The Sleeping Policeman http://t.co/o7yaDloNf4 via @BreitbartNews,12,9
490869272596721664,2014-07-20 14:42:09,http://t.co/81vHyKztZA,114,90
490853535223775233,2014-07-20 13:39:37,"Sad to hear James Garner passed away. I was a fan of The Rockford Files, Maverick,  etc.",19,30
490716702502813697,2014-07-20 04:35:53,"@Chris_Hadrick That's funny. Yeah,  the mosh it at Any Grant",0,0
490713698152218624,2014-07-20 04:23:57,@MrRavine Athlete?  I was a kicker,0,0
490713125411635200,2014-07-20 04:21:40,"Ouch! Ran into the mantle at home and smacked my arm. Shouldn't try to cut corners, kids. http://t.co/L1zgtaI63O",7,18
490371709418352640,2014-07-19 05:45:00,Good time tonight at #Sundancebluebird for the @amygrant concert.  Beautiful night in Utah. http://t.co/7dnp5Lv6Y2,9,41
490309912254115841,2014-07-19 01:39:27,At Sundance tonight for an outdoor concert. Love Utah!  Beautiful night. http://t.co/3gamTilfIn,7,17
490290664001654784,2014-07-19 00:22:58,Please keep this family and many others affected by yesterday's tragedy in your thoughts and prayers. So sad  http://t.co/EYt0r0hp8U,28,24
490205875567886336,2014-07-18 18:46:03,Ouch! Silly me turned the corner a bit fast and ran into the mantle at home. The mantle won. http://t.co/YVzD077yzk,2,12
489979507281911810,2014-07-18 03:46:32,Jimmy Fallon Has a Hilarious Reason Why Obama Will Never Be Impeached - But One Great Benefit of It http://t.co/EGUAcndOX2,15,13
489903150237634560,2014-07-17 22:43:07,"RT @JaredHalpern: Speaker Boehner statement on Malaysia flt 17: Many innocents were killed today.  It is horrifying, and we await the facts…",4,0
489866828508704768,2014-07-17 20:18:47,Introduced a new immigration bill today worn the Judiciary Chairman.  http://t.co/PXllMwoLSN,13,9
489797373494050816,2014-07-17 15:42:48,My interview on @FoxNews with @gretawire https://t.co/zVSr1AqKBO,5,3
489736534275284992,2014-07-17 11:41:03,10 Years of 'Napoleon Dynamite:' Where are they now? http://t.co/1YglCvZnz8 via @kslcom,7,6
489611165535059968,2014-07-17 03:22:53,Why is DOJ still investigating Gen. Petraeus? I find it a bit perplexing and suspicious http://t.co/J8FXEgDZ0e,55,21
489609279817535488,2014-07-17 03:15:23,"Patent trolls now-67 percent of all new patent lawsuits. House passed leg to fix, Senate said no http://t.co/wsYSblpo7R via @washingtonpost",30,4
489541146608013312,2014-07-16 22:44:39,Going on with @gretawire  on @FoxNews  tonight about :20 after the hour #utpol #tcot,10,7
489469415571095552,2014-07-16 17:59:37,Will be on @FoxNews  with @GretchenCarlson  in a moment,3,7
489469164017704960,2014-07-16 17:58:37,RT @GretchenCarlson: Rep. @jasoninthehouse calls timeline of Gen.Petraeus investigation “perplexing &amp; suspicious.” Exclusive on #TheRealSto…,10,0
489241501072105474,2014-07-16 02:53:58,I helped pass the ban on taxing internet access (Internet Tax Freedom Act). Today's Floor speech...it passed.  https://t.co/6ma1THL9R7,65,67
488767513204117504,2014-07-14 19:30:30,My Floor speech in support of the Internet Tax Freedom Act. Up for a vote this week. Tell Congress to vote AYE. https://t.co/pG6458iqto,43,19
488757209560403969,2014-07-14 18:49:34,Politicians Are Covering Themselves In Ice Water For Charity. I did it. Video here http://t.co/6J0ecJPppO via @BuzzFeedAndrew @buzzfeed,5,8
488648714396127232,2014-07-14 11:38:26,"RT @WebDotComTour: ""Half Man, Half Amazing"" @Andres_Gonzales (69) wins on @WebDotComTour for 2nd time by 4. Is 1st to win wire-to-wire twic…",20,0
488500911367405568,2014-07-14 01:51:07,Beautiful thunderstorm on my flight to DC tonight http://t.co/r2yP5HskjS,18,47
488493307392061442,2014-07-14 01:20:54,"Despite facts, they just keep saying it. Spokesman: Obama 'absolutely' the most transparent president http://t.co/OWlu1KxCSo via @TheHill",43,22
488167945487396864,2014-07-13 03:48:02,"Justin Harding, my former COS, Gov. Herbert's new chief of staff brings D.C. experience but 'no drama' | Deseret News http://t.co/Btnc0FD3kq",12,8
488147018842648576,2014-07-13 02:24:53,Disorder at the Border | The Weekly Standard http://t.co/a6MTNgokaV,52,18
487681322190925824,2014-07-11 19:34:22,I answered the call of @beckylockhart - Ice Bucket Challenge to fight cancer https://t.co/AfvsK5NNFT I challenge @MayorBenMcAdams #utpol,12,15
487678815255429120,2014-07-11 19:24:24,RT @beckylockhart: I took the challenge...ice dunk and a donation...challenging @jasoninthehouse. 24hrs and ticking friend...http://t.co/0w…,5,0
487599311820050433,2014-07-11 14:08:29,Controversy over government program to create beautiful embassies continues http://t.co/cTWxkCQmkJ via @cbsnews From our hearing,8,1
487571243453796355,2014-07-11 12:16:57,House Judiciary Chairman Goodlatte: How Obama Can Stop The Border Crisis http://t.co/kiPOCk2bTB via @BreitbartNews,21,7
487564169479069696,2014-07-11 11:48:51,Is the State Department Prioritizing 'Pretty Buildings' Over Preventing the Next Benghazi? http://t.co/dJWrSM8OHS via @nationaljournal,14,6
487299952939646976,2014-07-10 18:18:57,http://t.co/2TvDMXwim8,173,83
487299339459776512,2014-07-10 18:16:30,"Passed a bill yesterday that is good for Utah.  A technical, but needed change. http://t.co/ced6hzpGq3",6,3
487207099353821185,2014-07-10 12:09:59,The President should meet with the members of the National Border Patrol Council to hear what is really happening and how to solve it,48,33
487205911514324992,2014-07-10 12:05:15,RT @FoxNews: Border Patrol union spokesman: Obama request for funds 'does nothing to secure the border' http://t.co/4ST8vLBVzE,295,0
487077096058290176,2014-07-10 03:33:23,Here is one of the key documents Oversight revealed today. http://t.co/e4ZgQMTO0v,45,20
487075637560365056,2014-07-10 03:27:36,RT @Jim_Jordan: VIDEO: http://t.co/f6o6Q44Lxj - I question #IRS commissioner about NEW Lois Lerner email during today’s @GOPoversight heari…,31,0
487017333198974977,2014-07-09 23:35:55,Bill by Sensenbrenner would dissolve federal ATF agency http://t.co/dovqkLdQKn What do you think?,10,14
487016625837981696,2014-07-09 23:33:06,I don't want my $584 to buy games for illegal immigrants  http://t.co/2eCGR0LOJM,43,25
486953862629048321,2014-07-09 19:23:42,Rockets intercepted over Tel Aviv; IAF targets 160 Gazan terror sites overnight | JPost  http://t.co/OJ1uYpMdv6 Very serious situation,14,3
486953302131630080,2014-07-09 19:21:29,Someone had me on a list stating I advocated impeachment of the President. I have not taken that position. I said it is simply on the table.,22,16
486931424897810432,2014-07-09 17:54:33,"Billions In Taxpayer $$ Spent On 'Lyrical, Poetic' Embassy Architecture Overseas http://t.co/bW0q2ZRpu2 via @BreitbartNews Hearing tomorrow",19,7
486582832735592448,2014-07-08 18:49:22,Rep. Jim Bridenstine: Center tours like ‘Soviet Union’ http://t.co/ReukhXzD6y via @POLITICO,15,6
486510696117862401,2014-07-08 14:02:43,Link to my interview last night on Hardball with Chris Matthews https://t.co/Hwbnr9MRrL #utpol #tcot,10,6
486271931558010880,2014-07-07 22:13:57,Going on Hardball tonight with Chris Matthews and Congressman Cummings,13,12
486255301721473026,2014-07-07 21:07:52,RT @LukeRussert: Great story. RT: @MichaelLaRosaDC: Utah Rep. Jason Chaffetz takes a tour of the liberal side http://t.co/fmzkgg5Kz2 via @s…,12,0
486151517955559424,2014-07-07 14:15:28,Oversight Chairman Race: Jason Chaffetz Trying To Outwork Opponents http://t.co/jDk7eIxFYx via @BreitbartNews,6,3
