id,created_at,text,retweets,favorites
310094386774028288,2013-03-08 18:27:17,Congratulations to @GabbyGiffords for being awarded the #profilesincourage award.  Well deserved.,10,3
309777618117476352,2013-03-07 21:28:34,"Looks like it was the Senate graphics folks who insulted Sen. Heller with my pic #standingwithRand. Sorry, C-SPAN! http://t.co/Vzpq1XZEEL",16,5
309770374529314816,2013-03-07 20:59:47,"So what gives, CSPAN? I guess all mormons look alike? http://t.co/775c1eC5Wr",33,14
309753027038941184,2013-03-07 19:50:51,WH finally says what it should have said weeks ago. Would have saved @SenRandPaul a lot of time on his feet.,16,4
309534868528824321,2013-03-07 05:23:58,Happy to #standwithrand tonight on the Senate floor. @SenRandPaul,84,35
309428477969457153,2013-03-06 22:21:12,Kudos to @SenRandPaul for his efforts to get information from the WH on the use of use of drones to kill American citizens.,74,24
309427944865009664,2013-03-06 22:19:05,Excellent illustration by @fixthedebt of our debt problem http://t.co/CFWvwKucSD,8,1
309382010978316288,2013-03-06 19:16:34,"View from DC, where the fed gov't is closed down due to ... snow.  Well, at least we aren't blaming the sequester. http://t.co/DWuseORAKH",5,3
309294204478173184,2013-03-06 13:27:39,"Venezuela's interim leader blames ""imperialists"" for cancer that claimed Chavez.  Not an auspicious start to a new era.",3,0
309268098274447361,2013-03-06 11:43:55,"Blaming the #sequester, the WH cuts WH tours. C'mon, really? No denying there are sequester effects, but this seems a tad petty.",22,5
309131745062703106,2013-03-06 02:42:06,A new day dawns in Venezuela in a post Chavez era. Hope better days are ahead.,12,6
308957540203499521,2013-03-05 15:09:52,"Arizona will greatly miss Ross Farnsworth, and so will I. Fortunately, his family will carry on his legacy. http://t.co/O0p9gmsDoU",7,3
308745017042812928,2013-03-05 01:05:22,A behind the scenes look at the Senate “gym caucus.” I spend most of my gym time getting @marcorubio water. http://t.co/eN5BunQwSL,19,7
308708010174337024,2013-03-04 22:38:19,Looking forward to the @AIPAC policy conference tonight. Strong bond between Israel and the U.S. continues. #AIPAC2013,4,1
308617350603739136,2013-03-04 16:38:04,Sent a letter to Sec. Napolitano seeking answers on the release of immigration detainees in AZ. http://t.co/DpB8rn9Ymf,20,3
306484917968195585,2013-02-26 19:24:33,RT @SenJohnMcCain: Great sitting down today w/ @GovBrewer &amp; @JeffFlake as always http://t.co/pjh3lwkoKv,13,0
306183214723108864,2013-02-25 23:25:41,"@azchamber, thanks for the letter of support from AZ business community on our immigration efforts @SenJohnMcCain http://t.co/UMNnqEsEIz",2,0
306106886724415488,2013-02-25 18:22:23,The WH sequestration tactics are unproductive. Congress/Admin must find ways to cut federal spending across the board http://t.co/pT2NTaLx8j,17,4
303183727859736576,2013-02-17 16:46:48,President struck the right tone on immigration during SOTU. But leaking details of a partisan WH draft is not helpful.,7,1
302075340333936640,2013-02-14 15:22:28,"Happy 101st, Arizona!",12,6
302068676478246912,2013-02-14 14:55:59,"Happy V Day to the love of my life, 2,000 miles away. Hangin' out with Ried &amp; McConnell is fun but no substitute. http://t.co/CUf3mw8E",1,3
301334467786715136,2013-02-12 14:18:30,So this is how direct ag. payments have managed to survive… from @TheOnion: http://t.co/DiS2Llqm,4,0
301057185490800640,2013-02-11 19:56:41,WH seems to rule out entitlement reforms http://t.co/xk5PO3ul to fix debt crisis after ruling out most discretionary cuts. #cutspending,11,0
300034446340542464,2013-02-09 00:12:41,"WH warns that sequester will ""disrupt the life of the nation.""  As if continuing to borrow 40 cents on every dollar won't?",64,15
300015100939612160,2013-02-08 22:55:48,"@brahmresnik I said I'm pushing for ""broader,"" not ""universal,"" background checks.",1,0
299685994872070147,2013-02-08 01:08:03,"Think we need reform? During my CSPAN spot today, callers could phone in on 4 lines: Rep/Dem/Ind and ...""illegal immigrant."" #weneedreform",12,2
299602094413983744,2013-02-07 19:34:40,Working with @marcorubio to advance conservative principles in the immigration debate. @FoxNews http://t.co/SARPqV1a,6,4
298921660260687872,2013-02-05 22:30:52,Cool #STEM jobs from @Mashable http://t.co/FWiReooi We need more foreign-born STEM graduates to stay in the U.S.,3,3
298886308401643521,2013-02-05 20:10:23,“Delaying the spending cuts in the #sequester for a short time only allows more time to come up with a way to avoid them altogether.,9,3
298868796729483264,2013-02-05 19:00:48,"Pres. Obama ""does not offer specific proposal"" to avoid sequester.  I'm shocked. #cutspending",17,5
296702075511910400,2013-01-30 19:31:01,"@GabbyGiffords. Thank you, Gabby, and so good to see you. You are deeply missed here on Capitol Hill.",2,1
296638106080268288,2013-01-30 15:16:50,Great to see Gabby Giffords in the senate hearing today.,17,6
296362160878153728,2013-01-29 21:00:19,President's reform proposal silent on two key elements: certification of border security and temporary worker program.,20,5
296342565693841408,2013-01-29 19:42:28,Good editorial in the Sierra Vista Herald about the importance of border security in the new immigration proposal: http://t.co/cNTwljic,4,2
294216488620003329,2013-01-23 22:54:11,My take on today's Benghazi hearing: https://t.co/5ntvqKUG,4,5
294161030211309568,2013-01-23 19:13:49,Serious questions remain about #Benghazi. Ex: Why did Amb. Rice make statements contradicting known intelligence and analysis at the time?,16,3
294160393377554432,2013-01-23 19:11:17,"After this morning’s hearing, the picture of what happened in Benghazi remains hazy at best.",9,4
294157749305098241,2013-01-23 19:00:47,"Sec. Clinton regarding contradictory Benghazi explanations: ""What difference does it make?"" We'll, quite a difference, actually.",24,4
294110783481204736,2013-01-23 15:54:09,Ok,17,9
293585374083698688,2013-01-22 05:06:23,"Even when your guy doesn't make it to the WH, an inauguration is pretty special, Especially when your kids are in town. http://t.co/Et0QLxB0",10,6
293448570638581760,2013-01-21 20:02:46,"Three Senators born in AZ. With my good friends, and likely cousins, the Udall boys, Mark and Tom. http://t.co/Jqs7G4uQ",8,4
291350898557456385,2013-01-16 01:07:22,"Congrats to kid brother, Mike, just promoted to Chief Master Sergeant! Member of the 305th Rescue Squadron at DM AFB. http://t.co/ORDi5HAT",3,7
290956946104782848,2013-01-14 23:01:56,"Great to see Arizona troops doing a great job in Kandahar, Afghanistan this morning. http://t.co/Db25ou9n",14,10
289850038610440192,2013-01-11 21:43:29,In Israel today and was honored to meet with Prime Minister Netanyahu. Israel remains a stalwart ally. http://t.co/SfzCu20c,10,5
281966693184589824,2012-12-21 03:37:52,Spoke tonight on the #House Floor for the last time. http://t.co/y8Kuk5AC,9,5
280847926245343233,2012-12-18 01:32:18,Saddened by Sen. Inouye’s passing. He leaves behind huge respect for the body he served for all to share.,4,3
279659915386171393,2012-12-14 18:51:34,Deeply saddened by the tragic and senseless school shooting in CT. My thoughts and prayers are with the victims and their families.,11,1
274591272633790465,2012-11-30 19:10:35,WH plan to avert the fiscal cliff is not a serious proposal to get the country back on the right fiscal track. http://t.co/I7OvTvLV,4,0
274557648551178241,2012-11-30 16:56:59,Glad House passed STEM Jobs Act. Keeping more highly-skilled grads in the US will help keep us hub for tech innovation http://t.co/Zfspunpe,9,2
274282297581256705,2012-11-29 22:42:50,Disappointed UN granted Palestinian Auth upgraded status. Only path to peace thru direct negotiation btw Israel + PA  http://t.co/jkAiabCM,5,0
273574564850700288,2012-11-27 23:50:33,Step toward secure border: House passed bill mandating operational control as metric for evaluating border security http://t.co/AK4n4Suu,14,1
269524136177594368,2012-11-16 19:35:36,New rule on AZ air quality regs from EPA: Stands to increase electricity costs + will do little to improve air quality http://t.co/MTud81vn,8,1
267659271179759617,2012-11-11 16:05:17,Thank you to all of our nation's veterans. Your bravery and sacrifice have made our freedom possible. #veteransday,7,3
261921529737142272,2012-10-26 20:05:34,Here with Larry Brown and Ron Capek at the inductee ceremony for the AZ Veterans Hall of Fame #azsen http://t.co/ZedkCjSJ,6,1
249209747386011648,2012-09-21 18:13:28,My amendment to stop EPA from implementing costly haze-controlling burdens on coal-fired power plants passed #winforAZ http://t.co/3Lzgh2th,33,2
248949714186301440,2012-09-21 01:00:11,Voted to prevent Obama Admin. from weakening welfare program work requirements. Move has taxpayers rightly concerned. http://t.co/wKyouvsq,21,3
248901910353027074,2012-09-20 21:50:14,Disappointed the STEM bill failed in the House today. http://t.co/YypNzMin,3,0
248428307752833024,2012-09-19 14:28:18,"We will remember Larry Dever as the rugged sheriff, the consummate lawman. Thoughts and prayers are w/his family during this difficult time.",7,0
248106463304761344,2012-09-18 17:09:26,"Proud to receive @FreedomWorks Freedom Fighter award for defending economic freedom. Thanks, @Max_Pappas http://t.co/LA45EtwC",10,3
247802295788654592,2012-09-17 21:00:45,AZ BLM got the message after I intro’d bill to protect recreational shooting in AZ/West – Sonoran Desert to remain open to target shooting.,4,1
245922542697717760,2012-09-12 16:31:17,"My thoughts + prayers to families of the consulate attack victims in Libya. Such senseless, violent acts cannot be tolerated or justified.",2,0
245524942593089537,2012-09-11 14:11:22,"Today, we remember those taken from us 11 years ago and when we stood together, united. Today, we renew our pledge to never forget.",3,1
243069288846602240,2012-09-04 19:33:29,"The U.S. debt hits $16T today. More than ever, we need a Grand Slam of a plan to ace the debt. http://t.co/79AmtvPo",12,1
232870150314004482,2012-08-07 16:05:45,Not even #MichaelPhelps can win enough Gold medals to pay down the huge U.S. debt. http://t.co/VrI2Jykz,8,2
227500985965228033,2012-07-23 20:30:36,So just how big is our national debt? Congress could medal in ignoring our debt problems. http://t.co/Jx1NupOO,9,3
226345964988944385,2012-07-20 16:00:58,"My thoughts and prayers are with the victims and their families of the shooting in Aurora, CO. Such a senseless act.",7,1
223150669379547137,2012-07-11 20:24:00,Voted to repeal #Obamacare. Neither taxpayers nor our overall economy can afford the law’s full burdensome effects. http://t.co/eYcvTbS4,16,4
223104956465545216,2012-07-11 17:22:21,Intro’d bill to reduce federal subsidies for crop insurance. We simply can’t afford these irresponsible subsidies. http://t.co/slqXHIfa,12,2
218493835746099200,2012-06-28 23:59:24,Voted to hold AG Holder in contempt. When an Exec Branch official doesn't comply w/checks of our system balances needed http://t.co/WJc2wIaR,12,2
218359533574172673,2012-06-28 15:05:44,SCOTUS ruling makes path forward on healthcare clear: Congress must repeal Obamacare + replace it w/market-based reform http://t.co/0CpKf78E,20,2
218042553700859904,2012-06-27 18:06:10,My amdt addressing cleanup of large-scale wildfires passed. No place for bureaucratic delay after catastrophic wildfire http://t.co/cuPcTHv3,2,0
217741822540263427,2012-06-26 22:11:10,Intro’d bill today to force DHS to return to reporting operational control as measurement of border security. http://t.co/WWND9qia,5,1
217372885889724417,2012-06-25 21:45:09,"Obama Admin suspended ICE’s 287(g) program, stripping local authorities of critical tools to deal w/illegal immigration http://t.co/HX7Gbfpw",21,2
217309159929028608,2012-06-25 17:31:55,One thing’s clear coming off the SCOTUS SB1070 ruling: Obama Admin should focus on border security instead of suing AZ http://t.co/SU9oHFWG,39,3
215827982189723648,2012-06-21 15:26:15,Met last night with students from the ASU Capitol Scholars Program. Great group.  http://t.co/Fxjkt5N4,1,0
215569246195957761,2012-06-20 22:18:08,Here's a story on my amdt to stop GSA employees under investigation for misconduct receiving bonuses on taxpayers’ dime http://t.co/WN0XLW8s,5,0
215517400618110976,2012-06-20 18:52:07,My amdt to stop bonuses for GSA staff under investigation for misconduct passed. Taxpayers can’t be on the hook 4 this http://t.co/hdabgRtM,5,2
215169014350090241,2012-06-19 19:47:45,My amdt to stop farm subsidies for people making more than $250k/yr passed. Farm subsidies for wealthy is indefensible http://t.co/Qw7mdbNe,5,3
211169416132562944,2012-06-08 18:54:46,Spoke at @NatResources Cmte hearing today on the need to pass my bill addressing water issues in Tombstone. http://t.co/YKIQbcjA,4,1
210769061825617920,2012-06-07 16:23:54,Tmrw my bill addressing water issues in Tombstone will be part of @NatResources hearing. Watch live at 6 am AZ 9 am EST http://t.co/Ic9TaJ88,6,1
210111055609856000,2012-06-05 20:49:13,Obama Admin wasting taxpayer $ advertising unpopular Obamacare with $15.7T in debt. Intro’d a bill to help fix this http://t.co/MaoPWU0p,6,1
210027801812803586,2012-06-05 15:18:24,The U.S. debt is a royal mess. http://t.co/NC5qcUiE,7,2
208300588373524481,2012-05-31 20:55:04,MT @kdooleyyoung: @JeffFlake loses on limiting Members’ using federal $ 4 online ads. Watch for him to raise the issue again //Count on it,3,0
208280907021418496,2012-05-31 19:36:52,Disappointed House defeated Rep. Franks’ Prenatal Nondiscrimination Act. Should be something everyone can agree on. http://t.co/RCVR8EHY,11,1
207965355115683840,2012-05-30 22:42:59,"Glad the House passed the Secure Border Act. It’s going to be more work getting the Obama Admin on board, though. http://t.co/G1PwSbuP",2,1
207491158404890624,2012-05-29 15:18:41,@arizonarepublic article on air quality and the CLEER Act: http://t.co/6R8pLFy8,0,0
207176304687185920,2012-05-28 18:27:34,Today is for remembering those who fight for the cause of freedom. Thank you to our brave soldiers for all you’ve done and continue to do.,4,1
205758914497748992,2012-05-24 20:35:22,More reasons to pass CLEER Act: EPA redesignating Pinal County as nonattainment for PM 10 – dust. http://t.co/VqWRYpbm http://t.co/EHaoVEFO,2,0
205024784923369472,2012-05-22 19:58:12,Glad the Senate passed strong econ. sanctions on Iran. Iranian regime developing nuclear weapons won’t be tolerated. http://t.co/D6MOQHGQ,3,0
203180372060684288,2012-05-17 17:49:10,Introd bill preventing feds meddling w/water in disaster areas like in Tombstone. Fight with feds? I’m your huckleberry http://t.co/aGVi05cC,6,1
202108224231579649,2012-05-14 18:48:50,Glad the Obama Admin. relented and will allow recreational shooting at the Sonoran Desert. http://t.co/yaCIMtkB,4,0
200325573011177472,2012-05-09 20:45:13,Proud to speak today at the #NORPAC 2012 Annual Mission to Washington conference on the importance of the US-Israel relationship.,2,0
200272160793694208,2012-05-09 17:12:58,Hard to believe my amendment rolling back NSF funding to pre-Stimulus levels would save $1B+. Harder to believe the House didn’t pass it.,9,1
199873760311001088,2012-05-08 14:49:52,States shouldn’t face EPA penalties for natural events like dust storms. Intro'd CLEER Act to help remedy this problem. http://t.co/jcvnVt5x,3,0
199589514497368064,2012-05-07 20:00:23,There’s got der-by more support for paying down our massive debt. http://t.co/v0GhFyLL,1,0
198145342129184768,2012-05-03 20:21:45,Thanks to @azchamber for allowing Sen. Kyl and me to update them today. #update2012,1,0
195930968169779203,2012-04-27 17:42:37,Best thing gov’t can do for students is create a pro-growth tax/reg environment so they have jobs after graduation. http://t.co/EfM9lvHH,12,2
195720973146791936,2012-04-27 03:48:10,"Obama Administration steps in it, backs away from ""Youth Ag Rule"" that would keep kids off farms.  Yeehaw!",4,0
195645080982405120,2012-04-26 22:46:36,"Amdt to prevent govt overreach I helped offer in Cmte today passed, will keep 1000s of hotel/community pools from having to close for summer",5,1
195152761472552960,2012-04-25 14:10:18,The Obama Administration should focus on securing the border instead of suing Arizona for trying to help. http://t.co/IzNCbxFe,11,2
194509961282326529,2012-04-23 19:36:03,So just how many congressmen does it take to come up with a plan for paying down our debt? http://t.co/JXqu7SIX,2,1
193107976087810048,2012-04-19 22:45:03,"Great meeting with the Arizona Cattle Growers Association yesterday.
 http://t.co/7fWVUpUq",3,0
193090614127099904,2012-04-19 21:36:04,Cosponsored a proposed Constitutional amendment to protect crime victims’ rights in courtrooms. http://t.co/lFd3xjt4,5,0
192708705014390784,2012-04-18 20:18:30,"Though #Keystone XL will give Americans more jobs and energy security, transpo. ext bill spends at unsustainable levels http://t.co/OfAmGKMg",2,0
192390823638347776,2012-04-17 23:15:21,The House just passed a bill I intro’d to protect recreational shooting on public lands in AZ and all over the West. http://t.co/FMbaXJom,10,0
192272377223200769,2012-04-17 15:24:41,Proud to be part of 2012 Pig Book unveiling w/CAGW @GovWaste today. Important effort to expose wasteful gov’t spending http://t.co/OB6ARc6i,4,0
192014945041395712,2012-04-16 22:21:45,Our U.S. debt is the Jolie-Pitts. http://t.co/eySdo51x,2,0
191405423797080064,2012-04-15 05:59:43,Much thanks to the hundreds of students/parents who participated in the Service Academy conf today.  Great to see you all there.,0,0
189475328249438208,2012-04-09 22:10:13,Great tour of the Navajo Generating Station today. It's a facility that's vital to Arizona. http://t.co/a5qyhF6g,1,0
189425958418251777,2012-04-09 18:54:02,"I’ll be on @FoxNews Special Report w/ @BretBaier 6 pm ET, Fox Report w/ @Team_Shep 7 pm ET talking about Obamacare’s new taxes and fees.",3,0
189063659740332032,2012-04-08 18:54:23,A very Happy Easter to all.,1,0
187564520863043584,2012-04-04 15:37:21,Honored to receive @USChamber Spirit of Enterprise award by @GilbertChamber this morning. http://t.co/kX5fbDAJ,4,0
185449698470002688,2012-03-29 19:33:48,We’re long overdue for a way out of our fiscal crisis. @RepPaulRyan budget puts U.S. on that path. http://t.co/RHNIL7AR,1,0
184694500810170368,2012-03-27 17:32:55,Here's an op-ed I wrote on Obamacare's anniversary: http://t.co/D4z1TaZt,4,0
184386226894282752,2012-03-26 21:07:56,Congress needs to start Manning up and tackle the U.S. debt – simply Tebowing for it to go away isn’t working. http://t.co/lqiKhVIU,16,1
184352813084721152,2012-03-26 18:55:10,RT @azchamber: Congressman Flake issues letter to EPA Region 9 regarding Arizona’s exceptional events: http://t.co/h0W7jKqr,0,0
182869686067789824,2012-03-22 16:41:45,"Pleased the House moved to repeal IPAB today, but Obamacare must be repealed completely. http://t.co/21akWvDj",15,1
181838364960493569,2012-03-19 20:23:39,#MarchMadness may cost $192M in lost wk hrs.75M yrs of wk to pay $15.4T US debt.Talk abt putting us out of our Missouri http://t.co/Urk8xeJp,3,0
180010232989233152,2012-03-14 19:19:18,#Obamacare adds $1.76T in new spending when fed govt can least afford it. Better healthcare reform = market-oriented http://t.co/M0CAjaCu,6,0
177068408817455104,2012-03-06 16:29:33,"Sad about the death of my friend Donald Payne (D-NJ). He will be missed by many across #Africa, where he worked to make lives better.",1,1
176788430041260032,2012-03-05 21:57:00,The U.S. debt gives the term “moneyball” a whole new meaning. http://t.co/th0kGzLj,5,1
174170924814319617,2012-02-27 16:35:59,Our massive debt is leaving taxpayers holding the bag. http://t.co/YDIbdwHC,2,0
172696526278234112,2012-02-23 14:57:15,Heart goes out to families of Marines killed in copter crash in Yuma last night.,6,1
172365042753343488,2012-02-22 17:00:03,Organized letter to State Dept. questioning how restoring funding to UNESCO will further Middle East peace talks. http://t.co/etQ1vOTe,1,1
170558269830606848,2012-02-17 17:20:35,"By not paying for $93B, short-term tax holiday, Congress is saddling taxpayers with more long-term fiscal challenges. http://t.co/ka1GbHu5",3,0
170274811300417536,2012-02-16 22:34:13,Congress shouldn’t reestablish UNESCO funding. Repercussions needed for its decision to recognize a Palestinian state http://t.co/rUciAcvs,2,0
169452034200829952,2012-02-14 16:04:47,Wishing a happy 100th birthday to our great state of Arizona today. Here’s to the all that the next 100 years will bring. #AZcentennial,7,0
169265965081702400,2012-02-14 03:45:25,"So, no payroll tax offset?  Have we even stopped pretending?",16,1
169162437248024576,2012-02-13 20:54:02,We're rolling in deep debt. http://t.co/GaHsdZ4Q,5,0
168183931705892864,2012-02-11 04:05:48,Congrats to Gabby Giffords for having her bill signed into law and having a Navy ship named in her honor. Not a bad day's work!,26,2
166999239099039744,2012-02-07 21:38:15,Offering STOCK Act amdt to permanently ban #earmarks in House. http://t.co/bZFKS3Ye  @WashingtonPost story shows why: http://t.co/iqvzmFlr,3,1
166924741549101056,2012-02-07 16:42:14,Congress will take action if Obama doesn't back off forcing religious institutions to violate beliefs on health care benefits. @azpolicy,9,2
166606136164884480,2012-02-06 19:36:12,"Like Tom Brady in the final secs of the big game, taxpayers need a real Hail Mary of a plan to solve our debt crisis. http://t.co/x8MSFtM9",6,1
165183053294092289,2012-02-02 21:21:23,Disappointed @SenToomey earmark ban failed. Taxpayers won’t trust Congress 2 solve fiscal crisis if earmarks don’t stop http://t.co/ZZiOla8j,8,0
164773316253585408,2012-02-01 18:13:14,CBO Dir says Congress “has to decide soon” how to handle economic strains and government debt. Why don’t we start with a budget?,8,0
164391860406726656,2012-01-31 16:57:28,Democrats clear Justice Dept officials of wrongdoing in Fast and Furious investigation?  Already?  Isn't the investigation still going on?,3,0
164068162336329728,2012-01-30 19:31:12,Congress needs to Lego of its unwillingness to get serious about paying down our debt. http://t.co/j8bfd83z,9,1
162230110462816257,2012-01-25 17:47:27,Proud Rep #Giffords bill to curb border smuggling via ultralights passed House. Fitting tribute 4 her last day. http://t.co/CoOgEtB0,8,1
162012644834947073,2012-01-25 03:23:19,"If Pres Obama + Congress serious abt fairness, let's show more 4 those who’ll inherit fruits of our fiscal indiscipline http://t.co/dQZjPYEn",6,0
161943242873647105,2012-01-24 22:47:32,Honored to sit next to Gabby Giffords tonight. Her courage and optimism bring out the best in Congress http://t.co/3KHSO3DN #Giffords #SOTU,56,7
161830720329883648,2012-01-24 15:20:25,Join me @ 8:45 MT for @GoldwaterInst Congressional Virtual Townhall in honor of Natl School Choice Wk http://t.co/lp9Hs1vr #AZSchoolChoice,1,0
161167547910209536,2012-01-22 19:25:12,Just learned Gabby Giffords will resign from Congress and continue recovery. What a class act. Can't wait to be with Gabby in DC this week.,9,1
159759568908455936,2012-01-18 22:10:24,Voted to disapprove of Pres's action to up debt limit. Shouldn’t raise it any further w/o a plan to solve fiscal crisis http://t.co/rjQrjChd,2,1
159702965630943234,2012-01-18 18:25:28,Obama Administration to reject #KeystoneXL permit today. The Administration is making new jobs and greater energy security a pipe dream.,9,1
159680373519953920,2012-01-18 16:55:42,I oppose #SOPA because I’m concerned it will restrict free speech.,42,6
159352784746057728,2012-01-17 19:13:59,The level our debt has reached is a real Whopper. http://t.co/1gy2qilL,2,0
159031842962546688,2012-01-16 21:58:40,"""Never succumb to the temptation of bitterness."" Thankful to Dr. King for his eternal optimism. #MLKDay",16,3
157848497859723264,2012-01-13 15:36:29,"Thanks for the #FF, @jlsemmel! MT: @jlsemmel: Good Morning! Have a Fabulous Friday!",0,0
157526830881054720,2012-01-12 18:18:17,"@Heritage, @WSJ Index of Econ. Freedom out today: ""Rapid expansion of government … responsible for flagging economies.” http://t.co/T9C37BJ1",3,0
156465694408585216,2012-01-09 20:01:43,Obama Admin’s. decision to halt new uranium mining in N. AZ will needlessly stymie local economic growth + job creation http://t.co/VhF3RF6a,13,1
156073786939162625,2012-01-08 18:04:25,"1 yr after Tucson shooting, we mourn the lost, pray for the wounded, and know that out of tragedy, spirit as a state and nation is stronger",15,0
149706882892832768,2011-12-22 04:24:36,Taxpayer funds for name id? You'll want to read this: Jeff Flake: And a Happy Festivus From Congress Too http://t.co/4FcfYtVY via @WSJ,11,3
149524546876215297,2011-12-21 16:20:04,Thanks for having me on! RT @kcharliehicks: Thanks to @JeffFlake for joining us on @flagnewsshow #interestingtimes,0,0
149204341893496832,2011-12-20 19:07:41,"Voted no to go to conf. re. payroll tax cut extension. Unless we reform entitlements, shouldn’t reduce their revenues http://t.co/flWY1Dkx",5,0
149117003431555072,2011-12-20 13:20:38,It was wrong to institute the payroll tax holiday a year ago. Extending it now will simply hasten social security insolvency.,24,4
148879206963621888,2011-12-19 21:35:43,Intro’d the Earmark Elimination Act w/ @repjimcooper of TN to permanently ban earmarks in the House of Representatives http://t.co/qerQYCPs,5,0
148627166001774592,2011-12-19 04:54:12,"Two very different world leaders died today.  Vaclav Havel inspired his countrymen, Kim Jong Il compelled his.",17,3
