id,created_at,text,retweets,favorites
388379517481279488,2013-10-10 19:04:27,AP poll: 7% say Obamacare exchanges working well. Hmmm. Probably same elusive 7% that says Congress is working well. #lowbar,13,4
388362199766683648,2013-10-10 17:55:38,Admin now allowing private funds to keep GC open. @SenJohnMcCain &amp; I have been working on this. http://t.co/4cidTsOJyO,5,0
387953511712837632,2013-10-09 14:51:39,Easy way to #shutdown wasteful spending: stop direct farm payments. Presser @ 2:30p. Sent this to leadership: http://t.co/GSdnqRMUbK,5,1
387931783649452033,2013-10-09 13:25:19,Excellent piece by @RepPaulRyan on a path forward http://t.co/drhLPhPfXM,12,3
387351306274230272,2013-10-07 22:58:42,Wow. My view right now. At least Congress can't shut down the sunsets. http://t.co/gQPsR5Fob8,158,121
386290326878429184,2013-10-05 00:42:45,"My thoughts on Congress, Obamacare and the Continuing Resolution https://t.co/sG5leZddHI",3,2
385836483409879040,2013-10-03 18:39:20,Shots fired at the Capitol. No more details yet. My staff in D.C. are inside and ok.,48,13
385538380294914048,2013-10-02 22:54:47,My view right now. Hopefully not much longer. http://t.co/7p32gQUVE0,8,3
385169048205418497,2013-10-01 22:27:11,POTUS compares Obamacare launch glitches to Apple's iOS-7. Hmmm. Probably more analogous to fate of Blackberry.,21,8
384893338467328000,2013-10-01 04:11:37,"Nothing good happens after midnight, including government shutdowns.  Not Congress' finest hour.",89,28
383733382330343424,2013-09-27 23:22:22,"I hate to miss any vote, let alone important votes like we had today. But I was where I needed to be. http://t.co/CWThBPElwb",13,26
383310091887194112,2013-09-26 19:20:22,Not supporting cloture on CR. Rate of spending exceeds budget cap in BCA and little chance for any real opportunity to cut spending.,67,10
382967207065444352,2013-09-25 20:37:52,Just spoke on the Senate floor on Continuing Resolution and Obamacare http://t.co/BzcKC6y0dY,5,1
382520074621681664,2013-09-24 15:01:07,Clear example of how #Obamacare will harm businesses + employees in AZ via @BrahmResnik @12news: http://t.co/EIwZjXNuCy,21,4
382188541754630144,2013-09-23 17:03:44,Watching your kids get married is tough on parents. We'll go thru this ritual again this week. http://t.co/U65BVIhMah,2,3
381065037042839552,2013-09-20 14:39:19,"Received the Taxpayers’ Friend Award from @NTU: http://t.co/Lss9TeKbme. Yes, I'm a cheapskate.",4,3
380744083956072448,2013-09-19 17:23:58,Sent letter to Leader Reid w/several colleagues urging him support CR within the budget cap in existing law. http://t.co/50bXGxX1JT,5,1
380525720612528129,2013-09-19 02:56:16,"Just exited the congress/journalist charity spelling bee on the word ""malfeasance"". For the record, I can't even SPELL malfeasance...",17,18
380420553992982528,2013-09-18 19:58:22,I'm participating in a spelling bee for charity tonight. Wish me luk! http://t.co/AOH1NWfV1l,7,4
380345670474809344,2013-09-18 15:00:48,Whoa! POTUS just said that economists say our deficit is coming down too fast?  That's not what's keeping me up at night...,10,5
379127173686104064,2013-09-15 06:18:56,Wow!  What a finish go #ASU!,9,3
379085093723058176,2013-09-15 03:31:44,@heathpoulter called it right.  Mogollon Rim off Highway 260.  Here's another view http://t.co/KyL0phe02T,0,0
379054713762639874,2013-09-15 01:31:00,My view right now. Anybody know this AZ view? http://t.co/v6JHLCSsBx,2,6
378952257191960576,2013-09-14 18:43:53,"Nothing like being back in Snowflake, says Dallin http://t.co/69udKw4U18",1,4
378653089072283648,2013-09-13 22:55:06,Wide support for bill I intro’d w/Rep. @MarciaBlackburn to delay implementation of Obamacare: http://t.co/w7XTLTCv1x,7,5
378264558475182080,2013-09-12 21:11:13,"In the chickens coming home to roost department: ""The AFL-CIO has approved a resolution calling Obamacare “highly disruptive.""",26,6
377995554476666881,2013-09-12 03:22:17,"Oh, brother... http://t.co/JBf4kXn83S",14,6
377947163910995968,2013-09-12 00:10:00,My view right now. What a city. http://t.co/dwYwB1LhMh,3,3
377945242710065152,2013-09-12 00:02:22,My view right now. http://t.co/YRWUlHjS0P,4,4
377539075160305664,2013-09-10 21:08:24,Introduced legislation today to delay all provisions of Obamacare for one year http://t.co/5JrtT4I0qS,15,1
376054737537220608,2013-09-06 18:50:10,Thoughtful piece on the broader implications of the Syria vote by former Senators Kyl and Lieberman http://t.co/Bh1PRpa50J,7,0
375809916012732417,2013-09-06 02:37:20,Baking in the bleachers. 106*F at 7:36 pm. Only in Arizona. http://t.co/oPMQxwuenl,3,6
374640060999532544,2013-09-02 21:08:45,"Congrats to @diananyad for her Cuba-Florida swim. Incredible feat, and on the 5th try. Great example of perseverance.",9,2
374598202726445056,2013-09-02 18:22:25,Headed to DC today for Syria hearings in the Sen. Foreign Relations Committee. Will also have classified briefings.,17,4
372897394381176833,2013-08-29 01:44:01,Enjoyed a personal tour of the border today with rancher John Ladd. http://t.co/3G5ro6Icr1,4,4
372790839887396864,2013-08-28 18:40:37,Thanks to Cochise County Sheriff Dannels and local police chiefs for taking the time to share your challenges along the border.,1,0
372766142105796608,2013-08-28 17:02:28,Great crowd of AZ leaders at the League of Cities and Towns Conf in Oro Valley. http://t.co/jWhvh6JxBG,5,1
372144181155606528,2013-08-26 23:51:01,"Thank you to Dr. and Mrs. Somers for coming in today to share story of their son, Daniel, and need for VA reforms http://t.co/uVvLDH7n4v",2,1
372105417775517696,2013-08-26 21:16:59,"Oh, whatever...  http://t.co/Px6eCHXM6y",71,28
370948123972993024,2013-08-23 16:38:19,Big shout out and congrats to the Sunnyside Little League softball team - World Series Champions! http://t.co/qgxMqLXXut,8,1
370907568568152064,2013-08-23 13:57:10,Big congrats to the Rio Rico Little League team - 2013 Junior National champs and World Series runners-up! http://t.co/b42o9MmdSL,5,0
370663524579557376,2013-08-22 21:47:25,RT @CoconinoCounty: Sup Archuleta &amp; Sup Metzger brief Senator @JeffFlake on flood mitigation efforts in the Schultz burn/flood area. http:/…,3,0
370658310740922368,2013-08-22 21:26:42,With Dr. Wally Covington surveying flood mitigation efforts following Schultz fire near Flagstaff. http://t.co/qqOjuPZ0kk,3,2
369675407429087232,2013-08-20 04:21:00,"Reunited at EAC in Thatcher today with my English teacher, Mrs. Flamm.  Not her fault I didn't learn good. http://t.co/4WF2dC5uWE",4,4
369672311999184896,2013-08-20 04:08:42,Visited Freeport-McMoran's Morenci mine today and met with Greenlee County elected officials and execs http://t.co/rnA9es8gFS,1,1
369276605308215297,2013-08-19 01:56:18,My take on the situation in Zimbabwe. http://t.co/gEuwszmWKJ,6,4
368847793080651777,2013-08-17 21:32:21,Watching Dallin's football scrimmage at 2:30pm. 109 *F.  #sweatfest http://t.co/e3KDXRvuaX,4,1
368407037794742272,2013-08-16 16:20:57,"@tomfarley Bummer, Tom.  Best treatment: Wait 24 hours. That'll do it.",0,0
368397852138946560,2013-08-16 15:44:27,Great townhall with Raytheon employees in Tucson yesterday. Thanks for all you do for our national security. http://t.co/vRAnGvfF0G,7,5
368075430458163200,2013-08-15 18:23:15,Great crowd at Oro Valley Chamber of Commerce breakfast.  Thanks for the invite! http://t.co/WHuin5jMeh,4,0
367868615208337408,2013-08-15 04:41:27,The perils of living in the desert. This guy stung me today. #scorpion. http://t.co/4ClrkxT0YV,30,12
367321128475176960,2013-08-13 16:25:56,So sorry to hear about the death of Dave Sitton. Mr. Tucson.  He will be deeply missed.,2,1
363087713261453314,2013-08-02 00:03:51,My view right now. Dusk at the Capitol. http://t.co/HynGYlXvm0,3,11
363070258820562944,2013-08-01 22:54:29,Just finished colloquy on Senate floor with Senator @StabenowPress regarding direct farm payments. http://t.co/QuwLz8a2l1,2,1
362999787685019648,2013-08-01 18:14:28,Thanks to @NTU for supporting the bill I intro’d that would reduce tax bias against small biz investment (S. 1342) http://t.co/rszimPjaJH,4,1
362654193628098560,2013-07-31 19:21:12,Enjoyed meeting with members of Vietnam's National Assembly. http://t.co/rUVWBoS5dc,0,3
362363643301605376,2013-07-31 00:06:39,My view right now. Nothing like a run on the mall. http://t.co/rSeuxVSteg,2,5
362297700655431680,2013-07-30 19:44:37,"Is it just me, or does the President's new ""grand bargain"" sound an awful lot like another stimulus bill?",29,4
362002866556243969,2013-07-30 00:13:04,My view right now. What a city. http://t.co/mKlbFpPO8M,5,16
360497540665311236,2013-07-25 20:31:26,Nice to be speaking out against budget-busting approps bills. I feel at home once again. http://t.co/owEupEqMmh,6,3
360496673778188289,2013-07-25 20:27:59,"Not my 1st errant tweet, won't be my last. MT @dannowicki  @TwitchyTeam tweaks Sen. @JeffFlake over deleted tweet: http://t.co/tcoHulG4iJ",3,1
360464641614286848,2013-07-25 18:20:42,Just spoke on Senate floor in favor of Toomey Motion to Recommit THUD bill back to Approps committee to stay under BCA number.,4,3
360429616160206848,2013-07-25 16:01:31,"Great to meet with AZ Boy Scouts. Thanks for coming in today. (I'm not Photoshopped into this pic, scouts honor!). http://t.co/gWhuOuPiB4",2,4
360428737969401856,2013-07-25 15:58:02,Senate’s gearing up for a big debate re tax reform.  Here are my goals: http://t.co/tdPCqjk5hn,4,0
359829065416454145,2013-07-24 00:15:09,My view right now. Not bad at all. http://t.co/TTYGS3EVVH,5,8
359438678189289473,2013-07-22 22:23:53,Great piece from @peggynoonannyc on why the IRS debacle continues to grow into a bigger scandal: http://t.co/5Pi5yl1InY,6,4
357872940844478465,2013-07-18 14:42:12,"Hat tip to AZ State Senator Adam Driggs, also in the picture, who dug up the old photo. #ThrowBackThursday http://t.co/IUcXS4WT8r",3,1
357868968687570946,2013-07-18 14:26:25,"#throwbackthursday.  AZ Sen DeConcini staff. Intern Flake a right, next to Tim Roemer. #shortsleeves #80shair http://t.co/Cs7LOr5Ihz",3,2
357864882688892930,2013-07-18 14:10:11,"#throwbackthursday.  Former AZ Senator DeConcini staff.  Intern Flake in upper right, next to former staffer Tim Roemer. #shortsleeves",1,1
357690270948655105,2013-07-18 02:36:20,"Wow. When the unions have gone south on #ObamaCare, it's a pretty good sign it's time to start over.",28,10
357689306023870466,2013-07-18 02:32:30,Enjoyed meeting with the @ASU Capitol Scholars tonight. http://t.co/O7wOntYnmD,3,5
357604979671965697,2013-07-17 20:57:25,Intro’d bill w/ @SenJohnMcCain to help reduce wildfire risks. @azcentral has more details: http://t.co/v62bHPUzOX,14,8
353639688642367488,2013-07-06 22:20:47,Received briefing today in Yarnell from Incident Management Team. #yarnellfire is 90% contained. http://t.co/ljsi7WA2gI,6,4
353601134998470657,2013-07-06 19:47:34,Walked in Prescott's Frontier Days Parade today with @SenJohnMcCain. Families of fallen firefighters led parade atop fire engine.,4,2
353367433643438082,2013-07-06 04:18:56,"Along with @SenJohnMcCain, met with families of fallen firefighters in Prescott. Heartbreaking. Profiles in courage, all of them.",7,5
351562730882351105,2013-07-01 04:47:41,"Spoke with Sheriff Masher, Speaker Tobin and Sen. Pierce. Calling WH and fed agencies to ensure all resources are brought to bear.",11,4
351547816084111361,2013-07-01 03:48:25,19 firefighters dead battling #yarnellfire. I am sick with the news. Prayers go out to all affected.,115,21
350359239815995392,2013-06-27 21:05:26,Just passed strong #immigrationreform bill out of the Senate with a strong 68-32 vote.  Good day for AZ.,42,22
350334141016981505,2013-06-27 19:25:42,"AZ’s Lisa Graham Keegan on why she supports the Senate #immigrationreform bill. Great op-ed, via the Glendale Star: http://t.co/OUySr1AtOc",6,4
350329592650809345,2013-06-27 19:07:38,Air Force locating 3 addtl. squadrons of F-35 fighter jets at Luke AFB. I join @SenJohnMcCain in welcoming new personnel + families.,8,2
350278293452361728,2013-06-27 15:43:47,Great call this morning with AZ border ranchers. They’re on the front lines and their input has been invaluable. #immigrationreform,17,8
349580117355401217,2013-06-25 17:29:29,"RT @Dbacks: While in Washington DC, @DHallDbacks met with Senator @JeffFlake, who graciously gave @Dbacks a tour of the Capitol. http://t.c…",12,0
349293382868287488,2013-06-24 22:30:06,"Must keep more foreign-born, highly-skilled workers in U.S to compete globally, says fmr. CEO of @Intel.  http://t.co/CV9aXYJgC4",19,4
349246165398716416,2013-06-24 19:22:29,"Just saw that @GovBrewer has endorsed border surge amendment, not underlying bill. http://t.co/dfosJV5e0S",9,1
349241355362516992,2013-06-24 19:03:22,Good to see @GovBrewer come out in favor of Senate #immigrationreform bill http://t.co/dfosJV5e0S,4,4
349239306516307968,2013-06-24 18:55:13,"Two senators, one Flake. @edatpost piece in @washingtonpost. http://t.co/laW8nIdjrf",1,2
349237697392545794,2013-06-24 18:48:50,Good to see @governorbrewer come out in favor of Senate #immigrationreform bill http://t.co/dfosJV5e0S,13,7
347843147759501312,2013-06-20 22:27:23,I'll appear on the @oreillyfactor tonight to discuss immigration reform with @bill_oreilly_DN,10,6
347841945323847680,2013-06-20 22:22:37,Happy to sit down with @jorgeramosnews for an interview today on the prospects for immigration reform.,14,12
347466128819363844,2013-06-19 21:29:15,Tiime to put the death tax six feet under. Cosponsored @SenJohnThune’s #deathtaxrepeal bill today.,18,11
347172739427209217,2013-06-19 02:03:25,"CBO: Senate Immigration Bill saves $197 billion over first 10 years, $700 billion over next 10 years. Good stuff.",19,8
347106558670422016,2013-06-18 21:40:27,CBO score out. $700 billion in deficit reduction over ten years. Great news for those who favor immigration reform.,26,9
347069867972775936,2013-06-18 19:14:39,Grateful for @catoinstitute’s strong advocacy  on free trade. Thanks for having me today. http://t.co/cDkKoUoLCj,4,3
344561362900512768,2013-06-11 21:06:45,"Wow, I just got called a ""sock puppet"" and ""the new Dr. Evil"" at the same press conference. I can't figure out which is worse...",17,2
344544957736050688,2013-06-11 20:01:33,"Senate agrees, by a vote of 82-15, to begin debate on Immigration Bill.  This is good news. #immigrationreform",27,17
344166319861665792,2013-06-10 18:56:59,Stories like this http://t.co/GyP0eQa6UX make me proud to be a @dbacks fan. #coryhahn,1,4
344144423229198336,2013-06-10 17:29:59,It's the @rollcall Congressional Baseball this week. I'll be wearing a @Dbacks uniform playing third base. http://t.co/MLq6BOdgZy,3,6
343595898334490624,2013-06-09 05:10:20,Cheryl and I enjoyed time with Yanira and Paul Maldonado and family/friends today. What a story #freeyanira http://t.co/BJgY0oXkfy,10,3
343503907647008769,2013-06-08 23:04:48,Take me back to the island... http://t.co/rwb5UxavJ1,2,6
342794210388353024,2013-06-07 00:04:43,"Navy has named joint high speed vessel after city of #Yuma, citing city's strong support for military http://t.co/iPgRwEO3va",3,3
342350740746027008,2013-06-05 18:42:31,Just met with RSC members (conservative Republicans) in the House of Representatives to discuss Senate immigration reform bill,8,7
342036532712050689,2013-06-04 21:53:58,"Just delivered ""Maiden Speech"" on Senate floor. Watch it here: https://t.co/bJkex6qVVo",9,4
341577762391343104,2013-06-03 15:30:59,RT @RonHoonFox10: Here's @myfoxphoenix intv w Senator @JeffFlake&amp;his sons back from a deserted island. Sharks were just offshore when...htt…,3,0
341577601522999300,2013-06-03 15:30:21,Upstaged by my boys again... Just interviewed by @RonHoonFox10  http://t.co/PjA2fXDcHm,1,4
341286236847218690,2013-06-02 20:12:34,"1dad,2boys,4days,one deserted island. http://t.co/hYQaLToJMx http://t.co/3WiZ660hFr",3,3
340342245951692800,2013-05-31 05:41:29,Great News. Just had it confirmed by Consul General.  Yanira Maldonado has been released. #FreeYanira,48,8
338081744932700160,2013-05-24 23:59:03,@factcheckdotorg notes that Michael Bloomberg got it wrong with his gun control ad: http://t.co/S1x9n4g3rY,3,0
337627079325655040,2013-05-23 17:52:23,"#iMarch because immigration reform will spur labor force growth, and therefore growth in GDP. http://t.co/e1hMs9TIVf",13,3
337594672216150016,2013-05-23 15:43:36,More than 100 conservative economists urge sweeping immigration overhaul. Read about it here: http://t.co/vWMPg5SVPU,30,6
337572149319569410,2013-05-23 14:14:06,#IMarch because keeping more foreign-born STEM grads in the US is vital to a return to economic prosperity. http://t.co/e1hMs9TIVf,24,7
337210149565517825,2013-05-22 14:15:39,IRS debacle intensifies w/each day. My bill (now a farm bill amdt.) prohibits IRS targeting based solely on ideology http://t.co/lNkXXlQCeT,4,2
336991974903119872,2013-05-21 23:48:42,"Jud Comm #immigrationreform markup ending now. Kudos to Chairman Leahy and Ranking Member Grassley for a fair, substantive process.",16,9
336929068165525504,2013-05-21 19:38:44,Just had two more amdmts adopted by Jud Comm to make sure those in RPI status will not receive welfare benefits #immigrationreform,7,2
336906596988878848,2013-05-21 18:09:26,"Once again, the Senate Farm Bill is as bloated as a cow on new alfalfa. #corporatewelfare",12,4
336563347426254848,2013-05-20 19:25:29,"Phx tragically lost 2 of its finest Sun.: Firefighter Brad Harper + police officer Daryl Raetz. Thoughts, prayers are w/their loved ones",7,4
336549912965701632,2013-05-20 18:32:06,Back in immigration bill markup. Just adopted Hatch Amendment to move more quickly toward biometric exit system.  Good move.,6,3
335861360216924160,2013-05-18 20:56:03,"Ah, our youngest son Dallin's final piano recital today. Where did the time go... http://t.co/wrCFW9142x",2,2
335575935057276928,2013-05-18 02:01:52,"So, the IRS asked some groups about the ""content of their prayers""? They were probably praying for a less obtrusive IRS...",24,12
335439509544112128,2013-05-17 16:59:45,"My thoughts on the Mayor Bloomberg ad currently running on television in Arizona.
https://t.co/sG5leZddHI",10,4
334804367058296833,2013-05-15 22:55:56,"Acting IRS Commissioner resigns. Hopefully just the first step in what needs to be a long, thorough process of restoring confidence.",17,3
334726151748608001,2013-05-15 17:45:08,"Just heard Mayor Bloomberg is running more ads against me. If the mayor of NYC doesn't like my votes, I guess I’m on the right track.",70,30
334469803307839488,2013-05-15 00:46:29,Hmmm. Maybe @michaelcrow shouldn't have laughed at the Obama reference to an IRS audit http://t.co/TLcBw82qMJ,9,2
334356496081108993,2013-05-14 17:16:15,Intro’d bill today to combat dangerous IRS practice of targeting tax-exempt orgs based on ideology: http://t.co/btHBjqzXSh,10,2
334071848394452992,2013-05-13 22:25:10,Wow. First the IRS targets conservative groups. Now the DoJ targets the AP. What's next? HUD targeting homeowners?,54,11
334061193406849025,2013-05-13 21:42:49,"POTUS has strong words for IRS on its targeting of conservative groups. Fine, but now let's see some follow through.  What's next?",4,1
332982307755544577,2013-05-10 22:15:43,"So, if ""low level"" staffers at the IRS can target #teaparty and #patriot, what's next? Party registration? Donation history?",25,7
332874136282075137,2013-05-10 15:05:53,Border security amendments from Sens Grassley and Cornyn adopted in markup will improve #immigrationreform bill.,7,3
332517964840591362,2013-05-09 15:30:35,Just had another amendment adopted.  This one would require that GAO provide an annual review of the DHS border strategy.,8,2
332513613812219904,2013-05-09 15:13:17,My amendment to add private landowner owners to border commission was just adopted in committee markup.,6,6
332503400321265664,2013-05-09 14:32:42,Just started immigration markup in the Judiciary Committee. Will consider more than 300 amendments in coming days.,3,3
332169078527623168,2013-05-08 16:24:14,"With AZ Cardinals great @LarryFitzgerald in Washington. More post patterns, I tell him, more post patterns. http://t.co/p3mloaVI8T",3,2
331774263663140864,2013-05-07 14:15:23,"Cutting thru clutter, I've always supported background checks. I didn't support Manchin-Toomey, and still don't. I voted for Grassley amdt.",16,5
331557065183084544,2013-05-06 23:52:19,Congratulations to Gabby Giffords on her well deserved Profiles in Courage Award.  http://t.co/IMAacL261K,7,5
331435060756619264,2013-05-06 15:47:30,Here we go again. New Heritage study claims huge cost for Immigration Reform. Ignores economic benefits.  No dynamic scoring.,94,17
331134278618468353,2013-05-05 19:52:19,Sometimes I wish I could freeze a moment in time with my kids. This is one of those times. http://t.co/tsECul7x4A,6,21
330688426426900483,2013-05-04 14:20:39,"Okay, so giving my only daughter away today is turning out to be a little harder than I thought... http://t.co/4JRUcScszy",17,15
330321799407624193,2013-05-03 14:03:48,Great op-ed by Marco Rubio on why Republicans should lead on #immigrationreform http://t.co/KcZjaVNIaX,11,3
329235451133173760,2013-04-30 14:07:03,Great op-ed on the need for #immigrationreform by Jonathan Lines from Yuma http://t.co/kd6re8RLQ5,7,4
327935896722735104,2013-04-27 00:03:05,"Nothing better than seeing your children so happy. Big day for our new college grad, Alexis. http://t.co/4hNeQTUhgI",3,6
327479114284032000,2013-04-25 17:47:59,Pleased Sen Jud Cmte has scheduled #immigration bill markup in May. Plenty of time for all to read bill and prepare amendments.,6,3
327241853638418433,2013-04-25 02:05:12,My thoughts on last week's gun votes: https://t.co/EcAnpnrjM3,9,3
327098176945410048,2013-04-24 16:34:17,RT Good meeting. Thanks for coming! @GPEC: .@GPEC met with Sen @JeffFlake yesterday in D.C. #GPECinDC @barrybroome http://t.co/XQcrVDvhE0,3,0
325755860586475522,2013-04-20 23:40:24,Here's a conservative case for immigration reform: http://t.co/xV5uyP9xMR,29,6
325044829639819265,2013-04-19 00:35:01,Bipartisan press conference with @SenJohnMcCain and other #gangof8 members to launch immigration reform bill. http://t.co/qFPaM6THv8,10,5
324602731237085185,2013-04-17 19:18:16,"Suspicious pkg at my Phx office cleared, no dangerous material. Thx to Phx PD + FD, FBI, ATF + USPS for quick response. Everyone safe",91,14
323954134132850689,2013-04-16 00:20:59,I will oppose the Manchin-Toomey Amendment. Here's why: https://t.co/sG5leZddHI,73,24
323890956405448705,2013-04-15 20:09:56,Such a tragic and senseless event in #Boston. Thoughts and prayers are with the victims and their families.,12,4
323601468454223873,2013-04-15 00:59:36,Kudos to @marcorubio for hitting 7 Sunday political shows to talk about #immigrationreform.  Great spokesman for a good cause.,8,3
322452460012707842,2013-04-11 20:53:52,Here's why I voted yes on cloture today: https://t.co/sG5leZddHI,8,4
322360951049445376,2013-04-11 14:50:14,"Some in GOP critical of POTUS for including Chained CPI in budget. C'mon! Plenty in budget to complain about, but not that.",13,2
322040554013736961,2013-04-10 17:37:05,"POTUS budget gives small nod to entitlement reform, but spends more than we already do. Not a responsible proposal. http://t.co/EX6aYQdKO5",4,5
321295328940806145,2013-04-08 16:15:50,"My favorite political photo of all time, with Barry Goldwater, Margaret Thatcher and William F. Buckley, Jr. http://t.co/t4esBgCJfv",46,22
321287778245677056,2013-04-08 15:45:50,My thoughts on Margaret Thatcher https://t.co/sG5leZddHI,2,2
320774721794879488,2013-04-07 05:47:08,"So, @Beyonce and Jay-Z @S_C_ are in Cuba? Fine by me. Every American should have the right to travel there.",239,61
319123353367625728,2013-04-02 16:25:11,Go @Dbacks - 7th straight Opening Day win.,1,3
318135940071686144,2013-03-30 23:01:33,"#gangof8 closer to agreement on #immigrationreform. Still have details to iron out, however.",15,7
317490685202812928,2013-03-29 04:17:32,Large town hall in Prescott today. Good questions. http://t.co/mrpISP4v5g,2,2
317448376604061696,2013-03-29 01:29:25,Go #ArizonaWildcats #BearDown!,6,3
317302573986111489,2013-03-28 15:50:03,@SenJohnMcCain and I are holding a town hall meeting in Prescott today.,2,1
316968215311941633,2013-03-27 17:41:26,Half of #gangof8 in Nogales @SenJohnMcCain @ChuckSchumer @SenBennetCO @jeffflake http://t.co/liNjtvVahK,7,2
316939439786041347,2013-03-27 15:47:05,Our ride for border tour w/ @SenJohnMcCain @ChuckSchumer and @SenBennetCO. http://t.co/pPHoZqynhb,7,2
316923187633995777,2013-03-27 14:42:30,Touring Tucson Sector of the border today w/ @SenJohnMcCain @ChuckSchumer and @SenBennetCO.,7,1
316727305386987522,2013-03-27 01:44:08,Just heard about the death of Eddie Basha. One of Arizona's finest.  He leaves a great legacy.,15,4
316657421382729728,2013-03-26 21:06:27,Informative meeting with the Yuma County Board of Supervisors. http://t.co/w5DuqruqDI,3,2
316605337190936576,2013-03-26 17:39:29,"Visiting Yuma and San Luis today. Checking in with US Border Patrol, Yuma officials, old and new friends.",2,2
315171015950995457,2013-03-22 18:40:00,"Not fond of the Senate Democrats' budget being debated today, but pleased, after 4 years, to have a budget to debate. #babysteps",8,2
314163314651459585,2013-03-19 23:55:45,Kudos to @SenRandPaul for supporting a path to citizenship as part of #immigrationreform. Very helpful.,36,12
312233566090170368,2013-03-14 16:07:37,Great piece in today's WSJ by @SenJohnMcCain on 40th anniversary of his POW release.  http://t.co/p3GhPRmHEP,5,2
312040404021309441,2013-03-14 03:20:04,RT @LorenaOchoaR: Meeting with Senator Jeff Flake from Arizona talking about #NHTF13 http://t.co/aoXOOEZWsF,7,0
311318854515187712,2013-03-12 03:32:53,Court slams Mayor Bloomberg's #sodaban. I'll drink (an extra large soda) to that!,31,15
