id,created_at,text,retweets,favorites
487346550893723649,2014-07-10 21:24:06,Working with @SenJohnMcCain on a bill to stem the flow of unaccompanied minors crossing the border. Read more at http://t.co/XOUZNJmRy7,5,6
487333106119344129,2014-07-10 20:30:41,RT @SenJohnMcCain: Introducing legislation w/ @JeffFlake to address the humanitarian crisis at US-Mexico border: http://t.co/BCUBONkK6Z,30,0
487031220664930305,2014-07-10 00:31:06,We'll only stem flow of UACs when their parents see us sending them right back. My amdt. gives POTUS that flexibility http://t.co/Aj2JcugveJ,6,5
486976372469170177,2014-07-09 20:53:09,In the #CenterSeat on @SpecialReport w/ @BretBaier tonight to talk #immigration. Watch on @FoxNews from 3-4 AZ time https://t.co/FQB4t3kJmE,4,0
486963932486434816,2014-07-09 20:03:43,RT @azchamber: 4 things Arizonans need to know about The Bill Williams River Water Rights Settlement Act http://t.co/omnszrFMUG  @JeffFlake…,3,0
486963578772414464,2014-07-09 20:02:19,Pleased to welcome Hualapai Tribe Chairwoman Counts to testify in support of Bill Williams River Settlement #Time2TalkH2O,1,1
486961556568428545,2014-07-09 19:54:17,"RT @SenJohnMcCain: VIDEO: My Senate floor remarks on humanitarian crisis on border today w/ @JohnCornyn, @SenTedCruz &amp; @JeffFlake: http://t…",14,0
486930660989632512,2014-07-09 17:51:30,Looking forward it MT @BretBaier @JeffFlake tonight in the #SpecialReport #CenterSeat to talk about influx of illegal children at the border,9,1
486917344103776257,2014-07-09 16:58:35,"Wishing a happy birthday to @1041kqth's @JonJustice. It's a little late, but that's still pretty fast for #Congress",1,3
486907066557423617,2014-07-09 16:17:45,Joined @gwenifill to discuss how to end surge in #IllegalImmigration &amp; why #POTUS's proposal sends the wrong message https://t.co/CKQWjBBtBq,4,1
486905186217390080,2014-07-09 16:10:17,Joining @KTAR923's @BruceStJames at 12:20 to talk solutions to end the surge of illegal #immigration from C. America http://t.co/1psgu5sEZL,5,0
486894415265665024,2014-07-09 15:27:29,Congress ought to go cold turkey on smoked pork #primecuts http://t.co/f3CH4JfhJJ http://t.co/vzZCfBc5Gj,5,0
486689170715586560,2014-07-09 01:51:55,Tonight I was interviewed by @gwenifill on PBS @NewsHour on the border crisis  http://t.co/PtxLjlVY9k,4,4
486652449835741184,2014-07-08 23:26:00,RT @gwenifill: Lawbreakers or refugees? The latest border debate: with WH domestic policy adviser @cecilia44 &amp; Sen. @JeffFlake tonight @New…,13,0
486516978157625344,2014-07-08 14:27:41,"Congress needs to change what it can, as soon as it can, to ensure unaccompanied minors are sent home without delay http://t.co/W6o5HJIOMG",5,1
486463943452676096,2014-07-08 10:56:56,"Kudos to AZ's official historian, Marshall Trimble. Without Marshall, too few would know AZ's official bird, flower, song, reptile, tree...",5,4
486278003941318656,2014-07-07 22:38:05,Finally! High flying boondoggle has ended. We can more effectively export values to Cuba by ending the travel ban.   http://t.co/D5Ss901wDZ,22,10
485088215246729217,2014-07-04 15:50:17,Parades and Purple Mountain Majesty. Happy Birthday America! http://t.co/LVuOJDNClG,4,16
484782494038765570,2014-07-03 19:35:28,"The ultimate survivor, WWII POW Louis Zamperini, has died. One of the most inspiring stories ever lived, and told. #unbroken",7,15
484746235623243776,2014-07-03 17:11:23,Shortage of STEM workers.  Yet another reason for #immigrationreform. http://t.co/6gMzY9aQNb,10,7
484737190761492480,2014-07-03 16:35:26,Maybe next #July4th @StateDept will settle for a @Costco run #primecuts MT @thehill Flake blasts 'wasteful party' http://t.co/DWIm6JinqX,4,3
484365681266151424,2014-07-02 15:59:12,Taxpayers ought to be free &amp; independent of unnecessary spending; it's self-evident #primecuts http://t.co/XPpcBskQVI http://t.co/1iNJsC3W8I,9,5
484069190714667009,2014-07-01 20:21:03,Rooting on the #USA Arizona-style  #IBelieveThatWeWillWin #USMNT #WorldCup http://t.co/tUcXK1K0zU,14,16
483716582632206336,2014-06-30 20:59:54,"We're all frustrated that IR hasn't moved in the House, but POTUS dismissing genuine concern about unilateral executive action doesn't help.",6,3
483047680831393792,2014-06-29 00:41:56,"@ananavarro  Yes, communists don't like good music, or much else subversive for that matter. How, again, does that justify OUR travel ban?",0,0
482948254842499073,2014-06-28 18:06:51,@ananavarro Why shield the Castro regime from American influence?  Not every American goes to Cuba to get a tan.,0,0
482774293441290242,2014-06-28 06:35:35,"@ananavarro No, they haven't released Alan Gross. So why coddle them by keeping the travel ban in place? It's time to get tough.",0,1
482602446980534272,2014-06-27 19:12:44,"#POTUS sends right msg to C. America: “Do not send your children to the borders...they'll get sent back."" @StateDept needs to broadcast it.",8,4
482538207225978880,2014-06-27 14:57:28,Excellent @NPR series on Cuba. Travel ban has been a boon to the Castros and a bust for Cubans. Let's end it. http://t.co/nvvHsDXZR0,24,15
482271512582311936,2014-06-26 21:17:43,"Congrats to the Dems on a 15-6 win. We need to draft...er, elect, a few new ballplayers in November http://t.co/p27Fzylrou",4,9
482270822258573312,2014-06-26 21:14:58,"My letter with @SenFeinstein, 40 others calling on @BarackObama to make clear that immigration law will be enforced  http://t.co/XqXYe7cNLL",10,9
482186302209941504,2014-06-26 15:39:07,Good news: Supreme Court rules that President cannot make government appointments by declaring the senate out of session. Thank you!,17,12
482167150011228160,2014-06-26 14:23:01,Wish GOP #CongressionalBaseball team was as stingy w/ runs (15) as @SenatorReid is w/ votes on GOP amdmts (11)  https://t.co/29Zqe5xIf9,3,3
481915917815644160,2014-06-25 21:44:43,Spoke today on the frustration &amp; dangers associated w/ current practice of limiting debate &amp; amendments in #Senate https://t.co/Zm1Kit84B3,6,5
481895692743753728,2014-06-25 20:24:21,"My CLEER Act would ensure #AZ isn't penalized when uncontrollable, natural events like dust storms impact air quality http://t.co/IiE0i02vHy",2,3
481872792317480960,2014-06-25 18:53:21,"18 months, 85 offered amdmts later, I finally get a roll call vote in the world's most deliberative body. http://t.co/p6dh6EwYhS",26,18
481816994178957312,2014-06-25 15:11:37,"If the U-S-A! U-S-A! U-S-A! is going to get its debt under control, spending cuts should be our GOOAALLLL #primecuts http://t.co/HqwEDrg1xD",9,7
481611882688937984,2014-06-25 01:36:35,I sat down today with @SusanPage @USATODAY to talk immigration reform  http://t.co/caulRzTIl2,8,2
481549405167030272,2014-06-24 21:28:19,"Just spoke on Senate floor, asking @BarackObama to make personal statement about children crossing SW border. https://t.co/iFOuG7Gai0",10,4
481532342973255682,2014-06-24 20:20:31,Pleased to hear @RepMattSalmon will be serving on the border crisis working group. #Arizona's interests &amp; concerns will be well represented,3,4
481469460101206016,2014-06-24 16:10:39,Kicking off my weeklong effort to highlight fed air regulatory overreach in #Arizona by introducing the ORDEAL Act https://t.co/jxCzpZEzdh,2,1
479985464728752128,2014-06-20 13:53:47,New poll confirms that an overwhelming percentage of Americans believe we should all be allowed to travel to Cuba. #cubanow,14,12
479666714356228098,2014-06-19 16:47:11,RT @SpeakerBoehner: PHOTO: Getting ready for victory w/ @GabbyGiffords &amp; Members of Congress team at last night’s @CWSoftballGame http://t.…,14,0
479339283179126784,2014-06-18 19:06:05,The stairway to hog heaven is a fast track to fiscal ruin #PRIMECUTS http://t.co/Vzy5t8Bpo6 http://t.co/6MozbFYYw7,7,1
479330340029603840,2014-06-18 18:30:33,Having trouble with a federal agency? Stop by my staff's #Sahuarita office hours tomorrow to see if we can help. http://t.co/NJqt6Gyicg,2,3
479095099088175104,2014-06-18 02:55:47,Kudos to those who planned and carried out the capture of Benghazi suspect Abu Khattala.  Well done.,7,19
478953131364339712,2014-06-17 17:31:39,@GinaEPA declaring a #WarOnCoal is a far cry from her promise to me as a nominee to improve EPAs working relationship w/ states &amp; industry,9,1
478928065897455616,2014-06-17 15:52:03,"@RMCSret Join the club, Bennie. But if there’s ever anything that I can help you with, please reach out to my Tucson office 520-575-8633",2,0
478913312198234112,2014-06-17 14:53:26,Having trouble with a federal agency? Stop by my staff's #Yuma office hours tomorrow to see if we can help. http://t.co/bj35J2C2IL,5,0
478258140199145474,2014-06-15 19:30:00,"Happy Father's Day to the man I admire most in the world, my dad. http://t.co/Q0PorA0HZ1",3,13
477543076387225600,2014-06-13 20:08:36,"Great mtg. w/ @AZWater Dir. Mike Lacey, @SenJohnMcCain, @RepGosar, @RonBarberAZ, @RepMattSalmon #Time2TalkH2O http://t.co/6tf8Hsxjvr",9,8
477221120316174337,2014-06-12 22:49:16,I'll be discussing the recent surge in illegal immigration on @NBCNightlyNews tonight. Find your local airtime at http://t.co/AWMiSSJHiT,5,4
477191060347568128,2014-06-12 20:49:49,Having trouble with a federal agency? Stop by my staff's #Scottsdale office hours tomorrow to see if we can help. http://t.co/kLrwyZktKt,4,5
476812157016088576,2014-06-11 19:44:11,"Voting today to #standwithvets &amp; pass the Veterans' Access to Care through Choice, Accountability, &amp; Transparency Act http://t.co/0JuJ3bE72k",18,9
476761369602445312,2014-06-11 16:22:22,President must make clear that there are consequences for illegal immigration. More in my letter with @SenJohnMcCain  http://t.co/byVp9cfCOE,18,2
476466934595457024,2014-06-10 20:52:24,My joint statement with @SenJohnMcCain on the transfer of illegal migrants from Texas to Arizona http://t.co/S7wtpTZkVM,6,3
476169244200423425,2014-06-10 01:09:29,Oh happy day. The airport family reunion when a missionary returns. http://t.co/4yKztjeaxQ,4,18
476035992063729664,2014-06-09 16:19:59,Accountability must accompany reform if we are to restore faith in #VA. Renewed call for DOJ investigation last week  http://t.co/pZOl5XrxPW,5,3
474921325476081665,2014-06-06 14:30:42,"70 years on, nothing inspires awe &amp; gratitude like listening to vets share memories of #DDay. http://t.co/NTR5oxJBwi http://t.co/v3XQ6GjeEp",18,21
474660253142089728,2014-06-05 21:13:17,RT @SenJohnMcCain: My stmt on today's agreement on VA reform - providing choice to our veterans and accountability to VA: http://t.co/snWdx…,23,0
474656210420252672,2014-06-05 20:57:13,Good news: Choice Card provisions remain in bipartisan #VA reform bill. Vets need choice in health care if VA can't deliver.,3,2
474567083465142272,2014-06-05 15:03:04,". @USChamber is right - instead of our archaic embargo, it's time for a new chapter in US-Cuba Policy. #Cuba",12,3
474550667793952768,2014-06-05 13:57:50,Saddened to hear of the passing of Chester Nez. The last of the Navajo Code Talkers is now gone.  What a great legacy.  #AZ,13,10
474290024645926912,2014-06-04 20:42:08,#VeteransChoiceAct is the #VA fix supported by @AmericanLegion @iava @AMVETSNational &amp; @ConcernedVets. Let's vote.  http://t.co/LCuWumP7wg,9,3
473967430029438977,2014-06-03 23:20:15,"Okay, so it's not the @Dbacks, but it's baseball. Go @Nationals! http://t.co/ipdfi0pFyf",10,12
473943493983760384,2014-06-03 21:45:09,"Surprised to see open assault on 1st Amdt at Jud Cmte hearing. Need to protect all speech, not just speech we agree with. #DontRepeal1A",22,9
473937907141459969,2014-06-03 21:22:57,Congress can take the first step to ensure vets choice &amp; flexibility by passing the #VeteransChoiceAct https://t.co/6GUGmy511R,9,5
473909822283608065,2014-06-03 19:31:21,Pleased to join @SenJohnMcCain @TomCoburn and @SenatorBurr to introduce the Veterans Choice Act. #VA http://t.co/WmMQyLnCyn,6,5
473269015863779328,2014-06-02 01:05:00,"Okay. This is getting old already, dry heat or not. http://t.co/BsATFrSMNq",9,6
472762539034415104,2014-05-31 15:32:27,"Just briefed by Incident Commander Tony Sciacca and his #slidefire team. Great work, everyone. AZ is grateful. http://t.co/pQFkxF6Nf2",11,6
472478939504320512,2014-05-30 20:45:32,Just joined @KTAR923's @RobandKarie to discuss the latest on the #VA.,2,1
472397192699719680,2014-05-30 15:20:42,President has accepted Sec. Shinseki's resignation.  Good move. Now let's fix the problems. #VA,18,11
472125119641686016,2014-05-29 21:19:34,Beating the heat with an Eagle Scout Project in Flagstaff. http://t.co/kqfJspfVjU,2,4
471770445763448832,2014-05-28 21:50:14,"I join @SenJohnMcCain in calling for Gen. Shinseki to resign and, if he does not resign, for the president to ask for his resignation. #VA",14,7
471728953489518592,2014-05-28 19:05:21,On way to press conf w/ @SenJohnMcCain where I will call for Sec. Shinseki's resignation.,20,5
470966985971728384,2014-05-26 16:37:34,Proud to honor our war dead at the National Memorial Cemetery of Arizona this morning. http://t.co/9I4hkHjG6i,6,8
469587280127332352,2014-05-22 21:15:06,Pleased to hear the IRS will revise proposed regs that would limit the advocacy and educational activities of 501(c)(4) organizations.,6,0
469508396082012161,2014-05-22 16:01:39,Congress shouldn't be so quick to forget the waste and corruption associated with #earmarks.  https://t.co/GoZ01HyAu4,11,1
469189188378972161,2014-05-21 18:53:14,My response to the president’s remarks on the widening #VA scandal http://t.co/YPhHLti1MU,6,1
468450940144476160,2014-05-19 17:59:42,Immigration reform: Good policy is good politics as well: http://t.co/wwuNg4YGnY,32,17
467373274507530240,2014-05-16 18:37:26,Speaking with the Agribusiness and Water Council of Arizona #Time2TalkH2O http://t.co/GIYG3t5C7c,4,3
467017491294978048,2014-05-15 19:03:41,"RT @SenAlexander: Alexander, @JeffFlake offer amendments to end #windPTC, Washington's “most conspicuous, wasteful taxpayer subsidy” http:/…",8,0
466779145239023616,2014-05-15 03:16:35,RT @brianbabylon: @JeffFlake hanging out at the @NPR shop! I'm serious Jeff I can get the GOP on the right track 👍👍 http://t.co/U49pgnKHBC,1,0
466772381013659648,2014-05-15 02:49:42,"Congrats to Carl Kassel for 60 years of journalism, 30 years @NPR and 15 years  with @waitwait  What a career. http://t.co/uOSjt7RVrH",3,10
466750584893485056,2014-05-15 01:23:05,Here with @petersagal of @waitwait at Carl Kassel's retirement send off. @npr http://t.co/dSNHJazwXw,12,13
466707795673620480,2014-05-14 22:33:04,"Good day! Senate just confirmed 3 AZ judges: Steven Logan, John Tuchi and Diane Humetewa, the first Native American woman on fed. bench.",7,9
466653313686315009,2014-05-14 18:56:34,I took to the Senate floor today to discuss allegations leveled at the Phoenix VA Health Care System https://t.co/zgtCArJ8Pz,3,0
466602678005792768,2014-05-14 15:35:22,"Congratulations to @GoldwaterInst CEO Darcy Olsen on being awarded the 2014 Bradley Prize. Well done, and well deserved!",2,1
466399544255991808,2014-05-14 02:08:11,Congrats to @Sasse4Senate and @CapitoforWV on GOP Senate primary wins in NE and WV tonight. To November and beyond!!!,21,6
466363402521440256,2014-05-13 23:44:34,Great read from Sen. Kyl and Richard Morrison re need for proactive water management  http://t.co/T9pDfZqMBk via @azcentral #time2talkh2o,9,5
466282056885239809,2014-05-13 18:21:20,It's time to kill the #ZombieTaxCredit #PTC https://t.co/Zp57oTHUWX,9,4
465968636147269633,2014-05-12 21:35:54,"Best wishes to @ADL_National's Bill Straus in retirement. Great work, Bill. These are big shoes to fill.  http://t.co/whNgG7tKfn",3,1
465593201101783040,2014-05-11 20:44:04,"I am reminded on Mother's Day I have a wonderful mother, an incredible wife, and an amazing daughter. #luckyman http://t.co/nIKOuqMoEl",2,19
464872687911706625,2014-05-09 21:01:00,"Met with VA whistleblower Dr. Katherine Mitchell today, I remain convinced that IG review needs to be prompt &amp; thorough.",8,6
464182715030724608,2014-05-07 23:19:18,Evening run to the Lincoln Memorial. Washington at its best. http://t.co/hZRALTrPjH,5,23
464173186851307521,2014-05-07 22:41:26,RT @shannonrwatts: #Arizona @MomsDemand members meet with Sen @JeffFlake to talk about #gunsense #MomsVote #momstrong http://t.co/GuWn6or4N9,28,0
464172439384371201,2014-05-07 22:38:28,RT @B3Strategies: @WWIIMemorial @JeffFlake  celebrating America's greatest generation with #WWII vets http://t.co/hapULlQVIk,4,0
464135066172801025,2014-05-07 20:09:57,RT @B3Strategies: @WWIIMemorial with @JeffFlake @AnnieMooney #phoenixchildrens celebrating our #AzVets. http://t.co/F2nDQjJNV4,3,0
464119220398084099,2014-05-07 19:06:59,With @HonorFltAZ at WWII Memorial. 100 year old veteran Arnold Schroeder tells his remarkable story. #HonorFlight http://t.co/ZI5ffiaIHe,18,15
464090968523014144,2014-05-07 17:14:43,RT @JenLongdon: .@JeffFlake thank you again Senator for a productive conversation. #momsvote,3,0
464068112971612160,2014-05-07 15:43:54,Pig selfies are in. Especially at the @GovWaste Pig Book Press Conference http://t.co/C7Lksq5NUf,17,19
462705664670703616,2014-05-03 21:30:01,Nothing like father and sons outing. Just missing Austin at college. http://t.co/o7G9JJHLOq,3,10
462291224003497986,2014-05-02 18:03:11,Met with Phx VA earlier and w/ Dr. Foote today re allegations.  I support Sec. Shinseki's call to place 3 PHX VA officials on leave.,2,3
462248500776796163,2014-05-02 15:13:25,Pleased to lend my support to @TomCoburn and @MarkUdall effort to preserve the ban on earmarks.,8,2
461921436463300608,2014-05-01 17:33:47,ICYMI: Yesterday I joined @RobandKarie on @KTAR923 to discuss the latest on the PHX VA investigation. Listen at https://t.co/AMNRQNvb7z,5,4
461364901043109888,2014-04-30 04:42:18,My thoughts on the passing of Stan Turley https://t.co/sG5leZvmVQ http://t.co/zrEaAPQA6F,3,3
460944975576854529,2014-04-29 00:53:40,"Happy Birthday, more than 2,000 miles away, to the love of my life. http://t.co/f8h6w20m5Z",5,12
460943034843402241,2014-04-29 00:45:58,"One of Arizona's great statesmen, Stan Turley, has passed away.  What a legacy he leaves.  http://t.co/fB9GzpfNJ1",4,1
460940907521773569,2014-04-29 00:37:30,Please to see new effort to bring outdated Cuba policy into the 21st Century #CubaNow http://t.co/n5cipRHfbr,24,6
460809736045096961,2014-04-28 15:56:17,Pleased to hear Pres Obama has ordered @DeptVetAffairs to investigate disturbing allegations of mismanagement and neglect at PHX VA,5,3
460088594170789888,2014-04-26 16:10:43,Good editorial by @arizonarepublic on forest health http://t.co/IXA3ZeQg6P @MartinHeinrich @A_SNFs,6,1
459924687682682880,2014-04-26 05:19:25,"Great to watch my son Tanner run the 300 hurdles tonight, and to meet @BobGrant21, the nation's top 300 hurdler. http://t.co/KMoQFdox04",8,22
459918008731697153,2014-04-26 04:52:52,RT @Mkkelly70: Senator Jeff Flake and his son Tanner with US#1 300 hurdler Robert Grant from Brophy college Prep. At… http://t.co/uGm3kxS3NE,6,0
459802883517456384,2014-04-25 21:15:24,RT @SteveVoeller: Sen. @JeffFlake and @SenJohnMcCain speaking at @azchamber luncheon. Great job by @azhamer and team. http://t.co/MyI1th5Frw,3,0
459736329111076864,2014-04-25 16:50:57,Encouraged by @SpeakerBoehner's efforts to bring immigration reform legislation to the House floor.,35,15
459443528771194880,2014-04-24 21:27:27,"As allegations continue to surface regarding patient care at the PHX VA, we've got to get to the truth without delay http://t.co/krs6qf4KA6",4,6
459029986691661824,2014-04-23 18:04:11,Speaking this morning to the Phoenix Council on Foreign Relations. http://t.co/hrSm79cYeR,1,5
458705677737664513,2014-04-22 20:35:30,RT @MartinHeinrich: Press avail w/ @myfoxpheonix &amp; @abc15 after a tour of the Vaagan Portable Mill w/ Sen. @JeffFlake http://t.co/eZVqIgIf5U,4,0
458690777678217216,2014-04-22 19:36:18,RT @MartinHeinrich: Discussing the link between the small wood industry &amp; forest restoration at family owned &amp; operated AZ Log &amp; Timberwork…,6,0
458676136323850241,2014-04-22 18:38:07,"RT @MartinHeinrich: Touring Forest Energy Corporation Pellet Plant in Show Low, AZ with Sen. @JeffFlake http://t.co/vvrLKIL788",4,0
458676111422259200,2014-04-22 18:38:01,RT @MartinHeinrich: Sen. @JeffFlake &amp; I are at the AZ/NM border where businesses are turning forest health &amp; restoration into economic oppo…,4,0
458666068014538752,2014-04-22 17:58:06,Touring Forest Energy in Show Low with @MartinHeinrich http://t.co/GTIBhRFbHN,4,4
458633550732853248,2014-04-22 15:48:54,"RT @SpeakerBoehner: Do you agree we should keep the #earmarks ban in place?  RT yes, Favorite no.",170,0
458399849616920576,2014-04-22 00:20:15,My thoughts on @JebBush's comments on immigration https://t.co/sG5leZvmVQ,16,8
458398696795676672,2014-04-22 00:15:40,RT @MartinHeinrich: I'm ready for tomorrow’s tour of @A_Sitgreaves &amp; Gila Nat'l forests with Sen. @JeffFlake. #nmfire http://t.co/ZgWpDWv10B,5,0
458302864742285312,2014-04-21 17:54:52,Looking forward to touring AZ and NM forests tomorrow with Sen. @MartinHeinrich http://t.co/LfUR2d5V5f,4,1
457671785144541184,2014-04-20 00:07:11,My favorite interview of the year is re-airing on @npr this weekend http://t.co/O6b8kqOjN2 @waitwait @petersagal,5,7
457568926503694336,2014-04-19 17:18:27,Easter with Aiden. Nothin' better http://t.co/AjTsWFagGn,3,8
457262997426036736,2014-04-18 21:02:48,. @SenJohnMcCain and I had meetings with VA officials this morning.  Further investigation needed by Senate VA Committee.,23,15
457189636574433280,2014-04-18 16:11:18,"Just trying to be like Mike. With my brother CMSgt Mike Flake, 943rd Rescue Group, Davis-Monthan AFB. Great tour. http://t.co/vlCyKR2MFF",19,18
456118584838610944,2014-04-15 17:15:19,#TaxDay is another reminder of the need to reform our burdensome tax code. http://t.co/p7CudHnmWV,8,4
455930585114882048,2014-04-15 04:48:16,"Just learned of the passing of Chuck Wahlheim, the East Valley's ultimate booster. This is a better place to live because of him.",4,1
454429854583119873,2014-04-11 01:24:54,Good news here. USAID's ill-fated Cuba Twitter project will receive a proper review. http://t.co/6LXU7qJVj7,3,2
454379439653003265,2014-04-10 22:04:35,I join @SenJohnMcCain responding to reports of mismanagement/neglect at PHX @DeptVetAffairs Health Care Sys http://t.co/ZviE1lZ3Uo,4,4
453931515693776897,2014-04-09 16:24:41,Honored to meet with Arizona’s @MilitaryOfficer delegation today. Thank you for your service! #Storming2014 http://t.co/PFYi1Wd9pT,5,2
453655643761963008,2014-04-08 22:08:28,"Contrary to claims of bone-deep spending cuts, there is plenty of fat left to be trimmed from the fed budget http://t.co/Feuzrnm7Mf",2,4
453550808433696768,2014-04-08 15:11:53,More on my bill to halt the IRS's latest attempt to quash free speech in today’s @StarNet #TaxDay http://t.co/WBjjOabhX3,6,0
453192524358615041,2014-04-07 15:28:12,Time to name a Champion of Waste - is it the Showy Staters or the Ghost Town Recons? #8ofWaste #MarchMadness http://t.co/zTwweX92qS,7,4
452184881879998464,2014-04-04 20:44:11,Check out who stopped by my office this week https://t.co/FVX0ebFVDO,1,0
452093715138760705,2014-04-04 14:41:55,Bigger waste of your taxes - $1.3M on alcohol or $34M on a facility the military won’t use? #8ofWaste #FinalFour http://t.co/4fhXQnuCFv,5,1
451895225745539073,2014-04-04 01:33:12,"If there was ever a better case for changing our Cuba policy, I have not seen it.  Wow. http://t.co/RWsfer09Wn",19,5
451798206901673984,2014-04-03 19:07:41,Congratulations to @CAPArizona on the 20th anniversary of the Lake Pleasant Storage Reservoir #Time2TalkH20 https://t.co/vcRTNZmgCN,4,2
451724192044826624,2014-04-03 14:13:34,What’s a bigger waste of your $ - $130K for NFL to hock ACA or $5M for @StateDept stemware? #8ofWaste #FinalFour http://t.co/5QkjqylQs6,2,1
451496411675512832,2014-04-02 23:08:27,Thoughts and prayers with victims of shooting at Fort Hood.,6,5
451491236969709568,2014-04-02 22:47:53,Getting last views of the Capitol before it is shrouded in scaffolding for a couple of years for refurbishing. http://t.co/SpmVX4w6uS,12,15
451473709996728320,2014-04-02 21:38:15,"RT @MeganRunyan: GT is where loyalty, vision, and service 2 community are supreme priority. #jumpingintheshadowsofgreatness @MSB_MBA http:/…",2,0
451437108172181504,2014-04-02 19:12:48,"Talking water solutions today with water professionals from Kazakhstan, Kyrgyzstan, and Tajikistan #Time2TalkH20 http://t.co/qcIWqJCmFl",3,2
451425217639116800,2014-04-02 18:25:33,Are you one of the millions being squeezed by #Obamacare’s new mandates? My #ReLIEF Act will help. Discussing on the #senate floor soon.,0,1
451397767605538816,2014-04-02 16:36:29,10! http://t.co/NDIs8fNk3N,1,5
451379052541399040,2014-04-02 15:22:07,Ghost Town Recons win! Thanks for voting! Check back tomorrow for the tipoff of my Elite #8ofWaste #FinalFour http://t.co/AOnZYkeSEt,0,2
451145264938893312,2014-04-01 23:53:07,Dusk in Washington. Some views just never get old. http://t.co/gJ7wJasqeA,5,17
451136391297380352,2014-04-01 23:17:52,Pleased to see AZ ports of entry among those set to receive additional U.S. Customs and Border Patrol officers http://t.co/rp9KbYbxSW,8,4
451003802980999170,2014-04-01 14:31:00,$5M for @StateDept stemware? No #AprilFoolsDay prank here. That and more in my @foxandfriends Elite #8ofWaste recap http://t.co/Cz0HLlDotH,8,0
450773030453932032,2014-03-31 23:14:00,Tune into @foxandfriends Tuesday at 6:15 am EST for my Elite #8ofWaste bracketology session with @kilmeade @ehasselbeck and @sdoocy,6,2
450664167708450816,2014-03-31 16:01:25,Enjoyed this @AtWarOnTheRocks interview on Cuba policy. http://t.co/nWIRkifEh2,2,2
