id,created_at,text,retweets,favorites
458674286866489344,2014-04-22 18:30:46,Congratulations to @GreeneSchoolRI &amp; Pell Elementary on being named Green Ribbon Schools by @usedgov! @davidcicilline http://t.co/tq1fOjv8aF,4,2
458658878356750336,2014-04-22 17:29:32,My Rhode Island District office is now accepting applications for summer interns! http://t.co/DUb5GTAa3o,1,0
458655268159901696,2014-04-22 17:15:11,"When I think of ways to #ActOnClimate I'm reminded of how lucky RI is to have @SenWhitehouse, a leader on environmental protection #EarthDay",6,1
458636387659821056,2014-04-22 16:00:10,Today is #EarthDay. Join the @EPA in their efforts to #ActOnClimate http://t.co/iZG8WAUR4n,2,0
458612778983759872,2014-04-22 14:26:21,"We can all protect and preserve our environment, from turning off the lights to recycling more. On #EarthDay, I pledge to #ActOnClimate",4,2
458325515880108033,2014-04-21 19:24:52,Congrats @FitzProv &amp; @NBC10_Mark on completing the #BostonMarathon! What an accomplishment for you and for all the runners. @projo @NBC10,1,1
458281563361656832,2014-04-21 16:30:13,"ICYMI, I appeared on @NBC10 to talk about the need for stronger cyber protections in the wake of the Michaels breach http://t.co/iI5xsFUF8u",1,0
458259011541159936,2014-04-21 15:00:37,Today RI celebrates and remembers an extraordinary woman who had an indelible impact on our state. We will never forget Nuala Pell,1,1
458203746183708672,2014-04-21 11:21:00,"Have a happy and safe Patriots Day &amp; good luck to all the #BostonMarathon runners. Your hard work is so inspiring, especially this year",2,1
457884094031216640,2014-04-20 14:10:49,"Happy Easter! Enjoy the day with your faith and family, and God bless!",3,0
457648890020655104,2014-04-19 22:36:12,"I'm proud to be at the Cranston Portuguese Club tonight to support the RI Military Organization, for what I hope will become an annual event",5,3
457550654266179584,2014-04-19 16:05:51,"Happy Cambodian New Year, especially to everyone celebrating today at @rhodesopawtuxet with the Cambodian Society of Rhode Island!",4,1
457231491819655168,2014-04-18 18:57:37,RT @NBC10_Bill: Security breaches threaten American economy says Rep @jimlangevin,2,0
457212807910797312,2014-04-18 17:43:22,Talking #cybersecurity and the Michael's breach with @NBC10_Bill @NBC10 http://t.co/IGopX9nBc8,1,0
456866158642479104,2014-04-17 18:45:55,A very Happy Birthday to @SenatorMillerRI!,2,0
456857540337598464,2014-04-17 18:11:40,RT @CrossroadsRI: Happy to have @jimlangevin &amp; @LtGovRoberts join us for the kickoff of this great cause! 5/31 &amp; 6/1 free dental clinc: htt…,2,0
456804236974895104,2014-04-17 14:39:51,"RT @LtGovRoberts: 'It all starts with a smile' at RI Mission of Mercy Free Dental Clinic: May 31, Jun 1, CCRI Lincoln campus. @CCRINews htt…",3,0
456803190152118272,2014-04-17 14:35:42,@jessandunnotis @LtGovRoberts @CCRINews @DeltaDental @BCBSRI I would encourage anyone to volunteer at the clinic for starters!,0,2
456801601525518336,2014-04-17 14:29:23,All today's speakers agree we hope the RI Mission of Mercy's work is someday no longer needed @LtGovRoberts @CCRINews @DeltaDental @BCBSRI,3,2
456800685921542144,2014-04-17 14:25:45,"Happy Birthday to @LtGovRoberts, who is here at the RI Mission of Mercy clinic kickoff. There is no better champion for health care in RI",1,2
456798971810164736,2014-04-17 14:18:56,I'm proud to support the RI Mission of Mercy free clinic and I'm grateful to all volunteers @DeltaDental @CCRINews http://t.co/IQjlNzdczq,4,4
456797686323093505,2014-04-17 14:13:49,".@CCRINews will host the RI Mission of Mercy free dental clinic on May 31 and June 1, and this year's goal is to serve 1,000 people",3,1
456796285421371392,2014-04-17 14:08:15,Just got to Crossroads for the kickoff of the RI Mission of Mercy free dental clinic - a wonderful program @DeltaDental @BCBSRI @CCRINews,5,2
456577209294004224,2014-04-16 23:37:44,Thanks to the Student Community Government Group at @RICNews for having me in to speak this evening http://t.co/OcRbFxMoeD,5,5
456508386075365376,2014-04-16 19:04:15,"Hope Valley Industries should be proud - not only are they @GM Supplier of the Year, but they also have a great team http://t.co/iJp0vSV6z7",2,1
456506490732281856,2014-04-16 18:56:43,"RT @QuonsetRI: @JimLangevin on @US_EDA grant: ""Quonset and the Port of Davisville are anchors of the Rhode Island economy""",1,0
456504358847275009,2014-04-16 18:48:15,"Hope Valley started with 17 employees and now has 250+, and does their manufacturing here in RI http://t.co/ynkB53hOhO",2,0
456501984342708224,2014-04-16 18:38:49,Just arrived at Hope Valley Industries in N. Kingstown for a tour and update on operations. Hope Valley was named @GM Supplier of the Year,3,1
456493137720901632,2014-04-16 18:03:39,"Thrilled to be at Peace Dale Elementary to share one of my favorites, ""House Mouse, Senate Mouse"" for #ReadingWeek http://t.co/DdrsOwr6g6",1,1
456477444862926848,2014-04-16 17:01:18,RT @SenJackReed: Joining w/ @SenWhitehouse @jimlangevin @davidcicilline to announce $787k in @NEAarts grants to support arts &amp; boost #RI’s …,2,0
456468937815756800,2014-04-16 16:27:30,One great thing about Navatek is last year they say they hired more @URINews engineering grads than any other RI biz http://t.co/3v2I3hy21N,8,2
456468671343255552,2014-04-16 16:26:26,"Earlier I took a fascinating tour of Navatek in Peace Dale, a company producing incredible technology here in RI http://t.co/VAtymibDXH",2,0
456466743943503872,2014-04-16 16:18:47,Great to be here at the South Kingstown Senior Center today to have lunch and catch up with area seniors http://t.co/8iJtHA51Hz,4,0
456422941342052352,2014-04-16 13:24:43,"This is great news, @dadekian! Congrats. I can't wait to see what you come up with at your culinary hub (via @projo) http://t.co/kTCRIZeIXp",2,1
456164445878644736,2014-04-15 20:17:33,And the Congressional Youth Caucus discussion begins! RI has some truly extraordinary young students http://t.co/o7NpoJbBd5,2,2
456160084888784896,2014-04-15 20:00:13,"Looking forward to today's Congressional Youth Caucus meeting, where we will discuss current events and the global economy #CYC",1,0
456099795950899200,2014-04-15 16:00:39,Don't forget today is #TaxDay. Visit the @rigov @RhodeIslandTax site to learn about available #freefile programs http://t.co/mQtarVfdoR,1,0
456098836831019009,2014-04-15 15:56:51,"@0xdanad @SenWhitehouse RI Police Chiefs Assc./RISP Computer Crimes unit, &amp; we discussed need for training programs for future professionals",0,0
456078353284747264,2014-04-15 14:35:27,One of the big #cybersecurity challenges is building a training pipeline for future cyber pros @SenWhitehouse http://t.co/msEcMB10sc,2,0
456073250469347328,2014-04-15 14:15:11,Proud to join @SenWhitehouse this morning for a roundtable discussion on #cybersecurity with the RI Police Chiefs Association @RIStatePolice,1,0
456069707372961793,2014-04-15 14:01:06,"Today we remember the victims &amp; families of the #BostonMarathon Bombing, and I am grateful for the stronger city that emerged #BostonStrong",5,2
456062992904646656,2014-04-15 13:34:25,"FYI for business owners, the @SBAgov Office of the Nat'l Ombudsman is hosting a Regulatory Fairness Forum from 10 to 12 @NEInstituteTech",3,0
455854127957159936,2014-04-14 23:44:28,Chag Sameach to all those celebrating Passover. I hope you have a wonderful celebration with your families and loved ones!,2,1
455811235423215616,2014-04-14 20:54:01,RT @SOAlumniNetwork: @jimlangevin @RICNews Thank you for supporting Rhode Island Science Olympiad and #STEM education! @SOAlumniNetwork @SO…,1,0
455774069934538752,2014-04-14 18:26:20,Great news that @QuonsetRI is receiving $800K in federal grants to upgrade two new berths at the @Port_Davisville,4,2
455740904218046464,2014-04-14 16:14:33,"It's National Library Week! Celebrate by visiting your local library, or signing up for a library card @rilalibs @LibraryBoardRI @EZoneRI",3,2
455406316711059456,2014-04-13 18:05:01,"Nuala Pell was a selfless, kind, courageous woman dedicated to public service, and it is with deep sadness that we say goodbye to her",4,0
455026680890155009,2014-04-12 16:56:29,Great to be here at the 25th RI Science Olympiad at @RICNews! A lot of talented students on display http://t.co/ITFkADi9Nc,6,2
454665547163381760,2014-04-11 17:01:28,Incredible @IndependentRI story about an #EGHS trainer whose quick thinking saved a student. Well done! http://t.co/wEkVcDp2uw,5,2
454634528515321856,2014-04-11 14:58:12,Glad to be here for Lippitt Mill groundbreaking. What a wonderful preservation project @PreserveRI @West_Warwick_RI http://t.co/LHnBNNafHT,2,1
454629900830658560,2014-04-11 14:39:49,It's great to see how Built Inc and Northeast Collaborative Architects will transform Lippitt Mill @West_Warwick_RI http://t.co/VwPCjW8Mye,1,2
454364477736378371,2014-04-10 21:05:07,.@ABCSharkTank looking for veterans w/ a business idea in need of funds. Email SharkTankCasing (at) yahoo (dot) com to apply @DeptVetAffairs,0,0
454335758355415040,2014-04-10 19:11:00,Judges from @Wickfordart have arrived! They have their work cut out for them with many wonderful entries to consider http://t.co/z9VK7zo7pt,3,3
454334263224467456,2014-04-10 19:05:04,My RI team is meeting w/ @Wickfordart Association this afternoon to talk about this year's Art Competition! Thanks for signing on as judges!,1,1
454309615195680771,2014-04-10 17:27:07,In '76 a Pell grant covered 72% of 4yr public univ tuition. It's now 36% but GOP budget cuts Pell funds to RI by $12.7M? I disagree #UMatter,11,0
454304155373670400,2014-04-10 17:05:25,New England Chapter of @AILANational is in DC to advocate for comprehensive immigration reform - an issue I hope this Congress will take up,1,0
454283920964853760,2014-04-10 15:45:01,Congrats @dadekian on being featured on @wpri12 Executive Suite! David is such a leader in RI's food economy @tednesi http://t.co/fJbF7fRLWB,5,4
454267605365571584,2014-04-10 14:40:11,Thanks Mark Male and all the Independent Insurance Agents stopping by to talk about insurance regulation with my staff @ri_agents,1,0
454253407508127745,2014-04-10 13:43:46,Good luck to students participating in Real World Day today @BryantUniv. It's a great program for financial literacy and other impt skills,1,1
454031072293314561,2014-04-09 23:00:17,"Wish I could be there for the RI Freshwater Forum this evening, featuring Janet Coit of @RhodeIslandDEM",1,0
454000827360108544,2014-04-09 21:00:06,Rhode Island should be proud to have @wpro reporter @KimKalunian representing our great state this week as Cherry Blossom Princess!,3,2
453985915460153344,2014-04-09 20:00:51,Remembering the #ArmenianGenocide today. Thanks to @ANCA_DC for ensuring that we never forget,16,14
453979411071913984,2014-04-09 19:35:00,"It's great to have Dystonia Advocacy Network in DC, as this movement disorder is unknown to many @DystoniaSociety http://t.co/QyeXgBfmjK",0,1
453975072882294784,2014-04-09 19:17:46,"Thoroughly enjoying today's @SEEC meeting speaker, EU Commissioner for Climate Change @CHedegaardEU, who is addressing US climate policy",4,3
453955153914105856,2014-04-09 17:58:37,I'm grateful @URINews has a strong @4H program. It's great to learn from the @ri4hfoundation reps visiting DC today http://t.co/xjzIgnGOXw,5,3
453949270857908225,2014-04-09 17:35:14,".@Tech_Collective, thank you and @IAmBiotech for speaking with my staff about health care issues and @NIH funding",3,2
453920272991916032,2014-04-09 15:40:01,Thanks again to @NAPEquity for having me speak at Public Policy Day! http://t.co/gDPdSBEFF4,0,0
453909256321130497,2014-04-09 14:56:14,I'm proud to be speaking at the @NAPEquity Public Policy Day about the importance of career and tech education to a competitive workforce,0,0
453902043816931328,2014-04-09 14:27:34,Thanks to Donna and Bill McGowan and Sadie DeCourcy from RI Chapter of @alzassociation for your advocacy on behalf of patients and families,0,0
453900756803129344,2014-04-09 14:22:28,"Thoughts and prayers out to the people in Murrysville, Pennsylvania, especially all of the students and their families",1,1
453638513871691777,2014-04-08 21:00:24,"Thank you @SenJackReed and @SenWhitehouse for your leadership on #renewUI benefits. @SpeakerBoehner, it is time for the House to vote",19,8
453634094610386945,2014-04-08 20:42:50,Just a reminder to @Microsoft @Windows XP users that you should upgrade to avoid cybersecurity risks http://t.co/jbkdcefmt8,1,0
453589390934417408,2014-04-08 17:45:12,"Construction trades are crucial to RI economy, for job creation &amp; strengthening infrastructure. Thanks @RIBuilders for stopping by my office",1,0
453588310854627329,2014-04-08 17:40:55,Great to meet reps &amp; students of RI Assn of Nurse Anesthetists to talk access to care/job development @aanawebupdates http://t.co/IbhAUnD05G,1,0
453548184930103296,2014-04-08 15:01:28,Thanks to Mary Kelley of the @URINews @URI_DPT Physical Therapy program for talking to my staff about challenges facing your profession,1,3
453542412825419776,2014-04-08 14:38:32,Today is #EqualPayDay2014. Women in the US are paid 77 cents for every dollar paid to men. This needs to change! #equalpay @PaidSickDays,5,4
453298743220391936,2014-04-07 22:30:16,Best of luck to the @FestBalletProv at your gala this evening at @HotelProvidence!,1,2
453245995363876865,2014-04-07 19:00:40,"On #WorldHealthDay, I am reminded that a proactive approach to wellness is crucial. Eat healthy, exercise and visit your dr regularly @WHO",2,1
453203080839168000,2014-04-07 16:10:09,"Did you know it's National Volunteer Week? Visit a local school, senior center or non-profit to lend a hand however you can #volunteerweek",2,2
453185654168780802,2014-04-07 15:00:54,Wish I could be at the @NUWCNewport for the dedication ceremony for a new $20M electromagnetic sensor lab - an exciting investment in RI,0,0
453177327737135105,2014-04-07 14:27:49,I am particularly struck by 54% spike in SNAP participation among children from '08 to '13. We must support @SNAP_Ed program @RIKidsCount,9,4
453177301208162304,2014-04-07 14:27:42,"On the release of the 20th annual Factbook, I want to thank @RIKidsCount for your leadership and advocacy on behalf of RI youth and families",1,1
452521150921601024,2014-04-05 19:00:24,Did you know it's @roboweek? Celebrate by checking out the @RobotBlockParty at @BrownUniversity #robotics #STEM http://t.co/zgpRzliqRO,4,2
452506102450909184,2014-04-05 18:00:36,Wish I could be there for the RI Junior Duck Stamp awards ceremony at Exeter West Greenwich High School today - good luck to all involved!,1,0
452445648122810369,2014-04-05 14:00:23,Congrats to all the RI Energy Expo Award winners at the @RIBAHomeShow! Thank you for your leadership in energy conservation and efficiency,2,1
452426705928740864,2014-04-05 12:45:07,Just a reminder that @SenJackReed and @SenWhitehouse are hosting a Military Academy Day until noon at @CCRINews http://t.co/Z3U4pugwN9,1,1
452192677367660544,2014-04-04 21:15:10,Anyone interested in military shouldn't miss @SenJackReed &amp; @SenWhitehouse's Military Academy Day tomorrow @CCRINews http://t.co/VBsFAVzCdB,1,1
452162462201413633,2014-04-04 19:15:06,Kudos to the @RIAssemblyPress for passing legislation to speed up use of $6M federal grant to repair storm-damaged piers at @QuonsetRI,2,1
452143573237260289,2014-04-04 18:00:02,McCutcheon is a step in the wrong direction for fair elections (via @projo) http://t.co/gXoK4ytvBC,1,0
452128572623552512,2014-04-04 17:00:26,It's finally Opening Day at Fenway Park for the @RedSox! Congrats to the 2013 Champs! Go #Sox! #redsox #openingday,1,5
452113751282819073,2014-04-04 16:01:32,"ICYMI, House passed the Children's Hospital GME Support reauthorization @SenJackReed @SenWhitehouse @davidcicilline http://t.co/Xicy17P3Tt",2,0
452101402954072064,2014-04-04 15:12:28,Good luck to @JWUProvidence at today's RI Seafood Challenge on the Harborside Campus. I wish I could be there! @RhodeIslandDEM @URINews,1,2
451835487213588480,2014-04-03 21:35:49,Spring must be here since it's opening day for the @PawSox! Play ball!,2,2
451834057119502336,2014-04-03 21:30:08,"I hope you enjoy Adoption RI's Spring Skating Party, @darlene_allen! Good luck with the event",2,1
451811618952081409,2014-04-03 20:00:58,".@DMontiFish, I appreciate you talking to my staff about fisheries management &amp; how it affects charters like No Fluke and Barebones Fishing",3,1
451796468861771776,2014-04-03 19:00:46,We must fight for strong medical research funding and @NIH. Thanks to the @AAOS1 American Academy of Orthopaedic Surgeons for your advocacy,0,0
451781371766513664,2014-04-03 18:00:47,"The #FairEmployment Protection Act would strengthen protections from harassment, especially on low-wage workers. We need to act!",2,0
451766145960640512,2014-04-03 17:00:17,"Congratulations to Brooke Macomber @broo44 of @CoventryOakers, the RI Assistant Principal of the Year, who is in DC today @Coventry__RI",3,1
451758592497311744,2014-04-03 16:30:16,Best of luck to all the participants and vendors at the @RIBAHomeShow this weekend at the RI Convention Center @RIBuilders,2,1
451748176404684800,2014-04-03 15:48:52,"Thanks to Rebuilders Auto in @Coventry__RI, @BBBIndustries and @MEMADC for coming by my office to discuss the auto #manufacturing industry",2,0
451489948605349889,2014-04-02 22:42:46,Thoughts and prayers out to the people in Fort Hood,3,1
451465357442945024,2014-04-02 21:05:03,I am excited and honored to accept the Humane Champion award from the @HumaneSociety today for my support of animal protection legislation,1,3
451415031209820160,2014-04-02 17:45:04,"Thanks folks from @JWUProvidence, HVS Hotel Management and American Hotel &amp; Lodging Asscn. for talking legislative priorities with my staff",3,0
451410115762327552,2014-04-02 17:25:33,Great to meet RI students learning about the legislative process as part of the Washington Center for Internships and Academic Seminars,1,0
451391131251900416,2014-04-02 16:10:06,So honored to accept the Star of Education award for distinguished service from @CTEWorks Nat'l Assn of State Directors of CTE Consortium,4,1
451381838184218625,2014-04-02 15:33:11,"On Autism Awareness Day, I'm thankful for @autismspeaks @AutismSociety @GrodenNetwork and @AutismProjectRI for your leadership &amp; advocacy",2,3
451375843638804480,2014-04-02 15:09:21,Reminder to @URINews students that there's a career fair @TheRyanCenter today from 11 to 3. Get informed about the jobs that are out there!,2,1
451056450715267072,2014-04-01 18:00:12,"With open enrollment over, I want to give kudos to @HealthSourceRI on leadership and ensuring RIers #GetCovered http://t.co/y5IDlWJmgE",1,0
451028729842913280,2014-04-01 16:10:03,More than ever we need to encourage companies to keep jobs in America - not ship them overseas. #GOPbudget protects harmful tax loopholes,2,2
451018688049971200,2014-04-01 15:30:09,Congratulations to the @RedSox for being honored today by President @BarackObama at the @WhiteHouse,2,2
451012051214020608,2014-04-01 15:03:47,Thanks to @ConcernedVets for America for meeting with my staff to discuss legislative priorities for veterans and military families,5,0
450777164812914688,2014-03-31 23:30:25,Glad to be with a class of @URINews students to discuss national security and #cybersecurity http://t.co/wE8mmYtZ1V,6,4
450754489105252352,2014-03-31 22:00:19,Looking forward to going to @URINews tonight to talk to former Congressman Weygand's Legislative Policy class,2,3
450720464726679552,2014-03-31 19:45:07,Thanks @joshuaaromin of @RIMonthly for your interest in the food economy and how we can brand RI as a culinary destination #RIFoodWeek,0,1
450710163616694272,2014-03-31 19:04:11,Congrats to the @WesternHillsMS students recognized in the @Verizon Innovative App Challenge (via @RhodyBeat) http://t.co/7V6BhozEAi,2,0
450689117245149184,2014-03-31 17:40:33,"Open enrollment ends today, so visit @HealthSourceRI and #GetCovered! http://t.co/nhfgU8TIh4",2,0
450650790148198400,2014-03-31 15:08:15,I always enjoy delivering @_MealsOnWheels. Thanks @MealsRI for including me in the #MarchForMeals campaign,6,2
450624519301234689,2014-03-31 13:23:52,RT @LISCRhodeIsland: Thank you @CitizensBank for investing in LISC for workforce development.  @jimlangevin says job training the to gettin…,3,0
450622324585541632,2014-03-31 13:15:09,"As we talk growing jobs, I believe the importance of skills training can't be overstated #askri2014 @Provchamber http://t.co/EKD1DGQs3g",4,0
450617739996979202,2014-03-31 12:56:55,.@Provchamber panel begins w/ the topic of health care reform #askri2014 @SenJackReed @SenWhitehouse @davidcicilline http://t.co/y0dC1kp8k7,2,1
450612076533514240,2014-03-31 12:34:25,Just arrived @CrownePlazaRI for the @Provchamber breakfast. Looking forward to some great conversation! @LW_ProvChamber,2,1
450258308897988608,2014-03-30 13:08:40,"There is a flash flood warning in effect for RI from the @NWS, so be careful out there! #ri #weather",4,2
449992766882611200,2014-03-29 19:33:30,Great lunch and great conversation with the US Ambassador to #Portugal! @davidcicilline http://t.co/BYLQdvCHdC,4,2
449969228545028096,2014-03-29 17:59:58,"Joining @davidcicilline for lunch with Bob Sherman, the US Ambassador to #Portugal",3,0
449297411924844545,2014-03-27 21:30:25,"When women succeed, America succeeds #banbossy #WomenSucceed http://t.co/zZeYRq8PzU",1,0
449277350103232513,2014-03-27 20:10:42,"As a frequent traveler though @PVD Airport, it was great to meet with RIAC officials today in DC. I am proud to have TF Green in my district",1,0
449275721891201024,2014-03-27 20:04:13,RT @RepJohnLarson: 174 have signed resolution @RepPeteKing and I introduced honoring efforts of Pope Francis http://t.co/rYOqzXbefA RT if y…,15,0
449274984389947392,2014-03-27 20:01:18,"I'm honored to speak today on behalf of Fr. Pat Conroy, House chaplain, in a documentary that @PBS is in the process of filming @HouseFloor",1,0
449245724543565824,2014-03-27 18:05:01,".@hurdy9, thank you for coming to my office today to talk about @NADAUpdate and issues important to the auto industry",3,2
449240831598555138,2014-03-27 17:45:35,I really appreciate @NOAA stopping by today to provide an update on their programs and priorities @NOAAComms,2,0
449216811729698816,2014-03-27 16:10:08,"Thanks to Scott Wolf from @GrowSmartRI for coming by to discuss the Complete Streets, Safe Streets Act",0,0
449207689651163137,2014-03-27 15:33:53,I just updated my blog to include the re-launch of Accessible RI from the @MSDreamCenter http://t.co/hwU9XA4leT,1,0
448989627933028353,2014-03-27 01:07:23,My thoughts and prayers go out to the families of the two @BostonFire firefighters who died in the line of duty today,10,7
448938808671997952,2014-03-26 21:45:27,Congratulations to all the @SkillsUSARI students being honored tonight at @TheVetsRI!,4,4
448879566669746176,2014-03-26 17:50:03,It's great to have students from @NKHS_RI in DC today to discuss legislative issues with my staff. Welcome to Washington! @kenworthy_tom,6,1
448852280105005057,2014-03-26 16:01:37,"Re-homing and its causes, like lack of support/resources, need to be addressed by Congress (via @Reuters) http://t.co/akNEsJZr5y",0,0
448833035912617984,2014-03-26 14:45:09,"We need 2014 to be a year of action. Mr. Speaker, I #DemandAVote on #immigration reform",0,0
448824275026604032,2014-03-26 14:10:20,I'm honored to be recognized as a Champion of Healthcare Innovation by the @HealthInFocus Healthcare Leadership Council,2,0
448565360292548609,2014-03-25 21:01:30,Best wishes to @HowesConnie as she celebrates a 30+ year career as President and CEO of @womenandinfants Hospital,3,1
448557484115238913,2014-03-25 20:30:12,Wish I could be at the RI State House today for the 193rd Greek Independence Day! Enjoy the celebrations! @rigov @LouRaptakis @LincolnChafee,0,1
448520079630958592,2014-03-25 18:01:34,Today is Arts Advocacy Day. Thanks to @RISCA1967 @rihumanities and all the wonderful arts education groups in RI for your leadership! #AAD14,6,0
448507251834519552,2014-03-25 17:10:36,Today is @AmDiabetesAssn's Alert Day. Take the Diabetes risk test and join the fight to stop #diabetes http://t.co/0FB99uU1F9,2,1
448507047214989312,2014-03-25 17:09:47,"It's a delicate balance to protect privacy &amp; prioritize nat'l security, and I believe this bill strikes that balance http://t.co/gO4dBDW6ZF",3,1
448506935315542017,2014-03-25 17:09:20,I was proud to join @RepMikeRogers and @Call_Me_Dutch earlier today in co-sponsoring the FISA Transparency and Modernization Act,4,0
448470087461535744,2014-03-25 14:42:55,.@JacobSNBrier @MojoTech Thank you for meeting with my team and for your commitment to doing business in #RI. #smallbiz,2,5
448462360060379136,2014-03-25 14:12:13,RT @OfficialNAHC: @jimlangevin: “Val halamandaris is a great leader &amp; truly enjoy working w/ him &amp; the work all of you do.”  http://t.co/fk…,1,0
448225328138584065,2014-03-24 22:30:20,ICYMI: RI is getting $7M to improve emergency preparedness @SenJackReed @SenWhitehouse @davidcicilline (via @projo) http://t.co/5LIZ4tphhY,4,1
448208930444148736,2014-03-24 21:25:11,Best of luck to @AS220 at your event at @trinityrep tonight. Thanks for all you do to rebuild the community and to provide arts education,3,4
448195093414313984,2014-03-24 20:30:11,Thanks again to @RICNews @RicDems for hosting me and @davidcicilline @CollegeDemsRI (via @TheAnchor_RIC) http://t.co/wepujSt1I3,2,1
448176198464856064,2014-03-24 19:15:07,There's still time for RI students to sign up for the STEM Competition! @deborahgist @dmiller212001 #edchatri http://t.co/WJpDzugeLv,4,1
