id,created_at,text,retweets,favorites
517768270502703104,2014-10-02 20:09:10,"ICYMI @First_Focus recognized my leadership on child health, wellness &amp; safety issues #ChampionForChildren http://t.co/BdheKIHTw4",5,4
517756485301186560,2014-10-02 19:22:20,They are perfecting their craft @WhalersBrewing. The brewing industry is crucial to the food economy. #RIFoodWeek http://t.co/5hLrOu4NZT,4,2
517754122939166722,2014-10-02 19:12:56,"After meeting one of the founders, Andy, at an RI Brewers Guild mtg, it's great to get to @whalersbrewing #RIFoodWeek http://t.co/S20KwepDb5",3,1
517733848235659266,2014-10-02 17:52:23,Thanks so much to the Pelloni family for having me at their farm and farm stand! @thewesterlysun #RIFoodWeek http://t.co/SPYKu1hL0Z,1,0
517727976696594432,2014-10-02 17:29:03,Join @LGBTM @GSANetwork @glaad @GLSEN in recognizing #LGBT History Month. We must never stop fighting for equal rights!,2,0
517717636122411008,2014-10-02 16:47:57,Delicious homemade jams at Pelloni Farm #RIFoodWeek http://t.co/oDeEvnyEdv,0,1
517697751963160577,2014-10-02 15:28:57,October is #EatBetterEatTogether Month. Take a cue from @TeamNutrition &amp; sit down for a nutritious meal with your #family. @eatright,1,1
517486331954724864,2014-10-02 01:28:50,Showing support for Breast Cancer Awareness Month. #WhatGivesMeStrength is courageous women fighting this disease http://t.co/5CAVaNdiZY,4,1
517434087666368512,2014-10-01 22:01:14,Do you know about the great work Southside Community Land Trust is doing to increase access to healthy food? http://t.co/DMTaTq35BX,2,1
517433908993200128,2014-10-01 22:00:32,Best wishes to Southside Community Land Trust at tonight's Harvesting Hope fundraiser!,1,0
517399569660116992,2014-10-01 19:44:04,ICYMI RI's delegation helped secure $3.9M for lead hazard mitigation http://t.co/KCEV0sjWrJ,0,0
517377689884561408,2014-10-01 18:17:08,I'm honored to be named a #ChampionForChildren by @First_Focus. I will keep fighting for our kids! http://t.co/iHxDeHskRK,5,6
517343737660596224,2014-10-01 16:02:13,October is #DomesticViolence Awareness Month. Learn more and access resources @ndvh @NCADV http://t.co/IXH4JKFwHm,9,4
517321288835411968,2014-10-01 14:33:01,Congratulations @TechACCESSRI on the ribbon cutting today for your newly modified and accessible lab!,3,3
517313374838063104,2014-10-01 14:01:34,"In the 10 years that @gloriagemma has been around, they have done so much for #breastcancer patients and survivors. Thank you. #FlamesOfHope",3,6
517072414740475904,2014-09-30 22:04:05,"My #RIFoodWeek follow-up blog posts are being posted this week, starting with the #EGFarmersMarket and @patspastured http://t.co/lkPkq3J5yw",1,0
517057610693242882,2014-09-30 21:05:15,Nice @rhodybeat look back at the @CCRINews time capsule. Can't wait to see what the next 50 brings! http://t.co/Qgn7FNRejn,2,2
517041990283055104,2014-09-30 20:03:11,Thanks again @KennedyPlazaPVD for showing me around last week! @rollcall @WARojas http://t.co/UQPBMiQL9N,0,1
517030427178307584,2014-09-30 19:17:14,ICYMI I was on @AlexWitt @msnbc to talk ISIL and nat'l security http://t.co/8qGx6E5Bcn,0,0
517019379037663232,2014-09-30 18:33:20,This $200K federal grant to @Official_RIPIN will help connect parents to community resources (via @rhodybeat) http://t.co/LDKgFcwcf0,1,1
516998157142872067,2014-09-30 17:09:00,Check out photos of my August and September events and business visits on my @Flickr page http://t.co/ccEsMv4qvR,1,0
516981965774680064,2014-09-30 16:04:40,Thank you @risd for your leadership in supporting advanced manufacturing in RI (via @projo) http://t.co/PbrdwX9iGy,2,1
516704488049352704,2014-09-29 21:42:04,"Interested in a career in #cybersecurity, or honing your cyber skills? I'm thrilled to hear that @CyberAces program is now open to anyone",3,1
516682831767281665,2014-09-29 20:16:01,Today is #WorldHeartDay. Visit the @worldheartfed website for tips on  heart-healthy choices for you &amp; your family http://t.co/bwj9Z8tKQq,2,0
516670499787919360,2014-09-29 19:27:01,"Congrats @FarmFreshRI on your $22K grant award from @USDA, and thanks for helping RI's food economy to grow!",2,3
516637596798451712,2014-09-29 17:16:16,Good luck to the RI Police Chiefs Association at today's scholarship charity golf classic! @RIStatePolice,0,2
516612626345103361,2014-09-29 15:37:02,"ICYMI yesterday was #GoldStarMothersDay. To all the Gold Star moms, thank you. http://t.co/DzObrS4A3y",1,0
516593729860562944,2014-09-29 14:21:57,Workforce development is key to closing the #skillsgap &amp; putting people to work. This $2.5M grant will help do that http://t.co/rx7hxOnkjj,2,0
516264572190478337,2014-09-28 16:34:00,Tune in to @msnbc @AlexWitt now,0,1
516260943001841664,2014-09-28 16:19:35,I'll be on @msnbc around 12:30 pm to talk to @AlexWitt about ISIL and national security,1,2
516216610504589312,2014-09-28 13:23:25,".@Wickfordart Assoc. has enriched RI, showcasing great local artists. Thanks for having me at your gala last night http://t.co/qXVU4UkeMw",3,2
516081532109611008,2014-09-28 04:26:40,RT @dadekian: Follow Congressman @jimlangevin 's Second Food Week http://t.co/juvhzqSHxr #RIFoodWeek #EatDrinkRI #CulinaryValley #RhodeIsla…,3,0
515945231645409281,2014-09-27 19:25:03,Thanks @ButtonHole_Golf for including me in today's Full Swing event. Your programming for kids is so important http://t.co/jBVH6MSnPp,1,1
515896575055638530,2014-09-27 16:11:43,"Feels like summer at the #Scituate Farmers Market! Some great finds today, including RI-made maple syrup #RIFoodWeek http://t.co/RN7QQLapdY",0,1
515875664814424064,2014-09-27 14:48:37,The town really did a great job on the new complex. #GoPanthers #JHS #Johnston http://t.co/z6E9eWWEvy,3,2
515875260449947649,2014-09-27 14:47:01,The crowd is unbelievable. So much community spirit and pride on display. #Johnston #JHS #GoPanthers http://t.co/MZHN82kMnd,3,1
515874528632000512,2014-09-27 14:44:06,It's a beautiful morning in Johnston for the official opening of the new #JHS town athletic complex! http://t.co/gVroSkR1hC,2,2
515844847375486976,2014-09-27 12:46:10,@chrislb104 my pleasure - thanks for saying hello,0,1
515657566870073344,2014-09-27 00:21:59,Congrats to @judgewesmith and all of the honorees at tonight's RI Association for Justice event at @ProvGpub! http://t.co/BOACuBzIFm,9,5
515652236421386240,2014-09-27 00:00:48,Best wishes to @fosterforward at tonight's gala event! Foster youth in RI are fortunate to have you in their corner,4,5
515642672481316864,2014-09-26 23:22:47,Thank you President @BarackObama @WhiteHouse for extending DED for #Liberians and keeping them safe in our country,0,1
515637773647482880,2014-09-26 23:03:19,"I hope your 4th annual ""Big Toast"" is a success, @BBBSOS!",1,1
515614939093147648,2014-09-26 21:32:35,Congratulations @AlFornoPVD on being named one of the best pizza places in America by @Thrillist! #RIFoodWeek http://t.co/NZQQbaF86P,3,2
515593300498456576,2014-09-26 20:06:36,Good luck @BlockChamber at 6th annual Taste of Block Island! There are so many great restaurants on the island @BITimes @Blockislandinfo,1,4
515564256222531584,2014-09-26 18:11:12,"David, the owner of Mulberry, has a great long-term vision for his business, with plans to plant more #RIFoodWeek http://t.co/aPSanSmKpr",0,1
515561104119185409,2014-09-26 17:58:40,Business has been good in the first year for Mulberry Vineyard in Chepachet #RIFoodWeek http://t.co/cv0X9q0bnY,0,3
515554848394473472,2014-09-26 17:33:49,"@Kadamo @ProvidenceRI thank you, Kristen!",0,1
515554455111368705,2014-09-26 17:32:15,"Thank you so much to Steve &amp; Sheri for showing me around their business, Nickle Creek Vineyard @dadekian #RIFoodWeek http://t.co/1bin6Vg9Y2",0,2
515543807468011520,2014-09-26 16:49:56,There's a waiting list for some of these Nickle Creek Vineyard wines #RIFoodWeek @dadekian http://t.co/qSDg8Szkgo,2,1
515535478830161920,2014-09-26 16:16:51,"There are some wonderful farm vineyards in RI, including Nickle Creek here in Foster @dadekian #RIFoodWeek http://t.co/Bgcs6EiSiv",2,1
515527518439612416,2014-09-26 15:45:13,"Today's shopping list included cider, hummus, tomatoes &amp; jam from some of RI's tremendous food businesses #RIFoodWeek http://t.co/MaH6Zp3qEa",2,5
515527039659827200,2014-09-26 15:43:18,"Goddard Market has real variety of small business owners, including @JacksSnacks @LuckyfootKitche &amp; more #RIFoodWeek http://t.co/l7pGja7OgQ",2,2
515509248491798528,2014-09-26 14:32:37,Big crowd at Goddard this morning. Rhode Islanders really understand the importance of buying local #RIFoodWeek http://t.co/WYxn5K7isj,4,1
515502725438930944,2014-09-26 14:06:41,"Another day, another farmers market on our #RIFoodWeek tour follow-up. The sun is out for the #GoddardPark market",1,0
515497323582210048,2014-09-26 13:45:14,"Thank you so much to @AAUW for my 100% voting record on policies that are important to women. #WhenWomenSucceed, America succeeds",1,0
515289314771869697,2014-09-25 23:58:40,"@FarmFreshRI thank you for all your hard work! It's paying off for Rhode Island farms, businesses and residents",2,4
515268758047584256,2014-09-25 22:36:59,"One of the priorities of @FarmFreshRI is increasing access to healthy, local foods, especially for kids &amp; in low-income areas #RIFoodWeek",7,4
515268428031340544,2014-09-25 22:35:41,"Another collaboration story is how @JWUProvidence has teamed up with @FarmFreshRI'sHealthy Foods, Healthy Families program #RIFoodWeek",1,5
515267734419296256,2014-09-25 22:32:55,Very cool how @HumblePiePVD uses many local ingredients in their pies #RIFoodWeek @FarmFreshRI http://t.co/8JywhU39PM,4,4
515263975639244800,2014-09-25 22:17:59,Sampling the apple pie smoothie at @TheGreenJars at the Armory Park farmers market @FarmFreshRI #RIFoodWeek http://t.co/HoR7UaWsa6,2,3
515260746805301248,2014-09-25 22:05:09,Thanks @dadekian of eat drink RI for highlighting #RIFoodWeek and for all you do to support our food economy http://t.co/14FbLTgWPd,0,0
515238350811582465,2014-09-25 20:36:10,Great to see so many cities and so many people celebrating @NatDriveElecWk (via @HuffingtonPost) http://t.co/4stbw6ZgG4,2,0
515220262418391040,2014-09-25 19:24:17,RT @WhipHoyer: 6 yrs ago the ADA Amendments Act was signed into law to ensure #equality for those w/ disabilities #ThrowbackThursday http:/…,42,0
515217680039936000,2014-09-25 19:14:01,"Check out the SOS @RalphMollis website for helpful election info, including details on all the ballot questions http://t.co/t4DFsLMZcp",0,0
515199834585055232,2014-09-25 18:03:07,Excited for this $1.57M grant to better prepare defense manufacturers for future demands http://t.co/4hY0KtEcKa,1,1
515175187114102784,2014-09-25 16:25:10,ICYMI my colleagues @SenJackReed @SenWhitehouse @davidcicilline and I announced $161K for study on paid family leave http://t.co/hRDjVZxlcO,3,4
514901930997743617,2014-09-24 22:19:21,"If RI is to compete on a global level, it is crucial that we foster strong relationships with international partners http://t.co/WrphMz1s9i",2,1
514897907129266176,2014-09-24 22:03:22,Best wishes to @AmosHouse at your Shake It Up celebration event @Aquaprovidence,1,2
514837583244062720,2014-09-24 18:03:39,"To all those preparing to celebrate, Shana Tova. I wish you a sweet year ahead.",0,0
514831687344455680,2014-09-24 17:40:14,"Ireland is a country known for its beauty, and I hope our own coastal vistas make a lasting impression on @EndaKennyTD and his delegation",1,0
514831400370208768,2014-09-24 17:39:05,"Honored to have @EndaKennyTD, Prime Minister of Ireland, here in Rhode Island. Fáilte roimh! @DiscoverIreland http://t.co/smUEUMPGwA",1,1
514823773561040896,2014-09-24 17:08:47,Wrapping up our @KennedyPlazaPVD visit with @MamaKimsKbbq &amp; tater tots at @NobleKnots #RIFoodWeek http://t.co/9aqtQFNOtZ,5,4
514823276364058625,2014-09-24 17:06:48,".@rockettruck recommends the Parisienne burger, so that's what I'm going with @KennedyPlazaPVD #RIFoodWeek http://t.co/mcjNbnhobX",3,5
514815275242651648,2014-09-24 16:35:01,Anxiously awaiting my spicy Brava fries from @PORTU_GALO #RIFoodWeek @KennedyPlazaPVD http://t.co/lVo5tUf1FG,8,8
514812544251613184,2014-09-24 16:24:09,Great crowd at @KennedyPlazaPVD food truck park. Going down the line starting with @pocolocotacos &amp; @oohmommifoods http://t.co/f9MLGm2pR5,1,4
514810476291977216,2014-09-24 16:15:56,Brought my appetite to @KennedyPlazaPVD to check out some of the great food trucks parked here for lunch on weekdays #RIFoodWeek,4,6
514801133857296384,2014-09-24 15:38:49,Best wishes to @USDA and your partners participating in today's #RenewableEnergy meeting on Block Island @BITimes,3,2
514753317239783424,2014-09-24 12:28:49,I had a wonderful time last night at the @WaterFireProv event with Barnaby Evans &amp; board chair Betsy Myers http://t.co/FHUOGzzBdS,3,1
514502637216333825,2014-09-23 19:52:42,I'm for climate action. I'm for health and security. Are you? #climate2014,1,2
514502443565318144,2014-09-23 19:51:56,"Today begins the #UNClimateSummit. Climate change is a challenge, but also an opportunity, and I am for #ClimateAction @climasphere @UN",6,2
514475324642717696,2014-09-23 18:04:10,"Sorry I missed the @alexandani @carolyn ribbon cutting at the new Alex &amp; Ani Hall at my alma mater, @RICNews",1,2
514459780556263424,2014-09-23 17:02:24,Thanks @JoshKlemp for bringing your @SkillsUSARI leaders to DC - my staff is excited to host them and talk about education &amp; democracy,5,1
514445778891571200,2014-09-23 16:06:46,Beautiful piece of land here at @patspastured #RIFoodWeek http://t.co/golh1Pd8nZ,3,0
514437701538701312,2014-09-23 15:34:40,It's an impressive operation here at @patspastured #RIFoodWeek http://t.co/6tZsgwc4Qn,1,2
514435663987752960,2014-09-23 15:26:34,Pat McNiff of @patspastured is so knowledgable of the issues facing local farmers. He's a real advocate #RIFoodWeek http://t.co/X95qScLemW,3,1
514431826845532160,2014-09-23 15:11:19,"I've heard great things about @patspastured, and seen products at farmers markets. I'm really looking forward to today's visit! #RIFoodWeek",1,0
514158956688973824,2014-09-22 21:07:02,Best wishes to @RINPR at tonight's gala event to celebrate excellence in community leadership @trinityrep,2,1
514142628905238528,2014-09-22 20:02:09,"Also on a food-related note, it's Nat'l Farm Health and Safety week. Thank a Rhode Island farmer! #RIFoodWeek @RhodeIslandDEM",2,1
514142578355474432,2014-09-22 20:01:57,"There are more than 1,000 farms in RI &amp; great ones at the #EastGreenwich #FarmersMarket. @RhodeIslandDEM #RIFoodWeek http://t.co/qNlj9J0bKl",1,2
514135177606737921,2014-09-22 19:32:33,"Agriculture is a crucial piece of the RI food economy. This #RIFoodWeek, I'll be meeting with many farmers to talk about industry issues",1,0
514134009774096384,2014-09-22 19:27:54,"In February, I kicked off my #RIFoodWeek initiative. This week, we continue that mission to support RI's food economy http://t.co/Mi8cmQMI1G",0,0
514069125044641792,2014-09-22 15:10:05,It's great to have Jane Hayward of the @RIHCA_CHCs in my office today to discuss health care in Rhode Island. Thanks for your leadership!,1,0
514053813251366912,2014-09-22 14:09:14,.@cleanwater_ri does an exceptional job advocating for conservation &amp; clean water. Glad to see them sharing that expertise w/ @RIFoundation,2,3
513846395665911808,2014-09-22 00:25:02,"Big congrats to the #WestSide @LittleLeague Majors championship team, Langevin's Reps! I'm so proud of you! http://t.co/FCzcqqDYCq",3,5
513418778424909824,2014-09-20 20:05:50,".@JWUProvidence students volunteering here at @StandDownRI weekend, too! @MayorDanMcKee #veterans http://t.co/UvOXBBfXf9",6,12
513418417433755649,2014-09-20 20:04:24,Great to see these @RICNews Nursing students volunteering their time to support our #veterans @MayorDanMcKee http://t.co/h5lIxTIylM,1,2
513414475127721984,2014-09-20 19:48:44,"Proud to be with @MayorDanMcKee at #StandDown weekend, supporting our #veterans @StandDownRI http://t.co/OJDBcgVEUR",5,4
513414044850860032,2014-09-20 19:47:01,"We are so fortunate to have @StandDownRI in our state, advocating for and supporting #veterans.  #StandDown weekend http://t.co/c6WH5W4DOX",1,0
513377188251697152,2014-09-20 17:20:34,"Thanks @RICleanCities for coordinating today's @NatDriveElecWk event to promote cleaner, efficient transit #NDEW2014 http://t.co/gAHg1VI4ST",1,6
513331681672298497,2014-09-20 14:19:44,It's a beautiful day for the annual Apple Festival in Johnston! Bring your family to Memorial Park this weekend,2,2
513078897517559808,2014-09-19 21:35:16,Congrats to all of the award winners at tonight's @ProgresoLatino's 37th anniversary gala!,2,1
513040114512314368,2014-09-19 19:01:09,I introduced the Transportation Accessibility Innovation Act because public transit is crucial to strong communities http://t.co/j4LTHM787K,1,2
513017211876036608,2014-09-19 17:30:09,"Today, on POW-MIA Recognition Day, take a moment to remember, thank and pray for #veterans and servicemembers http://t.co/WEmLXqVrcH",4,0
512995804605612034,2014-09-19 16:05:05,.@StandDownRI Stand Down Weekend starts today! Please tell all #veterans you know &amp; help them connect w/ resources http://t.co/8mjTZ8V5a6,1,0
512983270972469248,2014-09-19 15:15:17,Thanks @HerffJonesRI @HerffJonesInc &amp; @Lifetouch for meeting with my staff today to discuss retirement security &amp; other issues,3,0
512977845413761024,2014-09-19 14:53:43,"Congrats Rear Admiral David Duryea on a distinguished career, and good luck to incoming Rear Admiral Michael Jabaley @USNavy @NUWCNewport",0,0
512738167942676480,2014-09-18 23:01:20,"Our state is well represented by these smart, driven individuals. You will do great things in DC! #RhodeIsland http://t.co/pVapwTMapv",0,4
512737969610817536,2014-09-18 23:00:32,"Nice to have so many RI students here in Washington, ready for another great school year in DC-area colleges! http://t.co/QX13Pd8OKb",4,4
512723880616554497,2014-09-18 22:04:33,"Happy 10th Anniversary, @FirstWorksRI! Best of luck at your gala event tonight and a weekend full of celebrations",1,1
512694560690958337,2014-09-18 20:08:03,I think @SECNAV Ray Mabus is absolutely correct: cooperation is key to a more stable global economy (via @projo)  http://t.co/rGSHDgMWH3,1,0
512685267275104256,2014-09-18 19:31:07,.@HIMSS and @LifespanCareers are in my office today to discuss #healthIT and better #globalhealth @HITNewsTweet,0,1
512671025101025280,2014-09-18 18:34:32,Always glad to meet w/ @DonnaPrnp of @RIStateNurses @ANANursingWorld &amp; @LopesLeonard! We’re fortunate to have wonderful care providers in RI,1,0
512647896622448640,2014-09-18 17:02:37,Glad to have @AmerMedicalAssn &amp; @AMPAConline in my office to discuss electronic medical records and other health care issues with my staff,1,0
512646053808443392,2014-09-18 16:55:18,Cranston and Warwick are on the list of 50 top cities! Well deserved honor and good news for RI! (via @ProvBusNews) http://t.co/UKKjm4wn3g,1,0
512634119965405184,2014-09-18 16:07:53,I joined my @SEEC colleagues in support of climate action! #climate2014 @CWNYC @peoplesclimate @climasphere @UN http://t.co/Ob5iIiQxZf,2,0
512614098522365952,2014-09-18 14:48:19,We must #DemandAVote to pass #ENDA and stop workplace discrimination against #LGBT Americans http://t.co/v4l8LfFnWB,3,2
512438420061581312,2014-09-18 03:10:14,Big congrats to Rhode Island's @MatFrancoMagic who won @nbcagt #AmericasGotTalent! I wish you much success in the future! #AGTFinale,5,6
512361363063050240,2014-09-17 22:04:02,Best of luck to my friends at the @Wickfordart Association with tonight's UP CLOSE gala!,0,0
512347024553816064,2014-09-17 21:07:04,"ICYMI I spoke on the floor last night to address the threat that ISIL poses to our country.
http://t.co/V77gtIlOTd",0,0
512338514357542912,2014-09-17 20:33:15,Kudos to my colleague @SenJackReed for hosting #RIBusinessLeaders Day and fostering discussion on economy and workforce development,4,3
512316919987601410,2014-09-17 19:07:26,"On Fall Advocacy Day, it's great to have @novonordisk @novonordiskus in my office to talk about defeating diabetes &amp; chronic conditions",0,2
512302792317624320,2014-09-17 18:11:18,Wonderful @gailciampa @projo story on exciting development at @HopeandMain. What a tremendous group of entrepreneurs! http://t.co/iCoXAZmos3,4,2
512289399292567552,2014-09-17 17:18:05,22 American veterans die daily from suicide. Call #VeteransCrisisLine this #SuicidePrevention month &amp; save a life 1800-273-8255 #ThePowerOf1,6,1
512270565080838144,2014-09-17 16:03:14,Wish I could be in RI for the Nat'l Land Conservation Conference rally. Thanks @nature_org @NRCS_RI &amp; Sakonnet Preservation for leadership,2,2
512255449010540545,2014-09-17 15:03:10,"On #ConstitutionDay, we also celebrate #CitizenshipDay. Congrats to all of the RIers celebrating naturalization http://t.co/jICOtgzf97",2,2
512255238351634433,2014-09-17 15:02:20,"On this day in 1787, 39 brave Americans signed #USConstitution. Today, we celebrate what it means to be an American! http://t.co/ERv9c2KWuB",2,0
512241529357074432,2014-09-17 14:07:52,Congrats to the National Youth of the Year finalists at this morning's @BGCA_Clubs Congressional breakfast,0,0
511983213175394304,2014-09-16 21:01:24,RT @SPI_4_Plastics: @jimlangevin visiting @YushinAmerica last month after meeting at @SPI_4_Plastics Fly-In - http://t.co/CaJYrqfWDf http:/…,2,0
511976841817903104,2014-09-16 20:36:05,"ICYMI, the Hillsdale property in @Richmond_RI was bequeathed to @RhodeIslandDEM by the generous Mr. deCoppet http://t.co/tHfM75EbBD",0,0
511939853848940545,2014-09-16 18:09:07,Thanks to Ronald Lizotte of the @AmericanCancer Society's @ACSCAN for your advocacy on patient quality of life legislation,0,0
511931152714973185,2014-09-16 17:34:32,.@HowesConnie is a leader in health care. Glad to have her in DC to discuss better care for women &amp; kids @carenewengland,0,0
511878572219568128,2014-09-16 14:05:36,Congratulations to new RI farm brewery @TiltedBarnBrew! Such great things happening in our food and beverage industries,4,3
511877071828946944,2014-09-16 13:59:38,RT @RIStateSociety: RI'er attending college in DC?! RI Students Reception w/@jimlangevin @davidcicilline 9/18 5-7pm CHOB 121. Students only…,5,0
511652694826573824,2014-09-15 23:08:03,Just a few more days before our Rhode Island student reception in DC! http://t.co/5nG9egP2LK,2,1
511629036590612480,2014-09-15 21:34:02,September is #HungerActionMonth. Visit the @nokidhungry website for tips on keeping our kids healthy #NoKidHungry http://t.co/KKucQoJgNQ,15,10
511592406987583488,2014-09-15 19:08:29,Did you know September is #HispanicHeritageMonth? Educate yourself about Hispanic heritage &amp; celebrate its cultures! http://t.co/r1fO02l2yW,2,0
511564407550517249,2014-09-15 17:17:13,"Best wishes to @CCRINews at today's Fall Classic, this year celebrating the school's 50th anniversary!",3,2
511554670226341888,2014-09-15 16:38:32,Yes! Congrats @MatFrancoMagic on making it so far and impressing America with your talent! Good luck tomorrow on the #AGTFinale @DrMicrobe,5,3
511282104018432000,2014-09-14 22:35:27,"Best of luck to Miss Rhode Island Ivy DePew, as she competes for the #MissAmerica title. We're all rooting for you back home @MissAmericaOrg",10,11
511142944536293376,2014-09-14 13:22:29,Congratulations @PawSox on bringing the Cup home to Rhode Island!,12,14
510881394344865792,2014-09-13 20:03:10,Good food and great company at St. George Church’s #Lebanese Festival http://t.co/aJ6t6sYjqj,1,1
510872362573918208,2014-09-13 19:27:17,This year's Rally4Recovery coincides with the 25th anniversary of National Recovery Month @RIBHDDH http://t.co/en6zLHJYxA,1,1
510869295761719296,2014-09-13 19:15:06,I'm glad the rain held off for the Rally4Recovery. So many strong Rhode Islanders sharing their stories @RIBHDDH http://t.co/aRDD5JjXDn,2,1
510510837933817857,2014-09-12 19:30:43,"Great event! MT @LarryValencia13: celebrating de Coppet estate transfer to DEM @LincolnChafee, @SenJackReed, @SenWhitehouse @Richmond_RI",1,0
510496832943063040,2014-09-12 18:35:04,My colleague @davidcicilline is exactly right - our state is fortunate to have a leader like @NeilDSteinberg of @RIFoundation #RIAHH #RIHH,1,4
510496075955064833,2014-09-12 18:32:03,RT @hwri: @jimlangevin Over 85 #RIAHH working together using data for a fact driven way to make changes that benefit our state #RIAHH,2,0
510495435283496960,2014-09-12 18:29:30,It is so impressive to see how @RIHealthyHomes has engaged dozens of community partners for this important initiative http://t.co/rnyGPuQWFm,1,0
510493751039766529,2014-09-12 18:22:49,It's great to see so much collaboration on an important issue like healthy and green housing @RIHealthyHomes http://t.co/JNQsrFpkXg,2,0
510493339058462720,2014-09-12 18:21:11,"The efforts of @RIHealthyHomes &amp; it's partners are keeping kids safe &amp; healthy, resulting in lower health care costs and better ed outcomes",1,1
510491307564097536,2014-09-12 18:13:06,Excited to be at RI State House to support @RIHealthyHomes w/ @SenWhitehouse @davidcicilline @AGKilmartin @NeilDSteinberg #RIHealthyHomes,3,0
510444089566068736,2014-09-12 15:05:29,We all have a responsibility to preserve our natural resources in RI. @SenJackReed @SenWhitehouse @LincolnChafee http://t.co/mSs435psW6,6,1
510442107765796864,2014-09-12 14:57:36,My colleagues @SenJackReed and @SenWhitehouse &amp; I are so grateful for the conservation leadership provided by @RhodeIslandDEM. @Richmond_RI,3,2
510440521484226561,2014-09-12 14:51:18,.@Richmond_RI Administrator Rob Rock shares the town history of generous residents like Mr. deCoppet @RhodeIslandDEM http://t.co/fXkDSzzwe8,0,0
