id,created_at,text,retweets,favorites
568074333047934976,2015-02-18 15:47:29,RT @RepLujanGrisham: .@HouseGOP should drop their anti-immigrant efforts &amp; join with Dems to fund @DHSgov. #DontShutDownOurSecurity http://…,82,0
567805952704147459,2015-02-17 22:01:03,Great to have the opportunity to see @SenWhitehouse again tonight for one of his community dinners at @CoventryOakers! Join us at 6!,0,0
567787575877050368,2015-02-17 20:48:01,"Congrats @csmonitor on @CSMPasscode launch! I'm honored to be named an ""Influencer"" &amp; I look forward to continued #cybersecurity coverage",5,2
567764827293368320,2015-02-17 19:17:38,"On this day in 1929, @LULAC was founded. Thank you for your continued advocacy on behalf of the Hispanic community",2,1
567744736191336448,2015-02-17 17:57:47,"Speaking of tax filing programs, @CranstonSenior Center can help area seniors file, as well! Check your local senior center for information",1,0
567735669314031618,2015-02-17 17:21:46,"Thrilled that @NellieGorbea could join me today, too! Our seniors have so much insight - I love catching up w/ them http://t.co/ZqFP7uMyiS",0,1
567735370658639872,2015-02-17 17:20:35,Always so great to be at the @CranstonSenior Center with @SueStenhouse. This is an incredible community resource! http://t.co/mJ2uAuc6Rg,3,1
567725134912708608,2015-02-17 16:39:54,"If you need more information on #FreeFile programs, follow @TaxPrepHelp, visit the @IRSnews site or check out @ccianet",0,0
567723745926991872,2015-02-17 16:34:23,"Meg Chevalier of @IRSnews shares a valuable piece of information, that seniors raising grandchildren may be eligible for the #EITC",0,0
567722956215058432,2015-02-17 16:31:15,"If you e-file your taxes, direct deposit is available, putting money into the pockets of RI families faster @ccianet @IRSnews @Intuit",1,0
567721578562326528,2015-02-17 16:25:46,"#EITC &amp; free file programs help so many families, &amp; that money goes back into our local economy @ccianet @IRSnews @Intuit @OlneyvilleHC",1,1
567720798711185409,2015-02-17 16:22:40,"There are many wonderful community groups represented today, &amp; they will bring this info back to RIers @SenWhitehouse http://t.co/yuvFqBT80L",2,0
567720112451751936,2015-02-17 16:19:57,"RT @EconProgressRI: @jimlangevin #EITC average refund $2100, helps #workingfamilies pay for basic necessities http://t.co/XEdzSZlwit",1,0
567719018178805760,2015-02-17 16:15:36,This is a great example of a public private partnership &amp; how we can work together to help working families @ccianet http://t.co/NhKr8b0MUH,1,3
567718168962273280,2015-02-17 16:12:13,Too many RIers are unaware of the tax preparation/filing programs available to them @ccianet @Intuit @OlneyvilleHC http://t.co/eIViehIUO6,2,0
567717485823393793,2015-02-17 16:09:30,So glad @SenWhitehouse &amp; @SethMagaziner could join us for this wonderful event with @ccianet @Intuit @OlneyvilleHC,1,1
567708877861699584,2015-02-17 15:35:18,The snow can't stop us! We will be at 31 Salmon Street in Providence at 11 a.m. for our Free File Tax Event! @ccianet @Intuit @OlneyvilleHC,4,1
567396925671223296,2015-02-16 18:55:43,"""There is nothing wrong in America that can't be fixed with what is right in America."" - @billclinton #PresidentsDay",3,0
567360810851508225,2015-02-16 16:32:13,"On #PresidentsDay, we honor the contributions of great leaders and pray for courage and wisdom in public office today and in the future",1,2
567327710712967169,2015-02-16 14:20:41,I am disgusted and saddened by the vandalism of the Islamic School of RI and hope the perpetrators are quickly caught &amp; brought to justice,23,19
567006189134028800,2015-02-15 17:03:04,@TedNesi Check out our Free File Tax event and demonstration at 11 am on Tuesday with @ccianet @OlneyvilleHC!,3,1
566680393320251392,2015-02-14 19:28:28,What an incredible display of culture at @BryantUniv http://t.co/RhpPjBR4uV,0,5
566678833303416833,2015-02-14 19:22:16,Great to be with my friends at @BryantUniv for the US-China Institute's Chinese New Year celebration! http://t.co/fFb4AomW3R,2,4
566666030941229057,2015-02-14 18:31:24,RT @TaxPrepHelp: Live in Rhode Island? Join @jimlangevin and @SenWhitehouse this Tuesday in Providence to learn more about #FreeFile! http:…,3,0
566372285192601600,2015-02-13 23:04:10,.@avilatomas you do so much to celebrate diversity and promote equality in our community! Best wishes at tonight's #BlackHistoryMonth event,4,1
566354376512770048,2015-02-13 21:53:00,Have you visited my blog lately? New posts include @thehiveri @HexMet @FLLRI and more! http://t.co/KeddWtTzfp,0,0
566343830463864833,2015-02-13 21:11:05,ICYMI I spoke on the House floor yesterday in support of Career and Technical Education Month #CTE http://t.co/4Een1WHX88,2,1
566335755229089792,2015-02-13 20:39:00,The @EPA @EPAnewengland is hosting a community call update on the #CleanPowerPlan on February 26th http://t.co/Yid3YFL5q3,0,0
566316136497954816,2015-02-13 19:21:03,The updated @projo site looks great! Congrats @KarenBordeleau1 @TMurphyRI http://t.co/BuCA0w0Jiy,0,0
566297512315998208,2015-02-13 18:07:02,"With only 2 weeks left until a @DHSgov shutdown, we must pass a clean funding bill #DontShutDownOurSecurity http://t.co/befwhLbsJt",2,2
566290392992473088,2015-02-13 17:38:45,"Even though the @Patriots won, I still hope we can share some RI lobster someday, @RepRickLarsen!",1,1
566290364064358401,2015-02-13 17:38:38,Victory is sweet. Thanks @RepRickLarsen for this Coho salmon to settle our @Patriots - @Seahawks @SuperBowl wager! http://t.co/kG2XkRuyjI,3,12
565980668375887872,2015-02-12 21:08:01,"Congress must be part of the decision on a new #AUMF and I look forward to a thorough, bipartisan debate http://t.co/Y5ktCZatNj",0,0
565970725224591360,2015-02-12 20:28:30,Thanks @JennWFRI! I hope everything is going well at @WomensFundRI,0,1
565950021066309633,2015-02-12 19:06:14,I spoke on the House floor to support a clean @DHSgov funding bill. We can avoid another manufactured crisis http://t.co/S3QmRxbFaK,0,0
565935903349432320,2015-02-12 18:10:08,Glad to have @NHPHealth in my office today to discuss improving health care and increasing access to affordable options,0,2
565929676359864321,2015-02-12 17:45:23,"This #CTE Month, let's find new ways to support career and workforce development for young people @CongressmanGT https://t.co/AA7QkPYwo1",1,1
565929554435645441,2015-02-12 17:44:54,I have a strong #CTE partner on the other side of the aisle in @CongressmanGT. We spoke on the House floor to support career &amp; tech ed,3,2
565913062096797696,2015-02-12 16:39:22,I'm proud to be an original cosponsor of #HuntingtonsDisease Parity Act to provide crucial medical access to those impacted by #HDSA #HR842,6,2
565899304985198592,2015-02-12 15:44:42,"On this day 100+ yrs ago, @NAACP was established. Thanks for your leadership, and let's continue to fight for equality @NAACPprovidence",0,1
565628595851513858,2015-02-11 21:49:00,"Votes are pouring in for my @Facebook Cover Photo contest! ""Like"" your favorite before 5 p.m. next Friday http://t.co/b8ACsLCVhf",1,0
565594142747922432,2015-02-11 19:32:06,Kudos to @RIFoundation for bringing in Dr. Susan Hasmiller of @RWJF @RWJF_Live. Their vision for transforming health care is innovative,1,3
565559893294608384,2015-02-11 17:16:00,"On this day 25 yrs ago, #NelsonMandela was freed from prison. Today we remember his legacy as a man who would do anything to fight injustice",3,0
565549384642088960,2015-02-11 16:34:15,Best wishes to @Provchamber @LW_ProvChamber at today's Legislative Luncheon. Thank you for being such tremendous advocates for RI business,0,0
565529565318356993,2015-02-11 15:15:30,Wish I could be in RI for the grand opening of the @GreencoreGroup facility in @QuonsetRI. That's 400 new jobs for RI!,3,1
565279296160542720,2015-02-10 22:41:01,"Sounds like the @hackatbrown was a huge success, as @BrownUniversity inspires innovation (via @projo @RichSalit) http://t.co/6k4GJFiMpA",6,10
565260435717619716,2015-02-10 21:26:04,"Congrats @ProvBusNews - your redesign looks spectacular, with the quality coverage your readers know and expect http://t.co/CuA6yFjCLd",1,2
565243235388624898,2015-02-10 20:17:43,Happy 85th anniversary to @WIC_RI and congrats on your growing customer base! (via @RhodyBeat) http://t.co/qA2sA0d0rW,1,0
565209587482370049,2015-02-10 18:04:01,The finalists in my @Facebook cover photo contest are up. The photo with the most likes at 5 p.m. on 2/20 will win http://t.co/gButZv9mo5,2,1
565190976764125185,2015-02-10 16:50:04,and @EllasFineFood @hemenwaysprov @graciesprov @15PointRoad @jamestownfish &amp; @nicksonbroadway #FoodFirst (3/3),2,3
565190708890726400,2015-02-10 16:49:00,Well-deserved @Movoto recognition for @birchpvd @LosAndes_RI @NapolitanosRI @TheChanlerHotel @MatunuckOyster @Bristoloyster #FoodFirst (2/3),0,2
565190501654335488,2015-02-10 16:48:10,"Nice @Movoto piece on a few of RI's great restaurants, though the list goes on! #FoodFirst http://t.co/6ZVDkdzQpq (1/3)",2,0
565162874956689408,2015-02-10 14:58:24,Wish I could be at the @VAProvidence today for the Nat'l Salute to Veterans Patients. Thank you to all our veterans in RI and nationwide!,1,0
564925716069089280,2015-02-09 23:16:01,ICYMI I'm hosting a #FreeFile Tax event on 2/17 with @OlneyvilleHC @Intuit @ccianet @IRSnews http://t.co/pyQPuoXyvO,2,0
564893551079989248,2015-02-09 21:08:12,Have you checked out my January blog posts? More posts coming soon! http://t.co/z6EoYrwxiE,2,0
564883222119841793,2015-02-09 20:27:09,My office is a resource for RIers who need help navigating the immigration process (via @projo) http://t.co/oINyTgUNsi,0,0
564863144682868736,2015-02-09 19:07:22,"Security training should be mandatory. To promote good cyber hygiene, we must practice what we preach (via @rollcall) http://t.co/Gyf39DbKkz",0,0
564178020542738432,2015-02-07 21:44:56,"It's an honor to be at @MunSecConf w/ @SenJohnMcCain &amp; @SenWhitehouse, and especially to hear from Chancellor Merkel http://t.co/Ttx3KqdDCp",9,3
563813388569292803,2015-02-06 21:36:01,"As a Catholic, I'm so impressed by the vision of @Pontifex for our faith. I'm honored that he will address Congress http://t.co/TBQkOxtXpp",0,5
563790742687326208,2015-02-06 20:06:02,Our national security shouldn't be used as a political bargaining chip (via @DefenseOne) #DontShutDownOurSecurity http://t.co/OZA9jI4OgS,3,3
563769610080878594,2015-02-06 18:42:04,"Remember, today is your last chance to enter my Facebook cover photo contest! Share your shots of the 2nd District http://t.co/OR0NPqRYwZ",0,1
563749750504452097,2015-02-06 17:23:09,RI-based @CVSHealth is ranked among the top 20 most loved companies in America! We certainly love having them here! http://t.co/wqPySFVaxP?,0,0
563734037647593473,2015-02-06 16:20:42,I'm showing support for women living with or at-risk for heart disease. #GoRedSelfie! #GoRedForWomen @American_Heart http://t.co/uIFYrfOqvW,1,0
563459820226084865,2015-02-05 22:11:04,"Wish I could be there for the @providencecol School of Business Dean's Symposium, featuring @bankofamerica CEO Brian Moynihan. Good luck!",0,2
563445208525078529,2015-02-05 21:13:00,RT @RIKidsCount: Pic: Only 10 days left to enroll or renew health coverage thru @HealthSourceRI. Please spread the word! @jimlangevin http:…,1,0
563414013087088640,2015-02-05 19:09:03,.@BrownUniversity is an educational leader in so many areas. It's great to have @BrownU_CIO here to testify on important cyber legislation,8,13
563391917162233856,2015-02-05 17:41:15,"More funds available for local farmers, through the @USDA_NIFA food security program! @USDA @FarmFreshRI http://t.co/WiBCjsjEdC",1,2
563367444581212160,2015-02-05 16:04:00,Don't miss a #FreeFile #Tax event on February 17 with @Intuit @ccianet @IRSnews @OlneyvilleHC! http://t.co/hOXNxBaIIE,2,2
563329421130866689,2015-02-05 13:32:54,"#DontShutDownOurSecurity! If GOP fails to pass a clean bill, more than 50,000 TSA aviation security screeners will have to work w/out pay.",84,27
563113037297905666,2015-02-04 23:13:04,REMINDER! Friday is the deadline to enter my @Facebook cover photo contest http://t.co/8jA1KW2nUE,0,0
563068751114170368,2015-02-04 20:17:06,Attn RI farmers: @RhodeIslandDEM has grants available for specialty crops through @USDA (via @RhodyBeat) http://t.co/WzJTz7vIxd,6,3
563064123781816320,2015-02-04 19:58:42,"Congrats @NBC10_Patrice on 35 years with @NBC10, and thank you especially for your work on adoption/foster youth! http://t.co/BHjayWgqYq",0,2
563056165664600064,2015-02-04 19:27:05,"Everywhere you turn, RI is being recognized and celebrated as a food destination (via @ProvBusNews) http://t.co/fedXiXv1IT",4,1
563040233802174464,2015-02-04 18:23:47,Thank you @klgard13 @MSAPC And @ctaskforce1 for stopping by and for working to prevent substance abuse in RI http://t.co/lRkhsBZTLj,2,4
563037818449305600,2015-02-04 18:14:11,"Just catching up on last week's @ProvBusNews. So many great manufacturing stories, like @MFGRI @Polaris_mep @TheHinckleyComp and many more",2,3
563020713528164353,2015-02-04 17:06:13,"If you’re interested in working in residential treatment, @FamilyServiceRI is having a job fair today from 3-6 p.m. http://t.co/nz6IqctHAb",1,0
563008821552242688,2015-02-04 16:18:57,RT @ddukcevich: #Johnson&amp;Wales plants fresh ideas about local foods http://t.co/DkaRGlL9Hv Chef Idell is #RI at its best @JWUProvidence @ga…,9,0
562741858108182529,2015-02-03 22:38:08,"Welcome to DC, @JWUProvidence @myrwu @aicuri and member representatives! Thanks for talking student aid and education with my team",1,2
562721986951282690,2015-02-03 21:19:11,"Thanks to Carey Monahan of @FDIC, from #WestWarwick, for stopping by my office to discuss issues facing Treasury employees nationwide",0,0
562703332087988225,2015-02-03 20:05:03,February is American #Heart Month. Follow @American_Heart and @GoRedForWomen  to learn how to join the #HeartCrusade http://t.co/6ob2xLeaHC,0,2
562683447123390464,2015-02-03 18:46:02,"On this day 20 yrs ago, Eileen Marie Collins became the 1st female pilot on a space shuttle. Let's encourage girls to pursue their dreams!",4,2
562679449024733184,2015-02-03 18:30:09,"Thank you! It's an honor. RT: ""@MayforthGroup: Congrats @jimlangevin for being selected as Chairman of @SEEC Energy Task Force""",0,1
562664589540986880,2015-02-03 17:31:06,.@AIDSProjectRI1 is planning its 11th annual Dining Out for Life for April 30th. Learn more at http://t.co/uUgOy10X7D,0,0
562646718383411201,2015-02-03 16:20:05,ICYMI @GreencoreGroup's @QuonsetRI Job Fair continues today at the Providence netWORKri Career Center http://t.co/i6OUux9kw5,1,0
562634360202219520,2015-02-03 15:30:59,"Millions have access to quality, affordable health care through #ACA, &amp; yet @HouseGOP is taking vote 56 to undermine it. #PeopleOverPolitics",2,0
562357446539485184,2015-02-02 21:10:38,Check out my blog for posts on the Coventry Sr Center and the important work of @CFRI1834 http://t.co/XP9yP6WcXz,2,0
562333095983337474,2015-02-02 19:33:52,Learn more about #BlackHistoryMonth at http://t.co/NQgEDNGGeP,1,1
562332723587846144,2015-02-02 19:32:23,"It has been 50 years since the march in #Selma, and we must continue to fight for #equalrights for all #BlackHistoryMonth",1,3
562332524480069632,2015-02-02 19:31:36,"February is #BlackHistoryMonth, an important opportunity to honor the African American voices that have shaped our history and culture",1,0
562311548975464448,2015-02-02 18:08:15,Please follow @GinaRaimondo @RhodeIslandEMA @nationalgridus and @RINationalGuard @femaregion1 for important safety updates,3,0
562311404288737280,2015-02-02 18:07:40,"Please, everyone - be very careful out there! The roads are slick and will continue to ice over once the temperatures drop",1,1
562085892337446912,2015-02-02 03:11:34,Congratulations @Patriots!! Huge @SuperBowl victory! #PatriotsNation,2,5
562023840705155072,2015-02-01 23:05:00,Ready to watch the best football team in the country win the @SuperBowl. Go @Patriots! #PatriotsNation #GoPats,0,7
561668950359302147,2015-01-31 23:34:47,#STEM fields are so important &amp; make young ppl more competitive in the workforce @FLLRI @FIRSTweets @NEInstituteTech http://t.co/mTN4EGbNOw,5,5
561667449079492609,2015-01-31 23:28:49,Congratulations to all of the @FLLRI participants! @FIRSTweets http://t.co/PlL6WVeIyS,4,1
561667200298545152,2015-01-31 23:27:50,Always great to be with @NEInstituteTech for the @FLLRI @FIRSTweets Robotics Tech Challenge http://t.co/ZVgJdUzisl,1,1
561286516996329472,2015-01-30 22:15:08,"""Cooperation is the thing"" that solves problems, says community leader and former state rep Mel Benson http://t.co/WddxNKI5jf",0,0
561275422114336768,2015-01-30 21:31:03,"As a former Secretary of State, I know @NellieGorbea is going to do a phenomenal job! http://t.co/6KtUgMhTTt",2,2
561255832080625665,2015-01-30 20:13:12,Thanks @LGDanMcKee for stopping by my office to talk about your plans as Lt. Governor. You will do great things! http://t.co/EswyT2BLiU,3,3
561235301411356672,2015-01-30 18:51:37,Great conversation on the food economy with these #FoodFirst partners. There are exciting things happening in RI! http://t.co/WChvSxXHcx,2,3
561218803485659136,2015-01-30 17:46:04,"Food is a huge part of the RI economy. Together, we can help it to grow #FoodFirst http://t.co/ETQ7Beygyi",4,8
561217567931793408,2015-01-30 17:41:09,And last but not least @BackyardFoodCo @Kartabar_ @KennedyPlazaPVD #FoodFirst. I hope this advisory committee will continue to grow!,3,3
561217331213664256,2015-01-30 17:40:13,Thanks @JWUProvidence @RhodeIslandDEM @nicksonbroadway @HopeandMain @dadekian @revivalbrewing @patspastured @SenatorMillerRI #FoodFirst,6,7
561217125818580992,2015-01-30 17:39:24,There are so many great food biz represented @richeeses @NobleKnots @solspirits @FarmFreshRI @MatunuckOyster @RIHospitality @MillonzisGrille,5,6
561207472007172096,2015-01-30 17:01:02,"I'm so excited to kick off my first advisory committee today, this one bringing together leaders in the RI food economy #FoodFirst",1,4
561193696113467392,2015-01-30 16:06:18,Don't forget to check if you're eligible for free tax preparation and filing! #EITC #EITC_Awareness_Day @RICommAction http://t.co/ChDtB56bTu,2,1
561193611669540864,2015-01-30 16:05:58,"Tax season is upon us, and the earned income tax credit is an important benefit for RI families. #EITC #EITC_Awareness_Day @RICommAction",3,1
561191809519734784,2015-01-30 15:58:48,Thank you @RICommAction for having me at today's #EITC kickoff! http://t.co/AarOzA9BN8,1,0
561164949444374528,2015-01-30 14:12:04,Did you see my Nat'l Mentoring photo with late Senator Pell? Read about it on my blog #SomeoneWhoMatters @MentoringRI http://t.co/51Tsb9ukF1,4,0
560952843579191296,2015-01-30 00:09:14,Best wishes to @CAPartnership of Providence at tonight's event at @fetemusic,0,2
560923012309188608,2015-01-29 22:10:42,"My blog is up about the #immigration forum w/ @davidcicilline &amp; @RepGutierrez, &amp; Mayors @Jorge_Elorza &amp; @JamesDiossa http://t.co/p8snQlUb5w",3,3
560920318056071169,2015-01-29 21:59:59,Thanks so much to @HexMet @HexMetrology for a very informative meeting and tour of your facilities in @QuonsetRI http://t.co/kSPH2qwUSd,6,2
560906439670390784,2015-01-29 21:04:51,Congratulations to @BGCPawt on the grand opening of your new facility today! Thanks for all you do for RI kids! @BGCA_Clubs,2,2
560882447370706944,2015-01-29 19:29:30,Really looking forward to my tour of @HexMet @HexMetrology in @QuonsetRI. They are part of RI's manufacturing resurgence,0,2
560878271244795905,2015-01-29 19:12:55,Fantastic group of entrepreneurs at @thehiveri. Thank you for having me! @TRSstrategies http://t.co/uZWpyVPc30,3,3
560868526840623105,2015-01-29 18:34:11,"So many @thehiveri business owners live in @NorthKingstown area and feed the local economy, creating a sustainable community @TRSstrategies",1,2
560867885472825345,2015-01-29 18:31:38,One of the wonderful things about @thehiveri is how @TRSstrategies and partners reach out to other incubators &amp; biz http://t.co/y2j3UcnBUu,1,2
560866343336312833,2015-01-29 18:25:31,Historian Tim Cranston is here and an integral part of keeping this historic space thriving @thehiveri @TRSstrategies http://t.co/aLTgohFqLP,1,1
560865527573512193,2015-01-29 18:22:16,Lafayette Mill in @NorthKingstown is such a beautiful historic space. It's great to see how an existing space can be repurposed @thehiveri,0,0
560864747894374401,2015-01-29 18:19:10,The passion that @TRSstrategies and @thehiveri partner businesses have for RI is contagious http://t.co/yxYJVQOSa3,1,2
560857436702380033,2015-01-29 17:50:07,"Headed to @thehiveri, an exciting coworking facility in @NorthKingstown that is leading the way on community-based biz model @TRSstrategies",0,0
560841191290589186,2015-01-29 16:45:34,Great to meet with RI's new Treasurer @SethMagaziner to discuss the challenges and opportunities facing our state! http://t.co/ZirLqBIpVj,1,5
560838216874733568,2015-01-29 16:33:45,We can and must do more to close the gender pay gap. #EqualPay #LillyLedbetter,1,4
560838166366920704,2015-01-29 16:33:33,"On this day in 2009, the #LillyLedbetter #FairPay act was signed into law, but we are still far from achieving #EqualPay",8,8
560576353410748417,2015-01-28 23:13:12,REMINDER! Just 1 week left to submit your artwork to my @Facebook Cover Photo Contest http://t.co/4GvdUu5CeC,0,0
560545097734164482,2015-01-28 21:09:00,"Check out my blog about the IT Career Fair @BryantUniv, which encourages our students to pursue #STEM @RIStatePolice http://t.co/dCAK4d3wnv",1,2
560525737669971968,2015-01-28 19:52:04,ICYMI I offered my support this week for @RepKarenBass's important legislation to protect children from trafficking http://t.co/Z0MEUbAG5u,2,1
560504362896986113,2015-01-28 18:27:08,"As clean up continues, it's important that RI get federal support for the blizzard aftermath http://t.co/rsMz4D8xTo",0,3
560504098051883008,2015-01-28 18:26:05,Kudos to @GinaRaimondo for a job well done keeping RIers safe during #Juno and outstanding clean-up efforts,2,8
560493538576982017,2015-01-28 17:44:07,"On this day in 2008, the #WoundedWarrior Act passed. Today, thank veterans in your life &amp; the ppl who care for them @wwpinc @VAProvidence",4,0
560478081576861697,2015-01-28 16:42:42,"The @FamilyServiceRI job fair originally scheduled for today has been moved to Wednesday, February 4. Don't miss it!  http://t.co/RlZN8kh1Jn",0,0
560201243239665664,2015-01-27 22:22:39,ICYMI I launched my High School Art Competition! The contest is open to all high school students in the 2nd District http://t.co/lnwDlR0xDh,2,1
560175209333141504,2015-01-27 20:39:12,#Cybersecurity is such an important priority for me. Thanks @IridiumComm for sharing my concerns and talking cyber today,2,1
560131633085693953,2015-01-27 17:46:02,It's great to have representatives from @NFB_voice in DC today to discuss legislative issues affecting the blind and visually impaired,3,2
560123377642655744,2015-01-27 17:13:14,"As Foster Youth Caucus co-chair, I support @RepKarenBass's Strengthening Child Welfare Response to Trafficking Act http://t.co/FsllQtaO21",3,1
560106895768567809,2015-01-27 16:07:44,"As Anne Frank said, ""How wonderful is it that nobody need wait a single moment before starting to improve the world."" #HolocaustRemembrance",10,5
560106526615281664,2015-01-27 16:06:16,"On this Internat'l Holocaust Remembrance Day, let us remember the lives lost and pledge to care for one another. @HolocaustMuseum",0,0
560097085115355136,2015-01-27 15:28:45,Hope everyone in RI is staying safe! Stay off the roads if possible,1,1
560084833700151297,2015-01-27 14:40:04,.@BrownUniversity and RI colleges recognize the importance of #cybersecurity education. Great @the_herald editorial! http://t.co/ueLDgTG9du,3,2
559857855336300545,2015-01-26 23:38:09,Arctic Nat'l Refuge is a pristine habitat. Thank you @BarackObama for moving to protect it @Interior http://t.co/sYuCfo0ZqR,3,2
559827889734967297,2015-01-26 21:39:04,"Everyone be safe out there, and try to stay off the roads. Let public works and safety crews do their jobs. #Juno",0,0
559761514627092480,2015-01-26 17:15:19,RT @SenJackReed: Sent letter w/ @SenWhitehouse @jimlangevin @davidcicilline asking for federal help as needed to cope w/ #blizzard2015 http…,5,0
559754697872257024,2015-01-26 16:48:14,The elderly and disabled who need help clearing snow can turn to @Serve_RI by calling 401-331-2298 (VIA @PROJO) http://t.co/23PJijYLA1,2,1
559754449280049154,2015-01-26 16:47:15,.@femaregion1 also has important updates for you http://t.co/awAy5qcrQ2,1,0
559754137051865088,2015-01-26 16:46:00,.@RhodeIslandEMA &amp; @Readygov both have helpful tips to prepare for #Juno http://t.co/7iMtRv6q8Q http://t.co/FmeS26mw0k,1,2
559753951013515264,2015-01-26 16:45:16,"A serious winter storm, #Juno, is on its way. Make sure your family is prepared with food, water and other essentials http://t.co/UbD6Xo820A",3,0
559736401848463360,2015-01-26 15:35:32,Scott DePasquale of @Utilidata is everywhere these days! Wonderful job on #ExecutiveSuite with @TedNesi (via @wpri12) http://t.co/kfYZKAO4yE,1,2
559136122711056384,2015-01-24 23:50:14,Tune in to @wpri12 for the @MeetingStreetRI Telethon with lots of special guests! @NiRoPe http://t.co/7LsRV2J8HE http://t.co/qi7BXODHzs,2,4
559129945717633024,2015-01-24 23:25:41,And always nice to see @MarisolGarciaPV! #SnowAngelBall @MattyFund,1,2
559129243805052928,2015-01-24 23:22:54,The #SnowAngelBall is a wonderful event every year! Thank you @MattyFund for including me and @davidcicilline http://t.co/h9nKYpgvGD,4,3
559127633376854020,2015-01-24 23:16:30,Great to be back for another #SnowAngelBall to benefit The @MattyFund. Thank you for fighting for our kids!,3,1
