id,created_at,text,retweets,favorites
83269509464604672,2011-06-21 20:26:12,Meeting with a couple “furry” members of my constituency at the @akwildlife conservation center: #AK #Alaska http://twitpic.com/5evozw,2,0
82884324436877312,2011-06-20 18:55:37,We're open Whittier! Stop by City Council Chambers until noon to meet with my staff & @SenatorBegich's staff:  http://twitpic.com/5eeqb1,1,0
82876849574789120,2011-06-20 18:25:55,Meet Nerka the salmon. He's the mascot for the 2011 Alaska Delegation Mobile Office: http://t.co/prz3jxF /via @SenatorBegich,3,0
82838037914071040,2011-06-20 15:51:41,This weekend I visited the @akwildlife conservation center & got to help out with a few chores: http://t.co/EmFmgLe #AK #Alaska,0,0
82572378969874432,2011-06-19 22:16:03,Yesterday I joined Kenai River guides & the Soldotna community for the Wounded Warriors bbq. Great tribute to incredible men & women! #AK,1,1
82571504205840384,2011-06-19 22:12:35,Happy fathers day to all the dads out there! Great weekend in#Alaska celebrating the solstice. How are you celebrating your dad?,0,0
81491650282655745,2011-06-16 22:41:38,Can’t wait to bring the #Arctic conversation to #Alaska: 200 leaders will attend the Arctic Imperative Summit this weekend in Girdwood #AK,2,0
81491514424967168,2011-06-16 22:41:05,Wonderful round table discussion on the #Arctic with the Ambassador’s of Denmark & Sweden today http://twitpic.com/5cim0l,0,0
81093159295258624,2011-06-15 20:18:10,Proud of my work with the Village Safe Water Program to benefit Alaskan villages like Igiugig & Buckland: http://t.co/LbaTRPb #AK #Alaska,3,0
81062522488225792,2011-06-15 18:16:26,I want to hear from you #Alaska – join my staff members on the Kenai Peninsula next week: http://t.co/6MMpO9s #AK,4,0
80737983896096768,2011-06-14 20:46:50,"Very proud of my former intern, Mari Freitag, who was named the 2011-2013 student regent for @UA_System: http://t.co/DmhtQug #AK #Alaska",3,0
80691858631688192,2011-06-14 17:43:32,"On this date in 1777, Congress adopted the stars & stripes as our national flag. Would love to see pics of you celebrating #FlagDay! #AK",1,2
80315127555031040,2011-06-13 16:46:33,The @TodayShow honored Ma’o Tosi & #AK Pride with a huge gift today for #LendAHand: http://t.co/mpTAj1S Hope you enjoyed #Alaska @alroker!,4,0
78969317848395776,2011-06-09 23:38:47,Wishing @repdonyoung a very happy birthday! #AK #Alaska,1,1
78585596112678912,2011-06-08 22:14:00,Alaskan communities like Crooked Creek & Red Devil must get the same swift FEMA response as those in the lower 48: http://1.usa.gov/ikqBDk,3,0
78515022430617601,2011-06-08 17:33:34,RT @ENR_GOP - Exxon made a huge oil discovery in the Gulf of Mexico today: http://t.co/6C2itCN,0,0
77836677925715968,2011-06-06 20:38:04,Welcoming my 10 interns to DC on their first day. Looking forward to their contributions: http://1.usa.gov/l7Dag9 http://twitpic.com/57ylk7,0,0
76392609228128256,2011-06-02 20:59:52,Great meeting with the members of the Kenai & Soldotna Chambers of Commerce today #AK #Alaska  http://twitpic.com/5616s9,0,0
76376245356601345,2011-06-02 19:54:50,"Enjoying a beautiful day on the Kenai, getting ready to speak with the Kenai & Soldotna Chambers of Commerce #AK #Alaska",1,1
76370588859498496,2011-06-02 19:32:21,Gorgeous day on the Kenai! Thanks @FoodBankofAK for hosting my conversation with the non-profit community #AK http://twitpic.com/56097m,2,0
75968864680280064,2011-06-01 16:56:03,Join me at Primary Care Associates in Anchorage at 10am as I unveil my bill to empower Medicare Patients alongside doctors & seniors #AK,1,0
75656886824878080,2011-05-31 20:16:22,Please join @SenatorBegich & I today for a Veterans Listening Session with Sec. Shinseki at the Loussac Library at 1:30pm. #AK #Alaska,2,0
75647599700488192,2011-05-31 19:39:27,I was honored to participate in the Byer's Lake & Fairbanks Memorial Day Ceremonies for our fallen soldiers: http://bit.ly/mIQKPg #AK,1,0
75281383790096385,2011-05-30 19:24:15,"This Memorial Day, we owe it to our fallen soldiers to honor their service & commitment. I honor them today: bit.ly/jkyLeQ #AK #Alaska",3,1
75002703482327040,2011-05-30 00:56:52,"To be able to pay tribute to our nations veterans in a setting like Byers Lake, with Denali in the background is special #AK",0,0
74899710502109186,2011-05-29 18:07:37,"This Memorial Day weekend, we owe it to our fallen soldiers to honor their service & commitment. I honor them today: http://bit.ly/jkyLeQ",7,1
73880736003932160,2011-05-26 22:38:34,Today I met the @USCG Enlisted Person of the Year- Sitka's own Petty Officer Troy Brevik & his family #AK #Alaska http://twitpic.com/52wz0g,0,0
73830025069203457,2011-05-26 19:17:04,I introduced a bill to revitalize US critical mineral supply & reduce the nation’s dependence on foreign suppliers: http://1.usa.gov/kbDTpt,3,0
73521999477088258,2011-05-25 22:53:05,I believe Sen. Toomey’s proposal is the best starting point to begin addressing the nation’s deepening deficit : http://1.usa.gov/mlhZ1f,1,0
73510274547716096,2011-05-25 22:06:29,AK Baseball wouldn’t be where it is today without Lefty Van Brunt. I mourn his passing with every #AK baseball fan: http://1.usa.gov/k0qbla,0,0
73420098395844608,2011-05-25 16:08:10,I told @YouTube Town Hall we should look toward hydropower & geothermal: http://youtu.be/GoFiZh3GWl8 http://bit.ly/jXvUTY #YTTownhall,3,0
73121682939850752,2011-05-24 20:22:22,"Today I urged the Postmaster General to not put Alaska’s mail service in untrained hands 2 time zones, 2K miles away http://1.usa.gov/lOT4VA",1,0
72790168154804224,2011-05-23 22:25:03,America is “waking up” to the fact that we’re an arctic nation: http://1.usa.gov/ixYhvS #AK #Alaska,4,1
72777326793990144,2011-05-23 21:34:01,@SenatorBegich & I introduced a Senate resolution to honor the @AlaskaAces for winning the Kelly Cup: http://owl.li/51azu #AK #Alaska,0,0
72758817343029248,2011-05-23 20:20:28,America’s seniors need solutions & certainty with Medicare. Today I introduced a bill to give them some: http://1.usa.gov/kKY4sr #AK,2,1
72704466817794048,2011-05-23 16:44:30,Congrats to our @AlaskaAces for bringing the Kelly Cup home to #Alaska last night! http://bit.ly/j8OYn6 #AK,3,1
71675527978688512,2011-05-20 20:35:52,"@adndotcom Raising my hand from Washington, DC on #BikeToWorkDay – missed all the traffic! http://twitpic.com/5068cv",0,0
71643232685146112,2011-05-20 18:27:32,Great morning commute in honor of National #BikeToWorkDay– missed all the traffic!  http://twitpic.com/5068cv,5,0
71240762410536961,2011-05-19 15:48:16,"Reducing demand for fuel is important, but new policies shouldn't add to our federal debt: http://1.usa.gov/j3SxM0 /via @ENR_GOP #Alaska",0,0
70957161622147072,2011-05-18 21:01:20,On IED protection for our troops: we must do better to protect our men & women in uniform: http://1.usa.gov/jU2Zur #AK #Alaska,1,0
70939150437728256,2011-05-18 19:49:46,There’s no reason a man in Shaktoolik or in Selawik should have worse odds of a healthy life than the avg American: http://1.usa.gov/mv0JVb,5,0
70932694283980801,2011-05-18 19:24:06,Our offshore production & safety act of 2011 is both common sense and long overdue: http://bit.ly/j4WOYK /via @ENR_GOP #AK #Alaska,0,0
70582492888965122,2011-05-17 20:12:32,I spoke on the Senate floor today explaining why repealing tax provisions for oil companies won’t lead to price drops: http://bit.ly/kOqFL5,0,0
70503701466460160,2011-05-17 14:59:26,"We need to ensure that safety regulations spur, not impede offshore #drilling: http://1.usa.gov/kq2LGN /via @ENR_GOP #oil #jobs",0,0
70165747246182400,2011-05-16 16:36:32,"Obama’s comments on #oil drilling in #Alaska are positive, but need to be followed by action: http://wapo.st/lttSt0 #AK",3,0
69462513862979585,2011-05-14 18:02:08,"Today for National Police Survivors Day, join me in honoring 3 Alaskan officers & the families they left behind: http://1.usa.gov/kc7QSk #AK",0,0
68792586684481536,2011-05-12 21:40:05,Leaving Greenland after historic meeting of the Arctic Council in Nuuk. #Alaska #AK,1,0
68779642684837888,2011-05-12 20:48:39,"The Ferry Systems Investment Act will improve Alaskans way of life, from Dutch Harbor to Metlakatla: http://1.usa.gov/jPhK4p #AK #Alaska",1,0
68743564112310272,2011-05-12 18:25:17,"Increasing access, not taxes will result in more #jobs & lower #gas prices http://1.usa.gov/kfXLKh /via @ENR_GOP #ENR #AK #Alaska",4,0
68378318281510914,2011-05-11 18:13:56,"I’m proud to co-sponsor the Hiring Heroes Act - giving veterans the job skills, support needed when they return home: http://wapo.st/jHCzuX",3,1
68320196993093632,2011-05-11 14:22:58,WSJ: Shrinking #Oil Supplies Put Alaskan Pipeline at Risk: http://on.wsj.com/jt6sJz /via @ENR_GOP #AK #Alaska,1,0
68058678913269761,2011-05-10 21:03:48,"Joining Secs Clinton & Salazar at the #Arctic Council in Greenland to discuss challenges, opportunities in Arctic: http://1.usa.gov/jOMx7F",2,0
67993086336307200,2011-05-10 16:43:09,New advances in directional drilling make #ANWR more attractive prospect than ever: http://1.usa.gov/ltpSx1 /via @ENR_GOP #energy,0,0
67940802365636608,2011-05-10 13:15:24,RT @lisamurkowski reminds us how important advocacy & telling your #ALS story is! http://t.co/f6ghsJ4 /via @ALSPublicPolicy #alsadvday11,1,0
67716262658187264,2011-05-09 22:23:09,"Welcome to #Twitter, @ENR_GOP! Follow our efforts to improve #energy security for America. #AK #Alaska",4,0
67703379027177472,2011-05-09 21:31:58,Congrats to the #AK HS seniors graduating this week! Ceremonies are being streamed live here: http://ow.ly/4QGES via @ASD_Info #ClassOf2011,0,0
67693704659468288,2011-05-09 20:53:31,RT @ENR_GOP: Sen. Murkowski talks to Tyler Suiters of EnergyNow! TV about the importance of developing our rare earth resources http://t ...,2,0
67685912519262208,2011-05-09 20:22:33,Many thanks to the AFN & ILD members here in #DC for their LEIP Conference. Great talking to all of you! #AK #Alas http://twitpic.com/4vmcy1,0,0
67321243837284353,2011-05-08 20:13:29,Off to cheer on my son at his soccer game. Wishing a #HappyMothersDay to all the wonderful moms out there!,0,0
66196395228536832,2011-05-05 17:43:45,"Check out the podcast of my interview with @KMBQ 's Ray Babowicz. We chatted 2012, #energy & the #economy: http://bit.ly/kByWNr #AK #Alaska",0,0
66183645001551872,2011-05-05 16:53:05,Partnering with the private sector is an important step to improving cyber security for our nation: http://1.usa.gov/kTccj0,2,0
65545712007512064,2011-05-03 22:38:10,Today I thanked #AK teacher of the year Lorrie Heagy: Librarian & Music teacher @ Glacier Valley Elementary http://twitpic.com/4sypug,0,1
65536304762470400,2011-05-03 22:00:47,"My 3rd grade teacher in Ketchikan changed my life. On National Teacher Appreciation Day, who did you thank? #thankateacher #AK #Alaska",2,0
65480250754207744,2011-05-03 18:18:03,Congrats to @UAFairbanks student Marjorie Tahbone who was crowned the 2011 Miss Indian World! http://bit.ly/itw3GP #AK #Alaska,2,0
65460209514057729,2011-05-03 16:58:24,"Kudos to the more than 5,800 Heart Run participants this weekend for helping the fight against heart disease: http://bit.ly/mc676U #Alaska",1,0
64911374622539777,2011-05-02 04:37:32,"Osama bin Laden's death is a lesson to the world: If a fight is brought to the American people, we will finish it. http://1.usa.gov/kAD6as",18,3
64478564526985216,2011-04-30 23:57:42,"Happy Birthday to my son Nic, who's turning twenty today!",1,0
63783527816249344,2011-04-29 01:55:52,I’m joining the @Ch2KTUU news hour for a live Q&A – tune in now! #AK #Alaska,1,1
63769801528578048,2011-04-29 01:01:20,Tune in to ABC Channel 13 now! I’m on live with KIMO. #AK #Alaska,0,0
63744774926118913,2011-04-28 23:21:53,Anchorage: I’m joining KIMO Channel 13 at 5pm (AKDT) & @CH2KTUU at 6pm for a live Q&A. Hope you’ll tune in! #AK #Alaska,3,0
63679048181743616,2011-04-28 19:00:42,Heading over to @KTVA today to sit down for “View from the Hill.” Watch the interview tonight at 6pm & 10pm. #AK #Alaska,2,0
63636550075944960,2011-04-28 16:11:50,"Our thoughts & prayers are with those dealing with the damage of the storms in the south, especially those families who’ve lost loved ones.",4,1
62962108417052672,2011-04-26 19:31:51,"Trips home to #Alaska are so refreshing!  Check out some pictures with my friends in Bethel, Hooper Bay & more: http://bit.ly/gLIHMZ #AK",2,0
62595815088193536,2011-04-25 19:16:19,Enjoyed my visit to Chevak. Thanks to the children for the warm welcome & the dancing! http://bit.ly/e7rwTW (h/t teacher Misty Nelson) #AK,4,0
61562106172022785,2011-04-22 22:48:44,Thankful I'm able to spend Easter in #Alaska with my friends & family. Hope you're able to enjoy this holiday weekend as well! #AK,0,1
61529623577624576,2011-04-22 20:39:40,Setting the record straight on America's #oil: http://wapo.st/edm6sq #jobs #energy #AK #Alaska /via @washingtonpost,2,1
61139912094789632,2011-04-21 18:51:05,"Just landed in Chevak. Sunny, windy and beautiful. I’m looking forward to our community visit this morning! #AK #Alaska",2,0
60377526861692930,2011-04-19 16:21:38,"It's great to be home in #Alaska. Looking forward to spending the Senate recess in Bethel, Chevak, Fort Yukon & beyond! #AK",0,0
60045286638227456,2011-04-18 18:21:26,Celebrate #NationalParksWeek with a visit to one of Alaska's 23 national parks & historic sites: http://1.usa.gov/ffnJgj via @AlaskaNPS,3,0
58198150619463680,2011-04-13 16:01:35,Check out pictures of @lisamurkowski & I addressing the media today: http://on.fb.me/fGiSZ0 #alaska #AK #energy #epa /via @repdonyoung,1,0
58183214614851584,2011-04-13 15:02:14,"I testified today that the EPA Clean Air Permits are becoming a hidden, blunt instrument against exploration: http://1.usa.gov/eNaxw8",3,0
57914588057976832,2011-04-12 21:14:48,"Dept. of Interior should work with Congress, not around us. Wild Lands designation spiked: http://1.usa.gov/gnLVbn #AK #Alaska",1,0
56562968191713280,2011-04-09 03:43:57,"I'm thankful a #budget deal has been reached. No #shutdown means rent, mortgage and groceries for American workers. #AK #Alaska",11,1
56475565754036224,2011-04-08 21:56:38,"If federal workers aren’t being paid, neither am I. In event of a #govtshutdown, my paycheck will go to the Food Bank of #Alaska #AK",30,2
56429938953293827,2011-04-08 18:55:20,Proud to join @kaybaileyhutch on the Military Pay Act so our brave men/women are paid #ifgovtshutsdown: http://bit.ly/eCyGB2 #AK #Alaska,4,1
56424847709974528,2011-04-08 18:35:06,I see some “bad math” in Cook Inlet critical habitat decision: http://1.usa.gov/fBhT2q #AK #Alaska,0,0
56117694533074944,2011-04-07 22:14:35,I’m proud to join my Senate colleagues in fighting against Alaskan youth suicide: http://bit.ly/htxi4N /via @indiancountry #AK #Alaska,3,0
56101307781611520,2011-04-07 21:09:28,"#Alaska loses; America loses, with government shut down. Forget the talking points – let’s get the job done: http://1.usa.gov/dXdg31 #AK",8,1
56085958889717760,2011-04-07 20:08:29,#Hydropower is and must continue to be part of our practical #energy solution: http://nyti.ms/dIlLW6 #AK #Alaska,5,0
56067442866262016,2011-04-07 18:54:54,"Yesterday, I introduced revised legislation to the Sealaska lands bill: http://1.usa.gov/hVLmFd  #AK #Alaska",2,0
55712261431500800,2011-04-06 19:23:32,"Congrats to the students of Kokhanok School, finalists in the national Solve for Tomorrow contest! http://bit.ly/fuHczc #AK #Alaska",3,0
55377069500137472,2011-04-05 21:11:36,I'm speaking on the Senate floor to discuss domestic #oil production. Watch online now: http://cs.pn/gkTy01 #AK #Alaska,3,1
55371864339525632,2011-04-05 20:50:55,My vote to repeal the 1099 tax reporting mandate is a must for #AK small businesses buried under needless red tape: http://1.usa.gov/gwY99H,1,0
55028880972587008,2011-04-04 22:08:02,Pleased to welcome @matthewfelling to my communications team: http://1.usa.gov/fNpskS #AK #Alaska,2,0
53841827794649088,2011-04-01 15:31:06,Thank you to the more than 70 participants who joined us for the Choose Respect March yesterday: http://bit.ly/fGAl60 #AK #Alaska,0,0
53834718906552320,2011-04-01 15:02:51,"#AK vets told to travel to Seattle for care that’s available in AK. I say that’s wrong, VA says it will do better: http://1.usa.gov/fYlilR",1,0
53570195897335809,2011-03-31 21:31:44,Joined by @SenatorBegich @repdonyoung & all the participants in our Choose Respect march here in DC #ak #Alaska  http://t.co/auWvT8q,7,0
53558291736952832,2011-03-31 20:44:26,"@BronxZoosCobra Glad to hear you’re home safe, but sure glad you didn’t find your way too far north! #cobra #AK #alaska",0,0
53528550191546368,2011-03-31 18:46:15,"Rain or snow, we will still be marching against domestic violence for the Choose Respect Rally today: http://1.usa.gov/grsKgD #AK #Alaska",3,0
53494581781725184,2011-03-31 16:31:16,"Check out pictures from my visit with students from IDEA, Petersburg & Wrangell. Such bright students! http://bit.ly/hgesWk #AK #Alaska",1,0
53243036095881216,2011-03-30 23:51:43,Want to wish @SenatorBegich a happy birthday!!!,5,0
53188029996736512,2011-03-30 20:13:09,Reminder: Join me tomorrow to march in solidarity against sexual abuse and domestic violence: http://1.usa.gov/grsKgD #AK #Alaska,7,0
52413878960783361,2011-03-28 16:56:57,Happy Seward's Day Alaskans! Today we celebrate the purchase of #Alaska in 1867. Check out this replica check: #AK http://twitpic.com/4ec37l,14,0
51362046817746944,2011-03-25 19:17:20,Join me & thousands of Alaskans on March 31 in standing up against the epidemic of domestic violence in #AK: http://1.usa.gov/grsKgD,6,0
50986880220667904,2011-03-24 18:26:34,Want to experience govt firsthand? HS intern applications are now being accepted in my DC office! Apply online: http://bit.ly/hRQ3pi,3,0
50255235888857088,2011-03-22 17:59:16,Great to celebrate the impact women have on #Alaska at the Athena Society luncheon yesterday. Congrats to all: http://bit.ly/gmrzYX #AK,2,0
50200378549080064,2011-03-22 14:21:17,"In case you missed it, I was recognized in the latest @ELLEmagazine issue: #ak #alaska http://twitpic.com/4c4exk",2,0
50183673953263617,2011-03-22 13:14:54,RT @knom: On our blog: Photos of Red Lantern (last-place finisher) Ellen Halverson. Senator @lisamurkowski was on hand: http://ow.ly/4je ...,3,0
49492468982497280,2011-03-20 15:28:18,Heading to Nome for the #Iditarod Banquet tonight. Looking forward to a great day in the Gold Rush city! #AK #alaska,2,0
49254771936329728,2011-03-19 23:43:47,Enjoying the 3A State Basketball Championship game: Monroe Catholic vs. ACS at the Sullivan Arena #AK,0,0
48822096318574592,2011-03-18 19:04:29,One of the heroes of the original #Iditarod: Emily Morgan who gave life saving serum to the residents of Nome in 1925: http://bit.ly/h2Q1e8,1,1
48760059634786304,2011-03-18 14:57:58,#Hydropower is and must continue to be part of our #energy solution: http://1.usa.gov/hopzNz #AK #Alaska,6,1
48141172509650944,2011-03-16 21:58:44,I always enjoy seeing so many Alaskans at our constituent coffees in DC! http://bit.ly/epHpsR #AK #Alaska,1,0
48110582834020352,2011-03-16 19:57:11,The actions of the #EPA have had dire consequences for #Alaska. Watch my comments to Administrator Jackson: http://1.usa.gov/glDghJ #AK,3,0
47809832991997952,2011-03-16 00:02:07,"My family & I (dogs too) are exceptionally proud of Velvet, Summit, Snickers & crew: Top dogs on @TeamJohnBaker winning team! #Iditarod",1,0
47715481330782208,2011-03-15 17:47:11,Sending my very best wishes to @TeamJohnBaker of Kotzebue as he celebrates a well-deserved #Iditarod 39 victory! #Iditarod #alaska #AK,4,0
47713624579522560,2011-03-15 17:39:49,RT @Ch2KTUU: Channel 2's live stream from Nome of the #Iditarod finish is now live; you can also watch on Channel 2. http://bit.ly/i8NI5B,6,0
47683061999079424,2011-03-15 15:38:22,RT: @TeamJohnBaker With about 25 miles left to go Team Baker continues lead over Smyth by approx 10 miles #Iditarod #ak #alaska,0,0
47671401498415104,2011-03-15 14:52:02,Think you know the story of the 1925 serum run to Nome? You may not know this: http://bit.ly/h2Q1e8 #Iditarod /via @adndotcom,3,0
47417017464143872,2011-03-14 22:01:12,"For too long, our nation has ignored the benefits of American #oil production: #jobs, security, & revenue: http://bit.ly/h0U4SB",1,0
47367903917522944,2011-03-14 18:46:03,"Traveling 4,700 miles across #AK with only skis & a packraft - no problem for @andrewskurka! Check out his story: http://bit.ly/fmvB1r",2,0
46345001793363969,2011-03-11 23:01:24,"Responsible development of #energy resources will create #jobs, improve security, raise revenue to pay down the #debt: http://usat.ly/fE96qo",3,0
46258255411949568,2011-03-11 17:16:42,My thoughts & prayers go out to the families affected by the earthquake & #tsunami that struck Japan: http://1.usa.gov/h2Hjbc,2,0
46231168231800832,2011-03-11 15:29:04,A #tsunami advisory remains in effect for the #Alaska coastline. NOT a warning or watch. http://1.usa.gov/fGT2fU /via @adndotcom,0,0
45893530647932928,2011-03-10 17:07:25,"Watch now to find out the top 5 ways to improve our #energy security, create #jobs & reduce dependency on foreign #oil: http://cs.pn/gkTy01",4,0
45595805373038592,2011-03-09 21:24:21,Constituent coffee season is in full swing! Check out the photos from today: http://bit.ly/eZVYq8 #ak #alaska,1,0
45591783148748800,2011-03-09 21:08:22,Enjoyed my visit with students from Golden View Middle School today! #ak #alaska http://twitpic.com/47wmid,0,0
45257296758054913,2011-03-08 22:59:15,One of my favorite #Alaskan traditions! Check out the photos from the ceremonial opening of Iditarod 39: http://bit.ly/dK8eo2 #ak #alaska,1,0
45229439742775296,2011-03-08 21:08:33,Americans deserve balance not bias in their energy policy. We must begin increasing domestic oil production today: http://1.usa.gov/hV3zmS,4,0
44855555864535040,2011-03-07 20:22:52,Experience what it's like to be the lead sled dog: Check out musher Aliy Zerkle's sledcam: http://bit.ly/dZ5njy #AK #Alaska #Iditarod,4,0
44850705386840064,2011-03-07 20:03:36,Nothing better than spring in #AK! RT @alaskatravlnews: Kayakers preparing for a paddle on Resurrection Bay: http://yfrog.com/gy98tsej,3,0
44145198539874304,2011-03-05 21:20:10,Waiting in line for America's best hotdog from M.A.s. Reindeer or Polish - decisions decisions... #Iditarod #AK #alaska,4,1
44128157527322625,2011-03-05 20:12:27,Wishing musher John Baker well  #Iditarod #AK #alaska  http://t.co/PBHLHrY,1,0
44122043922391040,2011-03-05 19:48:09,Enjoying the #Iditarod opening ceremonies with racing champions Larry Westlake & Emmit Peters  http://t.co/Up050A7,1,0
44114941208305665,2011-03-05 19:19:56,Cutting the ribbon for the opening of the 39th #Iditarod! #AK #alaska  http://t.co/5F0JpGr,0,0
44113605536382977,2011-03-05 19:14:37,At the start of the 39th Iditarod downtown. Good luck to all the teams! #AK http://yfrog.com/h0xe0xgj,0,0
44078653667155968,2011-03-05 16:55:44,It's #Iditarod day in Anchorage! Meet all 62 mushers: http://t.co/LjGF25w /via @adndotcom #ak #Alaska,2,0
43734214079819776,2011-03-04 18:07:03,Heart disease takes a woman’s life every minute. The Heart for Women Act will help prevent the rise of this disease: http://bit.ly/elEer4,5,0
43472685317107712,2011-03-04 00:47:50,Enjoying my visit at the @NCAI1944 legislative session tonight in DC: #ncai  http://t.co/1IkyXgl,0,0
43412221207908352,2011-03-03 20:47:34,What are 5 steps the US can take to improve our energy security? Watch online now to find out: http://cs.pn/gkTy01 #ak #alaska,0,0
43375168114003968,2011-03-03 18:20:20,The #Iditarod - One of Alaska’s finest traditions starts this weekend! Good luck to all the teams: http://bit.ly/ftS4uc #ak #alaska,4,1
43085905598218240,2011-03-02 23:10:55,Wonderful time catching up with so many Alaskans today at our 1st Constituent Coffee of 2011! http://bit.ly/eA2TaV #ak #alaska,1,0
42676761514876929,2011-03-01 20:05:07,It’s constituent coffee season here in DC – first one starts tomorrow!  Interested? Find out more here: http://bit.ly/gwdZrL #ak #alaska,1,0
41205345074286592,2011-02-25 18:38:14,Today in #AK history: Glacier Bay National Monument (now GB National Park) is established in 1925: http://bit.ly/4PyMlg @GlacierBayNPS,0,0
40838336411082752,2011-02-24 18:19:52,I’ll be addressing the #AK state legislature today at 11:00am (AKST). Watch on @360North or online here: http://gavelalaska.org #alaska,2,0
40813368033939456,2011-02-24 16:40:39,The #TSA needs to be more considerate of privacy rights of airline passengers: http://bit.ly/e4sdnn #alaska #AK #cissna,8,1
39167349416407040,2011-02-20 03:39:58,The Kodiak High School culinary class can really put on a spread!  http://twitpic.com/41oroa,3,2
39138664617492480,2011-02-20 01:45:59,Just had a chance to personally thank coast guard crews in Kodiak who have been keeping us safe in #Alaska http://twitpic.com/41nerg,3,0
38379942433525760,2011-02-17 23:31:05,Good news for our rural Alaskan communities - Essential Air Service remains intact: http://bit.ly/gWeXYI #AK #Alaska,3,0
38366132729552896,2011-02-17 22:36:13,"Unacceptable: President’s budget would saddle every American with $2,500 a year in interest on the debt: http://wapo.st/eBMGFm",1,0
37986439748653056,2011-02-16 21:27:27,"If you are in Juneau, join the events honoring a great Alaskan woman - Elizabeth Peratrovich. Find out more here: http://bit.ly/dL69Sv",2,0
37970680804802560,2011-02-16 20:24:50,Yesterday I introduced legislation to increase domestic #oil production. Find out how it will help our economy: http://bit.ly/fvFQuE #ANWR,1,0
