id,created_at,text,retweets,favorites
490266121262489600,2014-07-18 22:45:26,Talking with some military training instructors about their regimen and how the recruits are performing. http://t.co/gflrFTNrXT,2,1
490248005627310082,2014-07-18 21:33:27,"While at Lackland Air Force Base, I'm also getting briefed on their work and mission for our nation's defense. http://t.co/JT35za2si3",2,0
490223687879389185,2014-07-18 19:56:49,Just landed at Lackland AFB with the delegation to see the process for unaccompanied minors who are sheltered &amp; housed there. #BorderCrisis,4,2
490205429050671104,2014-07-18 18:44:16,2/2 We need to be working with these other nations where the children are coming from to address some root causes of the #BorderCrisis.,6,2
490204630773940224,2014-07-18 18:41:06,1/2 This morning I saw a 7 y/o girl from Ecuador—she does not know where her parents are. She’s traveling with no one. How did she get here?,5,2
490186215778689025,2014-07-18 17:27:55,"Good to talk w/ my colleague @JohnCornyn over some lunch. As the senior Senator in Texas, he has great insight on the border situation.",6,3
490177419182374912,2014-07-18 16:52:58,CBP says they can’t accept food donations from the business community. Doesn't seem to make sense. What do you think? #BorderCrisis,2,2
490176839626006528,2014-07-18 16:50:40,I'm touring the CBP's new facility in Texas to try and handle the surge in unaccompanied minors along the southern border. #BorderCrisis,1,0
490176188552597504,2014-07-18 16:48:05,Asking CBP about the flow of unaccompanied children across the border #BorderCrisis http://t.co/6U7pFmwCiM,3,4
490142507226128384,2014-07-18 14:34:14,The Customs &amp; Border Patrol in McAllen is the busiest station in the US w/over 3000 permanent agents #BorderCrisis http://t.co/X0GGAOpEMy,3,0
490136278168776706,2014-07-18 14:09:29,Pastor Chad Mason talks about his frustration in having 100s of ppl willing to help but are stuck in red tape http://t.co/q6VFnm5HZi,4,0
490120917918679040,2014-07-18 13:08:27,The Mayor of McAllen TX is sharing how his town handles the flow of unaccompanied children across the southern border http://t.co/14LSMz52ct,5,3
490120554184450048,2014-07-18 13:07:00,"Today I'm in McAllen, TX to see firsthand the conditions on the U.S.- Mexican border.",4,4
489861430314020864,2014-07-17 19:57:20,"Such tragic news about the Malaysian Airlines flight that crashed in eastern Ukraine, praying for the family and friends of those onboard,",6,0
489424766663921665,2014-07-16 15:02:12,Congrats to Adm Robert Papp for being the 1st U.S. Special Rep to the Arctic &amp; Fran Ulmer on becoming Spec Advisor on Arctic Science&amp;Policy!,8,0
489128553058172928,2014-07-15 19:25:09,I love this story about preserving Alaskan native languages by making the most of 21st century technology! http://t.co/RTpIjFXa2S,5,2
489064214192201729,2014-07-15 15:09:29,.@HooDooBrew has been nominated for the Best Craft Brewery in America! Make sure to cast your vote here: https://t.co/zBhr4Kqb9s,6,1
489039589282435072,2014-07-15 13:31:38,"#OnThisDay in 1923, Pres. Harding drove in the Golden Spike to signify the completion of the @AKRR. http://t.co/EvSz33V9Mi",3,1
487305741511196672,2014-07-10 18:41:57,"@NMoralesNBC visited Juneau &amp; explored the beautiful Mendenhall Glacier. Next time, bring the whole @TODAYshow to AK! http://t.co/ba89WGcQYh",4,20
487274243085066241,2014-07-10 16:36:47,RT @ktva: King Cove residents write to @BarackObama for help: http://t.co/GHendPSeoE,3,0
486897713255292928,2014-07-09 15:40:35,87 years ago the Alaska State Flag was first flown in public. Happy AK Flag Day! http://t.co/qno9eoJeQ7,23,14
486539983445319682,2014-07-08 15:59:06,"My 2nd group of interns are here from Fairbanks, N. Pole, Juneau, Petersburg, Unalaska, Palmer, ER and Ketchikan http://t.co/lKBHkvUOR6",2,4
486191589879201792,2014-07-07 16:54:42,"RT @BeschlossDC: Here is Ansel Adams' rendition of Alaska, whose statehood bill was signed by President Eisenhower this day 1958: http://t.…",137,0
486174376703053824,2014-07-07 15:46:18,"#OnThisDay in 1958, Pres. Eisenhower signed the Alaska Statehood Act, clearing the way for us to become the 49th state!",16,8
484462446439321600,2014-07-02 22:23:42,Chatting with @DenaliBrewing GM Sassan Mossanen about his small business success story! (BTW: try the Mother Ale) http://t.co/MnLRgbleBo,5,7
482621159020961792,2014-06-27 20:27:05,Greg Kaplan and friends are manning the grill @ the Commerce's Military Appreciation Picnic at Ft. Richardson! Yum! http://t.co/6tWgMIMf1E,8,4
482274092255809537,2014-06-26 21:27:58,Today I gave DHS a deadline to decide and explain on TPS for Filipinos displaced by Typhoon Haiyan #TPSnow,14,15
482224875915214849,2014-06-26 18:12:24,RT @USOlympic: Have plans next Tuesday afternoon? Cancel them. #USMNT is on to the Round of 16! #1N1T http://t.co/RTeZDeprZI,1119,0
481805115238936576,2014-06-25 14:24:25,Talking with @KTVA11Daybreak around 6:45am - tune in if you can!,1,1
481515096649531392,2014-06-24 19:11:59,"Feels weird to talk NFL in July, but ... MT @Ch2KTUU Seahawks plan 2 Alaska visits in July, bringing Lombardi trophy http://t.co/uUewFhA9V7",6,4
481185614873001984,2014-06-23 21:22:45,"FYI to coastal Alaska, NOAA has announced a tsunami alert. If you're there, be careful and seek higher ground. http://t.co/Pn1uHrWmTV",8,1
481064469641318400,2014-06-23 13:21:21,Hiked Flattop this weekend - felt like I was on top of the world! http://t.co/7rs3HIvMYQ,1,3
480816769016537088,2014-06-22 20:57:05,Great news for Alaska and the nation: the MDA had a successful missile defense test today over the Pacific! http://t.co/Y8wRoqbh33,9,8
479757999452737536,2014-06-19 22:49:55,I love this video tribute to Harry Race Pharmacy in Sitka! They're a nominee for 'Pharmacy of the Year.' http://t.co/BJckE6jwWp #GotMyVote,3,2
478643982634057728,2014-06-16 21:03:12,@HFRevolution I walk to/from work every chance I get - and use the elevator as little as possible.  (My office is on the 7th floor),3,10
478643601199874048,2014-06-16 21:01:41,RT @ENR_GOP: @lisamurkowski briefing CQ reporter Lauren Gardner on the energy challenges facing Alaskans. http://t.co/MTwXy0DSmR,1,0
478632953447448576,2014-06-16 20:19:23,A lot of Alaskans wish the U.S. Men's World Cup team good luck against Ghana today!  #USAvGHA,8,4
477137395666931712,2014-06-12 17:16:34,RT @AKSeafoodNow: RT if you're watching the live stream of the Alaska sustainable seafood discussion with ‘Deadliest Catch’ star @crabwizar…,2,0
477079817595392001,2014-06-12 13:27:46,Thanks @BowieBaysox for the fun game for me and my visiting family!  Next best thing to @AlaskaBaseball http://t.co/v6zLlLtJiU,5,6
476353567587311617,2014-06-10 13:21:55,"Way to go, Alaska Aces!  2014 Kelly Cup champions! http://t.co/cnFZv5hIeH",4,0
476127524964294656,2014-06-09 22:23:42,"An Alaska-sized congrats to Lynn Hootch, of the Emmonak Woman's Shelter, for being elected to the NCAI Taskforce on Violence Against Women!",6,7
475006885985521665,2014-06-06 20:10:41,"70 years after D-Day, it's important to remember, but also recall Alaska's lesser-known WWII past as well. http://t.co/hSq50Y7S90",7,4
474955768392077313,2014-06-06 16:47:34,"RT @ThomasBoswellWP: Accidentally ""hot gym"" or locker room  is as old as basketball. Auerbach/Celts used it. Silver should move Game 2 to n…",6,0
474639504293494786,2014-06-05 19:50:50,On the floor of the Senate talking about new EPA proposals.  Watch here: http://t.co/IOJ55uf7Rn,2,2
474224313907048449,2014-06-04 16:21:01,It's 'Bike to Work Day' in Anchorage today.  http://t.co/CwPqP2VhWP RT if you pedaled to your job today! #Bike2Work,3,0
473960179713572864,2014-06-03 22:51:27,Welcoming my summer interns to the office and teaching them about the U.S. Senate.  Such great young Alaskans! http://t.co/W88hZm6Uqr,11,10
472475946701033473,2014-05-30 20:33:38,Game 1 of the Kelly Cup tonight in Anchorage: Let's go Aces! http://t.co/nVjdYbAd3Y #MoreCowbell,3,5
472092413453148161,2014-05-29 19:09:37,RT @Niebrugge: This interesting guy is biking around the world!  http://t.co/WJpheKwvxD http://t.co/f7R4h3TGxW,2,0
471389889196748801,2014-05-27 20:38:02,RT @chillygal: We always celebrate Senator's @lisamurkowski May birthday during the Annual Spring Luncheon here in #Fairbanks http://t.co/z…,1,0
469922917044985856,2014-05-23 19:28:48,"This Memorial Day weekend, let's all remember that freedom is not free. http://t.co/H1wowNfdpn",5,4
469919241559609344,2014-05-23 19:14:12,"Hey @courtscott, thanks for the Alaska tourism shout out!  Alaska is the most beautiful place on earth - yes, I'm biased. #TravelAK",5,5
469598708917891073,2014-05-22 22:00:31,@ambdermer Thank you very much taking the time to come in and visit earlier today! http://t.co/6JtgI5ho0y,0,0
469526133776846850,2014-05-22 17:12:08,My Frankenfish-labeling amendment just passed the Senate Appropriations Committee. That's a birthday present to me and wild Alaska salmon!,11,13
469483334733922304,2014-05-22 14:22:04,"What a great birthday surprise from my staff and colleagues!  Thank you, everyone. http://t.co/5kke7qFvDm",3,12
469228484012032000,2014-05-21 21:29:23,Spouses &amp; children share the burden of service. They deserve access to programs to help them cope w/the transitions http://t.co/FxL6N3l10J,2,1
467771681592053761,2014-05-17 21:00:34,"Thanks, @YFALS for putting together today's corntoss challenge!  Good times for a great cause! http://t.co/dgfJKmLu5J",2,0
467367461449629697,2014-05-16 18:14:20,"It's National Bike to Work Day!  If you can, leave the car behind and get pedaling! http://t.co/aFxWuz63mz",3,2
467034607125553152,2014-05-15 20:11:42,"Happy National Book Week!  I just donated my 9,500th book to promote Alaska reading! http://t.co/2bqgHbT57K http://t.co/1J8fmosG6B",3,3
466715578628317184,2014-05-14 23:03:59,@WARojas Thanks for sharing the story about the big @YFALS bean bag toss this weekend! http://t.co/lJL0mrtdFX,0,0
466689200956637184,2014-05-14 21:19:10,Gearing up for a little bean bag competition with @YFALS on Saturday to fight Lou Gehrig's Disease: http://t.co/lJL0mrtdFX,8,2
466609207509520385,2014-05-14 16:01:18,Last night I represented Alaska at the National Law Enforcement Memorial Candlelight Vigil. Such a stirring event. http://t.co/ejADeE6aXR,3,1
466310535915765761,2014-05-13 20:14:30,Big thanks to @AlaskaPublic for showcasing Mike Anderson and his gourmet hot dog stand in Anchorage! http://t.co/smPZ8QxaW5,4,1
466258833455988736,2014-05-13 16:49:03,Thanks! RT @WomensHealthMag Senator Lisa Murkowski's smart blog for WH on the scary truth about Frankenfish: http://t.co/4nZOFobnUx,9,5
466254486760325120,2014-05-13 16:31:46,"Congrats to the Baldiviez family, owners of ""House of Bread"" &amp; winners of the AK Small Business Persons of the Year! http://t.co/wEBvrmIt1e",2,3
465929917541392384,2014-05-12 19:02:03,Best flight ever? Flying to Fairbanks Saturday with the Last Frontier Honor Flight &amp; a crystal-clear view of Denali? http://t.co/3BWLc3pVuc,4,8
464837925025644544,2014-05-09 18:42:52,"Took way too long, but I'm glad Fish &amp; Wildlife Service finally saw reason. The wood bison's coming back to Alaska. http://t.co/ZBpaBPJjXs",7,4
464530601568399360,2014-05-08 22:21:40,#AKHonorFlight came to Capitol Hill today; what a thrill and honor to spend time with these heroes! Watch here: http://t.co/3W6CgNJQWf,2,0
464507876607004672,2014-05-08 20:51:22,It's an honor to co-sponsor the #SAVAct and help our returning combat veterans deal with the internal toll of war http://t.co/yVxSOZ2ZMY,5,2
464476835599110144,2014-05-08 18:48:01,RT @alsadvocacy: @lisamurkowski rocks the fight against ALS. She knows ppl on the jacket &amp; cares. @ReginaHolliday #ALSA14 http://t.co/MqGb6…,8,0
464462531017580544,2014-05-08 17:51:11,It was an honor to visit and meet with the #AKHonorFlight today! http://t.co/GmluzFnPFM,11,4
464457120050851840,2014-05-08 17:29:41,RT @ktva: Have you seen our #AKHonorFlight photo gallery? http://t.co/eRd7CqJvUQ http://t.co/J9JCDtX8ES,3,0
464171466645594112,2014-05-07 22:34:36,"What a great news story about the ""The Kodiak Kid"" becoming a country music force in Nashville! http://t.co/8TCSrCa1hB",10,3
463822404972601344,2014-05-06 23:27:33,MT @ktva Some of Alaska's bravest men &amp; women waiting to board the #HonorFlight to D.C. http://t.co/Zn250e2r2P / Can't wait to visit w/them!,7,2
463811558305300480,2014-05-06 22:44:27,"To honor the two fallen Alaska State Troopers, I shared their memory on the Senate floor. http://t.co/45mzekdRTL",4,2
463726044131106816,2014-05-06 17:04:39,"It's National Teacher Appreciation Day, and I want to encourage everyone to #ThankATeacher! http://t.co/bG55T8kSnf",2,1
463713810579091458,2014-05-06 16:16:02,Congrats to this year's AK Prudential Spirit of Community Award winners: Katherine Dolma and Leah Smith! #AlaskaGirls http://t.co/rHWU8qRxwt,3,6
463434727907524608,2014-05-05 21:47:04,"Up in Fairbanks today, they had the #FirstFlight of a new unmanned aerial tool to research and monitor wildlife! http://t.co/qwaLGNATlZ",7,1
461237201612075008,2014-04-29 20:14:52,RT @ENR_GOP: @lisamurkowski headed to the Senate floor to talk about the benefits of approving the #KeystoneXL pipeline. http://t.co/sBPonZ…,4,0
461224681287450625,2014-04-29 19:25:07,"RT @Senate_GOPs: Photo of the week goes to @lisamurkowski. Looks like you had a great time, senator! http://t.co/XXjSukwfVp",4,0
461223742723878912,2014-04-29 19:21:24,Great testimony from @mikeroweworks today on the House @NatResources hearing on American #Energy jobs. Watch here: http://t.co/VEtA3Wn2N7,7,1
461196354413264896,2014-04-29 17:32:34,Congratulations to the 2014 BP Teachers of Excellence! http://t.co/6EJW2lkASh,4,2
459470718913482752,2014-04-24 23:15:30,#Alaska #Native #healthcare has been shortchanged for years &amp; now $96m is finally on its way to help make up for it: http://t.co/n1gIlSj2NA,1,0
459419200612990976,2014-04-24 19:50:47,Thanks to @AjitPaiFCC yesterday @FCC Open Meeting for recognizing Alaska’s concerns with mandating an increase to local telephone rates.,0,1
457319688314568704,2014-04-19 00:48:04,RT @ktva: Sen. @lisamurkowski stopped by this afternoon. Tune in at 5pm &amp; 6pm for her interview with @emilyreporting #akleg http://t.co/24W…,3,0
457264516787896321,2014-04-18 21:08:51,Here's what I think about the #KeystoneXL delay: http://t.co/g6isBnKQHY,9,1
457240997303316480,2014-04-18 19:35:23,Only way #Alaska girls get around Point Hope for #SpringWhaling! Glad my staff trusts my snowmachine driving skills http://t.co/0nbXzc25yP,4,10
456931825420496896,2014-04-17 23:06:51,Talking Point Hope traditions &amp; waiting for wind to die down w/ alutiġaaq (caribou &amp; gravy over rice) #SpringWhaling http://t.co/BLeAM6ICif,4,3
456866278326542336,2014-04-17 18:46:23,Ice conditions here in Point Hope have improved and the whales are coming through. They are close to shore now! http://t.co/TyqZvwvSMj,1,1
456777207549947904,2014-04-17 12:52:27,Had a great time up in Point Hope w/Alaskans during spring whaling. Thank to everyone for the visit! http://t.co/JRFJrVMBHP,1,1
456195711759953921,2014-04-15 22:21:48,RT @ENR_GOP: @lisamurkowski provision blocking feds from demolishing veteran allotment cabin signed into law by President Obama. http://t.c…,2,0
455797965572308992,2014-04-14 20:01:17,RT @nicolasdory: Driving over the frozen Arctic Ocean. Ice road to Aklavik and Tuktoyaktuk. #Canada #NWT #Arctic http://t.co/SN3BCiSRYd,39,0
455791111995658240,2014-04-14 19:34:03,@brooksha1 it was so good to spend time with you and I enjoyed reading your re-cap of your trip! Come back anytime! http://t.co/clrs2kqy4b,2,0
454273148847153152,2014-04-10 15:02:13,@AmyAHarder It's an easy mix-up.. it happens more than you'd think! No hard feelings here! @CQEnergy @SenLandrieu @SenatorBarb,3,3
453623887872688128,2014-04-08 20:02:17,Proud that we offered an amendment to support equal pay for equal work. @SenatorCollins @KellyAyotte @SenatorFischer http://t.co/rH0kWTfRoD,4,2
453615260868829186,2014-04-08 19:28:00,Speaking to the YKHC 21st Tribal Gathering from DC through video conference. Technology makes connecting to #Alaska so much easier.,0,0
453321785627648000,2014-04-08 00:01:50,USA needs better #Arctic policy now. Here’s why: http://t.co/mZiRdimGkZ,13,3
453316818141466624,2014-04-07 23:42:06,At @Georgetown speaking to some bright young students http://t.co/RGv5eMvnRu,7,10
453313146573561856,2014-04-07 23:27:30,"This evening- I am speaking to students @Georgetown about my story, #energy and #women in politics.",4,2
453298859784302592,2014-04-07 22:30:44,I voted to #RenewUI with structural reforms to get people back to work: http://t.co/6PqXWnqZDF,10,7
453294418767134722,2014-04-07 22:13:05,Well- the #ArcticNation continues- lets get off the sidelines and start making things happen in the #Arctic http://t.co/WW2OPqVHRb,1,3
453250140149923840,2014-04-07 19:17:09,"""I hope its clear that we have such opportunity and such capacity for growth in the #Arctic."" #ArcticNation",1,2
453249508168978432,2014-04-07 19:14:38,"""We (#Alaska) truly are the gateway between the Pacific and the Arctic"" #ArcticNation",1,3
453247808112705536,2014-04-07 19:07:53,"""With the decreasing amount of sea-ice in the Arctic, we are seeing a corresponding increase in maritime activity."" #ArcitcNation",1,2
453246198875697153,2014-04-07 19:01:29,"""China, South Korea, and Japan each have ice breakers."" #ArcticNation",2,2
453245809791094784,2014-04-07 18:59:56,"""From an economic perspective, the Arctic will help create jobs and economic growth in areas facing extraordinary challenges"" #ArcticNation",3,1
453245558116077568,2014-04-07 18:58:56,"""From a foreign policy perspective, the Arctic is an area for cooperation and relationship building"" #ArcticNation",4,2
453244675965853696,2014-04-07 18:55:26,"""It doesn't seem to be important enough to the Administration to be a priority"" #ArcticNation",2,1
453243727906369537,2014-04-07 18:51:40,The Admin. Released its National Strategy for the Arctic Region..it was just a glorified memo with plenty of gaps #ArcticNation,6,1
453243596989546496,2014-04-07 18:51:09,Disappointed with the general lack of resources the Administration has invested in this important issue. #ArcticNation,3,3
453238403900116992,2014-04-07 18:30:30,We need to make #Arctic matters a priority now. Gearing up to speak on the #Senate floor. Watch here: http://t.co/D5qNmpBYou,5,0
452144785038774272,2014-04-04 18:04:51,Good news for SE #Alaska schools &amp; roads: $14mil+ is on its way from @forestservice http://t.co/IKai3Kh24Z,4,2
451877084047347712,2014-04-04 00:21:06,We need to crack down on #syntheticdesignerdrugs coming into #Alaska villages via the Post Office:  http://t.co/eZBYu5AJfQ,2,2
451867545935839232,2014-04-03 23:43:12,#Pirate fishing needs to stop. Two treaties I have been working on will help:  http://t.co/5wFd46OViU,9,1
451806982375497728,2014-04-03 19:42:33,#TedStevens’ prosecutors were unethical &amp; found guilty of misconduct yet still work @ #DoJ. This is harsh discipline? http://t.co/jsYAblOoch,5,9
451773092164296704,2014-04-03 17:27:53,@SecretaryJewell thinks stationing @uscoastguard near #KingCove is an alt to a life-saving road but $ doesn’t add up http://t.co/c6MyOK6lTD,2,0
451738908909649920,2014-04-03 15:12:03,RT @SenateApprops: @lisamurkowski tells @TheJusticeDept Alaska needs help stopping drug shipments via @USPS &amp; clearing the name of former S…,2,0
451535608872452096,2014-04-03 01:44:12,90 villages in #Alaska don’t have law enforcement. #Tribal courts could help:  http://t.co/3fDGrCUS3O,13,11
451142046573920256,2014-04-01 23:40:20,@uscoastguard does 5th medevac out of King Cove. We have safer &amp; saner path. @Interior: build the road! #Peoplefirst http://t.co/toUNtgjm7C,0,0
450798007349690368,2014-04-01 00:53:15,My #VeteranSpotlight is on Soldotna #Alaska resident Gary Turner. Learn more about this amazing Alaska #veteran here: http://t.co/itglCGJByd,2,2
450735630973407233,2014-03-31 20:45:23,Happy #SewardsDay #Alaska!  Best $7.2mil we’ve ever spent:  http://t.co/GGSshPpAsc,13,8
450704897772904448,2014-03-31 18:43:15,"RT @ENR_GOP: Women in power: ENR Chair Landrieu, FERC Chair LaFleur, and ENR Ranking Member Murkowski at recent EEI conference. http://t.co…",13,0
449680017954725888,2014-03-28 22:50:45,Happy birthday Dad! http://t.co/ZMNFnh7mJX,4,0
449340545618702338,2014-03-28 00:21:49,I’m still looking for #justice for Ted Stevens &amp; to ensure no one else faces injustices. Here’s what #FBI said today: http://t.co/IiY8T8m8zC,5,5
449258502692040704,2014-03-27 18:55:48,Heading to #Senate floor to talk about #64quake &amp; impacts it’s still having on #Alaska 50 years later. Watch live: http://t.co/6DEfYjXiGq,4,4
449224241909481472,2014-03-27 16:39:40,"Today, my staff &amp; I will #ChooseRespect. Will you, #Alaska? http://t.co/2fONtomiLQ",5,4
448989037182083072,2014-03-27 01:05:02,I welcome today’s decision on the #Tongass roadless rule. Here’s why:  http://t.co/gczE2mwFDe,2,0
448530483018625024,2014-03-25 18:42:55,Meeting with @uscoastguard Vice Admiral Paul Zukunft in my D.C. office about the future of the #USCG http://t.co/YyOuYjhnS7,2,1
448258852891680768,2014-03-25 00:43:33,1 step closer to making the #honeybucket a thing of the past in #Alaskan homes: http://t.co/3cAWOIZ4Ub,6,4
448107718902300672,2014-03-24 14:43:00,"RT @ENR_GOP: Nothing dinky about this pin from North Pole, AK. Proud home of Santa Claus and Eielson Air Force Base. Wear it proud http://t…",2,0
447145970782838784,2014-03-21 23:01:21,It’s Qaspeq/Atikluk/#KuspukFriday in my #Anchorage office! http://t.co/VJDPto3wM1,8,3
447077312723709952,2014-03-21 18:28:32,#Alaska 3rd in nation for #maritime jobs! Water shipping/transportation even more important as the #Arctic opens up http://t.co/5K6NqZvFMk,4,2
445304515961430016,2014-03-16 21:04:04,Love #Alaska in Winter! Walking through the beautiful Ice Maze at the Ice Park in #Fairbanks http://t.co/NmVz7ZqWxY,5,5
444624986385698816,2014-03-15 00:03:52,"#Liberty and #Justice for all, not Liberty and Justice for most:  http://t.co/Y5pu95PRop",6,5
444270546197688320,2014-03-14 00:35:27,Good News for #Alaskas: We fixed #FEMA’s fuzzy math today w/ Homeowner Flood Insurance Affordability Act http://t.co/hY48OqphVN #FixFlood,10,0
444258665982603264,2014-03-13 23:48:14,Proud Child Care &amp; Development Block Grant Act we passed includes my important #Alaskan measures: http://t.co/ZflirJsY70 #CCDBG #care4kids,4,1
444216080022532096,2014-03-13 20:59:01,Love connecting w/ #Alaska classrooms- Today I Skyped w/ Ms. Moody's class in Coffman Cove about #WomensHistoryMonth http://t.co/CtIfepqKiN,2,9
444204673017610240,2014-03-13 20:13:41,"#Frankenfish could harm health, environment &amp; economy, so I demanded @US_FDA guarantee it’s safe before approval http://t.co/PhPP5WppUf",3,3
443897226331701248,2014-03-12 23:52:00,My amendment to the Child Care and Development Block Grant passed! Great start for #Native kids &amp; families #Care4Kids http://t.co/t119DZlktG,5,2
443880372133437440,2014-03-12 22:45:02,The #Arctic MUST be a #budget priority. I asked @DHSgov about Homeland Security’s Arctic agenda today:  http://t.co/zhqmf0vf76,6,0
443811643227533312,2014-03-12 18:11:56,Good to talk w/ @YukonPremier about what #Canada is doing in the #Arctic &amp; what we can learn from them http://t.co/EzVthyVoxV,12,6
443744967648096257,2014-03-12 13:46:59,Speaking at the NCAI conf. about IHS and BIA Budgets- also asking for their help with King Cove. http://t.co/4W9wVqeUrR,5,1
443503787656110080,2014-03-11 21:48:37,"Quick reminder that today is World Plumbing Day, to appreciate those who directly help our health and public safety. http://t.co/7Vq29IAPwi",3,1
443484174495023104,2014-03-11 20:30:41,"Feeling #AKPride about the great #Iditarod performances by the competitors, shared my thoughts on the Senate floor http://t.co/Zhhp3hv6Wr",4,0
443480925960409088,2014-03-11 20:17:46,I met with the Malchea family this morning from AK #JDRF who are participating in #JDRFGovDay http://t.co/Bj2Sc5u6nM,7,13
443431043367198722,2014-03-11 16:59:33,"I am on the Senate floor congratulating @DallasSeavey, Aliy Zirkle and all of the #iditarod2014 mushers.",3,7
443374287290789888,2014-03-11 13:14:02,"Congrats, @DallasSeavey for winning #Iditarod42!  Your come-from-behind win kept Alaska up all night! http://t.co/nYbBDY7HKl",3,3
443357135154741248,2014-03-11 12:05:52,"Congrats, @DallasSeavey!!!",4,2
443152082502430720,2014-03-10 22:31:04,"I’ve voted to pass Victims Protection Act, but we still need tougher measures to stop #MilitarySexualAssault http://t.co/UtUjjTCyIt",9,3
442064444802482176,2014-03-07 22:29:11,RT @emilyrfiles Maggie Avila is the only girl on Thorne Bay HS Wolverines basketball team. http://t.co/mERc3iSzmG // Tough Alaska girl!,1,5
441745482256097281,2014-03-07 01:21:44,Today we are one step closer to better protections for victims of #MilitarySexualAssault http://t.co/A92iFJUSfY,2,2
441667465328996352,2014-03-06 20:11:44,RT @BillsandBrews: Impressed with Sen. @lisamurkowski's goal to hit every #craftbeer brewery in Alaska! We may need to come film part of yo…,6,0
441655850617569280,2014-03-06 19:25:35,Proud to have just cast my vote to reform justice for military sexual assault victims #MJIA,3,8
441641006027784192,2014-03-06 18:26:35,Months of work &amp; FINALLY a vote on #MilitarySexualAssualt protections – Heading to Senate floor now. Watch live: http://t.co/D5qNmpBYou,7,1
441333168218439680,2014-03-05 22:03:21,Obama’s #budget ignores serious needs in the #Arctic http://t.co/9FSIQ2cths #BudgetFail,6,0
