id,created_at,text,retweets,favorites
235153433777278976,2012-08-13 23:18:42,The Obama administration's plan for NPR-A development is too restrictive &amp; denies U.S. taxpayers both revenue &amp; jobs: http://t.co/joYgceYR,6,0
235140401714044929,2012-08-13 22:26:55,"I was saddened to hear of the death of former AK legislator Al Adams. He was a statesman, an advocate and a friend. http://t.co/mLdo1AUD",0,1
234351646602326016,2012-08-11 18:12:41,Today's Ryan pick shows Romney is ready to face our fiscal issues head-on http://t.co/dfmDuL2F,4,1
234278893652148224,2012-08-11 13:23:35,Mitt Romney’s selection of Rep. Paul Ryan is a serious pick for a serious time. America needs bold &amp; intelligent problem solvers right now.,4,0
234062579004227584,2012-08-10 23:04:02,"Two years after his death, Eielson’s Joint Mobility Complex was dedicated to Uncle Ted. Watch the entire ceremony here: http://t.co/uRLqbkjg",0,1
234038137150664704,2012-08-10 21:26:54,"Hey Ketchikan, come to my office’s open house at 4pm to meet the newest member of my team in Southeast: Sonia Henrick. http://t.co/ReonZPUp",0,0
234020263853957120,2012-08-10 20:15:53,Good to see the Obama administration responding to my call for increased consultation with tribes &amp; AK Native Corps: http://t.co/45UvUegy,2,1
233974098798190592,2012-08-10 17:12:26,"I am so glad to be home in Alaska!  In just a week, I have been all over our great state working hard for Alaskans. http://t.co/Sdk3y60V",0,0
233957186072625152,2012-08-10 16:05:14,"Ketchikan, coming your way! Hope many of you can make it to my 4pm open house. http://t.co/ReonZPUp",1,0
233813461346422784,2012-08-10 06:34:08,"Had a great time in Fairbanks today enjoying the sunshine, food, and great people at the #TananaValleyFair http://t.co/bl4iJC2K",0,0
233702933341032450,2012-08-09 23:14:55,"On a day of remembrance, the Joint Mobility Complex at Eielson is dedicated to Ted Stevens http://t.co/4Sdht66C",4,0
233702293860667392,2012-08-09 23:12:23,"On a day of remembrance, the Ted Stevens Joint Mobility Complex opens at Eielson.  http://t.co/WHNtVnj2",2,0
233680588534595584,2012-08-09 21:46:08,"At Eielson AFB, where they are remembering Ted Stevens today. (A dog tag reads ""Uncle Ted') http://t.co/1VDHXuyH",2,1
233644753202331648,2012-08-09 19:23:44,"I'm in Fairbanks today for a few events, so I took the time to visit the Ted Stevens gallery at UAF. http://t.co/PRz4nBWl",0,0
233594888032239616,2012-08-09 16:05:35,"It's been two years since we lost Uncle Ted, and I join Alaskans in remembering him. http://t.co/TzY6iODB",4,1
233386879867826176,2012-08-09 02:19:02,What could it cost Alaskans? 61% of businesses (many in AK) are worried about higher costs from the health care law http://t.co/M5m6ti3r,5,0
233353705506889729,2012-08-09 00:07:13,So proud of all 4 former Alaskans in the Olympics! Janay DeLoach from Fairbanks just won the bronze in the long jump http://t.co/p4Tu33Bn,12,3
233302624802336768,2012-08-08 20:44:14,My trip to the Bertholf did something unbelievable: Made me even more impressed by the Coast Guard. http://t.co/HaazShub,2,0
233266563757780993,2012-08-08 18:20:57,Papa John's owner says he's going to need to raise prices because of health care reform taxes. http://t.co/PASRTj0v,2,0
232950092926177280,2012-08-07 21:23:24,Alaskans deserve clarity when it comes to sequestration cuts. The bill I co-sponsored for transparency became law today http://t.co/X5xfnYtl,1,1
232928605691322369,2012-08-07 19:58:01,We need more icebreakers &amp; resources for the Coast Guard to be able to do its job in Alaska: http://t.co/7R3pC9ft,4,0
232535892978442240,2012-08-06 17:57:31,Tune in now to watch my colleague Senator Landrieu and I hold a field hearing on Kodiak. http://t.co/arAn6xsQ (Sorry about the glitch),1,0
232527715910156288,2012-08-06 17:25:02,"Alaska, my webstreamed Senate hearing from Kodiak with Sen. Landrieu will be online very soon. Tune in at http://t.co/arAn6xsQ",1,0
231920655262703616,2012-08-05 01:12:48,@SenJohnHoeven and I are touring the AK North Slope village of Kaktovik today: home to the only people living in ANWR http://t.co/DuB0Fs9W,2,0
231184682862120960,2012-08-03 00:28:19,Today was the last day for my 2nd Session high school interns. I continue to be impressed by the young people from AK! http://t.co/nKp1v5Di,1,0
231120599165042688,2012-08-02 20:13:39,Ted Stevens was there for our military. We can honor his contributions by naming a U.S. Navy warship after him: http://t.co/W9QURPSS,8,0
231099854921797633,2012-08-02 18:51:13,"A U.S. Navy warship named after Ted Stevens, new health care taxes &amp; the Law of the Sea in today’s Morning Meeting: http://t.co/dmHCEhiA",1,0
230843924581859329,2012-08-02 01:54:15,"So happy my resolution to make September 9, 2012 “National Fetal Alcohol Spectrum Disorders Awareness Day” has passed the Senate!",3,1
230831496762638336,2012-08-02 01:04:52,I spoke on the Senate floor to raise the profile of the tsunami debris threat we face &amp; to demanded federal action: http://t.co/C45553cp,3,0
230781407054688256,2012-08-01 21:45:49,Tune in NOW to hear about the immediate threat of Japanese tsunami debris in Alaska.  Watch live on C-SPAN2: http://t.co/eOvSF44A,1,0
230778685702152192,2012-08-01 21:35:00,I will speak on the Senate floor in 10min about the tsunami debris threat to Alaska &amp; US coast. Watch live on C-SPAN2 : http://t.co/eOvSF44A,0,0
230737342313422848,2012-08-01 18:50:43,"Tsunami debris, low cost housing for veterans &amp; addressing misconduct in TSA: it’s all in today’s Morning Meeting: http://t.co/d9jOXXMg",2,1
230414097861210113,2012-07-31 21:26:16,"In her 101 years, Mary Louise Rasmuson was a pioneer &amp; visionary for Alaska. I mourn her passing &amp; honor her memory http://t.co/rWnSsziv",4,0
230389778753929216,2012-07-31 19:49:38,"Today in Subcommittee, I halted the proposed move of F-16s and 600 airmen from Eielson AFB for at least a year: http://t.co/LMpG3no2",2,0
230371727954309121,2012-07-31 18:37:54,@SenLandrieu coming w/ me to Kodiak for a U.S. Senate field hearing w/ Admiral Papp &amp; others on Coast Guard priorities: http://t.co/jwoGzVUN,0,0
230081851031695360,2012-07-30 23:26:02,"My fav #Olympics events?  Swimming, gymnastics and soccer, plus I love cheering on the Alaskans on the US Olympic Team: http://t.co/KeF11zUt",2,0
230037417359462400,2012-07-30 20:29:28,Some of AK’s waters haven’t been mapped since Capt. Cook. The USS Fairweather will give fishers &amp; shippers new data: http://t.co/NgGQ8tIO,2,0
230026872308789249,2012-07-30 19:47:34,"Alaska is home to 75,000 veterans. I support the Stolen Valor Act because no one should lie about military service: http://t.co/UaTfcKfL",3,0
229725596274544641,2012-07-29 23:50:25,I got to listen to the Thunderbird pilot's communication during this year's Arctic Thunder Air Show http://t.co/Rpvo2rkh,1,0
229713498786103296,2012-07-29 23:02:22,A little summer wind isn't stopping us from enjoying an Alaskan tradition: the Arctic Thunder Air Show! http://t.co/jLoJLg8Z,1,0
229385409862463489,2012-07-29 01:18:38,It is important to remember what you are fighting for! Enjoying beautiful AK by hiking Flat Top. Happy Ted Stevens Day! http://t.co/XPKgtOMG,5,0
229370500600713216,2012-07-29 00:19:23,I hope everyone is getting out and playing on this gorgeous Ted Stevens Day! #UncleTed http://t.co/eYmNveYi,4,0
229306103668830209,2012-07-28 20:03:30,It is Ted Stevens Day!  Let's all get out and play Alaska! http://t.co/4YqFn111,3,0
229028420271632385,2012-07-28 01:40:05,Keep the grocery prices coming Alaska! http://t.co/V09f4Ylk Send pictures of prices in your community to: Prices@murkowski.senate.gov,6,0
229024351117266945,2012-07-28 01:23:55,Don’t forget to celebrate Ted Stevens Day tomorrow by getting out and enjoying Alaska’s great outdoors! http://t.co/iLrOtLt4,9,0
228952985802248192,2012-07-27 20:40:20,"I'm co-sponsoring a bill to clarify the tax code for air taxis and charters, to keep Alaska's skies open for business. http://t.co/DmR14zDl",2,0
228659929051975680,2012-07-27 01:15:50,"The Domestic Energy &amp; Jobs Act will open offshore opportunities &amp; the NPR-Alaska, creating jobs &amp; energy independence: http://t.co/xhwCUz9B",3,1
228628044741476353,2012-07-26 23:09:08,A new EPA policy will have little effect on improving AK air quality &amp; a big impact on already sky-high grocery prices http://t.co/pYtFQ4nV,2,0
228598898787237888,2012-07-26 21:13:19,"I'm walking down to the Senate floor to discuss how the EPA just doesn't ""get"" Alaska. You can tune in on C-SPAN2.",1,0
228584003219902465,2012-07-26 20:14:07,"Going to the Senate floor at 1pm AK  to talk price hikes that would come with new EPA rules, and taking some AK pics. http://t.co/XPKgtOMG",1,0
228567775273160704,2012-07-26 19:09:38,"Agriculture Dept wants ""meatless Mondays."" How do we tell Alaskans living off moose and caribou? #Overreach http://t.co/PLEiT4wE",3,1
228558633267511299,2012-07-26 18:33:19,Thanks to Alaskans who shared pictures of our sky-high prices. I’m taking them to the Senate floor to make our case! http://t.co/XPKgtOMG,3,1
228541256622567426,2012-07-26 17:24:16,I told the White House I’m concerned the UN Arms Treaty being negotiated could overreach into Alaskans firearm freedoms http://t.co/1LdJSlXZ,2,0
228279987889909760,2012-07-26 00:06:05,The tax plan that passed the Senate today hurts job creators: it’s like handing the pink slip to everyone in Denali borough #1800AKJobsLost,5,1
228251550852710401,2012-07-25 22:13:05,"President Obama, 2009: “You don’t raise taxes during a recession.” http://t.co/DfN7ANTD  July, 2012? Different story.  #1800AKJobs",43,4
228244025801584640,2012-07-25 21:43:10,"Ernst &amp; Young says today’s tax bill means 1,800 Alaska jobs lost: http://t.co/Ppf9hQr8",22,1
227917297854074880,2012-07-25 00:04:52,"Moments ago, my resolution unanimously passed the Senate, making August 16National Airborne Day to honor those who defend our nation's skies",2,0
227857150146387968,2012-07-24 20:05:52,Should taxpayer $ be used to expand the use of natural gas in cars and trucks?  I asked that today: http://t.co/1x1h81Ze,2,0
227840104465588225,2012-07-24 18:58:08,Alaskans love pioneers.  We salute Amelia Earhart who would have been 115 today.  http://t.co/BFPdJQy4,4,0
227820168347267073,2012-07-24 17:38:55,A new market for natural gas in the US? It’s just one of the issues that impact #Alaska in today’s Morning Meeting: http://t.co/6riGLB3e,3,0
227525817868091393,2012-07-23 22:09:16,Saddened to hear of the passing of astronaut Sally Ride. The 1st US woman in space and a trailblazer for women in science.,19,3
227512656620306432,2012-07-23 21:16:58,A new #EPA rule means already-high prices of goods in #Alaska could go up. Tweet me your pictures of prices so I can make our case in DC,1,0
226392319765643265,2012-07-20 19:05:10,"The Coast Guard Air Station in Kodiak #AK has a new commander: Capt. Melissa Rivera, the 1st woman to head the station: http://t.co/wDAPk5a4",2,0
226345951374229505,2012-07-20 16:00:54,"I join all Alaskans in mourning the needless, senseless loss of life in Aurora, Colorado. Those impacted are in my thoughts and prayers.",2,0
226084502328442880,2012-07-19 22:42:00,The administration continues to fall short when it comes to consulting with #Alaska Native Tribes. Today I asked why: http://t.co/aDdlFyVY,5,0
226060260178272256,2012-07-19 21:05:40,"In today’s Morning Meeting: higher education, higher costs and cutting red tape for job creators: http://t.co/or4HKRP6 #AK #Alaska",2,0
226009193814052864,2012-07-19 17:42:45,"I’m seeing progress with Skagway #AK’s Post Office situation, but I told KHNS I still want more answers: http://t.co/sJ0PgerF",2,1
225744924803477504,2012-07-19 00:12:38,Small business success stories are being written at #Anchorage Airport! Efforts like this are crucial to our economy: http://t.co/625ERPLa,0,0
225721417960939520,2012-07-18 22:39:14,"I sat down with the next Air Force Chief of Staff today, and he agrees about Alaska’s geographic advantages: http://t.co/OryifqvW",1,1
225703268121198592,2012-07-18 21:27:07,I always said the stimulus wouldn't work. My colleague &amp; I are demanding answers on why it fell short in Indian Country http://t.co/KQax3yf8,2,0
225654167421734912,2012-07-18 18:12:00,Today’s Morning Meeting is up: better technology to solve #AK cold cases &amp; reducing the backlog for America’s veterans: http://t.co/VncmD3A7,0,0
225624076205572097,2012-07-18 16:12:26,"You are going to love Kodiak @Pitbull. #AK’s Emerald Isle is gorgeous- just bring a rain jacket, bear spray &amp; enjoy: http://t.co/ypJwK4t4",10,0
225353153686683650,2012-07-17 22:15:53,Campaign finance transparency is critically important &amp; I committed to improve the process today on a bipartisan basis http://t.co/GRjSrnIP,0,0
225306038516199424,2012-07-17 19:08:40,In today’s Morning Meeting: thinking ahead on cybersecurity needs &amp; improving search &amp; rescue operations in #Alaska: http://t.co/f9p8aUfn,1,0
225301774855176193,2012-07-17 18:51:43,I’m on the floor of the Senate discussing the DISCLOSE Act.  Tune into C-SPAN2: http://t.co/NY3FZRHl,1,0
224985412677017601,2012-07-16 21:54:37,The US is the only #Arctic nation without a national strategy. We must boost investment in our Arctic: http://t.co/oZH11H3v,11,1
224943858914557952,2012-07-16 19:09:29,The Interior Dept still hasn't answered my questions about stimulus bill shortfalls in Indian Country: http://t.co/8NjdMH57,1,0
223929710432882689,2012-07-13 23:59:38,"Congrats to the Rural Alaska Honors Institute (RAHI) grads! They earned 539college credits, the most in program history http://t.co/AmOyuAIB",1,1
223880962491170816,2012-07-13 20:45:55,Ted Stevens was a champion of the Olympic movement &amp; he was honored for his advocacy yesterday: http://t.co/XruxcJGE #Alaska #AK,0,0
223519443597279233,2012-07-12 20:49:22,Today’s Morning Meeting is online: Fed hypocrisy w/legacy wells &amp; burdensome red tape. A lot of #AK concerns in DC: http://t.co/Xy1Mbkx4,1,0
223508279626702849,2012-07-12 20:05:01,Wishing my wonderful husband Verne a very happy birthday! http://t.co/DHZZ6UKg,1,2
223460790789881857,2012-07-12 16:56:18,The BLM has had 40 years to clean up legacy wells - and has failed. Today I called on them to fix this embarrassment: http://t.co/XfHvnMhH,1,0
223177602494504963,2012-07-11 22:11:01,Eating #Frankenfish is like playing “genetic roulette.” Check out this @WomensHealthMag article abt these altered fish http://t.co/X03nvPlA,5,1
223165225640280064,2012-07-11 21:21:50,"#Alaska has over 75,000 vets &amp; no tolerance for military impostors. Today I co-sponsored the Stolen Valor Act: http://t.co/wXw7jgOd",2,1
223117267074953218,2012-07-11 18:11:16,"Today’s Murkowski Morning Meeting is online now, focusing on evolving threats to #Alaska and White House leaks: http://t.co/VkHfGvWA",0,0
222747003082383360,2012-07-10 17:39:58,"Today’s Murkowski Morning Meeting is up. Can smartphones revolutionize #AK retail? Also, TSA screening policies: http://t.co/u8eHTPfj",0,0
222728875552145409,2012-07-10 16:27:58,Welcomed my 2nd session of summer interns today who will get a first-hand look at Congress over the next 4 weeks. http://t.co/YY1j2UQ2,0,1
222448591170572288,2012-07-09 21:54:11,"No place else in America can give our military what JPARC does. ""No action"" on expansion is not an option. http://t.co/ofPFS2xj",0,0
222372212357873664,2012-07-09 16:50:41,"Good morning, Alaska, and enjoy Alaska flag day today. Let's remember Benny Benson today, too. http://t.co/u1Io3S3Y",6,0
221290168517279744,2012-07-06 17:11:02,10 young Alaskans are flying to DC this weekend to join my team for July. http://t.co/P9QzNnhG,0,1
220610825365368832,2012-07-04 20:11:34,"Today, my Veteran Spotlight honors an #Alaskan Vietnam veteran who turned his PTSD heartache into help for other vets http://t.co/AyXCQ8HG",2,0
220583537462616064,2012-07-04 18:23:08,"On July 4th we honor patriots who crafted our country's identity &amp; celebrate all Americans who protect, share &amp; live it http://t.co/Ziyj05L5",2,2
219868430134816771,2012-07-02 19:01:33,Just wrapped up a roundtable hearing concerns from the fishing community in Petersburg. http://t.co/LWAw9KkW,0,0
219149360049553408,2012-06-30 19:24:13,I want to thank @TacoBell for turning a negative story into a positive one in Bethel. http://t.co/quw7xA91,3,0
218823163012841473,2012-06-29 21:48:02,The Emmonak #AK Women’s Shelter sees nearly 500 victims/year. I worked to deliver unobligated funds to keep it open:  http://t.co/kYRbGKCd,1,1
218807125588180992,2012-06-29 20:44:20,Greg Kaplan from my Anch. office enjoying Bike to Work day. Learn about bike safety in #AK here: http://t.co/3C0oyQt7 http://t.co/hE1Eq1bt,0,0
218783331335159808,2012-06-29 19:09:45,I am pleased the Senate just kept student loan interest rates down without paying for it by a tax hike on employers http://t.co/sRD4p9Q6,4,0
218760507983790080,2012-06-29 17:39:04,the Senate passed the Pilot’s Bill of Rights I co-sponsored unanimously giving #Alaska’s aviators rights &amp; protections http://t.co/M89EUMtu,0,0
218742006841737216,2012-06-29 16:25:33,Japan tsunami debris is a problem for #Alaska so I'm calling on Obama to create a taskforce to prevent another disaster http://t.co/N1wAct0e,0,0
218498084785758208,2012-06-29 00:16:17,The #HCR ruling is a new precedent for federal overreach that must be repealed. What else can we be taxed into buying? http://t.co/8xM5z57S,8,1
218493381930778624,2012-06-28 23:57:37,It's the last day for my 1st Session interns in D.C. Take a look at their faces- they are the future #Alaskan leaders! http://t.co/dvwyQCZU,0,1
218455682716942337,2012-06-28 21:27:48,"#Alaska is still a young state, and today’s transportation bill keeps us from disproportionate cuts: http://t.co/uWKXifQ6",0,0
218398140640919552,2012-06-28 17:39:09,"I will work with anyone who wants to replace this #healthcare law with something smarter, leaner &amp; better for Alaskans: http://t.co/TbaIsMHC",10,3
218364151909720067,2012-06-28 15:24:05,"Supreme Court decision is an unprecedented federal overreach, and health care a tax hike in a struggling economy. http://t.co/Ma5Zyk6H #hcr",2,1
218110563182579713,2012-06-27 22:36:25,"Make Mt. McKinley ""Denali"" -- I urged my Senate colleagues today to officially restore 'The High One's name. http://t.co/NZbmlVIF",12,0
218074368515915776,2012-06-27 20:12:36,Fritz Creek - my staff is set up at the Post Office to hear from you. Stop by &amp; let them know your thoughts. http://t.co/CEGgnV95,1,0
218057914227769344,2012-06-27 19:07:12,Today marks National #PTSD Awareness Day. Learn how to #supportourtroops in your community: http://t.co/9jrYHU91 #Alaska,1,0
218038328602279936,2012-06-27 17:49:24,Glad to spend the morning with @runningstartDC women’s leadership group at the @SBHMuseum: http://t.co/iexAEnQ0,2,2
217801369187393536,2012-06-27 02:07:47,Today's news on delaying the F-16 Aggressors move is vindicating in that Alaskans have been heard: http://t.co/O7ESHBzl,2,0
217769668222529536,2012-06-27 00:01:49,The decision to delay the F-16 Aggressor move is welcome news. We must make this victory a permanent one for #Alaska &amp; our nation’s defense.,2,0
217754941006151680,2012-06-26 23:03:18,I was proud to vote to make Alaska's tough policy on synthetic drugs the national standard. http://t.co/v3zNZ9Cq,1,0
217726821494566913,2012-06-26 21:11:34,Good luck to Trevor Dunbar of Kodiak who is competing in the Olympic track trials: http://t.co/FDUdjIhR #makethefinal,1,0
217703594525327360,2012-06-26 19:39:17,My 1st session interns are wrapping up their last week in my DC office. Thanks for your hard work! http://t.co/bm1tHlUw,0,0
217688188708335617,2012-06-26 18:38:03,Today I joined 26 Senators in demanding the Attorney General get serious abt the avalanche of leaks at the White House http://t.co/bR5iipUV,1,1
217673824051789824,2012-06-26 17:40:59,Mobile office is open in Healy right now #Alaska.  Come share your thoughts with my staff. http://t.co/3ZudhzFL,1,0
217671134857011200,2012-06-26 17:30:18,"My staff wants to hear from you, #Alaska. My mobile office is open to you in Seward at the Post Office right now. http://t.co/j8UiSf8P",0,0
217355352562348034,2012-06-25 20:35:28,I remain hopeful that a bipartisan deal will be reached to keep student loan interest rates at 3.4% http://t.co/sL0zDmDi,2,0
217324228398166016,2012-06-25 18:31:49,My staff is set up at the Hope Community Library for mobile office: http://t.co/ZwDM71TG,0,0
217015965244866560,2012-06-24 22:06:52,Members of my staff will be making stops along the Kenai Peninsula to meet with Alaskans. Check out the schedule here: http://t.co/bNU57MeA,0,0
217015497114402816,2012-06-24 22:05:01,Interior #Alaska - my staff will be making stops along the Parks Highway this week. Check out the schedule here: http://t.co/vmNiJwK0,0,0
216255438637895680,2012-06-22 19:44:49,"Good luck to Agnes Avakumoff from Chuathbaluk #AK, she's 1 of 6 in the nation chosen for a science trip to Greenland http://t.co/gXPnhdCq",1,0
216239234309296129,2012-06-22 18:40:25,I told the White House its policies on consultation are failing Tribes. It’s a moral obligation that must be honored http://t.co/BcK2xHaS,1,1
216214439777673216,2012-06-22 17:01:54,"Big week for AK/NBA hoops: Mike Dunlap gets NBA coaching gig, and @mchalmers15 wins a ring!  Go #Alaska!",3,0
215937732613120000,2012-06-21 22:42:22,Thanks to KYUK-AM for letting me call-in today and share my concerns about the Kuskokwim's slow King salmon runs so far,1,0
215919448790532096,2012-06-21 21:29:42,Today’s Farm Bill spends more next year than we did this year. Only in DC could it ‘save’ money http://t.co/T7tJ5P6e,1,0
215905822272782337,2012-06-21 20:35:35,"Just visited w/ Nathan Peratrovich, great great nephew of Elizabeth Peratrovich the #Alaska Natives civil rights leader http://t.co/ko4PRDKr",2,0
215880954655408128,2012-06-21 18:56:45,Bartlett Golden Bears alum @MChalmers15 is bringing “the Heat” to the NBA Finals. Good luck tonight! http://t.co/PNMaAnxP,1,0
215872191571562496,2012-06-21 18:21:55,Want to know what’s going on in D.C. &amp; how it affects you #Alaska?  My Murkowski Morning Meeting keeps you in the loop: http://t.co/4j1C8stR,0,0
215638492229812227,2012-06-21 02:53:17,"In its 40 years #Title IX has increased opportunities for women &amp; girls- not just in sports, but for all education http://t.co/MTxQxRR7",6,1
215579166182088706,2012-06-20 22:57:34,The renovated MLK Jr. Memorial on the park strip was rededicated today!  Good activity for #SummerSolstice #Alaska http://t.co/ywL7SvDA,3,0
215533521429729282,2012-06-20 19:56:10,I hope many Alaskans got the chance to see the Vietnam Veterans Memorial Moving Wall during its #AK tour: http://t.co/oqzV4OBy,0,0
215488879388659713,2012-06-20 16:58:47,I remember watching Mike Dunlap play HS hoops in #Alaska.  Now he’s a big time NBA coach with the Bobcats! http://t.co/uvYYIwhq #AK,1,1
215204522967052288,2012-06-19 22:08:52,Female vets of Iraq &amp; Afghanistan face many challenges. Today I previewed a film abt their transition to civilian life http://t.co/2BdKUGhK,2,0
215194163770175490,2012-06-19 21:27:42,Congrats to Brigit Noon – one of two Presidential Scholars from #Alaska! #AK http://t.co/OwNeUSzU,0,0
215175653459361793,2012-06-19 20:14:08,The devil is in the details – too many of EPA’s new rules go beyond what is necessary: http://t.co/dHbSr3ix,1,0
215126597118853122,2012-06-19 16:59:12,"The Trans-Alaska Pipeline turns 35 this week. Here’s to 35 years, 16.6 billion barrels of oil &amp; to a long, full future: http://t.co/fZUR6d3I",9,1
214797803061387266,2012-06-18 19:12:42,I had a great trip with @Sen_JoeManchin and @RonWyden in WV seeing their “all in” #energy approach. http://t.co/khg2VaRK,1,0
214445116583182336,2012-06-17 19:51:14,Blessed to have two great fathers in my life - my dad Frank and my sons' dad Verne. Happy #FathersDay!,0,0
213346850655322113,2012-06-14 19:07:08,Happy #FlagDay! Today we honor the Stars and Stripes &amp; all it stands for. How are you celebrating #Alaska? http://t.co/wTEkssdQ,2,1
213303400719319040,2012-06-14 16:14:28,Happy 237th Birthday to the @USArmy! Thank you to all serving or who have served: http://t.co/j4FtiRKs #ArmyBDay #Hooah,4,1
213051845915066369,2012-06-13 23:34:53,Today I participated in the @BBBSA “Bigs on the Hill” rally. Honored to receive their leadership award #BBBS2012 http://t.co/LqyFiaEj,0,2
213008112280547329,2012-06-13 20:41:06,Thanks for your feedback Alaska! Today I raised your concerns w/ Sec Panetta. Hear what he had to say abt Eielson: http://t.co/qsf4B1n0,2,1
212967406103052288,2012-06-13 17:59:21,Heading to the Senate floor to appreciate my long-time aide Sherrie Slick from Ketchikan.  Check out C-SPAN2! #ThanksSherrie #Alaska,1,1
212671969940869120,2012-06-12 22:25:24,Great to see so many Alaskan students here for National History Day @NHDalaska #AK #Alaska http://t.co/pQUTGXqh,2,0
212629099842256896,2012-06-12 19:35:02,#Alaska is vital to the DOD's Asia-Pacific focus. I'll ask Sec. Panetta about #AK's role in the region tomorrow. What do you want to know?,4,0
212608979581419520,2012-06-12 18:15:05,Action must be taken to ensure that the USPS is not an avenue for drug trafficking in SE #Alaska: http://t.co/pN4Djl1k #AK,2,0
212330183414390785,2012-06-11 23:47:15,Sec. of Defense Panetta will testify before the Senate Defense Appropriations Subcommittee on Wednesday- what do you want me to ask?,2,2
212269717224833026,2012-06-11 19:46:59,Defense Secretary Panetta will testify before the Defense Approps Subcommittee on Wed. What questions would you ask him #Alaska? #AK,0,0
