id,created_at,text,retweets,favorites
601422206124630016,2015-05-21 16:20:02,AK has world-class fisheries &amp; military....glad to see the Navy &amp; Cordova residents engaging directly over concerns. https://t.co/H6GN3DK3fX,2,1
601181172698320896,2015-05-21 00:22:15,Great to see Palmer Chamber of Commerce held a military appreciation luncheon to show support for our veterans. http://t.co/xkKjB9i0bi,1,6
601171591599390720,2015-05-20 23:44:11,This is good news for both communities involved - thanks to everyone who worked together on this effort. https://t.co/bhBVjq61b8,0,3
601168993559420928,2015-05-20 23:33:51,RT @CraigAKLibrary: Read about all the #NationalMedal Recipients. The Class of 2015 includes some incredible institutions and stories. http…,4,0
601166182511685633,2015-05-20 23:22:41,"@Chenagrrl If your call was inadvertently dropped, please call my office back.",0,1
601089972062531587,2015-05-20 18:19:51,RT @EnergyGOP: Murkowski: OCS Revenue-Sharing is ‘Simple Fairness’ http://t.co/PSqOaxfDJw via @alaskapublic #offshore,4,0
601052077360545792,2015-05-20 15:49:16,RT @Ch2KTUU: We've got your map of where to find Bike to Work Day treats this morning right here: http://t.co/DKFPYdhoMo #ktuu http://t.co/…,7,0
601014996852703232,2015-05-20 13:21:56,"Happy Bike to Work Day, Anchorage! Be extra careful on the roads and make sure to look out for each other!",2,4
600858738082357248,2015-05-20 03:01:01,"@Iceblue52Roth absolutely! As a scientific research opportunity, these icebreakers open up a new world of knowledge.",0,0
600855404722130944,2015-05-20 02:47:46,RT @EnergyGOP: Miss our hearing this morning on U.S. #energy supply? Here's a recap: http://t.co/Rr1hlScOFh #energyisgood http://t.co/Nubi2…,2,0
600828413096665088,2015-05-20 01:00:31,"I introduced bipartisan legislation to authorize 6 heavy icebreakers. From a military perspective, it's imperative. http://t.co/RdhcwXVJQW",13,6
600749167141527554,2015-05-19 19:45:37,"Updated @DucksUnlimited on my Bipartisan Sportsmen's Act to open up lands for hunters, fishermen, and outdoorsmen. http://t.co/pdIvqOsUdS",2,3
600736851603955713,2015-05-19 18:56:41,"RT @EnergyGOP: .@lisamurkowski: The irony of denying #Alaska opportunity while people 4K miles away lock up access to our resources
https:/…",7,0
600734774550994944,2015-05-19 18:48:26,"Great op-ed from @defense_news on what many in AK know: the Arctic is full of opportunities, and the US must engage: http://t.co/ZUoJNhnJ28.",5,3
600664878567784453,2015-05-19 14:10:41,RT @EnergyGOP: Murkowski: America is the leader in all #energy. We have it all. #energyisgood: http://t.co/7PZ5R2A8iV,4,0
600339298714525697,2015-05-18 16:36:57,"This past weekend, a grateful crowd of Alaskans came together to salute the 2nd Engineer Brigade at a… https://t.co/kZUMnemk7q",1,0
600331275644366848,2015-05-18 16:05:04,Proud to cosponsor USA Freedom Act to protect privacy; @washingtonpost says “It should pass...the sooner the better.” http://t.co/2YKJdFb8lr,7,6
599715282639147008,2015-05-16 23:17:20,"In honor of #ArmedForcesDay, I want to thank all the men and women who so bravely serve our great nation.",7,11
599653574486990848,2015-05-16 19:12:07,View from downtown Seattle showing Terminal 5 in the distance with Polar Pioneer safely at the dock. https://t.co/ERCvHIyP7Y,4,3
599650137690886144,2015-05-16 18:58:28,Ceremonial 1st fish of the Copper River salmon season arrived in Anchorage today &amp; thousands of lbs of salmon! http://t.co/xBuj7yIriI,2,2
599391829411254273,2015-05-16 01:52:02,Ceremonial 1st fish of the Copper River salmon season arrived in Anchorage today &amp; thousands of lbs of salmon! http://t.co/RR0RRbifLN,3,5
598981088170618880,2015-05-14 22:39:54,Congrats @uafairbanks for being selected into an exclusive coalition to advance unmanned aerial systems w/ FAA. http://t.co/nAOhihnXIc,5,7
598971593293959168,2015-05-14 22:02:10,Consider it done.  I was an original co-sponsor of the Senate version of this important bill. http://t.co/k5p6wP0xk0 https://t.co/v7ybTXcdbE,2,3
598934377876365313,2015-05-14 19:34:18,"On Senate floor discussing #NationalPoliceWeek, foreign trade, oil exports &amp; other issues Alaskans are talking about. http://t.co/X6hbpKylA9",3,3
598911299985113090,2015-05-14 18:02:35,Thrilled to be touting the benefits of unmanned aerial systems in Alaska!! http://t.co/iZI2Z9gjo1,2,2
598892532962037760,2015-05-14 16:48:01,Thanks for getting the word out! https://t.co/yvYIBeoZcC,2,3
598666295664578560,2015-05-14 01:49:02,Honored to read the names of Alaska's fallen officers at Vigil. We won't forget your sacrifice #NationalPoliceWeek http://t.co/xvaeTGTF4P,4,6
598661276408098816,2015-05-14 01:29:05,"As a final roll call of honor, the names of fallen officers, including AK officers being read now @ Candlelight Vigil http://t.co/Njx0o9UDYx",1,2
598647335791525891,2015-05-14 00:33:41,"Candlelight Vigil happening right now in DC, honoring those we've lost in the line of duty. Watch live: http://t.co/N7THRgaYyT #PoliceWeek",1,1
598558072366305280,2015-05-13 18:38:59,RT @EnergyGOP: It's time to #LiftTheBan on U.S. #oil #exports. Learn more about @lisamurkowski's bill: http://t.co/eXSkyR5U63 http://t.co/r…,17,0
598547733323055104,2015-05-13 17:57:54,RT @EnergyGOP: Murkowski: US has an opportunity to embrace its role as a global #energy powerhouse http://t.co/eXSkyR5U63 #LiftTheBan on #o…,6,0
598489872287014914,2015-05-13 14:07:59,Follow along as BLM Director Neil Kornze explains his dept's budget request ...an agency w/ a huge presence in AK: http://t.co/bWefwZtUWT .,0,2
598488663631212546,2015-05-13 14:03:11,As a nation we rely on BLM to make responsibly resource development possible...it's important to both our economic &amp; national security.,0,2
598488175154241536,2015-05-13 14:01:14,1/4 of all #BLM lands are located in Alaska...the largest portion of which is the National Petroleum Reserve-Alaska.,1,3
598487932081741824,2015-05-13 14:00:17,"The Bureau of Land Management manages ~240 million acres of federal land, the vast majority of this land is in 11 western states and Alaska.",0,2
598487679597203457,2015-05-13 13:59:16,Getting ready to gavel in an Interior Appropriations hearing on #BLM’s budget request for FY2016. Watch--&gt; http://t.co/bWefwZtUWT.,1,2
598283217888772096,2015-05-13 00:26:49,Thank you Brig. Gen.Bridges of AK National Guard for faithfully serving our nation for 35 yrs. I wish you well as you head into retirement!,1,3
598255459531886592,2015-05-12 22:36:31,RT @EnergyGOP: Murkowski bill will ensure #Alaska's coastal communities receive a substantial share of revenues from development http://t.c…,2,0
597875417064861696,2015-05-11 21:26:22,An important step toward the U.S. assuming a leadership role in the Arctic! https://t.co/1BWu0fcWLs,13,5
597853826847264768,2015-05-11 20:00:34,"@PostReid So much going on in the Arctic, and with the U.S. taking the Chair of the Arctic Council, we really need to step up our engagement",3,2
597168453976498176,2015-05-09 22:37:08,"Thank you to everyone--businesses, schools, families, including my staff--who chipped in and hit the… https://t.co/DffucWduB6",4,3
596820350190641152,2015-05-08 23:33:54,What am amazing way to celebrate V-E Day's 70th Anniversary -- a #WW2Flyover of the National Mall by… https://t.co/uanHYT8Tam,3,6
596755412201951232,2015-05-08 19:15:52,RT @USCGPacificNW: Happy Military Spouses Day! A very sincere thank-you to all military spouses for their important service to country. htt…,4,0
596470488781758464,2015-05-08 00:23:41,Today I pressed Attorney General Loretta Lynch for a commitment to make Alaska Native safety a priority at the DOJ. http://t.co/YYJp78sLK9,3,5
596400266234200064,2015-05-07 19:44:38,Next Tues. I'll intro legislation to #LiftTheBan on US oil #exports. Check @ENR_GOP for more: http://t.co/jDFkyow73j https://t.co/C4dJUVhKXI,8,5
596395500326297600,2015-05-07 19:25:42,"Alaska aviation legend Urban Rahoi, a 95-year old WWII vet, will be flying in the nose of a B-17!  https://t.co/WgFx4JA6yE",3,5
596389836988243969,2015-05-07 19:03:12,"RT @adndotcom: Alaska Native singing and drumming videos have made a Toksook Bay teen into a role model
http://t.co/LCQjrs5M8s http://t.co/…",32,0
596332070340861953,2015-05-07 15:13:39,Exactly why I'm backing the #USAFREEDOMAct: http://t.co/XzwILCAyRR. https://t.co/29WCW3t9VM,14,10
596331378154803201,2015-05-07 15:10:54,"About to question new AG Loretta Lynch about her priorities on many Alaska issues, tune in to watch here: http://t.co/ZfH8LJQV3B.",2,0
596091683101609985,2015-05-06 23:18:26,"Starting tomorrow, Alaskans can opt for the retro ’76 grizzly license plates. Who’s getting one? http://t.co/MtkIO5ryBa",6,6
596074527144181761,2015-05-06 22:10:16,@WakeUpAmerica62 I've been calling attention to this family and working w/the State Department for days. Let's focus our energy on them!,0,0
596072399331811328,2015-05-06 22:01:49,Thx to Sec. Carter of the @DeptofDefense for testifying about the importance of the Arctic today. http://t.co/1sKHPNkXv3 Let's get moving!,5,3
596002015777583105,2015-05-06 17:22:08,Praying that this Alaskan finds her mom. https://t.co/EZ48zFebuV,2,3
595982388896866305,2015-05-06 16:04:08,RT @NBCNews: FAA announces 'Pathfinder' drone program to test unmanned aircraft for commercial use http://t.co/LLOeaQ8dv8 http://t.co/w8LB4…,66,0
595744689787142146,2015-05-06 00:19:37,Thankful Congress just passed a 10yr #BalancedBudget w/out raising taxes. First time since 2001! http://t.co/lcV7C8WLVv,9,6
595675118187225089,2015-05-05 19:43:09,Congrats to the @GirlscoutsAK Gold Award winners—the highest award in Girl Scouts. An amazing achievement! http://t.co/oetlHtMwbj,2,1
595641927325884416,2015-05-05 17:31:16,"If you live in Anchorage, make sure to vote in today’s mayoral election! Find your voting site here: http://t.co/D6TCcxacju #ANCmayor",8,10
595616038051586048,2015-05-05 15:48:24,RT @ASD_Info: Today is National Teacher Appreciation Day! Help us celebrate our amazing educators. #ThankATeacher http://t.co/Di7h1MI8HZ,3,0
595606370298273792,2015-05-05 15:09:59,Congrats to Ketchikan's Cassandra Adams and Juneau's Amara Sanguni on their Prudential Spirit of Community Awards! http://t.co/UnXMvT48wg,4,7
595584575306375168,2015-05-05 13:43:22,Love today’s Google Doodle in honor of Nellie Bly—a pioneering journalist &amp; adventurer who was way ahead of her time. http://t.co/vtBF24Z4nw,4,7
595374407738138626,2015-05-04 23:48:14,This weekend I was honored to speak at the Victims for Justice Awards Banquet as they recognized… https://t.co/vDODFDzXfs,2,0
595325572609347586,2015-05-04 20:34:11,"We deserve defense against those who seek to harm us, but we shouldn't sacrifice our liberty to do so. #USAFREEDOMAct http://t.co/XzwILCAyRR",3,3
594626542086520832,2015-05-02 22:16:29,I got to try my hand at using the F-35 simulator at the Military Appreciation Banquet in Fairbanks! https://t.co/GKZBJ9NiF8,3,4
594255695622574080,2015-05-01 21:42:53,RT @Principal_Legg: Chugiak High School celebrating senior class 2015 @ crossover assembly @ASD_Info #2015ANCGRADS http://t.co/GghIVUUZ4W,14,0
593890456041295873,2015-04-30 21:31:33,RT @ENR_GOP: Tune in NOW to @FoxBusiness -- Sen. @Lisa Murkowski is discussing why we need to #LiftTheBan on US #oil #exports. http://t.co/…,6,0
593787799842725888,2015-04-30 14:43:38,Way to go Maeva! https://t.co/qdFky26ldq,2,3
593577914240770049,2015-04-30 00:49:37,"Inspirational! 4 vets aim to summit Denali on Memorial Day &amp; carry over 100 names of Americans who've died serving. 
http://t.co/THieKIUGc0",5,12
593194155670646784,2015-04-28 23:24:42,RT @ENR_GOP: Murkowski plans Iran bill amendment to end crude #oil export ban: http://t.co/3QjPOawEla (sub. publication) via @EEPublishing …,13,0
593155178410291200,2015-04-28 20:49:49,Glad I could participate in the @JointOceanCI Arctic Ocean Leadership Roundtable by video message! http://t.co/M0nrjKlFPo,3,3
593049560462860288,2015-04-28 13:50:08,RT @ENR_GOP: This morning Secretary Moniz will testify on U.S. #energy infrastructure. Watch LIVE at 10am: http://t.co/ETfqWElEGe,3,0
592832800232976385,2015-04-27 23:28:48,What an awesome opportunity! Fort Yukon H.S. student heading to Australia to represent Alaska in Tourney this summer. http://t.co/oo9Fxm4ioJ,1,3
592778625369387009,2015-04-27 19:53:32,It was an honor to be at @ArcticCouncil mtgs as the US officially assumed Chair. #OneArctic http://t.co/SiRfOA7njM,10,11
591737198178914304,2015-04-24 22:55:16,Couldn't agree more!  https://t.co/5g395suXeo,5,3
591682023682605056,2015-04-24 19:16:02,@ArcticCouncil watch party at @uaanchorage today! Alaskans know our Chairmanship is important! #OneArctic http://t.co/JLkzOiUMZO,2,4
591680650572341248,2015-04-24 19:10:34,RT @UAFGI: Indigenous knowledge enhances arctic science. #OneArctic. @ArcticCouncil,2,0
591646805709824001,2015-04-24 16:56:05,"Only 1 hour to go until the US officially becomes Chair of the @ArcticCouncil. At 10 am in Alaska, tune in to watch: http://t.co/V6yfEnhRCd.",7,9
591359940830322688,2015-04-23 21:56:11,"No, thank you for boosting awareness!! https://t.co/t4MNzkFLJn",2,4
591341815443369984,2015-04-23 20:44:10,Happy #takeyourchildtoworkday! Mabel in my Anchorage office brought her son &amp; Taona in DC brought her daughters! http://t.co/5uWQPidk53,0,8
591292294604652544,2015-04-23 17:27:23,RT @ENR_GOP: 163 Members of Congress Urge Admin to Increase #Energy Production in Outer Continental Shelf http://t.co/z7NhxG7e1F http://t.c…,8,0
591278019651772416,2015-04-23 16:30:39,"Today I voted against the nomination of Attorney General candidate Loretta Lynch, and here's why: http://t.co/YjjrgzpXLW.",5,10
590979973353234432,2015-04-22 20:46:20,"Between votes today, @sendansullivan and I were able to meet with some impressive students from… https://t.co/epRdUfwvlg",1,4
590908063344889857,2015-04-22 16:00:35,"RT @newsminer: If you're wondering, the Ice Classic tripod is still standing this morning. #alaska #iceclassic http://t.co/ZPV0mqE5gS",5,0
590632059787436032,2015-04-21 21:43:51,Staff Sgt. Kimberly Daugherty’s determination is truly incredible! https://t.co/cOe9GgqfxG,1,1
590606488814673923,2015-04-21 20:02:14,Safe travels to the 23 veterans–of WWII &amp; Korea-who are flying to D.C. as part of The Last Frontier Honor Flight! http://t.co/V9gx4pXy5y,2,5
590590972515450884,2015-04-21 19:00:35,Congrats to @CraigAKLibrary for being named winner of the National Medal for Museum and Library Services…truly well-deserved!,3,6
590553679666774017,2015-04-21 16:32:23,Just a few days to go until the U.S. takes the Chair of the Arctic Council! https://t.co/GKcpZlIGoQ,11,5
590239516973109250,2015-04-20 19:44:01,RT @ENR_GOP: Sen. @lisamurkowski: US #oil export ban is a sanction against ourselves http://t.co/dGuI8bOqOw #CERAWeek #LiftTheBan http://t.…,16,0
589059038022733824,2015-04-17 13:33:13,"RT @ENR_GOP: LIVE now: @lisamurkowski talking #Arctic policy, US @ArcticCouncil chairmanshp at #CSISLive: http://t.co/L3Ty84Irbb http://t.c…",9,0
589057492316917761,2015-04-17 13:27:04,"RT @CSIS: Watch Now for “The Road to Iqaluit: The Arctic Agenda on the Eve of the U.S. Chairmanship”, feat. San. Murkowski: http://t.co/D3p…",5,0
589057332920758272,2015-04-17 13:26:26,"RT @ENR_GOP: .@lisamurkowski: “We are an #Arctic nation because of #Alaska, but every state has a stake in the Arctic.” http://t.co/L3Ty84I…",5,0
588841693585215488,2015-04-16 23:09:34,"Best of luck to all the NYO Games athletes! The games kick off today, celebrating AK's rich culture and traditions. http://t.co/ltdCzJeMir",5,6
588793958974750720,2015-04-16 19:59:53,AK creativity makes me proud! This one-of-a-kind ornament was created for @USCapitolTree.Can’t wait to see them all! https://t.co/c3wG5ktyxZ,0,3
588711007444279296,2015-04-16 14:30:16,The first 100 days tell a strong story: the U.S. Senate is back to work for America. http://t.co/a9QLolWetO,1,3
588458782495113218,2015-04-15 21:48:01,"RT @SenatorLankford: The #TaxCode contains over 4 million words &amp; has changed over 4,600 times in the last 12 years. Burdensome? You bet. #…",15,0
588458452445364224,2015-04-15 21:46:42,It takes Americans an estimated 1.35 billion hours to file individual returns and pay $4.4 billion in compliance costs #TaxDay,21,8
588155642462019584,2015-04-15 01:43:27,Many of you might recognize this face --- Sue Aikens of the show lifebelowzero was in D.C. today!… https://t.co/PmpvtgQuhB,1,3
588064869863292928,2015-04-14 19:42:45,"America needs Eielson, which is why the @usairforce has decided to keep the F-16s there: http://t.co/1H2sqBtnBt. http://t.co/7eeTliJRbA",5,5
587722508478115840,2015-04-13 21:02:20,"Congrats to Kenai's Allie Ostrander, “Allie-O”, who broke the 10 minute mark in the 3,200 meter run--truly amazing! http://t.co/jVqBbFVoZC",2,2
587686894022041600,2015-04-13 18:40:48,"@EricaMartinson, welcome to the AK journalism scene!  Look forward to working (more) with you on Alaskan issues and our energy future.",1,4
586570783176204288,2015-04-10 16:45:47,Just gorgeous! https://t.co/fBNvBzvVcF,6,5
586321052441128960,2015-04-10 00:13:26,Tomorrow is Go Blue Day! Wear blue to help raise awareness for National Child Abuse Prevention Month. #Goblue #StopChildAbuse,12,7
586298229098184704,2015-04-09 22:42:45,Congrats to Chickaloon Village Traditional Council on the ground breaking of the Life House Community Health Center! http://t.co/D2I3LB6JGn,5,3
586256561670074370,2015-04-09 19:57:11,"RT @postphoto: The #cherryblossoms spring to life in Washington, D.C. http://t.co/xCmfdddH18 http://t.co/SiYCuMMS8O",389,0
586232222862151680,2015-04-09 18:20:28,RT @ENR_GOP: Congrats to #Alaska Energy Authority &amp; UASoutheast! Both received grants from USDA to expand AK wood energy projects http://t.…,3,0
586230990227537920,2015-04-09 18:15:34,RT @ENR_GOP: USDA Awards Funds to Expand and Accelerate Wood #Energy and Wood Product Markets in 23 States: http://t.co/wb8mu7NrXX,3,0
585933654251143168,2015-04-08 22:34:03,RT @ENR_GOP: Committee staff got a firsthand look at #Alaska's infrastructure in advance of crafting broad #energy legislation http://t.co/…,11,0
585856923720900610,2015-04-08 17:29:09,The world seen through Rie Munoz's eyes was always bright and cheerful.  Alaskans statewide will miss her. http://t.co/0Sda8OYIjv,8,12
585591437003247617,2015-04-07 23:54:13,#Voting absentee in person at the Anchorage airport. So easy! https://t.co/NXsdQbCCHA,6,3
585537377717907456,2015-04-07 20:19:24,RT @ENR_GOP: Thx to UAF's Brian Ellington for showing staff around the Fairbanks Pipeline Training Center. #jobs #oil #natgas http://t.co/R…,4,0
585525639165403136,2015-04-07 19:32:45,Great start to the day! I spent this morning catching up with a group of strong Alaskan woman… https://t.co/lpqRyrRgid,12,9
585220040947015683,2015-04-06 23:18:25,(2/2) ...where educators are preparing students for employment in industries vital to Alaska through experiential teaching and application.,4,1
585219915956781056,2015-04-06 23:17:55,(1/2) I’m impressed w/ what I saw at @KenaiPenCollege recently.Their Process Technology program is really impressive. http://t.co/i88Re1mG3j,4,3
585201353523335168,2015-04-06 22:04:09,Weather kept me from making it to Nikolai &amp; McGrath today- thankfully I was able to check in w/ students on Skype. http://t.co/xGw4GfmZiR,1,2
584118416535117824,2015-04-03 22:20:57,RT @ENR_GOP: Chair @lisamurkowski responds 2 @BarackObama @Interior actions to designate #ANWR as wilderness; restricting #energy http://t.…,8,0
583805091859267584,2015-04-03 01:35:55,Heading to the Fairbanks Curling Club soon for the opening ceremonies of the 80th International Bonspiel!,5,6
583758146889461760,2015-04-02 22:29:22,"Whether the #IranDeal proves to be a good deal or a bad one, it must be presented to Congress for consideration: awb://1.usa.gov/1ItSkKR.",16,7
583065152892899328,2015-04-01 00:35:39,"In honor of the last day of #WomensHistoryMonth, I want to call attention to some of the women who got us this far. http://t.co/HkdLlJtZRY",12,6
583012591833858049,2015-03-31 21:06:48,"Have you filed for your AK PFD yet? The deadline to file is today!
http://t.co/AwXPPYK7fn",10,3
583002420583649280,2015-03-31 20:26:23,Congrats to @fbx_IceDogs GM Rob Proffitt on his lifetime achievement award! I can’t think of anyone more deserving: http://t.co/qNCWGChdol.,3,3
582608625975332864,2015-03-30 18:21:35,Happy #SewardsDay! Today we celebrate the United States’ purchase of Alaska from Russia…for the bargain price of roughly two cents an acre!,14,17
582295665801232385,2015-03-29 21:37:59,What a great showing at the Interior Alaska Science Fair! Over 600 bright Alaskans presented their innovative ideas. http://t.co/5AFY1w0Gb0,7,11
581189977440174080,2015-03-26 20:24:23,RT @pickclickgive: Only six days left to http://t.co/a7TC34NG5W.Give. We've almost hit $3 million-a record. Keep up the momentum Alaska! #L…,10,0
580787582742724608,2015-03-25 17:45:24,The estate tax is a form of double taxation on the bereaved. I’m proud to co-sponsor its repeal. #DeathTaxRepeal http://t.co/Ywf8BEvwSH,8,7
580756658361659392,2015-03-25 15:42:31,RT @Ch2KTUU: #Alaska tsunami alerts and sirens will sound at 10:15 a.m. today in a preparedness test: http://t.co/Bv8xmCn9jl #ktuu http://t…,23,0
580727424314433536,2015-03-25 13:46:22,Less than a month until the U.S. assumes chair of the @ArcticCouncil! #ArcticNation http://t.co/V6yfEnzt0N,8,7
580504389774929921,2015-03-24 23:00:06,Just a few days left to see the World Ice Art Championships @icealaska in Fairbanks. Featuring 70… https://t.co/QDX3f3rv1C,3,1
580451386044870657,2015-03-24 19:29:29,"Congrats to Mimi Troxel, Alaska's next Cherry Blossom Princess! http://t.co/yUII9DCqug",4,1
580376659200741376,2015-03-24 14:32:33,"RT @USCG: ""A subset of being a maritime nation is the #Arctic ... U.S. is an Arctic nation""- @ADMZukunft at HAC-HLS hearing http://t.co/I8U…",30,0
579885092044025856,2015-03-23 05:59:14,Historic! 20 year effort to reintroduce bison back into Interior AK becomes a reality. Thanks @akwildlife and ADF&amp;G. http://t.co/DZVGbGVABn,10,11
579731071190831105,2015-03-22 19:47:12,My first time sit-skiing with @akzen yesterday...truly incredible! http://t.co/tVddMwVpPm,5,4
579362218812182528,2015-03-21 19:21:31,Thankful so many joined together at 30th Annual AK Governors Prayer Breakfast to support our leadership in prayer. http://t.co/4JoQfkvPm2,4,6
579095884899721216,2015-03-21 01:43:12,"Just got to the March Madness Alaska State Basketball ""Just got to the March Madness Alaska State… https://t.co/gU0yfR2qHP",2,2
579063785652166656,2015-03-20 23:35:39,Today kicks off the 70th Annual Open North American Championship Sled Dog Race in Fairbanks. Glad so many showed up! http://t.co/ujh2EX5oHq,4,3
578631235804786688,2015-03-19 18:56:51,RT @USCGAlaska: A #USCG AirSta Kodiak crew was recently recognized as Naval Helicopter Association Aircrew of the Year. Bravo zulu! http://…,17,0
578305590520377344,2015-03-18 21:22:51,"We're all #OneDegree from cancer. It's touched members of my family, like my cousin Jenny. Thx @ACSCAN for all you do http://t.co/TJbH0B3eJs",18,8
578246782116823040,2015-03-18 17:29:10,"Like father, like son! Mitch Seavey just reached Nome, coming in 2nd behind his son Dallas. Congrats to the Seavey family!",5,8
578241086247809025,2015-03-18 17:06:32,Interesting article: The costliest part of feeding farmed salmon?  A pill to make sure they're the right color! http://t.co/a9jAwgQ3f0,3,2
578193831520296960,2015-03-18 13:58:46,"Everyone in Nome: If you see Dallas Seavey, let him know I just left him a v/m congratulating him on winning #Iditarod2015!",1,4
578182210160840704,2015-03-18 13:12:35,Anybody else have Dallas Deja Vu with today's Iditarod Finish? http://t.co/xrQRlJYczM #Iditarod2015,1,2
577928030368219137,2015-03-17 20:22:34,RT @TananaChiefs: @lisamurkowski addressing the TCC Convention in Fairbanks #TCC2015 http://t.co/LdQyykwTXK,4,0
577919052162678784,2015-03-17 19:46:53,So glad that I was able to connect &amp; talk w/ the @TananaChiefs Annual Convention about tribal courts today. #tcc2015 http://t.co/RZtCmjUky9,3,3
577824074862342145,2015-03-17 13:29:29,Alaska and Hawaii have a special bond as the only non-contiguous states. I hosted all of the AK/HI… https://t.co/rGeBrbiJUH,1,2
577625441827217408,2015-03-17 00:20:11,Great story! A Veteran is working to dramatically improve veggies found on AK shelves &amp; looking to employ other vets. http://t.co/98k5SYy0rs,4,4
577573286143533056,2015-03-16 20:52:56,I am optimistic this new plan to fight pirate fishing will help Alaska and seafood producing states nationwide: http://t.co/zyBA22TV4V.,6,5
577557118976425984,2015-03-16 19:48:42,Blue skies and broad smiles! What a great way to spend an Alaska winter day: at the Ice Fishing Derby… https://t.co/giGl72OT0Q,1,3
576896117595504640,2015-03-15 00:02:07,Congrats to @BeansCafeAK for another successful Empty Bowl Project! http://t.co/LSuG9TtV7z,6,4
576552120549146624,2015-03-14 01:15:12,"I just introduced bipartisan legislation cracking down on potential Genetically Engineered Salmon aka ""Frankenfish"". http://t.co/9PXKKnHyHa",11,8
576210227571355648,2015-03-13 02:36:38,"RT @adndotcom: Headed to Anchorage for March Madness? Costco, Ravn &amp; Northern Air offering a 1-day deal on air freight for rural AK. http:/…",6,0
576145682865745920,2015-03-12 22:20:09,What the Lower 48 needs to know about Alaska's lack of land access.  #ThisIsOurAlaska http://t.co/1dAO3FIvRT http://t.co/qj9KfbrrwW,8,7
576135373790814208,2015-03-12 21:39:11,I used today's lunch w/colleagues to teach them a couple things: 1) how delicious our Alaska King… https://t.co/oqsd6kRTte,1,2
