id,created_at,text,retweets,favorites
600745698032799744,2015-05-19 19:31:50,Tomorrow the house votes on a bill I introduced to boost lead times in severe weather forecasting. #EveryMinuteCounts http://t.co/dPqtNn1kiP,2,2
599278315090874369,2015-05-15 18:20:59,"Lesser Prairie Chicken's ""threatened"" ESA listing burdens ag producers &amp; could even hinder military base functions http://t.co/rI7ZEI5rdq",1,1
599274706672451585,2015-05-15 18:06:38,RT @OKCattlemen: House passed language to fix Lesser Prairie Chicken ESA listing. Thank you @RepFrankLucas for leading this effort!  http:/…,4,0
598517154317770752,2015-05-13 15:56:24,Thank you to the men and women who serve to protect us everyday #PoliceWeek http://t.co/BuBSJ60F40,5,3
596766331900428288,2015-05-08 19:59:15,Proud to announce this year’s winner of the Third District Congressional Art Competition! http://t.co/qHD49Qq7WQ http://t.co/gXztXHc71d,0,1
596691617383358464,2015-05-08 15:02:22,"70 years later, we will never forget the heroism &amp; sacrifice of the #GreatestGeneration who fought to liberate Europe http://t.co/RMo2nRKmLo",7,8
596380272133812224,2015-05-07 18:25:11,3rd District Main Street communities received 15 of the 22 annual awards from @OKcommerce for hard work &amp; innovation! http://t.co/8OJyWvFwQr,1,3
595985269767147520,2015-05-06 16:15:35,Great first stop in El Reno to kick off my town hall meetings this week! http://t.co/pt2LF6VvYI http://t.co/hC07YrOF6s,1,1
595974041044922368,2015-05-06 15:30:58,Honored to be recognized by @FeedingAmerica &amp; @rfbo for my work on the Farm Bill: https://t.co/orzUwYpqkw http://t.co/umbGTxLjw3,4,3
595669355217707008,2015-05-05 19:20:15,"Voting for the congressional art competition ""fan favorite"" closes tomorrow – hit ""like"" on your favorite piece HERE: http://t.co/OPMqUvaO6O",0,0
594230550044549120,2015-05-01 20:02:58,"Great visit with OK State Senators @stephaniebice, @kimdavid2010, and @AJ_GriffinOK this afternoon in my DC office http://t.co/sunt2v8drl",4,18
593893902366683136,2015-04-30 21:45:14,Excited to host six town hall meetings next week throughout SW Oklahoma. Full details here: http://t.co/pt2LF6VvYI http://t.co/letsrs0yv0,1,2
593464381918285825,2015-04-29 17:18:29,VOTE for your favorite submission to the 2015 Third District Congressional Art Competition! http://t.co/OPMqUvaO6O http://t.co/yqZOFRDJ0M,0,1
593139690108297221,2015-04-28 19:48:16,"Glad to sit down w/ @Ron_on_RON in my DC office this afternoon to discuss #FarmBill, trade, and EPA regulations http://t.co/OIX8XieTBH",3,5
590990093785165824,2015-04-22 21:26:33,Glad to visit w/ @EnidChamber earlier today in the Capitol to discuss issues ranging from Vance AFB to EPA regulation http://t.co/5GU1G6gY3M,1,0
589107333512454144,2015-04-17 16:45:08,"Yesterday, the Oklahoma delegation reflected on the OKC bombing tragedy, 20 years later http://t.co/37HXoVKdxB http://t.co/FLV0ikV68D",4,0
588078265358757889,2015-04-14 20:35:59,Enjoyed meeting @okfarmbureau this morning in the Capitol to discuss Farm Bill implementation and other ag issues http://t.co/2Ap1hG68QY,2,2
587993188478115840,2015-04-14 14:57:55,RT @okfarmbureau: Thankful for the common sense @RepFrankLucas brings to DC! #OKFB15 http://t.co/QXGnNGjAQd,3,0
586305252435087362,2015-04-09 23:10:39,"Honored to meet Roy ""Junior"" Herring &amp; present this WWII hero w/ the Bronze Star for  bravery in the field of combat http://t.co/sLaQCZyYkR",5,3
585846270402650112,2015-04-08 16:46:50,Thanks Sapulpa High School for inviting me to speak this morning! http://t.co/5hUOrMU0Rb,0,0
585521788450406400,2015-04-07 19:17:27,This morning I was proud to commemorate the 75th anniversary of the Agricultural Research Service in Stillwater. http://t.co/9pB1aRtATG,1,5
583014435054309376,2015-03-31 21:14:07,Great discussion at yesterday's town hall meetings in Woodward and Taloga! http://t.co/XUp2hTocXH http://t.co/c5JLCH7Mve,1,4
582666998095679488,2015-03-30 22:13:32,Met up with the Woodward Fire Dept this afternoon to assess some of the wildfire damage throughout western Oklahoma http://t.co/lyiZ85foO9,4,5
582550594554056705,2015-03-30 14:30:59,It was an honor to speak with veterans this weekend at the El Reno American Legion. Thank you for your service. http://t.co/srFc16lCwh,3,2
581569627664183296,2015-03-27 21:32:58,REMINDER: Be sure to check my website for next week's town hall meeting schedule: http://t.co/1rNpgo6bWV http://t.co/UA0rFhsofH,3,2
581524561512042496,2015-03-27 18:33:54,"Visiting Washington? Schedule a Capitol tour through my website!

http://t.co/byhpSEYH1Q http://t.co/OsIWYHHt16",0,1
581128417103482880,2015-03-26 16:19:46,The House-passed budget plan balances our nation's budget in nine years and sets us on the path to a stronger economy http://t.co/oz7xdDlC7s,3,2
580830523527954432,2015-03-25 20:36:02,RT @OKCattlemen: Outstanding mtg with @RepFrankLucas !  Great friend and fellow beef rancher he is! @BeefUSA @JBurtrum http://t.co/aMj9RWpT…,5,0
580820565616926720,2015-03-25 19:56:28,This afternoon I addressed several reps from the Altus Chamber of Commerce &amp; @97AMW at the Library of Congress. http://t.co/MeGVASLWqM,4,1
580738025338105856,2015-03-25 14:28:29,RT @KSWO_7NEWS: Rep. Frank Lucas announces town hall meetings in Oklahoma http://t.co/2PXkffid42 #7news #KSWO,2,0
580701735834009601,2015-03-25 12:04:17,"Look forward to joining @johnherrick10 at 7:15 am OKT this morning to discuss #Obamacare &amp; #Budget, listen live here: http://t.co/L7uULyk2N6",1,1
580469926609195009,2015-03-24 20:43:09,"I'm hosting town hall meetings next week in Dewey, Woodward, Washita, Ellis &amp; Harper counties http://t.co/1rNpgnOB5n http://t.co/7lDKAJa63X",3,0
580407741807747073,2015-03-24 16:36:03,There’s more work to be done to improve rural veterans access to healthcare but I'm glad VA will revise distance reqs http://t.co/iCJRlH9Mud,0,0
578926481029615616,2015-03-20 14:30:03,Happy first day of spring &amp; good luck to @OSUMBB and @OSUWBB! https://t.co/E1sn0O1COA,12,17
578591563707781121,2015-03-19 16:19:13,EPA admits they did wrong by America’s farmers &amp; ranchers in rolling out the controversial Waters of the U.S. Rule http://t.co/ELLNSDICDL,4,5
578163921321893888,2015-03-18 11:59:55,"Joining KWFX &amp; KWDQ shortly to discuss the latest in DC, including our nation's budget &amp; the EPA. Listen live here http://t.co/xXXPPL7Bq9",0,1
577900912372543488,2015-03-17 18:34:49,"RT @GOPLeader: The Science Advisory Board Reform Act ensures the science guiding the #EPA’s regulatory policy is objective, transparent, &amp; …",7,0
577899864052375552,2015-03-17 18:30:39,HR 1029 seeks to increase public participation...the federal government does not have a monopoly on the truth #EPA http://t.co/IhmU1sEs5p,3,2
577899284705718272,2015-03-17 18:28:20,HR 1029 ensures the best experts are free to undertake a fair &amp; open review of EPA's regulatory science http://t.co/Z9S1FV3kEv,1,0
577876952226381824,2015-03-17 16:59:36,There's still time to apply for a summer Congressional internship in my DC office. Applications are due March 23rd. http://t.co/PSMSAHDX1b,1,1
577504104056012800,2015-03-16 16:18:02,RT @okfarmbureau: Keeping the EPA honest http://t.co/YuDKJIVkga,2,0
577498963915464705,2015-03-16 15:57:37,.@OSUMBB kicks off their March Madness run this Friday #GoPokes http://t.co/tSB1lXsKCi http://t.co/WMpK7K0L8y,0,0
577463295248101376,2015-03-16 13:35:52,We must address the EPA’s misguided regulatory overreach. My op-ed in @TheHill this morning outlines one way we can: http://t.co/cT1k73hyRo,21,7
576429508057817088,2015-03-13 17:07:58,Photo from my town hall visit to Watonga – sign up to receive alerts about future TH meetings: http://t.co/2qFUHcscpd http://t.co/7XEATl2mgy,1,0
576106040086962176,2015-03-12 19:42:38,Recently spoke ab my proposal to ensure the research EPA uses to justify regulations is open &amp; honest http://t.co/1bfEkSDnSY via @enidnews,2,1
575368094576721920,2015-03-10 18:50:18,"RT @GrowENID: You are invited to Congressman Frank Lucas' Town Hall Meeting in Enid at 9:00 a.m. Wednesday, March 11th at... http://t.co/Ad…",1,0
573181834261102593,2015-03-04 18:02:53,Look forward to hosting five Town Hall meetings next week! http://t.co/w9vcMAz8mT http://t.co/B1LBvG7s39,0,0
573162879949676544,2015-03-04 16:47:34,The federal agency behind some of the most arbitrary and costly regulations is alarmingly opaque http://t.co/Mw26CLWA0F,2,0
573147415538241536,2015-03-04 15:46:07,WSJ: ‘Federal Judge finds EPA withheld documents and then lied about it’ http://t.co/8vlz8Y8xXF,4,1
572881526506958849,2015-03-03 22:09:34,Great to meet with @OStateSGA students who are visiting Washington to advocate for higher education. #GoPokes http://t.co/VEGAGaon9l,8,23
572783146531463168,2015-03-03 15:38:38,I stand with Israel and look forward to hearing from one of our nation's closest allies. Watch PM @netanyahu here: https://t.co/pGvaSov0PD,0,2
572482341844725762,2015-03-02 19:43:21,"Even before I was old enough to read, my Grandmother would read to me The Cat in the Hat. #ReadAcrossAmerica http://t.co/5snGRVrvMv",0,2
572446925347287040,2015-03-02 17:22:37,Don't miss this month's newsletter! Sign up here: http://t.co/2qFUHcscpd http://t.co/lm6oa1ck9b,0,0
570998460972961792,2015-02-26 17:26:56,Thanks @USChamber for supporting my bill to strengthen the science behind EPA's regulations http://t.co/jOMpEucjUV http://t.co/K4J4rpMHt3,0,0
570714240962732032,2015-02-25 22:37:33,Americans who've saved for retirement shouldn't have to pay for the economic methadone we've existed on for six years http://t.co/ZWCICSHdld,0,0
570698389551230976,2015-02-25 21:34:33,I asked Fed Chair Yellen about consequences of the central bank's quantitative easing on older Americans &amp; savers http://t.co/WbdSbPJpoF,0,0
570629912937275394,2015-02-25 17:02:27,This week I introduced a bipartisan bill to ensure research behind EPA's costly regulations is unbiased &amp; transparent http://t.co/uw6VXlpLVi,4,2
569905348804538369,2015-02-23 17:03:18,"On this day, seventy years ago – U.S. Marines raise the American flag over Iwo Jima http://t.co/OpVOQOuZuh",16,9
565921279480717312,2015-02-12 17:12:01,Dodd-Frank regs actually hurt smaller lenders the most &amp; leave consumers w/ fewer choices than ever http://t.co/zFDvOP5yku via @EdMorrissey,0,0
565608882064883712,2015-02-11 20:30:40,Great meeting w/ OK Rural Water Association – the folks who work to protect one of our most critical resources in OK http://t.co/Gmhz0bsIKA,3,3
565525375607128064,2015-02-11 14:58:51,"RT @OSUCASNR: Don't forget the Frank Lucas Policy Internship Application is due this Fri., Feb. 13 to 136 AGH by 5 PM. http://t.co/nvfAWflb…",1,0
565266207360958465,2015-02-10 21:49:00,Proud to join my colleagues today to support reauthorization of NASA in a sustainable &amp; transparent manner http://t.co/vZdjJHgJUS,2,3
564881543953645568,2015-02-09 20:20:29,"For most people across rural America, #CommunityBanks are often the center of credit availability",4,1
564880991706435584,2015-02-09 20:18:18,"New study finds #DoddFrank regulations have killed community banks, promoted industry consolidation http://t.co/1JC80uT5Uk",6,3
564838215178522624,2015-02-09 17:28:19,"Check out my op-ed: ""Obama's Budget is Irresponsible"" http://t.co/eRDx2D1MgV via @StwNewsPress",0,0
563735140602753024,2015-02-06 16:25:05,"President Obama's budget is nothing more than a big government wish list – more taxes, more spending and more debt http://t.co/HjrebaHeU8",3,0
562715893135081472,2015-02-03 20:54:58,Enjoyed meeting with @SorghumGrowers this afternoon to discuss Farm Bill implementation &amp; other ag issues http://t.co/Gb9xUWfzc5,1,2
562292332721352704,2015-02-02 16:51:53,"ICYMI: On Friday, I sat down with @USDA Sec Vilsack to discuss the Farm Bill &amp; its impact on Oklahoma, via @OETAOK https://t.co/NS4uilqwZp",0,0
561211952362708992,2015-01-30 17:18:50,Appreciate @USDA Secretary Vilsack joining me in Oklahoma this morning to discuss one-year anniversary of #FarmBill http://t.co/nPYvG0nnUq,2,3
561185216841392130,2015-01-30 15:32:36,RT @AndyTBarth: Public forum w/ Rep. Lucas &amp; Sec. of Ag Vilsack. Big turnout of ag students and producers. @OKHorizonTV  @Auzemoto http://t…,8,0
560834951231594497,2015-01-29 16:20:46,"Look forward to joining @USDA Sec Vilsack tomorrow morning in El Reno, OK to discuss #FarmBill http://t.co/8Tdd9qwLhE http://t.co/B9hT9QknnW",0,2
560463066710953984,2015-01-28 15:43:02,Honored to receive the ‘2014 Wheat Advocate Award’ from @wheatworld. I appreciate your work on behalf of OK growers! http://t.co/4nVXI052fa,1,1
560441553454657536,2015-01-28 14:17:33,ICYMI: Yesterday I asked @FHFA Dir. Mel Watt ab proposed reg likely to have major adverse impact on community banks https://t.co/mbRx76rTeJ,0,0
560150143509725184,2015-01-27 18:59:35,Today we commemorate 70 yrs since the liberation of Auschwitz #HolocaustRemembranceDay http://t.co/JSld84uGBS,0,2
557891443373899777,2015-01-21 13:24:19,Americans are eager to see the president work with – not around – Congress. Read my response to the president's #SOTU http://t.co/pHTfuhlmku,0,1
557751465276878850,2015-01-21 04:08:06,The president has an opportunity to set aside his all-or-nothing approach that has driven a sharp ideological wedge in our country #SOTU,0,1
557587415096115200,2015-01-20 17:16:13,What do you hope to hear from President Obama's #SOTU tonight? http://t.co/ddLWD12qtM,0,1
555810299845283840,2015-01-15 19:34:36,Seizing the opportunity to boost our country's energy security should be a no-brainer #KeystoneXL http://t.co/3Nw6UpRvZD,3,0
555443881417121792,2015-01-14 19:18:35,Today we voted to roll back President Obama's unprecedented &amp; undemocratic executive amnesty http://t.co/3CGBse1NvL http://t.co/Jljnto0hg9,4,2
555112000683249664,2015-01-13 21:19:49,This week the House is working on a bill to reverse President Obama’s executive amnesty &amp; strengthen border security http://t.co/u6AHQWLDxF,28,14
554013320869842944,2015-01-10 20:34:03,The president is already threatening to block legislation that will boost our economy &amp; create jobs http://t.co/A4e3zckYqe via @NewsOK,3,0
553632023487987712,2015-01-09 19:18:55,"After 6 yrs of deliberation &amp; rising support from the public, it’s time to build #KeystoneXL http://t.co/vhhu9XPDOo http://t.co/qNNh7Z6ULL",0,1
553556143545782272,2015-01-09 14:17:23,The House is beginning it's reading of the #Constitution for the 114th Congress. Tune in here to watch live: http://t.co/0qacDx38J2,2,0
553325601181155329,2015-01-08 23:01:18,"Proud to support the #SaveAmericanWorkers Act, a practical fix to the president's complex &amp; unworkable healthcare law http://t.co/0NuvKQ8uKN",0,2
553295880556912640,2015-01-08 21:03:12,It's time to advance commonsense ideas &amp; force the president to explain why he’s blocking job-creating legislation http://t.co/VEQvhBc8z6,1,0
552497642199339009,2015-01-06 16:11:17,The view from my office on this snowy morning as we begin the new session of Congress http://t.co/x4qfbGtZnM,5,8
548181609229602816,2014-12-25 18:20:55,Wishing you and yours a very Merry Christmas! http://t.co/rZH4cFmZkj,2,3
546041541224321024,2014-12-19 20:37:03,Be sure to sign up for my email updates to receive the latest news on my work in Washington http://t.co/2qFUHcJNxh http://t.co/5BoFQzVmOk,1,0
545248001607098368,2014-12-17 16:03:48,"RT @DroversCTN: Via @DCN_Mary: Meet @RepFrankLucas. Rancher, U.S. House Ag Committee Chairman, Oklahoman #agchat #agpolicy #ranchlife http:…",2,0
545205288429953025,2014-12-17 13:14:04,"Next up, I’ll be speaking with #KWFX. Listen in live here: http://t.co/5uGflMy6q7",2,0
545203230909956096,2014-12-17 13:05:54,Joining @KWDQ to discuss the latest in Washington. Tune in live here: http://t.co/bKwh3szyTu,1,0
542718300367880192,2014-12-10 16:31:40,Proud to see Oklahoma join several other states in a lawsuit against President Obama’s executive amnesty. http://t.co/4MpunXacem via @kfor,3,4
541998239567065088,2014-12-08 16:50:24,"Last week, I joined @agripulse to discuss my experience working to pass the Farm Bill &amp; what to expect down the road http://t.co/y0F6PffrM6",5,2
541631112238612480,2014-12-07 16:31:34,We will never forget the sacrifice of those who laid down their lives to defend our great nation. #GreatestGeneration http://t.co/d7DpWHxSmd,4,3
537986992144142336,2014-11-27 15:11:08,Wishing everyone a safe and happy #Thanksgiving today! http://t.co/7XttKUBjoU,1,2
535622276205797376,2014-11-21 02:34:36,"President Obama must remember it's his constitutional duty to implement, not write, our nation's laws. #immigration",3,5
535619567985631232,2014-11-21 02:23:50,The president’s brazen executive action does nothing to stem the growing tide of illegal immigration &amp; delays fixing our immigration system,3,3
535129040697708545,2014-11-19 17:54:40,"Pres Obama promised cheaper and more reliable health coverage, yet we have seen everything but that under #Obamacare http://t.co/vXPNheY3gQ",0,1
533294038808817664,2014-11-14 16:23:01,"After over half a decade, it’s time to build the #KeystoneXL pipeline for American energy independence &amp; jobs. http://t.co/orWTu20Dct",2,4
532223465278156800,2014-11-11 17:28:57,Thank you to the brave men and women who have served to defend our country #VeteransDay2014 http://t.co/EAD5rO1wR6,8,2
522776075282427905,2014-10-16 15:48:23,.@OKCattlemen work hard to support our beef industry &amp; I'm proud to receive their 2014 Legislative Appreciation Award http://t.co/952WM1OH1i,2,3
519910312687194112,2014-10-08 18:00:52,Enjoyed hosting a town hall meeting in Perkins earlier today! Find my October TH schedule here http://t.co/keDJEZo4mc http://t.co/A3TKwLdeCi,1,1
519519198805245952,2014-10-07 16:06:43,Sat down w/ Sapulpa Chamber earlier to discuss burdensome regs coming from Washington &amp; the state of affairs overseas http://t.co/LK2ZybwQtk,0,1
517697184347996160,2014-10-02 15:26:41,Look forward to hosting 20 town halls this month! You can find the full schedule on my website http://t.co/keDJEZo4mc http://t.co/MbSdP7XA27,1,1
512330572073820160,2014-09-17 20:01:41,Interested in attending a United States Service Academy? Find out how you can apply for a nomination here: http://t.co/CklzE9YRlo,0,0
510075259362750464,2014-09-11 14:39:53,This morning our thoughts and prayers are with those who tragically lost their lives 13 years ago #NeverForget http://t.co/rtspsYCpUo,2,2
509471790507118592,2014-09-09 22:41:55,Proud to support passage of bill to block EPA's proposed water rule &amp; preserve states' rights http://t.co/75mg2Ki2UP http://t.co/rZ6l6WV2YS,8,4
509448596245073921,2014-09-09 21:09:45,Great to meet w/ @okstate_agVP Dr. Thomas Coon today to learn more about his work at @okstate_ag #GoPokes http://t.co/58KWXvNd9a,1,7
509411310543843328,2014-09-09 18:41:35,EPA push to further regulate land &amp; water would trigger an onslaught of red tape for farmers &amp; ranchers #DitchTheRule http://t.co/LotVOOnhKK,7,3
509355722568925184,2014-09-09 15:00:42,RT @HouseAgNews: House set to consider HR5078 to block EPA's proposed power grab that harms American agriculture #WOTUS #DitchtheRule http:…,24,0
499606539318341633,2014-08-13 17:20:55,Interested in interning in my Washington DC office during the fall semester? Learn more here: http://t.co/PSMSAHW6fj http://t.co/8YyRBBI5kY,5,1
494524625481904128,2014-07-30 16:47:13,"If you haven't already, be sure to sign up for my newsletter for updates from Washington http://t.co/2qFUHcb9nd http://t.co/9pCZfP2P2F",2,1
494245344134574080,2014-07-29 22:17:27,Pleased the House passed #ESA reforms today to promote openness in the listing process &amp; certainty for land owners http://t.co/GldArdN23N,2,2
492369972812075008,2014-07-24 18:05:23,Great to meet w/ OK FFA President @_garrettreed &amp; Secretary @Gatlin_squires. Proud of their hard work for our state. http://t.co/Ra9NoSDSWy,1,19
491965513950851072,2014-07-23 15:18:13,Looking forward to the #OKPrayerBreakfast tomorrow morning. Open to all Oklahomans! http://t.co/3PgU40mw1E,0,0
489857916238036992,2014-07-17 19:43:23,The president’s mixed signals on immigration have sent a green light to unaccompanied minors crossing our border. http://t.co/ELP5WnDPaR,2,0
486973742321778688,2014-07-09 20:42:42,Great to meet with Oklahoma school superintendents to discuss how we can best serve OK students http://t.co/ahHrgKwOvW,0,0
485064156781887490,2014-07-04 14:14:41,Wishing everyone a safe and happy #IndependenceDay! http://t.co/Y5sDLHzWEj,2,3
473948340497813504,2014-06-03 22:04:24,It was a pleasure visiting with constituents about congressional issues at my Alva town hall meeting. http://t.co/TtBji19N3n,1,0
473929072758620160,2014-06-03 20:47:50,I enjoyed visiting with constituents at my Cherokee town hall meeting. Glad everyone could attend. http://t.co/X7MjQdvI9v,2,2
473870614303092737,2014-06-03 16:55:33,Was a pleasure attending a Business &amp; Economic Development Roundtable in Fairview to discuss important federal issues http://t.co/EZh0qdxi79,1,1
473558505988059136,2014-06-02 20:15:20,Had a great visit about the important issues facing our country at today’s town hall meeting in Guymon. http://t.co/HWBU0cRxw2,1,1
473528933531795456,2014-06-02 18:17:50,Enjoyed visiting about congressional issues with constituents at my Boise City town hall meeting. http://t.co/SiGaK5ogtR,1,0
471761569261846530,2014-05-28 21:14:57,Tune-in to @1600kush radio tomorrow @ 7:40 a.m. CT to listen to my LIVE radio interview. Look forward to talking with Molly Payne.,2,0
470914058506739712,2014-05-26 13:07:15,Today we remember those who lost their lives defending freedom &amp; thank those who continue to serve our great country. Happy #MemorialDay !,4,1
469516730306686976,2014-05-22 16:34:46,Pleased the House passed the FY2015 #NDAA to provide for the common defense of the U.S. &amp; support our troops. http://t.co/2B8t8VAHYj,0,1
468860619043905536,2014-05-20 21:07:37,Tune-in to @TheBossKKBS 92.7FM tomorrow @ 7:20 am CT to listen to my monthly LIVE radio interview. Look forward to talking w/ Ramey Cozart.,0,0
468856854383460352,2014-05-20 20:52:39,Tune-in to KWFX 100.1 FM tomorrow @ 7:10 a.m. CT to listen to my monthly LIVE radio interview. I look forward to talking with LaDonna Herber,2,0
468856227049771008,2014-05-20 20:50:10,Tune-in to KWDQ 102.3 FM tomorrow @ 7:05 a.m. CT to listen to my monthly LIVE radio interview. Look forward to talking with Grendel &amp; Ginger,0,0
466684399493193728,2014-05-14 21:00:06,"Was a pleasure visiting Advance Pierre Foods in Enid, Oklahoma today and discussing issues important to them! http://t.co/baOwsH0OFW",1,0
466677356774449152,2014-05-14 20:32:06,Enjoyed attending a Guthrie Business &amp; Economic Development roundtable to discuss federal issues. Had a great visit! http://t.co/k4QHisUCkg,0,2
464823587875340288,2014-05-09 17:45:54,"To read my latest Frankly Speaking, ""One Step Closer to the Truth on Benghazi,"" please click on this link: http://t.co/OSG2zXvi4n",0,0
464464120927227904,2014-05-08 17:57:30,Glad I could be part of the @Okstate_ag extension documentary which airs tonight on @OETAOK at 7 p.m. CT. @Ext100Years #Ext100Years #CoopExt,5,8
464453373543350272,2014-05-08 17:14:48,Had the opportunity to speak to members of the McAlester Oklahoma Chamber of Commerce today. We had a great visit! http://t.co/MN165QXzvp,1,0
464393607735431168,2014-05-08 13:17:18,"As we celebrate the 100th Anniversary of the Smith-Lever Act, it's great to marvel on the success of the #CoopExt. @Ext100Years #Ext100Years",1,2
464183401096806400,2014-05-07 23:22:01,"I supported H. Res. 574 to hold Lois Lerner, former IRS official, in contempt of Congress. Please read my statement http://t.co/m3bY2Iytvx",0,1
463775849854939136,2014-05-06 20:22:34,Was great meeting with members of @OAECoops today to discuss important Congressional issues. http://t.co/DEnviEE6Nr,0,0
463735910396198912,2014-05-06 17:43:51,Enjoyed meeting with Oklahoma Librarians today to discuss issues important to them. http://t.co/34mGN3hNps,0,0
463714241917100032,2014-05-06 16:17:45,It was an honor to receive the @NRECANews Distinguished Service Award today! #CoopsInDC http://t.co/O4i4kkUeJm,4,2
461651650814693376,2014-04-30 23:41:45,Pleased the House passed H.R. 4486 the Military Construction/VA Appropriations for FY2015. Read my statement here: http://t.co/B25xlNfj2Q,0,0
461590762711298049,2014-04-30 19:39:48,Glad I had the opportunity to meet with @theFSpac Oklahoma representatives to discuss important education issues. http://t.co/8R2qYlZrPt,3,10
461585674521436160,2014-04-30 19:19:35,Glad I had the opportunity to speak to members of the @EnidChamber &amp; visit about issues important to their city. http://t.co/OvP47wR3yU,3,1
461190020729012225,2014-04-29 17:07:24,Enjoyed meeting w/ members of the Oklahoma Association of Optometric Physicians &amp; discussing issues important to them http://t.co/Lrebuosxbb,0,0
459723154286727170,2014-04-25 15:58:35,"My office is now accepting Service Academy applications. For more information, please read my latest Frankly Speaking http://t.co/z15debOX1J",1,0
459444648331976705,2014-04-24 21:31:54,Had a great visit about important issues facing our country at today’s town hall meeting in Taloga. http://t.co/sEXUgUmLwo,1,0
459418949973590016,2014-04-24 19:49:48,Enjoyed visiting about Congressional issues with my constituents at my Woodward town hall meeting. http://t.co/LsUPqGlOsZ,0,1
459054349855895552,2014-04-23 19:41:00,Was great attending a Ponca City business &amp; econ. development roundtable &amp; discussing issues important to their area. http://t.co/l5aVQ0kTwM,1,0
