id,created_at,text,retweets,favorites
600318987319287808,2015-05-18 15:16:14,"ISIS, the terrorists Obama referred to as a ""JV team,"" just captured another city. http://t.co/m4yO5cCbGR",2,1
599202050136735744,2015-05-15 13:17:56,ObamaCare website company quits. http://t.co/hatMdym41D,2,0
598902833673588738,2015-05-14 17:28:57,Read my latest column in the @NOLAnews on why we should allow the Export-Import Bank to expire: http://t.co/iB8FBSVoLY,3,1
598606075403833348,2015-05-13 21:49:44,H.R. 36 protects the lives of pre-born babies in the fifth month of development. http://t.co/tQ0m1eRe6D #theyfeelpain,5,3
598490621100335104,2015-05-13 14:10:58,They have no voice but they are not alone. #HR36 #theyfeelpain http://t.co/dKkSyCJbfQ,5,4
598489452122603520,2015-05-13 14:06:19,Honored to receive the @ACUConservative 's Award for Conservative Excellence from @mschlapp this week. #ACUratings http://t.co/syIURGIygg,3,2
597765840843481088,2015-05-11 14:10:57,Great news: Louisiana has moved up to number 7 among the 50 states for a positive business environment. http://t.co/N7OD07PBSe,5,2
596362330784555008,2015-05-07 17:13:54,Join me in a #NationalDayofPrayer as we pray for our nation. http://t.co/ihTGsHFE8f,10,11
596322629449097218,2015-05-07 14:36:08,"Today we celebrate the 64th #NationalDayofPrayer. Read: ""An Open Letter to American on Prayer"" which I signed: http://t.co/Xtpl5UFB9y",8,5
595593473102901248,2015-05-05 14:18:44,"As global warming policies are damaging the European economy, skepticism grows among scientists and politicians.http://t.co/h2LijKv3Hf",7,1
594156806571712512,2015-05-01 15:09:56,Voted last night to protect First Amendment Rights for Residents of the District of Columbia.http://t.co/9asDpOJyeY,3,4
593887665084313600,2015-04-30 21:20:27,It was great to meet with Dr. James Hobley from Shreveport this afternoon. http://t.co/6ImdlAre4Z,5,4
593131245418196992,2015-04-28 19:14:43,The U.S. Supreme Court does not have the right to redefine marriage. http://t.co/GqODKVwXPz,13,13
593082825336877056,2015-04-28 16:02:19,"#Marriage should be determined by the states, not the Supreme Court. #Stand4Marriage http://t.co/NmZyoCwyNE",16,19
592710693335539713,2015-04-27 15:23:35,Iranian Jews think Obama and some in Congress are naive when it comes to negotiating with Iran. http://t.co/gvrdkqpKpJ,4,0
591231140834500608,2015-04-23 13:24:23,It was an honor to accept the Guardian of Seniors’ Rights award from the  @60PlusAssoc this week. http://t.co/NPFTR3cVco,2,2
590886684214059009,2015-04-22 14:35:38,RT @SlapYaMama: @RealMissLAUSA visits our Nation's Capitol &amp; LA Congressman @RepFleming..He keeps #SlapYaMama in his office! http://t.co/xD…,8,0
590886461895004160,2015-04-22 14:34:45,Glad to support the Air Force's decision to realign B-1 and LRS-B Under Air Force Global Strike Command http://t.co/9ZC192II83,1,1
590149793986568192,2015-04-20 13:47:29,"Radical Islamists continue killing Christians around the world. Obama says nothing, does nothing. http://t.co/OcaADquV2b",22,7
589072498030960640,2015-04-17 14:26:42,The military has low morale. Cites leadership as the problem. http://t.co/rax3npbyq3,12,5
588795416558313472,2015-04-16 20:05:41,Today I voted to fix the broken tax code + rein in IRS abuses http://t.co/MNSinTAmFh,3,2
588736923092520960,2015-04-16 16:13:15,RT @FAIRImmigration: Running into friends at @FAIRImmigration's radio row -  @SenatorSessions and @RepFleming. http://t.co/ScSJsK9MOx,7,0
588736646444638208,2015-04-16 16:12:09,Remember that school loans were put under direct control of the federal government. http://t.co/ut7qAJkyFA,2,0
588458968323739648,2015-04-15 21:48:45,Had the privilege of meeting with Miss Louisiana and other contestants this afternoon. http://t.co/f6eN4L5t3V,2,0
588425858286747648,2015-04-15 19:37:11,My latest op-ed on fixing the tax code via @mindenph http://t.co/ntLK7QU7gT #TaxDay,2,1
588354398033747968,2015-04-15 14:53:14,M6 alternative disposal method selected via @shreveporttimes http://t.co/twupwiN6wN,2,0
588343232649687040,2015-04-15 14:08:52,Each year we're reminded that we need to simplify the tax code. Happy #TaxDay http://t.co/M6ZIwsM1th,12,6
588039879763881986,2015-04-14 18:03:27,Recently I visited North Caddo Medical Center in Vivian and was given a tour of the hospital’s expansion project. http://t.co/W8grhPFNn3,1,0
587613347870285825,2015-04-13 13:48:34,"""Cuomo’s StartUp NY Program Creates a Whopping 76 Jobs, Costs Taxpayers $53 Million"" via @thehill http://t.co/MIg8XAAB7R",11,5
586163881963290624,2015-04-09 13:48:54,Big Tobacco is back...in the form of Big Pot. WATCH: https://t.co/ul8D9xynVt,1,1
585867847395598336,2015-04-08 18:12:34,"Everybody knows the cost of ObamaCare has been going up dramatically. Wait until the ""Cadillac"" tax begins.http://t.co/TsEp6hvh2U",7,1
584057291109965824,2015-04-03 18:18:04,A blessed and happy #GoodFriday. http://t.co/H1zGjIHwZ7,5,5
583997663122685953,2015-04-03 14:21:07,"Under Obama, job recovery isn't happening. http://t.co/cPGgmZZCSb #JobsReport",0,1
582896830087843840,2015-03-31 13:26:48,I am pleased the Senate confirmed General Robin Rand as @BarksdaleAFB_LA new Commander. http://t.co/J1yfTxrYwX,3,2
581446144162729985,2015-03-27 13:22:18,Yesterday I voted for the Medicare reform bill to offer stability to physicians. http://t.co/AmoiOZHiUM,4,2
581087874889703424,2015-03-26 13:38:40,The House budget I voted for yesterday provides a fiscally sound path forward for our country.  http://t.co/Kx9btaysxR,5,3
580813650027499520,2015-03-25 19:28:59,"""Marijuana Extract for Children with Epilepsy is Questioned"" via @WSJ http://t.co/MacESzttaE",1,0
580733435771240448,2015-03-25 14:10:15,"Avonlea, my beautiful granddaughter, came to visit her Pops in my Congressional office this week. http://t.co/0umOfRFRJo",0,6
580446926295957505,2015-03-24 19:11:46,"RT @NatResources: “Taxpayers...deserve accountability, and transparent, responsive government"" - @RepFleming http://t.co/IDczTHAtwf http://…",6,0
580008409971458049,2015-03-23 14:09:15,Five years ago today #Obamacare was signed into law and it’s still hurting people.  Share your story/ concerns: https://t.co/Wb6fRLWyjK,3,3
579016256768077824,2015-03-20 20:26:47,Join me tonight at 5:22pm EST as I discuss the growing hostility toward #religiousfreedom with @tperkins http://t.co/HkWHaqpueY,2,3
578925104903667712,2015-03-20 14:24:35,RT @peter100percent: Thank you @RepFleming for all you do to cure #cysticfibrosis @CFAdvocacy @CF_Foundation http://t.co/uKDXIDNXQ4,6,0
578924855774556160,2015-03-20 14:23:36,Obama exposes his plan to skip over the Congress and go straight to the UN to work against Israel. http://t.co/rqIyDVkG4Z,11,3
578594114318557184,2015-03-19 16:29:21,Took my grandson on the House floor today. http://t.co/RN2OCuSVQ7,4,7
578553571249152000,2015-03-19 13:48:15,#TBT to when I shook @netanyahu's hand a few weeks ago at a joint session of Congress. Congrats on re-election! http://t.co/e82jAgzkX3,0,4
578279234768134145,2015-03-18 19:38:08,Introduced legislation today with @RepGwenGraham that will make filing taxes easier for seniors. http://t.co/6hsWNoRu0M,5,8
578189687296286720,2015-03-18 13:42:18,Happy #AgDay and thank you to our farmers! http://t.co/DwDV5BAg8S,4,7
577869790594760704,2015-03-17 16:31:09,ICYMI I discussed the House budget with @TeamCavuto last night. Watch HERE: https://t.co/f6HEeArmgk,1,0
577828478575316992,2015-03-17 13:46:59,"Al Gore says ""climate-change deniers"" should be punished. Does he deny selling his company to a big oil company? http://t.co/YseztqMUmm",3,5
577546227740471296,2015-03-16 19:05:25,RT @FRCdc: Join 60k Americans in standing up for #religiousfreedom for our military chaplains like Wes Modder: http://t.co/yL1cGoY0zS,14,0
577490193776840704,2015-03-16 15:22:46,RT @jfradioshow: We can't get this done until we have a Republican President. We need to look at our leadership. They need to be bold&amp; cour…,2,0
576467618703532032,2015-03-13 19:39:25,"Have a Blessed Day. ""Air Force Reinstates Phrase After Brief Prohibition"" via @BreitbartNews http://t.co/BTyqbiFJ9T",5,0
576025134332567552,2015-03-12 14:21:08,CRS: Illegal immigrants under Obama's Executive Amnesty will receive Social Security payments. http://t.co/NVGLYCBAfD,8,0
575346820399951873,2015-03-10 17:25:46,CBO predicts spike in Obamacare premiums. http://t.co/W5VTWcVJmo,5,0
574958504349462528,2015-03-09 15:42:44,"Net job growth under Obama, all to foreign born. via @BreitbartNews http://t.co/Uoh2Hf4HVl",5,1
573874215520174080,2015-03-06 15:54:09,The Obama administration apparently lied to the court about executive amnesty via @WashTimes http://t.co/3YWQlFG3fv,24,9
573542140774649856,2015-03-05 17:54:36,It was an honor to meet with Hall of Fame and five time NCAA Champion Skip Bertman yesterday. http://t.co/04EMCnXDeu,6,3
573131884512870401,2015-03-04 14:44:24,"""DHS approved 100,000 expanded amnesty applications before judge halted program"" via @washingtontimes http://t.co/cYW4Gssgq9",6,1
563824476929159168,2015-02-06 22:20:05,About to talk live on @FRCdc radio. Click on the link to listen http://t.co/HkWHaqpueY,5,2
563814836224950273,2015-02-06 21:41:46,"RT @FRCdc: Craig James sits in for @TPerkins on #DCwatchlive at 5pm. He'll be joined by Bob Maginnis, @RepFleming &amp; Bob Morrison http://t.c…",3,0
563740168893784064,2015-02-06 16:45:04,On @CNN The senate needs to pass this DHS funding bill and send it on to the president.,4,3
563737973263704064,2015-02-06 16:36:21,About to go on @CNN to talk about Senate Democrats blocking DHS funding to preserve the president's amnesty.,1,2
563703002369105920,2015-02-06 14:17:23,I would vote today to stop all funding for Planned Parenthood. Rep Fleming on C-SPAN,1,1
563693380463763457,2015-02-06 13:39:09,On now on @cspan #WashingtonJournal http://t.co/erIFdHIHhd,3,2
563687727913517057,2015-02-06 13:16:41,I'll be on @cspan at 7:30 AM CT talking about the House Freedom Caucus and the president's budget.,4,2
563360529226686464,2015-02-05 15:36:31,About to talk live with @jeffcrouere on @wgso990am New Orleans. Click on the Listen Live link http://t.co/Sw2xYwKCkQ,3,1
563092720290635777,2015-02-04 21:52:20,Illegals to get tax benefits for illegal work http://t.co/lwc73irFVw,3,0
562711174446604288,2015-02-03 20:36:13,Joining @PointofViewRTS to talk about the House Freedom Caucus,4,0
560561840921788416,2015-01-28 22:15:32,RT @FRCdc: .@SenatorSessions calls on DOJ nominee to speak out against a President who's “out of step” w/ own laws on marijuana http://t.co…,8,0
560519687092850689,2015-01-28 19:28:02,Great time today talking w @CSHSGators students who are in DC this week as part of a Close-Up Foundation trip http://t.co/QCX1V4XZgZ,1,0
559832787373801472,2015-01-26 21:58:32,RT @tperkins: Joining #DCWatchlive today is @RepFleming &amp; @BobbyJindal. Tune in live at 5pm ET: http://t.co/9eBvLktkwP,5,0
559734503229632512,2015-01-26 15:27:59,"RT @MelindaDeslatte: GOP congressmen form House Freedom Caucus with ""agenda of limited, constitutional government in Congress."" @RepFleming…",9,0
558278548495294465,2015-01-22 15:02:32,Welcome to all the Louisianians who came to DC for @March_for_Life  Thank you for standing for the unborn! #WhyWeMarch,7,5
558277931043397633,2015-01-22 15:00:05,Thankful for you! RT@LARighttoLife Thankful for Louisiana Students for Life college students who made the trip to DC http://t.co/8sflKZtz9V,0,0
557728593833652228,2015-01-21 02:37:13,"RT @HouseCommerce: That single pipeline will support over 42,000 American jobs. Why stand in the way? #TimetoBuild #SOTU",31,0
557727378441789441,2015-01-21 02:32:23,"Washington needs to repeal #Obamacare, cut taxes &amp; slash unnecessary &amp; burdensome regulations http://t.co/gveOSDRbGr #SOTU",1,3
557725608785231873,2015-01-21 02:25:21,The national debt has risen by $7.5 trillion under President Obama. Now at more than $18 trillion. #SOTU,4,3
557724990783897602,2015-01-21 02:22:54,"From the administration that claims to believe in ""sensible regulations"" http://t.co/qVvaiKYFbn  3,541 new rules &amp; regs issued during 2014",13,4
557724171523092480,2015-01-21 02:19:39,Nearly 7-million Americans want f/t jobs but are stuck in p/t positions http://t.co/W4650hH2ve #SOTU,5,1
557723281361752064,2015-01-21 02:16:06,"Labor force participation “continued its plummet” last month, “falling to a fresh 36-year low of 62.7 percent,” http://t.co/PxKttwGf2Y #SOTU",4,0
557714253533437952,2015-01-21 01:40:14,Private firms get access to personal data through #Obamacare website http://t.co/cPQQS33t1C,2,0
556155096774742016,2015-01-16 18:24:42,Freedom of conscience is part of who we are as a nation #ReligiousFreedomDay. http://t.co/WXsaa6l7IM,22,14
556154813638270977,2015-01-16 18:23:35,Thank you Gen. Hickman for your service @FortPolkPAO Welcome Brig. Gen. McGuire. Proud to work w you for mission JRTC http://t.co/oeLCoCGesr,1,0
555022000805396481,2015-01-13 15:22:11,Letter sent to EPA &amp; LADEQ regarding disposal of Camp Minden explosives http://t.co/N7tzg2sLJR @BillCassidy @DavidVitter @RepAbraham,7,1
555021301958848512,2015-01-13 15:19:24,RT @BillCassidy: Joined @DavidVitter @abraham_ralph &amp; @RepFleming to push EPA to answer questions on open burn at Camp Minden http://t.co/K…,8,0
553571069584744448,2015-01-09 15:16:42,RT @RepAbraham: The EPA must prove Camp Minden burn is safe. I'm standing with @RepFleming &amp; @DavidVitter to hold the EPA accountable http:…,12,0
553566652550643712,2015-01-09 14:59:09,Listen live as I stop by Ringside Politics with @jeffcrouere at about 9 AM CT  http://t.co/YqlR6KoDkP,0,0
553565890743373827,2015-01-09 14:56:07,About to talk live with @jeffcrouere on @wgso990am.,0,0
552862202064289792,2015-01-07 16:19:55,About to talk live with Moon Griffon on @kpel965 @710keel @KSYL970 Listen online at http://t.co/UJTYYAU546,0,0
549994333630631937,2014-12-30 18:24:02,Obamacare architect admitted in 09 that only way it would be affordable is to deny care. Death panels anybody? http://t.co/VZ9Abs38vG,5,3
549601685736521728,2014-12-29 16:23:47,RT @Heritage: Rocky Mountain High: 30% of Homeless in Denver Shelter Came to State for Marijuana - http://t.co/n0obSWvRT5 http://t.co/OzCJL…,108,0
543559144679440385,2014-12-13 00:12:53,RT @TheAmericanEdge: Join us ...www.710keel.com 6-7PMC with @RepFleming Cromnibus 'Disgrace' 'Gives Up' to Dems http://t.co/kkM6UnuFIN via …,4,0
543242590053609472,2014-12-12 03:15:01,"Merry Christmas, Allen &amp; thanks RT@VStrom_Rider: Thank you John. You a great Patriot and glad I have you as my Congressman. Merry Christmas.",1,0
543241668539867137,2014-12-12 03:11:21,My statement opposing the #CRominbus http://t.co/fUYFikS2yd,2,7
543234395176316928,2014-12-12 02:42:27,I voted NO on the $1.1 trillion #CRomnibus  This is not what Louisianians want.,4,18
542689789858680833,2014-12-10 14:38:23,Now on w @IngrahamAngle talking about conservative efforts to defund Obama's amnesty Listen --&gt; http://t.co/EKIFquubh3,2,0
542679608428990464,2014-12-10 13:57:55,About 8:30 AM CT I'll be on w @IngrahamAngle talking about conservative efforts to defund Obama's amnesty Listen --&gt; http://t.co/EKIFquubh3,2,1
541973912423530496,2014-12-08 15:13:44,RT @talk1073: ICYMI  U.S. Rep.John Fleming (R-Minden) @RepFleming on the upcoming GOP-controlled congress. http://t.co/HAxUbJnyy8 #AMBR,2,0
540613220088971264,2014-12-04 21:06:50,At 3:05 PM CT I'll be on @WRKO680 talking about defunding the president's amnesty. Listen live --&gt;  http://t.co/snHo3C7xJ7,0,0
540558641452310529,2014-12-04 17:29:57,"RT @talk1073: ICYMI Congressman John Fleming (R) on government funding shutdown, Saturday's elections. http://t.co/0wZ442zv4K #AMBR @RepFle…",1,0
540260214784933891,2014-12-03 21:44:07,RT @CWforA: .@RepFleming speaking as a doctor about conscience protection rights for healthcare providers/doctors. #prolife http://t.co/ik5…,5,0
540260071683674112,2014-12-03 21:43:33,"RT @RepDianeBlack: Honored 2 lead briefing w/ @RepFleming, @AllianceDefends, @CWforA et al re: #HR940 &amp; the fight 4 #religiousfreedom! http…",4,0
540242614277382144,2014-12-03 20:34:11,RT @tperkins: Congress should pass @RepFleming &amp; @RepDianeBlack's Abortion Nondiscrimination Act this yr to enforce the law: http://t.co/yz…,7,0
539895794363809794,2014-12-02 21:36:02,Thank you! RT @tperkins Thnx to @BishopHarry and @RepFleming for discussion yesterday on #DCwatchlive radio: http://t.co/A1jhsP6XCP,0,2
539825356266819584,2014-12-02 16:56:09,"RT @DailySignal: ""Why should we wait till the end of March"" to vote on a CR?"" -- @RepFleming #cwc113",4,0
539822609228365825,2014-12-02 16:45:14,Let the new Congress make a statement by voting on a new CR on its first legislative day in January #cwc113,3,1
539821469329809408,2014-12-02 16:40:42,RT @danholler: Fleming: we cannot give Senate Democrats a pass on executive amnesty. #cwc113,6,3
539820924493918208,2014-12-02 16:38:32,"RT @danholler: Fleming ""reluctant"" to support CRomnibus because of length of DHS measure. #cwc113",5,0
539819566797697026,2014-12-02 16:33:08,"RT @DailySignal: .@RepJohnFleming on #immigration: ""The President still doesn't seem to get the message.""  #cwc113",6,0
539815929342083072,2014-12-02 16:18:41,Why would we extend funding all the way to March? #immigration http://t.co/geVYxEktcu #CWC113,7,0
539815019337482240,2014-12-02 16:15:04,Talking immigration at monthly @conversations. Watch live: http://t.co/geVYxEktcu Join the conversation by using #CWC113,1,0
539800216355233793,2014-12-02 15:16:15,Taking part in monthly @conversations at 10 AM CT. Watch live: http://t.co/geVYxEktcu Join the conversation by using #CWC113,4,0
539544908315774976,2014-12-01 22:21:45,RT @tperkins: .@RepFleming joins me next on #DCwatchlive to discuss CA #abortion coverage mandate: http://t.co/uqmri3r0SP #prolife,4,0
534467666254508033,2014-11-17 22:06:36,"Talking live with @tperkins on FRC Radio, looking at Obamacare's continued downward spiral in the latest Gallup poll http://t.co/jilyA3t96j",2,2
532603859458600960,2014-11-12 18:40:30,Obamacare is not sustainable and repeal is still necessary. On http://t.co/9x5PFoqmKC talking about it with Garland Robinette,5,5
532603274361581568,2014-11-12 18:38:10,Repealing Obamacare is the topic right now on @WWLAMFM as I talk with Garland Robinette,2,2
530825644729704448,2014-11-07 20:54:30,In Sept I said of POTUS ISIS strategy: inadequate &amp; doomed to fail. It still is. http://t.co/EcEAQ1UIvE,3,1
530495113555083264,2014-11-06 23:01:05,Excellent post-election analysis by @TheHayride on the real agenda of POTUS &amp; why GOP must not fall for their scam http://t.co/cLlE0tVL8k,3,1
527816092132331520,2014-10-30 13:35:37,Looking forward to joining Moon Griffon at about 9:30 CT this morning. http://t.co/Kw55q4xikJ,1,1
527788643835207681,2014-10-30 11:46:33,I'll be on @kpel965 this morning just after 7 AM.,1,0
523176806778941440,2014-10-17 18:20:45,"RT @MelissaAttias: ICYMI w/ all the Ebola news, @RepFleming will co-chair the GOP Doctors Caucus w/ @DrPhilRoe next year after @RepPhilGing…",4,0
523123658127335425,2014-10-17 14:49:33,Obama appoints Ebola czar -  a political activist &amp; not even a doctor. Shows where the priorities of POTUS reside.  http://t.co/8U3UkDmQGw,14,4
522866885814398977,2014-10-16 21:49:14,Congress should return to DC to debate a travel ban to protect Americans from Ebola. POTUS won't lead. http://t.co/ve4wi9WqVd,2,4
519859057646383104,2014-10-08 14:37:12,About to be live on the air with Moon Griffon. You can listen on @710keel,0,0
519604430816030721,2014-10-07 21:45:24,I'll be on 90.7 FM in Shreveport w Tom Pace at 5 PM CT. Listen through the live stream. http://t.co/ovdVSGweXN,0,0
517735689744842753,2014-10-02 17:59:42,Will be with @RevCLBryant tonight at 6:07 PM CT on @710keel  We'll be talking about Ebola in the U.S. and other crucial issues.,0,1
515835726035169280,2014-09-27 12:09:55,Congressman Fleming is on C-SPAN's Washington Journal until 7:30 AM CT,2,0
515830879013572609,2014-09-27 11:50:39,"RT @cspanwj:.@RepFleming talks with us next about ISIS, the Congressional agenda, &amp; campaign2014, among other issues.",2,0
515549175115939840,2014-09-26 17:11:16,Talking with Tim Farley live now on the Sirius POTUS channel @MorningBriefing,0,0
515548684734697472,2014-09-26 17:09:19,I'll be speaking at the Values Voters Summit this afternoon at about 2:30 ET #VVS14 http://t.co/4kutdZvCQ2,2,0
515548254956953601,2014-09-26 17:07:37,On live on Sirius POTUS channel http://t.co/BmaRdxVHjt,0,0
515491691248517120,2014-09-26 13:22:51,RT @talk1073: ATF now asking for the ethnicity of gun purchasers. Rep. John Fleming @FlemingforLA joins #AMBR next to explain his objection…,1,0
514526711774322689,2014-09-23 21:28:22,Will be on live with @tperkins in a few minutes to talk about the POTUS ISIS strategy #DCwatchlive http://t.co/SSuJYctsxH,0,0
514515828034011139,2014-09-23 20:45:07,"RT @tperkins: Joining #DCwatchlive tonight are @KenBlackwell @ToddStarnes @RepFleming 
 http://t.co/CWEPc8iDuu Live at 5pm ET.",1,0
512613771484090368,2014-09-18 14:47:01,Why I voted against the president's ISIS plan https://t.co/CP6hIyMZjK,2,2
511954411388948481,2014-09-16 19:06:57,"We are seeing government and its policies accelerate a resegregation of America, and that needs to stop #INSIGHTForum",1,1
511953184332709888,2014-09-16 19:02:05,Talking about important challenges for urban America at #INSIGHTForum with @JCWatts and @ArturDavis http://t.co/d5noxJiTTC,4,0
507263878351556608,2014-09-03 20:28:27,"RT @FtPolkProgress: Reese, Fleming address force structure at AUSA breakfast http://t.co/71Kszr5p00",2,0
505366603287240704,2014-08-29 14:49:22,My wife &amp; I offer our deepest sympathy &amp; prayers to Rep. Andy Harris &amp; family on the sudden loss of their wife/mother http://t.co/Yk4uZlexUe,0,2
505085734127419392,2014-08-28 20:13:17,"RT @Country1057: Congressman John Fleming, R-La., spoke this morning at the Leonidas Polk Chapter AUSA's membership meeting. #fortpolk http…",2,0
505085453243265024,2014-08-28 20:12:10,Good meeting today in Leesville on our military &amp; mission of @FortPolkPAO http://t.co/VNCBBtT3r9 @FtPolkProgress,2,2
504002622207324160,2014-08-25 20:29:23,Looking forward to being on @MyArkLaMiss at about 4pm CT on #LouisianaLiving.,1,1
497821152040206336,2014-08-08 19:06:26,I'll be talking with Randy Thomasson on the @JanetMefferd show at 2:15 CT this afternoon. Click to listen --&gt; http://t.co/dcmcqspoBO,2,0
497820191586516994,2014-08-08 19:02:37,The most endangered entity in government: emails. http://t.co/lZO1L6LVxx,3,0
495340377835327488,2014-08-01 22:48:43,Will be live on @710keel with @RevCLBryant at about 6:25 PM CT tonight on @TheAmericanEdge talking #BorderCrisis.,3,3
492420930959048705,2014-07-24 21:27:53,RT @MikeNeedham: Xlnt letter by @RepFleming urging House to make Obama take responsibility before moving a border bill http://t.co/uZh7REet…,9,0
492317815060566017,2014-07-24 14:38:08,House Republicans need to wait for POTUS to take responsibility before pushing #BorderCrisis legislation.  http://t.co/3ezuKtJ0T8 #tcot,1,0
491603205005258752,2014-07-22 15:18:32,The case for #repeal grows stronger RT @KTBS Federal appeals court deals blow to health law http://t.co/QznRk4ohjH #obamacare,1,0
491325089590575104,2014-07-21 20:53:24,"Cuts to #MedicareAdvantage by #Obamacare. One estimate: seniors in Louisiana's 4th Dist each cut more than $2,100 http://t.co/V5V58UmXNi",2,0
491315942635606016,2014-07-21 20:17:03,Some #IRS employees suggesting that maybe Lois Lerner emails may be backed up after all http://t.co/3g6GhTYXUb,1,2
491279215774687232,2014-07-21 17:51:07,http://t.co/CaIIlAmLf1,4,4
491054505522647040,2014-07-21 02:58:12,#Hamas instructs civilians to stay in homes despite #Israel warning to evacuate http://t.co/9XOXwXfzge #tcot,7,0
491052199318130691,2014-07-21 02:49:02,Coming by the scores to a city or town near you... http://t.co/ZgKzvlJdfX #border,4,1
490150890486370304,2014-07-18 15:07:33,"No transferring illegals to Louisiana. Here's the letter I sent, along w @RepBoustany @BillCassidy @RepMcAllister http://t.co/eK0ejxM0SE",11,6
490150339182886913,2014-07-18 15:05:22,Fleming-Led Letter Demands No Transfer of Illegal Immigrants to Louisiana http://t.co/Us6hTxtZqh #tcot,1,1
490144083026141184,2014-07-18 14:40:30,I continue fighting for LNG exports http://t.co/2cukXWQaTW #NatGas #LNG #energy,1,1
490128147846029312,2014-07-18 13:37:11,"RT @ChadPergram: LA GOP Reps Boustany, Fleming, Cassidy &amp; McAllister write to HHS/DHS, demanding that no UAC's be brought to LA.",7,0
490127777107296257,2014-07-18 13:35:42,Billionaire Dem pushes climate change agenda after making billions on coal &amp; other carbon based forms of energy. http://t.co/4gUEXr2Ylo,4,0
489876633646817280,2014-07-17 20:57:45,Maybe not so good for the environment http://t.co/Tz7D6wUxdW,1,0
489767828036534272,2014-07-17 13:45:24,Maryland Governor demands illegals not be sent home but opposes sheltering in his state #border #Hypocrisy  http://t.co/GBZAy0wz1S,2,0
489525916138086400,2014-07-16 21:44:08,#Obamacare increases in New York 22% http://t.co/pS2CSJ3sRo,1,0
489456693638881280,2014-07-16 17:09:04,"It's vital that Army preserve troop strength at Fort Polk. It offers the most cost effective, rigorous &amp; relevant training @FtPolkProgress",3,2
489118776701763584,2014-07-15 18:46:18,"Doesn't pass the straight-face test RT @DavidMDrucker ""The border is secure."" @SenatorReid during his weekly news conference",5,1
489070063627284480,2014-07-15 15:32:44,"#LostEmails a contagious disease. First, it was Lois Lerner, then 6 #IRS colleagues. Now a former #FEC law-breaker  http://t.co/hikRvw1Ng5",8,4
489068874986708992,2014-07-15 15:28:00,Obama's #BorderCrisis bill shaping up to be an expensive boondoggle,5,2
