id,created_at,text,retweets,favorites
601120134619656192,2015-05-20 20:19:43,"After spending the day with Ke’Onda Johnson, I am more committed than ever to ensuring every child has a loving family. #FosterYouthVoices",12,11
601021304242864128,2015-05-20 13:47:00,RT @RepLoisFrankel: .@HouseGOP has punted Highway Trust Fund deadline 2 months deeper into the critical summer construction season. This is…,87,0
600361888778756097,2015-05-18 18:06:43,@HeadStartgov is one of the strongest investments we’ve made in our children #HeadStart50 #EngageDems,0,0
600298929666793472,2015-05-18 13:56:32,RT @Clyburn: Our children are our future. Join me in celebrating the 50th Anniversary of @HeadStartgov #HeadStart50 #EngageDems,141,0
600048765605666817,2015-05-17 21:22:28,Today is International Day Against Homophobia &amp; Transphobia. Let's end prejudice against the LGBT community #idahot http://t.co/P2JCYFkzJI,2,2
598955772324802561,2015-05-14 20:59:18,We must #knowlupus to create a future with #nolupus. Play the game and raise your knowledge about lupus! http://t.co/dZXpK5lfZr,1,1
598851797806161920,2015-05-14 14:06:09,"RT @RepPerlmutter: Let's renew Highway Trust Fund ASAP. @HouseGOP's needless crisis casts uncertainty on 6,000 US construction projects. ht…",102,0
598118007949422592,2015-05-12 13:30:20,"RT @repblumenauer: There are just 7 legislative days until Highway Trust Fund expires. @HouseGOP, end the dysfunction &amp; bring us a bill. ht…",98,0
595952710798680065,2015-05-06 14:06:13,RT @NydiaVelazquez: This National Small Business Week we salute American entrepreneurs who create 3 out of 4 new jobs. Let's help them succ…,139,0
595694148944003073,2015-05-05 20:58:47,Rivlin meets delegation of congressmen http://t.co/XxHbp4Dh4g via @timesofisrael,3,0
595596592582893571,2015-05-05 14:31:07,At a meeting with Prime Minister #Netanyahu on my 16th trip to Israel. http://t.co/RiExAMModm,13,11
594198756515536896,2015-05-01 17:56:37,Disappointed that @HouseGOP passed a resolution that permits DC employers to discriminate against women for their healthcare choices.,4,1
594197489399496704,2015-05-01 17:51:35,Join me in paying homage to Jewish Americans who have helped shape our nation and world this #Jewish American Heritage Month. #JAHM,3,4
594139112812257280,2015-05-01 13:59:37,"RT @RepDennyHeck: With only 25 legislative days until Ex-Im Bank expires, @HouseDemocrats are moving to force a vote to save #ExIm4Jobs htt…",56,0
593883857583284224,2015-04-30 21:05:20,Proud to support the #RaiseTheWage Act introduced today that will boost the federal minimum wage to #12by2020,2,2
593415815707414529,2015-04-29 14:05:30,RT @RepCummings: We can't allow violence to distract from our purpose. We must continue with peaceful calls for justice to honor the memory…,373,0
593123103796031488,2015-04-28 18:42:22,RT @USAID: We're providing an additional $9 million in assistance for the #NepalQuake emergency response: http://t.co/Zxf93LR2fT http://t.c…,273,0
591271345738092544,2015-04-23 16:04:08,"RT @NAACP_LDF: ""#LorettaLynch is the first AG nominee to be filibustered in US history."" - @SenatorReid #ConfirmLynch",32,0
591258803850649600,2015-04-23 15:14:18,"Join me in celebrating #Israel ’s 67th #IndependenceDay, Yom Ha’atzmaut.  Wishing  everyone a Chag Sameach.",0,0
590937255029669888,2015-04-22 17:56:35,"Happy #EarthDay! Today we focus on leaving a healthier, stronger &amp; more livable planet for future generations. http://t.co/Y9dHkD7Fjw",6,1
590515262580985857,2015-04-21 13:59:44,"RT @keithellison: .@HouseGOP, let's invest in America's hard-working families instead of giving away billions of dollars to the top 0.2%.",102,0
590160123722629120,2015-04-20 14:28:32,RT @repjoecrowley: FACT: @HouseGOP has spent this entire Congress blowing up the deficit w/ unpaid-for tax giveaways overwhelmingly tilted …,132,0
589077400073428992,2015-04-17 14:46:11,Hastings Introduces Resolution Recognizing America’s Homeless Veterans http://t.co/wEp2MDFYrg,3,2
588776650596319232,2015-04-16 18:51:07,"On this #HolocaustRemembrance Day, let us rededicate ourselves to the fight to end anti-Semitism, bigotry and hatred in all of its forms.",3,4
588745466344566785,2015-04-16 16:47:12,Proud to be an original co-sponsor of @RepAndreCarson ’s resolution condemning discrimination against #LGBT Americans. #Equality,2,2
588405444915437570,2015-04-15 18:16:04,"Today is the 150th anniversary of Pres. Lincoln's assassination, we honor him for freeing millions &amp; keeping the Union together #Lincoln150",2,4
588336426221228032,2015-04-15 13:41:49,"RT @StaceyPlaskett: Today marks 100 days of the new Republican Congress: 100 days of dysfunction, obstruction &amp; distraction. Americans dese…",161,0
587989413952671745,2015-04-14 14:42:55,On Equal Pay Day we must continue to ensure #equalpaynow for equal work by closing the wage gap. #EqualPayDay http://t.co/sh9s9A0nba,7,0
587709732196069376,2015-04-13 20:11:33,"Working families need bigger paychecks &amp; better infrastructure, but 100 days into this Congress, GOP refuses to help. http://t.co/adpBc14k4a",3,3
587675894338232321,2015-04-13 17:57:06,".@HouseDemocrats want to raise wages &amp; cut taxes for hard-working families, @HouseGOP keeps fighting for wealthy few. http://t.co/Wmq7cUvpxD",4,3
586574687322406913,2015-04-10 17:01:18,Every day 33 young people become infected with HIV. Let's encourage our youth to get tested. #NYHAAD http://t.co/IEwdggdZC3,2,4
586530831218388992,2015-04-10 14:07:02,RT @RepHankJohnson: .@HouseDemocrats want to pass #BankOnStudents legislation that allows borrowers to refinance their student loans. http:…,147,0
585167997125451776,2015-04-06 19:51:37,The @HouseDemocrats have filed a brief in support of POTUS' #ImmigrationAction to strengthen families and US economy. http://t.co/Oc2icsFkhZ,6,6
582612270401884161,2015-03-30 18:36:04,"RT @HRC: ""Opposing discrimination takes courage...it’s time for all of us to be courageous."" -Apple CEO @tim_cook http://t.co/6cjrHjMwev @H…",169,0
582565448316809217,2015-03-30 15:30:01,Hastings’ Statement on Deadly Church Van Crash in Glades County  http://t.co/fFkyq6C26s,0,0
581083355246104577,2015-03-26 13:20:42,RT @RepMarciaFudge: No hiding the radical and destructive values in the #GOPbudget. We should #InvestInKids. They’re our future. http://t.c…,177,0
581078858197266433,2015-03-26 13:02:50,Proud to support the Paycheck Fairness Act. Ensuring #EqualPay for equal work and closing the wage gap. http://t.co/2mWrEHIC3H,2,1
580122461926240256,2015-03-23 21:42:27,Hastings Introduces Resolution Honoring Dr. Elmira Mangum as the First Female President of Florida A&amp;M University http://t.co/pJybeOdTsI,0,0
580095747951058945,2015-03-23 19:56:18,RT @RepJudyChu: The *real* #MarchMadness is happening in Congress. Which of these Republican proposals is your top pick? http://t.co/wpsdLd…,19,0
580057591990128640,2015-03-23 17:24:41,"Thanks to the #AffordableCareAct, which turns 5 today, millions now have access to healthcare! #ACAisWorking http://t.co/6hS1BtnvRh",3,2
579609599436808192,2015-03-22 11:44:31,Happy #WorldWaterDay ! Read USAID op-ed about #WASH and #sustainability http://t.co/90VGYwT1Qr #WaterIs @USAIDEnviro,5,3
578664894729453569,2015-03-19 21:10:36,I stand with all Tunisians rallying against tyranny &amp; terrorism at the site of yesterday's tragic event. #Democracy #Tunisia,3,3
578631409960615936,2015-03-19 18:57:33,Proud to vote against Republicans' latest move to undermine workers' rights. #UnionElections,1,3
578603003403440128,2015-03-19 17:04:40,"Proud to stand with @RepJohnLewis, @Clyburn, @WhipHoyer, @RepJohnConyers &amp; @RepBrady as an original cosponsor of the Voter Empowerment Act.",8,7
578263242159624192,2015-03-18 18:34:35,Hastings and Schweikert Condemn Tunisia Museum Attack  http://t.co/F8z8VPjs3T,2,1
578247973781573632,2015-03-18 17:33:54,"The @NYTimes on #GOPbudget: ""The plan’s deep cuts land squarely on the people who most need help: the poor &amp; the working class.""",2,4
578208707995156480,2015-03-18 14:57:53,"Today I joined in intro #SocialSecurity 2100 Act to cut taxes for seniors, improve benefits &amp; strengthen the program http://t.co/yVtGYBfH6S",5,2
577528963381243904,2015-03-16 17:56:49,@HouseGOP needs to move past the drama &amp; work with Dems for bigger paychecks &amp; better infrastructure for Americans. http://t.co/yT3vKc4RcU,0,0
577473558114349056,2015-03-16 14:16:39,RT @ChrisVanHollen: Americans want &amp; deserve a budget that puts the #MiddleClassFirst. Time for better infrastructure &amp; bigger paychecks fo…,198,0
576080292462641153,2015-03-12 18:00:19,Lynch exemplifies what #WomensHistoryMonth is all about. #ConfirmLynch http://t.co/pUqntZBPyO,6,2
575323998592090114,2015-03-10 15:55:04,RT @repjohnlewis: We commemorated the 50th annv of Bloody Sunday. Now it's our responsibility to fix SCOTUS decision that put a dagger in t…,566,0
574976848502898690,2015-03-09 16:55:37,Proud to be 1 of 211 Members urging #SCOTUS to strike down state same-sex marriage bans #MARRIAGEEQUALITY http://t.co/GjfelMxxOR,4,6
573198384586203137,2015-03-04 19:08:39,Rep. Hastings Introduces Legislation Addressing Chronic Homelessness Nationwide http://t.co/dQM3MPkMbx,4,5
573193260799303682,2015-03-04 18:48:17,RT @CecileRichards: Obamacare is working - and we can’t go backward. A must-read with everything you need to know about #KingvBurwell: http…,36,0
572878164084457472,2015-03-03 21:56:12,Glad the @GOPHouse finally stopped playing games w/ Nat Sec &amp; passed a clean @DHSgov funding bill…Sadly 3 months later than necessary,5,4
572498409153802240,2015-03-02 20:47:11,Hastings’ Statement in Recognition of Women’s History Month http://t.co/Tcfk63dudi,3,2
572425582283259905,2015-03-02 15:57:48,"The @HouseGOP ‘s love of Ground Hog’s Day continues, weren’t we hear just last week? #DontShutDownOurSecurity http://t.co/Z3X4vaE2dg",1,1
572402469390708736,2015-03-02 14:25:58,Will never forget the first time I read Alice in Wonderland. Encourage your kids to read March 2! #ReadAcrossAmerica @NEAToday,3,3
571347419729924096,2015-02-27 16:33:34,Keeping American families safe is 1st priority of Congress. I urge my Republican colleagues #DontShutDownOurSecurity http://t.co/IWFCsqeooA,9,3
571332183937429504,2015-02-27 15:33:02,"Again @GOPHouse plays kick the can w/ @DHSgov funding, need leadership not gamesmanship to pass clean funding bill #DontShutDownOurSecurity",3,5
570987239930507265,2015-02-26 16:42:21,"Florida has 16,575 full-time @DHSgov employees protecting our nation, tell @HouseGOP #DontShutDownOurSecurity http://t.co/6Unh32jBLs",2,3
570963295248760835,2015-02-26 15:07:12,Loretta Lynch has the experience needed to excel as our next #AG. It’s time to #ConfirmLynch,1,1
570685189178986497,2015-02-25 20:42:06,"The clock continues to run out on DHS funding.  Only #3DaysTil shutdown, tell @HouseGOP #DontShutDownOurSecurity ! http://t.co/qhguE6vPRq",4,2
570321986917933058,2015-02-24 20:38:52,"Ahead of 50th Anniversary of the ""Voting Rights Act"" I'm working to mark August 6th as “National Voting Rights Day” http://t.co/K1V9Fi1uQh",2,3
570234805297786880,2015-02-24 14:52:26,#4DaysTill DHS shuts down &amp; @HouseGOP are playing games with America’s safety! Tell #GOP #DontShutDownOurSecurity http://t.co/zhpjRoyGx8,6,2
569882205423579136,2015-02-23 15:31:20,Insane that @GOPHouse continues to play political games with our nation’s security! #DontShutDownOurSecurity http://t.co/A2MLdcRGID,22,3
568147962888638464,2015-02-18 20:40:04,"Open Enrollment is over &amp; 1.6 million Floridians are receiving affordable, quality coverage through Marketplace #ACA http://t.co/V1ybCYC9Sb",3,1
566349707363254273,2015-02-13 21:34:27,Join me in supporting better access to care for kids with cancer #actnow4kidswithcancer for Childhood Cancer Awareness Day 2015,5,4
566310763309318144,2015-02-13 18:59:42,In 2 wks 40k border agents will have to work w/o pay unless GOP ends the political games and passes a clean bill #DontShutDownOurSecurity,1,4
566303963260416001,2015-02-13 18:32:40,Only 2 weeks until @DHSgov shutdown; it's time for GOP to pass clean bill &amp; stop holding national security hostage #DontShutDownOurSecurity,1,2
566296412649168897,2015-02-13 18:02:40,All 188 @HouseDemocrats support funding @DHS Tell @HouseGOP to stop risking national security to deport DREAMers #DontShutDownOurSecurity,3,2
565910769163051008,2015-02-12 16:30:16,Rep. Hastings Calls on @HouseGOP Republicans to Stop Spinning Their Wheels and Start Putting the #MiddleClassFirst http://t.co/kdofUc8g1r,9,3
565865427218477056,2015-02-12 13:30:05,"Yesterday, the GOP unanimously defeated a clean DHS funding bill. Americans deserve better. #DontShutDownOurSecurity http://t.co/VjVhmNcttU",161,61
565634175970312192,2015-02-11 22:11:11,Don't delay! 4 days left to #GetCovered. Enroll now at http://t.co/gQW9MzuuiA . http://t.co/ItjVZWGJGR,5,5
565610833787768834,2015-02-11 20:38:25,Hastings Reintroduces Legislation to Award Congressional Gold Medal Posthumously to Lena Horne http://t.co/39c6KCPtus,7,4
565604272117936132,2015-02-11 20:12:21,Proud to be an Original Cosponsor of #HR842 Huntington’s Disease Parity Act. Let's #PassTheHDParityAct and help thousands of families! #HDSA,3,1
565180703303041024,2015-02-10 16:09:14,By attaching #DHS funding to anti-immigration conditions @GOPHouse Republicans threaten the security of all Americans http://t.co/3b9xGT1aiX,6,1
564816619629993984,2015-02-09 16:02:30,Proud to be a cosponsor of @RepLowenthal &amp; @MarkeyMemo ‘s #LGBT Int'l #HumanRights Defense Act. http://t.co/MRbAe9SeSZ,7,3
564202225682362368,2015-02-07 23:21:07,#HIV is 9th leading cause of death for African Americans. Get tested &amp; spread awareness! #NBHAAD2015,6,3
563730456269844480,2015-02-06 16:06:29,Proud to support legislation that limits high capacity gun magazines and makes #gunsense Let's #SayNo2MoreAmmo http://t.co/Cs06q3HjKS,34,25
563361477676236800,2015-02-05 15:40:17,"If @HouseGOP fails to pass a clean #DHS funding bill, 50,000 TSA screeners will have to work w/out pay #DontShutDownOurSecurity",11,8
563021605237194752,2015-02-04 17:09:45,Everyone has the right to quality cancer treatment and services regardless of geography or financial situation #WorldCancerDay,14,8
562299156338077697,2015-02-02 17:19:00,With @HouseGOP to call for 56th vote to repeal #ACA it must be #GroundhogDay again http://t.co/KCtQuHL4lu,53,37
562260143963115520,2015-02-02 14:43:59,President Obama’s budget is focused on investing in an economy that puts the #MiddleClassFirst &amp; allows everyone to live the American Dream.,3,8
561227173466738688,2015-01-30 18:19:19,Proud to cosponsor International Human Rights Defense Act which will promote LGBT human rights abroad #HumanRights http://t.co/yphqmxTEWW,5,4
560802304405012480,2015-01-29 14:11:03,Hastings’ Marks Sixth Anniversary of the Lilly Ledbetter Fair Pay Act http://t.co/FzKaFs4lyX,3,2
560544896231407616,2015-01-28 21:08:12,Hastings Receives 100 Percent Score from Humane Society Annual Scorecard in 113th Congress http://t.co/Z9DfoAGYOA,3,2
560156382541127680,2015-01-27 19:24:23,Hastings’ Statement on International Holocaust Remembrance Day 2015  http://t.co/hXMASlStgs,1,0
559819916161724416,2015-01-26 21:07:23,"@SpeakerBoehner dismisses solutions to income inequality, calling them ‘dead, real dead’ http://t.co/1maW1MnRuA http://t.co/niJynHGRDv",1,3
558333271902539776,2015-01-22 18:40:00,The @HouseGOP is a party of obstruction &amp; dysfunction. Thanks Rep. Dent for the candid insight http://t.co/N8TfeSiAK4 http://t.co/CQGPW9ysel,14,4
558312870203887616,2015-01-22 17:18:55,Hastings’ Statement on the 42nd Anniversary of Roe v. Wade http://t.co/Lt3gNNYDqZ,0,1
558019215333265408,2015-01-21 21:52:03,The time to remove big money from our political process is long overdue #citizensunited #getmoneyout,3,3
557973604881948672,2015-01-21 18:50:48,I’m proud to defend women’s health and rights by co-sponsoring the Women’s Health Protection Act #ActForWomen #7in10forRoe,14,26
557922270694625280,2015-01-21 15:26:49,"RT @USDOL ""It’s 2015. It’s time"" Women make 78% of what their male counterparts make. http://t.co/KNEGp7p2wK  link: https://t.co/TlrpoNFQoJ",2,2
557919342273519616,2015-01-21 15:15:11,Hastings’ Response to President Obama’s State of the Union Address  http://t.co/Mu6e35SXe5,0,1
557622260148998144,2015-01-20 19:34:41,Hope #SOTU inspires GOP end special interest handouts for corp &amp; wealthy interests. Let's fight for working families! http://t.co/vXFF22SqJy,2,1
557613434293219328,2015-01-20 18:59:37,U.S. Representatives Alcee L. Hastings and Ted Deutch to Host Briefing on ISIS’ Involvement in Sex Trafficking  http://t.co/MAq3LuNDDm,1,0
557197371373674497,2015-01-19 15:26:20,"Recent events remind us that ""Injustice anywhere is a threat to justice everywhere."" - Dr. Martin Luther King Jr. #MLKDay",3,1
557178391330570241,2015-01-19 14:10:55,"Hastings Celebrates Martin Luther King, Jr. Day http://t.co/Vw7qKSF6GA",1,0
555795999298711552,2015-01-15 18:37:47,POTUS is expanding access to paid leave. I urge @HouseGOP to join Dems in Congress &amp; #LeadOnLeave too http://t.co/YcbX0kPHCK,0,0
555767915660972033,2015-01-15 16:46:11,"“Stand with Charlie Hebdo in the fight for freedom of thought,” My thoughts on the recent tragedy in Paris. http://t.co/r33g3tHx6J",1,0
555072708950892545,2015-01-13 18:43:41,"Proud to vote for H.R. 203, the #ClayHunt SAV Act. Critical legislation to improve Veteran #suicideprevention programs @DeptVetAffairs",7,13
554739652666884096,2015-01-12 20:40:14,Watch at 5PM as I fight Wall Street giveaways &amp; endangering Nat Sec to satisfy anti-immigrant extremists in @HouseGOP http://t.co/hzmMcFK8Ee,0,0
554687870494322688,2015-01-12 17:14:28,#GOP the Party of NO comprehensive #immigrationaction Holding Homeland Security funding hostage is no way to run government,1,3
553900091015442432,2015-01-10 13:04:07,I look forward to spending time with great friends and supporters of the Everglades today. #EVCO2015,4,7
553624390420942848,2015-01-09 18:48:35,"Dec. added to the longest uninterrupted period of private sector job growth in history. Great news, but still more to do! #MiddleClassFirst",4,2
553264670011060226,2015-01-08 18:59:11,"3 days into the 114th Congress, the @HouseGOP is again working to dismantle health care for Americans. Disappointing. http://t.co/DMNsbUWYm2",2,2
552907197232197634,2015-01-07 19:18:42,Today we stand with the people of #France in mourning this unspeakable act of violence. #parisattack,1,1
552841644316581889,2015-01-07 14:58:13,"Disheartening that the GOP spent their first day fighting for special interests, rather than the needs of American workers #MiddleClassFirst",1,3
552539828299243521,2015-01-06 18:58:55,"Our march toward equality for all can't be stopped.  At long last, love wins in FL. #FLmarriage #MarriageEquality",2,6
552475624879960064,2015-01-06 14:43:48,"As the 114th Congress starts, I'm focused on creating equality for working class families, improving infrastructure and to #RaiseTheWage",1,1
544546612996227072,2014-12-15 17:36:44,Today is the deadline to enroll for health insurance coverage that starts January 1st! Sign up to #GetCovered → http://t.co/gQW9MAlhGM,1,1
543445650202169344,2014-12-12 16:41:54,"I voted against #CRomnibus to protect our middle class. We must protect retirees, not Wall Street, and insist on ridding politics of big $",2,1
542809658147479552,2014-12-10 22:34:42,Today I am proud to recognize @UN Human Rights Day and the start of the International Decade for People of African Descent. #rights365,1,2
540578930370314243,2014-12-04 18:50:35,#POTUS took bold step to keep families together. Time for Congress to act &amp; #PassABill. #ImmigrationAction,0,1
540203380443209729,2014-12-03 17:58:17,No one should have to choose between her job and the health of her pregnancy #StandWithPeggy http://t.co/sPi1waQYol,3,3
539500543174254594,2014-12-01 19:25:27,This World AIDS Day the end of #AIDS begins with us! Learn more about #HIV prevention + treatment. @AIDSgov #WAD2014 http://t.co/RQKAzg5GKV,0,0
539478778435874816,2014-12-01 17:58:58,Today we remember Rosa Parks’ courage and contribution to the Civil Rights Movement.  #RosaParks #civilrights http://t.co/uZrrmhrrvw,1,0
535803523905384448,2014-11-21 14:34:49,Child homelessness has reached a historic high in the U.S  #1in30children are homeless http://t.co/Jqz3zyzMeo,0,0
535536302612287488,2014-11-20 20:52:58,@SpeakerBoehner has had 500+ days to act on #CIR bill and Americans can no longer wait. I support #ImmigrationAction! http://t.co/rpQU96rCxn,1,1
533640000143777792,2014-11-15 15:17:45,Health Insurance Open Enrollment begins TODAY and will remain open until Feb. 15th. Get coverage now. http://t.co/ZE0iamTr1z,0,0
533365335203008512,2014-11-14 21:06:20,We are 1 day away from open enrollment! Learn how to get ready to #GetCovered https://t.co/HskmEGhIpp #HealthTalk http://t.co/wbAlrlYiMs,0,0
532944228914327552,2014-11-13 17:13:00,Need health insurance? You can start comparing plans for 2015 at http://t.co/gQW9MzuuiA today,0,0
525676909699801088,2014-10-24 15:55:16,Over the past 69 years the UN has been tackling global challenges and helping those in need. #HappybirthdayUN http://t.co/igRLWHUrw9,1,0
524965904237748225,2014-10-22 16:49:59,#RaiseTheWage @EconomicPolicy: A $10.10 minimum wage would save taxpayers $7.6 billion a year http://t.co/tZZxRY24oh http://t.co/YLI0rqDGxc,2,0
524300178434424832,2014-10-20 20:44:38,@DHSgov has announced it will create a Haitian Family Reunification Parole Program in 2015. Visit http://t.co/bS85XwFLfl for more details.,1,0
522802082513162240,2014-10-16 17:31:44,Join me in going purple for #SpiritDay to support #LGBT youth and take a stand against bullying.  #BullyingPreventionMonth,0,0
520590171834945536,2014-10-10 15:02:23,Oct. 10 is National Minimum Wage Day. It’s time we put the #MiddleClassFirst and #RaiseTheWage to $10.10 #with1010 http://t.co/3kmPpSLsDG,3,1
520295793719533569,2014-10-09 19:32:38,Received a score of 100 from @HRC in 113th Congress.Tell your elected officials/community leaders that #LGBT equality is important to you!,1,1
519939861722431489,2014-10-08 19:58:17,Today is Latina #EqualPay Day. Latina women earn 56 cents for every $1 earned by men. It’s time Congress #RaiseTheWage #Igualdadsalarial,1,1
519495437066440705,2014-10-07 14:32:18,Let's end economic insecurity for 4 million African Americans and make the minimum wage a living wage! #RaiseTheWage http://t.co/JNpX3pGGMo,1,0
519245331369046017,2014-10-06 21:58:28,Today’s #SCOTUS decision is another victory for #MarriageEquality. #LGBT Americans deserve just + fair treatment under law in all 50 states!,2,1
518098526673575937,2014-10-03 18:01:29,U.S. manufacturing supports 1 out of every 7 American private sector workers. That's 17.8 million jobs. #MfgDay14,6,6
517739803203629058,2014-10-02 18:16:02,"There's no dignity in working a 50 hr. week &amp; then going to a food pantry at the end of the week."" -@LaborSec on the need to #RaiseTheWage",0,0
517419314761465856,2014-10-01 21:02:32,October is #BreastCancerAwarenessMonth. 1 in every 8 women will develop breast cancer in her lifetime. #PinkPower #Mammogram,0,1
516653715013771265,2014-09-29 18:20:19,Today is #WorldHeartDay ! Have a happy start to your week by choosing to make healthy #heartchoices ! http://t.co/OjHxyNGdiQ,0,0
515552206867558400,2014-09-26 17:23:19,Today @UKParliament voted on airstrikes against #ISIL. Congress should reconvene now to voice views of American people on US mil strategy!,0,1
515522066280632321,2014-09-26 15:23:33,September 27 is National Gay Men’s HIV/AIDS Awareness Day. Get the facts and get involved at http://t.co/jzCqDX03iy! #NGMHAAD #StartTalking,1,0
514824793032777728,2014-09-24 17:12:50,August 14 &amp; yesterday I asked @SpeakerBoehner to reconvene Congress to debate US response to #ISIL. We must act now! http://t.co/ajGVlNMMA8,2,1
514795875135389697,2014-09-24 15:17:55,"Happy #RoshHashanah to all celebrating the Jewish New Year, marking the start of the high holidays and wishing all a peaceful year",0,0
514531780888895488,2014-09-23 21:48:30,Time is now for Congress to debate #ISIL threat. See my letters to @SpeakerBoehner and @WhiteHouse http://t.co/tA9kloTd0T,1,1
514454812227039232,2014-09-23 16:42:40,Happy National Voter Registration Day! #CelebrateNVRD by getting registered RIGHT NOW: http://t.co/DXm2gRQ0v3,0,0
513034456492670976,2014-09-19 18:38:40,"3 years ago military’s discriminatory Don’t Ask, Don’t Tell finally came to an end. Let’s honor all who serve our great nation! #DADT #LGBT",1,0
512989105257730048,2014-09-19 15:38:28,316 days since Senate passed #ENDA to protect #LGBT workers. Tell @SpeakerBoehner that you #DemandAVote in the House! http://t.co/qxPZgcw59K,1,1
512227349203812352,2014-09-17 13:11:31,"According to @iava 5,500+ veterans died from suicide this year. We're working to #Stop22aDay #SuicidePreventionMonth http://t.co/LtgiNNTYBJ",1,1
511918665953185792,2014-09-16 16:44:55,#AskedandAnswered database of questions from 2012 #Benghazi attacks. #BenghaziAnswered  http://t.co/F4fR4s0hO6,0,0
511556812718751745,2014-09-15 16:47:03,Citizen participation is the foundation of democracy + transparency critical to bringing this right to people around the world #openparl2014,5,0
510479798381330432,2014-09-12 17:27:22,"Today is the 20th anniversary of @AmeriCorps, thanks to all past &amp; present AmeriCorps members for their service and impact #AmeriCorps20",6,7
510427828819881984,2014-09-12 14:00:52,Honored to join resolution condemning #ISIL for brutal killing of American journalists James Foley and Steven Sotloff http://t.co/hDDnOKNEqX,0,0
