id,created_at,text,retweets,favorites
598539119942365184,2015-05-13 17:23:41,RT @cspanwj: ICYMI: @RepJohnDuncanJr (R-TN) on foreign policy and #transportation infrastructure http://t.co/W5sqtbDUb3 #Amtrak http://t.co…,4,0
598480506452353025,2015-05-13 13:30:46,@georgewillf Flasback: #Neoconservatives are “magnificently misnamed” and “the most radical people in this town.”,1,1
598442810010927107,2015-05-13 11:00:59,Watch @cspan 745-830a today appearing on Washington Journal with @gretabrawner and taking questions from viewers. http://t.co/BfvN77gg1o,3,0
598200136775376897,2015-05-12 18:56:41,Report: Cost of Federal Regulation Reached $1.88 Trillion in 2014 https://t.co/XWmsqaGxlR via @sharethis,3,0
597863453152440321,2015-05-11 20:38:49,Duncan: Presidential libraries should disclose donors https://t.co/wPOCygteZs via @knoxnews,0,2
597861198361669633,2015-05-11 20:29:52,Thanks BES Technologies in Oak Ridge for recycling one millions gallons of water! #cleanwater http://t.co/VfwB3lUBBI,0,2
596301235168370689,2015-05-07 13:11:07,Federal #StudentLoans are creating indentured students. http://t.co/8Zo0p8DGw9,2,1
594210800212025347,2015-05-01 18:44:29,Secret presidential library donations can pose major questions http://t.co/0u9tunpCa2 via @msnbc,1,1
593028654323638272,2015-04-28 12:27:03,@MarkLFuzek You're welcome!,0,0
592681604876771328,2015-04-27 13:28:00,Eisenhower in Ike's Bluff by @evanthomasbooks: God help the Nation when it has a Pres. who doesn’t know as much about the military as I do.,1,1
592678701873176576,2015-04-27 13:16:28,"Republicans once stood for peace through strength, not endless war.  http://t.co/VoJy5rqAoN via @amconmag",5,4
590975429642706944,2015-04-22 20:28:16,Thanks Al Cecere from the American Eagle Foundation for bringing #ChallengerTheEagle by for a surprise visit! http://t.co/546pjF9bN4,1,1
589085369011933185,2015-04-17 15:17:51,‘Free-range’ kids and our parenting police state http://t.co/26cGK7hkTY,3,0
588436697626517504,2015-04-15 20:20:15,Tennesseans shouldn't pay a larger share of taxes than other taxpayers  Make sales tax deduction permanent. http://t.co/JmanHUVBsp,2,3
588434812215656448,2015-04-15 20:12:46,"Washington does not have a revenue problem, it has a spending problem, and higher taxes won’t solve it.  #TaxDay #taxreformnow",7,5
587991785512837121,2015-04-14 14:52:20,"We have the most confusing, complicated, convoluted tax system. No human being can really understand or know it all. #TaxreformNOW #TaxDay",15,7
581446960474955776,2015-03-27 13:25:32,Minimum-Wage Laws: Ruinous Compassion http://t.co/SQPpUuOHkw,2,0
578571964119441408,2015-03-19 15:01:20,"RT @newsgirl88: @RepJohnDuncanJr visited my son's school, Todd got to interview him. #ProudMama #FuturePresidentTodd http://t.co/T7jMA4nAWt",1,0
578571614880661505,2015-03-19 14:59:56,RT @RAmasonWilliams: A big thank you to @RepJohnDuncanJr for his continued support of the Alzheimer's Association @alzassociation! #ENDALZ …,2,0
578571081101012992,2015-03-19 14:57:49,"RT @RepWalberg: Thanks to the 8 new bipartisan cosponsors of the #FAIRAct: @RepMikeBishop, @ConawayTX11, @RepDeSantis, @RepJohnDuncanJr 1/2",3,0
578570562026504192,2015-03-19 14:55:45,Great trip to @ClaiborneCtyTN! Thanks to CHS and HY Livesay Middle School for inviting me to speak! http://t.co/arAI08Pd6j,0,1
576075961524994048,2015-03-12 17:43:06,Congrats Alex &amp; Heather of Hardin Valley Academy @knoxschools 4 winning Hon. Mention in @cspan Video Doc Competition! http://t.co/8ZeCgI4oFN,2,4
573233485776863234,2015-03-04 21:28:07,Best of Times or Worst of Times? http://t.co/jC7pIn24gV via @PatrickBuchanan,0,1
573136335877369857,2015-03-04 15:02:05,ET delegation votes against Homeland Security funding http://t.co/Jle5QQ9Mz2 via @knoxnews,2,0
571068226119049216,2015-02-26 22:04:09,Thanks @Webbschoolknox for visiting me this morning in the U.S. Capitol. http://t.co/RPqWjOdLwr,7,15
569935958684131328,2015-02-23 19:04:56,Reject the surveillance state http://t.co/6igzx1ooyS via @BostonGlobe,3,3
565874823763873793,2015-02-12 14:07:26,East Tennessee lawmakers supportive but cautious on war powers http://t.co/gXnEcK3ZoQ via @knoxnews,1,1
565169874503483392,2015-02-10 15:26:13,"RT @DOE_SC_NSB: Farragut Middle School from Knoxville, TN has advanced to the National Finals of the NSB! @knoxschools http://t.co/YTgBNDyp…",4,0
563724405629812736,2015-02-06 15:42:26,House to vote on Senate #KeystoneXL bill next week. Bill will finally go to @WhiteHouse.,1,2
563413514354974720,2015-02-05 19:07:04,The College Loan Bombshell Hidden in the Budget http://t.co/qprbdudTVh,2,0
562675565950689280,2015-02-03 18:14:43,The Big Lie: 5.6% Unemployment http://t.co/mFLdZxrLdp,9,3
561272928206356480,2015-01-30 21:21:08,The Persians Are Coming! http://t.co/r2k2lGhT6I via @PatrickBuchanan,1,1
560527012625145856,2015-01-28 19:57:08,Proud to join @Rep_JaniceHahn to honor #MerchantMarines of WWII.  Thousands died for our freedom. Time to say thanks  http://t.co/Q5iqIcA1WM,4,4
555029231571566594,2015-01-13 15:50:55,Honored to return to @Transport Committee as Vice Chairman and continue important work with Chairman @RepBillShuster,4,5
553289026094907392,2015-01-08 20:35:58,Climate-change’s historical precedents http://t.co/V8jCirMCS7,0,1
549942540300861440,2014-12-30 14:58:13,George F. Will: Government for the strongest http://t.co/hUunp4wgrp,0,0
545690822830600193,2014-12-18 21:23:25,Memo To WSJ: The CRomnibus Abomination Was Not ‘A Rare Bipartisan Success’  http://t.co/fXksxcZnD8,1,1
543419092934602752,2014-12-12 14:56:22,#omnibus bills are a bad way to do business.,4,3
543418751384055808,2014-12-12 14:55:01,The #CRomnibus was more than $1 trillion. National debt is $18 trillion. It gave increases to agencies more than what they were asking. #no,6,2
543418327897739266,2014-12-12 14:53:20,Could not vote for #CRomnibus bill that funded illegal #Amnesty,3,4
543058116732915712,2014-12-11 15:01:59,ET lawmakers: ‘Partisan' terrorism report puts American security at risk  http://t.co/ImkNklzvF9 via @knoxnews,1,0
540587386099744768,2014-12-04 19:24:11,"We have to have a legal, orderly system of immigration, and it must be enforced. #immigration",7,6
540587274992619520,2014-12-04 19:23:44,"We have a Constitution, and it should be followed. #Immigration",2,3
540587189286223872,2014-12-04 19:23:24,"The Administration may not like present law, but no one has the right or the power to enforce some laws but not others. #immigration",4,2
537632067878928385,2014-11-26 15:40:48,My favorite Thanksgiving food might be @SisterSchubert rolls with real butter. Wishing you all a happy #Thanksgiving w/ lots of good food!,3,6
537629890779283456,2014-11-26 15:32:09,Thanksgiving edition of #ThrowbackThursday http://t.co/VCWMtiq0fG,1,0
535791568427294720,2014-11-21 13:47:19,East Tennessee lawmakers blast executive order on immigration http://t.co/76C2D24T1w via @knoxnews,3,1
535790307112394752,2014-11-21 13:42:18,"There is a right way to do things, and there is a wrong way to do things.  This is the wrong way. #immigration #Obama",7,6
535147018662858752,2014-11-19 19:06:06,Obama’s Unilateral Amnesty Really Will Be Unprecedented – and Unconstitutional http://t.co/TevHw5iTNX via @malcolm_john @DailySignal,2,1
534815304694513665,2014-11-18 21:07:59,The stupidity of 'experts' http://t.co/kV83TxTSzr,1,0
532215824296468480,2014-11-11 16:58:35,#VeteransDay at Philadelphia Elementary School http://t.co/vOgskYnxki,0,1
532215197021523968,2014-11-11 16:56:05,#VeteransDay at Philadelphia Elementary School http://t.co/d4yJuxAukV,0,2
532214837129277440,2014-11-11 16:54:39,#VeteransDay at Philadelphia Elementary School http://t.co/wasdhJea95,1,2
530470345581789185,2014-11-06 21:22:40,RT @RonPaul: Congratulations to our champions for liberty: @repjustinamash @RepWalterJones @RepJohnDuncanJr @RepThomasMassie @DonHuffines,202,0
529660571130802176,2014-11-04 15:44:55,@TBAPowell Can't forget the teachers and chaperones! http://t.co/qnW8s93SM1,0,0
529659928907378688,2014-11-04 15:42:22,Thanks @TBAPowell 8th graders for visiting me in DC! So glad I could arrange a Senate and House floor tour! http://t.co/0GKoBvPv8n,2,7
529311299717447681,2014-11-03 16:37:02,Disclosure sought of ‘whisper gallery for Wall Street' http://t.co/FFoRGh6qYK via @knoxnews,0,0
529287385205334016,2014-11-03 15:02:00,EDITORIAL: A Grand Canyon boondoggle http://t.co/24vvRX4gUP,0,1
528240463665713152,2014-10-31 17:41:55,Thanks team @BestBuy in West Knoxville for welcoming to your store yesterday! http://t.co/8z76UWlsSy,3,1
527534673548029952,2014-10-29 18:57:21,Honored to be ranked with @repjustinamash and @RepMcClintock as top three defenders of taxpayers in House by @NTU .,27,26
527533571503046657,2014-10-29 18:52:59,"National #debt currently stands at $17.89 trillion, or about $56,059 per citizen and $153,062 per taxpayer.",3,1
526813292178583552,2014-10-27 19:10:51,Ebola vs. civil liberties http://t.co/ImahgedJlp,0,1
525755701118107648,2014-10-24 21:08:21,Thanks also to Mr. Householder for having me to William Blount High School's government class! http://t.co/jRtZc2EUYw,0,1
525755254869356545,2014-10-24 21:06:35,Thanks to Mr. Rowland’s Government Class at Heritage High School for having me today! http://t.co/CX2ZCDwVIP,0,1
525363142856294400,2014-10-23 19:08:28,Excited to speak to @YALiberty chapter @UTKnoxville next week. Topic: #Liberty and #War http://t.co/1DAh019YpP,3,4
524649017465384960,2014-10-21 19:50:47,@isabellaaaa_lee Thanks for sharing!,1,3
522861939039690752,2014-10-16 21:29:35,Tune-in to @Hallerin Hilton Hill show Friday at 705am talking about #Ebola,2,0
522134214834413568,2014-10-14 21:17:52,President should ban travel from countries with #Ebola outbreak. http://t.co/bW08SjpGIF,2,3
522045451257008128,2014-10-14 15:25:09,"Scheduled to appear on the @wilkowmajority show on @SIRIUSXM at 2:05p.m. today. Topics: #ISIS and #Ebola.

http://t.co/jYzNTHkqI9",3,2
522020261395066880,2014-10-14 13:45:03,Why the Middle East Still Doesn’t Matter http://t.co/zyumlB8mLR,0,0
517676189704806401,2014-10-02 14:03:16,Greeting true heroes @FlyKnoxville #HonorAir #HonorFlight http://t.co/QuqJgFZ1fd,0,1
517340416958402560,2014-10-01 15:49:01,Uncle Sam’s $8 Trillion Annual Debt Churn: Why Washington Is Pertrified Of Honest Interest Rates  http://t.co/2dFOymOw25,0,0
516592463046139905,2014-09-29 14:16:55,The battle against the Islamic State is not our war http://t.co/RpBQuvl4y5 via @washingtonpost,0,0
515135215962845186,2014-09-25 13:46:20,Lies of the Past Are Being Drycleaned https://t.co/oXvNSigoBh,0,0
512649862819885056,2014-09-18 17:10:26,We have spent $716 billion on #HomelandSecurity since 9/11 at fed level not counting billions spent by local governments &amp; private sector,2,1
512649100337356800,2014-09-18 17:07:24,I do not support sending thousands of young Americans as combat troops on the ground into civil and religious wars in the #MiddleEast.,5,8
512589128634888193,2014-09-18 13:09:06,Bipartisan House Report Sees Growing Role for Private Money in Infrastructure Deals http://t.co/gywLoEmXXx via @rollcall,0,0
512572991885312000,2014-09-18 12:04:59,Tune in to FOX business channel 805am for interview on Scotland with @TeamCavuto http://t.co/3YwYpHbMdG,2,1
512340207853907968,2014-09-17 20:39:59,"When it comes to government, smaller and closer to the people is better.  #Scotland",3,2
511936784591101952,2014-09-16 17:56:55,When America wages war http://t.co/bRqyBmvEL7,0,0
511889863764115456,2014-09-16 14:50:28,We cannot take care of our own Country and our own people if we are permanently at war in the #MiddleEast.,15,5
511518850915913728,2014-09-15 14:16:12,"Ready, Aim, Fire. Not Fire, Ready, Aim. http://t.co/lLfuADPowF",0,1
509800072432070656,2014-09-10 20:26:23,Flashback: 1972 in Scott County TN. Sen @HowardBakerCntr's 1st reelection campaign. I'm on right law student at GWU http://t.co/NVCCXEYk5M,2,4
509365059643248640,2014-09-09 15:37:48,Just met with @AlcoaHighSchool Principal Dr. Scott Porter in DC. Congrats on winning @NASSP TN Principal of the Year! http://t.co/FvH4gxanof,0,2
504329064258076672,2014-08-26 18:06:33,Feds: Cost of http://t.co/6belstI8O7 Estimated $1.7 Billion | The Weekly Standard: http://t.co/tdfBBH9ASh,0,0
496298494018080768,2014-08-04 14:15:56,You can never satisfy govt's appetite for money and land... http://t.co/LoJkmAIBQT,1,0
496297139098505216,2014-08-04 14:10:33,Duncan: Abolish taxpayer-guaranteed export financing http://t.co/7MyJ5BNtiM via @knoxnews,1,1
494849940367998979,2014-07-31 14:19:54,America needs a conservative internationalist as president http://t.co/4tJsEmkzun via @washingtonpost,4,2
494559277194166272,2014-07-30 19:04:54,Thanks @FreedomWorks for my #FreedomFighter Award. Proud of my voting record for 2013! http://t.co/Qw7uP5fpwD,3,4
494173938722041856,2014-07-29 17:33:42,President Obama in 2008 on his environmental policies: “electricity rates would necessarily skyrocket.”  http://t.co/MxtG9VkSL1,0,0
492411977734844417,2014-07-24 20:52:18,Very wise words from my friend @RepMcClintock this am http://t.co/DGw1IIS0JA #BorderCrisis,3,3
492359683462930432,2014-07-24 17:24:30,There is one standard for ordinary citizens and another for #IRS employees and friends of those in the #WhiteHouse. #IRSscandal,2,0
492358678599593984,2014-07-24 17:20:31,Abolish Politicized IRS: http://t.co/8Vo9jdfsvq via @YouTube,3,1
492357191207518209,2014-07-24 17:14:36,"We need a much simpler, fairer tax law that would allow us to do away with the politicized #IRS altogether. #IRSscandal",5,3
491996072555065344,2014-07-23 17:19:39,RT @HouseGOP: RT @SpeakerBoehner: The top 10 bipartisan #jobs bills blocked by Senate Democrats: http://t.co/vXbZuWsqQE,8,0
490121676839862273,2014-07-18 13:11:28,$1.5 billion spent on Afghan structures that could easily burn down. Washington Times: http://t.co/sSnPOVWmuE via @washtimes,3,0
489149747119525889,2014-07-15 20:49:22,Joined @RepPaulBrounMD in sending letter to new Maj Leader asking for action on audit the #federalreserve bill.,8,3
489137978174734336,2014-07-15 20:02:36,CBO: Dark skies head for deficits?  http://t.co/mtPbX2WTTO via @POLITICO,1,0
489135213969428480,2014-07-15 19:51:37,"RT @HouseGOP: ""We will continue to pass bills that create good paying jobs, even if @SenatorReid will continue to block every solution."" -@…",22,0
487682393180864512,2014-07-11 19:38:37,The Crisis on the Border by @peggynoonannyc http://t.co/5f7fjD4cGD via @WSJ,1,1
487315607655038976,2014-07-10 19:21:09,We need to immediately deploy our National Guard to secure our border. #ImmigrationCrisis,6,6
487249084135116800,2014-07-10 14:56:48,The worst polluters in the world have been the socialist and communist countries. http://t.co/oD3tkRwKhO via @CatoInstitute,2,1
487247818831458304,2014-07-10 14:51:47,"RT @HouseGOP: ""I'm just a Bill. I'm only a Bill. I want to become a law, but it's up to @SenatorReid and the US Senate to act."" http://t.co…",52,0
487247722362437632,2014-07-10 14:51:24,"RT @HouseGOP: The more we know about the #VA, the worse it gets. Audit finds thousands have received inflated salaries → http://t.co/q6DIeu…",26,0
487243992942542848,2014-07-10 14:36:35,Just sponsored bill calling for #Mexico to release Marine Sgt. Andrew #Tahmooressi immediately. #MarineHeldInMexico,11,6
486891617534877696,2014-07-09 15:16:22,"RT @HouseGOP: ""I want to give you a number: 294. 294 bills that have passed through the house that are sitting in the Senate."" - @GOPWhip",76,0
486889492905992192,2014-07-09 15:07:55,"We need legal, orderly system of immigration and it must be enforced, because without borders, you really don’t have a country. #immigration",5,2
486889290610528256,2014-07-09 15:07:07,There is no way that our Country can hold the hundreds of millions of people who want to come here. We must have order. #immigration,2,0
486546093489283072,2014-07-08 16:23:22,RT @HouseGOP: This is why hundreds of House-passed bills go to die in the  U.S. Senate → http://t.co/K6W9X16DSn @WashTimes,18,0
486520558893277187,2014-07-08 14:41:55,If Baghdad falls http://t.co/VTTcbLX8au via @POLITICO,1,0
486514126983004160,2014-07-08 14:16:21,"We’ve built roads, power plants, schools, hospitals, hired thousands of citizens in #Iraq &amp; #Afghanistan. Time to put #America first again.",2,2
486497001232531457,2014-07-08 13:08:18,Michael Collins: Duncan reiterates stance to military intervention http://t.co/2ioHp4QgaO,0,1
484445078585610240,2014-07-02 21:14:42,"RT @NationalDebt: $17,602,672,273,372.67 (-) #nationaldebt",97,0
484337552225468417,2014-07-02 14:07:25,#HowardBaker was a champion of civility in politics.  Today we have too many people on both sides who are angry.,1,0
483714537276071936,2014-06-30 20:51:47,"#Obamacare should be voluntary and no one should be forced to participate against their will, especially against their religious beliefs.",4,5
483711899469901824,2014-06-30 20:41:18,Meeting with leadership today in Knoxville of several #Vets service organizations about the crisis at the #VA http://t.co/JG3qhWrWJK,1,2
482217160094539776,2014-06-26 17:41:44,"We have lost one of the greatest public servants TN has ever had, and one of the greatest statesmen this nation has ever known. #HowardBaker",20,8
481902163929874432,2014-06-25 20:50:03,@EPA official paid $900k to do no work. http://t.co/1QJ6dz7hYv http://t.co/wJJv0JYCqX,1,0
481840176596267009,2014-06-25 16:43:44,"#ExecutiveOrders, through most of our history, have been used very sparingly and usually for non-controversial, organizational-type matters.",0,0
481838676826423296,2014-06-25 16:37:47,The power of presidents to issue executive orders was not meant to replace #Congress or set up some type of presidential dictatorship.,2,1
481836745852739584,2014-06-25 16:30:06,@SpeakerBoehner plans to file suit against Obama over alleged abuse of executive power http://t.co/yQ0DbQmDGV,0,0
481507969566142464,2014-06-24 18:43:40,LAMBRO: Obama's anti-oil antics drill into workers' pockets - Washington Times: http://t.co/j6U6v7DjMZ via @washtimes,0,0
479966196033257472,2014-06-20 12:37:13,What Obama unleashed in Libya http://t.co/XwcdPlDFGa via @washingtonpost,0,0
479966116916113408,2014-06-20 12:36:54,NAPOLITANO: When another Iraq war is pointless - Washington Times: http://t.co/40fk1h0ckZ via @washtimes,0,0
479286402275110913,2014-06-18 15:35:57,What Will #Obamacare Cost You? - Forbes put our a great interactive map that breaks it down by COUNTY.  http://t.co/Kkfwj7Kahn,2,1
479283211013738496,2014-06-18 15:23:16,"We have spent far too much blood and treasure in #Iraq and #Afghanistan over the last few years, and that needs to stop.",2,1
479283019942227968,2014-06-18 15:22:31,We have spent $103 billion over the last several years rebuilding #Afghanistan. The #HighwayTrustFund has a $15 billion shortfall.,3,1
479279719838654464,2014-06-18 15:09:24,#HighwayTrustFund has $15B shortfall. Lets take from #Iraq and #Afghanistan fund. http://t.co/JpQqD1XJ0U,2,3
479268636843323393,2014-06-18 14:25:22,RT @AARPTN: Thank you @RepJohnDuncanJr for signing on to #safestreets. @AARPadvocates @AARPTN @RebeccaBKelly @whiting_edwin,5,0
478973880640733184,2014-06-17 18:54:06,With national debt of $17.6 trillion we cannot keep sending mega-billions to corrupt governments all over the world. #Iraq #Afghanistan,4,3
478973220402782210,2014-06-17 18:51:29,#Iraq and #Afghanistan are going to have to solve their own problems. We cannot do everything for them and take care of our own people.,3,3
478972676292501504,2014-06-17 18:49:19,JFK said that U.S. cannot correct every adversity or right every wrong and solve every world problem. True with #Iraq and #Afghanistan,1,2
478907866364248064,2014-06-17 14:31:47,"""Jimmy Duncan’s quarter century of constituent-minded conservatism"" http://t.co/BtiZKM0b3N",2,0
477554655673991169,2014-06-13 20:54:37,"RT @NationalDebt: $17,536,614,238,239.15 (-) #nationaldebt",89,0
477173277006508032,2014-06-12 19:39:09,The new American embassy in London is an expensive model of waste: http://t.co/IgCYDVUUsM @WashTimes,5,0
477093404816736258,2014-06-12 14:21:46,Thankful for opportunity to be keynote speaker at Loudon County's Memorial Day event. #Heroes http://t.co/HNtD5VUV4e,0,1
477092931137175552,2014-06-12 14:19:53,Thanks to all the folks at the @ADTstaysafe monitoring center in Knoxville for their hospitality!  I enjoyed my tour! http://t.co/l2Lv3TYXXk,1,1
477082136923897856,2014-06-12 13:36:59,@GovWaste  Every dollar kept in private sector will do more to create jobs and keep prices low than any dollar turned over to gov to spend,0,0
477081646584565760,2014-06-12 13:35:02,"A business that wastes money will go out of business, but a gov agency that wastes money just gets more. @GovWaste",3,2
477080787364618240,2014-06-12 13:31:38,There is waste in every agency and at every level of the federal government. Thanks @GovWaste for naming me #TaxpayerHero,3,3
476792571352842240,2014-06-11 18:26:22,We have turned the Department of Defense into the Department of Foreign Aid #Afghanistan,4,2
476792233128366080,2014-06-11 18:25:01,"Totally ridiculous we have poured mega billions, hundreds of billions, into #Afghanistan http://t.co/ISsfS47mBC",1,0
476791362675675136,2014-06-11 18:21:33,Afghans fear downturn in economy as U.S. departs http://t.co/uusJywwHDs via @washingtonpost,1,0
476095612346437633,2014-06-09 20:16:54,"RT @NationalDebt: $17,543,976,854,111.74 (-) #nationaldebt",91,0
476066043820253184,2014-06-09 18:19:24,VA audit finds more secret wait lists http://t.co/RQ0jtSoGmJ ANSWER: Competition. Let Vets Choose Any Hospital.,0,0
475011042565947392,2014-06-06 20:27:12,"RT @NationalDebt: $17,544,581,789,209.83 (+) #nationaldebt",138,0
474910250303496192,2014-06-06 13:46:41,#DDay70 http://t.co/RBzvp8jwDE,15,7
474909835512004608,2014-06-06 13:45:02,The word 'hero' is used too lightly today. #DDay70,1,1
474572710086209539,2014-06-05 15:25:25,We need to stop trying to take care of the whole world &amp; start taking care of our own Country &amp; putting the #AmericanPeople first once again,4,2
474572050238291968,2014-06-05 15:22:48,This Nation keeps printing more &amp; more money. That is going to speed up in the years ahead if we don't get more fiscally conservative,2,3
474571594636218368,2014-06-05 15:20:59,This Nation is in the shape of #Detroit. The only difference is #Detroit can't print money.,4,2
474571409004326913,2014-06-05 15:20:15,The only reason more people are not upset about the #NationalDebt is that nobody can humanly comprehend a figure like $17.6 trillion,2,4
474570963695468544,2014-06-05 15:18:29,This Nation's #NationalDebt has now reached an astounding $17.6 trillion,0,1
474570823878332416,2014-06-05 15:17:56,You can never satisfy the government's appetite for money or land. They always want more.,5,2
474570570294919169,2014-06-05 15:16:55,Put the American People First: http://t.co/VT3l2PEhb3 #NationalDebt,0,0
474553249811664896,2014-06-05 14:08:06,"RT @NationalDebt: $17,517,597,022,244.87 (-) #nationaldebt",79,0
473883662753095680,2014-06-03 17:47:24,"Local Congressional members: Climate change plan would raise electricity rates, kill jobs http://t.co/A9Wy0B27Rr",0,0
473883158019342336,2014-06-03 17:45:23,I will be discussing release of #SgtBergdahl with Phil Williams at 330 p.m. on @987news Listen Live here: http://t.co/DqH8V4IbwD,0,1
472464904860205056,2014-05-30 19:49:45,The #SchoolLunch program simply doesn't work: http://t.co/SZtQv1EFwj,0,0
472464362893234177,2014-05-30 19:47:36,I have been saying this for years: http://t.co/jxmYjJLMWr @dcexaminer,0,0
472124909091844096,2014-05-29 21:18:44,"RT @NationalDebt: $17,490,047,622,577.64 (-) #nationaldebt",86,0
472117540798627842,2014-05-29 20:49:27,I am honored to receive the #ThomasJeffersonAward again.  Thank you @IFDA:  http://t.co/apZplaaMtI,1,2
469881405238177793,2014-05-23 16:43:51,"""The Slush Fund"" @weeklystandard:  http://t.co/fAp8qNrXMs",2,1
469578981457805312,2014-05-22 20:42:08,RT @Transport: Congratulations to the Senate &amp; American people. #WRRDA is off to the President. @EPWChairBoxer @EPWRepublicans http://t.co/…,34,0
469577999269265409,2014-05-22 20:38:14,Just sat down for an interview with @kaylastrayer from @6News on #Veterans.,4,0
469498385834455040,2014-05-22 15:21:52,Let #veterans choose any hospital: http://t.co/psJgwdJIrd,3,2
468816743109230592,2014-05-20 18:13:16,"RT @Transport: #WRRDA Conference Report is agreed to, 412-4. http://t.co/3TLegdiLES",24,0
468765590807937024,2014-05-20 14:50:00,RT @cspanbus: Congrats to 3rd prize @StudentCam winners from Farragut Middle. @chartercom @knoxschools @CityKnoxvilleTN http://t.co/zdzcywt…,6,0
468489286095237120,2014-05-19 20:32:04,"RT @NationalDebt: $17,473,133,162,652.10 (+) #nationaldebt",133,0
467303514499465218,2014-05-16 14:00:14,Another great article by @Judgenap: http://t.co/ULZujroksn,1,1
467042896919920640,2014-05-15 20:44:38,"RT @NationalDebt: $17,466,359,022,192.19 (-) #nationaldebt",89,0
467014970128211970,2014-05-15 18:53:40,I am proud to be recognized again this year by the #NationalRetailFederation as a Hero of Main St. @NRFnews,0,3
466977404159016961,2014-05-15 16:24:23,"@WashTimes ""Feds Released Hundreds of Immigrant Murderers, Drunk Drivers, Sex-crimes Convicts"":  http://t.co/tzaRE4ibYf",0,0
466683921846272000,2014-05-14 20:58:12,"RT @NationalDebt: $17,477,954,685,990.29 (+) #nationaldebt",102,0
466312073031716864,2014-05-13 20:20:36,"RT @NationalDebt: $17,472,131,682,925.49 (-) #nationaldebt",83,0
466195166366539776,2014-05-13 12:36:03,A great article from this week's @weeklystandard: http://t.co/jb7TigU0Ef,0,0
465959928063348737,2014-05-12 21:01:18,"RT @NationalDebt: $17,472,278,485,983.26 (+) #nationaldebt",137,0
