id,created_at,text,retweets,favorites
451109337780326400,2014-04-01 21:30:21,"Temp #SGR patch = major disappointment for physicians, let seniors down. Click http://t.co/iQ109Mi2bt to read my @congressblog op-ed. #NV03",3,0
451087788386320385,2014-04-01 20:04:44,RT @EMSWorldNews: Rep Joe Heck receives #EMSFieldBill Legislator of the Year award @NAEMT_ http://t.co/DWradALJ3W /A great honor. Thx #NV03,0,2
451079138497933315,2014-04-01 19:30:21,Temp #SGR fix does nothing to secure permanent access 2 care for seniors. Click http://t.co/iQ109Mi2bt to read my @congressblog op-ed. #NV03,1,0
451049714264596482,2014-04-01 17:33:26,Flawed #SGR is currently single greatest threat to #Medicare system. Click http://t.co/NRnESJLqVT to read my @CongressBlog op-ed. #NV03,2,1
450676638762946561,2014-03-31 16:50:58,"Thanx to Doug McGee, DO from @EinsteinHealth, I spoke w EM residency directors abt GME funding &amp; advocacy Learn more: http://t.co/FumvLVZs55",2,0
450452220820336640,2014-03-31 01:59:13,Sen. Heller has op-ed in The Hill on his bipartisan Mortgage Forgiveness Tax Relief Act. I have same in House. #NV03 http://t.co/xKSKkR64CP,4,0
449635189270908928,2014-03-28 19:52:37,"This #WomensHistoryMonth post recognizes Col. Jeannie Leavitt, first female fighter pilot in @USAirForce #NV03 http://t.co/M7PHhC6K95",4,0
449289161544314880,2014-03-27 20:57:38,RT @SenDeanHeller: Thanks @MarkWarner for signing on to the Good Samaritan Search and Recovery Act. Cc: @RepJoeHeck http://t.co/8pir6FPwSo,6,0
449181010693877761,2014-03-27 13:47:52,Honored to receive the Legislator of the Year Award from @NAEMT_ for my work on Emergency Medical Services. #NV03 http://t.co/bnaThHTyfC,7,3
448866071953408000,2014-03-26 16:56:25,Honored to receive a Champion of #Healthcare Innovation Award from @HealthInFocus at today's 2014 #HLCExpo #NV03 http://t.co/rXuPiZ4iP3,2,0
448809048625152000,2014-03-26 13:09:50,This morning I spoke with members of @NDIAToday abt critical defense/national security issues #NV03 http://t.co/nZjgVblcJJ,1,1
448598135867461632,2014-03-25 23:11:44,See my full statement on House passage of HR 3771 - #Philippines Charitable Giving Assistance Act  by clicking http://t.co/B2q2XBYy7j #NV03,1,1
448545328149856256,2014-03-25 19:41:54,On National Medal of Honor Day take a moment to reflect upon the valor/sacrifice displayed by MOH recipients. #NV03 http://t.co/M5VDkMXgak,2,3
448456965921202176,2014-03-25 13:50:47,"RT @NDIAToday: Tomorrow! LID Breakfast Series Featuring Rep. Joe Heck - The Army and Navy Club in Washington, DC on 3/26: http://t.co/51BXc…",1,0
448456934082240512,2014-03-25 13:50:39,"To recog Womens Hist Mo &amp; Medal of Honor Day, we remember Mary Walker: 1st Amer woman to be Medal of Honor recipient http://t.co/nUWzJuzdL4",0,0
447848795926040576,2014-03-23 21:34:08,RT @threesquareLV: Three Square's SNAP assistance team was at a job fair this last week where look who they bumped into - @RepJoeHeck! http…,3,0
447793229321097217,2014-03-23 17:53:20,My op-ed on why commitment to career &amp; technical education is key to a thriving workforce: http://t.co/Hq1CZ3UOfR #NV03 #CareerTechEd,11,7
447458744947859456,2014-03-22 19:44:12,Lots of excitement at Red Ridge Park &amp; Peccole Little League Opening Day! Good luck to all  teams this season! #NV03 http://t.co/96WCdegrdq,3,2
447105597494681600,2014-03-21 20:20:55,Talked w folks @GulfstreamAero LV abt general aviation impact on local economy. 50% of LV workforce are vets - and they are hiring! #NV03,4,2
447094728014577665,2014-03-21 19:37:44,"150 yrs ago Pres Lincoln signed  Act ""to enable the ppl of #Nevada to form a Constitution and State Government #NV03 http://t.co/L08pPTQ0LL",8,8
447070830829133824,2014-03-21 18:02:46,"MT@Hutch4Nevada: Great to support my good friend @RepJoeHeck last night. CD3 is fortunate to have him as their Rep. #NV03 / Thanks, Mark!",1,0
447070382864879616,2014-03-21 18:01:00,MT @anderson4nv: Proud to support @RepJoeHeck last night.CD3 is fortunate to have him as their Rep.#NV03 http://t.co/69O1dtFsS7 Thanx Paul!,1,1
446773005755363328,2014-03-20 22:19:19,RT @USVETSLV: @RepJoeHeck thank you for supporting Veterans and #LVVeteransStandDown http://t.co/qc8xDhzSQX / Thanx 4 caring 4 our vets!,2,0
446438322949619712,2014-03-20 00:09:25,Visited @VadaTech 's new HQs in #Henderson 2 meet w/ employees &amp; learn abt the high-tech products they produce #NV03 http://t.co/NoOtNN1ELR,4,0
446415578605944833,2014-03-19 22:39:02,Met w/staff at Comprehensive Cancer Cntrs of #Nevada to discuss concerns over healthcare issues - #SGR &amp; #ACA #NV03 http://t.co/Ul6PmcBVxH,1,0
446360970542084098,2014-03-19 19:02:03,"Via The Laughlin #Nevada Times: Heck discusses economy, bridge, VA clinic. Click here for full story - http://t.co/CBlf1pyuKz #NV03",2,1
446336331397206017,2014-03-19 17:24:08,".@NCPSSM Met w Dr. Herb Randall, NV Senator to Natl Silver Haired Congress, abt WH Conference on Aging &amp; ""Boost Soc. Sec. Now"" #NV03",2,1
446098749618536448,2014-03-19 01:40:04,Today @RepJohnKline and I examined importance of #CTE at @EdWorkforce field hearing at SW Career/Tech Acad in #NV03 http://t.co/wK48a9hGNz,2,3
446033704750555136,2014-03-18 21:21:36,RT @EdWorkforce: Happening now: NV field hearing w/@repjohnkline &amp; @RepJoeHeck on ways to support workers through #CTE. Watch live: http://…,3,0
445955151497818113,2014-03-18 16:09:28,The @LasVegasSun previews @EdWorkforce #CTE field hearing I'll be participating in today w/ @RepJohnKline - http://t.co/Mv7ORBIF91 #NV03,5,1
445657503343181824,2014-03-17 20:26:43,RT @EdWorkforce: LIVE at 6:30PM on @kxnt: @RepJoeHeck &amp; @repjohnkline discuss tmrw's NV hearing on how #CTE strengthens our workforce http:…,1,0
445628794271838209,2014-03-17 18:32:38,Our #NV03 Jobs Fair/Career Skills Workshop is underway at the Silverton. Lots of employers looking to hire on hand http://t.co/OScYgnqfGt,2,0
445599874428329984,2014-03-17 16:37:43,"Great time at this morning's Cup of Joe talking with small biz owners, constituents at Madhouse Coffee. #NV03 http://t.co/5PYKNMUqpo",3,2
445396403368361984,2014-03-17 03:09:12,Don't forget: Job Fair tomorrow 10 am -2 pm at the Silverton. Visit http://t.co/PALGNTtyhX to get event details.#NV03 http://t.co/sorJO2ePOX,3,2
444586039395352576,2014-03-14 21:29:06,"House passed bill to fix #SGR, ensure access to healthcare for seniors. Visit http://t.co/WAJdzgxSzQ for info. #NV03 http://t.co/2klvVNzdaV",2,0
444543325509410816,2014-03-14 18:39:22,"This #WomensHistoryMonth post recognizes Vice Admiral Michelle Howard, Dpty Chief of Naval Ops 4 Ops, Plans, Strategy http://t.co/Co89gAasuh",2,0
444509709442514945,2014-03-14 16:25:47,Urged colleagues to support policies contained in HR 4015.  Let's give seniors the peace of mind they deserve #nv03 http://t.co/RbOKSnBaJZ,0,0
444226442084110336,2014-03-13 21:40:11,"Met w/ Kathleen Schaeffer, teacher @ Bob Miller MS; here advocating for board certification program 4 teachers #NV03 http://t.co/eYmmwXnGT6",1,0
444193046821732352,2014-03-13 19:27:29,Great meeting w/ Rich and Sean who are in DC representing the Peace Officers Research Association of #Nevada. #NV03 http://t.co/wyFZ3IoZlQ,0,1
444125958082011136,2014-03-13 15:00:54,Today a member of my staff will be holding mobile office hours at the #BoulderCity Senior Center at 11am http://t.co/DKG0QFr5A4 #NV03,1,0
443907009721548802,2014-03-13 00:30:53,Tomorrow a member of my staff will be holding mobile office hours at the #BoulderCity Senior Center at 11am http://t.co/DKG0QFr5A4 #NV03,5,0
443876810518822912,2014-03-12 22:30:53,Several new employers RSVPd to attend #jobs fair March 17. Visit  http://t.co/hG5dbAtj61 to see the full list and get event details. #NV03,2,1
443833460407296000,2014-03-12 19:38:37,"I asked participants in last 2 tele-town halls a survey question about #jobs, the economy. Here are the results #NV03 http://t.co/vp6kN6d0z2",0,0
443819048053112832,2014-03-12 18:41:21,"Thx 2 Hannah 4 stopping by 2 discuss impt'ce of @SONevada Hannah goes to BasicHS, competes in bowling/swimming #NV03 http://t.co/7TCSlAgs1I",3,1
443794292314619904,2014-03-12 17:02:59,Proud to receive the #SpiritofEnterprise award from the @USChamber for support of policies to improve economy #NV03 http://t.co/vSbwNYCdGz,3,0
443778662848929793,2014-03-12 16:00:52,Today a member of my staff will be holding mobile office hours at the #SandyValley Community Center at 3p. http://t.co/xP8u76ahl3 #NV03,2,0
443776348000387072,2014-03-12 15:51:41,"RT @dspacecommunity: To our Las Vegas locals, don't forget about the Joe Heck Job Fair this Monday! Come join us and see how you can join t…",1,0
443766281788194816,2014-03-12 15:11:41,In @EdWorkforce hearing on benefits of Charter Schools incl inc grad &amp; college entry rates. Saw firsthand @CoralAcademyLV in #NV03.,1,2
443763562360492032,2014-03-12 15:00:52,Today my staff will be holding mobile office hours at Heritage Springs Comm Center in #Southwest at 11a http://t.co/8UWwwsR6cw #NV03,0,0
443469118314795008,2014-03-11 19:30:51,".@TheEconomist details benefits of the #JOLTAct. http://t.co/ICw1TPcmtu | Increased travel/tourism means more #jobs for SoNV, nation! #NV03",3,1
443446474966589441,2014-03-11 18:00:53,Tomorrow a member of my staff will be holding mobile office hours at Heritage Springs Comm Center in #Southwest http://t.co/v52BjM6IJT #NV03,0,0
443445825176608768,2014-03-11 17:58:18,RT @EdWorkforce: A week from today @repjohnkline &amp; @RepJoeHeck will host a hearing in NV on how #CTE can strengthen the workforce http://t.…,2,0
443431367729098752,2014-03-11 17:00:51,Tomorrow a member of my staff will be holding mobile office hours at the #SandyValley Community Center. http://t.co/xP8u76ahl3 #NV03,1,0
443416269132275714,2014-03-11 16:00:51,Today a member of my staff will be holding mobile office hours at the community center in #Searchlight at 1:30p http://t.co/XjwiLaVrgu #NV03,1,0
443401169491087362,2014-03-11 15:00:51,.@CNNMoney Why casino workers hate Obamacare http://t.co/8m0DoUT2zC | Culinary Union Local 226 threatens to strike over....#ObamaCare #NV03,0,0
443386071284330496,2014-03-11 14:00:51,Today a member of my staff will be holding mobile office hours at the American Legion post in #Laughlin @ 10am http://t.co/HXwEkd4OMr #NV03,0,0
443135308733763584,2014-03-10 21:24:25,"According to @TheHill, even House Dems wants the Senate to act on House-passed bills. http://t.co/5wCrdkfJQV #NV03 http://t.co/2yHQ1a9z66",16,12
443096208869822464,2014-03-10 18:49:03,My office is accepting submissions for the 2014 Congressional Art Competition. Info - http://t.co/MjnPaiOPgi  #NV03 http://t.co/lwRR9BjuIt,5,2
443079730167021568,2014-03-10 17:43:34,Check out the list of employers we have confirmed for next week's #jobs fair and career skills workshop http://t.co/CNFkzvQSDn #NV03,3,0
443036969539747840,2014-03-10 14:53:39,Via @USATODAY - Bureaucracy hindered search for slain brother http://t.co/rN4tQEOHWU | My #GoodSamaritan search bill would fix problem #NV03,1,0
441985824280678400,2014-03-07 17:16:46,"In recognition of #WomensHistoryMonth wanted to hi lite Lt Gen Patricia Horoho, 1st female Surgeon Gen of Army #NV03 http://t.co/vCsg2NWfgZ",0,1
441660972538007552,2014-03-06 19:45:56,RT @EdWorkforce: March 18 field hearing with @repjohnkline &amp; @RepJoeHeck in NV will discuss how #CTE can strengthen our workforce http://t.…,2,0
441593174566256640,2014-03-06 15:16:31,Enjoyed speaking with students from @TouroNevada today at @AOAforDOs #DODay2014 abt #SGR #GME and the #ACA. #NV03 http://t.co/T5pwnZckOD,5,6
441563722515890176,2014-03-06 13:19:29,Great to speak to packed house this morning at kickoff for @AOAforDOs #DODay on Capitol Hill. #NV03 #SGR #GME #ACA http://t.co/4ekgEDrKJ4,11,8
441318323712978944,2014-03-05 21:04:22,House voted 250-160 to extend #SIMPLEFairness to hard-working middle class families. Video on why I voted YES  http://t.co/bSfHhKFlwG #NV03,1,2
441274140113506304,2014-03-05 18:08:48,House will vote today to delay penalty tax on individuals who don't buy insurance under #ObamaCare. RT if you support #SIMPLEFairness #NV03,3,0
440982631962771457,2014-03-04 22:50:27,Met with Nevadans Rose and Camilla from Future Business Leaders of America to discuss the importance of #CTE #NV03 http://t.co/SvaTp8ptxi,3,2
440974547320188928,2014-03-04 22:18:19,Always an honor 2 meet w/ fellow veterans frm NV representing @VFWHQ. Talked abt need 2 ensure retiree benefits #NV03 http://t.co/k337twQ4ZU,2,1
440961215708155905,2014-03-04 21:25:21,Met today with a great group of Nevadans from @AIPAC to discuss the critical need to support our ally Israel #NV03 http://t.co/xTyJctusXl,7,5
440955714945970178,2014-03-04 21:03:29,RT @EdWorkforce: .@repjohnkline to join @RepJoeHeck for NV hearing “Reviving our Economy: How #CTE Can Strengthen the Workforce” http://t.c…,1,0
440948348845977600,2014-03-04 20:34:13,"Met with Nevadans from @ACOGNews to talk abt #SGR &amp; Graduate Medical Education, 2 of my #healthcare priorities #NV03 http://t.co/9UwkXM3gvV",4,2
440917628400730112,2014-03-04 18:32:09,This #WomensHistoryMonth I will recognize women who have proudly served in the US military. Visit http://t.co/s1A75nCueW for more info #NV03,2,1
439526713878265856,2014-02-28 22:25:09,"For final #BHM post, we recognize Tuskegee Airmen and first African American to become full general, Daniel James Jr http://t.co/hT2g2GbuTx",1,0
439490335937658880,2014-02-28 20:00:36,"As part of #StopGovtAbuse week, the House passed HR 1944 to prohibit the unlawful seizure of private property under eminent domain #NV03",5,4
439445033461108739,2014-02-28 17:00:35,"As part of #StopGovtAbuse week, the House passed HR 3865 to ensure Americans are not targeted by the #IRS for political beliefs #",1,0
439138628674269184,2014-02-27 20:43:02,I recently met with folks from @vegasnfbenefit to talk abt need to  raise awareness of #Neurofibromatosis #NF #NV03 http://t.co/1oFU5UldQb,5,6
439111801973014529,2014-02-27 18:56:26,Today I met with Nevadans from the National Hemophilia Foundation to talk about need for awareness/advocacy #NV03 http://t.co/42iC5oKOWK,1,1
439065247031123968,2014-02-27 15:51:26,#TBT of #NV03 2013 Congressional Art Competition finalists. To get involved this year click http://t.co/MjnPaiOPgi http://t.co/Zq4fB3i4xD,2,0
438780650485596160,2014-02-26 21:00:33,Admin is working to cut #MedicareAdvantage for seniors http://t.co/c8M41eQL3c I'm working to give them options http://t.co/5zs7ZzwEuU #NV03,2,1
438770201413550080,2014-02-26 20:19:02,"RT @RJCHQ: ICYMI - Via @thedailybeast: @RepDLamborn, @RepTrentFranks and @RepJoeHeck Warn Michelin Over Iran http://t.co/gQ5HMwdMiD #NV03",1,0
438748631701921792,2014-02-26 18:53:20,RT @TravelCoalition: We're proud to honor @RepJoeHeck w/ our Distinguished Travel Champion award. Passing the #JOLTAct is crucial. #DCH14 h…,2,0
438743313126920192,2014-02-26 18:32:11,Was a great honor 2 b named Distinguished Travel Champion by @USTravel Assoc and to address their members at #DCH14 http://t.co/b7Po5G036P,5,3
438438714100830208,2014-02-25 22:21:49,Building healthy econ starts w/ giving ppl skills needed to fill avail jobs. Time for Senate to pass #SKILLSAct #NV03 http://t.co/nMI7PXqquy,3,0
438423779048693760,2014-02-25 21:22:29,RT @RepDLamborn: Lawmakers Warn Michelin Over Iran http://t.co/wFQ1CmRyoo via @thedailybeast @RepTrentFranks @RepJoeHeck,1,0
438423580830093312,2014-02-25 21:21:41,Thanks for coming by! RT @AdamJSandler: . @RepJoeHeck thanks for taking time today to meet with @NVBroadcasters http://t.co/fMDbqtPhrK,0,0
438393377143275520,2014-02-25 19:21:40,On @HouseFloor this week: bills to #StopGovtAbuse by increasing transparency. See bills: http://t.co/gfIWkn22x3 #NV03 http://t.co/5jhg2u9lsp,16,11
436933635686404096,2014-02-21 18:41:11,"This week's #BlackHistoryMonth post: we recognize the Montford Point Marines, the 1st African American Marines #NV03 http://t.co/ogMOHXYYPy",3,2
436912682541662208,2014-02-21 17:17:55,Yesterday I visited Imperial Truck/Auto Cntr in @CityofHenderson to talk w/ employees abt the auto repair biz #NV03 http://t.co/iIVDIgau5H,1,0
436618028886011904,2014-02-20 21:47:04,Thanks to everyone who came out to last night's #NV03 town hall. Always good to discuss impt issues w/ constituents http://t.co/2M5XMbVJpj,2,1
436533137565581312,2014-02-20 16:09:45,On KDWN 720AM w Alan Stock. Listen in and join in the conversation!,1,0
436241608950829056,2014-02-19 20:51:19,Did you know Expedia was located in #NV03 ? I visited their offices today 2 learn more abt online travel booking biz. http://t.co/WJa4Lzfjhs,6,6
436203992557703168,2014-02-19 18:21:50,Yesterday I visited w/ employees of Varian Medical Systems in LasVegas. Had a gr8 time answring their questions #NV03 http://t.co/6iS0LR1TEc,3,0
436202035764289536,2014-02-19 18:14:04,"RT @RepMikeQuigley: Bipartisan #JOLTact = commonsense job creator, good for economy. Read latest op-ed w/ @RepJoeHeck: http://t.co/1UjCIG9W…",6,0
435939530672070656,2014-02-19 00:50:58,RT @NVHomelessYouth: Congressman @RepJoeHeck pictured with our housing clients! http://t.co/wyx2YkFkzf,1,0
435866391300677633,2014-02-18 20:00:20,#NV03 Town Hall February 19 at Green Valley High 6pm. Come share your concerns/find out where I stand on the issues. http://t.co/DizcPfCOwz,5,0
435862227258994688,2014-02-18 19:43:47,"RT @USTravel: #Travel provisions to #JOLTAct will create #jobs, boost economy http://t.co/bzvtCDCfAn via @RepJoeHeck &amp; @RepMikeQuigley",3,0
435862042277580800,2014-02-18 19:43:03,"RT @TravelCoalition: Read @RepJoeHeck &amp; @RepMikeQuigley's OpEd in @TheHill. #JOLTAct is a bipartisan, substantive common sense job creator …",6,0
434394881172045824,2014-02-14 18:33:05,This week's Black Hist Month post: we recognize the Buffalo Soldiers - first peacetime all-black regiments in US Army http://t.co/uMIeT3l6IX,6,1
434116360495300608,2014-02-14 00:06:20,Great to welcome @Barclaycard to #NV03 - bringing 1k jobs over next year to southern Nevada! #4jobs http://t.co/KjL9pd8RRv,5,2
434100384630837248,2014-02-13 23:02:51,Visit http://t.co/XziOQJ5BoC to read my statement on #Afghanistan releasing enemy combatants who have engaged in hostilities vs US #NV03,3,1
434055104183152640,2014-02-13 20:02:55,Enjoying 9th Annual Joint Chambers Lunch w @lvlcc @urbanchamber &amp; LV Asian Chamber: representing the diversity of small biz in southern NV!,2,0
434013576668663808,2014-02-13 17:17:54,A member of my staff will be at the #BoulderCity senior center today at 11am holding mobile office hours. Info: http://t.co/xYOmTWWhHI #NV03,1,0
433661831257653248,2014-02-12 18:00:12,A member of my staff will be in #SandyValley holding mobile office hours today. 3pm at the SV Community Center http://t.co/IFb2PeOGRb #NV03,1,0
433660136251326464,2014-02-12 17:53:28,"Today we wish happy birthday to our 16th President, Abraham Lincoln #NV03 http://t.co/C111ZmSQgv",18,6
433646726629449728,2014-02-12 17:00:11,A member of my staff will be in #Southwest @ Heritage Springs Assisted Living Center 11a 4 mobile office hours http://t.co/MDYeuI7ZuR #NV03,1,0
433282080509014016,2014-02-11 16:51:12,Improved housing mrkt is key 2 building healthy economy. I intro’d bill that encourages saving for a first home http://t.co/M2Wh0GCDo5 #NV03,3,0
432966420654460928,2014-02-10 19:56:53,Check out the @FOX5Vegas piece on the dedication of the Ron Kirk/Keith Goldberg training center at @RedRockSAR https://t.co/VsZ2usVrRf #NV03,2,1
432907594794303488,2014-02-10 16:03:08,This week the House will consider legislation to reform the CFBP. See what else we will be working on here - http://t.co/gcNTgUDj5h #NV03,0,0
432293536155701248,2014-02-08 23:23:05,Great day @RedRockSAR: dedication of new training ctr in memory of Keith Goldberg &amp; Ron Kirk. Thanx 4 ur service! http://t.co/XNMfuiwH5A,3,3
431916363565629440,2014-02-07 22:24:20,Congratulations to @SWGas and @threesquarelv as @cathcharitieslv 2014 Heart of Hope Honorees.,7,3
431875675671121921,2014-02-07 19:42:39,"In recognition of Black History Month, we remember the 54th Mass Regiment. For info - http://t.co/U4HZDCwxiG #NV03 http://t.co/OB6BKAfwCS",5,2
431820302255812608,2014-02-07 16:02:37,.@WashingtonPost - U.S. sees second month of weak #jobs numbers http://t.co/tIpe42U3ur #NV03 http://t.co/0XKI4IQnpi,0,0
431518492697718784,2014-02-06 20:03:20,"#TBT photo to my days as member of US Nat'l Luge Team, '80 Olympic hopeful #NV03 Good luck @USOlympic Team in Sochi http://t.co/aNmbw2SgDn",9,1
431462916693323776,2014-02-06 16:22:30,"Join me in wishing happy birthday to Ronald Reagan - defender of freedom, champion of American exceptionalism. #NV03 http://t.co/Su2RXSkAjY",13,5
431083046478299136,2014-02-05 15:13:02,Good news today via @ReviewJournal - Red Flag military exercise back in force at @NellisAFB training range http://t.co/ROezI4HhC7 #NV03,4,2
430824492470763520,2014-02-04 22:05:38,In honor of #BlackHistoryMonth I'll be highlighting the heroic military service of African American soldiers #NV03 http://t.co/XtuPhHsKQG,11,7
430779188132343808,2014-02-04 19:05:36,Met today w/ Nevadans from the Roman Catholic Diocese of #LasVegas 2 discuss domestic/foreign policy objectives #NV03 http://t.co/cWwDjbDWFG,1,0
430429683487080448,2014-02-03 19:56:48,Just sent out my latest eNewsletter. Visit http://t.co/7FeQQHunny to read about my latest work on behalf of #NV03. Inside - #SOTU response,3,0
429383251799838720,2014-01-31 22:38:39,State report says building #Keystone “would not significantly alter global greenhouse gas emissions.” No more delays. Keystone = jobs #NV03,5,1
429303916476391424,2014-01-31 17:23:24,Best wishes for the Year of the Horse to all of those celebrating the start of the Lunar New Year today in #NV03 http://t.co/Prj4HgRSt8,1,1
429016605238898689,2014-01-30 22:21:44,"#TBT #SchoolChoice Week - my visit to Clark HS in Vegas, a public magnet school preparing students for success #NV03 http://t.co/9xho31KyO3",1,1
428981607966732288,2014-01-30 20:02:40,"#TBT photo for #SchoolChoice Week - visit to Coral Academy of Science, public charter school focused on #STEM #NV03 http://t.co/9KewUO4tQl",0,0
428928904938524672,2014-01-30 16:33:14,This week is #SchoolChoice Week. House-passed #StudentSuccess Act improves education by expanding school choice #NV03 http://t.co/i74N4Pb2RP,3,2
428614530101702657,2014-01-29 19:44:01,Check out this story on my #SOTU guest. @FOX5Vegas - Vegas teacher attends State of the Union address http://t.co/RfpMJQvjSA #NV03,6,2
428552272617172992,2014-01-29 15:36:38,RT @sikh_coalition: Thank you to @RepJoeHeck for asking about why the presumptive ban on #sikhsinthemilitary still exists http://t.co/lSAYp…,3,0
428310803683352576,2014-01-28 23:37:07,I am pleased to have Clark HS AP Gov't teacher Amy Evers as my guest for the #SOTU tonight. #NV03 http://t.co/8wH25jgFjl,38,35
428248231001079808,2014-01-28 19:28:29,Great to meet Nevadans from @NFB_Voice (Nat'l Fed of the Blind) to talk abt issues that concern blind Americans #NV03 http://t.co/LcIBHJANXd,2,1
427996274080882688,2014-01-28 02:47:18,MT @SenDeanHeller: Great news @RepJoeHeck gets #GoodSamaritan through House. / Thx for sponsoring Senate Companion Bill. Let's get it done!,2,1
427958155625373696,2014-01-28 00:15:50,#GoodSamaritan SAR bill passes House 394-0; allows expedited access to public lands for Good Samaritan searches http://t.co/52o0nWG6TC #NV03,3,1
427954030887723008,2014-01-27 23:59:26,"RT @RepCloakroom: H.R. 2166 has passed- 394 Yeas, 0 Nays",1,0
427929203581804544,2014-01-27 22:20:47,You can watch the @HouseFloor debate on my #GoodSamaritan SAR LIVE by clicking here - http://t.co/6C7hMQ5xOK - at 5:30p EST #NV03,2,0
427832165221814272,2014-01-27 15:55:11,My #GoodSamaritan SAR bill will be on the floor for a vote today. Visit http://t.co/LOAyGDipzK to learn why we need to pass this bill #NV03,2,1
427233767950778368,2014-01-26 00:17:22,RT @adam_englander: Thanks to @RepJoeHeck and @InNEVation for inviting me to help with the #HouseAppContest.  Go District 3! http://t.co/vh…,4,0
427206160484413441,2014-01-25 22:27:40,.@InNEVation thx for hosting our kick-off meetup for the Congressional App Challenge!  #NV03 http://t.co/NTtDmsiDrd,5,0
427173076514512896,2014-01-25 20:16:12,@complexnerve 1 pm,0,0
427169180740108290,2014-01-25 20:00:43,".@mortgagenewsmnd argues for renewal of Mortgage Forgiveness Debt Relief Act, which expired at end of 2013. http://t.co/MUT2adxNm6 #NV03",2,0
427151278339158016,2014-01-25 18:49:35,Today is the Congressional App Challenge kickoff event at the @InNEVation Center. Visit http://t.co/HslMdG12Vw to learn more and come on by!,3,1
426867187966410752,2014-01-25 00:00:43,Saturday I will be at the @InNEVation Center for Congressional App Challenge kickoff event. Visit http://t.co/YLRIqdWo3D to learn more #NV03,1,0
426852611908993024,2014-01-24 23:02:47,"Toured Start Pac, maker of reliable, efficient and long-lasting American-made ground power units. Always amazed by the diversity of biz...",0,0
426828889403695105,2014-01-24 21:28:31,Was a great visit! MT @NevadaDECA: Check out article detailing @RepJoeHeck 's visit to Southwest CTA DECA last month! http://t.co/veeWkSC2Uf,1,0
426812243636801536,2014-01-24 20:22:23,Had a great time speaking to Thurman White Middle School 7th graders and taking their questions. #NV03 http://t.co/HCTreRcPRH,2,2
426746393726697474,2014-01-24 16:00:43,.@ReviewJournal on @_FINALLYHOME_ &amp; @PulteHomes making dream of homeownership come true for wounded warrior http://t.co/buNEjdncuZ #NV03,4,3
426474795497431040,2014-01-23 22:01:29,Incredible honor to welcome wounded warrior CPL Chris Bales to #NV03 &amp; his new home provided by Pulte Homes &amp; Operation Finally Home.,4,1
