id,created_at,text,retweets,favorites
212591225453297664,2012-06-12 17:04:32,Appreciate Drs. Levi &amp; Kenny of Lung Screening program at Atlantic Medical Imaging for great demo today. Encourage #SouthJersey NOT to smoke,0,0
212558239739555843,2012-06-12 14:53:28,"Discussing reasons to NOT smoke at Atlantic Medical Imaging in #SouthJersey today. Used to smoke 2 packs/day, better to live smoke-free",1,0
211126496100745216,2012-06-08 16:04:13,"Posted a poll for #SouthJersey residents on #Facebook - Is Obama right when he says ""the private sector is doing fine""? http://t.co/bTlcRsks",0,0
211117756374990848,2012-06-08 15:29:30,"Putting out another e-newsletter today. Details on what I'm working on in Congress, events in #SouthJersey. Sign up! http://t.co/xf4OtHsd",0,0
211116607236349953,2012-06-08 15:24:56,"If President Obama believes ""private sector is doing fine"" he should visit #SouthJersey where double-digit unemployment, families struggle",1,0
211116158663929856,2012-06-08 15:23:09,"RT @SpeakerBoehner: President Obama says ""the private sector is doing fine"" -- millions out of work, 8%+ unemployment for 40 months #doi ...",180,0
210765948502818817,2012-06-07 16:11:32,Great seeing reps of NJ League of Conservation Voters. Always happy to welcome #SouthJersey residents to Capitol http://t.co/aXQj7Cow,0,0
210475178092797952,2012-06-06 20:56:07,"Appreciate @GovChristie coming to Galloway Wed 6/13 to meet with #SouthJersey residents, hear their concerns. RSVP https://t.co/qjzmQHwn",1,0
210455051339177984,2012-06-06 19:36:08,"@USCG already does more with less. We can't expect them to do more with nothing. As Chair of Coast Guard Subcomm, I'm strongly against cuts!",1,1
210454653689806848,2012-06-06 19:34:34,"Spoke against Obama Admin proposed 1000 ppl, 4% reduction of Coast Guard. #SouthJersey home to countless Servicemembers http://t.co/vTQLp5Hi",0,1
210379252372221954,2012-06-06 14:34:57,RT @GovChristie: Our nation will forever be grateful to those who served especially to those service men &amp; women &amp; their familie ...,46,0
210379223897092096,2012-06-06 14:34:50,Today I join #SouthJersey residents to mark 68th Anniversary of #DDay. Deeply appreciate those in uniform who sacrificed so much for freedom,0,0
210113936488529920,2012-06-05 21:00:40,RT @GOPLeader: Former Pres. Bill Clinton told CNBC that Congress should extend all the tax cuts due to expire at the end of the year.  h ...,48,0
209728259083083776,2012-06-04 19:28:08,"Applaud strong turnout from #SouthJersey vets at todays forum w/ VA officials at Vineland Memorial Home. Positive conversation, move forward",1,0
208957641442070528,2012-06-02 16:25:59,Appreciate 2011 AANP State Award for supporting our nurses practitioners at Shore Memorial and across #SouthJersey http://t.co/gkoBZSwS,1,0
208550118377529344,2012-06-01 13:26:37,Proud to again sponsor bill to protect #SouthJersey police 15 years after Officer Baker was killed on duty @nbc40wmgm  http://t.co/BgQDIzkN,0,0
208224454843699200,2012-05-31 15:52:33,"Posted new pics from last week's events across #SouthJersey on Facebook. Check them out &amp; remember to ""Like"" my page! http://t.co/bTlcRsks",0,0
207227621107445760,2012-05-28 21:51:30,Great to see Somers Point cub scout pack 87 at #MemorialDay celebration. Applaud #SouthJersey community participation http://t.co/cFydQoZY,0,0
207227218504597504,2012-05-28 21:49:54,Appreciate the Coast Guard color guard at todays #MemorialDay remembrance in Cape May County http://t.co/HSdQFw3a,0,0
207110403820490752,2012-05-28 14:05:42,"Pleased to join #SouthJersey residents in Somers Point, Cape May Court House honoring those who served &amp; sacrificed so much for our nation",0,0
206094380430409728,2012-05-25 18:48:24,Grateful to those who served. Proud to attend Atlantic County's Memorial ceremony. http://t.co/hTnWBu5k,0,0
206026439387131904,2012-05-25 14:18:25,Great to be cutting the ribbon on new Cape May Convention Hall. Kicking off Memorial Day Weekend here in #SouthJersey,0,0
204998709124145152,2012-05-22 18:14:35,"THANKS to members of Bridgeton Area Chamber of Commerce for great discussion on local economy, jobs. Appreciate your dedication/partnership!",0,0
204966739967090688,2012-05-22 16:07:33,"RT @RayLaHood: #NationalMaritimeDay an opportunity to celebrate a bright past, prepare for a brighter future http://t.co/476pb0ka #maritime",7,0
204966290207670272,2012-05-22 16:05:46,"On this #NationalMaritimeDay, appreciate your dedication to efficiency &amp; safety in our ports &amp; significant contributions to U.S. economy",1,0
204965975953641474,2012-05-22 16:04:31,"As Chair of House Maritime Transpo Subcom, I honor outstanding contributions/service of 13 million Americans who are our maritime industry.",0,0
204212535145152516,2012-05-20 14:10:41,Great day for the ARC event at Parvin State Park in #SouthJersey http://t.co/tjhR2aNk,1,0
203950511144189952,2012-05-19 20:49:25,CONGRATULATIONS TO WILDWOOD ON 100 YEARS! One of #SouthJersey's true gems and favorite beach communities. Great celebration today.,0,1
203892768530108416,2012-05-19 16:59:58,"On this #ArmedForcesDay, I join with all #SouthJersey residents in expressing our appreciation for the men and women who wear the uniform",1,0
203872459982782464,2012-05-19 15:39:16,Great #SouthJersey turnout at American Heart Association walk in Ocean City today. Congratulations to all participants for worthy cause!,0,0
203554111419985920,2012-05-18 18:34:16,CONGRATULATIONS to #SouthJersey graduates of Salem Community College!! I wish you the best in your future careers.,0,0
203550501801967616,2012-05-18 18:19:56,Encourage #SouthJersey residents to subscribe to my e-newsletter via my website for regular updates http://t.co/xf4T1hBn,0,0
203228087503163392,2012-05-17 20:58:46,CONGRATULATIONS to #SouthJersey graduates of Atlantic Cape Community College!! Best of luck in your future careers.,0,0
202836292197826561,2012-05-16 19:01:55,"Appreciate @glfop support of HR 5742, Bulletproof Vest Partnership Program. Proud to stand with #SouthJersey police! http://t.co/XkWgJQpX",1,0
202835073983201280,2012-05-16 18:57:04,Pleased to again introduce bipartisan legislation w/ @RepVisclosky to reauthorize Bulletproof Vest Partnership Program http://t.co/XkWgJQpX,0,0
202409854072143873,2012-05-15 14:47:24,"This #PoliceWeek, Let's honor those who protect &amp; serve our #SouthJersey communities, at substantial risk to themselves http://t.co/sYI55NuK",0,0
202402587494989824,2012-05-15 14:18:31,In Case You Missed It - Cherry Hill Courier Post supports my efforts to legalize sports-betting in #SouthJersey http://t.co/PfGcOurd,0,0
201673541945540610,2012-05-13 14:01:33,Happy Mothers Day to all #SouthJersey mothers!,0,0
201337005089632256,2012-05-12 15:44:17,Congratulations to #SouthJersey walkers &amp; runners of 10th annual Shirley Mae event!,0,0
201009655466569728,2012-05-11 18:03:31,"On this ""Military Spouse Day"" I want to extend my appreciation to #SouthJersey military spouses for your invaluable support &amp; sacrifice.",2,0
200981622668001280,2012-05-11 16:12:07,Lewis Finch Jr was a longtime Millville Airport administrator &amp; active in his #SouthJersey community. http://t.co/bAj9bdqt,0,0
200979286470045698,2012-05-11 16:02:50,Honored to help dedicate Administration Building at Millville Airport for Lewis Finch Jr. #SouthJersey http://t.co/Raptby8G,0,0
200955283269369856,2012-05-11 14:27:27,Saddened by loss of unwavering advocate April Kauffman. #SouthJersey vets were her #1 focus. Honored to work with her http://t.co/nbsQixBD,1,0
200954358282719232,2012-05-11 14:23:47,Appreciate speaking at Veterans Housing Forum in Mullica. Local/state/federal must partner together to address housing for #SouthJersey vets,1,0
199911458971193345,2012-05-08 17:19:40,RT @GOPWhip: Tax reform would spur economic growth and create jobs -- But @WhiteHouse has taken it off their 'to do list': http://t.co/A ...,10,0
197697656317947904,2012-05-02 14:42:48,Enjoyed speaking with Cape Assist members and supporters today. Great organization who actively improves the lives of #SouthJersey teens,0,0
197395482601992194,2012-05-01 18:42:05,"Proud to support #SouthJersey wineries &amp; help secure 2007 federal designation as  ""Outer Coastal Plain"" led to today http://t.co/jMYlP5UY",1,0
197298906336473088,2012-05-01 12:18:19,"Going on #SouthJersey radio - WIBG 1020AM Larry Trulli in the Morning - to discuss current issues facing U.S., take listener questions",0,0
197297329047478273,2012-05-01 12:12:03,RT @marinenews: Congress Examines Maritime Regulatory Impacts: LoBiondo Holds Hearing to Examine Impact of Coast Guard and EPA R... http ...,2,0
197297223476850688,2012-05-01 12:11:38,RT @SalemSunbeam: The congressman and the kids: #Alloway students have plenty of questions for U.S. Rep. #LoBiondo | http://t.co/z8Qx59i ...,1,0
197010888992112640,2012-04-30 17:13:50,Great to take questions from 7th &amp; 8th graders at Alloway Intermediate School in #SouthJersey http://t.co/JTXR09Z3,0,0
196965381401870336,2012-04-30 14:13:01,"Attentive audience of #SouthJersey 5th graders at Durand School in Vineland, talking U.S. #Constitution  http://t.co/7IkKhaoJ",0,0
195595267444191234,2012-04-26 19:28:40,@Gailaker Feel free to call my Mays Landing office at 609.625.5008 or 1.800.471.4450 or write me via my website: http://t.co/sGpHLfeY,1,0
195594945451659265,2012-04-26 19:27:23,Appreciate #SouthJersey residents' feedback & opinions. Contact me via email or phone. Information at my website: http://t.co/sGpHLfeY,0,0
195588203137335296,2012-04-26 19:00:36,Pleased to be working with @FrankPallone to bring sports-betting to #NewJersey. Great opportunity for Atlantic City! http://t.co/QTlpGQFp,3,0
195582319707426816,2012-04-26 18:37:13,Glad to join WOND's Harry Hurley & Intrepid Project's Sally Hastings on #SouthJersey radio to discuss bringing home Commander Richard Somers,1,0
195518407251202049,2012-04-26 14:23:15,Barnegat Light Mayor Kirk Larson & #SouthJersey scalloper James Gutowski testify at @TransportGOP subcom hearing http://t.co/XkvaeUm1,0,0
195496522903846913,2012-04-26 12:56:17,"Chairing #CoastGuard Subcom hearing at 9am on impact of government regulations on maritime industry, #jobs. Watch live http://t.co/z6azuVGl",0,0
194449041243901955,2012-04-23 15:33:58,"Met w/ #SouthJersey interns: Patricio Ramirez, Eric Raymond, Christopher Layton, Meaghan Ireland, Linwood Donelson http://t.co/IZc6dalC",0,0
193401051964121088,2012-04-20 18:09:38,An honor to recognize and thank Mr. Lou Rosso today with @USCG for selfless effort to save two children. Real #SouthJersey hero,2,0
193353158947381248,2012-04-20 14:59:20,Appreciate the #SouthJersey energy and enthusiasm as the Landis Middle School today! Good luck on your exams!!,0,0
193031221763248128,2012-04-19 17:40:04,Looking forward to presenting Congressional citation tomorrow to #SouthJersey hero Lou Rosso who saved 2 kids last year http://t.co/XU3twWdM,0,0
191926761875963904,2012-04-16 16:31:20,"Encourage #SouthJersey to join discussion on critical issues such as economy, #gasprices on my Facebook  http://t.co/bTlhp2lm  Click ""LIKE""",1,0
191920226470871041,2012-04-16 16:05:22,"Met w/ staff of Cape May National Wildlife Refuge, one of #SouthJersey tourist attractions, environmental treasure http://t.co/lQj4jmnA",0,0
190844822171557888,2012-04-13 16:52:05,"RT @SpeakerBoehner: America’s Loss, China’s Gain: Canada moving quickly to bypass U.S. after POTUS’ #KXL rejection: http://t.co/F3XO6Wxu ...",89,0
190844661240315904,2012-04-13 16:51:27,RT @HouseIntelComm: Welcome to the new Twitter account for the House Intelligence Committee,11,0
189706833760497664,2012-04-10 13:30:08,Great to be back speaking with members of Cumberland & Cape May Counties ELC #SouthJersey http://t.co/OJooDOZb,0,0
188358701982285824,2012-04-06 20:13:08,RT @AlzAssoc_DelVal: Thanks to Rep. LoBiondo from the 2nd District for his co-sponsorship of the Alzheimer’s Breakthrough Act & the HOPE ...,1,0
188358619581005824,2012-04-06 20:12:49,RT @SugarReform: The Coalition applauds @FrankLautenberg @RepLoBiondo and Reps. Frelinghuysen and Lance for their #sugarreform efforts h ...,1,0
188357811422511104,2012-04-06 20:09:36,A Happy Easter & Joyous Passover #SouthJersey!,0,0
187947886250700800,2012-04-05 17:00:42,"Proud to receive the ""Spirit of Enterprise"" pro-biz award from Greater Millville Chamber of Commerce http://t.co/XYwLTCgS",0,0
187632221077770241,2012-04-04 20:06:22,Appreciate all #SouthJersey constituent feedback & opinions. Let Congress know how you feel. Write Your Rep today: http://t.co/dTWaZYbs,0,0
187565013794439168,2012-04-04 15:39:18,Wishing #SouthJersey's Woodruff School Band a great performance at National Cherry Blossom Festival this week http://t.co/QUpdMq3i,0,0
187532336219426817,2012-04-04 13:29:27,Appreciate speaking on critical issues to the Southern New Jersey Chamber of Commerce this morning http://t.co/lpQ3Ql4r,0,0
187171100470423552,2012-04-03 13:34:02,Honored to support federal funding for Alzheimers research w/ Delaware Valley Chapter association http://t.co/w9ixj9Hb,1,0
186840286582947845,2012-04-02 15:39:30,"RT @ACPressAtlantic: Revel opens doors, becomes Atlantic City's newest casino:  ATLANTIC CITY — A sunrise toast today marked the open... ...",6,0
185794069665026050,2012-03-30 18:22:12,Great to be at the ribbon-cutting for new offices of Gloucester County Chamber of Commerce http://t.co/ONzYpB5c,0,0
185442604786253825,2012-03-29 19:05:36,Talked critical issues of dealing w/ Iran & China with #SouthJersey 's Cumberland County Reminder during recent visit http://t.co/h2DQff0U,0,0
185442070062837760,2012-03-29 19:03:29,"Discussed key federal, local issues facing residents of Cape May County, #SouthJersey with @HeraldNews. Check it out http://t.co/unsB65zO",0,0
185055704724418562,2012-03-28 17:28:12,Great to meet with American Hellenic Educational Progressive Assoc member Stephanie Papastephanou of Ventnor today http://t.co/KatUKipz,0,0
185027749314961409,2012-03-28 15:37:07,I applaud carrier Mary Beth Gaskill of Wildwood Post Branch 903 for heroic life-saving efforts of elderly resident http://t.co/AArh335S,0,0
185026329924747264,2012-03-28 15:31:29,Appreciate so many members of #NewJersey State Association of Letter Carriers for coming by. Proud to support you! http://t.co/EQofmQLu,0,0
184683678465654786,2012-03-27 16:49:54,At the #SupremeCourt for rally with #SouthJersey residents against unconstitutional mandate in President Obama's healthcare law,0,0
184670654145101825,2012-03-27 15:58:09,Great meeting with #SouthJersey 4-H students Allison Denelsbeck of Dorothy and Jared Weygand of Belleplain today http://t.co/CpjdU25Z,0,0
184335839315247104,2012-03-26 17:47:43,#SCOTUS began oral arguments on President Obama's #HCR law today in Washington. Here are my thoughts http://t.co/MU508qsR,0,0
183265042991558656,2012-03-23 18:52:45,"Stopped by @987TheCoast to talk #gas prices, #KeystoneXL  with morning show hosts Mark &amp; Phil http://t.co/iYmZBDyZ",0,0
183250256199303168,2012-03-23 17:54:00,It's official! Multi-mission building at Coast Guard Training Center in #CapeMay is operational. http://t.co/c7iFKHSo,0,0
183247171116736512,2012-03-23 17:41:44,Cadets of @USCG Training Center Cape May - a critical facility in #SouthJersey for national security http://t.co/8yeRiQ5c,1,0
183245121649786882,2012-03-23 17:33:36,Cutting the ribbon on new $11 million multi-mission building at @USCG Training Center in #CapeMay,0,0
183211942045949952,2012-03-23 15:21:45,About to talk 2nd anniversary of President Obama's healthcare law with Dan Klein on WIBG 1020am in #SouthJersey.  #unconstitutional,0,0
183203368599158784,2012-03-23 14:47:41,"LIVE NOW on WIBG 1020's Dan Klein talking #FAA NextGen and positive impact on #SouthJersey, nation",0,0
182531562129211393,2012-03-21 18:18:10,"Watch my speech at the ""Keep Fishermen Fishing"" rally with #SouthJersey and other fishermen across East Coast http://t.co/s7Uz0UJk",1,0
182524328791904256,2012-03-21 17:49:25,"Great to see so many #SouthJersey fishermen at the ""Keep Fishermen Fishing"" rally at U.S. Capitol today http://t.co/celnZ202",0,0
182506167875022849,2012-03-21 16:37:15,"Joining #SouthJersey fishermen at the ""Keep Fishermen Fishing"" rally at the US Capitol. Great turnout!",0,0
182151923334520832,2012-03-20 17:09:37,Had pleasure to meet with @USCG cadets at U.S. Capitol for meetings this morning. http://t.co/B4VDTEoU,0,0
182119673788235776,2012-03-20 15:01:28,"Per CBS - ""National Debt has increased more under Obama than under Bush"". #SouthJersey talking about this on Facebook http://t.co/bTlhp2lm",2,0
180336225197101056,2012-03-15 16:54:41,Great meeting with members of the #Bridgeton Rotary this afternoon. Appreciated your questions and enthusiasm. http://t.co/LP88MT1y,0,0
180332686538317824,2012-03-15 16:40:37,"Appreciate meeting with #Reminder today to discuss many issues on minds of Cumberland County, #SouthJersey residents incl jobs &amp; healthcare",0,0
180010474010722305,2012-03-14 19:20:16,"Great meeting with #Hammonton Gazette today to discuss many issues incl #SouthJersey jobs, over-regs, healthcare &amp; role of gov in our lives",0,0
179543118671122433,2012-03-13 12:23:09,"Excited to speak with Ocean City Chamber of Commerce members this morning on #jobs for #SouthJersey, increasing gas prices and veterans care",0,0
179204441440915457,2012-03-12 13:57:22,@girlscouts CONGRATULATIONS on your 100th anniversary!  You've made positive contributions in countless #SouthJersey homes over the decades,0,0
178218441419915266,2012-03-09 20:39:22,"""Fannie and Freddie execs to get pay cut"" - LONG overdue but absolutely a step in the right direction http://t.co/JwUIjcui",1,0
177774377700556800,2012-03-08 15:14:49,President Obama supports House vote on bipartisan #JOBSAct to help #smallbiz #startups grow & create #jobs http://t.co/qwFYXwHF #4jobs,2,1
177408102256214018,2012-03-07 14:59:22,Chairing a subcommittee hearing today on FY2013 budget proposal for @USCG. Available online at http://t.co/pr0X0Tm5,0,0
177078564745781248,2012-03-06 17:09:54,Appreciate representatives from #NJ Veterans of Foreign Wars for meeting with me today http://t.co/ICJ8JNQM,0,0
177065271679385602,2012-03-06 16:17:05,"Extend my deepest sympathy to family of #NJ Congressman Payne family, who served w/ distinction & honor for 20+ years http://t.co/I53KM5Mj",1,0
176722540243329024,2012-03-05 17:35:11,I encourage #SouthJersey law enforcement to apply for federal COPS funding. Open applications now through March 22nd http://t.co/BNM6DDey,0,0
175601984114663424,2012-03-02 15:22:30,RT @987TheCoast: Thanks again to Congressman Frank LoBiondo for stopping by the Morning Wakeup. We appreciate all the callers who... htt ...,1,0
175601610309894147,2012-03-02 15:21:01,Appreciate meeting with Executive Committee of Cape May County Chamber of Commerce this morning in #SouthJersey http://t.co/ThdYxG19,0,0
175600723659206658,2012-03-02 15:17:29,Great to visit with @987TheCoast this morning and talking to Cape May County residents about issues on their minds. #SouthJersey,0,0
174950396849164288,2012-02-29 20:13:19,Convened Coast Guard Subcomm hearing on cruise ship safety in wake of Costa Concordia. Watch my opening statement here http://t.co/mgsSfzec,0,0
174872623992410112,2012-02-29 15:04:17,Chairing Coast Guard & Maritime Transportation hearing on cruise ship safety following Costa Concordia accident. Watch http://t.co/FVPFQzh1,0,0
174515917047349248,2012-02-28 15:26:51,Pleasure to meet with #NewJersey representatives of the Disabled American Veterans. Thank you for your service. http://t.co/YckvmreP,0,0
172151629116735490,2012-02-22 02:52:01,"Appreciate ""Matsworld on WOND 1400am for having me on tonight to talk energy, economy and future of our country",0,0
170262268578246656,2012-02-16 21:44:22,RT @GPACSwimming: Congratulations to Gunnar B. who received official word from @RepLoBiondo on his official appointment to the US Air Fo ...,2,0
170262207022637056,2012-02-16 21:44:08,RT @MrsSGMKenyon: @RepLoBiondo THANK YOU for Cosponsoring #HR2288 Caring for #Military Kids w/ #Autism Act. #CMKAA http://t.co/bnbFB1lG,2,0
170261648567840769,2012-02-16 21:41:54,RT @DeptofDefense: This is the last week to submit your photos for the 'Serving Abroad' photo call. Deadline is Feb. 20: http://t.co/T0f ...,4,0
169813785937313792,2012-02-15 16:02:16,"#SouthJersey employers say the same, @gallup poll confirms small biz not hiring b/c uncertainty of new regs, health law http://t.co/VqddRgee",0,0
169120011498168320,2012-02-13 18:05:27,RT @GOPWhip: WaPo: “Obama budget: National debt will be $1 trillion higher in a decade than previously forecast”: http://t.co/2KM7xzOn # ...,7,0
167979453882966017,2012-02-10 14:33:17,I had co-sponsored bill to repeal 1099-K reporting mandate on #SouthJersey small biz. IRS came to right conclusion http://t.co/dOcqnpON,0,0
167979108108730368,2012-02-10 14:31:54,A win for #SouthJersey small biz - IRS backing down from 1099-K reporting mandate on credit card purchases per @WSJ http://t.co/Y6r85F5y,0,0
167782866812534785,2012-02-10 01:32:07,RT @ACPressAtlantic: Mark Your Calendar: Learn about opportunities to do business with the FAA: Even before the federal government’s ... ...,1,0
167652149587738626,2012-02-09 16:52:41,GREAT to hear Revel opening 4/2. Exciting for #AtlanticCity w/ new jobs & tourism interest. COME VISIT! http://t.co/cpqE64de @ACPressACnews,0,0
167651139813253121,2012-02-09 16:48:41,Pleased to cosponsor & vote for #STOCKAct. Common-sense bill ensures taxpayer interests are not second to personal gain http://t.co/nGkl68A9,0,0
167322313459646466,2012-02-08 19:02:02,Met w/ Zach Gihorski from Port Norris & winner of national Ag Communications Award http://t.co/xThDwmdw @NJdotcom http://t.co/ujAk6tOr,0,0
166573536092225536,2012-02-06 17:26:40,Great meeting with Executive Committee of Salem County Chamber of Commerce this morning in #SouthJersey http://t.co/xJwCrLG0,0,0
166211750700654593,2012-02-05 17:29:04,Stopped by annual Vineland PBA Super Bowl breakfast. GO JERSEY GIANTS!! http://t.co/ft55Euiu,1,0
165518396258140161,2012-02-03 19:33:55,"RT @ACPressAtlantic: House approves aviation bill, includes $10.9 billion for NextGen: WASHINGTON (AP) - The House has given final ap... ...",1,0
165502149709660160,2012-02-03 18:29:22,RT @SpeakerBoehner: Appreciate @RepLoBiondo’s strong advocacy & unwavering effort to get multi-year FAA Authorization bill through Congr ...,9,0
165486477386596354,2012-02-03 17:27:05,"Senate scheduled to vote on #FAA Monday, then Pres to sign. Reliable long-term funding for NEXTGEN critical to project http://t.co/a3fjmmTz",4,0
165485604484820992,2012-02-03 17:23:37,"GREAT News #SouthJersey! House passed 4yr #FAA authorization. Critical for NEXTGEN project, local jobs at Tech Center http://t.co/a3fjmmTz",2,0
165161776466497536,2012-02-02 19:56:50,Proud cosponsor of @repaaronschock common-sense bill repealing 1099-K reporting IRS mandate on #SouthJersey small biz http://t.co/39SCT3qk,3,0
164776490234417153,2012-02-01 18:25:51,Nearly $180k in fed funding for Laureldale Volunteer Fire Rescue Company in Hamilton Twp #SouthJersey. New fire truck! http://t.co/8medII7P,0,0
164776043834650624,2012-02-01 18:24:04,GREAT News for @wildwood_nj_usa -getting $350K in federal fire grant funding. Critical assistance at much-needed time! http://t.co/8medII7P,0,0
164728180840742912,2012-02-01 15:13:53,"In Case You Missed It - Today's @WSJ editorial: ""Obama's 4 years have seen the four highest deficits since 1946"" http://t.co/G4hJZJYu",4,0
162985098864640000,2012-01-27 19:47:30,RT @GovChristie: Thank you to everyone who came to the Vineland Town Hall yesterday in South Jersey. Packed house! http://t.co/RZCOSocu  ...,12,0
162976268906807296,2012-01-27 19:12:25,Kudos @travelchannel for naming Ocean City's boardwalk 1 of 6 BEST in USA. #SouthJersey known all along. COME VISIT! http://t.co/IK9Ca0Xl,2,0
162602172146659329,2012-01-26 18:25:53,"Appreciate Carl Aquillino inviting me to talk about Social Security, Medicare at Holy Spirit Senior Citizen Club http://t.co/ixjEA0w1",0,0
162601128385720320,2012-01-26 18:21:44,Great to visit with members of Holy Spirit Senior Citizen Club in Mullica Hill in #SouthJersey today http://t.co/90kWCukg,0,0
161939845638402048,2012-01-24 22:34:02,Reminder #SouthJersey residents - Watch Pres Obama's #SOTU at 9:00 PM on http://t.co/fakCgaMw and pose your question using #SOTUGOP.,0,0
161877723252391936,2012-01-24 18:27:11,RT @GOPWhip: Ask your State of the Union questions to House #GOP members using #SOTUGOP & watch responses here: http://t.co/a8IiaNTh,6,0
161877521716088832,2012-01-24 18:26:23,No Dem Budget in #1000Days. Pres Obama NOT likely to mention tonight. #SouthJersey talking on my Facebook about this http://t.co/bTlhp2lm,0,0
161542907759828992,2012-01-23 20:16:45,Today I introduced sports-betting legislation (H.R. 3797) because #NewJersey voters have spoken loud & clear  http://t.co/9LM45P3P,0,0
161490019268304897,2012-01-23 16:46:35,My sports-betting bill is now with House Clerk - introduced today to give #NewJersey opportunity to get in game. http://t.co/9LM45P3P,2,0
161489727290224641,2012-01-23 16:45:25,"Don't miss my op-ed in @ACPressACnews about assault from Trenton on #AtlanticCity's gaming industry, employers http://t.co/ahM2pax3",0,0
161462874768818177,2012-01-23 14:58:43,"Introducing sports-betting bill today to give #NewJersey opportunity to get in game. Voters wanted, Gov signed into law http://t.co/9LM45P3P",0,0
161446396908675073,2012-01-23 13:53:15,"On WSNJ ""Delaware Valley Hotline w/ George Moore"" this morning from 9-10am. Talking issues important to #SouthJersey - economy/jobs, gaming",0,0
