id,created_at,text,retweets,favorites
451713756507410432,2014-04-03 13:32:06,Calling on #SouthJersey H.S. artists - Looking for pieces for Congressional Art Competition to represent 2nd district http://t.co/EsxJn73vdw,3,0
451442924874526725,2014-04-02 19:35:55,Good to meet w/ Diane Durham of Clayton &amp; Mariann Moran of Chatham to discuss occupational therapy issues #AOTA14 http://t.co/eE3hiAA9I9,1,3
451400096798633984,2014-04-02 16:45:44,"With new CDC data showing 1 in 68 children diagnosed, Proud to show support for World Autism Awareness #Congress4LIUB http://t.co/xyOmJiNSdD",22,22
450985590377709568,2014-04-01 13:18:38,"Flights on @united to/from #SouthJersey begin today, connecting ACY to hubs Chicago &amp; Houston. Will be on hand for inaugural flight #NoJoke",3,0
450606571119050752,2014-03-31 12:12:33,Look forward to being in Sea Isle City this morning to celebrate breaking ground on new municipal complex #southjersey,0,3
450359783997317120,2014-03-30 19:51:54,"RT @1400WOND: Congressman Frank LoBiondo, was in studio today to thank Chef Joe from Roberta's by Joe Muldoon for his work for... http://t.…",1,0
449618373488705536,2014-03-28 18:45:48,Retirement of Intel Chair @RepMikeRogers a huge loss for country &amp; constituents. Exceptional advocate who always put security of USA first,8,4
449216131099017217,2014-03-27 16:07:26,"RT @Wilderness: . @RepLobiondo,  We love that you defended our national monuments and precious cultural resources today. Thank you!",5,0
448921086668058624,2014-03-26 20:35:02,RT @hilltransport: Rep. LoBiondo: Act now to prevent FAA shutdown repeat http://t.co/wwvBCQHnGF,2,0
448910294647971840,2014-03-26 19:52:09,Appreciate meeting w/ veterans of Military Order of the Purple Heart. Thank you for your service &amp; defense of nation http://t.co/shrWWoNXr6,0,0
448812945175093249,2014-03-26 13:25:19,Great visit with members &amp; staff of Wildwood Catholic History Club. Look forward to seeing you back in #SouthJersey http://t.co/PbJS5S9wVs,5,5
448531580144070656,2014-03-25 18:47:16,See you soon! RT @ThomasDePaul: Wildwood Catholic History Club at the Naval Academy and on way to visit @RepLoBiondo! http://t.co/5iiSa3vtGG,0,0
448521992056995840,2014-03-25 18:09:10,"Honored to speak with #AeroClub members on safety of aviation, their ideas for upcoming #FAA Authorization bill http://t.co/znMji9YmKH",0,0
448481510358646786,2014-03-25 15:28:19,Great to welcome #SouthJersey FFA members David Watts &amp; Kyle Clement of Carneys Point to Washington http://t.co/yFnjZ2TLK0,5,4
448086866785751040,2014-03-24 13:20:08,RT @nbc40news: Congressman @RepLoBiondo sponsors Veterans Enrollment Clinic http://t.co/hgEVRgHSLN http://t.co/PFe55geXQi,2,0
447380414731005953,2014-03-22 14:32:57,Greeting #SouthJersey vets attending enrollment clinic in Vineland. Goes till 1:30pm at Semper Marine Detach Hall http://t.co/YlXUXzwxzS,3,3
447110386521616386,2014-03-21 20:39:57,"Pleased President Obama has signed bipartisan #fixflood legislation into law, reducing premium increases for countless #SouthJersey families",2,0
446760709922516993,2014-03-20 21:30:28,Reminder #SouthJersey - hosting enrollment clinic for our veterans this Sat from 10:30am-1:30pm in Vineland  http://t.co/nP02LKLf3i …,0,0
446742389223198720,2014-03-20 20:17:40,"Thanks @LJBarrick, member of my Youth Advisory Council, for invite to speak w/ classmates at Ocean City High School http://t.co/bHBqEwc1aK",2,2
446673759232356352,2014-03-20 15:44:57,Latest e-newsletter headed to your email box this afternoon. Don't miss out #SouthJersey  http://t.co/IWwSg55erf …,1,0
446648466622513152,2014-03-20 14:04:27,Great turnout of #SouthJersey students to clean up OC's beach/boardwalk. Thanks NJ Clean Communities for organizing! http://t.co/bRXOeVhkk7,1,0
446642027959447552,2014-03-20 13:38:52,Listen to her -&gt; MT @LJBarrick: Sup OCHS. Rep LoBiondo is coming to OUR SCHOOL at 3:00 in Auditorium! Be there or be square #DontBeASquare,3,2
446635084184293376,2014-03-20 13:11:16,Stopping by to thank volunteers - See you there! MT@DanSkeldonNBC40 I'm excited to emcee NJ Clean Communities Student Exchange in Ocean City,2,2
446290127917420545,2014-03-19 14:20:32,"While waiting for President to sign, ICYMI @ACPressAtlantic Editorial: ""Flood Insurance Changes / A Responsible Fix"" http://t.co/CH9xlk0Q8h",4,1
446245813061029888,2014-03-19 11:24:27,"Will be joining WSNJ's George Moore this morning, talking current issues in DC &amp; taking questions from Cumberland County residents. Listen!",2,1
445993629283536896,2014-03-18 18:42:22,Don't forget to join other #SouthJersey residents in thoughtful discussions on my Facebook https://t.co/OVzuVfzap1,0,0
445992879056760832,2014-03-18 18:39:23,#SouthJersey - tell veterans you know -  I'm hosting enrollment clinic this Sat from 10:30am-1:30pm in Vineland http://t.co/nP02LKLf3i,0,0
445536411244953600,2014-03-17 12:25:32,"Due to weather, my DC office is closed today. #SouthJersey residents needing assistance can contact my Mays Landing office at 609.625.5008",1,0
444967077514711041,2014-03-15 22:43:13,Stopped by North Italy Club to support #Vineland Fire Dept kegs &amp; eggs event http://t.co/kzYVv2McUj,3,2
444860723437395970,2014-03-15 15:40:36,Appreciate the Cub Scout Pac 126 in Mays Landing for having me join their breakfast http://t.co/MtR2WxIyR8,2,0
444268282716364801,2014-03-14 00:26:27,"Watching news reports closely on emergency landing at PHL. Hope all aboard are safe, #SouthJersey families able to unite w/ loved ones soon",3,3
444233361666875392,2014-03-13 22:07:41,"BIG Congrats to @SenatorMenendez for starting momentum, then carrying compromise bill I helped broker through Senate to aid #NJ homeowners",5,2
444231736122425344,2014-03-13 22:01:13,"Bipartisan House-passed #fixflood bill APPROVED by Senate, headed to President! Huge financial relief for so many #SouthJersey families",10,3
443870328226578432,2014-03-12 22:05:07,RT @dsissman: @RepLoBiondo Thank you for signing the America 4 Boston Prayer Canvas. @PrayerCanvasUSA #america4Boston http://t.co/HJj20OzArj,1,0
443754433567272960,2014-03-12 14:24:36,Don't miss my op-ed in @PhillyInquirer on great economic &amp; job opportunity for #NJ with unmanned aircraft w/ @AUVSI http://t.co/uyA6MqPpUh,1,0
443753684313595904,2014-03-12 14:21:37,Catch up on yesterday's event --&gt; RT@nbc40news Unmanned Aircraft focus of Congressional Hearing at FAA Tech Center http://t.co/FriHSO97Iy …,2,1
443753204875272192,2014-03-12 14:19:43,".@galeharrier I support #renewUI, asked for vote before Dec expiration. Definite need for many #SouthJersey families, awaiting Senate action",5,3
443752110187085824,2014-03-12 14:15:22,"102 years of inspiring countless #SouthJersey girls, wishing a very Happy Birthday to the @GirlScouts of the USA!",2,4
443736658983534592,2014-03-12 13:13:58,RT @HCSVillage: Congressman LoBiondo and students in his Youth Advisory Council visited the Village on Saturday for a talk and... http://t.…,2,0
443478525212127232,2014-03-11 20:08:14,"Special thanks to @FAANews Deputy Admin Whitaker, Director Filler &amp; entire FAA Tech Center staff for hosting todays aviation subcom hearing",3,0
443440777939517440,2014-03-11 17:38:14,WATCH --&gt; MT @Transport: Now streaming #Aviation Hearing live from William Hughes Tech Center: http://t.co/saOP4smUAG http://t.co/MFp24Dgu8u,7,0
443406901859348480,2014-03-11 15:23:38,RT @Transport: #Aviation Chair @RepLoBiondo and @RepRickLarsen touring the FAA's William J. Hughes Tech. Center this morning. http://t.co/5…,17,0
443370301586694144,2014-03-11 12:58:11,"Pleased to welcome Aviation Subcommittee Ranking Member @RepRickLarsen to our FAA Technical Center for a tour, today's field hearing",2,1
443144349354700800,2014-03-10 22:00:20,"Spoke w/ @nbc40news about approved #fixflood legislation, positive impact for #SouthJersey homeowners. Joined by local mayors. Watch at 6pm",4,1
443141713843224576,2014-03-10 21:49:52,RT @SenatorMenendez: .@RepLoBiondo We’re working on it! Hope to get our bipartisan bill to the finish line as soon as poss to help New Jers…,2,0
443114932742402048,2014-03-10 20:03:27,"Closely following developments on missing Maylasia Airlines plane. Passengers, crew &amp; their families are certainly in our thoughts &amp; prayers",1,2
443088958093008897,2014-03-10 18:20:14,Hoping @SenatorMenendez &amp; Sen @CoryBooker can move bipartisan #fixflood bill passed 306-91 by House through Senate to President's desk,7,0
443088408043597826,2014-03-10 18:18:03,"Joined by @RepChrisSmith, Freeholder Dir Thornton w/ mayors of Cape May &amp; Atlantic counties for #fixflood press conf http://t.co/Kqiu1cPEJK",1,0
443066358591684608,2014-03-10 16:50:26,"Headed to #OceanCity to discuss bipartisan #fixflood legislation. Senate should accept House-passed bill, give certainty to homeowners",2,1
443040051568861185,2014-03-10 15:05:54,"RT @AARPNJ: Over 5,600 South Jersey #aarp members were on our #HouseCall with @RepLoBiondo this morning!",4,0
443028058623455232,2014-03-10 14:18:14,RT @AARPNJ: @RepLoBiondo is on an AARP House Call right now! Talking about #SocialSecurity and #Medicare.,2,0
443027957242941440,2014-03-10 14:17:50,"Talking this morning with 40,000 #SouthJersey seniors as part of @AARPNJ ""House Call"" series http://t.co/SIFAlumYvz",2,0
442759133725728770,2014-03-09 20:29:38,"Met w/ Youth Advisory Council yesterday, speaking Mon w/ seniors as part of @AARPNJ ""House Calls"" series. How's your weekend #SouthJersey?",2,0
442633703517605888,2014-03-09 12:11:13,Don't forget to #SpringForward #SouthJersey. Our dogs Luca and Lucia certainly didn't miss that hour of sleep,4,2
442037136486068224,2014-03-07 20:40:40,"LAST CALL - RSVP by 5pm for 3/11's #aviation field hearing at FAA Tech Center. Focus on NextGen, UAS, safety http://t.co/r0q3Iq6F59 … …",0,0
442004366187560960,2014-03-07 18:30:27,RT @NJLCV: New Jersey LCV &amp; National LCV Praise Rep. LoBiondo's Vote Against Whitfield Bill http://t.co/IEVJf9lKDo,1,0
442002509427904513,2014-03-07 18:23:04,"Had honor of hosting family, friends of #OceanCity Vietnam vet Jim McElwee this morning as he received Bronze Star https://t.co/3RxWWjdRd0",1,0
441691627166654464,2014-03-06 21:47:44,"Reminder - RSVP by Fri for my #aviation field hearing at FAA Tech Center. Focus on NextGen, UAS, role in safety http://t.co/r0q3Iq6F59 …",1,0
441691424372031490,2014-03-06 21:46:56,"Headed back to #SouthJersey to busy weekend. Presenting Bronze Star Medal to Vietnam Vet Fri, meeting w/ Youth Advisory Council on Sat",0,1
441677903651409920,2014-03-06 20:53:12,Watch today's bipartisan #fixflood event on Capitol Hill. Hopefully enthusiasm &amp; passion on this issue will continue http://t.co/29JA48xZ1t,4,0
441668981783801856,2014-03-06 20:17:45,RT @HeraldNews: NEWS: Pay Returned As Promised @RepLoBiondo http://t.co/hG5mnrcxeu,1,0
441629833760894977,2014-03-06 17:42:12,RT @NJAudubon: Leadership looks like @RepLoBiondo working to make air cleaner for our kids; votes against bad pollution bill HR3826 #njpoli…,1,0
441620120952377344,2014-03-06 17:03:36,"Joined w/ @Transport Chairman Shuster on bipartisan ""Transparent Airfares Act"" to openly reveal taxes in airfares http://t.co/UU5ExogokX",4,0
441611744616525824,2014-03-06 16:30:19,"Will join #SouthJersey officials, realtors to discuss years-long effort, impact of bipartisan #fixflood legislation in Ocean City on Monday",4,0
441610379689353216,2014-03-06 16:24:53,Celebrating bipartisan effort to #fixflood legislation at Capitol Hill press conference http://t.co/bzYmUeEzvY,4,1
441602571023568897,2014-03-06 15:53:52,#SouthJersey veterans - Don't forget my enrollment clinic on Sat March 22nd from 10:30am-1:30pm in Vineland. Details on website or Facebook,3,0
441602222313316352,2014-03-06 15:52:29,RT @VeteransHealth: Want to make sure you’re getting all the important news and updates from us and your local VA medical center? http://t.…,4,0
441545466753212417,2014-03-06 12:06:57,"Joining @1400WOND's Don Williams now to talk #fixflood legislation, latest situation in Ukraine. Listen &amp; call w/ your ??s #SouthJersey",3,0
441344135958888448,2014-03-05 22:46:56,RT @NJTVonline: @RepLoBiondo : Flood Insurance Affordability Act Good for Sandy Victims #NJTVNews http://t.co/V3HyoMOT4s,1,0
441336946359402497,2014-03-05 22:18:22,"Checking in with @1400WOND's Pinky Kravitz to discuss #FIXFLOOD bill prospects, failed foreign policy of President re: Russia-Ukraine events",2,0
441330198072410112,2014-03-05 21:51:33,Hey #SouthJersey - Tune into @nbc40news at 5pm as I discuss months-long fight for #FIXFLOOD legislation approved by House last night.,11,0
441258761764605953,2014-03-05 17:07:41,Joining @1400WOND Dave Spatz shortly to talk BIG 306-91 #fixflood vote in the House last night. Senate should accept our bipartisan bill,4,1
441240279454998528,2014-03-05 15:54:15,"Holding roundtable w/ FAA &amp; UAS industry on safety concerns, uses of commercial unmanned technology. http://t.co/N2FXKzfi65",0,0
441001872925540352,2014-03-05 00:06:54,House APPROVES #FIXFLOOD bill 306-91. Senate should immediately take up critical relief for #SouthJersey homeowners http://t.co/HuXN1AZ6Wa,14,1
440985584484352000,2014-03-04 23:02:11,Vote on #FIXFLOOD legislation in House coming up in minutes. Just spoke on critical need for #SouthJersey homeowners https://t.co/KeNlnxgqHq,1,0
440972945842663425,2014-03-04 22:11:57,Headed to House floor to voice support of #FIXFLOOD legislation to be voted at 6:30pm. Critical for #SouthJersey. Watch LIVE on @cspan,4,2
440933232192667648,2014-03-04 19:34:09,"Convening #aviation field hearing at FAA Tech Center in EHT. Focus on NextGen, UAS, role in safety. Get details here: http://t.co/NNB2HP1F5G",2,0
440896709397213184,2014-03-04 17:09:01,"RT @GSSANJ: Env Regs Affecting the Maritime
@replobiondo bill to continue the moratorium on vessel discharges. Delayed till 3pm http://t.co…",1,0
440876939306614784,2014-03-04 15:50:28,"RT @JerseyShoreOpen: Snow-covered or basking in sun, #AtlanticCity's Boardwalk was named @travelchannel's ""Best Beach Boardwalk"" !! http://…",1,0
440841287340544001,2014-03-04 13:28:47,Headed to DC for vote on bipartisan #fixflood legislation. Both Mays Landing &amp; Washington offices open to assist #SouthJersey,5,1
440509595770167296,2014-03-03 15:30:46,"Due to severe winter weather, DC &amp; Mays Landing offices are closed. If need help, my staff &amp; I are checking voicemails, will get back to you",1,0
440259839634067457,2014-03-02 22:58:20,"Stay safe #SouthJersey with this latest winter storm. Listen to weather reports, stay off road so first responders can do their jobs.",3,0
439472586716487680,2014-02-28 18:50:04,"RT @VeteransHealth: Connect the #Veterans in your life with caring, qualified VA responders at http://t.co/ZOW9oIxA9u. Call 1-800-273-8255 …",8,0
439471362164674560,2014-02-28 18:45:12,#fixflood vote delayed til next week to include add’l bipartisan ideas. House support grows to protect homeowners from outrageous increases,13,1
439152548843249664,2014-02-27 21:38:21,Key part of our economy is tourism to #JerseyShore. Will continue to support efforts of #NJ Travel Industry Assoc. http://t.co/HL6F9TPj20,1,1
439082546492878848,2014-02-27 17:00:11,RT @FAANews: Busting Myths about the FAA and Unmanned Aircraft http://t.co/xbbnHXevnZ #aviation #AvGeeks,33,0
438769347033833472,2014-02-26 20:15:38,CONGRATS @CleanOcean on 30 years of protecting &amp; promoting #JerseyShore! Proud to join your education &amp; efforts over the years #COAsBDay,2,1
438750895476449281,2014-02-26 19:02:19,"Pleased to work w/ #NJ Teaming with Wildlife Coalition, enthusiasts to protect #SouthJersey's environmental treasures http://t.co/GG9xe2ctOU",4,4
438307455802429440,2014-02-25 13:40:15,"Invited by member of my Youth Advisory Council, looking forward to ??s from students at Kingsway Regional HS today before returning to DC",2,2
436186137720152064,2014-02-19 17:10:53,"Calling @1400WOND to tak status of sports-betting, Supreme Court appeal w/ host David Spatz &amp; @FrankPallone. Listen: http://t.co/so7z3lnAZU",2,0
436172210990899200,2014-02-19 16:15:33,On Sat 3/22 will host my 10th #veterans enrollment clinic in cooperation w/ VA Wilmington Med Center in #SouthJersey http://t.co/LbpJO5khar,2,1
435866381620228096,2014-02-18 20:00:18,#NewJersey appealing sports-betting decision to @USSupremeCourt is welcome news to @FrankPallone &amp; myself. http://t.co/4lu6zNsd6h,3,0
435860217025134592,2014-02-18 19:35:48,"Privilege to serve w/ @RushHolt, an advocate for his constituents &amp; voice for #NewJersey’s interests. I wish him &amp; his family very best",0,0
434324991862001664,2014-02-14 13:55:22,"Mays Landing office is open for normal business hours, DC office will be open later this morning to assist #SouthJersey residents",2,0
433944657580400641,2014-02-13 12:44:03,Mays Landing office closed this morning but staff is checking voicemails for #SouthJersey residents needing help. DC office closed today,4,0
433768428252323840,2014-02-13 01:03:46,Joining @1400WOND Mat's World in 5min to talk #floodinsurance announcement &amp; other issues facing #SouthJersey. Listen &amp; tweet thoughts,2,1
433744119492390912,2014-02-12 23:27:11,Especially thankful of @GOPLeader Cantor’s determination &amp; commitment to finding workable result to #floodinsurance national problem,1,0
433742026429829120,2014-02-12 23:18:52,"Appreciate efforts of @BillPascrell, NJ del in fight for bipartisan compromise critical to livelihood of #JerseyShore http://t.co/mmYRh5IIze",2,0
433740113546190848,2014-02-12 23:11:16,BIG NEWS - House to vote on modified Grimm-Waters-LoBiondo #floodinsurance legislation week of Feb 24th to help #SouthJersey homeowners,3,0
433738084963061761,2014-02-12 23:03:12,RT @GOPLeader: The House will consider a version of the Homeowner Flood Insurance Affordability Act the week of February 24th.,23,0
433586692599996416,2014-02-12 13:01:37,".@rnolter Happy to explain, call my office &amp; let staff know you want call-back from me. I call constituents to talk every day. 609.625.5008",1,1
433572419584815104,2014-02-12 12:04:54,"Joining @1400WOND Don Williams now to discuss key issues for #SouthJersey - jobs, Obamacare, flood insurance. Listen &amp; call w/ your ??s",1,0
433392580542201856,2014-02-12 00:10:17,"RT @WeAreALPA: On behalf of the 50,000 @WeAreALPA pilots, thank you @RepLoBiondo &amp; @RepRickLarsen for all your hard work on HR 3578 http://…",3,0
433349491626737664,2014-02-11 21:19:04,"Talking with @1400WOND Pinky Kravitz now on #floodinsurance efforts, Coast Guard and aviation bills moving forward",4,0
433340585605206016,2014-02-11 20:43:41,My ongoing efforts to protect #SouthJersey commercial fishing industry from excessive EPA fines approved by Committee http://t.co/NhtXKY3DJg,0,1
433324669601460224,2014-02-11 19:40:26,"Speaking on House Floor soon on my bill w/ @RepRickLarsen for FAA open rulemaking on sleep disorders for pilots, air controllers. Vote today",3,0
433292110079344640,2014-02-11 17:31:03,"As #SouthJersey prepares for next round of winter snow, consider donating blood to help local efforts per @TheSJTimes http://t.co/ktLAY3d0P6",3,1
432948038043066368,2014-02-10 18:43:50,"Appreciate AP Politics/Gov students of Clearview Regional High School for thoughtful questions, informed debate today http://t.co/PqEHolw6x7",14,14
432580323658825728,2014-02-09 18:22:40,Congratulations to 177th Fighter Wing Hometown Heroes honored today. You are an inspiration to #SouthJersey community http://t.co/ik89geZZka,3,1
431848903541944320,2014-02-07 17:56:16,"Appreciate @CMCChamber for hosting #floodinsurance forum in CMCH today. Critical issue affecting many in #SouthJersey, momentum to fix w/ us",3,2
431530663850688513,2014-02-06 20:51:42,".@StopFemaNow Helped author Grimm-LoBiondo bill which has over 180 cosponsors. Clearly I support &amp; pushing for vote, open to strengthening",1,0
431529433468399616,2014-02-06 20:46:49,Join every #SouthJersey resident in wishing best of luck to US Olympians competing in #Sochi. GO TEAM USA!!,2,2
431498915129466881,2014-02-06 18:45:32,Headed back to #SouthJersey - will be in Cape May Court House tomorrow giving update on #floodpolicy status in House at CMC Chamber forum,0,0
431164722671403008,2014-02-05 20:37:35,Missed my opening statement at today's #Aviation subcom hearing on #NextGen? Catch it on my YouTube page http://t.co/ElnWJoKTBD,1,0
431069706909253633,2014-02-05 14:20:01,Chairing @Transport #Aviation subcom hearing at 10am focusing on #NextGen &amp; unmanned aerial systems. Watch online http://t.co/huorQ4U8hW,2,0
430738975565701120,2014-02-04 16:25:49,Enjoyed working w/ @RepAndrews on critical #SouthJersey issues. His absence as an advocate for NJ will truly be felt http://t.co/fdmj3AifTx,3,0
430705103461294081,2014-02-04 14:11:13,"Not often able to discuss work on @HouseIntelComm, but today is open hearing on worldwide terrorist threats. Watch http://t.co/FzJUA0gYdJ",2,0
429359418564558848,2014-01-31 21:03:57,"Today @StateDept signed off on #Keystone pipeline, so President should use his pen &amp; sign off on project for America's energy independence",2,0
429297597832916993,2014-01-31 16:58:17,Wishing #SouthJersey asian households a very joyous celebration &amp; Happy Year of the Horse!,1,0
428982929637658624,2014-01-30 20:07:55,Appreciate @SenatorMenendez efforts in Senate approving delay in flood insurance premiums. Working together as its critical for #SouthJersey,1,0
428982018836140033,2014-01-30 20:04:18,Senate's strong bipartisan vote to delay drastic flood insurance hikes for #SouthJersey families = House MUST ACT http://t.co/lPa1memgq0,1,0
428642437889011713,2014-01-29 21:34:55,RT @NJAHC1: Thanks @RepLoBiondo 4 your vote vs #farmbill &amp; 4 continuing 2 help people in South Jersey get needed food assistance #protectSN…,1,0
428582188628836352,2014-01-29 17:35:31,".@MCooklin Thanks for tweet. Just saw request, was on overseas Intel Comm trip last week. Linda in Mays Landing office will call to set up",0,0
428376497070419968,2014-01-29 03:58:10,RT @cspan: VIDEO: Republican Response from Rep. Cathy McMorris Rodgers (@cathymcmorris) http://t.co/PlZf7OF105 #sotu http://t.co/o5JC9MEZ9l,31,0
428369604021190656,2014-01-29 03:30:46,"Not working collaboratively &amp; cooperatively, President rather use executive orders to achieve agenda. Cannot ignore Congress, Constitution",4,2
428368922878824448,2014-01-29 03:28:04,"Ready &amp; willing to work on concerns of #SouthJersey families as we have on increasing PTSD funding for #veterans, protect nation’s security",0,3
428367958994210817,2014-01-29 03:24:14,My reaction to the President's #SOTU tonight https://t.co/pQ8jS5icoV - what's your reaction #SouthJersey?,2,1
428338696203812864,2014-01-29 01:27:57,Awaiting with #SouthJersey residents for President Obama's #SOTU. Joined in the House Chamber w/ fellow #NJ @USRepRodney &amp; @RepPeteKing,0,0
427813911908212737,2014-01-27 14:42:39,Encourage #SouthJersey residents to join the discussion on President Obama's #SOTU on my Facebook page: https://t.co/i2Z6n1GT7e,1,0
427809981845762048,2014-01-27 14:27:02,"Tuesday night will be @BarackObama's #SOTU address - #SouthJersey, what are YOU hoping to hear the President discuss?",1,0
427094696360300544,2014-01-25 15:04:45,Good to be home in #SouthJersey after week overseas on official Intel Committee assignment.,5,0
423842560331620352,2014-01-16 15:41:55,"Pleasure to serve w/ @BuckMcKeon, outstanding Chairman of @HASCRepublicans. Look forward to his final year &amp; wish best in your retirement.",2,0
423583956542300160,2014-01-15 22:34:19,First e-newsletter of 2014 delivered right to your email tomorrow. Don't miss out #SouthJersey  http://t.co/ndVhEEXHDh,1,0
423127523661066240,2014-01-14 16:20:37,.@rhagapito in Dec I joined in letter asking to extend unemployment benefits. Definitely great need in #SouthJersey http://t.co/dbhneqUW0D,0,0
422045073526624256,2014-01-11 16:39:21,"We were joined by #CapeMay Mayor Mahaney, Freeholder Dir Thornton, CAPT Prestidge , CDR John today at Training Center http://t.co/GlntXu3gr5",3,1
422044327640973312,2014-01-11 16:36:23,"Pleased to join Sen @CoryBooker at @USCG Training Center in #CapeMay to discuss key missions, meet cadets http://t.co/cWAJ00dBnS",4,2
421854299333734400,2014-01-11 04:01:17,RT @ACPressNJnews: Treasury: Volunteer firefighters and EMTs exempt from ACA employer mandate: The Treasury Department and IRS cl... http:/…,2,0
421759670269652992,2014-01-10 21:45:15,"Applaud joint efforts w/ @RepLouBarletta &amp; others to ensure ""volunteer"" stays volunteer for our local firefighters under #Obamacare",4,3
421759285417095168,2014-01-10 21:43:44,Pleased Obama Admin backtracked from disaster-in-making for #SouthJersey towns w/ vol firefighter #Obamacare rule http://t.co/D5iw6oyHCt,1,0
421676060569108480,2014-01-10 16:13:01,Security issues w/ #Obamacare MUST be addressed to protect personal info of #SouthJersey residents. Voted now w/ strong bipartisan majority,3,0
421035460841177088,2014-01-08 21:47:30,"Re: GWBridge closures, I only know what read in papers. All facts should come out &amp; confident @GovChristie will take appropriate action",11,3
421029190784548864,2014-01-08 21:22:36,".@KateNocera @GingerGibson Couldn't answer your impromptu ??s as exited bathroom, was late for meeting w/ Chairman on committee business",8,2
421011861966823424,2014-01-08 20:13:44,Check out my latest op-ed on #SouthJersey priorities for 2014 http://t.co/3x9Yf8nAEB,2,0
419087426519187456,2014-01-03 12:46:43,"Due to winter storm, my Mays Landing office is closed. #SouthJersey residents needing help can call my DC office - 202.225.6572. Stay safe!",3,1
