id,created_at,text,retweets,favorites
448576729620418561,2014-03-25 21:46:41,#ICYMI I believe President Obama’s budget shortchanges American missile defenses. Read more here: http://t.co/J1FnsqxlFN,1,0
448532706084003840,2014-03-25 18:51:45,"#ICYMI: I questioned the Army about their plans for ANAD's workload. http://t.co/A92kqf8yg4

Watch here: http://t.co/DtXsyiHuli",2,0
448463071364014080,2014-03-25 14:15:02,"I am in a @HASCRepublicans hearing titled ""FY15 NDAA Budget Request from the Department of the Army."" Watch Live: http://t.co/9ixt18p3K6",0,0
448208705876926465,2014-03-24 21:24:17,See what's happening on the House Floor this week: http://t.co/1LY59isURZ,1,1
448198419102703616,2014-03-24 20:43:24,"It was great to meet with the Kennedy family of Pike Road today during their trip to Washington, DC. http://t.co/LwbEtIAi2J",1,2
448095652581347328,2014-03-24 13:55:03,This weekend marked the 4th anniversary of Obamacare's broken promises. http://t.co/viP7lzX8hX,1,3
447012072879308800,2014-03-21 14:09:17,Have you heard about the Congressional Art Contest yet? Read more here: http://t.co/uKFu017v3t,0,0
446703383890509824,2014-03-20 17:42:40,Today's #tbt is me with the folks of First Baptist of Opelika in June of 2012 http://t.co/n956FLNqXv,0,0
446683369875582976,2014-03-20 16:23:09,It was an honor to present the St Clair County Head Start with a flag flown in their honor. Here we are raising it! http://t.co/HQbEaJub1Q,0,1
446657030703435776,2014-03-20 14:38:29,"Our seniors deserve better, which is why I support a full repeal of Obamacare. http://t.co/QmYL4ke7Lr",4,1
446644346662572032,2014-03-20 13:48:05,Thanks to AUSA for having me to speak at their breakfast this morning about issues facing our Armed Forces. http://t.co/gWDe3HIsfT,0,1
446397502808686592,2014-03-19 21:27:12,Read about today's Veteran's Advisory Committee meeting: http://t.co/ZtBsjqeBpb,1,0
446382755606052864,2014-03-19 20:28:36,Hearing from my Third District Veterans' Advisory Committee today in Talladega about issues affecting them. http://t.co/iJc5C4fEVV,1,0
446302382755168256,2014-03-19 15:09:14,"More and more folks will feel #Obamacare sticker shock. I support a full repeal of this flawed law.

http://t.co/LhcZH3G2rz",1,1
446295078818955264,2014-03-19 14:40:13,Thanks to Sylacauga Family Heath Center for meeting to discuss the many problems they're having with Obamacare. http://t.co/pUVEqOoGEk,2,2
446025377807613952,2014-03-18 20:48:31,Read about today's meeting of my Third District Agriculture Advisory Committee: http://t.co/OPkfpwATMW,1,0
445977877243125760,2014-03-18 17:39:46,Thanks to my Agriculture Advisory Committee for coming out to the meeting in Auburn today. http://t.co/ulBm9ga1YU,1,0
445544398198439936,2014-03-17 12:57:17,My DC office is closed today due to inclement weather.,1,0
444547389408706560,2014-03-14 18:55:31,"This week I voted for bills that would stop the President's actions to undermine the rule of law.  Read more here:
http://t.co/6j1tqPgSj1",5,4
444538631987138560,2014-03-14 18:20:43,"Read my statement on the passage of HR 4015, the SGR Repeal and Medicare Provider Payment Modernization: http://t.co/vQ0DUOHhHP",2,0
444195126441549824,2014-03-13 19:35:45,Today's #TBT is me with Girl Scout Troop 7112 out of Smiths Station http://t.co/ppuw7rJV3P,0,0
443807013945225216,2014-03-12 17:53:32,I am honored to be a recipient of this year's Spirit of Enterprise Award. http://t.co/cT6WmqX9oS,1,1
443790366337417216,2014-03-12 16:47:23,Read my column about Obamacare's cuts to Medicare Advantage: http://t.co/b3MX2ClYeO,1,0
443753585982324736,2014-03-12 14:21:14,The President's health care law raids $700 billion from Medicare. Watch more here: https://t.co/kAFd6iiQvn,2,0
443413905239314432,2014-03-11 15:51:27,"It was great to meet with Stephanie Miller, the Assistant Director of Student Financial Services at JSU. http://t.co/kVbM6mMPsI",4,2
443382424618434560,2014-03-11 13:46:22,See what's happening on the House floor this week: http://t.co/1LY59isURZ,0,0
441619348277309440,2014-03-06 17:00:32,Today's #tbt is me at a Press Conference last Jan with @RepMoBrooks in Huntsville at the US Space and Rocket Center http://t.co/DeD5J6HcIp,0,1
441584751393386498,2014-03-06 14:43:03,I am in a House Armed Services full committee hearing questioning Gen Dempsey and Secretary Hagel. Watch live here: http://t.co/py7Efp5xeR,1,1
441313785572118528,2014-03-05 20:46:20,"It was great to meet with some officials from my alma mater, Jacksonville State University! Go gamecocks! http://t.co/qLVE1Ghbe1",2,5
441252235360866304,2014-03-05 16:41:45,"Great to have you! RT @adk17127: Great visit with @RepMikeRogersAL telling him the @AHF story for AL-3. Thanks, Mike! http://t.co/Atwbgavl0C",1,0
441221714123689984,2014-03-05 14:40:28,"This week, the House will vote on H.R. 3826, the Electricity Security and Affordability Act. Read more @YHPolitics : http://t.co/fUc8L0ZIrQ",0,0
440961206384197635,2014-03-04 21:25:18,See what's happening in the House of Representatives this week: http://t.co/ZB2jI0NH95,1,0
440918327154597888,2014-03-04 18:34:55,A member of my staff is holding Mobile Office Hours at the Russell County Courthouse until 3 p.m. EST.,0,0
440859793637388288,2014-03-04 14:42:20,A member of my staff will be holding Mobile Office Hours at City Hall in Smiths Station until 12 p.m. EST today.,1,0
440481386533621761,2014-03-03 13:38:40,The DC office will be closed today due to inclement weather.,1,0
439430965970997248,2014-02-28 16:04:41,Enjoyed interviewing with Jock Burgess at @979wvokradio this week. Thanks for having me on! http://t.co/vWHfaa6945,2,1
439410447473991680,2014-02-28 14:43:09,I'm looking forward to being a part of Talladega's Mardi Gras this weekend! http://t.co/VeHSBOXEqG,2,1
439105622894575616,2014-02-27 18:31:53,Today's #tbt is me enjoying a gorgeous fall day with former intern Rohan Muralidhar on the Capitol steps in Nov 2011 http://t.co/w9qX2jZGNf,0,3
439053449221914624,2014-02-27 15:04:34,"Congrats to these hard-working educators in Talladega County, I am proud to have them in the Third District! http://t.co/4Ut7lfEG4H",0,1
438724287566856192,2014-02-26 17:16:35,"I've been talking to folks across AL03 about the latest delay to #Obamacare Read more here:
http://t.co/PcscuB6q4W http://t.co/mM3VsjHLcZ",2,0
438696853627207680,2014-02-26 15:27:35,I am in a @HASCRepublicans Full Committee Hearing discussing NORTHCOM / SOUTHCOM posturing. Watch here: http://t.co/kEq02kZGi2,0,0
438695807706222592,2014-02-26 15:23:25,See what's happening in the House this week! http://t.co/1LY59iJXTZ,0,0
438685540079001600,2014-02-26 14:42:37,There's more bad press for the President's health care law. #Obamacare http://t.co/nk43QEwuAE,1,0
438443142954897408,2014-02-25 22:39:25,About to jump on a live Tele-town Hall meeting to hear the concerns of folks back in East Alabama!,2,0
438338939229704192,2014-02-25 15:45:21,Centers for Medicare &amp; Medicaid Services says 11 mil small business employees will see their healthcare costs rise. http://t.co/NplOOgrtIk,3,0
438328880047194112,2014-02-25 15:05:23,Thanks to @RepBoustany for inviting me to speak at Farm Day in Louisiana recently. http://t.co/Rg5vNBUUBt,1,2
438059776677658624,2014-02-24 21:16:04,What an honor to present a Congressional Record Statement to James Richardson of Phenix City. He turned 110 in Jan. http://t.co/gWunbgZVB2,3,2
438035397034401792,2014-02-24 19:39:11,Congrats! RT @DOE_SC_NSB: Auburn Junior High will represent Alabama at the National Finals in April –congratulations! http://t.co/h8ctg8C8sz,0,0
438027328250466304,2014-02-24 19:07:07,Read more about my visit to AJIN USA here: http://t.co/OeQOYZKoe6,1,0
438002613737779200,2014-02-24 17:28:55,Thanks to the folks at the AJIN USA plant in Chambers County for the tour of their Southeast Regional Center today.,0,0
435787839494569985,2014-02-18 14:48:12,http://t.co/M1jl1R9jZb,0,0
433715350824550400,2014-02-12 21:32:52,"Read my statement on cosponsoring H. Res. 442, the S.T.O.P. Resolution: http://t.co/NeUkaJ4f7C",2,1
433684445561126912,2014-02-12 19:30:03,"Due to inclement weather, my Anniston office is closed for the rest of the day. Everyone stay safe out there!",0,0
433636636920791040,2014-02-12 16:20:05,Read my latest newsletter on the future harm that #Obamacare will cause: http://t.co/FRgCipirLw,0,0
433628189907103744,2014-02-12 15:46:31,"Happy Birthday, President #Lincoln! http://t.co/EDjboofh4A",2,0
433371392424153089,2014-02-11 22:46:06,#ICYMI I could not support raising the debt ceiling without necessary reforms to cut spending. http://t.co/jrJhjp7F3Q,3,1
433321411755925504,2014-02-11 19:27:29,Are you or your family visiting DC soon? http://t.co/d6O13frXZ7,1,0
433316417098629121,2014-02-11 19:07:39,"It was great to meet with MASA delegates Dr. Buddy Smith, Jean Smith, Wanda Smith, &amp; Dr. George Smith of Lineville. http://t.co/WeiFlj5J8s",1,0
433270156773429250,2014-02-11 16:03:49,It was great to meet with some students from Auburn's School of Rural Medicine yesterday. http://t.co/wfz1div3w5,0,0
433248862409486337,2014-02-11 14:39:12,Did you know - the President has unilaterally delayed parts of his own health care law at least 23 times. #Obamacare http://t.co/OKQ3fTuJus,7,0
433013342052286464,2014-02-10 23:03:20,Read my statement on the latest #Obamacare delays: http://t.co/xzLoZaa9em,8,1
432990227146489856,2014-02-10 21:31:29,See what's happening in the House this week: http://t.co/HzauudY9tj,2,0
432932466672685056,2014-02-10 17:41:58,"After another disappointing jobs report, House Republicans remain focused on creating jobs. #GOP http://t.co/SGea5ptivV",2,1
432888497016287232,2014-02-10 14:47:15,"In January the economy added 113,000 jobs - despite expectations of adding 180,000. #GOP http://t.co/N20i2P2oom",2,0
432166950743977985,2014-02-08 15:00:04,Do you have plans to visit DC? We can schedule a tour for you! Click here for more information: http://t.co/wvEX2KAWQt #ConstituentServices,4,1
431804891938304004,2014-02-07 15:01:23,Make sure you get important updates from my office! Subscribe to my eNewsletter here: http://t.co/JhqOGOBYO6 http://t.co/uvct5RDGUN,0,1
431562958376669185,2014-02-06 23:00:01,#ICYMI http://t.co/X4oIBbRRR4,2,0
431502798392262656,2014-02-06 19:00:58,Happy Birthday to the late President Ronald Reagan! http://t.co/JlrWmBv65e,8,6
431488120509710336,2014-02-06 18:02:39,A member of my staff with be holding Mobile Office Hours at City Hall in Tuskegee today from 1-3 CDT. Stop by!,1,0
431470541107896320,2014-02-06 16:52:48,RT @YHPolitics: .@RepMikeRogersAL blasts Obama’s Education Secretary over Common Core http://t.co/2n9MCjw5ei #alpolitics,2,0
431468154363981824,2014-02-06 16:43:18,Today's #tbt is me speaking to students at Tenth Street Elementary School in Anniston in April of 2011. http://t.co/rc0fAajPXJ,1,0
431435800949977088,2014-02-06 14:34:45,http://t.co/uTH5jBCx1K,1,0
431429686754037761,2014-02-06 14:10:27,A member of my staff with be holding Mobile Office Hours at Pike Road Town Hall today from 9-11 CDT. Stop by!,1,0
431137330590916608,2014-02-05 18:48:44,RT @OfficialDLDay: .@RepMikeRogersAL with our #DLDay experts. http://t.co/dLF86NTioS,10,0
431129346913611776,2014-02-05 18:17:00,A member of my staff with be holding Mobile Office Hours at the Cleburne County Courthouse in Heflin today from 1-3 CDT. Stop by!,0,0
431127548647723008,2014-02-05 18:09:52,Read my statement on CBO's latest report here: http://t.co/HGd0bnL0wI #Obamacare,3,1
431085562465099777,2014-02-05 15:23:01,I am in a Homeland Security hearing to Markup Bill to Protect Critical Infrastructure from Cyber Attack Watch here: http://t.co/mYsEfENSxA,1,1
431078534186934272,2014-02-05 14:55:06,Obama's former Energy Secretary says the decision on #KeystoneXL is political and not scientific. http://t.co/Ys99trIpUo,3,1
431075938718474240,2014-02-05 14:44:47,A member of my staff with be holding Mobile Office Hours at City Hall in Centre today from 9-11 CDT. Stop by!,0,0
430829760751484928,2014-02-04 22:26:34,I am honored to be a recipient of the Legislative Award from the Alabama Association of School Boards. http://t.co/yZZaBP15p6,1,0
430764008099303424,2014-02-04 18:05:17,A member of my staff will be holding Mobile Office Hours at the Russell County Courthouse in Phenix City today from 1-3 EDT. Stop by!,1,0
430747828059529217,2014-02-04 17:00:59,See what's happening on the House Floor this week: http://t.co/zLKS2NyS24,0,0
430717105605210112,2014-02-04 14:58:54,"RT @HouseCommerce: TWITTER POLL: Do you support building the #KeystoneXL pipeline? ReTweet for ""Yes"" or Favorite for ""No""",272,0
430716864218791937,2014-02-04 14:57:57,A member of my staff with be holding Mobile Office Hours at City Hall in Smiths Station today from 10-12 EDT. Stop by!,0,0
430715296412741632,2014-02-04 14:51:43,"22,000 Americans have filed requests with HHS to fix glitches in their health care coverage. #Obamacare #GOP http://t.co/9TFxiULBao",2,0
430466667928633344,2014-02-03 22:23:45,Watch my questions on religious accommodations in the Armed Services at a recent #HASC Subcommittee hearing: http://t.co/fZww7aTSgP,3,1
429339546267164672,2014-01-31 19:44:59,"Although this story is in Pennsylvania, folks across Alabama have been experiencing the same pains from Obamacare. http://t.co/HWKVsJCIl9",4,1
428945834764296192,2014-01-30 17:40:31,Today's #tbt is me supporting Auburn University with Auburn Mayor Bill Ham in March of 2010 http://t.co/FHsCf258Vz,0,0
428565126891851776,2014-01-29 16:27:43,ICYMI: Rogers Praises Passage of Farm Bill....http://t.co/jfnswaADkW,4,2
428555638185394176,2014-01-29 15:50:00,"Stay safe out there, everyone. RT @aldotcom: East Alabama law enforcement urges people to stay off roads. http://t.co/MZFkLR3ZBZ #ALwx",2,2
428547324415991808,2014-01-29 15:16:58,ICYMI: My column on The Uncertain State of Our Union.....http://t.co/pGqjxp8yMD,1,1
428174159655759872,2014-01-28 14:34:09,A member of my staff with be holding Mobile Office Hours at Town Hall in Pell City today from 9-10 CDT. Stop by if we can help!,0,1
427937313164128258,2014-01-27 22:53:00,Getting ready to host a live TeleTown Hall event to hear back from folks across the Third District.,1,1
427865819649810432,2014-01-27 18:08:55,"Last week, I attended an economic development meeting to discuss topics like outdoor recreation and tourism in AL03. http://t.co/qIiqlPKFDv",1,1
427814298774011904,2014-01-27 14:44:11,#SOTU http://t.co/j8UyT8JjhY,3,2
426847720780075008,2014-01-24 22:43:21,Read more about my meetings across the Third District this past week: http://t.co/qS4IbN6MHF,2,1
426800451749568512,2014-01-24 19:35:31,Thanks to Mr. Pete Conroy and Dr. Jerry Fielding for giving me an overview of JSU's new film production studio today! http://t.co/hoe512desl,1,2
426779086313099264,2014-01-24 18:10:38,Touring Damascus Steel in Jacksonville today! #AL03 http://t.co/6HkvQI5Xmg,1,1
426757687762640896,2014-01-24 16:45:36,Thanks to the folks at Wig's Wheels in Anniston for having me today to talk about the Coldwater Mtn biking trail. http://t.co/bZ0gXEio9x,2,3
426550094322606082,2014-01-24 03:00:42,"#ICYMI Read more about my letter to Janet Yellen, the new Chair of the Federal Reserve urging her to audit the Fed. http://t.co/yL6DomQW6v",3,1
426436010637942784,2014-01-23 19:27:22,Today's #TBT is me with some students from Glennwood School in Smiths Station on their visit to DC in April of 2007 http://t.co/IitKaA2aZP,5,3
426401249555001344,2014-01-23 17:09:14,Thanks to @wsfa12news for having me today. It's always great to be able to give an update on what's going on in DC. http://t.co/29An7KOsLI,1,1
426399510957670400,2014-01-23 17:02:20,I will be on @wsfa12news giving an update on the issues we are facing in Congress. Tune in here: http://t.co/UWfj1vyE95,2,1
426127300044652544,2014-01-22 23:00:40,#ICYMI My Third District Jobs Tour also took me to Tallapoosa County. Read more about it here: http://t.co/IdNnOetUw0,1,0
426100061660270592,2014-01-22 21:12:25,#ICYMI Read about my stop in St. Clair County as part of my Third District Jobs Tour http://t.co/E7TmcfZpxT,1,0
426081358893432832,2014-01-22 19:58:06,Visiting with Steve Culberson at WAXC during my visit to Tallapoosa County today. Thanks for having me! http://t.co/6OmHkfg3EZ,0,1
426005214034804736,2014-01-22 14:55:32,A member of my staff is holding Mobile Office Hours today from 9-11 a.m. at City Hall in Ashland. Stop by if my office can be of assistance!,1,0
425695440651051008,2014-01-21 18:24:36,A member of my staff is holding Mobile Office Hours today from 1-3 p.m. at City Hall in Roanoke. Stop by if my office can be of assistance!,3,0
425686486306942976,2014-01-21 17:49:01,Continuing the Third District Jobs Tour with a visit to Buckner Barrel in Springville. http://t.co/JunmI4wwGG,1,0
425661950211543040,2014-01-21 16:11:32,Visiting the Pipe Products Division of the Ford Meter Box Company in Pell City during the Third District Jobs Tour! http://t.co/9h2yxxyQ0M,1,0
425281716014424064,2014-01-20 15:00:37,Join me today in honoring the life and legacy of Dr. Martin Luther King Jr. http://t.co/ShvmouJv6y,5,2
424259991864741888,2014-01-17 19:20:39,Thanks to Central Junior High School of Clay County for having me today to speak about the legislative process! http://t.co/9Ky2BukXPI,2,0
424215463317356544,2014-01-17 16:23:42,#ICYMI: I will be taking a jobs tour of the Third District next week. Read more here on @YHPolitics : http://t.co/jO0KsEVHr8,5,0
423890185663680512,2014-01-16 18:51:10,Today's #TBT is me with the McConnell family of Montgomery during their son Forrest’s internship here in DC http://t.co/6glWakrwcQ,0,0
423827740190445568,2014-01-16 14:43:02,"In December, for every one person who found a job, more than 4 stopped looking for one. #VoteNow http://t.co/6xqZfxpWsr",4,2
423534060414062593,2014-01-15 19:16:03,"I had the pleasure of meeting with Jack Dudley, the founder of Food4Kids AL. Learn more at http://t.co/gWd12e3JEp ! http://t.co/lQVaByOfib",1,1
423486180378681345,2014-01-15 16:05:48,Read my column about how the #Obamacare disaster has continued into 2014: http://t.co/rwnG3QNpIH,4,1
422862307077529600,2014-01-13 22:46:45,See what is happening on the House Floor this week....http://t.co/zLKS2NyS24,4,0
422792150082801664,2014-01-13 18:07:58,ICYMI: My op ed in Space News today....http://t.co/fHkFGWizg3,1,0
422202139335589889,2014-01-12 03:03:28,ICYMI:  My statement on the passing of Ariel Sharon...http://t.co/IhjGCHmx8t,4,0
421686019302227968,2014-01-10 16:52:36,Congratulations to the Town of Pike Road on their school groundbreaking ceremony today!,2,1
421279965884080128,2014-01-09 13:59:05,ICYMI: Check out my op ed in Defense One about Hagel's nuclear site tour....http://t.co/hErTZF7af0,5,1
421275730581135361,2014-01-09 13:42:15,"RT @mattmurphyshow: NEXT: @RepMikeRogersAL joins the show, talking new Congressional session.",1,0
421019282387251202,2014-01-08 20:43:13,"I am happy to welcome @RepByrne to the Alabama delegation, and I look forward to working with him!",3,1
420931700042899456,2014-01-08 14:55:12,The Second Session of the 113th #Congress begins this week. See what will be on the House floor this week here: http://t.co/zLKS2NyS24,0,0
420615456211206145,2014-01-07 17:58:34,Visit http://t.co/1VHnLWRPp2 to see when a member of my staff will be holding Mobile Office Hours in the Third District.,1,0
420566483920355331,2014-01-07 14:43:58,"If you like your doctor, you can't keep it. #BrokenPromises http://t.co/FVN1TljEkI",2,1
420302051424206848,2014-01-06 21:13:12,The Third District's very own #Auburn Tigers take on FSU tonight in the 2013 BCS National Championship game. http://t.co/zm9gHu3n6c,3,1
413760757562888192,2013-12-19 20:00:26,Today's #tbt is me participating in the Reach out and Read program in August of 2012 http://t.co/LFpwvxqFst,5,3
413015475308593152,2013-12-17 18:38:57,A member of my staff will be holding Mobile Office Hours in Roanoke this afternoon from 1-3 p.m. CDT at City Hall. Stop by!,2,0
412953380093308928,2013-12-17 14:32:12,My staff will be holding Mobile Office Hours in Valley this morning from 10 a.m. - 12 p.m. EDT at City Hall. Stop by!,2,0
411509342404235264,2013-12-13 14:54:07,The National Defense Authorization Act #NDAA passed the House of Representatives last night Read my statement here: http://t.co/sVMqUHcnaK,3,0
411218968733442048,2013-12-12 19:40:16,Today's #tbt is me speaking to Rural Electric students from Alabama during their visit to DC last June http://t.co/k2oqdIpIIq,0,0
411148732382461953,2013-12-12 15:01:11,http://t.co/rGqWutFSFr,3,1
410888202342260736,2013-12-11 21:45:56,#ICYMI Rogers: No U.S. Ground-Stations for Russia  http://t.co/5sYCZzoxyT,2,1
410800959170674688,2013-12-11 15:59:15,"Read my column about folks giving back across East Alabama in 2013:
http://t.co/glWmnD8dqv",1,0
410790800495108097,2013-12-11 15:18:53,Secretary Sebelius will testify before a House committee today. What would you ask her? #AskSebelius http://t.co/HGcJDCPa9F,1,0
410470834898100224,2013-12-10 18:07:27,Check this week's House floor schedule here: http://t.co/wsjZJ1IF1u,0,0
408687919197474816,2013-12-05 20:02:47,Today's #tbt is my wife Beth and me in front of the Capitol Christmas Tree in 2005. http://t.co/cx3QW5X0lU,2,1
408640321023537152,2013-12-05 16:53:39,"It's always great to call into @979wvokradio to give a Washington, DC update! #AL03 http://t.co/FIctfs2JEC",2,2
408611749542129665,2013-12-05 15:00:07,"According to a Harvard Institute of Politics Survey, Obama's numbers with millennials continue to drop. #Obamacare http://t.co/vqtFjlP5ru",9,3
408315014227841024,2013-12-04 19:21:00,Getting set up earlier today to record a holiday message for troops serving overseas. http://t.co/18bzu7wEmc,2,0
408283686392451072,2013-12-04 17:16:31,The beginning of a friendly rivalry with @RepHartzler who represents Mizzou. Good luck this weekend in ATL #WarEagle http://t.co/jA2BySWBqK,6,2
407959157589807105,2013-12-03 19:46:57,#WarEagle from the Toomer's Oak here on the Capitol lawn! http://t.co/jrR8tNGKNM,43,43
407922821671555073,2013-12-03 17:22:34,A member of my staff will be holding Mobile Office Hours in Phenix City this afternoon from 1-3 p.m. EDT at the Russell County Courthouse.,0,0
407906961703706624,2013-12-03 16:19:32,See this week's House floor schedule here: http://t.co/zLKS2NyS24,2,0
407893535975677953,2013-12-03 15:26:11,The individual market is not so affordable under #Obamacare http://t.co/fnzCLvglrf,5,1
407533609940029440,2013-12-02 15:35:58,"ICYMI: Mike Rogers, Cruz: Obama Deal Ignores Iran's Missile Pact With NKorea http://t.co/TuU8coI3mc",1,1
404002912885415937,2013-11-22 21:46:15,ICYMI: Reaction to the pushback of the 2015 Obamacare enrollment...... http://t.co/rPsZk8WMIm,7,1
403585108860354560,2013-11-21 18:06:02,Today's #tbt is me at the AOD Jacksonville Ribbon Cutting Ceremony in July of 2012 http://t.co/PjReGHLdDE,1,0
403557123570679808,2013-11-21 16:14:50,It's always great to call into @979wvokradio to discuss issues affecting the Third District. http://t.co/tyG6yOpnjl,3,0
403538566052974593,2013-11-21 15:01:06,More broken #Obamacare promises in Alabama. http://t.co/8gE1DqGMy8,6,5
403190598137425920,2013-11-20 15:58:24,Did you know? St. Clair County is older than the State of Alabama! #AL03 http://t.co/sobJhzjOaZ,4,1
403170205037101057,2013-11-20 14:37:22,What follows a canceled insurance plan? Higher premiums. That's why I've voted for the #KeepYourHealthPlan Act. http://t.co/TVZ278uqfs,3,0
402870948098883585,2013-11-19 18:48:13,A member of my staff will be holding Mobile Office Hours in Roanoke at City Hall from 1-3 p.m. CDT today. Stop by!,2,1
402817504373780480,2013-11-19 15:15:51,A member of my staff will be holding Mobile Office Hours in Valley at City Hall from 10-12 p.m. EDT today. Stop by! #AL03,0,0
402470134960242688,2013-11-18 16:15:32,#ICYMI Read this weekend's article in the @nytimes where I ask the Pentagon about allowing Russian GPS on US Soil. http://t.co/RBm8sWURVg,5,0
402446360957288448,2013-11-18 14:41:04,Our thoughts and prayers are with those in the Midwest who have been affected by this terrible storm outbreak.,4,4
401432885376217089,2013-11-15 19:33:52,"Today, my colleagues and I passed HR 3350, the #KeepYourHealthPlan Act. Read more here: http://t.co/UG4kZBI69G",5,3
401370868149784576,2013-11-15 15:27:26,"Later today the House will vote on HR 3350, the #KeepYourHealthPlan Act. Watch the One Minute I gave about the bill.  http://t.co/CSTeyiI3P9",6,2
401021340540358656,2013-11-14 16:18:32,Today's #TBT is me with Mayor of Pike Road Gordon Stone in June of 2012! http://t.co/1ptFJCOilf,2,0
400805442890125312,2013-11-14 02:00:38,Check out my latest column on #Obamacare broken promises: http://t.co/MZ5Mu6j0vN’t-keep-your-health-plan,3,0
400653126358663168,2013-11-13 15:55:23,I am currently in a Committee on Homeland Security hearing. Watch live here: http://t.co/FbQSBQxOFP,1,0
400649609053085697,2013-11-13 15:41:25,"I have cosponsored HR 3350, which will allow Americans to keep their current insurance if they want. #KeepthePromise http://t.co/su0aIn9jZg",3,2
400373972300099585,2013-11-12 21:26:08,Obama’s pledge that ‘no one will take away’ your health plan is proving to be untrue. http://t.co/Ie8mZVq5K0,11,4
400313601145053184,2013-11-12 17:26:14,"Did you know that on this date in 1833 the ""stars fell on Alabama,"" inspiring the now-famous song? http://t.co/GPNsIdhLTz",5,2
400286128814559232,2013-11-12 15:37:04,"#Obamacare broken promise: Plans have been cancelled, and premiums are rising. http://t.co/ZjXd9cldZ2",3,3
399899467614142464,2013-11-11 14:00:37,A huge thank you today and everyday to those who serve or have served. May we always remember our Veterans' sacrifices. #VeteransDay2013,1,5
