id,created_at,text,retweets,favorites
314738768647163904,2013-03-21 14:02:24,Voting today on a plan to balance our nation's budget. #TCOT #GOP http://t.co/VZtAWZnngL,2,0
314447661770100737,2013-03-20 18:45:39,ICYMI: Rogers delivers One Minute speech on House Floor in support of House Republican Budget...http://t.co/ssv1tz6ifc #GOP #tcot,6,1
314401220221607936,2013-03-20 15:41:06,VIDEO:http://t.co/pVkq0dGV9d The Capitol continues to be open to the public. Schedule a tour through my website - http://t.co/iWYLrQHU1J,0,0
314394473280970753,2013-03-20 15:14:18,RT @HASCRepublicans: #HASC Hearing on NorthCom and SouthCom http://t.co/tgFQFR4LeQ streaming at 10AM,1,0
314388104716877824,2013-03-20 14:48:59,In #Agriculture Full Committee Mark Up this morning. #tcot #GOP,0,0
314095737476632576,2013-03-19 19:27:14,Leading a Congressional Hearing on Nuclear Deterrent. Watch live here: http://t.co/zmLPft2phy,0,0
314092463600066560,2013-03-19 19:14:13,Retweet my earlier statement if you agree with me and support our Second Amendment rights http://t.co/vn6LWcDc2m #TCOT #GOP,4,1
314092334356774913,2013-03-19 19:13:42,Roll Call reports assault weapons ban won't pass Senate http://t.co/YbMKIFSH5y,7,0
314086995360112640,2013-03-19 18:52:29,"ICYMI: Rogers Fights for Depot Workforce, Supports Army Foreign Sales Efforts http://t.co/QXm2Q66kvC #AL #GOP #TCOT",2,0
314064051481223169,2013-03-19 17:21:19,Voting tomorrow for a plan to balance the budget. #spendingistheproblem http://t.co/7WoKg0kgYX,2,2
314029453166661633,2013-03-19 15:03:50,Missile defenses continue to be important for today’s U.S. national security. #GOP #TCOT http://t.co/xdwh96DQYZ,0,0
314028766416470016,2013-03-19 15:01:06,Honored to speak @Heritage on the 30th Anniversary of Pres. Reagan’s SDI speech. Watch live at http://t.co/95u85F7fD8,1,2
313664543781974017,2013-03-18 14:53:49,Voting this week for a plan to balance the budget.. Again. #spendingistheproblem #TCOT http://t.co/TMH3SAHck3,3,0
312289734900727808,2013-03-14 19:50:49,In a Homeland hearing trying to talk sense into TSA... Thousands Standing Around,3,0
312261592836362240,2013-03-14 17:58:59,"ICYMI: Rogers blasts ICE Director Morton, calls for his resignation http://t.co/qc0mFUwZlE #GOP #TCOT",0,0
312261227285987328,2013-03-14 17:57:32,Meeting with GKN Aerospace- an important employer in East Alabama. #AL #GOP,0,0
312207207322234882,2013-03-14 14:22:53,"Yesterday, I voted to pass HR890- a bill to stop President Obama from gutting Welfare Reform work requirements. #GOP #TCOT",2,1
312190747988340736,2013-03-14 13:17:29,I enjoyed having breakfast with ALFA this morning. We discussed Alabama's #1 industry- Agriculture! #AL #GOP,1,1
311936743811215360,2013-03-13 20:28:09,Obama says balanced budget not his priority. We need a balanced budget. Read my comments here: http://t.co/d5IENGzhFJ #GOP,1,1
311910744688054273,2013-03-13 18:44:51,ICYMI: Report from Washington: Sequester Sinks In http://t.co/X0t5SqDnLm #TCOT #GOP,0,0
311902617695567873,2013-03-13 18:12:33,At a Professional Services Council roundtable discussing ways to grow business and create jobs.,0,0
311583166555095040,2013-03-12 21:03:10,Meeting with the Coalition of Alabama Waterways about issues that are vital to Alabama's econo0my. #AL #GOP,1,0
311547648433860608,2013-03-12 18:42:02,"ICYMI:  Rogers to Press Joint Chiefs Chairman on Depot Workload
http://t.co/rCPABFoJmv #HASC #GOP #tcot #AL",0,0
311512047772921856,2013-03-12 16:20:34,Meeting with Senator Sessions about America’s Strategic Forces and the important role Alabama plays in them. #GOP #AL,0,0
309386125242429442,2013-03-06 19:32:55,ICYMI: Rogers statement on passage of H.R. 933…http://t.co/AVLFzY0FaM #GOP #tcot,2,0
309381496182026241,2013-03-06 19:14:31,Happy to be an original cosponsor of a bill to stop the NLRB from enforcing #POTUS unconstitutional Labor Relations Board appntmnts. #TCOT,4,2
309368925555146752,2013-03-06 18:24:34,Meeting with the Alabama Broadcasters Association on issues important to them. #GOP #tcot,1,0
309362139787833344,2013-03-06 17:57:36,Happy to cosponsor HR940. It grants an out from HHS’s mandate to employers who don’t wish to be involved in the destruction of life. #TCOT,1,1
309343569527857153,2013-03-06 16:43:48,Congrats to Hyundai and Honda whose vehicles were ranked as 2013’s top picks http://t.co/Y5BS1YMVbh #Alabama #TCOT,5,2
309326466330546176,2013-03-06 15:35:51,Speaking to The Submarine Industrial Base Council in Washington this week. http://t.co/Yo6ZxaffXr,1,0
309044099015667712,2013-03-05 20:53:50,I met with Chambers Co officials today to discuss issues important to them in their area. #AL  #GOP http://t.co/d3er6geVrP,2,0
309030224178319360,2013-03-05 19:58:41,"Had the chance today to discuss sequestration and its effects on ANAD with Maj Gen Terry, CG of TACOM. #HASC #GOP http://t.co/R6VouQ19jG",1,0
309000328173457408,2013-03-05 17:59:53,ICYMI:  Rogers calls on Director of ICE to resign after release of thousands of illegal immigrants...http://t.co/IaM5IPCbPR #GOP  #homeland,5,2
308976419948601344,2013-03-05 16:24:53,In a House Armed Services Full Committee hearing discussing next fiscal year's budget with the Commander of STRATCOM. #hasc #GOP #tcot,1,0
308959329225158656,2013-03-05 15:16:58,In Agriculture Full Cmte hearing to review state of the rural economy with USDA Secretary Vilsack. #tcot #GOP,0,0
308942486095679488,2013-03-05 14:10:03,"Calling in to the Matt Murphy show this morning. To listen, click the listen live icon in the top right corner. http://t.co/NHVN96LezL",1,0
308709528113909760,2013-03-04 22:44:21,Meeting with the Southern Cotton Growers on issues important to them. #tcot #GOP,2,1
307589242756931584,2013-03-01 20:32:44,ICYMI: Rogers statement on the first day of sequester...http://t.co/uHOtm8k324 #tcot #GOP,0,0
307533574486253569,2013-03-01 16:51:32,"Congrats to the new AHSAA 2A State Champs, the Woodland High School Lady Cats, on today’s victory against Prattville Christian Academy!",0,0
307213896735936512,2013-02-28 19:41:15,ICYMI: Video from today's HASC Readiness hearing......http://t.co/aDChMHyC6W #HASC #GOP,0,0
307190631816638464,2013-02-28 18:08:48,ICYMI: My latest column on spending and the sequester..http://t.co/8PyMFWfnJH #GOP #tcot,0,0
307182266474442752,2013-02-28 17:35:34,Asking Deputy Assistant Secretary of Defense John Johns for some help for the employees at Anniston Army Depot. http://t.co/i2nc6yWhVD,2,1
307151596016521217,2013-02-28 15:33:41,"Chairing #HASC Strategic Forces subcommittee this morning titled: ""Nuclear Security: Actions, Accountability and Reform."" #GOP #tcot",0,0
306857425913409537,2013-02-27 20:04:46,ICYMI:  Read more about my meeting with General Via here... http://t.co/ntm6yognYc #HASC #GOP #tcot http://t.co/SmkF0zsYrF,0,0
306785827315412992,2013-02-27 15:20:15,Meeting with folks from JSU on issues important to them. #GOP #tcot #JSUNEWS,2,0
306783776451735553,2013-02-27 15:12:06,RT @USArmy: We're accepting questions for today's chat about #sequestration. Tag your tweets with #ArmyChat http://t.co/O1UVOhUx4Y,56,0
306520511729520640,2013-02-26 21:45:59,Thrilled to meet #NASCAR owner Rick Hendrick @teamhendrick. The 88 car is sponsored by the National Guard #DegaNation http://t.co/fh46PSl161,0,0
306496316903682048,2013-02-26 20:09:51,Meeting with members of the Alabama Aviation Council on aviation issues important to them.,0,1
306468619188051969,2013-02-26 18:19:47,"ICYMI: Rogers calls for spending cuts, smarter budget reforms that don’t hurt our military readiness...http://t.co/tWW9MbyTS7",1,0
306409919341543424,2013-02-26 14:26:32,Remember the the '93 #WTC bombing on the 20th anniversary today..http://t.co/SyaO7jURnY #GOP #tcot,1,0
306174054971367424,2013-02-25 22:49:17,"RT @gopconference: MUST READ: http://t.co/0Crln3pXag ""Obama's Sequester Deal-Changer"" via @washingtonpost #Obamaquester",11,0
304681555169792000,2013-02-21 19:58:38,"Touring St. Vincent's Hospital's new facility in Pell City, Alabama. I'm glad to be able to hear concerns from the folks back home.",5,1
302437221225603072,2013-02-15 15:20:27,ICYMI:  My most recent column on the state of our union....http://t.co/5bPXdE6I #GOP #tcot,0,0
302193801810825216,2013-02-14 23:13:11,ICYMI: Check out my press release on the letter I sent to President Obama today   http://t.co/4chutdnj #GOP #tcot,2,0
301827845678837760,2013-02-13 22:59:00,"Fighting for the Anniston Army Depot's workforce - ""The Pit Crew for the American Warfighters"" http://t.co/fW8UYYVb #HASC #GOP #tcot",1,1
301770442279104513,2013-02-13 19:10:54,More on the #SOTU: The President believes more gun control measures needed; I strongly OPPOSE new gun restrictions. #TCOT,7,4
301767493570158593,2013-02-13 18:59:11,Meeting with members of the Alabama Rural Water Association on issues important to them. #GOP #tcot,0,0
301743495306153984,2013-02-13 17:23:50,"The problem isn’t not enough taxes, it’s too much wasteful spending. Revenues will double over next 10 years.  http://t.co/ywPU6eMa",2,1
301727011485908994,2013-02-13 16:18:20,"My takeaways from #SOTU: President Obama is not serious about cutting spending, reducing debt. #tcot",3,0
301712087065960449,2013-02-13 15:19:01,RT @gopconference: REMINDER: @PressSec just admitted on @FoxNews Obama initiated the sequester http://t.co/NwrKLXK1  #Obamaquester #SOTU,31,0
301709105503035393,2013-02-13 15:07:10,In #HASC Full Committee to discuss impacts of sequestration. #GOP #tcot,1,0
301700627766071297,2013-02-13 14:33:29,Tune in to the @mattmurphyshow to hear my reaction to last night's State of the Union.  Listen live at:  http://t.co/MnzEHDfG #GOP #tcot,2,0
301354004779237377,2013-02-12 15:36:08,Meeting with the Alabama Medical Association on health care issues important to them.  #tcot #GOP,0,0
301351880112611330,2013-02-12 15:27:41,ICYMI:  My reaction to NKorea detonation....http://t.co/CslY5yfY #HASC,1,0
301007989538689024,2013-02-11 16:41:11,I enjoyed speaking to some young leaders today at Cleburne County High School's Government class. #ALGOP,0,2
299203585709858817,2013-02-06 17:11:08,"#POTUS has only met the legal deadline for submitting his budget
1/5 times. Today I voted to #RequireAPlan for America’s future. #TCOT",4,0
299160210151464960,2013-02-06 14:18:46,"RT @RepReneeEllmers: Happy 102nd Birthday, President Reagan. http://t.co/nx57vmhx",32,0
298563954572140544,2013-02-04 22:49:28,Getting ready to hold a Teletown Hall to hear what's most important to the folks of the Third District.,0,0
297358425820626944,2013-02-01 14:59:08,"RT @HASCRepublicans: McKeon Opposes Hagel As Secretary of Defense http://t.co/FpmcMxFx ""Unfortunately, ...he created more concerns than  ...",4,0
294198336452456448,2013-01-23 21:42:04,"Happy to be on the Ag Subcmtes Farm Commodities &amp; Risk Mgmt, Conservation, Energy, &amp; Forestry, and Livestock, Rural Development, &amp; Credit",1,2
294163961014784000,2013-01-23 19:25:28,"ICYMI: Reaction to passage of No Budget, No Pay today... http://t.co/afx3oeHt #NoBudgetNoPay",2,0
294083290795761665,2013-01-23 14:04:54,Tune in to my interview now with The Matt Murphy Show online at ...http://t.co/MnzEHDfG,0,0
293758170973736961,2013-01-22 16:33:00,"On #RoevWade 40th anniversary, I remain committed to passing laws that save the lives of the unborn #prolife #tcot",9,3
291966368318910464,2013-01-17 17:53:01,ICYMI:  Check out my latest column....http://t.co/Rwa8Jpcf #GOP  #tcot,3,0
291610857866149888,2013-01-16 18:20:21,ICYMI: Reaction to Obama Gun Control Proposals...http://t.co/WWX6RIHc #tcot,5,1
291594870819287043,2013-01-16 17:16:49,Today I join America in celebrating Religious Freedom Day. The freedom to practice and share religion is fundamental to our country.#tcot,5,2
291197636541812736,2013-01-15 14:58:21,Watch live as the US Constitution is read on the House Floor for the 2nd time in history...http://t.co/bwSyOWou,3,0
290871368214519809,2013-01-14 17:21:52,Proud to be an original cosponsor of the Stolen Valor Act reintroduced by @RepJoeHeck. It protects the sanctity of military awards &amp; service,3,1
289411600727818240,2013-01-10 16:41:17,Speaking at 908th Airlift Wing January Deployment at Maxwell.  #GOP #tcot,0,1
287265577993637888,2013-01-04 18:33:45,Looking forward to serving on the Ag Cmte again...http://t.co/ObIS0lwN #Ag #TCOT #GOP,5,1
287238449931640833,2013-01-04 16:45:57,"Don't forget to check out my ""DC Photo of the Week"" in the slideshow...http://t.co/tcPcVzrb #GOP #tcot",0,0
286478786738921473,2013-01-02 14:27:19,ICYMI:  My statement on last night's vote....http://t.co/y74jGg1i #GOP #tcot,4,0
281463826854072321,2012-12-19 18:19:40,Today I joined my colleagues in urging Secretary Clinton to demand the release of Jon Hammar. #TCOT #BringHammarHome,2,0
281149381200191489,2012-12-18 21:30:10,"The Montgomery District Office is relocating &amp; the current location will close Dec 21. For assistance in that area, call 334.277.4210",0,0
280810567428632577,2012-12-17 23:03:51,Looking forward to serving as Chairman of HASC Strategic Forces Subcmte...http://t.co/Gy4W4bBw #HASC,0,0
276811161821933569,2012-12-06 22:11:38,Check out my latest column....http://t.co/xI3nL3B7  #tcot #GOP,2,0
274523672868429824,2012-11-30 14:41:58,RT @GOPWhip: VIDEO: This is #SmallBiz America http://t.co/ikIf0ePd #FiscalCliff #jobs,2,0
273547501963980801,2012-11-27 22:03:01,@McCaulPressShop - Congrats on being selected as the #Homeland Security Chairman.  I look forward to working with you in 113th Congress.,0,0
273479631410171905,2012-11-27 17:33:19,RT @RepTimScott: The Capitol Christmas Tree has arrived! http://t.co/uHBS2zz4 (PHOTO),3,0
269093018915708928,2012-11-15 15:02:29,"Holding a TSec Subcommittee Hearing titled, “TSA’s Recent Scanner Shuffle:  Real Strategy or Wasteful Smokescreen?” #homeland",1,0
261901704109359104,2012-10-26 18:46:46,Check out my op-ed in the Washington Times...http://t.co/KwBtROkj #homeland,5,1
248886563147218947,2012-09-20 20:49:15,Check out my latest column....http://t.co/SbdtosV9 #GOP,0,0
248784847278067712,2012-09-20 14:05:04,"In Homeland Full Cmte titled: ""The Department of Homeland Security: An Assessment of the Department and a Roadmap for its Future""",0,0
248146631671808000,2012-09-18 19:49:01,Getting ready to tour the Propane Fueling Station with Sheriff Jay Jones in Lee County.,1,0
248048153637568513,2012-09-18 13:17:42,Happy 65th birthday to the United States Air Force! #GOP,2,1
247696628650242048,2012-09-17 14:00:52,Celebrating 225 years of the US Constitution....http://t.co/K6oHXviE,3,0
246607600546873344,2012-09-14 13:53:28,"RT @HouseCommerce: Today, as the House votes on the #NoMoreSolyndras Act, here are 10 lessons of the #Solyndra failure. http://t.co/jdz1IHUE",4,0
246248850493423616,2012-09-13 14:07:55,Meeting with the League of Southeastern Credit Unions on issues important to them. #GOP #tcot,0,0
245964781482303488,2012-09-12 19:19:08,Check out my statement on the attacks in Libya....http://t.co/P67dfJtN #GOP,2,1
245909621695467520,2012-09-12 15:39:57,Partnering with United Through Reading to make military parents feel a little closer to home. Learn more about it here: http://t.co/YzDHX9fM,0,0
245893422353895424,2012-09-12 14:35:35,In #HASC Full Committee on Operation Contracting Support.,0,0
245583186355179520,2012-09-11 18:02:49,"Holding TSec subcmte hearing titled: ""Eleven Years After 9/11: Can TSA Evolve To Meet the Next Terrorist Threat?"" http://t.co/RjXS2zlL",0,0
245574665144238081,2012-09-11 17:28:57,Meeting with members of the American College of Cardiology on issues important to them.,0,0
245486242416955392,2012-09-11 11:37:35,We will never forget.....,3,0
245247602759720960,2012-09-10 19:49:19,"The report for tomorrow's subcmte hearing...Rebuilding TSA into a Smarter, Leaner Organization.  http://t.co/h2TTcwGO #homeland",0,0
245232754181144576,2012-09-10 18:50:19,Eleven years after 9/11....http://t.co/3v71wMU6,2,0
237939060977582080,2012-08-21 15:47:47,"RT @GOPWhip: RT if you support keeping taxes low for #SmallBiz, the creators of 65% of net new jobs over past 17 yrs  |  http://t.co/BVb ...",92,0
236158128289370112,2012-08-16 17:51:00,"Holding a ""Congress on Your Corner"" event at Clay County Chamber of Commerce in Lineville.  Come on by!",1,0
235806857548165120,2012-08-15 18:35:10,"Holding a ""Congress on Your Corner"" event in Heflin at 101 Adams Street.  Come on by!",1,0
235061868769722370,2012-08-13 17:14:51,"Holding a ""Congress on Your Corner"" event in Phenix City at the Russell County Chamber.  Come on by!",0,0
230664917848563712,2012-08-01 14:02:56,Watch my TSec hearing here - http://t.co/nnZdwMVw #homeland,0,0
230419020795478018,2012-07-31 21:45:50,Getting ready to host a live Teletown Hall meeting to hear what's on the minds of folks back in East Alabama.,4,0
230310200396095488,2012-07-31 14:33:25,RT @HASCRepublicans The president and Senate Democrats’ inaction on sequestration is doing damage. http://t.co/oRlhXhvR,1,1
230295414203641857,2012-07-31 13:34:40,RT @HASCRepublicans McKeon WaPo OpEd - The danger of Obama’s inaction on sequestration http://t.co/60CboRlB,0,0
229961056901005312,2012-07-30 15:26:03,"@YHPolitics It's early but there are already leaders in that class. We must work together 2 cut spending,our debt &amp; get our economy moving",0,0
229958827284508673,2012-07-30 15:17:11,@YHPolitics I look forward to doing anything I can to help Mitt Romney and will campaign for him wherever he needs me.  We need him as POTUS,1,0
229957882337165312,2012-07-30 15:13:26,@YHPolitics @MittRomney We had a long visit years ago &amp; he struck me as being truly extraordinary. I believe he'll get the US back on track.,0,0
229956463030845441,2012-07-30 15:07:47,"@YHPolitics At the end of the year, but my main focus right now is our economy and jobs.",0,0
229955675915182080,2012-07-30 15:04:40,"@YHPolitics In Congress, seniority helps get things done for Alabama – just look at Senator Shelby.",0,0
229954960350121984,2012-07-30 15:01:49,@YHPolitics She has always been the boss and now she has another title to help back that up!,0,0
228184207397101570,2012-07-25 17:45:29,Just met with ADECA and Coalition for Regional Transportation on issues important to them. #GOP #tcot,0,0
228138063338033152,2012-07-25 14:42:07,"In HASC and HCVA Joint Hearing titled ""Back from the Battlefield-DoD &amp; VA Collaboration to Assist Servicemembers Returning to Civilian Life""",0,0
226659889680875520,2012-07-21 12:48:23,Tune into @FoxandFriends this morning for my interview on this week's #Homeland TSec hearing.,3,0
226316562569777152,2012-07-20 14:04:07,Check out my latest column....http://bit.ly/LCppL7 #tcot #GOP,0,0
226007095357603840,2012-07-19 17:34:25,Meeting with School Superintendents of Alabama on issues important to them. #GOP #tcot,1,0
225592501732507648,2012-07-18 14:06:58,Watch TSec Hearing live here: http://t.co/bZNzAIIU #homeland,0,0
225575825465016320,2012-07-18 13:00:42,Don't forget to visit my website to check out this week's DC Photo of the Week.....http://mike-rogers.house.gov/,1,0
225342042434322432,2012-07-17 21:31:44,Getting ready to host a live Tele-town Hall meeting to hear the concerns of folks across East Alabama.#GOP #tcot,2,0
223434326489055232,2012-07-12 15:11:09,"In #HASC Readiness Subcommittee titled: ""Department of the Air Force Aircraft Force Structure Reductions""",0,0
223120796489498625,2012-07-11 18:25:17,"TSec Subcommittee Topic: ""Has TSA Met the Deadline to Provide Expedited Screening to Military Service Members?"" #homeland #GOP",1,0
222730740637507584,2012-07-10 16:35:21,RT @HouseHomeland: Watch LIVE @ 12:30pm - Subcmte Chrmn @RepMikeRogersAL hearing on new ideas for #transportationsecurity &amp; reformin ...,2,0
222730621980643329,2012-07-10 16:34:53,"Chairing TSec Subcommittee titled: ""Challenging the Status Quo at TSA: Perspectives on the Future of Transportation Security"" #homeland",1,0
222722380227821569,2012-07-10 16:02:08,Meeting with Associated Builders and Contractors of Alabama on issues important to them. #GOP #tcot,0,0
222700022599385088,2012-07-10 14:33:17,RT @SpeakerBoehner: #Smallbiz “plans to expand &amp; hire will be pushed further back” w/POTUS' tax hike http://t.co/F3Cdl3UY #stoptheta ...,14,0
222698755567263744,2012-07-10 14:28:15,"In Homeland subcommittee hearing titled...""Building a Secure Community: How Can DHS Better Leverage State and Local Partnerships?""",0,0
222445480913813506,2012-07-09 21:41:50,Read a preview release of tomorrow's TSec Hearing....http://bit.ly/MVVuxK #homeland #GOP,0,0
218370437854412800,2012-06-28 15:49:04,Check out my statement on the Supreme Court's decision on the healthcare law today....http://bit.ly/ODjIP4 #GOP #tcot,1,0
217717390937563137,2012-06-26 20:34:05,Meeting with Calhoun County Sheriff Amerson on programs to keep our communities safer. #GOP #tcot,0,0
215832977769369600,2012-06-21 15:46:06,Check out my latest column....http://bit.ly/PATo52 #GOP #tcot,0,0
215486625008984064,2012-06-20 16:49:49,Don't forget to check out my website slideshow to see my new DC Photo of the Week...http://mike-rogers.house.gov/,0,0
215464721086812161,2012-06-20 15:22:47,"In HASC Full Committee Hearing titled: ""Addressing the Iranian Nuclear Challenge: Understand the Military Options"" #GOP #HASC",0,0
215184595115704321,2012-06-19 20:49:40,Questioning DHS on new border threats....check out my video here....http://bit.ly/N5LNbD,0,0
215147539337453568,2012-06-19 18:22:25,RT @HouseHomeland: Watch LIVE: Subcmte Chrmn @RepMikeRogersAL holds #transportation #security hearing on #TSA ID/boarding pass #technolo ...,2,0
215085961737027584,2012-06-19 14:17:44,"In Border and Maritime Security Hearing titled:""Border Security Threats to the Homeland:DHS' Response to Innovative Tactics and Techniques""",0,0
214835546818756608,2012-06-18 21:42:40,Getting ready to host a live Tele-town Hall meeting to hear back from the folks across East Alabama.,1,0
213285527087099905,2012-06-14 15:03:26,Happy Flag Day....what a great symbol of our freedoms in this great country!,2,0
212952142808485888,2012-06-13 16:58:41,Touring Warrior Transition Battalion at Fort Benning. #GOP #tcot,0,0
212563788287836160,2012-06-12 15:15:31,"Holding a ""Congress on Your Corner"" event at Pike Road Town Hall...come on by if in the area.",2,0
212525208727330816,2012-06-12 12:42:12,Speaking at Eggs and Issues this morning in Montgomery. #GOP #tcot,0,0
210732353713209344,2012-06-07 13:58:03,RT @HouseHomeland: Watch LIVE @ 10 am- Subcmte Chrmn @RepMikeRogersAL to hold hearing on improving #TSA - Administrator Pistole to testi ...,1,0
210460842586669057,2012-06-06 19:59:09,"On the 68th anniversary of D-Day, I salute all of our WWII Vets and thank them and their families for their selfless service and sacrifice.",3,0
210420691344965632,2012-06-06 17:19:36,Meeting with folks from Manufacture Alabama on issues important them. #tcot #GOP,0,0
210399143980564480,2012-06-06 15:53:59,"Meeting with Alabama Propane Gas Association on issues important to them.
#GOP #tcot",0,0
209985579675430913,2012-06-05 12:30:38,Remembering President Ronald Reagan today on the 8th anniversary of his death.,3,0
208585449747394561,2012-06-01 15:47:01,Be sure to visit my website to see this week's DC Photo of the Week!  http://t.co/V1uBUBli,0,0
208574861604425728,2012-06-01 15:04:56,Check out my latest column...http://bit.ly/K2pgdU #tcot #GOP,0,0
208266448332783617,2012-05-31 18:39:25,"Holding TSecSubcmte Hearing titled ""TSA's Surface Inspection Program: Strengthening Security or Squandering Scant Resources?"" #homeland",2,0
207951803017474048,2012-05-30 21:49:08,Getting ready to host a live tele-town hall meeting to hear what's on the minds of folks back in East Alabama.,1,0
205367805602832386,2012-05-23 18:41:15,"Holding a ""Congress on Your Corner"" event today at the City Hall in Alexander City....come on by if in the area!",0,0
205344413315108866,2012-05-23 17:08:17,Holding a Third District Agriculture Advisory Committee to get updated from some of our farmers. #tcot #GOP,0,0
205331366907363328,2012-05-23 16:16:27,Visiting the Bill Nichols State Veterans Home in Alexander City. #tcot #GOP,0,1
203130274056388608,2012-05-17 14:30:05,Meeting with folks from the Petroleum &amp; Convenience Marketers of Alabama on issues important to them. #GOP #tcot,0,0
202806768932372481,2012-05-16 17:04:36,Meeting with Secretary of the USAF and other attendees on structural changes at Maxwell AFB. #GOP #tcot,0,0
202803255691063296,2012-05-16 16:50:38,Check out video from my interview with CNN this morning....http://bit.ly/IYcVYn #tcot #GOP #homeland,0,0
202763666951651328,2012-05-16 14:13:20,RT @HouseHomeland: Watch LIVE now-- Subcommittee Chairman @RepMikeRogersAL to convene hearing on airport security breaches http://t.co/z ...,2,0
202734799293644801,2012-05-16 12:18:37,Check out my website to see the latest DC Photo of the Week!  http://t.co/tcPht9Al,0,0
200589285617967104,2012-05-10 14:13:07,"Meeting with the #Auburn Chapter of the American Society of Landscape Architects on issues that affect their industry.
 #tcot #GOP",0,0
200218948443189248,2012-05-09 13:41:31,"RT @HouseHomeland: Watch LIVE at 9:30am- Full Cmte chaired by @RepPeteKing will consider four bills- HR 2356, HR 3857, HR 4005, &amp; HR ...",3,0
199961413505126400,2012-05-08 20:38:10,Meeting with attendees of the National Independent Pharmacists on issues affecting them. #GOP #tcot,0,0
199944459717312513,2012-05-08 19:30:48,Check out the slideshow on my website to see the Third District Congressional Art Contest winner - http://t.co/tcPht9Al #GOP #tcot,0,0
199900850578137088,2012-05-08 16:37:31,"Holding  TSec Subcmte hearing on ""Building Secure Patnerships in Travel, Commerce and Trade with the Asia-Pacific Region"" #homeland",0,0
