id,created_at,text,retweets,favorites
289140026007248897,2013-01-09 22:42:08,So glad she didn't listen to her high school counselor who told her she wasn't college material and should lower her sights,8,3
289139465631440896,2013-01-09 22:39:55,Labor Secretary Hilda Solis has been a champion for working families across the nation and in Maryland. Sorry to hear she's resigning.,17,4
289107479860744193,2013-01-09 20:32:49,RT @GovernorOMalley: Picture with the new chair of the Senate Appropriations Committee -- @SenatorBarb http://t.co/LfQAVmhD,5,0
289079683440582656,2013-01-09 18:42:22,Team MD is on your side in every county &amp; every community working to protect day to day needs of all Marylanders. http://t.co/5LoTvepk,1,1
289067003682095107,2013-01-09 17:51:59,"Told MD House of Delegates we must provide jobs, growth &amp; opportunity. Next 90 days MD's rendezvous w destiny. http://t.co/iJdCc899",3,3
288988549318070272,2013-01-09 12:40:13,Today looking forward to speaking at opening of this session of Md General Assembly on behalf of Md's Congressional Delegation #MDSession,4,1
288102672018579457,2013-01-07 02:00:04,GR8 Game.   Loved The Fun Run by Ray -     now the Ravens. Fly. High. In the Mile. High City Denver.,15,3
287277375102791681,2013-01-04 19:20:38,Glad to be joined by historic number of Senate women in 113th Congress for discussion w/ @DianeSawyer. WATCH: http://t.co/Cj3U93ej,14,3
286984613946093568,2013-01-03 23:57:18,Wonderful being with Senate women of the 113th Congress with @DianeSawyer. Thanks #ABCWorldNews,12,5
286984141000552449,2013-01-03 23:55:25,.@SenatorCardin @rickklein Thanks!,2,0
286979642089410562,2013-01-03 23:37:33,ABC News did a nice page on the advice women Senators would give to boys and girls: http://t.co/VOjXVa84,6,4
286977712579571712,2013-01-03 23:29:53,Today led Team MD in announcing FEMA approval of public assistance for Baltimore Co recovering from Super-Storm Sandy http://t.co/KHO1umBX,4,1
286977267777818624,2013-01-03 23:28:07,.@SenShelbyPress Looking forward to working with you on @SenateApprops too!,2,0
286953013946511360,2013-01-03 21:51:44,"Need more frugal gov, but not one that hangs us out to dry. These civil servants deserve gov on their side &amp; I’ll continue to fight for them",10,1
286952798665461762,2013-01-03 21:50:53,"This is good news for jobs in PG Co, for MD and for the duty driven civil servants at the Hyattsville FMS facility. http://t.co/KHO1umBX",2,1
286952625855922176,2013-01-03 21:50:11,"Thanks to efforts of Team MD, proud to announce Treasury &amp; GSA have delayed their plan to move 450 jobs out of PG County until 2019.",8,0
286937473429422080,2013-01-03 20:49:59,RT @SenatorHarkin: Thx @SenatorBarb for joining me in supporting #filibusterreform &amp; sending an important msg this 1st day of the 11 ...,28,0
286881056236388353,2013-01-03 17:05:48,Glad to escort my friend &amp; colleague @SenatorCardin to be sworn in by @VP to continue representing MD in US Senate.,14,4
286852839584698368,2013-01-03 15:13:41,"RT @DianeSawyer: I sat down with the historic class of 20 female senators -the tough, lively, surprising intvw tonight on @ABCWorldNews  ...",208,0
286610348742701056,2013-01-02 23:10:07,ABC News / Martin Simon shared a great photo of our interview with @DianeSawyer -- http://t.co/LaigqemA,6,4
286609956004827136,2013-01-02 23:08:33,Clips of the @DianeSawyer and women of the Senate interview begin airing Thursday morning during Good Morning America,5,1
286609465883627521,2013-01-02 23:06:36,Tomorrow night - be sure to tune in to ABC World News Tonight to see @DianeSawyer interview with the Senate Women of the 113th Congress,11,2
286519770029907968,2013-01-02 17:10:11,RT @SenateApprops: Chairwoman Mikulski (@SenatorBarb) Statement on House Inaction on Disaster Assistance Supplemental  http://t.co/Y01pO ...,6,0
286519259826360320,2013-01-02 17:08:09,I am committed to helping communities hit hard by #Sandy &amp; will make enacting a supplemental bill an urgent priority in new Congress.,10,6
286519186769973248,2013-01-02 17:07:52,"It is long past time communities in MD, NY, NJ &amp; across nation get resources &amp; support they need from their federal government.",3,2
286519017093623808,2013-01-02 17:07:11,"As Chairwoman of @SenateApprops, I’m deeply disappointed House failed 2 act on emergency relief from Super-Storm #Sandy http://t.co/D2xQTYA6",30,7
286123155448287232,2013-01-01 14:54:10,Wishing all a safe and happy new year - especially our troops serving overseas and their families here at home,24,8
285820496132587520,2012-12-31 18:51:31,Will discuss fiscal cliff on Senate floor @ 2 p.m. -- Watch live on CSPAN 2,8,1
284811842067496960,2012-12-29 00:03:29,But clock is ticking-been two months since Sandy hit. Businesses need restarting. Homes need rebuilding. Now up to House to pass bill ASAP,11,0
284811335961821184,2012-12-29 00:01:28,"Shows that in America, we are all in this together – that when one community is hit by a disaster, all communities are hit.",4,2
284811304357744640,2012-12-29 00:01:21,Critical legislation provides well-tailored resources to those hit hardest by Sandy.,2,1
284810530688999424,2012-12-28 23:58:16,"Senate just passed the Superstorm Sandy Emergency Supplemental Appropriations Bill in strong, bipartisan vote",15,1
284724180283449344,2012-12-28 18:15:09,American families already are stretched and strained. Why should they pay $7 for milk because House won’t act,10,2
284723998208708612,2012-12-28 18:14:25,"House Republicans need to come home in from pasture, get back to Washington, pass the Farm Bill and avoid the dairy cliff",12,2
284698605074403328,2012-12-28 16:33:31,Dock workers and Port able to come together to avoid a strike – need Congress to do same thing and avoid fiscal cliff,10,0
284698545771143169,2012-12-28 16:33:17,"Good news for families, jobs and economy– Port strike averted with 30 day extension",7,1
284403585196896256,2012-12-27 21:01:13,Read about it today's Baltimore Sun -- http://t.co/5kD8Xthc,1,0
284403482264494080,2012-12-27 21:00:48,Already 691 Somerset Co. residents who lost homes/ businesses in #Sandy have applied for help since FEMA okay'd aid 4 individuals last week,4,0
284401800734445569,2012-12-27 20:54:07,News u can use” links for Somerset Co. residents &amp; biz's still getting back on feet after #sandy: http://t.co/RcINBAFb http://t.co/0tKmLwGt,4,0
283737955829428224,2012-12-26 00:56:14,A. Merry n blessed day. To one n all. Mine.was Church - Family n Traditions. Let's each give an act of kindness - big or small. to someone,10,6
281527037544505344,2012-12-19 22:30:50,It's an honor &amp; privilege to be expected to follow the great leadership of Senator Inouye as Appropriations Committee Chairwoman,128,25
281424941532979201,2012-12-19 15:45:09,Will discuss MD #Sandy recovery funds on Senate floor @ 10:45 &amp; continue fight 2 get MD communities back on track WATCH http://t.co/IzY3K9hB,4,0
280809477740060673,2012-12-17 22:59:31,Must also look at issues related to mental health. There’s a pattern of too many that fall between the cracks. These tragedies must end.,16,6
280809363269111808,2012-12-17 22:59:04,"Weapons of war have no place on our streets, in our schools or in our homes. I’ll work with my colleagues to reinstate assault weapons ban.",79,24
280809287515783169,2012-12-17 22:58:45,"Today funerals in Newtown begin. Our mourning will go on for a long time, but our work must continue.",7,1
280680693091160064,2012-12-17 14:27:46,NCCC transforming communities &amp; building new generation of duty driven volunteers. Neighbor helping neighbor,1,0
280680543610343424,2012-12-17 14:27:11,This morning at ribbon cutting for new AmeriCorps NCCC campus in Baltimore at Sacred Heart school.,1,0
280492419785560064,2012-12-17 01:59:38,Absolutely Will.  Support Feinstein Leg on Banning Assault Weapons-  but also so need more mental health help in our communities,135,22
279700875100946432,2012-12-14 21:34:19,This is a wakeup call. Weapons of war have no place on the streets of America.  It's time for Congress to act.,115,15
279700676819419136,2012-12-14 21:33:32,Our thoughts and prayers go out to the Newton community as we struggle to cope with such senseless violence.,14,4
279700526579458048,2012-12-14 21:32:56,Today our nation mourns for those lost and the families that have been shattered by this devastating tragedy.,18,0
279348310446317569,2012-12-13 22:13:21,"America needs a wakeup call, must get serious about priorities. Not about tax breaks 4 billionaires, it's about jobs! http://t.co/mU6g89db",8,1
279347972888748033,2012-12-13 22:12:01,Affected Sparrows Point employees should visit http://t.co/vA8weKCk and http://t.co/o1VkkquD for federal benefits info.,3,0
279347857121751040,2012-12-13 22:11:33,Thanks to men &amp; women at Bethlehem Steel. You built America. You helped save America. I’m going to work to save your safety net benefits.,2,0
279347517181800448,2012-12-13 22:10:12,"Throughout 20th century, Baltimore’s Bethlehem Steel put people to work building steel for our great iconic projects. They built America.",5,1
279258943019167745,2012-12-13 16:18:15,Continuing to fight for those affected. Led Team Maryland in supporting Gov’s appeal for individual disaster assistance http://t.co/LRgsI1F0,1,0
279258839809945600,2012-12-13 16:17:50,Communities in Lower Shore &amp; Western MD recovering from Super Storm #Sandy are in dire situation in need of swift resolution.,1,0
278244898996625408,2012-12-10 21:08:48,Last year LIHEAP helped 149K MD households stressed &amp; stretched by high energy costs to keep warm during cold winter months.,6,0
278244836484718595,2012-12-10 21:08:33,I urged President Obama to restore LIHEAP low energy assistance funding to support thousands of MD families. http://t.co/D3fWqM0e,15,0
278244735586537473,2012-12-10 21:08:09,"In America, no family should be forced to choose between paying their heating bill &amp; putting food on the table.",26,7
276440040584925185,2012-12-05 21:36:56,Seniors &amp; families who’ve earned these benefits shouldn’t be forced over the fiscal cliff themselves!,5,2
276440022633287680,2012-12-05 21:36:52,Today met w/ leaders of @AARPmaryland to say I’m fighting to protect Social Security &amp; Medicare from fiscal cliff. http://t.co/e9HZ0MZR,5,1
276340589551816705,2012-12-05 15:01:45,Watch my remarks at #Sandy hearing at 10am LIVE at http://t.co/MfnnuzhR,2,0
276340392151097344,2012-12-05 15:00:58,I'll be questioning FEMA &amp; HUD directors on everything they're doing to support communities hit hardest by #Sandy.,0,0
276340093390823424,2012-12-05 14:59:47,At Senate hearing on #Sandy will call for immediate action on assistance for MDers still recovering.,4,0
276330525252259841,2012-12-05 14:21:45,Am. Heading to Fema hearing to fight for help for the lower shore.        Devastated by Sandy.   Denied help by their govt.   Not right.,7,0
276067069718573056,2012-12-04 20:54:53,For 3 yrs Alan Gross has been imprisoned in Cuba on bogus charges &amp; sham trial. Time 2 come home to Md &amp; his family http://t.co/RDd2e5oZ,4,1
276066351666323456,2012-12-04 20:52:01,"Mr. Castro, let Alan Gross go! Let him go today. Let him go now! http://t.co/TtIALrk5",0,0
276035373002547200,2012-12-04 18:48:56,I’ve introduced amndt to #NDAA w @SenatorCardin &amp; @SenatorKirk to prevent Navy plan w/out Congressional approval. http://t.co/7DJpDjdp,5,2
276035125802852352,2012-12-04 18:47:57,Navy plan to move aircraft squadron VAQ-209 from Maryland would mean lost jobs and lost defense in our Nation’s Capital Region.,2,0
275742452370001920,2012-12-03 23:24:58,MD deserves to have highly qualified judges who will uphold the law &amp; provide equal justice for all. We have that in Judge Grimm.,3,0
275742392907362304,2012-12-03 23:24:44,Pleased Senate voted overwhelmingly 92-1 to confirm Judge Paul Grimm to US District Court in MD. http://t.co/AE66fzZ8,7,0
275725091537555457,2012-12-03 22:15:59,Headed to Senate floor at 5:15 to speak on nomination of Judge Paul Grimm to US District Court in MD. WATCH live: http://t.co/IzY3K9hB,1,0
275723379456241664,2012-12-03 22:09:11,It’s time for him to be immediately and unconditionally released so he can come home to Maryland  his family.,2,0
275723344375078912,2012-12-03 22:09:02,It’s been 3 yrs since Alan Gross has been wrongfully imprisoned in Cuba after bogus charges &amp; sham trial.,3,1
275685438818238464,2012-12-03 19:38:26,Visiting w Tom Marquardt @CapGazNews 2 thank him for 35 yrs as journalist &amp; thought leader for MD &amp; Annapolis community http://t.co/v1rwWZku,4,0
275316628852453377,2012-12-02 19:12:54,Watch them. Ravens. Fly. High today--   all the way to the.  Playoffs.   Go Go Ravens!!!!,6,3
274644368093224960,2012-11-30 22:41:34,Leading Team MD in supporting updated request 4 individual disaster assistance 4 Lower Shore hurt by Super Storm Sandy. http://t.co/VpxozMGl,2,0
274559313534656512,2012-11-30 17:03:36,"Time to put aside differences, come to the table to negotiate in good faith &amp; get the job done.",8,2
274559239471652865,2012-11-30 17:03:18,We've made serious &amp; significant cuts already including $917B over 10 yrs in Budget Control Act.,1,0
274552694432210944,2012-11-30 16:37:17,"Need a more frugal gov that will reduce deficit &amp; debt, but only things that caused debt &amp; deficit shld be on the table.",5,1
274552506732929024,2012-11-30 16:36:33,We've reformed Medicare thru Obamacare - took $500B in guaranteed profits from ins companies extending life of Medicare by 8 yrs.,12,2
274552202763317248,2012-11-30 16:35:20,"Medicare &amp; Medicaid pay for life-saving health care for elderly, children &amp; families.",2,0
274536022249975808,2012-11-30 15:31:02,"If you play by the rules &amp; pay your dues, you deserve Social Security benefit that is reliable, undeniable &amp; inflation proof.",7,2
274535267120066560,2012-11-30 15:28:02,Social Security didn't get us in this mess &amp; shldn't be on the table. We must protect Social Contract between American people &amp; their gov.,15,1
274534451344715777,2012-11-30 15:24:48,"Families who have earned benefits of Medicare, Medicaid &amp; Social Security shldn't be targeted &amp; forced over their own fiscal cliff.",10,0
274533789303185408,2012-11-30 15:22:10,"Pieces are in place to prevent fiscal cliff crisis. We've had ideas from all sides, now is time to come together &amp; prevent disaster.",3,1
274189636434272257,2012-11-29 16:34:38,Disaster Declaration is good news to help MD recover. Continuing push for Individual Assistance for those impacted most http://t.co/oSV6zDqQ,1,0
274189509820821504,2012-11-29 16:34:07,Sandy’s wrath had a measurable impact on MDers that’s still being felt. I want those affected to know they have a government on their side.,1,1
274189333957844992,2012-11-29 16:33:26,Here’s my testimony for today’s Senate hearing examining impact of Super-Storm Sandy. http://t.co/hmoIvYpR,2,1
274161257085554688,2012-11-29 14:41:52,"While he &amp; MD business leaders have strengthened MD STEM edu, I’ve been working on fed STEM investment 2 prepare students 4 innovation jobs.",2,1
274161194825314306,2012-11-29 14:41:37,On my way to speak @ MD Business Roundtable to honor Jim Pitts for his STEM education leadership in Maryland.,2,1
273927991120248832,2012-11-28 23:14:57,"To my colleagues from both sides of the aisle, both sides of the Dome and even the White House, let’s get the job done. http://t.co/WwZvo4wv",8,1
273926458714517505,2012-11-28 23:08:51,"Must put ourselves on a sound fiscal path with the right combination of growth, frugality &amp; ensuring a safety net for most vulnerable.",5,3
273926242338758657,2012-11-28 23:08:00,We need sense of urgency about solving the fiscal cliff. We need to end culture of delay in this institution.,13,1
273830029182513152,2012-11-28 16:45:41,Spoke w Portland's @WCSH6 today on @SenatorSnowe's retirement. Will greatly miss my friend &amp; Maine's champion in Senate http://t.co/maUo44Yu,9,2
273443339494383617,2012-11-27 15:09:07,"The battlefield is real &amp; cyber battleships are being built right here in Md, keeping our country safer &amp; Md’s economy stronger.",3,1
273443268577095680,2012-11-27 15:08:50,I’ll continue to lead fight in cyber battle so Md is epicenter of cybersecurity in US. We are Ft. Cyber! http://t.co/WcP3Spb4,5,0
271656970656817153,2012-11-22 16:50:43,Happy thanksgiving. -  to one n all.    Peace in our hearts -home n the world !!!,14,5
271291014868779008,2012-11-21 16:36:32,"Public assistance &amp; hazard mitigation is good news, but I will continue to support Gov’s request for individual assistance for Lower Shore.",2,0
271290965032071169,2012-11-21 16:36:21,"As we prepare to celebrate Thanksgiving, want families &amp; communities struggling to recover to know they have gov on their side.",1,0
271290891459772416,2012-11-21 16:36:03,Today announced that fed disaster declaration has been signed for MD following Super-Storm Sandy. http://t.co/2NEkOUcb,2,0
269144219921309696,2012-11-15 18:25:57,So proud of all the women who’ve made history. And now it’s time to change history.,16,4
269144148370669569,2012-11-15 18:25:40,"But when we gather all of the women together in January for the 113th Congress, we’ll have 20 women serving at one time.",6,2
269144098131279872,2012-11-15 18:25:28,I was the first Democratic woman elected to the Senate in her own right. The 16th women to serve in the Senate in all of American history,17,6
269143983454826496,2012-11-15 18:25:01,"Today, Senate women joined me in welcoming newly elected women with my traditional bipartisan Power Workshop. http://t.co/ktIi51R8",36,10
269099337852784640,2012-11-15 15:27:36,Must get to bottom of what went wrong &amp; make sure we have rules &amp; regs in place so it never happens again.,2,0
269099297579085824,2012-11-15 15:27:26,At Senate hearing on deadly meningitis outbreak. Will hear from FDA commissioner &amp; MDer Dr. Kasey Thompson of pharmacists assoc.,5,0
268777981814640640,2012-11-14 18:10:39,"Disaster declaration will mean federal help for MD families, businesses &amp; communities struggling to recover from devastating storm.",4,0
268777883760222209,2012-11-14 18:10:15,Leading Team Maryland’s support of Gov. O’Malley’s request for disaster declaration for MD following Super-Storm Sandy. http://t.co/0F25ecNn,5,1
268401499586052096,2012-11-13 17:14:38,Three cheers for #UMUC cyber team taking 2nd place @ int’l cyberlympics! MD leading the way preparing cyber warriors today 4 jobs tomorrow.,12,2
267699644434362368,2012-11-11 18:45:43,Happy. Birthday to the. Marine Corp- Always there when the. Country Needs Them. -  Always Semper Fi !!,7,0
267699114676998146,2012-11-11 18:43:37,Let's.  Salute the. Vets of. All Wars. N their families. by. Making Sure we. Help them w. Jobs/ Health Care. N Education - They Deserve IT,16,2
267358293582823430,2012-11-10 20:09:19,RT @FtMeadeMD: .@SenatorBarb Mikulski presents @USArmy veterans overdue Bronze Star medals http://t.co/VYTJmYaq,4,0
266184395411566592,2012-11-07 14:24:39,RT @SenatorCardin: Breakfast at Jimmy's w/ @SenatorBarb ... Getting back to work early on behalf of Marylanders! #mdpolitics #forward ht ...,9,0
265869980799741953,2012-11-06 17:35:18,Met w students at Northwestern High in Baltimore &amp; discussed importance of civic engagement &amp; voting w student reporter http://t.co/s5DbdgtM,3,0
265550623125151745,2012-11-05 20:26:17,"Thanks for a great visit, Daniel! http://t.co/W94K5uI1",1,1
265550454652559361,2012-11-05 20:25:36,Brought along a get well soon letter from Mrs. Obama &amp; Bo for Daniel and then made him an honorary Senator!,0,0
265549232159739904,2012-11-05 20:20:45,So glad to meet w Daniel Borowy &amp; family today and see he's getting better after Perry Hall tragedy. He's a remarkable young man,1,0
264149269374726144,2012-11-01 23:37:48,RT @RedCrossMD: Thank you @SenatorBarb for your visit to @RedCrossMD.  http://t.co/f1bpLldx,4,0
264012092946907139,2012-11-01 14:32:42,Visiting @RedCrossMD Superstorm #Sandy hdqrts in Baltimore today to thank everyone working to support disaster response &amp; relief.,4,0
263730301828755456,2012-10-31 19:52:58,Whew what a day. Working the phones around the State Chkng on the needs of our communities - squeezed in. Early Voting too,2,0
263292846625398784,2012-10-30 14:54:41,RT @NOAA: Get up to date local weather information from #NOAA #NWS at  http://t.co/ofG0aGqk click your location on map or enter your ZIP ...,66,0
263292746498990080,2012-10-30 14:54:17,"RT @fema: What to do before, during, and after a #hurricane. On the web: http://t.co/sPshqlkH On your phone: http://t.co/xz5hNhXR #Sandy",910,0
263292364838301696,2012-10-30 14:52:46,"RT @MDMEMA: Have you checked on family, friends, and neighbors today? Make sure they are doing ok #MDSandy",14,0
263292285276536832,2012-10-30 14:52:27,RT @StateMaryland: Keep away from loose or dangling power lines and report them immediately to the power company. #MDSandy,21,0
263292020523687936,2012-10-30 14:51:24,RT @MDMEMA: Can't stress this enough! RT @governoromalley: Reminder again: If you get to an intersection w/out power treat it as a 4-way ...,57,0
262973468239335424,2012-10-29 17:45:35,"Good #MDSandy advice from @fema on staying safe during storm, conserving power and communicating with loved ones after outages",3,1
262971772679372800,2012-10-29 17:38:51,RT @fema: Phone lines may be congested during/after #Sandy. Let loved ones know you're OK by sending a text or updating your social netw ...,1034,0
262968921546711040,2012-10-29 17:27:31,RT @fema: #Sandy accounts to follow in Maryland @MDMEMA @MDNG @governoromalley @themdta @MDDisabilities @MarylandDHMH @BACOemergency #MD ...,152,0
262968179473657858,2012-10-29 17:24:34,"RT @fema: #Sandy power outage tip: conserve cell phone battery by reducing screen brightness, turning off periodically &amp; limiting vo ...",499,0
262967765944635393,2012-10-29 17:22:55,"RT @fema: #Sandy East coast, search for open shelters by texting: SHELTER + a zip code to 43362 (4FEMA). Ex: Shelter 01234 (std rates apply)",3674,0
262967618376450048,2012-10-29 17:22:20,"RT @fema: 10/29: As #Sandy makes landfall: stay off the roads, charge your cell phone, listen to local officials &amp; follow your forecast.",573,0
262948411853127680,2012-10-29 16:06:01,RT @MDMEMA: Do you know how to shelter in place? http://t.co/CYmoY1t0 #MDSandy,20,0
262948058113925121,2012-10-29 16:04:37,RT @usNWSgov: Don’t forget to check out Storm Central 2012 for the latest on #Sandy. http://t.co/gKyhqWXM #NWS #NOAA,38,0
262651564282499072,2012-10-28 20:26:27,"Women of PG County are educated, empowered, engaged &amp; are working 3 shifts - at job, at home &amp; in the community.You are my champions",14,4
262651279870943232,2012-10-28 20:25:20,"Prince George's Co Commission women today honored me as their champion, but I want to honor women of PG county. http://t.co/o5fLcqmL",5,0
262632723431190529,2012-10-28 19:11:36,Today visited @NOAA to get #Sandy update &amp; thank men &amp; women working around the clock to track this storm. http://t.co/oc2oG0uz,15,8
262623938767618049,2012-10-28 18:36:40,RT @usNWSgov: @SenatorBarb &amp; Dr. Lubchenco tour #NOAA Center for Weather and Climate Prediction as forecasters track Hurricane #Sand ...,5,0
262623852562087936,2012-10-28 18:36:20,"RT @LovelyLadiesL3: @SenatorBarb we will not give up. What  a honor to be in the same room with you. Thank you for educating, empowering ...",1,0
262589455452471296,2012-10-28 16:19:39,At NOAA Weather Prediction Center in College Park getting update on Hurricane Sandy. http://t.co/z4dU362V,12,1
261925432042082305,2012-10-26 20:21:03,I urge all Marylanders to listen to their officials &amp; 1st responders and be prepared for this storm.,16,2
261924318789906433,2012-10-26 20:16:38,I’m working w our Congressional Delegation &amp; Gov. O’Malley to ensure MD has federal support &amp; resources needed to respond.,3,0
261923538716459008,2012-10-26 20:13:32,#Sandy has potential to be big &amp; dangerous storm. I’m monitoring its path &amp; possible impact on MD and coastal states.,4,1
260844964051816448,2012-10-23 20:47:40,"Chained CPI would lower Social Security cost of living adjustments, costing seniors on fixed incomes thousands.",0,0
260844820065579008,2012-10-23 20:47:06,"Social Security a social contract w our seniors. We must keep it undeniable, reliable &amp; inflation proof.",1,0
260844727233019904,2012-10-23 20:46:43,Today I told Senate leaders Social Security didn’t create deficit &amp; cutting social security won’t fix it. http://t.co/11DHEhF3,21,1
260467569461444609,2012-10-22 19:48:02,"RT @rd_leyva: ""We need to stop fighting for the next election and start fighting for the next generation""-@senatorbarb #TFABmore20",9,0
260467491648708608,2012-10-22 19:47:43,"RT @montysays: “It takes a village to raise a child, but it takes all of us to raise hell! To make things happen."" - @senatorbarb #TFABm ...",10,0
260396335574953984,2012-10-22 15:04:58,We're hear to protect our social contract w seniors - keeping Medicare as Medicare &amp; fighting for social security.,7,2
260395686359625728,2012-10-22 15:02:24,With @SenatorCardin at Montgomery Co Leisure World for seniors town hall. http://t.co/1bWjuZQR,2,1
259486523752325121,2012-10-20 02:49:42,RT @courtneywatson1: Thanks @SenatorBarb for visiting Main Street Ellicott City and visiting shops with me today to support the town! ht ...,2,0
259485836364632064,2012-10-20 02:46:59,RT @SweetElizaJane: Thanks for stopping by @courtneywatson1 @SenatorBarb! It was great to meet you and we appreciate your support for EC ...,3,0
