id,created_at,text,retweets,favorites
464923821892702209,2014-05-10 00:24:11,"Learn everything u can, respect others, have ethics, love the people that got you here, have a deep, abiding faith &amp; dream #SixSilentSecrets",15,6
464923657786380288,2014-05-10 00:23:32,"Secret #6: Dream - There are as many successes in life as there are graduates here today, if you are willing to dream. #SixSilentSecrets",5,2
464922247720079361,2014-05-10 00:17:56,Secret #5: Faith - Faith is a series of disappointments held together by singular moments of joy and success. #SixSilentSecrets,6,2
464922037350584321,2014-05-10 00:17:06,"Secret #4: Love – ‘Always remember to love people, and use things – don’t ever use people, and love things.’ -Will Rogers #SixSilentSecrets",8,3
464921759171756033,2014-05-10 00:15:59,"Secret #3: Ethics - Doing right is sometimes the most difficult thing to do, but it is always the best thing one can do. #SixSilentSecrets",6,4
464921307025784832,2014-05-10 00:14:12,"Secret #2: Respect - We’re all different sizes/shapes/ethnicities/creeds, but every1 has something 2 offer our fellow man. #SixSilentSecrets",5,2
464921077941288960,2014-05-10 00:13:17,Secret #1: Learning - treat your diploma like a passport &amp; have it validated over &amp; over by learning &amp; improving yourself. #SixSilentSecrets,8,2
464920775129309185,2014-05-10 00:12:05,"What is your secret to living a happy, successful &amp; fulfilling life? Reply using hashtag #SixSilentSecrets to share!",1,1
464920589569130498,2014-05-10 00:11:21,"Letting @universityofga c/o 2014 grads in on the #SixSilentSecrets to a happy, successful &amp; fulfilling life. TUNE IN: http://t.co/Yxr4amx8Vy",1,0
464920532883099648,2014-05-10 00:11:07,"""This is not about me, this is about YOU. I want to share the #SixSilentSecrets of a happy and fulfilling life."" #UGA @universityofga",2,0
464920342440722432,2014-05-10 00:10:22,"""48 years ago, I graduated from the University of Georgia. All of my children graduated from #UGA. My wife graduated from UGA.""",7,5
464919278937182208,2014-05-10 00:06:08,Want to watch my Commencement Address to @universityofga spring grads LIVE online? Click here: http://t.co/Yxr4amx8Vy #SixSilentSecrets,2,0
464917708715614208,2014-05-09 23:59:54,Student Sarah Marie Hughes about to speak @universityofga graduation. I had the pleasure of meeting her pre-ceremony. http://t.co/HYU2GB0ars,5,10
464916623548497920,2014-05-09 23:55:35,"Special congratulations to #UGA First Honor Graduates, currently being recognized by Pamela Whitten, Sr. VP for Academic Affairs &amp; Provost",2,0
464916370778767361,2014-05-09 23:54:35,Want to watch my commencement address to @universityofga spring grads LIVE online? Click here:http://t.co/Yxr4amx8Vy,1,0
464916044487086080,2014-05-09 23:53:17,Congratulations and good luck! @SenatorIsakson can you wish my best friends @DahaeKim1 and @BrettUGA_YD a happy graduation?! #uga14,5,1
464916002330144768,2014-05-09 23:53:07,"RT @universityofga: President Morehead begins the ceremony. ""We are loyal, were are devoted, we are proud and we make a difference in the w…",5,0
464915245535076352,2014-05-09 23:50:06,"National Anthem sung beautifully by Evelyn Josephine Shreves @universityofga graduation tonight, and meaningful prayer. #UGA #Freedom",4,1
464912485389459456,2014-05-09 23:39:08,@universityofga grads nearly all seated! View my commencement address LIVE online: http://t.co/Yxr4amx8Vy http://t.co/p0bNk52txt,5,1
464909548252585984,2014-05-09 23:27:28,Great to see so many smiling faces and great mortar board designs from #UGA Class of 2014. #UGA14 @universityofga,3,6
464908872432758784,2014-05-09 23:24:47,"Way to go, Leah! @kgoldman622 @LeahGoldman91 Congrats, to our daughter, @LeahGoldman91 UGA Class of 2014 #UGA14",4,1
464906247888965633,2014-05-09 23:14:21,Freedom. #UGA #UGA14 @universityofga @SanfordStadium http://t.co/10FEhBXP3r,4,2
464905788579147776,2014-05-09 23:12:32,"Proud to be a part of Commencement ceremonies at my alma mater @universityofga tonight, and proud of these students! http://t.co/4FGmbT5sGl",2,3
464904327812108289,2014-05-09 23:06:43,Want to watch my commencement address to @universityofga spring grads LIVE online? Click here: http://t.co/Yxr4amx8Vy #UGA14,0,0
464903299448442880,2014-05-09 23:02:38,Proud #UGA14 families and friends waiting on their graduates @universityofga @SanfordStadium http://t.co/iLrvmaRkub,1,0
464902769800126464,2014-05-09 23:00:32,RT @universityofga: Commencement is about to begin. It will be streamed at http://t.co/GlOdUFi9Z3. #UGA14,7,0
464902720198295552,2014-05-09 23:00:20,#UGA's Sanford Stadium ready for the Class of 2014 'Between the Hedges.' Watch my address LIVE:http://t.co/Yxr4amx8Vy http://t.co/i77a3eoQDn,2,0
464901717835132928,2014-05-09 22:56:21,#UGA c/o 2014 lining up for Commencement ceremony! Tune in at 7 p.m. for LIVE ceremony online http://t.co/Yxr4amx8Vy,1,2
464899950279933952,2014-05-09 22:49:20,At #UGA Spring 2014 Commencement with fellow @universityofga alum and #GA Board of Regents Member Larry Walker. http://t.co/nPS3EQqXyU,3,2
464894744859271168,2014-05-09 22:28:39,"In ceremonial robes and ready for @universityofga Commencement to begin with Chief of Staff, @jmkirchner. http://t.co/AsF1Zc9jAL",1,3
464891497738162176,2014-05-09 22:15:44,"Proud to meet #UGA student speaker, Sarah Marie Hughes who earned her degree in Int'l Affairs. http://t.co/WXn5NJI3sH http://t.co/sas4LSKNUA",1,2
464889113377001472,2014-05-09 22:06:16,"Congratulations to her! @scottraines @TerryCollege My niece, McKenzi is graduating from @TerryCollege today. #godawgs http://t.co/BySzaYtWZQ",0,3
464888393001078785,2014-05-09 22:03:24,Recently arrived @universityofga pre-Commencement reception. Happy to be greeted by #UGA president Jere Morehead. http://t.co/hiVD1ChouG,4,8
464828713126096896,2014-05-09 18:06:15,Eager to get to Athens to deliver the @universityofga Commencement Address tonight! #ClassOf2014 #GoDawgs,7,20
464819359073202177,2014-05-09 17:29:05,Good luck to Creekview High School @CherokeeSchools competing in Team America Rocketry Challenge @RocketContest championship in #DC on Sat!,8,5
464794682724450306,2014-05-09 15:51:02,@UGAWomensLax Congratulations on your win today! #GoDawgs,0,0
464778677675622401,2014-05-09 14:47:26,@UGAWomensLAX playing Michigan in 2014 WCLA Nat'l Champ tourney NOW! Good luck to the team and esp. graduating seniors C/o 2014. #GoDawgs,0,0
464752878629175296,2014-05-09 13:04:55,Excited to join @universityofga’s Class of 2014 spring commencement this evening! #GoDawgs,17,25
464520649042841600,2014-05-08 21:42:07,RT @VeraLynnDent: Caught wdent87 on cspan this morning w/ @SenatorIsakson during the Senate confirmation hearing for… http://t.co/PGb8xObAe5,1,0
464436115806904320,2014-05-08 16:06:13,RELEASE: Isakson Demands Answers Over Obama Administration Failure to Give Green Light to Savannah Harbor Deepening http://t.co/PAD59Ul2nr,3,2
464409191848116224,2014-05-08 14:19:14,RT @ajconwashington: .@SenatorIsakson questioning Sylvia Burwell now on SHEP http://t.co/3lBOlfN9A9 #gapol,1,0
464130583267135488,2014-05-07 19:52:08,"Appreciate all you do! MT @GABankers: Isakson, Chambliss meeting w/ GBA today. Voiced support for GA banking industry http://t.co/c3A1rrrPbS",1,2
464120902436003840,2014-05-07 19:13:40,"RT @GABankers: @SenatorIsakson, @SaxbyChambliss meeting with GBA members today. Both voiced support for a strong GA banking industry http:/…",5,0
464120881930063873,2014-05-07 19:13:35,RT @SaxbyChambliss: Great meeting with @GaHospitalAssoc and @SenatorIsakson this morning. Always good to see everyone! http://t.co/kaCyF95A…,5,0
464097520659214336,2014-05-07 17:40:46,Congrats to Sathvik Namburar &amp; Meghana Nallajerla- #GA students named to the 50th Class of U.S. Presidential Scholars. #BestandBrightest,1,5
464067201444900864,2014-05-07 15:40:17,RELEASE: Isakson Demands Answers on #IRS Bonuses http://t.co/FYTMtXwmmu,4,1
463735425996042241,2014-05-06 17:41:56,Congrats to Remington Youngblood of Duluth on receiving the @PruSpirit youth volunteer of 2014 award! #PruSpirit2014 http://t.co/Yxsbq9Udo7,1,6
463735133200076800,2014-05-06 17:40:46,Congratulations to Colin Humble of Marietta on receiving the @PruSpirit youth volunteer of 2014 award! #PruSpirit2014 http://t.co/pMfmIkQunw,0,2
463701159354847232,2014-05-06 15:25:46,"5,374 = # of bright, smiling faces I look forward to seeing Friday at @universityofga’s spring Commencement. #GoDawgs http://t.co/WIe1d1jeuG",1,3
463390613920952320,2014-05-05 18:51:46,"Countdown has begun for #UGA's commencement. 4 days, 4 hrs, 7 mins &amp; counting. Look forward to joining the C/O 2014! http://t.co/KG98s9Ir7l",1,4
463389596861353985,2014-05-05 18:47:43,RT @SenJackReed: May is National #SkinCancer Awareness Month. #Sunscreen saves lives. Lets pass the bipartisan Reed-@SenatorIsakson Sunscre…,15,0
461972922908024832,2014-05-01 20:58:22,"Students! Tomorrow, May 2, is our registration deadline for #Military Academy Info Day on May 17 @DobbinsARB Visit: http://t.co/r0Zbk6a0Lo",2,1
461969592185675776,2014-05-01 20:45:08,"RELEASE: Isakson Co-sponsors Legislation to Block Bonuses to #IRS Employees Who Break Tax Law, Have Tax Debt http://t.co/rUT7pxVPCk",3,3
461951554497806336,2014-05-01 19:33:27,RT @SenPatRoberts: Thanks to @SenRubioPress @SenatorIsakson @SenToomey @Mike_Johanns for helping to intro. #IRS bill to block bonuses http:…,8,0
461951101172854785,2014-05-01 19:31:39,Great meeting today with the @VLCChamber! Proud of the work you are doing for Moody AFB and our defense community! http://t.co/G3Dfzpt8li,2,3
461913317095665668,2014-05-01 17:01:31,Pleasure to join @SaxbyChambliss in greeting students from Bridgeway Christian in DC today. Great kids and teachers! http://t.co/IRkGaCDmoY,1,0
461902399800483841,2014-05-01 16:18:08,Enjoyed visiting with such an inspiring group from @mycampsunshine this morning with @SaxbyChambliss and #GA reps! http://t.co/9ZUiFrcAvS,4,4
461894802976813056,2014-05-01 15:47:57,@GwinnettChamber @SaxbyChambliss Great meeting! Thanks for your work to better the greater Gwinnett community! #GwinnettDC2014,2,2
461894289224916992,2014-05-01 15:45:54,RT @TraciStrom: Thanks @SaxbyChambliss and @SenatorIsakson for speaking with @GwinnettChamber today! #GwinnettDC2014 http://t.co/HBIgnXl8Ov,3,0
461885358977060864,2014-05-01 15:10:25,@TraciStrom @SaxbyChambliss @GwinnettChamber It was our pleasure! Great seeing everyone.,1,0
461666691785981952,2014-05-01 00:41:31,"High Schoolers! Register by 5 p.m. THIS Friday, May 2, for Military Academy Info Day on May 17 @DobbinsARB Details: http://t.co/r0Zbk6a0Lo",3,0
461522129109147649,2014-04-30 15:07:04,RT @SaxbyChambliss: Great meeting today w/ @SenatorIsakson &amp; @ChamberResource. Good conversation about new economic developments. #gapol ht…,3,0
461268654123126784,2014-04-29 22:19:51,Delaying #KeystoneXL again and again by the Obama administration is 'professional malpractice.' VIDEO: http://t.co/6X715rKqiS,5,1
460788266376372224,2014-04-28 14:30:58,Great resource via @ajc RT @The_KristinaT: Early voting begins today in Georgia! Here's what you need to know: http://t.co/p2mhZPftPU #gapol,2,0
460273489866678272,2014-04-27 04:25:26,RT @SAEProvinceEA: @SenatorIsakson speaking at the @SAEAtlantaAlums Ivan Allen Rush Party. http://t.co/vZBfUgbkYx,3,0
460059832863977472,2014-04-26 14:16:26,"Everyone agrees #comehellorhighwater #SHEP is a top priority. ""A Consensus in Washington, but No Action"" http://t.co/KgkenWX8NC via @nytimes",5,1
459780408205651970,2014-04-25 19:46:06,"RT @WSBTVNewsdesk: #BREAKING--""All Clear"" sounded at @kennesawstate...no shots fired, no gun found on campus, lockdown lifted.#wsbtv http:/…",26,0
459779651192520704,2014-04-25 19:43:05,@kennesawstate given all-clear http://t.co/rg3SotmAcP via @ajc,0,0
459773713622519808,2014-04-25 19:19:30,(2/2) MT @kennesawstate: Police are currently searching campus but have not located anyone. As a precaution campus placed on lockdown.,2,2
459773696870477825,2014-04-25 19:19:26,(1/2) MT @kennesawstate: Kennesaw Officials rc'd a call about a suspicious man on campus w/ a poss. weapon.  Police are searching campus.,0,2
459715307989655552,2014-04-25 15:27:25,RT @PilmoreBedford: Thanks to @SenatorIsakson for great meeting today on international issues &amp; importance of TTIP trade treaty for jobs &amp; …,3,0
459382900962521089,2014-04-24 17:26:33,"Pleasure to meet Acting Director of @ARPAE, Dr. Cheryl Martin, at yesterday's Energy Roundtable at @georgiatech! http://t.co/j2PejPAB4F",3,1
459381166328410112,2014-04-24 17:19:39,Great discussion at @georgiatech's Energy Roundtable. Talked innovation ecosystem &amp; all-of-the-above energy policy. http://t.co/O6PSo4ewUl,4,1
458598817274003456,2014-04-22 13:30:53,Pleased to meet you also! #GoDawgs MT @LoganBooker_BI: Very honored to meet Johnny Isakson &amp; Saxby Chambliss tonight.  #Georgia #GOP #UGA,1,2
458434138958491648,2014-04-22 02:36:30,Honored to receive the Distinguished American Award tonight from #UGA's National Football Foundation chapter. #GoDawgs!,9,9
458337606406000640,2014-04-21 20:12:55,"RT @ugagr: Thanks for visiting Health Sciences Campus, Animal Research Lab and BioBusiness Center @SenatorIsakson LD Jay Sulzman http://t.c…",4,0
458267685609279488,2014-04-21 15:35:05,Reminder to all #Georgia voters: Today is the last day to register to vote in the 5/20 Georgia primary! http://t.co/iLVvYlxT4H via @ajc,14,3
457886344686370816,2014-04-20 14:19:46,Wishing you and yours a happy and blessed Easter!,4,12
457248494043267072,2014-04-18 20:05:10,It's disappointing the president has once again delayed #KeystoneXL while leaving thousands of Americans jobless: http://t.co/aqudceDchO,37,18
456870111937187840,2014-04-17 19:01:37,"Study: Obamacare Hits Seniors With $1,500 Benefit Cut http://t.co/hMOqQ7RAOK via @nationaljournal",3,0
456863311074562048,2014-04-17 18:34:36,CBO says Obama's budget would mean $6.6 tril deficit over the next 10 yrs - $1.6 tril more than the White House says http://t.co/TQUPP98WZk,16,4
456437813991702528,2014-04-16 14:23:49,@SaxbyChambliss &amp; I are incredibly proud of the O'Donnell boys &amp; all others who rc'd appts to US Service Academies! http://t.co/iQoI06MdOX,0,0
456416226018082816,2014-04-16 12:58:02,"Congrats to #ATPC @ your launch. The FinTech industry supports 40K direct GA jobs &amp; 70% of transactions go thru ATL- ""Transaction Alley.""",11,6
456144490546212864,2014-04-15 18:58:16,Remembering Boston. #BostonStrong http://t.co/PFxrAkFT2z,4,0
455812040649883648,2014-04-14 20:57:13,Pesach Sameach- wishing a Happy #Passover to my Jewish friends.,9,5
455776486986117120,2014-04-14 18:35:57,(2/2) Be sure to register to attend our annual Academy Day on May 17th before the sign-up deadline (May 2nd) at 5PM! http://t.co/7R6ROaTLQr,3,0
455776097322676224,2014-04-14 18:34:24,Our Academy Dir. is visiting schools along coastal Georgia this week to share info about the military academies' nomination process. (1/2),3,2
454693914411552768,2014-04-11 18:54:11,OMB’s Burwell held up Ga's #1 econ development project – #SHEP. I have some tough ?'s for her HHS confirmation hearing. #GDEcD,14,5
454589659121987585,2014-04-11 11:59:55,LISTEN LIVE: Up next on @WGAUnews 1340 Athens to talk hot topic issues in Washington and Georgia. Listen online: http://t.co/aC7AiDz0jN,1,2
454585561915744258,2014-04-11 11:43:38,TUNE IN: Listen live at 8:00 a.m. ET as I talk to Tim Bryant @WGAUnews 1340AM Athens to discuss top #Obamacare official resigning and more.,2,1
454341755606151168,2014-04-10 19:34:50,RELEASE: Isakson to Administration: Reforms of Entitlement Programs Must Be on the Table http://t.co/dhLsGYQNVf,2,0
453981291130548224,2014-04-09 19:42:29,Great to meet this group of high school students from Norcross High School yesterday. Go Blue Devils! http://t.co/UUhDc9PAtv,1,0
453976736170926081,2014-04-09 19:24:23,"Pleasure to meet with members of Boy Scout Troop 846 from Duluth, #Georgia, yesterday! http://t.co/PpwU4JlIhI",1,1
453918477577752576,2014-04-09 15:32:53,"It was an absolute pleasure to Skype w/ 8th graders from Hilsman Middle in Athens, #Georgia, this morning! http://t.co/EWJ8OiFbNH",1,4
453901408862208000,2014-04-09 14:25:03,RT @HomeDepotGR: @SenatorIsakson with @HomeDepotfdn’s Heather Pritchard @RuralHome “Serving #RuralVeterans” event on Capitol Hill http://t.…,2,0
453901378889330689,2014-04-09 14:24:56,Pleasure to join @HomeDepotfdn &amp; @RuralHome at the “Serving #RuralVeterans” event this morning. Thanks for having me! http://t.co/3Rd5G9G17V,8,5
453900204899831808,2014-04-09 14:20:16,It was my pleasure. Great questions! RT @CloudsEdits: I am so proud to be one of the lucky people to talk to @SenatorIsakson on Skype Today.,2,0
453882991987916800,2014-04-09 13:11:52,VIDEO: Real Solutions vs. Political Ploys http://t.co/JOiC7Ag25b  via @Senate_GOPs #4jobs,2,3
453578364809654272,2014-04-08 17:01:23,RT @sgreen4616: Thank you @SenatorIsakson for speaking at the ACC Conference and for your continued commitment to Higher Education. #ACC #F…,3,0
453296397064757248,2014-04-07 22:20:57,"On its 60th anniversary, saluting the @USAFA &amp; our brave young men &amp; women from #Georgia proudly serving our nation. http://t.co/TZq74R7q6p",3,3
453216296130596864,2014-04-07 17:02:40,"Stay in the know by reading last week's eNewsletter on #Obamacare, Iran, my visit with WWII Honor Flight &amp; more here: http://t.co/izvbQM02zi",1,1
452085003506425856,2014-04-04 14:07:18,My good friend Bernie Marcus discusses #Obamacare health insurance tax &amp; its impact on #smallbiz &amp;consumers http://t.co/QojoyEESDB via @WSJ,2,1
451848380508291072,2014-04-03 22:27:03,"RT @MacFarlaneNews: Sen Johnny Isakson (R-Ga): VA's refusal to answers questions about agency executive Jed Fillingim ""unacceptable"" http:/…",3,0
451732563347136512,2014-04-03 14:46:50,RT @speaknowforkids: .@SenatorIsakson Thanks for sponsoring #CHGME reauthorization – grateful #Congress passed the bill.,3,0
451727073673875457,2014-04-03 14:25:01,Thanks @vetcampaign for inviting me to speak at @natvetscenter last night! It was quite an honor and a pleasure. http://t.co/lq5yHWAnWP,3,3
451726386860814336,2014-04-03 14:22:18,Honored to to join @vetcampaign at their Second Service Speaker Series event yesterday at the @natvetscenter. http://t.co/AwtHgFLrnz,9,5
451709598379311104,2014-04-03 13:15:35,VIDEO: I spoke on the Senate Floor yesterday about #Obamacare's harmful impact on #smallbiz &amp; consumers. Watch here: http://t.co/ZsVtYSSlAd,1,0
451487139663204352,2014-04-02 22:31:36,Sending prayers to @forthood right now.,55,30
451473188514721792,2014-04-02 21:36:10,"TUNE IN: Speaking at ~5:45p about #Obamacare, compensation for 1979 Iran hostage crisis victims. Watch http://t.co/rQ90gKp6WL via @cspan 2",1,2
451445651323510784,2014-04-02 19:46:45,"RT @GermanyinUSA: Amb #Ammon: Guests yesterday included @SenDanCoats, @SenSherrodBrown,@SenatorIsakson, @RepTimMurphy + @RepTomMarino http:…",4,0
451443608286003200,2014-04-02 19:38:38,What a tremendous honor. More photos from my visit w/ Roswell Rotary Club Honor Air WWII vets: http://t.co/iWjfuJ0ak2 http://t.co/4WkMHH8I8E,6,10
451422738884722688,2014-04-02 18:15:42,Honored to welcome #Georgia's brave WWII veterans from the Roswell Rotary Honor Air visiting the WWII Memorial in DC. http://t.co/mE2LS7jw8T,4,8
451412633489780736,2014-04-02 17:35:33,Great to see #Georgia in the running! MT @gpbnews: #Savannah facing off in @gardenandgunmag's #SouthernTowns bracket! http://t.co/tGcQnxhG7H,4,4
451363328372535296,2014-04-02 14:19:38,"RELEASE: Isakson, Casey Bill to Protect Funding for Children's Hospitals Clears Final Passage http://t.co/2GNWdXkvmo",6,0
451362900645801984,2014-04-02 14:17:56,RT @jaredssolomon: Bill by @SenBobCasey &amp; @SenatorIsakson to reauthorize funding for Children's Hospitals Passes Congress http://t.co/Hwnmi…,1,0
451096274864177152,2014-04-01 20:38:27,"RT @thevigilantvet: @senatorisakson, incredible meeting. Successful day taking the hill #voth2014 #vaaccountability http://t.co/ilF50Maz1z",7,0
450702801237471232,2014-03-31 18:34:56,Ensuring that a death in Africa is not forgotten http://t.co/D6Jwupx2WW via @politicalinsidr,2,0
449640630843879424,2014-03-28 20:14:14,Stay up to date with my activities this week in Washington by reading my weekly newsletter here: http://t.co/OnoRtke3Cg.,1,2
449232345380298752,2014-03-27 17:11:52,"1892 flags, one for each veteran who died by suicide this year. Thx @iava Team Delta 4 ur work to help #CombatSuicide http://t.co/LJ3gPdlqZ0",62,21
449138594092163072,2014-03-27 10:59:20,"RT @nickel1963: ""Whatever @iava needs, I'm your man"" says Senator @SenatorIsakson. #StormTheHill http://t.co/NH9XsY4FPC",6,0
448930440834207744,2014-03-26 21:12:12,VIDEO: Watch for more about my trip to Benin &amp; the ongoing murder investigation of @PeaceCorps volunteer Kate Puzey: http://t.co/GRYCSCoJ4A.,5,1
448916318033809408,2014-03-26 20:16:05,RT @sarahheartsnews: .@SenatorIsakson calls for further investigation into Peace Corps volunteer killed for reporting abuse at the school s…,3,0
448904911594721280,2014-03-26 19:30:45,VIDEO: View my Q+A from this morning's Senate Veterans Affairs Cmte legislative presentation of @AmericanLegion here: http://t.co/qTJJO9CrlI,5,1
448898483764723712,2014-03-26 19:05:13,Our #Georgia Military Academy Day will be May 17th at @DobbinsARB. Register to attend here: http://t.co/pj5zlnCtNk. http://t.co/A77p3RGkAf,3,1
448875216823795712,2014-03-26 17:32:46,"Had the chance to visit w/ @PeaceCorps volunteers in Benin. Blessed by their honorable, courageous service overseas. http://t.co/TNRAV6gNor",10,15
448873842518159362,2014-03-26 17:27:19,"Joined by @PeaceCorps leadership, Beninese gov't officials and Puzey family during trip to Benin, Africa last week. http://t.co/cWsCXsiGNj",2,2
448873212651110400,2014-03-26 17:24:48,"On 5th anniv of Kate Puzey's murder, her family &amp; I rc'd encouraging update on murder investigation in Benin, Africa. http://t.co/gMakdiMbfv",1,1
448837318435033088,2014-03-26 15:02:10,Pleasure working w/ @Reach4Stars on National #CerebralPalsy Awareness Day &amp; enjoyed our mtg yesterday! #CPAwareness http://t.co/JfVvHIBTBw,4,10
448833551547764737,2014-03-26 14:47:12,#Obamacare delayed again! When will #Dems admit it is fundamentally broken &amp; should be replaced w/ reforms that empower patients &amp; Dr.’s?,4,2
448579436150284291,2014-03-25 21:57:26,RT @MendezJenn: Wrapping up day 1 of our Fly In with @SenatorIsakson http://t.co/iOo8grVQft,1,0
448548197062148097,2014-03-25 19:53:18,It was my pleasure! Thanks for stopping by. MT @Reach4Stars: National #CerebralPalsy Awareness 3.25!! #CPAwareness http://t.co/qxrbysxIZ6,10,8
448512870490578944,2014-03-25 17:32:55,@TriplePinkFndn Our office is happy to assist with your White House tour request. Please call our Atlanta office at (770) 661-0999.,0,0
448166790263103488,2014-03-24 18:37:44,Pleasure to join @TCWFI &amp; @TaxPrepHelp at their workshop to discuss benefits of free tax prep for #Georgia residents. http://t.co/YOC192rrIt,2,1
448149203857186818,2014-03-24 17:27:51,RT @TCWFI: @SenatorIsakson speaks @tcwfi Free Tax File http://t.co/b4uek7WMXs,1,0
448116917422022656,2014-03-24 15:19:33,RT @TCWFI: TCWFI hosts FREE FILE WORKSHOP today at 10 am. w/ @SenatorIsakson &amp; @TaxPrepHelp go to http://t.co/8xJVatXTb4 for more info,2,0
448116751243681792,2014-03-24 15:18:53,RT @PSIimpact: .@SenatorIsakson visits a clinic in Benin to see US investment in #globalhealth with @USAIDGH &amp; PSI member org ABMS http://t…,7,0
447080320383602689,2014-03-21 18:40:29,Congrats to #Georgia team @MercerYou Bears on their big win over #Duke! #Mercer #MarchMadness @MercerMBB,17,13
446387129128857600,2014-03-19 20:45:59,RT @universityofga: Johnny Isakson to deliver #UGA’s spring Commencement address. http://t.co/ihmNfLdoyI http://t.co/LIOOOF2kN3,19,0
446386962254278656,2014-03-19 20:45:19,Thanks to @universityofga for the tremendous honor of delivering #UGA’s 2014 spring commencement address. http://t.co/jx8A4hZaD0 #GoDawgs,11,12
445586772509347840,2014-03-17 15:45:39,GA has lost 1 of its political giants. Bo Callaway was a great political pioneer &amp; champion of conservative values. http://t.co/gT2o8TCgnd,2,1
445575148473954304,2014-03-17 14:59:28,RT @SenJackReed: Intro'ed Sunscreen Innovation Act w/ @SenatorIsakson @john_dingell @RepEdWhitfield to help Americans get most effective su…,8,0
443804447047970816,2014-03-12 17:43:20,We must provide oversight to hold the @DeptVetAffairs accountable to protect our commitment to our #veterans. VIDEO: http://t.co/anlvJ4fqdq,7,2
442056327607881728,2014-03-07 21:56:56,RT @NBC26TV: @LindseyGrahamSC @SaxbyChambliss @SenatorTimScott @SenatorIsakson  joining forces to save #MOX at #SavannahRiverSite http://t.…,4,0
442055902909444098,2014-03-07 21:55:14,My Week in Washington: http://t.co/9HqgngvyxD #Savannah #SHEP #Budget2014 #Obamacare,3,1
441575240536453120,2014-03-06 14:05:16,ICYMI- 'President Obama should take responsibility... to end this ill-fated experiment' http://t.co/7ISev6wKjS  #Obamacare #health,3,1
441405563126423553,2014-03-06 02:51:01,'President Obama should take responsibility... to end this ill-fated experiment' http://t.co/7ISev6wKjS #Obamacare #health,12,6
441011242241490944,2014-03-05 00:44:08,@KF4LMT  VP promised #Savannah Harbor funding ‘Come Hell or high water.’ What happened? http://t.co/5QL1uBheO9   @gaports #budget,1,0
441010162816413697,2014-03-05 00:39:51,@SaxbyChambliss and I applaud @Governor_Deal for decision to proceed with #Savannah Harbor deepening http://t.co/f1TOiISSar #budget,11,1
