id,created_at,text,retweets,favorites
601378324888297473,2015-05-21 13:25:40,Military caregivers are America’s #HiddenHeroes. Today I honored these heroes with the @DoleFoundation. http://t.co/lhgtkgPZXI,1,5
601043774962323457,2015-05-20 15:16:17,"RT @LeoShane: .@SenatorIsakson: ""The best way to get good housing for vets is to get them good health care and get them a job."" #RuralVeter…",4,0
601024687888470016,2015-05-20 14:00:26,The VA Committee is having a joint hearing with @HouseVetAffairs and VSOs. Tune in NOW to @cspan or here: http://t.co/fSamJG8n2T,0,2
600762353878061057,2015-05-19 20:38:01,Thank you to all in the House who voted to #EndTrafficking with the Justice for Victims of Trafficking Act.,4,6
600744443554193408,2015-05-19 19:26:51,It was a pleasure meeting @MBCA students today at the @uscapitol. http://t.co/PzrTYy2PbJ,7,4
600743606295597057,2015-05-19 19:23:31,May is National Phenylketonuria (PKU) awareness month. Today I met with @NPKUA_Info to learn more about this disease. http://t.co/BWAeGnCQAJ,1,5
600742350919438336,2015-05-19 19:18:32,Thank you to the Herring family for stopping by for a picture at the @uscapitol. Enjoy your time in DC! http://t.co/j2AI4hlJ1s,1,1
600738094611099648,2015-05-19 19:01:37,It was an honor to meet with @EmoryGoizueta MBA students this morning with @sendavidperdue. http://t.co/fSkblZricH,3,7
600673821385953281,2015-05-19 14:46:13,"Congrats to #Georgia's @jessmainsworth of #Douglasville, who was named @NASSP's NATIONAL Assistant Principal of the Year!",1,5
600476668281651200,2015-05-19 01:42:48,My lucky staffer got to meet some bright #Georgia students at Woodville Elementary School today in Clarkesville. http://t.co/puXZpQwng1,2,7
600300645816651776,2015-05-18 14:03:21,"Jackson, #GA residents- meet w/my staff member @ our ""Open Office Day"" today from 11AM - 1PM at the Municipal Court: http://t.co/S7krjNXiaJ",1,0
599320665393668096,2015-05-15 21:09:16,"Today at the @uscapitol, we remember all the law enforcement offers who have died in the line of duty. #NeverForget http://t.co/naLDDt3qZN",6,5
599016270621765632,2015-05-15 00:59:42,Congrats on 1st big win for #PeanutPatriots staff softball team! 17-12 over Tennessee team. @sendavidperdue @SenBobCorker @SenAlexander,4,2
598954555020312577,2015-05-14 20:54:28,RT @ajconwashington: .@SenatorIsakson and @sendavidperdue push DOT to limit truck speeds after GSU crash http://t.co/gE7nJNgCXx #gapol http…,10,0
598954507616280576,2015-05-14 20:54:17,.@sendavidperdue &amp; I called on @USDOT to end delays &amp; adopt life-saving speed limit enforcement rule for truckers. http://t.co/9iMusiPLyL,1,3
598953390622777344,2015-05-14 20:49:50,"I don't usually like @UF Gators, but when I do, it's @alhorford for the @ATLHawks win. Great game last night, big fella!",6,8
598948802058395648,2015-05-14 20:31:36,"John Lazenby, a friend from my real estate days, is now president-elect of @ORRAFL. Congratulations! http://t.co/NJ7kL8XLeH",1,1
598909669118119937,2015-05-14 17:56:06,International trade supports American workers and jobs. RT if you agree. #TPA4USJobs http://t.co/ngpzzXM5mV http://t.co/Fg7BzM2qnN,12,2
598871494542958593,2015-05-14 15:24:25,"Great meeting with kids from Torah Day School in Atlanta, #Georgia, with @sendavidperdue today! http://t.co/dTRx6uic3S",2,1
598871070461014017,2015-05-14 15:22:44,"I love showing #GA students where I work. King’s Academy, @PerimeterSchool &amp; Torah Day School visited this week! http://t.co/VGn4pTfNYo",0,2
598868425860055041,2015-05-14 15:12:13,"It was great to meet the Melde family today. Georgians- if you’re visiting DC, please stop by the @uscapitol! http://t.co/BbQrTmBzpI",0,3
598601608193298432,2015-05-13 21:31:59,"Co-sponsored a bill today by @SenCapito to ensure reliable, affordable energy, put jobs first http://t.co/S2KtzcM1KZ",2,3
598534750937186304,2015-05-13 17:06:19,It was great to meet with @myMemorial representatives in DC. Thanks for all the work you do taking care of Georgians.,1,5
598524417627525120,2015-05-13 16:25:15,Really ready for #retirement? Just intro'd bill w/@SenMurphyOffice to make sure Americans have tools to better plan: http://t.co/iAWFyUH2by,3,2
598367182372806656,2015-05-13 06:00:28,Can't sleep? Watch a rerun of today's hearing on #VeteransChoice on @cspan here: http://t.co/BRBmn4kdaA,2,6
598305425788837888,2015-05-13 01:55:04,"If you missed today's #VeteransChoice hearing, you can watch it now on @cspan here: http://t.co/BRBmn4kdaA",3,2
598263006976344064,2015-05-12 23:06:30,Just got to @CARE's #CNC15 tonight. Doing a quick interview before delivering remarks. http://t.co/b0FVomKBbK,4,8
598238101518032896,2015-05-12 21:27:32,Congress must use all options - including through the courts - to force Obama to follow #immigration laws: http://t.co/3mktH77jCu #gapol,12,4
598207663344885760,2015-05-12 19:26:35,.@SenDavidPerdue and I had a great time greeting students from King’s Academy. Thanks for stopping by the @USCapitol. http://t.co/SpEV7g4IJt,3,6
598199900745105408,2015-05-12 18:55:45,RT @SenBlumenthal: .@senatorisakson and I are holding a hearing on the implementation and future of the Veterans Choice Act. Watch live: ht…,9,0
598197025545519104,2015-05-12 18:44:19,RT @VAChair: HAPPENING NOW: VA Committee hearing on the #Veterans Choice Program. Watch live on @cspan 3 or here: http://t.co/434imGBB16,8,0
598192516391927808,2015-05-12 18:26:24,.@CollegePark_Ga was in DC today! It was great to meet with City Council members this morning.,1,3
597824204692692992,2015-05-11 18:02:52,Hosted annual Academy Day on Sat. &amp; presented a flag to the Lassiter-Pope-Kell Navy JROTC Drill Team. @CobbSchools http://t.co/NvqvA04voJ,3,3
597795853974274048,2015-05-11 16:10:12,I was proud to speak at the @CarterCenter's @rotary conference summit w/@SenBobCorker to end the scourge of #SexExploitation this AM.,15,12
597753943079440384,2015-05-11 13:23:40,RT @ForumOnWomen: As Americans we must embrace survivors of #SexExploitation not stigmatize them @SenatorIsakson @CarterCenter,3,0
597480787022389248,2015-05-10 19:18:14,#HappyMothersDay to all mothers. My mom was my #FirstFriend. What’s your favorite thing about your mom? http://t.co/8N0sHxfpad,8,15
596789369568141313,2015-05-08 21:30:48,"Have a great weekend, and before you go out to enjoy the beautiful Georgia weather, don't forget your sunscreen! #skincancerawareness",5,3
596783906843688961,2015-05-08 21:09:05,The first @CocaCola was served 129 years ago today! http://t.co/RIfHGq5LNT #FlashbackFriday,9,7
596758242123862016,2015-05-08 19:27:06,Today we remember the 70th anniversary of Victory in Europe Day and all those who served. #VEDay70 #NeverForget http://t.co/KgLAsGWQcd,6,7
596748004780048384,2015-05-08 18:46:26,And more thoughts &amp; prayers w/the family of the victims in today's plane crash on I-285 in Atlanta. Please practice caution when traveling.,7,7
596747865839554561,2015-05-08 18:45:52,Saddened to hear about the passing of former #GA state senator Joey Brush yesterday. Thoughts &amp; prayers w/his family: http://t.co/1BLkX5c0dz,1,4
596676188598185988,2015-05-08 14:01:03,More than half of Americans own or work for a #smallbiz &amp; that's where I got my start in #realestate. Happy Nat’l Small Business Week!,3,5
596418662107611137,2015-05-07 20:57:44,RT @GlblCtzn: Thrilled to see the Global Food Security Act introduced by @SenBobCasey &amp; @SenatorIsakson. Let's get this bill to the Preside…,12,0
596410689150799872,2015-05-07 20:26:03,Senate voted 98-1 today to require Congressional approval of any #IranDeal. Oversight on this agrmt is essential. http://t.co/5YPz7N7YaM,1,1
596397876428738560,2015-05-07 19:35:08,#tbt to speaking on the Senate floor last week about the #Iran Nuclear Agreement Review Act. Glad it passed today http://t.co/aIHYydmaj6,1,1
596390798737813505,2015-05-07 19:07:01,I love welcoming #GA families to #DC. Great to see the Cope family. Enjoy your visit! http://t.co/oWqEX4gTkb,5,3
596384517889216514,2015-05-07 18:42:04,"As someone who ran a #smallbiz, I’m honored to receive the 2015 Small Business Council Award: http://t.co/O8s46jM4wS http://t.co/Jicg7PuxLw",2,3
596374929647468545,2015-05-07 18:03:57,Thank you to the Dowell Elementary School in #Marietta for visiting me at the @uscapitol! http://t.co/CYJKioJpgl,2,4
596369694799601664,2015-05-07 17:43:09,"RT @access_wdun: ICYMI: @SenatorIsakson was on #WDUN Morning Talk today to discuss taxes, poultry and more. http://t.co/X04mWnfoOu http://t…",2,0
596368180676849666,2015-05-07 17:37:08,RT @rdrewsjr: Thx to GA Sens @SenatorIsakson @sendavidperdue for discussing critical banking &amp; Nat'l issues w @GABankers #GBAinDC http://t.…,4,0
596368140486979584,2015-05-07 17:36:59,RT @USChamberAfrica: Thanks to @IREXintl and @SenatorIsakson for yesterday's insightful discussion on building partnerships across #Africa …,2,0
596349042449223682,2015-05-07 16:21:06,Our nation and our world need our prayers. RT if you agree and please join me today in prayer #NationalDayofPrayer http://t.co/4BB3qqpaqq,14,18
596287575410769920,2015-05-07 12:16:51,Look forward to checking in w/Joel Williams on @WDUN at 9:05AM in Gainesville! Tune in for my take from #DC. http://t.co/9KoQq7vCSq,4,0
596026113501110274,2015-05-06 18:57:53,"As a customer myself, I appreciate @GABankers Association for all you do to help #GA banks, families and #smallbiz. http://t.co/lNGwKKtU0H",10,6
595977318268588032,2015-05-06 15:44:00,Always a pleasure to meet with @PeaceCorpsDir Carrie Hessler-Radelet and @PeaceCorps Inspector General Kathy Buller. http://t.co/oM8BF13cj5,4,5
595964471358685184,2015-05-06 14:52:57,It was great to meet w/ @GaHospitalAssoc this morning. Thanks for coming to #DC to advocate for a healthier #GA! http://t.co/aPM7EIrBQv,2,7
595962807457325056,2015-05-06 14:46:20,"Free &amp; fair trade benefits #Georgia #ag, manufacturing &amp; hardworking families. Watch my statement on #TPA, #AGOA: http://t.co/FFY99rGDDy.",5,7
595956856364859392,2015-05-06 14:22:41,"More work ahead, but thank you to @ICEgov for arresting 1 of the top 10 most wanted #humantraffickers. More info: http://t.co/PO0lATl7ml.",0,2
595953374853464064,2015-05-06 14:08:51,"Last night, the #GOP-led Senate passed the first join 10-year #BalancedBudget in more than a decade. http://t.co/5g2v1R5vB1",4,5
595721752979906560,2015-05-05 22:48:28,RT @cobbemc: We enjoyed talking w/ @SenatorIsakson at @NRECANews Legislative Conference. http://t.co/a84tAFitTw,3,0
595705291527704576,2015-05-05 21:43:03,Today I chaired a hearing on pending nominations for the VA: Undersecretary of Health and Assistant Secretary for IT. http://t.co/iDa84Mj4KF,0,2
595668413827121152,2015-05-05 19:16:31,".@sendavidperdue &amp; I joined in fight to preserve A-10's critical mission for defense, #GAmil. http://t.co/nEW8WUo8RO http://t.co/aSTNlB2BhT",3,4
595645389031809024,2015-05-05 17:45:01,The mission of the A-10 Warthog is essential to #MoodyAFB &amp; our national security. Proud to defend: https://t.co/qOCVgWS9Ud #GaMil,4,3
595624453599559682,2015-05-05 16:21:50,Happy #NationalTeacherAppreciation Day! Be sure to thank your teachers today. Who's your favorite teacher in Georgia?,2,2
595624097742233600,2015-05-05 16:20:25,"Provided a #DC update &amp; discussed my work on #SFRC, Ethics, @GOPSenFinance &amp; #HELP cmtes &amp; as @VAChair w/ @TheSIBF. http://t.co/L7NNpyg0Rx",2,3
595616931459235841,2015-05-05 15:51:57,.@PruSpirit Community Awards honor kids who are outstanding volunteers. Congrats to this year's winners from Georgia. http://t.co/BBz9czNth5,2,6
595568572518268928,2015-05-05 12:39:47,RT @ASAGrassroots: Georgia Society of Anesthesiologists with @SenatorIsakson at #ASAWLC. Great advocate for veterans and patients. http://t…,4,0
595568394256125952,2015-05-05 12:39:04,"Enjoyed speaking to @ASAGrassroots about crucial #docfix, providing quality care to #veterans, &amp; #Obamacare repeal. http://t.co/KdjPcmvFQl",4,5
595556049287028736,2015-05-05 11:50:01,I'll be on w/@hometown on @WRGA at 8:45AM. We'll talk 1st 100 Days of #GOP-controlled Senate. TUNE IN:  http://t.co/X0huRKBcaU,2,2
595292658064568321,2015-05-04 18:23:24,It's #MelanomaMonday &amp; the start of Melanoma/#SkinCancer Detection &amp; Prevention Month. Wear protective clothing &amp; apply sunscreen!,6,5
595277095007289344,2015-05-04 17:21:33,"Kudos to the team at Northview HS in Duluth, Ga., selected as 2015's regional finalists in @ToshibaInnovate prog. #STEM #FutureScientists",1,3
595224654970789889,2015-05-04 13:53:11,"Before we get voting started today, a look at last week: http://t.co/9iDlMJby1i. #Iran #Veterans #energy #10thAmendment",0,2
594879407845711872,2015-05-03 15:01:17,RT @SenateMajLdr: .@SenatorIsakson #TPA is good for America…it’s good for middle-class American families who will reap the benefits... http…,10,0
594569062992216065,2015-05-02 18:28:05,"RT @Senate_GOPs: ""Fair and open trade promotes more American agriculture, American manufacturing, and American jobs."" @SenatorIsakson 
http…",19,0
594568984747384834,2015-05-02 18:27:47,"So glad my staff could welcome #WWII, #Vietnam &amp; #KoreanWar #veterans from Brunswick #GA to the WWII memorial in #DC! http://t.co/yiC1UR2qif",7,7
594504598943072257,2015-05-02 14:11:56,#TPA4USJobs is good for America and good for our economy. Watch me deliver the Weekly Republican Address here: http://t.co/ngpzzXuuvn,5,6
594504525832167424,2015-05-02 14:11:38,"Delighted this morning to deliver the Weekly Republican Radio address about the benefits of trade, including more jobs, better economy.",2,5
593893501487702016,2015-04-30 21:43:39,"RT @MODMDNCA: #MODGourmetGala co-chairs Dr. Reyes, Rep. Becerra and @SenatorIsakson and Mrs. Isakson http://t.co/88E02HdgF3",3,0
593803169047703552,2015-04-30 15:44:42,.@Sendavidperdue and I had the honor of welcoming @VLCChamber to DC today. #GaMil #Ag #MoodyAFB @valdostastate #gapol http://t.co/dJaBOsYN82,0,4
593801540986601474,2015-04-30 15:38:14,Thank you to everyone who came out to the #MODGourmetGala for @MarchofDimes. Dianne and I appreciate your support for this great cause.,3,5
593800066520985600,2015-04-30 15:32:22,Big winner of the night: @SenPatRoberts and his wife Franki won the #MODGourmetGala’s People’s Choice Award for their curried chicken balls.,2,2
593799780633022464,2015-04-30 15:31:14,"#MODGourmetGala’s Best in Show Award went to Senator @ChrisCoons and his wife Annie’s apple tart. And it was delicious, too. Congrats!",0,1
593799658557841408,2015-04-30 15:30:45,Rep. @DorisMatsui’s brown sugar bacon skewers won the #MODGourmetGala’s Easiest Prep Award. My kind of recipe! Congrats from Dianne and I!,0,2
593799549594017792,2015-04-30 15:30:19,Congrats from Dianne &amp; I to @lisamurkowski &amp; her husband Verne on winning #MODGourmetGala American Regional Cuisine Award for their salmon.,0,1
593798905994838016,2015-04-30 15:27:46,#MODGourmetGala Health &amp; Happiness Award went to @SanfordBishop &amp; his wife Vivian for their lemon pepper chicken w/ chili peppers. Congrats!,1,1
593798046212849664,2015-04-30 15:24:21,Congrats to @RepWestmoreland &amp; his wife Joan on receiving Best Presentation Award for their pot pie at the #MODGourmetGala last night!,3,6
593797438617583616,2015-04-30 15:21:56,Dianne and I had a wonderful time at last night’s @MarchofDimes #MODGourmetGala supporting children’s health. http://t.co/hc1FCNfmkJ,2,2
593780640195153920,2015-04-30 14:15:11,Great sermon by @petermilner at weekly prayer bfast. Thx @SenatorBurr &amp; @SenThomTillis 4 letting me crash #NC photo. http://t.co/ATC5c3lEcn,8,9
593779162034393089,2015-04-30 14:09:18,It was great to host @mycampsunshine from #Georgia this morning at the @uscapitol. Enjoy your time in #DC! http://t.co/FaM8wnEkIx,4,5
593773190188523520,2015-04-30 13:45:34,RT @mycampsunshine: Camp Sunshine teens at US Capitol today meeting with #Georgia Delegation http://t.co/4NzIOKE1bu,1,0
593772950978961408,2015-04-30 13:44:37,RT @SiteROI: The #GwinnettDC2015 group is meeting with @sendavidperdue and @SenatorIsakson. #gapol http://t.co/P1OxoK3aIY,5,0
593492647752380416,2015-04-29 19:10:48,Heard from @CBAGeorgia today about critical role community banks play in #GA &amp; impact of onerous federal regulations. http://t.co/c4mXvC1JKn,3,5
593490444237066241,2015-04-29 19:02:03,Enjoyed meeting with a group from @ConcernedVets of Georgia earlier today! https://t.co/oKYc0g82gF,0,2
593484854886572033,2015-04-29 18:39:50,"Thank you to the @USChamber for honoring me w/the ""Spirit of Enterprise"" Award again. I'm privileged to represent America's entrepreneurs.",1,3
593482686771113986,2015-04-29 18:31:13,RT @VAChair: HAPPENING NOW: A hearing on @VeteransHealth’s placement on @USGAO’s “High Risk List.” Watch live: http://t.co/aAdYgs7qwi,2,0
593426789030060032,2015-04-29 14:49:06,It’s always an honor to meet with veterans from #Georgia. Thank you to @ConcernedVets of Georgia for stopping by. http://t.co/8EqRP3frwe,5,8
593136388301844480,2015-04-28 19:35:09,"Discussing #GAmil priorities w/ @USMC LTG Faulkner re: @MCLBAlbany, its future, &amp; important role in south GA. #gapol http://t.co/e4SGZQgbLr",6,1
593129703281709056,2015-04-28 19:08:35,Another great #GAmil mtg w/ @GeorgiaGuard BG Joe Jarrard. Proud to be fmr member of #GA @AirNatlGuard. #gapol http://t.co/TfB5Q1us1h,6,3
593122451241959425,2015-04-28 18:39:46,Great #GAmil mtg w/ next Cmdr of @AFMC_Now Materiel Command to discuss Robins AFB's important role @middle_georgia. http://t.co/za03qdkYIS,0,2
593112124991344640,2015-04-28 17:58:44,There were plenty of smiles all around today at my meeting with the #Georgia Dental Association. http://t.co/213bGeuXSH,1,4
593062891043037184,2015-04-28 14:43:06,"RT @IsraelAtlanta: At Sunday's reception, Amb Aviran was joined by honored guests @SenatorIsakson &amp; @SaxbyChambliss, among other leaders ht…",1,0
593031542831763457,2015-04-28 12:38:32,Next up I'll talk with host Alan Sanders in NW Georgia on @wbhfnews in @cvillebartow. LISTEN: http://t.co/AjB13o97WX #gapol,1,1
593020558939389952,2015-04-28 11:54:53,Tune in this morning for my chat w/@ChrisBeckham442 on @ValdostaToday at 8:30AM: http://t.co/RS6QjcrbGk #gapol,3,0
592823456795885568,2015-04-27 22:51:40,I commend @sendavidperdue on his first speech. I know he will accomplish many great things as have those who have served before him. #gapol,13,9
592810553417961472,2015-04-27 22:00:24,.@sendavidperdue has been hard at work for four months in the Senate. I'm ready to head to the @SenateFloor to support his maiden speech.,5,4
592740761629634560,2015-04-27 17:23:04,ICYMI: on Friday I chaired a field hearing on the new Denver @DeptVetAffairs hospital. Watch: http://t.co/n7NcDK0Vos http://t.co/ZDxBbYWiaG,0,1
592731979793174529,2015-04-27 16:48:11,The new Denver @DeptVetAffairs hospital is $1 billion over budget. I saw the site firsthand: http://t.co/pLzD7eWLqH http://t.co/Rz3VmdO4HX,1,0
592729073346043904,2015-04-27 16:36:38,"Way to go, FlameOff Coatings, Inc., of Douglasville, Ga., on your 2015 State #Smallbusiness award from @SBAgov!",1,1
592675804770885633,2015-04-27 13:04:57,"As we prep today for bipartisan legislation to review any #Iran nuclear deal in the Senate, a look back at last week: http://t.co/3MUX1IHPYM",3,1
591721911354302464,2015-04-24 21:54:31,"RT @SenCoryGardner: Thanks to @SenatorIsakson, chairman of the Senate Committee on Veterans' Affairs, for holding today's hearing on the Au…",8,0
591683015018999808,2015-04-24 19:19:58,Touring the Denver VA hospital construction site with @SenBlumenthal @senbennetco @corygardner @senatorrounds. http://t.co/0yU2bsoBZh,8,6
591671005082443777,2015-04-24 18:32:14,RT @sendavidperdue: .@SenatorIsakson &amp; I are cosponsoring a bill to empower states to challenge federal rules: http://t.co/4vjfNmyZjJ,14,0
591325402670309376,2015-04-23 19:38:56,I was honored to receive @60PlusAssoc’s Guardian of Senior Rights award today! http://t.co/v17zYl0ort,3,1
591317997161164800,2015-04-23 19:09:31,.@sendavidperdue &amp; I enjoyed meeting w @CarpetRugInstit here in D.C. all the way from the carpet capital of #Georgia! http://t.co/lamme2XUSC,1,3
591295796273934336,2015-04-23 17:41:18,"Enjoyed speaking to members from the @BGICOC fly-in to discuss #SHEP, #WRRDA, flood insurance, @FLETC1 &amp; more. http://t.co/VYSguRh5uO",0,1
591194781583302657,2015-04-23 10:59:54,"#HappyBirthday, @USArmyReserve! 107 yrs. of service to our nation. You ""Weekend Warriors"" play a critical role in our national defense.",7,2
591040525530202112,2015-04-23 00:46:56,Pleased &amp; relieved we passed a bipartisan bill to help end heinous #humantrafficking. I hope it quickly becomes law. http://t.co/HMRrPGokFC,12,14
590987407631220740,2015-04-22 21:15:52,"Today @sendavidperdue &amp; I met the @ShepherdsMen, who are running 911 miles to raise awareness for veterans with PTSD. http://t.co/TzKCA3XXNb",3,4
590894455227547648,2015-04-22 15:06:31,Don't forget to sign up for Military Academy Information Day @DobbinsARB for students on May 9: http://t.co/1ufuinBWr7. Deadline is Apr. 29!,3,2
590886758277115904,2015-04-22 14:35:55,Who knew my office was such great concert venue? Great performance by talented songwriters with @NSAIofficial today! http://t.co/Ajpyb4yPCp,3,8
590880156513894400,2015-04-22 14:09:41,Started my morning off with students from Midway Covenant Christian School in Powder Springs. Thanks for visiting! http://t.co/eGEP4dSBMN,2,3
590877375426093057,2015-04-22 13:58:38,.@SavetheChildren advocates for kids around the world. Honored to receive their Congressional Champion Award tonight. http://t.co/2KelMxAvMm,1,3
590637867082375168,2015-04-21 22:06:55,RT @VAChair: Today we held a hearing on what the VA is doing to help women veterans. My opening statement: http://t.co/Upcr6FWhJR http://t.…,10,0
590625037792780288,2015-04-21 21:15:56,"Always a pleasure to welcome my friend Bud Peterson, president of @GeorgiaTech, to my D.C. office! http://t.co/ECmcA3t6gV",10,28
590595938743353344,2015-04-21 19:20:19,It was great to talk to @GAPartnership today about my work on the #ESEA authorization and early childhood education. http://t.co/Ef9rY6BZIn,1,2
590576045620908034,2015-04-21 18:01:16,TODAY at 2:30PM: @VAChair hearing on fulfilling our promises to women veterans. Watch live: http://t.co/um8mVLzxEE,1,2
590571692440825856,2015-04-21 17:43:58,"Had a great meeting this morning with @sendavidperdue &amp; Col. Tickner of @SavannahCorps to talk #SHEP, local economy. http://t.co/wBn26OuW0s",2,1
590567545209540608,2015-04-21 17:27:29,".@gavetsvc Commissioner Pete Wheeler dedicated his life to GA, USA &amp; fellow veterans &amp; will be deeply missed. http://t.co/F64TrLRryt",4,0
590549908618371072,2015-04-21 16:17:24,Assistant principals are unsung heroes &amp; help schools tick. I'm proud to have cosponsored a resolution to recognize them. #apweek,19,15
590527798042877952,2015-04-21 14:49:33,Congrats to @ATLHawks for a great season &amp; opening win. Let's keep it going. #hawksrising,7,10
590527487064612865,2015-04-21 14:48:19,"RT @ATLHawks: RETWEET to join us in congratulating Coach Bud, who was just announced as Coach of the Year! 💯

#TrueToAtlanta http://t.co/7F…",3920,0
590518046353154048,2015-04-21 14:10:48,@sharonnga @FreeAmirHekmati I signed a letter urging Sec. Kerry to demand release of Americans unjustly held by Iran. http://t.co/49vCffXWbw,10,7
590189726172389376,2015-04-20 16:26:10,Proud to stand w/our fine veterans to break ground on their new #VA clinic in Savannah w/ @RepBuddyCarter this AM. http://t.co/XyC9AHC9f2,10,10
590140283486130176,2015-04-20 13:09:42,Amelia Jones broke racial &amp;gender barriers in WWII w/Tuskegee Airmen &amp; I got to deliver her Congressional Gold Medal: http://t.co/GuKewwTXyS,9,4
589902911473377280,2015-04-19 21:26:28,RT @GACounty: Thank you for being here with us @SenatorIsakson http://t.co/zvdVa8nPb6,3,0
589902896562593792,2015-04-19 21:26:25,RT @ChathamCountyYC: #CCYC is listening to @SenatorIsakson at @GACounty #ACCG2015 #YouthMatter #ACCGYouthMatter,1,0
589902867043061760,2015-04-19 21:26:18,RT @GACounty: 2015-2016 ACCG officers installed #ACCG2015 @SenatorIsakson http://t.co/sIOnTa6fNh,2,0
589140825231200256,2015-04-17 18:58:13,"Excited to visit Savannah on Sun.-Mon. for @GACounty swearing-in, Congressional Gold Medal to Amelia Jones &amp; #VA Clinic groundbreaking!",3,2
589018909782761473,2015-04-17 10:53:46,I'm headed to Savannah on Sun-Mon. Hear about my plans on @1290WTKS w/Bill Edwards this morning. Tune in live: http://t.co/hGbI07PD0g,2,1
588841881708138496,2015-04-16 23:10:19,"#AGOA reauth will level playing field, pressure South Africa to stop blocking #poultry imports http://t.co/DoXtgvH9bq @ChrisCoons",6,2
588833544287494144,2015-04-16 22:37:11,"Want to say a special ""thank you"" to my wonderful former interns who came out to my speech @universityofga last week. http://t.co/IHkKbPXNWq",3,17
588748045761781760,2015-04-16 16:57:27,"It's good to be in a functioning Senate again. Thanks, @SenateMajLdr &amp; our leadership for a positive first #100days. http://t.co/DeRQmnbv4f",8,3
588715634411892737,2015-04-16 14:48:39,RT @pspatelEyeMD: @EmoryEyeCenter with GA senators @SenatorIsakson @SenatorIsakson and TN neighbor Dr. Sternberg @VUMChealth #myf2015 http:…,4,0
588400140282650625,2015-04-15 17:55:00,"On #TaxDay2015, I again called on Congress to enact fairer, simpler tax code; #AbolishTheIRS &amp; #Obamacare: http://t.co/c2T5VIo3Kd #gapol",4,3
588131309916160000,2015-04-15 00:06:45,Isakson Votes to Support &amp; Praises Committee Passage of Bill to Require Congressional Approval of #IranDeal  http://t.co/YVWNltEWc9,5,7
588123877445869569,2015-04-14 23:37:13,Great talking @JordanSpieth's Masters victory and tax reform w/ @PGATOUR commissioner today #golfisgood #taxesarebad http://t.co/mXEP500zo0,5,5
