id,created_at,text,retweets,favorites
504319389316173824,2014-08-26 17:28:06,As we mark #WomensEqualityDay let’s recommit ourselves to the fight for #equalpay for equal work &amp; a #fairshot for all women &amp; families!,12,10
504319240598736897,2014-08-26 17:27:31,"More than 50 yrs after Equal Pay Act signed into law, women still make just 77¢ for every $ a man earns. #EqualPay http://t.co/la3ASaRcJt",15,10
504319086143471616,2014-08-26 17:26:54,Just as Abigail Adams said ‘Do not forget the ladies or we will foment a revolution of our own.’ #WomensEqualityDay,26,14
503923171998060544,2014-08-25 15:13:41,Preparing students today for successful futures tomorrow RT @HCPSchools A few new HCPS teachers introduce themselves! http://t.co/DkWt4bzBxT,0,4
503920576134930432,2014-08-25 15:03:22,"RT @CCPS: Good morning and welcome to another school year! Students, have a great first day of school. Let's make it a great year.",21,0
503919293827149824,2014-08-25 14:58:16,From Howard @HCPSS to Wicomico @wcboe &amp; Charles @CCPS – students headed #backtoschool across Maryland. Good luck on a successful year!,4,4
503916952235294721,2014-08-25 14:48:58,MT @HCPDNews As schools start - #drivesmart! Slow down &amp; look around. http://t.co/2ujc7ZFliR,6,4
503915679964463105,2014-08-25 14:43:55,"Good luck to students, teachers &amp; families headed #backtoschool @BaltCitySchools, @MCPS, @FCPSMaryland &amp; across Maryland!",2,2
502898566483173376,2014-08-22 19:22:16,"Service members get hands-on training while providing free medical, dental &amp; vet care to those in need https://t.co/hvTECIwc0H",3,4
502897989812502528,2014-08-22 19:19:58,Thanks to @FtMeadeMD men &amp; women of 48th Combat Support Hospital providing medical care to Alleghany Co communities.,1,2
502550548491816961,2014-08-21 20:19:22,Investing in STEM education is investing in MD’s future workforce preparing them today for research &amp; innovation jobs tomorrow.,6,7
502550031615148033,2014-08-21 20:17:19,"Pleased @NASA awarding @MDScienceCenter, @NASAGoddard Visitor Center &amp; @PGCPS Science Center funds for STEM education http://t.co/cyn7q5BsTw",3,4
502090728936574976,2014-08-20 13:52:12,This month at APG cut ribbon on new bio chemistry lab for those standing sentry against spread of toxic agents https://t.co/kt9aC18fRl,2,2
502090490972741632,2014-08-20 13:51:16,Job well done to men &amp; women at Aberdeen Proving Ground for critical role in destroying Syrian chemical weapons http://t.co/SJbv1kbWUU,6,6
502087368917393408,2014-08-20 13:38:51,"Good luck for a successful school year to Washington Co students, teachers &amp; families headed #backtoschool today!",3,3
501757188093014016,2014-08-19 15:46:50,"Principal Evans shows why MD is leading way in education, preparing students for America’s opportunity ladder &amp; successful futures.",2,2
501757069104775168,2014-08-19 15:46:22,Kudos to Baltimore Co @RidgelyMiddle Principal Susan Evans as finalist for @NASSP Principal of the Year! http://t.co/cEn5E7QJWu,8,6
501743740323909632,2014-08-19 14:53:24,"New agreement is 1-2 punch for MD, supporting jobs today at Coast Guard Yard at Curtis Bay &amp; jobs tomorrow in MD’s coastal economies.",4,2
501743580806144000,2014-08-19 14:52:46,Pleased to announce @NOAA &amp; @USCoastGuard agreement bringing new maintenance/repair mission to Baltimore Curtis Bay http://t.co/itMgxtgJH5,2,3
501445759292960768,2014-08-18 19:09:20,"Firefighters protect our homes &amp; communities, gov’t has responsibility to protect our protectors so they can do their job safer &amp; smarter.",6,9
501445613566042113,2014-08-18 19:08:45,Every day our firefighters report for duty &amp; don’t know what they’ll face. I’m fighting for them &amp; tools they need to keep us safe.,8,11
501445022013980673,2014-08-18 19:06:24,MD firefighters &amp; EMS personnel can attend free workshops across MD on preparing federal AFG grant applications. http://t.co/dcY230qBgg,7,6
500346417442209794,2014-08-15 18:20:56,RT @MDOTNews: ICYMI: Joined @SenatorBarb @RepCummings @Amtrak @USDOTFRA to urge long-term transpo $$ bill &amp; fix #HighwayTrustFund http://t.…,12,0
499563571496632320,2014-08-13 14:30:11,"Today marks 3 years since Marylander Warren Weinstein was abducted in Pakistan, now is the time to bring him home #freewarrenweinstein",14,7
499249564046860289,2014-08-12 17:42:26,"I'll keep fighting to combat domestic violence &amp; ensure if you’re beaten &amp; abused, you have somewhere to turn for help &amp; path to recovery.",8,10
499249303417020416,2014-08-12 17:41:24,"RT @UMMC: Brown, U.S. Officials announce funding for Hospital-Based Domestic Violence Program at UMMC: http://t.co/wcGwxqC2SS",2,0
499249124093734912,2014-08-12 17:40:41,.@UMMC Bridge Center will provide 24/7 support for victims of domestic violence &amp; help protect families from continued abuse.,5,3
499248991650197504,2014-08-12 17:40:09,"In Baltimore w @ltgovbrown, @SenatorCardin &amp; @Call_Me_Dutch announced funds to combat domestic violence in MD https://t.co/y4cWiyoebu",7,3
497049553070489600,2014-08-06 16:00:22,"I’m standing sentry for APG developing new tools to keep us safe, making nation safer &amp; MD’s economy stronger https://t.co/xmwPEHrgZB",6,6
497049004950450176,2014-08-06 15:58:12,Men &amp; women at APG stand sentry protecting our men &amp; women in uniform &amp; our homeland from spread of toxic agents.,4,1
497048896649322496,2014-08-06 15:57:46,On Tuesday I was proud to cut ribbon on new advanced bio chemistry laboratory at Aberdeen Proving Ground in Harford. http://t.co/ZolTRhSRE3,6,7
496744252484116480,2014-08-05 19:47:13,I’m proud to support National Night Out – bringing together communities &amp; crime fighters to say NO to violence in our neighborhoods.,4,3
496744162444992513,2014-08-05 19:46:52,Tonight families across MD stand up to crime &amp; violence celebrating National Night Out. Find event in your community http://t.co/YdmGSXAfsJ,5,5
496636573723947008,2014-08-05 12:39:20,"Expanded facility is the only in US for advanced research/ development on chemical threats, keeping our nation safer &amp; MD's economy stronger",6,3
496636041072480256,2014-08-05 12:37:13,Headed to Aberdeen Proving Ground in Harford to cut ribbon on new state of the art advanced chemistry lab.,3,8
496395834779791360,2014-08-04 20:42:44,I’m fighting to help MD colleges &amp; universities do what they’re best at – preparing students for jobs. http://t.co/cG306DO7Uy,6,3
496395611823169537,2014-08-04 20:41:51,RT @MD_CommColleges: #HigherEd policy discussions w @SenatorBarb Mikulski &amp; 16 Pres from @MD_CommColleges. http://t.co/kCjowIg6Fq,2,0
496393679104663552,2014-08-04 20:34:10,"Education a critical rung on opportunity ladder of our nation, preparing students for jobs &amp; successful futures.",9,3
496393554655469569,2014-08-04 20:33:40,Today met w @MD_CommColleges Presidents to discuss ensuring access to affordable higher education. http://t.co/cJkbTCkS8i,6,5
495280666675019776,2014-08-01 18:51:27,Pleased my resolution passed Senate marking anniversary that forever stands as testament to strength of human spirit. http://t.co/5jprCnEeeN,5,2
495280512542736385,2014-08-01 18:50:50,Today we commemorate 70th anniversary of heroic #WarsawUprising which serves as inspiration to all people fighting for freedom &amp; dignity.,25,14
495262460300263424,2014-08-01 17:39:06,It’s crucial that Israel has opportunity to defend itself while others work on ceasefires or political solutions. https://t.co/ymdaxu8wVG,6,5
495262235745615872,2014-08-01 17:38:13,Fought hard to pass emergency spending bill to replenish Israel’s Iron Dome-critical to defense of our treasured ally http://t.co/DBIEbMRMnd,7,4
494956383847325696,2014-07-31 21:22:52,Carolyn Colvin is intellectually brilliant w enormous competency &amp; is up to the job at Social Security  http://t.co/hIZUlEmQ78,3,3
494956173796589568,2014-07-31 21:22:02,Social Security a social contract between American people &amp; their gov’t providing critical safety net there when they need it.,7,6
494956003201675265,2014-07-31 21:21:21,Today introd Anne Arundel Co native Carolyn Colvin at hearing on her nomination to be @SocialSecurity Commissioner https://t.co/eace822jpn,4,2
494506588951298048,2014-07-30 15:35:32,"My Polish heritage has given me set of beliefs–in freedom, in people, in strength of human spirit &amp; that we must always speak truth to power",5,22
494506361892638721,2014-07-30 15:34:38,Senate action w @SenatorRisch &amp; @SenatorCardin marks 8/1/44 uprising that forever serves as symbol of heroism in face of great adversity.,2,9
494506135907729408,2014-07-30 15:33:44,Pleased Senate Foreign Relations Cmt passed my bipartisan resolution marking Polish Warsaw Uprising 70th anniversary. http://t.co/BzRAHId1Uv,18,15
494502096939794432,2014-07-30 15:17:41,"RT @SenateApprops: Here is video of Chairwoman @SenatorBarb talking about #veteransaffairs &amp; Iron Dome, wildfires &amp; border funding:  https:…",5,0
494500269590585344,2014-07-30 15:10:26,FBI needs 21st century fully consolidated headquarters so it can fulfill its 21st century mission. WATCH https://t.co/y2QLaSaNVL,1,2
494247589517463552,2014-07-29 22:26:22,Today w @SenatorCardin &amp; Team MD announced 2 proposed Prince George's Co sites on shortlist for new FBI headquarters http://t.co/cBhMA265OG,9,2
493887138359156736,2014-07-28 22:34:04,Pamela Harris is extraordinarily qualified for the job w/ commitment to rule of law &amp; passion for how it affects lives of ordinary Americans,2,4
493887057325203456,2014-07-28 22:33:45,Pleased Senate voted to confirm Pamela Harris to serve on 4th Circuit Court of Appeals &amp; was proud to recommend her http://t.co/PCRo7clunB,1,6
492350424234881024,2014-07-24 16:47:43,RT @baltimoresun: COMMENTARY: Md. senators fight for multi-year transportation bill. http://t.co/mr3fg65AGX via @SenatorBarb and @SenatorCa…,9,0
492350263232319490,2014-07-24 16:47:04,"Time for Congress to act! Long-term investments in transportation create jobs, help businesses succeed &amp; create certainty for communities.",5,3
492350045417930753,2014-07-24 16:46:12,I’m fighting along w @SenatorCardin for multi-year transportation bill to provide planning &amp; funding certainty for Maryland.,8,6
492349957182337024,2014-07-24 16:45:51,"In midst of peak construction season, critical Highway Trust Fund will go bankrupt in August if Congress doesn’t act. http://t.co/ahDbRDoTu4",9,2
492302285067010048,2014-07-24 13:36:25,Proud to cut through red tape &amp; break bureaucracy so Cpl. Mackall received long-overdue honor he deserves. http://t.co/YRvanvu29q,4,2
492302144088055809,2014-07-24 13:35:52,Life-long Calvert Co MDer Corporal Elmer Mackall served his country as Montford Marine–but never received his medal or official recognition.,4,1
492302047052832768,2014-07-24 13:35:29,Montford Marines broke down barriers for African Americans serving in Armed Forces-I cosponsored bill awarding them Congressional Gold Medal,6,2
492046585984212992,2014-07-23 20:40:22,Jim-you are my sunshine for a rainy day or any day. Thanks for all you &amp; @WeatherChannel do to keep communities safe! http://t.co/G3zgoaZQLG,8,16
492046401053155329,2014-07-23 20:39:38,Would have liked to join @JimCantore today at Capitol to talk weather safety–sent him photo of our last mtg w regards http://t.co/aYWMg5rh3E,12,25
491712019318337536,2014-07-22 22:30:55,"As our nation looks at how best to create, sustain &amp; support high-paying jobs, must better prepare workforce to fill high demand jobs now.",2,3
491711872198922240,2014-07-22 22:30:20,Pleased President signed into law bipartisan Workforce Innovation &amp; Opportunity Act I cosponsored promoting jobs today &amp; tomorrow. #WIOA,6,8
491662247157309441,2014-07-22 19:13:09,I’m proud to honor Mattie &amp; his call for hope and peace that lives on &amp; will continue to inspire future generations. http://t.co/56xIEXlOLM,5,4
491662143562211328,2014-07-22 19:12:44,Mattie’s life &amp; legacy continues to inspire us all as advocate for peace whose message reached millions around world.,1,2
491661985994801152,2014-07-22 19:12:06,He’s especially on our mind as last Thursday would have marked his 24th birthday.,1,2
491661905795497984,2014-07-22 19:11:47,Pleased Senate has acted to pass resolution I intro’d w @SenatorCardin honoring life of MDer &amp; advocate for peace Mattie Stepanek.,5,9
491228891860979712,2014-07-21 14:31:09,Headed to Howard Co to tour MD Center for Entrepreneurship w/ Councilwoman Watson &amp; talk innovation jobs.,11,11
489887995122946048,2014-07-17 21:42:54,To honor his life &amp; legacy joined by @SenatorCardin to intro resolution declaring Mattie Stepanek World Peace Day http://t.co/ngqYDyLt0W,6,7
489887668927361025,2014-07-17 21:41:36,Mattie was inspiration as gifted author &amp; noted peacemaker. Took personal challenge &amp; turned it into message of peace heard around world,3,5
489887412827750403,2014-07-17 21:40:35,He’s especially on our mind as today would have marked his 24th birthday.,2,3
489887337670017024,2014-07-17 21:40:17,Today we pay tribute to life of Mattie Stepanek who passed away 10 yrs ago after fight w/ Muscular Dystrophy.,11,11
489829558540308481,2014-07-17 17:50:42,In June I intro’d Pamela Harris at her Senate hearing – she’ll be true asset to 4th Circuit https://t.co/ptkdL5TthS http://t.co/A18YcWDLD4,3,3
489829106868310016,2014-07-17 17:48:54,"Pamela is an exceptional litigator, professor, public servant &amp; proud Marylander who is well suited for job.",0,0
489828985682292736,2014-07-17 17:48:25,Pleased Sen Judiciary Cmt today voted to approve nomination of Pamela Harris to serve on 4th Circuit Court of Appeals http://t.co/1KLDIQpPBy,1,0
489777005895122944,2014-07-17 14:21:52,RT @SenateApprops: At 10:30 @SenatorBarb will hold a full committee markup of @SenatorDurbin’s FY15 #Defense appropriations bill. Listen ht…,6,0
489541193806532609,2014-07-16 22:44:50,"I'll keep fighting so health decisions made between an individual &amp; their doctor, not an employer &amp; insurance company http://t.co/ryQpQoEGEG",14,20
489540786698977280,2014-07-16 22:43:13,"By denying women access to care, Supreme Court decision again allows for gender discrimination in health care – something I fought to end.",21,16
489539956713332736,2014-07-16 22:39:55,Deeply disappointed Senate Republicans voted to put personal opinion of a employer ahead of medical opinion of a doctor. #NotMyBossBusiness,19,17
489506545038663680,2014-07-16 20:27:09,RT @SenateApprops: On the floor now: @SenatorBarb will speak on humanitarian crisis at SW border &amp; @WhiteHouse emergency supplemental http:…,9,0
489442008088723456,2014-07-16 16:10:42,Important health care decisions should be made by an individual and their doctor -- not by their employer.,29,25
489441920901726208,2014-07-16 16:10:21,I'm speaking out to ensure personal opinion of your employer doesn’t trump medical opinion of your doctor. WATCH https://t.co/8qaFk3b8xW,13,12
489441456969773057,2014-07-16 16:08:31,I’m fighting to right this wrong &amp; protect all Americans by prohibiting employers from denying access to impt health benefits.,9,9
489441004370792448,2014-07-16 16:06:43,Today I’ll vote to support legislation protecting women’s health following dangerous Supreme Court decision. #NotMyBossBusiness,22,26
489112429586952193,2014-07-15 18:21:05,Headed to Senate floor to speak out for bill protecting women's health after dangerous Supreme Court decision. Watch http://t.co/SkDOQFqTVG,10,18
488783572711383041,2014-07-14 20:34:19,I’m proud to support research &amp; innovation jobs in MD’s biotech industry keeping MD competitive in global economy http://t.co/s2JGx7CXn0,4,7
488783368990236673,2014-07-14 20:33:30,In MD life science is life blood of our economy – supporting 90K jobs developing new products &amp; treatments that help save &amp; improve lives.,1,5
488783160659181568,2014-07-14 20:32:41,RT @AstraZenecaUS: .@SenatorBarb showed her support of MD biotech today at AZ's biologics manufacturing center in Frederick. http://t.co/xX…,4,0
488783089548926976,2014-07-14 20:32:24,Today in Frederick met w/ @AstraZenecaUS to talk community health &amp; supporting biotech research &amp; manufacturing jobs. http://t.co/uVbcRgHe7c,5,1
488370869857947649,2014-07-13 17:14:23,Congrats to @OrbitalSciences on successful Antares launch from Spaceport @NASA_Wallops carrying critical cargo to int'l space station.,32,44
487720727311687680,2014-07-11 22:10:57,National Parks would be fitting tribute to honor her lasting legacy for MD &amp; our nation while inspiring future generations.,8,4
487720647099813888,2014-07-11 22:10:38,Harriet Tubman was a courageous fighter w tireless commitment to fight for those who couldn’t fight for themselves.,8,6
487720553067724801,2014-07-11 22:10:15,Pleased Senate passed bill I helped intro to create national historic parks to honor life &amp; legacy of Harriet Tubman http://t.co/39ylWey5Dd,14,9
487715711091892224,2014-07-11 21:51:01,RT @repdonnaedwards: I look forward to appearing on @HBO's Real Time w @billmaher tonight. Hope you can tune in!,19,0
487668186125717504,2014-07-11 18:42:10,#FF Team Maryland in the House @WhipHoyer @RepCummings @Call_Me_Dutch @ChrisVanHollen @RepJohnSarbanes @repdonnaedwards @repjohndelaney,6,5
487664960903077888,2014-07-11 18:29:21,I'll continue to stand sentry to ensure our firefighters have a gov't on their side and by their side http://t.co/pHI6vAXEmQ,0,4
487664750835552256,2014-07-11 18:28:31,Ensuring states have tools they need to respond to disasters w/ surplus equipment is common sense. Saves money &amp; saves lives.,0,1
487664354767421440,2014-07-11 18:26:57,First responders put their lives on the line to protect communities. Federal gov’t must protect our protectors w/ tools they need.,3,3
487663919939719168,2014-07-11 18:25:13,Joined w/ @SenJohnMcCain to call on Defense Dept to release surplus military equipment to firefighters responding to natural disasters.,4,5
487361132102172673,2014-07-10 22:22:03,"Health decisions should be made by an individual and their doctor, not by their employer. http://t.co/fubkL6zFYd",37,13
487361066004131840,2014-07-10 22:21:47,I’ve cosponsored bill to right this wrong &amp; protect all Americans by prohibiting employers from denying access to impt health benefits.,12,11
487360833673244672,2014-07-10 22:20:52,Allowing employers to deny women access to needed care once again allows for gender discrimination in health care –something I fought to end,20,11
487360752165339137,2014-07-10 22:20:32,Far-reaching Supreme Court womens health decision should concern us all–puts personal opinion of employer ahead of medical opinion of doctor,21,12
487302263095173120,2014-07-10 18:28:07,RT @SenateApprops: At 2:30 pm: @SenatorBarb will chair full committee hearing on @WhiteHouse emergency supplemental request. Watch live: ht…,5,0
486260376099880962,2014-07-07 21:28:02,MD cities &amp; towns need gov't on their wide to upgrade water &amp; sewer infrastructure. I'll keep working to make sure MD's water works!,4,10
486260161305387009,2014-07-07 21:27:11,"I'm fighting to wash away rust &amp; decay of crumbling water infrastructure to create jobs - protect public safety, environment &amp; ratepayers.",8,8
486260057391525888,2014-07-07 21:26:46,RT @SenatorCardin: At Montebello Water Treatment Plant w/ @SenatorBarb talking about the need to invest in US water infrastructure http://t…,7,0
486259862406717440,2014-07-07 21:26:00,Today visited Baltimore water treatment plant w @SenatorCardin to get up close view of MDs aging water infrastructure http://t.co/4a5bCazuOS,5,3
485119648979902464,2014-07-04 17:55:12,Have a happy &amp; safe July 4th!!,6,8
484697934294839300,2014-07-03 13:59:27,"Every day when first responders report for duty, don't know what they'll face. That's why I'm fighting to protect our protectors.",10,4
484697521772441600,2014-07-03 13:57:49,Headed to Rosedale to announce funds in federal checkbook for Baltimore Co &amp; MD fire fighters.,4,5
484008076706869248,2014-07-01 16:18:12,"Ellicott City small businesses backbone of community – creating jobs &amp; bringing in families who shop, eat &amp; live here http://t.co/Oahm5lOfZp",5,3
484006983008550912,2014-07-01 16:13:51,Vote TODAY for Ellicott City as @ParadeMagazine Best Main Street in US! Let’s support Howard Co families &amp; businesses http://t.co/Oahm5lOfZp,14,9
483735660554379264,2014-06-30 22:15:43,Look forward to Senate’s confirmation so we can right the ship &amp; together continue to tackle issues in VA.,3,2
483735553754808320,2014-06-30 22:15:18,"His military, business &amp; management experience needed to lead our nation’s largest health care network.",4,1
483735497563701248,2014-06-30 22:15:04,Decision to nominate Bob McDonald as next Sec of Veterans Affairs demonstrates President's commitment to resolving mgmt issues plaguing VA.,6,2
482634324462665728,2014-06-27 21:19:24,"MD artists using their passion, talents &amp; voices to keep American musical traditions alive for generations to come.",7,5
482634219743477760,2014-06-27 21:18:59,Kudos to MD blues &amp; gospel Holmes Brothers / Singing &amp; Praying Bands of MD &amp; DE named @NEAarts Nat’l Heritage Fellows http://t.co/My1oMBBCtL,7,5
482233322417180672,2014-06-26 18:45:58,Congrats to #USA Soccer! On to the Round of 16! #USMNT #1N1T,6,7
482213416397185024,2014-06-26 17:26:52,On Senate floor will keep up drumbeat against Boko Haram terrorists &amp; call for access to education for women &amp; girls http://t.co/m7x27CNEFJ,5,3
481927665922748416,2014-06-25 22:31:24,Workforce investment is a down-payment on middle class &amp; our nation’s future – promoting jobs today &amp; jobs tomorrow,6,3
481927490881867776,2014-06-25 22:30:42,"As we look at how best to create, sustain &amp; support high-paying jobs, must look at how to best educate our workforce &amp; fill high-demand jobs",3,2
481927329959014401,2014-06-25 22:30:03,Today’s passage of bipartisan workforce #WIA bill is step forward for jobs &amp; helping our nation remain competitive globally in 21st century,5,0
481518057664569344,2014-06-24 19:23:45,"Together we can break down barriers so all can live in a country that lives up to undeniable promise of life, liberty &amp; pursuit of happiness",5,9
481517887757484035,2014-06-24 19:23:05,"50 yrs after Civil Rights Act signed into law, we must renew &amp; reinvigorate our fight to break down barriers of injustice.",8,7
481517782874730496,2014-06-24 19:22:40,Long-overdue &amp; well-deserved award recognizes monumental impact of Dr. King &amp; his march towards freedom &amp; equality for all.,3,5
481517479026769920,2014-06-24 19:21:27,"Today as Congressional Gold Medal awarded to Dr. Martin Luther King &amp; his wife Coretta, we reflect on 50 yrs of historic Civil Rights Act.",1,4
481440145485209600,2014-06-24 14:14:10,Judiciary received letter of support from 79 members of legal community expressing united admiration for nomination. http://t.co/ZCjEVDNoij,4,3
481439995878588416,2014-06-24 14:13:34,"Pamela is a brilliant litigator, professor, public servant &amp; proud MDer who is well suited for the job.",2,2
481439901020192768,2014-06-24 14:13:11,"Today at 10:15am Senate hearing, will intro MDer Pamela Harris-nominee to serve on 4th Circuit Court of Appeals WATCH http://t.co/caghhmFmmW",6,1
481193722496155648,2014-06-23 21:54:58,Will continue to fight for funds in  federal checkbook to support justice programs protecting kids &amp; families.,3,1
481193634851999745,2014-06-23 21:54:37,Operation Cross Country shows what can be accomplished w government working to keep our kids safe.,3,0
481193500244185089,2014-06-23 21:54:05,"So proud of @FBI working w state, local police &amp; @MissingKids who rescued 168 exploited kids from prostitution rings. http://t.co/Pm9Bn906k6",11,11
480796687523672064,2014-06-22 19:37:17,"On 5th anniversary of deadly metro crash, thoughts are w victims families remembering their loved ones.",5,4
479628941687128066,2014-06-19 14:17:05,RT @SenateApprops: At 10:30 @SenatorBarb will hold a full committee markup of FY15 SFOPS &amp; Leg Branch #appropriations bills. Listen: http:/…,5,0
479321774380040192,2014-06-18 17:56:31,If you gather evidence – then test &amp; use it to prosecute sexual predators &amp; stand up for victims who need gov’t on their side.,7,6
479321666393489408,2014-06-18 17:56:05,"Rape victims shouldn’t be double assaulted! First by predator who attacked them, then by lackluster criminal justice! http://t.co/NlanUTL5V7",17,12
479321370757980160,2014-06-18 17:54:54,Bill meets compelling human need addressing backlog of sexual assault kits kept in lab storage or at police departments,2,2
479321266122657793,2014-06-18 17:54:29,I’m leading charge for passage of my CJS funding bill to take on sexual assault &amp; violence against women. http://t.co/9xihm4WISg,16,18
478960675256303616,2014-06-17 18:01:38,"Evidence must be processed, cases investigated, criminals punished &amp; victims provided services they need to help rebuild lives.",16,8
478960583749152769,2014-06-17 18:01:16,I’m fighting for funds in CJS bill to clear backlog of sex assault kit testing &amp; bring criminals to justice. http://t.co/CKPZWt8aR8 #VAWA,32,26
478960108962328576,2014-06-17 17:59:23,Outrageous that 10s of thousands untested sex assault kits sitting in crime labs or police lockers. Victims must know they're not forgotten.,19,18
478959846013009920,2014-06-17 17:58:20,No woman in America should live in fear of being assaulted or abused. Those that are need a gov’t on their side as they seek justice.,72,50
