id,created_at,text,retweets,favorites
511628080557731840,2014-09-15 21:30:14,My #Military academy dir. @ ParkviewHS today re: application process. Deadline to apply is FRIDAY: http://t.co/c7lDKLqKsL @GwinnettSchools,0,1
511621473048743936,2014-09-15 21:03:59,"Great visit with an old friend, Andy, and his son, Will, who told me touring my office was the ""coolest thing ever."" http://t.co/IKXZtfRa1M",2,7
511609683174776832,2014-09-15 20:17:08,"In honor of #ConstitutionDay2014 this week, I recorded a PSA &amp; look forward to speaking w/Ga. students via Skype: http://t.co/UiyeDPUZKn.",1,3
511606769601499136,2014-09-15 20:05:33,"Special office visitors! My son, Kevin, his wife, Katherine, &amp; my grandchildren dropped by before a @uscapitol tour! http://t.co/Rm0ZJ6dm9u",0,9
511606624587616256,2014-09-15 20:04:59,"Special office visitors! My son, Kevin, his wife, Katherine, and my grandchildren dropped by before a @uscapitol tour!",0,3
511549192154910720,2014-09-15 16:16:46,"Attend my live video discussion on ""Innovation in Higher Education"" via @CollegeWeekLive on September 18th @ 2PM: http://t.co/QldzbAL9t4",4,3
511521506774757376,2014-09-15 14:26:45,"#Military Academy Application Deadline is Friday, Sept. 19, at 5PM. Students, don't wait to submit your materials: http://t.co/OFsvyR6rzz",1,2
511514721535946752,2014-09-15 13:59:47,ICYMI: What's Needed to Fully Confront #ISIS? My take from @washingtonpost: http://t.co/saEzmuiKpe,2,2
510511807304589313,2014-09-12 19:34:34,"This week in #DC included visits from local #GA chambers, update on #ISIS, loss of @ChickfilA founder &amp; more. #gapol http://t.co/IVQ4k3Y1ZH",2,3
510415986756161536,2014-09-12 13:13:48,"Honored to join you! ""@ResearchAtlBiz: Honored to have @SenatorIsakson as guest speaker at @AtlBizChron's #atlbestplaces this morning!”",2,7
510398541748269057,2014-09-12 12:04:29,RT @PEPFAR: #AmbBirx &amp; @SenatorIsakson: @CDCGlobal's lab strengthening expertise as PEPFAR prtnr is key to #HIV &amp; #Ebola response http://t.…,7,0
510397509659676674,2014-09-12 12:00:23,"Thanks @hometown on @WRGA for having me on this AM.

Next on tap, looking forward to @AtlBizChron's ""Best Places to Work"" award ceremony!",1,1
510382376845725696,2014-09-12 11:00:15,TUNE IN #Rome: Listen live to @hometown on @WRGA at 7:20AM for my interview on #ISIS w/ or Listen Live Online: http://t.co/kMmJ05aSIZ #gapol,0,1
510256164249288704,2014-09-12 02:38:44,"#Rome: Tune in to @hometown on @WRGA tomorrow at 7:20AM for my interview on ISIS w/ ""Druck,"" or Listen Live: http://t.co/X0huRKBcaU #gapol",4,2
510148554942607360,2014-09-11 19:31:08,RT @brantdevans: @SenatorIsakson hard to believe you could squeeze my class into your busy day. What a privilege to speak with a US Senator…,1,0
510115680260476928,2014-09-11 17:20:30,@DarlingtonTiger It was my pleasure! Let's do it again soon!,2,5
510115413112672256,2014-09-11 17:19:26,RT @DarlingtonTiger: .@SenatorIsakson thank you for making time for Darlington's AP Government students today! It was an incredible experie…,2,0
510110590296002560,2014-09-11 17:00:16,Moved by @AriFleischer's #Sept11 remembrance tweets today. I still remember the smell of gasoline from the Pentagon attack. #NeverForget,6,2
510103084526092289,2014-09-11 16:30:27,"I will #NeverForget that I stood on the Capitol steps w/Congress @ 6:30PM to sing ""God Bless America"" &amp; pledged my support to our military.",2,3
510101617195372544,2014-09-11 16:24:37,Great Skype session with @DarlingtonTiger AP Gov't students today! http://t.co/Mq9QFK6WzO,8,19
510101063303962624,2014-09-11 16:22:25,"Thanks, Mr. Evans, for sharing your AP Gov't students today via Skype. They are living the @DarlingtonTiger ""learn with passion"" mission.",6,11
510100964884623360,2014-09-11 16:22:01,"RT @MarieMHG: Awesome! My boss, @Senatorisakson, Skyping with my alma mater, Darlington School right now. @Darlingtontiger http://t.co/7Ltr…",3,0
510060549808594944,2014-09-11 13:41:26,My chief-of-staff @jmkirchner and I got our very own #ShareaCoke can from Matt Echols w/ @CocaCola today. Thanks! http://t.co/dmWMgsdZsO,6,9
509797857759887360,2014-09-10 20:17:35,More photos taken by one of our DC interns at Congressional Gold Medal Ceremony honoring fallen heroes of 9/11 today. http://t.co/mYtSlBqMM6,2,4
509797610300116992,2014-09-10 20:16:36,Photos taken by one of our DC interns at Cong. Gold Medal Ceremony honoring fallen heroes of 9/11 today. #NeverForget http://t.co/rsRWOZy4l6,3,2
509796419952472064,2014-09-10 20:11:52,I'm so glad our interns got to experience such a moving Congressional Gold Medal Ceremony honoring fallen heroes of 9/11 today. #NeverForget,0,2
509793420467265536,2014-09-10 19:59:57,"Home to #GA's 3rd largest univ., @KennesawState, enjoyed meeting today w/ Mayor Mark Mathews of @CityKennesaw. #gapol http://t.co/rfTuz34qSl",2,3
509714646581141506,2014-09-10 14:46:56,RT @jasonanavitarte: Great meeting one of GAs leaders @SenatorIsakson this morning with @dstyf @KennesawMark @kennesawstate @CobbChamber ht…,2,0
509703751691956224,2014-09-10 14:03:38,RT @CobbChamber: Discussing the issues affecting Cobb with @SenatorIsakson on day 3 of the Fly-In #CobbtoDC http://t.co/eJmdC0oZPS,4,0
509701645664800768,2014-09-10 13:55:16,"Always enjoy visits with hometown friends. Welcome, @CobbChamber! #gapol http://t.co/moId5RATx2",5,7
509701111864107008,2014-09-10 13:53:09,Listen out for my remarks previewing President Obama’s speech tonight re: ISIS coming up soon on @WSBradio with @JamieDupree. #gapol,4,0
509470065230483456,2014-09-09 22:35:03,Visiting with Zsa Zsa Hears before her @uscapitol tour. Georgians- stop by for some @CocaCola or @georgiapeanuts! http://t.co/M8sv8c5eC3,0,4
509468867068846080,2014-09-09 22:30:18,Delighted to meet with #Georgia constituent Rev. Michael Jackson today during his visit to D.C. #gapol http://t.co/zvNhOf842J,0,2
509453756530819073,2014-09-09 21:30:15,"Education is my passion, so I was pleased to congratulate GA HS Principal of the Year Debra Murdock. @CherokeeSchools http://t.co/wTGHiFuR6z",19,37
509439181215780864,2014-09-09 20:32:20,"Thanks @MaconChamber team for your visit today. Especially enjoyed seeing Mike Dyer, president &amp; CEO, and Dan Slagle. http://t.co/LzPxePOcuE",0,2
509434669532975104,2014-09-09 20:14:24,Great meeting today with the Carroll County Chamber of Commerce. It’s wonderful to have you in our nation’s capitol. http://t.co/Na9cU6CpNr,1,3
509369447891881984,2014-09-09 15:55:14,"Great to welcome @DC_Chamber to Washington, D.C., today! Thanks for all you do for the Douglas Co community. #gapol http://t.co/nz01a9baB2",3,2
509327964501454848,2014-09-09 13:10:24,Great news! RT @universityofga: #UGA ranked among top 20 public universities by U.S. News &amp; World Report. http://t.co/ewJSgQVNz4 via @usnews,3,6
509100294845005826,2014-09-08 22:05:43,RT @DarlingtonTiger: Our AP Govt students can't wait to Skype with @SenatorIsakson on Thursday! Thanks to some great Darlington alumni for …,1,0
509090295309680640,2014-09-08 21:25:59,"RT @zpolitics: . @SenatorIsakson spoke from the Senate Floor on Truett Cathy ""Georgia lost a great citizen, great patriot."" https://t.co/jV…",5,0
509084708547080193,2014-09-08 21:03:47,"Humbled to pay tribute to the life of Georgia legacy Truett Cathy, founder of @ChickfilA &amp; lifetime public servant. http://t.co/5mxswSBTeW",7,5
509023498132815872,2014-09-08 17:00:33,On my way back to DC after a very busy &amp; productive few weeks traveling across Georgia. If only DC was as productive. http://t.co/BKh2LEQ1YL,3,8
508995999097163776,2014-09-08 15:11:17,Know young Georgians making a difference? Make sure they apply for a 2015 Prudential Spirit of Community Award: http://t.co/a4TfRHSWTS,2,5
508970534420643840,2014-09-08 13:30:06,"Georgia lost a legend with the passing of @Chickfila founder, Truett S. Cathy. His life was a fine example of service and hard work.",12,11
507972250252095488,2014-09-05 19:23:16,August was a productive month! A quick recap: http://t.co/BKh2LEQ1YL #gapol,1,2
507965077983866880,2014-09-05 18:54:46,"At Ft. Stewart w/@3rd_Infantry Commander, mayors of Savannah &amp; Pembroke and Bill Cathcart, @SECDEFUS civilian aide. http://t.co/M5LZ2PRwvK",1,4
507954755847880704,2014-09-05 18:13:45,Sen. Isakson: ISIS must be destroyed: http://t.co/LcBALi8PPw,6,4
507891478904209408,2014-09-05 14:02:19,"Full day ahead w/visit to Hinesville VA clinic, public town hall @HinesvilleGA City Hall at 10:45 AM, &amp; @3rd_Infantry at Ft. Stewart. #gapol",2,3
507627755312144384,2014-09-04 20:34:22,RT @SEGAFFSH: @SenatorIsakson visiting Hinesville City Hall 10:30-1130 am Sept. 5 to discuss veteran affairs. Join us in showing veterans w…,2,0
507606765022625794,2014-09-04 19:10:58,Great turnout at today's #townhall mtg at @CCGAtweets in Brunswick. Great to be here! #gapol http://t.co/c3g50KOukf,2,3
507570791660015616,2014-09-04 16:48:01,"Delighted to join @BGICOC at @epworthbythesea in #SSI to talk #WRRDA, coastal GA ports, #ISIS, #EPA &amp; more. #gapol http://t.co/AWuDsg3Blk",2,2
507547722451546113,2014-09-04 15:16:21,"Checking out the Titania (not a typo, thankfully for it), loaded &amp;ready to head out from Bwick port #GlynnCo @GaPorts http://t.co/s1AGvwPdZP",4,7
507544253757931520,2014-09-04 15:02:34,Touring Brunswick port w/ @GaPorts this AM to discuss economic benefits of #WRRDA to #GlynnCo &amp; #Georgia. #gapol http://t.co/dGptXdyLWp,1,4
507495806459736064,2014-09-04 11:50:03,"Golden Isles today! Lunch speech w/@BGICOC, touring Brunswick port &amp; 2:30PM town hall at College of Coastal Ga. @CCGAtweets  @GaPorts #gapol",3,6
507203503895617536,2014-09-03 16:28:33,Truly grateful for the chance to visit w/ @gavetsvc Commissioner Pete Wheeler yesterday. Thanks for your service! http://t.co/nogaGZ9I84,1,5
506889380393656321,2014-09-02 19:40:20,The United States has a vital interest in stopping the Islamist militants violently grabbing territory in Iraq and Syria. #gapol #isis,4,6
506887618232336384,2014-09-02 19:33:20,We need to send a clear message to the Middle East and the rest of the world. There’s only one way you deal with #ISIS: You kill them.,62,46
506887293362520064,2014-09-02 19:32:02,Our hearts and prayers go out to the family of American journalist Steven Sotloff and all that have suffered at the hands of #ISIS.,6,9
506884956346671104,2014-09-02 19:22:45,RT @AtlBizChron: .@SenatorIsakson urges tough stand against #ISIS http://t.co/8dYFXGRy3L #gapol #Iraq #Syria,4,0
506877529488392192,2014-09-02 18:53:15,Had an informative tour of Atlanta @DeptVetAffairs. Now sitting down for a briefing w/ VA director and personnel. http://t.co/CJRlXWpyAe,4,8
506849395271553024,2014-09-02 17:01:27,"Talking about the top two threats to our country today - ISIS, our tax code - with @kiwanisatlanta today. #gapol http://t.co/iqoPcncqLj",2,3
506797949708673025,2014-09-02 13:37:01,"I will speak to the Kiwanis Club of Atlanta today at Noon about threats to our national security- incl. terrorism, debt &amp; deficit. #gapol",3,2
506509483133374466,2014-09-01 18:30:45,"Thank you for participating! ""@LeahWood3 @SenatorIsakson Really enjoyed getting to hear you speak at YHC! Thanks for answering my question!""",1,2
506492438056534017,2014-09-01 17:23:02,Look forward to visiting coastal GA later this week. Town halls in Brunswick on Thurs. &amp; Hinesville on Fri.: http://t.co/hG7mv5mGEP #gapol,2,4
506428303058956288,2014-09-01 13:08:11,My pleasure! Thanks for being such a great group! RT @JSkyPruitt: Thank you @SenatorIsakson for coming to YHC to host the Town Hall meeting.,0,6
505845364159959040,2014-08-30 22:31:47,#godawgs http://t.co/TTvjFV0pP2,9,5
505402201918152704,2014-08-29 17:10:49,Great catching up with old friends Zell Miller &amp; Cathy Cox. And good luck to this freshman student running for SGA! http://t.co/wUWsHIlWlv,6,10
505383475286122496,2014-08-29 15:56:24,Thanks to @YH_College President @CathyCox15 for the sneak peak of the new campus center. http://t.co/5aNkOy9SsM,2,3
505373847366164480,2014-08-29 15:18:09,"Filming now for @universityofga's ""Living History "" project at @YH_College where I'll hold a town hall @ 1 PM. #gapol http://t.co/kcoAxbIIeU",4,4
505084969212211201,2014-08-28 20:10:15,"Great tour of Meggitt Training Systems in Suwanee yesterday! Supporting law enforcement, #military &amp; #defense. #gapol http://t.co/7mLdG63Pt3",2,3
505039818183966720,2014-08-28 17:10:50,RT @KPomey: @AtlantaOCA @SenatorIsakson @GWCC_ATL Best Places to Work Awards http://t.co/0q4miolVER …,1,0
505039200119701506,2014-08-28 17:08:23,What an honor to return to @roswellrotary and deliver remarks and take questions from members. #gapol http://t.co/NnKHqsL6wm,1,4
505039117550616577,2014-08-28 17:08:03,"Dr. Martin Luther King, an inspirational &amp; transforming Georgian, delivered his #IHaveADream speech 51 years ago today. His legacy lives on.",5,4
505038681280098306,2014-08-28 17:06:19,Happy to be here! RT @Roswell_Rotary: @SenatorIsakson gives our club his thoughts on the state of the union today. http://t.co/DscgRPBIlH,2,1
504699928669868032,2014-08-27 18:40:14,#townhall just getting started after a warm introduction from @UGAGriffin dean. http://t.co/hU0lU3C10A,4,5
504696413113315329,2014-08-27 18:26:16,Sitting down w @universityofga Pres. Morehead &amp; folks from @UGAGriffin before our #townhall mtg. #gapol #godawgs http://t.co/MMcuWuYvQ3,4,7
504677296624893954,2014-08-27 17:10:18,"More q's at Thomaston-Upton CoC lunch include #WIOA, #EPA, #VAreform,  hwy trust fund. Hope to get more great ?s tonight @UGAgriffin! #gapol",4,4
504673235041271808,2014-08-27 16:54:10,RT @MorrisNews: Isakson does a little cage rattling for #Savannah. @senatorisakson #gapol http://t.co/LR9NPcxqVy,2,0
504672886591074304,2014-08-27 16:52:47,"RT @AtlBizChron: .@SenatorIsakson: Biggest threats facing U.S. are #ISIS, federal spending http://t.co/CyO1TOSjBu #budget #gapol http://t.c…",6,0
504672562480414720,2014-08-27 16:51:29,RT @bissav: Isakson pushed river negotiations along - @MorrisNews http://t.co/yPNxC4sx3p #savannah @SenatorIsakson,1,0
504666203743584256,2014-08-27 16:26:13,Great to speak to the Thomaston-Upson Chamber lunch today at Upson Regional. #gapol http://t.co/Yi0pZXIWMU,4,5
504627631850270720,2014-08-27 13:52:57,Reminder that I'm hosting a town hall today @UGAGriffin in Room 104 of the Student Learning Ctr. from 2:30 - 3:30PM. Come on out! #gapol,2,2
504351260318109697,2014-08-26 19:34:45,Heard from employees of Meggitt Training Systems at Q+A forum after an excellent tour of the Suwanee facility. #gapol http://t.co/9GpkLB0sy1,0,1
504343254121578496,2014-08-26 19:02:56,"Miss my interview w/@MarthaZoller this AM? Hear it now: http://t.co/fSg31SaJe8. We talked ISIS, James Foley &amp; foreign policy; taxes. #gapol",1,2
504311452325675008,2014-08-26 16:56:34,Proud to join Gwinnett @rotary Club today. Thanks for the hospitality and for sharing your concerns with me. #gapol http://t.co/Z5XgIvQzZt,1,4
504308540048408577,2014-08-26 16:45:00,Thanks to Chuck for the warm welcome and introduction at Gwinnett @Rotary Club lunch! http://t.co/Iaa42mBLUZ,0,2
504286380143693824,2014-08-26 15:16:56,Heading to the Gwinnett @Rotary Club to give a Washington update and see some friendly faces in Duluth. #gapol #spaghettijunction,2,1
504009891926003712,2014-08-25 20:58:16,Check our more pics from my visit to @NCCA_Covington on their facebook page here: http://t.co/RzQ1Nxn4oj. #gapol http://t.co/2iS2OHYodC,1,2
503988397506306048,2014-08-25 19:32:52,"Great #TownHall today at @gpctweets in Covington. Questions on taxes, terrorism, EPA, immigration reform, etc. #gapol http://t.co/yNr9WDnKxR",6,7
503965596992937984,2014-08-25 18:02:16,"Honored to speak at Social Circle Rotary about the economy, #WIOA, #debtcrisis and turmoil in the middle east. #gapol http://t.co/Yg3oi4XUIY",3,4
503925392450011136,2014-08-25 15:22:30,"Outstanding group of students, teachers &amp; administrators at @NCCA_Covington. Thanks for a great visit! #gapol http://t.co/IB9F4iO6IU",3,3
503257595004850176,2014-08-23 19:08:55,We're just getting started at our #townhall mtg in Forsyth. Stop by if you're in the area. #gapol http://t.co/LX14HW40Cs,5,4
503205091370094594,2014-08-23 15:40:17,Terrific visit to @RobinsAFBase. Took a tour &amp; met w/ depot leadership to hear about major improvements taking place. http://t.co/yKwVjIk4zb,4,4
502926551806406657,2014-08-22 21:13:28,"Congratulations Moody AFB in Valdosta, Ga., on selection by @usairforce for critical new Afghan training mission! http://t.co/5aMEon8l81",1,1
502571136228818944,2014-08-21 21:41:10,Glory glory to ol' Georgia. #godawgs #ugalegretreat #latergram @ Sanford Stadium http://t.co/ob1KSmNn3K,1,5
502567982221254657,2014-08-21 21:28:38,"Great tour &amp; mini-townhall @AnheuserBusch in Bartow Co. Talked taxes, infrastructure &amp; water conservation efforts. http://t.co/woEldlcqlw",9,6
502538223693090820,2014-08-21 19:30:23,Enjoyed seeing @GeorgiaPower at work with Plant Bowen's water conservation efforts today. http://t.co/vOCxcZncyM,4,6
502509402277306370,2014-08-21 17:35:52,"Thank you Bartow Co.&amp; Calhoun, Ga. @Rotary for having me speak at your joint mtg. Appreciate the great questions. http://t.co/WGafenW4Ca",4,4
502470645914284032,2014-08-21 15:01:52,Congrats to @GeorgiaAquarium on your selection as #1 best aquarium in @USATODAY's Reader's Choice competition. http://t.co/Qb5KVDcVZ0,6,10
502452571584626688,2014-08-21 13:50:02,"Mark your calendar! Town hall meetings coming up in Monroe, Newton, Spalding &amp; Towns Counties. Details: http://t.co/FThF9mH0Ho #gapol",3,1
502173405136056320,2014-08-20 19:20:44,ICYMI: Editorial by @LedgerEnquirer taking note of my focus on @DeptVetAffairs &amp; commitment to #veterans http://t.co/YXYcAOQxLI #gapol,6,2
502103507726782464,2014-08-20 14:42:59,Thank you for having me! @BruceVanVreede @CohnReznick,2,2
501840586987421696,2014-08-19 21:18:14,"Great #TownHall mtg in #Augusta. Q's focused on #veterans, natl &amp; local issues. Thanks to all who came out! #gapol http://t.co/DnevZXzIR0",2,3
501811830206263296,2014-08-19 19:23:58,Rc'd briefing on cyber command transition @FGPAO--center of excellence! Thx MajGen Patterson for focus on integrity. http://t.co/DQzf2FR40s,1,1
501770464877105152,2014-08-19 16:39:35,@RepDougCollins and I just met w/ officials at Charlie Norwood @DeptVetAffairs to discuss #VAaccountability. #gapol http://t.co/TEWsbhOCU3,5,3
501739056653684736,2014-08-19 14:34:47,"Spoke to @gaemc in #Augusta this AM about #EPA overreach w/ coal standards, #DC update. Thanks for having me! #gapol http://t.co/pOFReTSPOT",4,2
501730265459617792,2014-08-19 13:59:51,Look forward to seeing everyone TODAY at my Augusta #TownHall meeting that I talked about w/ @AustinRhodes. DETAILS: http://t.co/FThF9mH0Ho,3,3
501459041902923776,2014-08-18 20:02:06,"#Augusta Have questions? Get answers tomorrow, Aug. 19! I'm hosting a town hall @ American Legion Post 205. More: http://t.co/FThF9mH0Ho",2,2
500371569181741057,2014-08-15 20:00:53,@13wmaznews story on my #Dublin town hall: http://t.co/Hmx3AVrCGT. Plan to attend a town hall near you! Schedule: http://t.co/S4BgzBgqfS,1,1
500302816691650561,2014-08-15 15:27:41,"Another from @FortBenning on Aug. 13 w/CoS Col. Marr @ McGinnis-Wickham Hall. Also pictured: my CoS,@jmkirchner http://t.co/vBeJC8l264",3,4
500294901251457025,2014-08-15 14:56:14,"Highlight of my day! Ga.'s rep to @NtlAmericanMiss Jr. Pre-Teen 2014, 9 year-old honor student Gabriela Norwood. http://t.co/jVk5sQFuu5",8,16
500286406611460096,2014-08-15 14:22:28,#AUGUSTA:Mark your calendars to attend my Town Hall on 8/19 after I visit @FGPAO &amp;Charlie Norwood #VA. Info: http://t.co/x8Lae7BEpt #gapol,4,2
500269865421512704,2014-08-15 13:16:45,Thanks @DC_Chamber for welcoming me to your Chairman’s Club. Enjoyed your questions &amp; look forward to visiting again! http://t.co/w2ScIxaN6b,5,6
500031182021857280,2014-08-14 21:28:18,"TUNE IN: Tonight at 11pm, watch @13wmaznews' coverage of my day in #Dublin that ended with a great #townhall meeting. http://t.co/rZQylmsmXf",6,6
500019549350400000,2014-08-14 20:42:05,#Veterans #townhall meeting underway in Dublin at the Dublin-Laurens County Chamber of Commerce. #gapol http://t.co/oAP9Klg0iE,3,3
499999760104062977,2014-08-14 19:23:27,W/ senior management at Carl Vinson #VA in Dublin for a frank discussion on improving care for our #veterans. #gapol http://t.co/jFevu1YU4r,6,3
499999364472131585,2014-08-14 19:21:52,Just sat down with senior management of Carl Vinson @DeptVetAffairs in Dublin for a frank discussion on improving care for our veterans.,0,4
499996287128076288,2014-08-14 19:09:38,"Truly humbled to join #Georgia's veterans, Dublin community &amp; local, state leaders at Vietnam Moving Wall memorial. http://t.co/HhUNQ2whHC",6,3
499915960179236864,2014-08-14 13:50:27,Great to join @AustinScottGA08 @GaryBlack4Ag @GaFarmBureau at Commodity Conf @universityofga Tifton campus. #gapol http://t.co/gLYvMLxPuU,9,4
499665018804514817,2014-08-13 21:13:18,"Great briefing from @FortBenning CoS Col Marr &amp; others. Also a treat to get to watch the changing of the colors, too! http://t.co/Di0Gy9YToi",2,4
499629642484318208,2014-08-13 18:52:44,It was great to see where many of #Georgia's ATMs &amp; self checkout machines are made @NCRCorporation in #Columbus. http://t.co/dvg89r3157,3,2
499606921520111616,2014-08-13 17:22:27,On to my next stop in #Columbus to tour @NCRCorporation and meet with management and personnel. #gapol http://t.co/oJlZl2HRmB,3,5
499606064653148160,2014-08-13 17:19:02,Started off my day in #Columbus with a great visit to @wecareforlife to tour St. Francis' newest expansion. #gapol http://t.co/gqLjzS3Hka,6,6
499241698946740224,2014-08-12 17:11:11,Great visit! Sorry I missed you! @bertbrantley @GovernorDeal @SouthernBelleFa,1,1
499232997238132737,2014-08-12 16:36:36,"Appreciate the hospitality, peach ice cream &amp;tour from Jake, Jimmy, @GaFarmBureau at Southern Belle Farms. #gapol http://t.co/J9pPI7QXDE",6,9
499203249363484673,2014-08-12 14:38:24,Thanks to Ed Clark for a great meeting and drive around the track this morning at @amsupdates. #nascar #gapol http://t.co/cF1g6xLZz7,5,7
498971566773129216,2014-08-11 23:17:46,"RT @Braves: Get up for game time, let's go! http://t.co/ybK0bJ0eOe",178,0
497472817785733121,2014-08-07 20:02:17,"TOWN HALL SCHEDULE: Announcing three #TownHall mtgs for #Veterans, General Public in #Georgia this #August. http://t.co/uBu1ehWfTm #gapol",5,3
497471028948635648,2014-08-07 19:55:10,RT @MollieCromley: #throwbackthursday to D.C. What a wonderful experience! @SenatorIsakson @repjohnbarrow http://t.co/yK6nprPQFN,3,0
497418838594846720,2014-08-07 16:27:47,"Delighted to introduce US Poet Laureate, @universityofga grad &amp; @EmoryUniversity prof @Ntrethewey last night. http://t.co/S63yMlvinD",1,3
497417708171198465,2014-08-07 16:23:17,Pleased to introduce U.S. poet laureate Natasha Trethewey at the Cobb Library Foundation yesterday! http://t.co/S63yMlvinD via @mdjonline,1,1
497416445912154112,2014-08-07 16:18:16,ICYMI: Check out my op-ed on bringing value back to #VA and our #veterans http://t.co/qJT98FCD9h via @ajc #gapol,5,2
497119471794786304,2014-08-06 20:38:12,Tune in to http://t.co/yQIcBkXYzY now to hear my interview w/@AustinRhodes_. We'll be discussing #VA and my #TownHall in Augusta Aug. 19.,1,1
496641342446247936,2014-08-05 12:58:17,I'll be on w/ @timbonole at 9:05AM to discuss my August #Veteran-focused schedule in #GA. Tune in: http://t.co/pqAqUmQrq1 #Athens,7,1
496323768261021696,2014-08-04 15:56:22,"Great to see #Augusta, Ga.-born artist Jasper Johns' patriotic ""Three Flags"" on display in the #ArtEverywhereUS exhibit around the country.",1,3
494948068845162496,2014-07-31 20:49:49,Big thanks to BBQ1 &amp; Sam’s Lost Mountain #BBQ of Marietta for bringing a little taste of #GA to DC! #fingerlickingood http://t.co/q3HqNTeT1I,8,9
494943838126211072,2014-07-31 20:33:01,A great #seersuckerthursday at the Capitol. Always enjoy chatting with such sharp #Senate colleagues. #senateswag http://t.co/s9gXp5Qx5c,11,7
494853161002487808,2014-07-31 14:32:42,Thanks to all who called in to #WSBcareathon this morning and donated to @childrensatl. I look forward to my meet &amp; greet w/the winner.,6,8
494813439760814081,2014-07-31 11:54:51,"I'll be on at 8AM w/Butch &amp; Bob to talk about the Savannah Port, #VA issues &amp; more news from Washington. Tune in: http://t.co/K4Vt5ivcl8",3,4
494537125602557952,2014-07-30 17:36:53,"Pleasure mtg w/ Col. Chris Hill &amp; SSgt Katherine Bussey, Outstanding Airman of the Year, from @RobinsAFBase! http://t.co/SZietLR72B",2,4
494152418691923968,2014-07-29 16:08:12,Great mtg w/ the @NatlParkService's SE Reg. Dir. to discuss efforts to protect &amp; preserve #Georgia's natl landmarks. http://t.co/XXmZBy2eBX,2,4
493443334451384320,2014-07-27 17:10:33,RT @ANHQDC: NEXT on ANHQ: @SenatorIsakson live on #VAreform and the @DeptVetAffairs nominee tune in to @ANHQDC !,6,0
493440764118978560,2014-07-27 17:00:20,Getting ready to join @ShannonBream on @FoxNews' @ANHQDC in a few mins to discuss reforming the VA and returning accountability to our vets.,5,3
493413033025081344,2014-07-27 15:10:08,Tune in to @FoxNews at 1:10PM. I'll be on w/host @ShannonBream to discuss #VA reform and @DeptVetAffairs nominee.,8,4
493388323118153728,2014-07-27 13:31:57,"Big congrats to @Braves greats @gregmaddux &amp; @Tom_Glavine today on induction into @BaseballHall, but esp. to my friend, legendary Bobby Cox!",6,13
493146311949307904,2014-07-26 21:30:17,I'll be on @FoxNews tomorrow at 1:10PM w/host @ShannonBream to discuss #VA reform and @DeptVetAffairs nominee.,11,8
