id,created_at,text,retweets,favorites
392654328143831040,2013-10-22 14:11:01,Headed to Women's Economic Forum in Prince George's w @repdonnaedwards &amp; @NancyPelosi to talk moving women &amp; families forward.,5,3
391236534420393984,2013-10-18 16:17:13,"RT @baltimoresun: Behind the scenes, @SenatorBarb &amp; @SenatorCardin pressed for 1% raise for federal workers. http://t.co/iCfx0KdlTL",7,0
390931772772737024,2013-10-17 20:06:12,Will join @MartinBashir on @MSNBC at 4:10pm to talk work of Senate women to end shutdown &amp; get us back on track.,10,4
390884062476660736,2013-10-17 16:56:37,RT @SenateApprops: Letter from NDIA to @SenatorBarb on need to end #sequester &amp; return to regular order to properly fund our military http:…,3,0
390806371467558912,2013-10-17 11:47:54,Theyve been target of unending attacks.   Federal employees should never be scapegoat in fight over deficit reduction http://t.co/T6aw9NOXFg,19,15
390805543314792448,2013-10-17 11:44:36,Fought hard for federal employees to protect first COLA in 3yrs &amp; back pay for those furloughed thru no fault of own. In bill to reopen govt,16,9
390804637005414400,2013-10-17 11:41:00,Proud to have fought on front lines for federal employees as hard as they fight each and every day on the front lines for America.,19,11
390804451650727936,2013-10-17 11:40:16,"Americans want gov't 2 work as hard as they do. Bipartisan agreement means we reopen govt, pay bills on time, move ahead w longterm solution",6,3
390617221938311168,2013-10-16 23:16:17,Great to talk w @WUSA9 on moving forward to reopen our government &amp; allowing federal employees back on the job http://t.co/NyhCxrcSk2,10,2
390589412700336128,2013-10-16 21:25:47,"Today spoke w @WolfBlitzer on bipartisan agreement to reopen government, pay our bills on time &amp; get America rolling http://t.co/Xil4ldDA1w",3,1
390569331601715200,2013-10-16 20:05:59,"RT @SenateApprops: Letter by @AIAspeaks on need to address #shutdown, debt limit &amp; sequester to properly fund national security efforts htt…",9,0
390562192569155584,2013-10-16 19:37:37,RT @SenateApprops: At approx 3:45PM Chairwoman @SenatorBarb to speak on bipartisan Senate deal to reopen govt &amp; avoid default. Watch http:/…,9,0
390508430123102209,2013-10-16 16:03:59,Will talk w @WolfBlitzer on @CNN at approx 12:20pm on Senate women working together to end shutdown &amp; move our country forward.,8,3
390189496060637184,2013-10-15 18:56:39,RT @SenateApprops: At approx. 3PM Chairwoman @SenatorBarb will speak on the Senate floor about the impacts of a debt default. Watch live ht…,4,0
388316111470886912,2013-10-10 14:52:30,"Headed to Senate floor to talk disastrous impacts of shutdown on Maryland, nation and the world. WATCH http://t.co/QnKzXQfUpd",12,3
388310012395024384,2013-10-10 14:28:16,"On steps of US Capitol, called on House GOP to reopen gov’t, make sure America pays its bills &amp; negotiate. http://t.co/QakSgaNTWW",10,5
388307224269185024,2013-10-10 14:17:11,"Furloughs mean people who process disability checks, process eligibility for Social Security, and go after waste &amp; fraud aren’t on the job.",10,3
388304929724858368,2013-10-10 14:08:04,FDA located in MD but serving nation &amp; world making sure drugs are safe. Shutdown means 45% of employees have been furloughed.,10,1
388302791456063488,2013-10-10 13:59:34,"Due to shutdown, small businesses throughout MD near federal facilities are stressed &amp; stretched without as many customers.",8,2
388300762578976768,2013-10-10 13:51:30,"MD is home to headquarters for 20 major federal agencies, from Social Security Administration to FDA.",10,3
388298855374409728,2013-10-10 13:43:56,"In MD, shutdown means 130,000 federal employees who live &amp; work here can’t do their jobs for Maryland and the nation http://t.co/QakSgaNTWW",14,1
387980004547887104,2013-10-09 16:36:56,"Let's reopen government, let's pay our bills on time &amp; let's negotiate so we can get America rolling again.",31,7
387979907550437376,2013-10-09 16:36:32,"On steps of U.S. Capitol, stood w Senate Democrats to call for end to Tea Party shutdown. http://t.co/F3r4stlpgi",25,8
387757161650331648,2013-10-09 01:51:26,RT @SenateApprops: .@SenatorBarb rebuts inaccurate Republican talking points &amp; calls for immediate vote in the House on Senate-passed CR ht…,18,0
387600685686349824,2013-10-08 15:29:39,RT @SenateApprops: At approx. 12PM @SenatorBarb will speak on the need to end the government #shutdown immediately. Watch live on @cspan ht…,4,0
386906999528910848,2013-10-06 17:33:11,"A short-term, clean CR to fund the gov't has the votes to pass the House. Time for the House to vote.",43,13
386604822264553472,2013-10-05 21:32:27,Cosponsored bill to ensure federal employees taken off job through no fault of their own receive pay they were promised when we hired them,20,12
386593269620416512,2013-10-05 20:46:32,"Because of shutdown, private sector partner Lockheed Martin will furlough 3K workers keeping our country safe &amp; our economy strong.",40,6
386577109315227648,2013-10-05 19:42:19,Shutdown having real impacts in real communities. Hurts federal employees standing up for America. Hurts private sector partners &amp; jobs.,18,3
386556323611303936,2013-10-05 18:19:44,"Tea Party shutdown means triad of public health - NIH, CDC, FDA - shuttered. Puts health and well-being of families on the line",30,4
386543049889030144,2013-10-05 17:26:59,"Tea Party shutdown hurting our economy, hurting families &amp; hurting jobs.",11,6
386527532222541824,2013-10-05 16:25:19,This week heard from Amy who works at weather service in MD. All she wants is to get back on the job protecting US http://t.co/hluzFrfRZ5,6,0
386516047534489600,2013-10-05 15:39:41,"As storm clouds gather in South, a tropical storm on way. Political storm clouds here means don't have full team in place at weather service",12,2
386157234511941632,2013-10-04 15:53:53,"Enough is enough. Standing w patients &amp; families to call on @SpeakerBoehner to allow House vote on clean, short-term CR to get America going",19,6
386156583820210176,2013-10-04 15:51:18,"Disastrous GOP shutdown putting America’s public health &amp; well-being of families at risk, shuttering  NIH, CDC &amp; FDA.",9,2
386156410914209792,2013-10-04 15:50:37,"W/ @SenatorHarkin, @Stabenow, @AmyKlobuchar, @MarkeyMemo, doctors &amp; patients 2 talk GOP shutdown impacts to health http://t.co/3YxenPBicd",18,5
386146274913054720,2013-10-04 15:10:20,On my way to join w doctors &amp; families to talk disastrous impacts of GOP shutdown hurting public health,5,4
385808353240555520,2013-10-03 16:47:34,"RT @SenateApprops: .@SenatorBarb Need all 3 agencies to process a veteran's claim. Without opening the entire government, we place our vets…",10,0
385808320046825472,2013-10-03 16:47:26,"RT @SenateApprops: .@SenatorBarb Other side says, we're going to fund veterans' benefits. But you cannot fund vets' benefits w/o reopening …",10,0
385808154954838016,2013-10-03 16:46:46,RT @SenateApprops: .@SenatorBarb Piecemeal does not work. You cannot do this one agency at a time. We need an open government. #NoShutdown,11,0
385808138995503104,2013-10-03 16:46:42,RT @SenateApprops: .@SenatorBarb The Senate CR would reopen the govt for 6 weeks while we work out fiscal problems. The House solution is t…,8,0
385476324338704384,2013-10-02 18:48:12,RT @SenateApprops: .@SenatorBarb The American people want a government that works as hard as they do. And so do I.,11,0
385476287953117184,2013-10-02 18:48:03,"RT @SenateApprops: .@SenatorBarb instead of working hard to serve our veterans &amp; elderly, or promote a growing economy, here we are in a #s…",8,0
385466986572312576,2013-10-02 18:11:05,We need to work as hard to open the federal gov’t as our federal employees work every day for America http://t.co/jGN8dQvb2U,13,4
385457070465888256,2013-10-02 17:31:41,"Social Security Admin employees in MD &amp; across country make sure seniors get their checks on time, but now 18,000 have been furloughed",18,2
385456927746293760,2013-10-02 17:31:07,Federal employees @NIH work hard to find new cures for diseases &amp; meet compelling human need. 74% of these workers have been told to go home,16,1
385456754987126785,2013-10-02 17:30:26,"Employees at @NOAA &amp; @usNWSgov design new weather models so we’re not swept away during hurricanes, protecting lives &amp; property.",8,2
385456276807094272,2013-10-02 17:28:32,Met w Amy from Weather Service in Silver Spring who works on frontlines building weather models to keep us safe. http://t.co/m9CpSp66YS,0,1
385455246224683009,2013-10-02 17:24:26,"House needs to take up clean, short term CR so we can reopen gov’t, find path forward, keep federal employees working &amp; keep America safe!",19,4
385455081040408576,2013-10-02 17:23:47,W @SenatorCardin  @SenatorWarner @SenatorBoxer &amp; furloughed fed employees called on House 2 act &amp; reopen our gov't! http://t.co/JwFkxfpbom,13,3
385186027221958656,2013-10-01 23:34:39,"RT @SenateApprops: .@SenatorBarb We don’t need a gag rule in the House, open up the House for a vote to open up the govt. #EnoughAlready ht…",10,0
385158477238521856,2013-10-01 21:45:11,Spoke today w @WBALtv11 on disastrous government shutdown &amp; need for Congress to act on clean funding bill http://t.co/L0evpABhax,11,9
385127749587062784,2013-10-01 19:43:05,RT @SenateApprops: .@SenatorBarb Let's reopen the govt. Let's reopen the govt of the United States of America. The way to reopen the govt i…,9,0
385106600383762432,2013-10-01 18:19:03,"RT @SenateApprops: .@SenatorBarb I implore the House to pass the clean CR that the Senate sent over four days ago, so we can reopen the gov…",16,0
385103553440018432,2013-10-01 18:06:56,"RT @SenateApprops: At approx. 2:15PM, @SenatorBarb will discuss the Continuing Resolution on the Senate floor. Watch live on @cspan http://…",2,0
384883451289038848,2013-10-01 03:32:20,"RT @DSenFloor: .@SenatorBarb: But to go to conference w/o the CR is, again, a hollow action that once again wastes time and wastes the coun…",13,0
384864075420692480,2013-10-01 02:15:20,"RT @missyrentz: Kudos to @SenatorBarb, @lisamurkowski &amp; @SenatorShaheen.  I hope your heartfelt statements are heard.",9,0
384847243687108608,2013-10-01 01:08:27,"RT @SenateApprops: .@SenatorBarb As POTUS said, #shutdown is being induced by 1 faction in 1 party in 1 House of our gov't over 1 issue htt…",16,0
384846844829769728,2013-10-01 01:06:52,"RT @SenateApprops: .@SenatorBarb Let's pass a simple, straightforward CR to keep the gov't open. We can do it. There's the will. We just ne…",10,0
384772224580063233,2013-09-30 20:10:21,"Last Friday, the Senate passed a clean bill to keep govt open. Will pass House if Speaker Boehner allows a vote. Let the House vote!",37,1
384751618455273474,2013-09-30 18:48:28,"I say to my colleagues on the other side of the dome, let's pass a clean CR that funds government through Nov 15 - let's find middle ground",14,9
384466596020109312,2013-09-29 23:55:54,House Republican plan says that simply being a woman can be considered a pre-existing condition for another year.,80,21
384460223689527296,2013-09-29 23:30:34,"RT @PattyMurray: Once again, House GOP has found a way to mount an ideological attack on women's health as the clock ticks down on a crisis…",285,0
384460109256335360,2013-09-29 23:30:07,"Maybe House Republican think women can wait another year for impt health care, but I don't.",32,13
384455323018620929,2013-09-29 23:11:06,House GOP plan allows employers &amp; insurers the right to deny coverage of impt women's preventive health care like mammograms,96,5
384454920143138816,2013-09-29 23:09:30,"RT @SenatorBoxer: If #GOP gets its way, women will lose access to affordable birth control &amp; checkups where they can be screened for breast…",142,0
384454702269997056,2013-09-29 23:08:38,House Republicans have said loud &amp; clear that women should have to wait another year before we end gender discrimination in health insurance,95,25
384454558841569281,2013-09-29 23:08:04,"As House GOP holds our economy hostage, they are again playing political games with women's health",23,7
384404803876450304,2013-09-29 19:50:21,"RT @SenateApprops: A shutdown is bad for your health: @CDCgov labs will be closed, leaving State labs and hospitals on their own @SenatorBa…",16,0
384348639306321920,2013-09-29 16:07:11,"RT @SenateApprops: In a shutdown, 28M small businesses would no longer have access to Federally-assisted loans &amp; technical assistance @Sena…",13,0
384322687734009856,2013-09-29 14:24:03,"RT @SenateApprops: Disappointed House chose shutdown, slamdown politics that threaten our jobs &amp; economic recovery over clean CR. @SenatorB…",11,0
384069610007318529,2013-09-28 21:38:25,RT @SenateApprops: Shutdown is bad for health: 55% of @US_FDA staff would be furloughed &amp; FDA would stop monitoring imports at borders @Sen…,55,0
384057961733054464,2013-09-28 20:52:08,"RT @SenateApprops: Not all protecting the US are soldiers. 1/2 of @DeptofDefense 800,000 civilian workforce will be furloughed w/o pay @Sen…",32,0
384023148556869632,2013-09-28 18:33:48,RT @SenateApprops: 1.4 million active duty military &amp; their families would have pay delayed. This is unacceptable says @SenatorBarb #NoShut…,12,0
384007990921023488,2013-09-28 17:33:34,RT @SenateApprops: The inventory &amp; backlog of VA claims will grow - veterans will be forced to wait even longer to collect benefits @Senato…,9,0
383993178497376257,2013-09-28 16:34:42,"RT @SenateApprops: Furloughs @ @SocialSecurity offices will delay basic services for 180,000 who visit/445,000 who call SSA every day @Sena…",9,0
383967275432177664,2013-09-28 14:51:46,RT @SenateApprops: Chairwoman @SenatorBarb urges House to keep gov't open and not throw sand in the gears of America #NoShutdown,2,0
383959179288776704,2013-09-28 14:19:36,"RT @SenateApprops: A govt shutdown is bad for your health: 70% of  @NIH's 19,000 employees will be furloughed. @SenatorBarb #NoShutdown",13,0
383619979733913600,2013-09-27 15:51:45,Today I’ll vote to pass clean Senate CR that clears out toxic political riders so we can work towards long term solutions.,10,8
383613577212747776,2013-09-27 15:26:18,"Need to end gridlock, deadlock, hammerlock &amp; move our country forward.",17,6
383613409641918464,2013-09-27 15:25:38,Here we are less than 4 days from a government shutdown &amp; House GOP continues to put US through manufactured crisis,12,4
383613074110185472,2013-09-27 15:24:18,On Senate floor this morning continued fight against a disastrous government shutdown that would hurt families &amp; hurt jobs,3,2
383612872414486528,2013-09-27 15:23:30,RT @SenateApprops: .@SenatorBarb our goal is to send the House a CR stripped of ideological riders that keeps gov't funded until Nov 15 htt…,5,0
383290366159761408,2013-09-26 18:01:59,"RT @SenateApprops: .@SenatorBarb When all is said and done, more gets said than gets done. Now is the time to act. #NoShutdown",9,0
383289642445189120,2013-09-26 17:59:06,"RT @SenateApprops: .@SenatorBarb You can huff and puff for 21 hours, but you can't be like the magic dragon that blows the Affordable Care …",12,0
383289144774238208,2013-09-26 17:57:07,RT @SenateApprops: .@SenatorBarb Amendment prevents a gov't shutdown &amp; removes controversial policy riders so people who need healthcare ca…,6,0
383249733810008064,2013-09-26 15:20:31,RT @DSenFloor: .@SenatorBarb: We're ready to move. But we can't move if we have the theatrical showdown politics.,2,0
383040689648320512,2013-09-26 01:29:51,RT @SenateApprops: .@SenatorBarb amendment to House CR clears out toxic political items/riders &amp; shortens CR duration #NoShutdown http://t.…,9,0
383013216055349248,2013-09-25 23:40:41,"Thanks to Obamacare, 48,000 MD young adults were able to stay covered on their parents plan until age 26. #getcovered  ",13,14
383003272753061888,2013-09-25 23:01:10,"With new preventive care coverage, 485,000 MDers on Medicare were able to get an annual health checkup. #getcovered  ",3,0
382988154753400832,2013-09-25 22:01:06,"By eliminating the doughnut hole, 72,000 MDers were able to save $700/yr to pump back into MD’s economy. #getcovered  ",5,2
382981365261942785,2013-09-25 21:34:07,"We must get rid of this brinksmanship, slamdown, slapdown, showdown politics. #getcovered",11,4
382981280746729472,2013-09-25 21:33:47,"Time to get rid of theatrical politics &amp; get into real business of providing jobs, economic opportunity &amp; ensuring our security. #getcovered",17,6
382980870954835969,2013-09-25 21:32:09,Republicans want to shut down the government just to go back to the days when health insurance companies were in charge. #getcovered,8,4
382949764876075008,2013-09-25 19:28:33,At 3:45 –will speak on Senate floor for 42 million Americans who have no healthcare but have hope because of Obamacare-watch live on CSPANII,10,6
382935252231933952,2013-09-25 18:30:53,Today- 3:45 pm on CSPANII: Watch my Senate floor speech on why I oppose defunding Obamacare &amp;taking away healthcare from those who need it  ,9,3
382873550639861760,2013-09-25 14:25:42,"Thanks to Obamacare, simply being a woman is no longer a preexisting condition &amp; we’re going to fight for that.",24,7
382873530029076480,2013-09-25 14:25:37,"I fought to ensure women have coverage like maternity care, prenatal care &amp; preventive screenings like mammograms.",17,7
382873303691825152,2013-09-25 14:24:43,"As Dean of Senate Women, will be joined by Senate women along w new mothers to fight GOP plan to roll back women’s health coverage.",15,1
382187586691006465,2013-09-23 16:59:56,I'm continuing to fight for military construction jobs so Maryland BRAC jobs stay in Maryland,2,0
382187460966772736,2013-09-23 16:59:26,Maryland's military &amp; security assets make our nation safer &amp; MD's economy stronger,2,0
382187409443524609,2013-09-23 16:59:13,This morning met w MD Military Installation Council to talk military construction jobs http://t.co/AI1z62Utoo,2,1
382184331743363072,2013-09-23 16:47:00,RT @SenateApprops: The @NIHClinicalCntr will not admit new patients or initiate clinical trials in a government shutdown #NoShutdown @Senat…,9,0
382164896223211521,2013-09-23 15:29:46,"RT @SenateApprops: Under a government shutdown, thousands of children will lose access to school readiness programs #NoShutdown @SenatorBarb",5,0
381877949508890624,2013-09-22 20:29:32,"New hotline set up for victims, witnesses &amp; survivors of Navy Yard tragedy to connect to crisis &amp; trauma counseling: Call 1-866-962-5048",17,3
381877555977940993,2013-09-22 20:27:58,Am here at memorial service with our MD families who lost their loved ones. Expressing our deepest sympathies and condolences.,9,1
381873196129341441,2013-09-22 20:10:39,"And to thank our local &amp; federal law enforcement who were first on the scene &amp; took control of terrible, horrific situation",4,4
381865240717430784,2013-09-22 19:39:02,I join with all Americans in expressing my deepest condolences to all the families of those killed at the Navy Yard.,6,5
381855471982088192,2013-09-22 19:00:13,Headed to memorial in Washington w Pres Obama for those affected by senseless tragedy at Navy Yard.,4,6
381849515956793344,2013-09-22 18:36:33,RT @SenateApprops: Chairwoman @SenatorBarb will work in Senate next week to keep the gov’t open so it meets day-to-day and long range needs…,10,0
381849436868997121,2013-09-22 18:36:14,"RT @SenateApprops: Shutting down the government hurts the middle class -- it threatens our country’s economic growth, jobs and national sec…",11,0
381844395252666368,2013-09-22 18:16:12,RT @SenateApprops: House CR puts political ideology ahead of country. They want to shut down the govt b/c we won’t take away people’s healt…,13,0
381780975497519104,2013-09-22 14:04:12,"RT @SenateApprops: ICYMI: ""We must end sequester"" @SenatorBarb. FBI agents will face furloughs of ten days if we don’t #fixsequester @FBIPr…",4,0
381548139368710144,2013-09-21 22:38:59,"RT @SenateApprops: ""We must end sequester"" @SenatorBarb. 1.3 million fewer students will be served by Title I next year if we don't #fixseq…",11,0
381531669859434496,2013-09-21 21:33:33,"RT @SenateApprops: ""We must end sequester"" @SenatorBarb. @HeadStartgov would serve 177,000 fewer children next year if we don’t #fixseqeust…",8,0
381523685875933184,2013-09-21 21:01:49,RT @SenateApprops: Support for transit systems around the country would be underfunded by $134 million next year if we don’t #fixseqeuster …,8,0
381497340739473408,2013-09-21 19:17:08,"RT @SenateApprops: ""We must end sequester"" @SenatorBarb. Critical work on our nation’s bridges would be cut by $500 million next year if we…",6,0
381491723790471168,2013-09-21 18:54:49,"RT @SenateApprops: ""We must end sequester"" @SenatorBarb. Repairs to highways would face a $636 million shortfall next year if we don’t #fix…",3,0
381463962770239488,2013-09-21 17:04:30,"RT @SenateApprops: As many as 500,000 fewer infants, children &amp; women would receive nutrition support if we don’t #fixseqeuster @SenatorBarb",9,0
381454603323449344,2013-09-21 16:27:19,"RT @SenateApprops: ""We must end sequester"" @SenatorBarb. @NSF would provide 1,500 fewer grants to keep America first in science if we don’t…",7,0
381434078790438912,2013-09-21 15:05:45,"RT @SenateApprops: ""We must end sequester"" @SenatorBarb. @NIH would receive $2 billion less for research--meaning 1,300 fewer grants if we …",10,0
381421570532470784,2013-09-21 14:16:03,RT @SenateApprops: FBI agents will face furloughs of ten days if we don’t #fixsequester @FBIPressOffice,9,0
381420563895689216,2013-09-21 14:12:03,"On Senate floor, I spoke with a heavy heart for victims of Navy Yard tragedy – including 6 Marylanders killed http://t.co/PiTa78rDRK",2,1
381179136527855616,2013-09-20 22:12:42,"My thoughts &amp; prayers are will the victims, their families &amp; all those affected by this terrible, senseless act.",3,0
381179059398782976,2013-09-20 22:12:24,"On Sunday I’ll join Pres Obama, Navy community &amp; affected families at a memorial for victims of Navy Yard tragedy.",10,4
381084159810498560,2013-09-20 15:55:18,"RT @SenateApprops: “Today’s action by the House is a defeat for our economy, jobs, &amp; our national security."" @SenatorBarb on House CR http:…",6,0
380826927965036544,2013-09-19 22:53:09,I’m proud to stand w @AmeriCorps volunteers to applaud service &amp; kick off next 20 yrs of supporting communities! http://t.co/ehjgier7Lj,13,5
380826749229342721,2013-09-19 22:52:27,"I fought to establish AmeriCorps, have worked to strengthen it &amp; expand opportunities because I believe in neighbor helping neighbor",5,5
380826523928117249,2013-09-19 22:51:33,"Volunteers mentor children, support vets, promote health, respond to disasters &amp; increase economic opportunities",3,0
380826352641122304,2013-09-19 22:50:52,Over 800K @AmeriCorps volunteers have served more than 1 billion hrs of community service in past 20 yrs,7,2
380826247917735936,2013-09-19 22:50:27,Congrats to @AmeriCorps &amp; @NationalService on 20 years of serving families &amp; communities across America! #AmeriCorps20,25,3
380819029579288576,2013-09-19 22:21:46,I believe in America no one should have to choose between paying rent &amp; putting food on the table,43,9
380818870518693888,2013-09-19 22:21:08,"Deeply disappointed by House GOP vote to slash crucial nutrition assistance for children, families &amp; seniors who need it most.",28,8
380352825273745408,2013-09-18 15:29:14,Great day at Spaceport Wallops! Launching cargo to the Space Station and jobs on the Eastern Shore http://t.co/8fyycm5VUA,14,4
380352538219773952,2013-09-18 15:28:06,Great day at Spaceport Wallops! Launching cargo to the Space Station and jobs on the Eastern Shore http://t.co/NmzZIGcU0S,4,4
380329781260062720,2013-09-18 13:57:40,"Great having support: @SavetheChildren, @AmerAcadPeds &amp; @Easter_Seals for bill making critical reforms to child care! http://t.co/0OZJaub6Dd",3,3
380329244464648192,2013-09-18 13:55:32,"As a social worker, I know importance of quality child care for kids &amp; families.  ",6,2
380327102270029824,2013-09-18 13:47:01,"Every working parent with children worries about child care that’s affordable, accessible &amp; safe",5,2
380326934070042625,2013-09-18 13:46:21,"This morning headed to HELP Cmt markup of bipartisan CCDBG bill I intro’d to revitalize, refresh &amp; reform child care",2,0
380018441413210113,2013-09-17 17:20:31,RT @RmazeTns: Tough words from @SenatorBarb about VA's Baltimore claims office after @AmericanLegion complaint http://t.co/3GhAWQr1cr,7,0
380018269631295488,2013-09-17 17:19:50,"RT @AmericanLegion: ,@SenatorBarb demands @DeptVetAffairs fix Baltimore #claims office following Legion testimony to @HouseVetAffairs. http…",13,0
379728555397361664,2013-09-16 22:08:37,Announced Ft Meade as partner in Healthy Base Initiative serving as model healthy base worthy of military families http://t.co/oshsbdlbek,2,1
379728336278523904,2013-09-16 22:07:45,New Wellness Center will help our military &amp; their families  be fit for duty as best fighting force &amp; best family support they can be.,3,0
379728227063058433,2013-09-16 22:07:19,Today at Fort Meade helped cut ribbon on new state of the art Army Wellness Center http://t.co/NDTOpvru7R,5,0
379668317625393152,2013-09-16 18:09:15,"My thoughts are with those wounded, killed and impacted at the Navy Yard. My thanks are with the first responders.",13,3
379668083604205569,2013-09-16 18:08:19,"Deepest condolences &amp; support for the victims, including law enforcement, of today's Navy Yard shooting.",9,1
