id,created_at,text,retweets,favorites
463750411963211777,2014-05-06 18:41:28,"Today at 3:00 pm ET, SFRC hearing on ""Countering Russian Intervention and Supporting a Democratic State” in #Ukraine: http://t.co/rtXSlNjjBE",2,3
463728114963447808,2014-05-06 17:12:53,"This afternoon, Senator Corker asked the Tennessee Hospital Association how #Obamacare is affecting their patients. http://t.co/xtYOrBH5Oz",7,3
463666861331460096,2014-05-06 13:09:28,RT @TNELECTRIC: Thanks to @SenAlexander and @SenBobCorker for your support of rural #Tennessee  #CoopsInDC http://t.co/RMFd1XSja2,9,0
463444706190712832,2014-05-05 22:26:43,Corker on @TheLeadCNN: “No Question” #Russia’s meddling in #Ukraine meets Obama’s threshold for tougher sanctions http://t.co/CxC0F9t6Lf,18,10
463409114542911488,2014-05-05 20:05:17,Happening now: Sen. Corker joins @jaketapper on @TheLeadCNN to discuss the latest on #Ukraine and #Russia. http://t.co/AhMWbqaJVD,6,2
463394693750210560,2014-05-05 19:07:59,Sen. Corker will be on @TheLeadCNN today at 4:00 p.m. ET to discuss the latest on the crisis in #Ukraine.,12,4
462357436502777856,2014-05-02 22:26:17,Sen. Corker tells fellow Tennessean @iamkidpresident: “Let’s keep bringing people together.” http://t.co/Z9ovRAdBXk http://t.co/0JNmVhdJ3j,22,12
462303219407147008,2014-05-02 18:50:51,“Imposing sanctions after the damage has been done doesn't seem to be constructive in yielding the right outcome.” http://t.co/4GVg9IOmsh,7,2
462303152860319744,2014-05-02 18:50:35,Corker “deeply concerned” about Obama Administration’s “tepid &amp; hesitant” response to Russian actions in #Ukraine http://t.co/4GVg9IOmsh,11,2
462301119696629760,2014-05-02 18:42:30,Corker statement on jobs report released today by the Department of Labor: http://t.co/Oo0ibdEmtf,1,3
461611645304049664,2014-04-30 21:02:47,Corker: Our legislation takes a three-prong approach to prevent the situation [in Ukraine] from becoming far worse http://t.co/pexb7cEd5x,13,6
461574174834958336,2014-04-30 18:33:53,Sen. Corker + 20 senators today introduced legislation to deter Russian aggression in Europe http://t.co/pexb7cEd5x,7,4
461553657331580928,2014-04-30 17:12:21,"MT @KellyO: ""We purposely crafted this [bill] as if we were sitting in the White House."" @SenBobCorker says Russia bill could attract Dems",5,2
461535230726123520,2014-04-30 15:59:08,"At noon, Sen. Corker and a group of @Senate_GOPs will intro legislation providing a strategic U.S. response to Russian aggression in Europe.",3,3
461524630482997249,2014-04-30 15:17:01,Reports show Fan &amp; Fred could require $190 billion from taxpayers during a future crisis. Time to act on #GSEreform http://t.co/qvdahDYVrX,7,2
461506869383946242,2014-04-30 14:06:26,RT @mikecatalini: Corker says he and others are introducing legislation to strengthen NATO and deter Russia from its actions in Ukraine.,6,0
461504720193216512,2014-04-30 13:57:54,"RT @ArletteSaenz: Corker says Obama administration's foreign policy tactics are ""creating danger for U.S. citizenry and creating danger thr…",8,0
461247501983428608,2014-04-29 20:55:48,Sen. Corker met with two @RhodesCollege students this afternoon to discuss the importance of undergraduate research. http://t.co/AjoXrmEZ56,7,2
461244138604990465,2014-04-29 20:42:26,Corker: No logical reason not to build #KeystoneXL pipeline http://t.co/jRGnKTxSem,12,6
461159117709905921,2014-04-29 15:04:36,Sen. Corker says he looks forward to continuing constructive talks to finalize #GSEreform bill: http://t.co/9U8nWSLqqn,6,1
461137507183509504,2014-04-29 13:38:43,My thoughts and prayers are with all those affected by the severe weather across Tennessee and other parts of the country last night. –BC,19,18
460889656390086656,2014-04-28 21:13:51,Corker &amp; Sen. @KellyAyotte call administration's latest sanctions on Russia “tepid” &amp; “just a slap on the wrist.” http://t.co/tlDgw75QDi,6,2
460819361616654337,2014-04-28 16:34:32,"RT @mitchellreports: .@SenBobCorker: ""I'm concerned that this tepid, cautious response creates possibilities of something bad happening."" -…",16,0
460816871827054592,2014-04-28 16:24:38,Live now: Sen. Corker now on @mitchellreports to discuss U.S. sanctions &amp; latest on crisis in #Ukraine http://t.co/KeZquSvQ0A,5,1
460812645176582144,2014-04-28 16:07:50,Watch Sen. Corker on @mitchellreports today at 12:20 p.m. ET discuss the latest on the crisis in #Ukraine. http://t.co/Jk0UF7A4Ua,2,3
460464995512623104,2014-04-27 17:06:24,Corker on @FaceTheNation: sanctions on Russian individuals not enough to change Putin’s behavior http://t.co/g0kbCvXDps,12,6
460425690156765185,2014-04-27 14:30:13,Tune in: Sen. Corker is getting set for @FaceTheNation to discuss the crisis in #Ukraine. http://t.co/8Z4UAdSZ5M,7,5
460391353533222912,2014-04-27 12:13:47,Tune in today: Sen. Corker on @FaceTheNation to discuss the crisis in #Ukraine.  Local listings: http://t.co/4wUppLAyNg.,13,5
459819227437088768,2014-04-25 22:20:21,Watch Sen. Corker on @FaceTheNation Sunday to discuss the crisis in #Ukraine.  Local listings: http://t.co/SUFWlP7r1Z.,9,1
459697241192947712,2014-04-25 14:15:37,Corker:“feeling on the ground is that Putin is more committed to” Ukraine’s failure “than the West is to its success” http://t.co/QAV4RdyuZm,52,18
459697151434838016,2014-04-25 14:15:16,Corker: “time for the administration to back up their talk by immediately putting in place tough sanctions” http://t.co/QAV4RdyuZm #Russia,28,9
459697072791629824,2014-04-25 14:14:57,Corker: Putin only emboldened by Obama administration's empty rhetoric on new sanctions http://t.co/QAV4RdyuZm #Ukraine,11,3
459279243180908544,2014-04-24 10:34:39,"Yesterday, Sen. Corker toured the Maidan in Kyiv and paid his respect to those who lost their lives. http://t.co/fOlWbLE2Cy",13,6
459068169156837376,2014-04-23 20:35:55,"Corker in Kyiv: ""Putin will continue aggression in #Ukraine until he begins to pay a price.""",28,14
459067966626492417,2014-04-23 20:35:06,"Corker in Kyiv: ""The West must help #Ukraine with more than rhetoric, additional sanctions needed against Gazprom and Russian banks.""",32,14
459067833784471552,2014-04-23 20:34:35,"Corker in Kyiv: ""A free and successful #Ukraine is an existential threat to #Putin.""",11,8
459067625432027136,2014-04-23 20:33:45,Sen. Corker in Kyiv said West must be more committed to #Ukraine’s success than Russia is to its failure. http://t.co/BJ3sv490Za,17,7
459048977993043968,2014-04-23 19:19:39,".@DavidHStevens: Groups who bristle at #GSEreform choosing to ""embrace the status quo,"" in it for the ""quick buck."" http://t.co/xYojj95G78",7,0
459014150279405568,2014-04-23 17:01:16,.@BPC_Bipartisan's Mel Martinez and George Mitchell in @thehill: Time to act on housing finance reform http://t.co/N2Np23zMqq #GSEReform,4,2
458969384988319745,2014-04-23 14:03:23,#Ukraine's Andriy Parubiy told Sen. Corker about tactics used by pro-Russian separatists and asked for U.S. support. http://t.co/ZoH5GM7yAt,20,7
458964559164735488,2014-04-23 13:44:12,#Ukraine's Deputy PM Yarema told Sen. Corker that pro-Russian separatists are using civilians as human shields. http://t.co/tItwfNyNnN,47,7
458955956773072897,2014-04-23 13:10:01,Sen. Corker met political leader and former heavyweight boxer Vitali Klitschko in Kyiv. http://t.co/2ALvkr21p2,38,17
458932085462269953,2014-04-23 11:35:10,Sen. Corker spoke with Crimean Tatar leader Mustafa Dzhemilev. http://t.co/9A8u7xNBJq,30,13
458931447210852352,2014-04-23 11:32:38,Sen. Corker discussed the importance of #Ukraine's May 25 election with presidential candidate Petro Poroshenko. http://t.co/owvPYeJ9xW,40,8
458931123234406400,2014-04-23 11:31:21,Sen. Corker tells President Turchynov the U.S. must play a stronger role in deterring Russian aggression in #Ukraine. http://t.co/eSdcfz8dih,16,5
458930295765360640,2014-04-23 11:28:03,Senator Corker meets with Ukranian Presidential candidate Yulia Tymoshenko http://t.co/QcPa2kHuJa,32,9
458609173539086336,2014-04-22 14:12:02,ICYMI: Read Sen. Corker’s column on why #Ukraine matters and why further unrest in region threatens U.S. interests http://t.co/0olIm8Kdcb,22,8
458602550967947264,2014-04-22 13:45:43,Corker: #Russian interference in #Ukraine and #Moldova is “a wake-up call” http://t.co/Sa6DhIN1aS,7,3
458602369853308929,2014-04-22 13:45:00,"At press roundtable in #Moldova, Sen. Corker says US must do more to counter #Russian propaganda in the region. http://t.co/pZZq6BeqmU",13,5
458601782206152705,2014-04-22 13:42:40,Moldovan President Timofti tells Sen. Corker how #Russia uses energy &amp; economic coercion. http://t.co/H6bbuqVfoC,9,3
458601672189542400,2014-04-22 13:42:13,Sen. Corker and Moldovan Prime Minister Leanca agree #Russia's behavior depends on how the US acts. http://t.co/9Eb2pMPgtV,5,5
458601498667008000,2014-04-22 13:41:32,Sen. Corker tells Speaker of Parliament Corman that freedom in #Moldova threatens #Putin's regime. http://t.co/2NvPpsJBhJ,6,7
458601287525740544,2014-04-22 13:40:42,Sen. Corker meets with OSCE ambassador to discuss #Russian interference in #Transnistria. http://t.co/mRTGiF69BB,8,6
458297425716064256,2014-04-21 17:33:15,#ICYMI: Sen. Corker writes on “Obama’s Asia trip and U.S. credibility” today in @WSJAsia http://t.co/pgVaUPhCzt,7,4
458281111475335168,2014-04-21 16:28:26,"Sen. Corker meets leaders of #Gagauzia, where #Russia is trying to prevent closer ties between #Moldova &amp; the West http://t.co/U7IDxsLnGE",22,8
458259581798735876,2014-04-21 15:02:53,"Corker: “Now it's time for #VW, our state and our community to re-engage and move forward with bringing additional jobs to #CHA.”",6,7
458258984936689664,2014-04-21 15:00:30,"Corker: ""It's a shame the #UAW slowed the momentum on our expansion conversations with #VW…"" http://t.co/nv0FhPxOcF",2,2
458258727624527872,2014-04-21 14:59:29,Corker: “Fortunately the majority of workers at #VW's #CHA plant realized they were only dollar signs to the #UAW’s self-survival.”,3,5
458258550218063872,2014-04-21 14:58:47,Corker: Many felt “#UAW never really wanted another election in the near term because they knew they would lose by an even larger margin”,2,2
458258059841007616,2014-04-21 14:56:50,Corker: “11th hour reversal” affirms that “objection was nothing more than a sideshow to draw attention away from their stinging loss”,3,4
458257591278501888,2014-04-21 14:54:58,Corker statement on #UAW withdrawing appeal of lost election at #CHA #VW plant: http://t.co/nv0FhPxOcF,10,7
457869161633677312,2014-04-20 13:11:29,REMINDER: Senator Corker will be on @meetthepress this morning to discuss #Ukraine. Local listings: http://t.co/iacphTo6uk.,8,4
457326356960116736,2014-04-19 01:14:34,Corker: Obama administration’s response to #Russia’s intervention in #Ukraine “a day late and a dollar short” http://t.co/EXaU52tzaP,17,7
457277588314935296,2014-04-18 22:00:47,Senator Corker will discuss the crisis in #Ukraine Sunday morning on @meetthepress. Local listings: http://t.co/GmkbDJk1K7.,20,13
457254027668238337,2014-04-18 20:27:10,Corker: Obama administration makes “every excuse imaginable” to delay #KeystoneXL pipeline decision http://t.co/je0EJoA9A9,7,3
457184251130413056,2014-04-18 15:49:54,"Corker seeks end to delays in U.S. adoptions from #DRC, continues to assist Tennessee families: http://t.co/TEWYISt6Hy",5,4
455711508564303872,2014-04-14 14:17:45,Corker: “A failure to respond…will give the Kremlin a license to continue to threaten and undermine #Ukraine…” http://t.co/BY6jIZUMJw,11,6
455711390129725440,2014-04-14 14:17:16,"Corker: “Our European allies need to see action, leadership, and resolve from the U.S….” http://t.co/BY6jIZUMJw #Ukraine #Russia",15,10
455711256314646528,2014-04-14 14:16:44,"Corker: ""Unless #Russia ends its destabilization of eastern #Ukraine…further sanctions…should be imposed within days” http://t.co/BY6jIZUMJw",7,3
455711060407119872,2014-04-14 14:15:58,In case you missed it:Corker urges Obama to impose new sanctions on #Russia to deter further intervention in #Ukraine http://t.co/BY6jIZUMJw,3,3
454258207570296832,2014-04-10 14:02:51,Live now: Corker questioning USAID administrator Shah at #SFRC hearing http://t.co/Ay1KZ8x97x,4,1
454254104467234816,2014-04-10 13:46:32,Live now: Sen. Corker speaking at #SFRC hearing w/USAID administrator Shah http://t.co/Ay1KZ8x97x,1,1
454252541325619200,2014-04-10 13:40:20,Live now: #SFRC hearing w/USAID administrator Shah on FY15 foreign aid budget http://t.co/Ay1KZ8x97x,2,0
453918485794795521,2014-04-09 15:32:55,ICYMI: Corker on @dailyrundown urges more economic sanctions against #Russia “as another shot across the bow”: http://t.co/auK31y3pHM,3,1
453880598596435968,2014-04-09 13:02:22,Live now: Senator Corker on MSNBC’s @dailyrundown discussing the latest on #Ukraine and #Russia.,4,1
453866504971227136,2014-04-09 12:06:21,"Today at 9:00 a.m. ET on @dailyrundown, Sen. Corker will discuss the latest on #Ukraine and #Russia. http://t.co/LtK0Zw7nnT",4,1
453667322314506240,2014-04-08 22:54:53,"Tomorrow at 9:00 a.m. ET on MSNBC’s @dailyrundown, Sen. Corker will discuss the latest on #Ukraine and #Russia. http://t.co/HBWAAtFpEb",5,1
453662746060783616,2014-04-08 22:36:41,Corker asks Kerry to follow through on commitment for #Syria briefing http://t.co/kZGWB9WMDo,9,0
453604032318562307,2014-04-08 18:43:23,"Senator Corker praises committee passage of the Tennessee Wilderness Act, hopes Senate will pass in the near future: http://t.co/6LtoGfhgee.",7,0
453582652285911041,2014-04-08 17:18:26,.@USAToday editorial: Sending Fannie &amp; Freddie “on their merry way” without reform would be “a huge mistake.” http://t.co/Ah6FrVmq0V,3,1
453553882296508417,2014-04-08 15:24:06,ICYMI: @USAToday editorial: Retire Fannie and Freddie http://t.co/Ah6FrVmq0V,4,2
453544995992379392,2014-04-08 14:48:48,Sen. Corker is questioning Secretary Kerry at #SFRC hearing now.  Watch live: http://t.co/Ay1KZ8x97x,4,1
453535896655396864,2014-04-08 14:12:38,Sen. Corker is speaking now at #SFRC hearing with Secretary Kerry: Watch live: http://t.co/Ay1KZ8x97x,0,0
453527933337239552,2014-04-08 13:41:00,#SFRC hearing today at 10:00 a.m. ET with Secretary Kerry. Watch live: http://t.co/Ay1KZ8x97x,2,0
452225043830153216,2014-04-04 23:23:47,.@factcheckdotorg: #GSEReform bill “is an attempt to roll back the govt’s involvement in the insurance industry.” http://t.co/8Nu3IQa1wF,8,2
451861583141277696,2014-04-03 23:19:31,"Corker: “U.S. must ensure the Internet remains free &amp; open, &amp; out of the hands of foreign governments or bad actors.” http://t.co/M8uxzgXTc2",17,14
451832231598620672,2014-04-03 21:22:53,Sen. Corker congratulates Tori Ruis of La Vergne High School for being named @NASSP’s TN Asst. Principal of the Year. http://t.co/PgY7FlIoFy,12,11
451816803065659392,2014-04-03 20:21:34,"With #POTUS signing #Ukraine bill into law, US sends a strong, unified message of support for Ukraine &amp; opposition to Russian aggression -BC",7,4
451767827159330816,2014-04-03 17:06:58,RT @TheHillGlobal: Corker: White House 'stonewalling' on Syria: Sen. Bob Corker (R-Tenn.) on Thursday accused the Obama administr... http:/…,5,0
451737840091926529,2014-04-03 15:07:48,"Corker: “Members on both sides of the aisle are demanding answers, and I will continue to press the administration until we get them” #Syria",6,3
451737754863284224,2014-04-03 15:07:28,"Corker: ""the administration has contributed to the worsening conflict through inaction…putting…our country’s security at risk."" #Syria",3,2
451737673657778176,2014-04-03 15:07:08,Corker: “A week after administration officials stonewalled our committee…we still have not had the briefing we were promised” #Syria,4,2
451729592097976320,2014-04-03 14:35:02,"Corker:150,000 killed in #Syria, still no strategy from the Obama administration: http://t.co/JKnTKiDN1O",5,2
451727340432015360,2014-04-03 14:26:05,"ICYMI: Sen. Corker and @SenAlexander help secure TennCare waiver request, remain committed to find a permanent fix http://t.co/iU4WjZj0W0",1,3
451496665904861184,2014-04-02 23:09:28,"RT @EGPAF: Congratulations to Deborah Birx, M.D. on her official confirmation as the U.S. Global AIDS Coordinator! @PEPFAR http://t.co/XbN2…",6,0
451477073585266689,2014-04-02 21:51:37,Corker: Obama administration must restore all sanctions if Iranian-Russian oil-for-goods deal proceeds http://t.co/rYEJLSMKTk,12,3
451132312533872640,2014-04-01 23:01:39,Corker: U.S. must demonstrate long-term resolve to deter any further Russian intervention in #Ukraine &amp; the region http://t.co/5wItbkssah,15,7
451131860148817920,2014-04-01 22:59:51,Corker: House passage of Senate #Ukraine bill “allows Congress to speak with one voice” http://t.co/5wItbkssah,10,7
449989598387924992,2014-03-29 19:20:55,Corker: President Obama’s Comments on #Syria “completely divorced from reality” http://t.co/xkjMkdPjni,16,5
449661654901727234,2014-03-28 21:37:47,"Corker: After a dozen hearings on housing finance reform &amp; S.1217, the committee is well prepared to act http://t.co/x42MGvQ8Ej #GSEReform",4,0
449643277428727808,2014-03-28 20:24:45,ICYMI: Corker looks forward to successful markup of housing finance reform bill on April 29th  http://t.co/x42MGvQ8Ej #GSEReform,3,2
449285425425698816,2014-03-27 20:42:47,Senator Corker met with 8th grade students from Goodpasture Christian School this morning on Capitol Hill. http://t.co/iUS6omjzkc,6,6
449224158753607680,2014-03-27 16:39:20,"""Going forward, the administration must demonstrate a long-term commitment to stop Russian aggression""",5,4
449224050263343104,2014-03-27 16:38:54,"""It’s important for Congress to act expeditiously in a unified way and send a bill to the president’s desk with economic aid and sanctions""",7,2
449223931472248832,2014-03-27 16:38:26,"""This bill sends a strong message of support to the Ukrainian people and a strong signal to Russia""",4,5
449223469004124160,2014-03-27 16:36:35,#Ukraine bill coauthored by Sen. Corker passes Senate 98-2,19,10
449216175986061312,2014-03-27 16:07:37,"Corker, @SenatorMenendez to hold media avail immediately following #Ukraine bill vote at 12:30 PM. ET in Senate Radio/TV gallery",1,0
449205266727567361,2014-03-27 15:24:16,Corker: U.S. should expand sanctions on Russian banks to “turn up the volume” on Putin regime: http://t.co/C25GCQDBCv #Ukraine,9,5
449173925210361856,2014-03-27 13:19:43,Live now: Sen. Corker is discussing #Ukraine on MSNBC’s @dailyrundown,3,2
449168015469596672,2014-03-27 12:56:14,Watch Sen. Corker discuss #Ukraine on MSNBC’s @dailyrundown today at 9:15 a.m. ET http://t.co/vhx6FMx5By,3,0
448952371063033857,2014-03-26 22:39:21,Corker: Complete failure of U.S. policy in #Syria necessitates new approach http://t.co/K24XtmBv5j,11,7
448893474637885440,2014-03-26 18:45:19,Live now: Sen. Corker speaking at #SFRC hearing on “#Syria after Geneva” http://t.co/9axnhREU97,7,2
448892325578948608,2014-03-26 18:40:45,Live now: #SFRC hearing at 2:30 p.m. ET on “#Syria after Geneva” http://t.co/9axnhREU97,6,0
448888974980161536,2014-03-26 18:27:26,.@vali_nasr to testify at 2:30 p.m. ET in the #SFRC on need for new U.S. diplomatic approach to end #Syria conflict http://t.co/9axnhREU97,3,2
448888838472339456,2014-03-26 18:26:53,Watch live: #SFRC hearing at 2:30 p.m. ET on U.S. approach to “#Syria after Geneva” http://t.co/9axnhREU97,1,0
448551540412792832,2014-03-25 20:06:35,Senator Corker held 11 events across eight Tennessee counties last week. Photos here: http://t.co/5UJaYtKTOV. http://t.co/oYxyAwuhDQ,6,5
447164535254687745,2014-03-22 00:15:07,Corker: Sanctions must demonstrate to Putin that “this is just the beginning if they intervene further in #Ukraine” http://t.co/2IxxiOGNp6,5,1
447164077807124481,2014-03-22 00:13:18,Corker: POTUS should target Russian state-owned companies w/sanctions to “send shock waves” into #Russia’s economy http://t.co/2IxxiOGNp6,5,3
446764155677073408,2014-03-20 21:44:09,Sen. Corker discussed a range of issues - from #VWVote to the crisis in #Ukraine - with the #CHA Rotary Club today. http://t.co/ysVSUD9mCb,5,0
446668517517971458,2014-03-20 15:24:08,Senator Corker is speaking to students and educators at Normal Park Museum Magnet School in #CHA. http://t.co/goBbVBFFbj,6,7
446402197442396161,2014-03-19 21:45:52,Senator Corker continues his travels across Tennessee with a stop in Mt. Juliet at @MJChamber. http://t.co/UIHhF5O8iw,7,7
446343667003817985,2014-03-19 17:53:17,"Senator Corker is discussing the #VWVote, the crisis in #Ukraine, and #GSEReform with the Clarksville Rotary Club. http://t.co/Fd6OuqNXCc",8,2
446336606828363777,2014-03-19 17:25:14,RT @SecTreHargett: Big tks to @SenBobCorker for sharing his perspective on the importance of public service @ our 2014 Mission Focus mtg ht…,10,0
446302112771616769,2014-03-19 15:08:10,Senator Corker meeting with business and community leaders in Nashville at an event hosted by @dhchamber. http://t.co/HtoT5FVIWl,1,4
446086230535852033,2014-03-19 00:50:19,Senator Corker to #VADept: “Our veterans...deserve to know why the Open Air Burn Pit Registry has been delayed.” http://t.co/tOj4omFAxD,8,1
446018001712603137,2014-03-18 20:19:12,Senator Corker visiting with business &amp; community leaders in Franklin at @ESPACES_Nash event. http://t.co/05DpUgfTHA,3,5
445963984085467136,2014-03-18 16:44:34,RT @TullahomaCoC: Meet &amp; greet with @SenBobCorker this morning. Thank you Senator for your service and representing the state of TN. http:/…,7,0
445963105021870081,2014-03-18 16:41:04,Senator Corker was in Manchester this morning to meet with the local Chamber of Commerce. http://t.co/sYURnmCbi1,4,2
445927374295949312,2014-03-18 14:19:05,"Corker: “The administration’s calibrated actions have failed to affect Putin’s decisions, and that has to change.” http://t.co/0orSLMgQsu",11,4
445187645367283713,2014-03-16 13:19:40,HAPPENING NOW: Senator Corker is live from #CHA on @FoxNewsSunday discussing the latest on the crisis in #Ukraine. http://t.co/Lc2xQQIRH2,10,10
445187541164371968,2014-03-16 13:19:15,RT @FoxNewsSunday: .@SenBobCorker and @SenatorMenendez join Chris to talk about the latest in Crimea next on #FNS,2,0
445178704701165570,2014-03-16 12:44:08,TUNE IN: Senator Corker will discuss the crisis in #Ukraine this morning on @FoxNewsSunday. Local listings: http://t.co/6veBcx8W4S.,7,5
444963819404922880,2014-03-15 22:30:16,Senator Corker will discuss the crisis in #Ukraine tomorrow morning on @FoxNewsSunday. Local listings: http://t.co/6veBcx8W4S.,9,2
444880307821346816,2014-03-15 16:58:25,Senator Corker is in Nashville today celebrating fellow Tennessean Andrew Jackson’s 247th birthday. @7thpresident http://t.co/l2SPzT1xIq,8,14
444218976290488321,2014-03-13 21:10:31,RT @WASHadvocates: Thank you @SenBobCorker for your commitment to #WASH! #CheersToH2O http://t.co/yZoEyEF0j0,3,0
444202506491817984,2014-03-13 20:05:05,Corker on @mitchellreports: U.S. leadership stiffens European resolve on sanctions in response to #Ukraine crisis: http://t.co/pOYiaE63TA,0,1
444200687845376000,2014-03-13 19:57:51,This week Senator Corker received @USChamber’s Spirit of Enterprise Award for his support of pro-growth policies. http://t.co/0jTaUEOyas,3,3
444150443913281536,2014-03-13 16:38:12,Live now: Sen. Corker on @mitchellreports to talk about #Ukraine and his meeting with Ukraine PM @Yatsenyuk_AP,0,1
444140428657295360,2014-03-13 15:58:24,RT @mitchellreports: Coming up on #AMR at Noon ET @SenBobCorker re #Ukraine + @tomcostellonbc &amp;  @KeirSimmons w/ new revelations in #Malays…,6,0
444131399537528832,2014-03-13 15:22:31,Corker speaking now at #SFRC hearing on #KeystoneXL http://t.co/AWCa3kOzfA,1,1
444131348727746560,2014-03-13 15:22:19,Live now: #SFRC hearing today at 11:15 a.m. ET on #KeystoneXL national interest determination: http://t.co/AWCa3kOzfA,0,1
444119865779953664,2014-03-13 14:36:42,Sen. Corker congratulates Tennessee’s @SenateYouth delegates Niman Mann &amp; Daniel Rose. #USSYP http://t.co/qEfxeRQgGP http://t.co/3Z47vkN6XX,5,19
444118375942606848,2014-03-13 14:30:46,WaPo: In State Dep. public comments on #KeystoneXL nearly “half of the comments in opposition came from…outside” U.S. http://t.co/xO0xIXo7V5,4,1
444112562956009472,2014-03-13 14:07:40,"WaPo/@abcnews Poll: 65% of Americans support #KeystoneXL, 85% say pipeline would create “significant number of jobs” http://t.co/QVejTmVJa1",10,5
444108888284364800,2014-03-13 13:53:04,Fmr. Obama NatSec Advisor Gen. Jim Jones to testify at #SFRC today in support of #KeystoneXL.  Read his op-ed: http://t.co/pllwVvfPew,7,3
444107212123021312,2014-03-13 13:46:25,#SFRC hearing today at 11:15 a.m. ET on #KeystoneXL national interest determination: http://t.co/AWCa3kOzfA,10,1
444073709964636160,2014-03-13 11:33:17,Happening now: Senator Corker joins @BeckyQuick and @JoeSquawk on @CNBC to discuss #Fannie &amp; #Freddie. #GSEReform,8,3
444067385298137088,2014-03-13 11:08:09,Reminder: Sen. Corker will be live on @CNBC at 7:30 a.m. ET this morning to discuss #GSEReform http://t.co/34MoBiaGhL,3,1
443916591810359296,2014-03-13 01:08:57,"After #Ukraine aid &amp; sanctions bill passed the #SFRC, Sen. Corker met with #Ukraine PM @Yatsenyuk_AP http://t.co/MRow32r7Ve",19,2
443905135807594496,2014-03-13 00:23:26,Corker: U.S. at “a defining moment” “if we’re going to do those things that are appropriate to protect #Ukraine’s sovereignty”,18,7
443905019331743744,2014-03-13 00:22:58,"Corker: #Ukraine aid bill “cements"" ""60 years of U.S...interests to ensure Europe remains democratic, whole &amp; free”: http://t.co/rN9c064Uo4",20,5
