id,created_at,text,retweets,favorites
374970292877008896,2013-09-03 19:00:59,"Corker: I have been dismayed at the lack of [administration] support for vetted opposition, which is supposed to be US policy. #SyriaHearing",12,1
374969645121277952,2013-09-03 18:58:24,Corker: Why does Syria matter to the U.S.? Why it is key to the region? How will [action] support the stated strategy? #SyriaHearing,10,0
374968305406078977,2013-09-03 18:53:05,Corker: This is the most important decision many of us will make during our tenure in the United States Senate. #SyriaHearing,15,1
374967377646993408,2013-09-03 18:49:24,HAPPENING NOW: Senator Corker is delivering opening remarks at today’s #SFRC #SyriaHearing. Watch LIVE: http://t.co/YnJUdGT7Kw.,10,1
374964613932003328,2013-09-03 18:38:25,Today’s #SFRC #SyriaHearing is now underway. Watch LIVE gavel to gavel coverage here: http://t.co/YnJUdGT7Kw.,12,2
374950644802527232,2013-09-03 17:42:54,#SFRC #SyriaHearing today at 2:30 pm ET on the authorization for use of force in #Syria. Live: http://t.co/YnJUdGT7Kw http://t.co/DMJJvhI5ml,8,1
374940100448120833,2013-09-03 17:01:00,RT @dougmillsnyt: Sen. Bob Corker talks to reporters as he heads into a Member-Only Classified Briefing on Syria. http://t.co/NFZhYiSR3H,59,0
374711514285891584,2013-09-03 01:52:41,"Tonight on @CNN w/ @wolfblitzer, Sen. Corker discussed tmw’s #SFRC hearing on authorizing military force in #Syria. http://t.co/j0aDD1ayya",5,1
374695368698499073,2013-09-03 00:48:32,"Tonight at 9pm ET on @CNN w/@wolfblitzer, Sen. Corker discusses Tuesday’s #SFRC hearing on authorizing military force in #Syria",18,7
374546357744181248,2013-09-02 14:56:25,"Corker: #POTUS must use ""every reasonable resource"" to make his case before ""potentially defining vote"" http://t.co/lsyt6XHUwO #Syria",10,1
374546293562941440,2013-09-02 14:56:09,"Corker: ""American people deserve...more from the administration about why military action in #Syria is necessary"" http://t.co/lsyt6XHUwO",10,3
374546241461288960,2013-09-02 14:55:57,Corker: “…I look forward to a vigorous debate on this important authorization.” http://t.co/lsyt6XHUwO #Syria,6,1
374546127594348544,2013-09-02 14:55:30,Corker: “Congress’s role in U.S. military force has too often been abdicated to presidential authority…”http://t.co/lsyt6XHUwO #Syria,5,2
374535654878617600,2013-09-02 14:13:53,Corker statement on #SFRC hearings this week on authorization for use of military force in #Syria: http://t.co/lsyt6XHUwO,5,0
373881800424030208,2013-08-31 18:55:42,Corker: “[I]t is imperative that [Pres. Obama] immediately begins using every ounce of his energy to make his case to the American people.”,6,2
373881336789868544,2013-08-31 18:53:51,Corker: “I look forward to... a vigorous debate on this important authorization.” http://t.co/n6lhmVT1T0 #Syria,12,1
373869861836840960,2013-08-31 18:08:15,Corker Statement on President Obama Asking for Congressional Authorization for U.S. Military Action in #Syria http://t.co/n6lhmVT1T0,18,4
373818628790960128,2013-08-31 14:44:40,"In op-ed, Corker writes about the connection between America’s role in the world and our way of life here at home. http://t.co/y1ZKYuM1CW",10,1
373818330525626368,2013-08-31 14:43:29,ICYMI: Sen. Corker in today's @Tennessean: U.S. cannot afford to relinquish leadership role. http://t.co/y1ZKYuM1CW http://t.co/MeJtDTaNfY,8,2
373238827902435328,2013-08-30 00:20:45,Corker makes statement following Obama administration briefings on Assad regime’s use of chemical weapons in #Syria: http://t.co/BYC9qcHvJG,20,2
372879521583595521,2013-08-29 00:33:00,"ICYMI: On @OutFrontCNN, Corker urges administration to seek congressional approval for surgical action in #Syria http://t.co/7i5LeWoOUi",7,3
372843769889955841,2013-08-28 22:10:56,TUNE IN: Sen. Corker will appear on @OutFrontCNN w/ guest host @JessicaYellin to discuss the U.S. response to the crisis in #Syria at 7 p.m.,6,1
372756192000344064,2013-08-28 16:22:56,"ICYMI: In today’s @timesfreepress, Chris Hopkins writes: Corker-Warner plan good start for mortgage reform http://t.co/3dVpiiOEta #GSEReform",2,0
372750445615124480,2013-08-28 16:00:06,"On #MLK50, we honor a great American. May Dr. King’s legacy inspire us to work to leave behind a better country for future generations. -BC",7,4
372701008855457792,2013-08-28 12:43:39,Senator Corker is in Chattanooga kicking off the Tennessee Small Business Development Center #CEOSeries. #CHA #CHAbiz http://t.co/pyosu1EB1z,7,3
372540648701718529,2013-08-28 02:06:26,HAPPENING NOW: Senator Corker is LIVE on @FoxNews with @gretawire from @newschannelnine in Chattanooga. Tune in. http://t.co/UmkJjxPdqB,3,2
372516200724443137,2013-08-28 00:29:17,TUNE IN: Senator Corker goes “On The Record” to discuss the U.S. response to the crisis in #Syria with @gretawire tonight at 10:05 p.m. ET.,3,1
372474470474063872,2013-08-27 21:43:28,RT @rollcall: Syria Elevates Corker’s Foreign Policy Role: http://t.co/jeJ8gvLrX9 via @meredithshiner #WGDB,9,0
372407170710511616,2013-08-27 17:16:03,Listen now to Sen. Corker discuss #Syria on NPR’s @hereandnow at http://t.co/323Ur4P1J8,3,0
372362620600201216,2013-08-27 14:19:01,".@chucktodd: I call most everyone by their last name – of course, since you have 2 first names it sounds a little odd. Love coming on. –BC",8,6
372345207531917312,2013-08-27 13:09:50,LIVE NOW: Sen. Corker joins @chucktodd on @msnbc’s @dailyrundown to discuss the US response to the crisis in #Syria. http://t.co/kiBR4SxGbK,7,5
372319024564039680,2013-08-27 11:25:47,TUNE IN: Sen. Corker will discuss the US response to the crisis in #Syria w/ @chucktodd on MSNBC’s @dailyrundown this morning at 9:00 am ET.,5,0
372086079546851328,2013-08-26 20:00:09,"At the @uofmemphis New Student Convocation, Sen. Corker tells students to (1) master something, (2) create a bold vision, and (3) give back.",8,4
372061604298248192,2013-08-26 18:22:53,"TUNE IN: At 3:30 p.m. ET (2:30 p.m. CT), Sen. Corker will deliver remarks at the @uofmemphis New Student Convocation. http://t.co/5o0JHZPWzO",3,1
372060448884944896,2013-08-26 18:18:18,Senator Corker discussed #GSEReform with the Memphis Area Home Builders this afternoon. More: http://t.co/LP9B33jeKt. http://t.co/IfduXhGhDe,4,0
372005555239260160,2013-08-26 14:40:10,PHOTO: Senator Corker is in Memphis meeting with the @memphisnews editorial board on a wide range of topics. http://t.co/elvUF6awt1,4,1
371951845809213441,2013-08-26 11:06:45,"TUNE IN: Also this morning, Sen. Corker will be on @msnbc's @Morning_Joe at 7:15 am ET to discuss the U.S. response to the crisis in #Syria.",8,1
371938688411774976,2013-08-26 10:14:28,"TUNE IN: This morning at 7:00 am ET, Sen. Corker will discuss the US response to the crisis in #Syria on @CBSThisMorning &amp; NBC's @todayshow.",2,3
371800772138127360,2013-08-26 01:06:26,"TUNE IN: Tomorrow at 7:00 am ET, Senator Corker will discuss the US response to the crisis in #Syria on @CBSThisMorning &amp; NBC's @todayshow.",8,2
371678816290078721,2013-08-25 17:01:49,"ICYMI: Senator Corker discussed #Syria, #Egypt and the #NSA on @FoxNewsSunday this morning. Watch here: http://t.co/RnsmPkokkH.",4,0
371628623859429378,2013-08-25 13:42:23,"Senator Corker re: #NSA: “It's our responsibility to know those things, to ensure they're in balance.” So again, I’ve called for a briefing.",6,1
371628461732794368,2013-08-25 13:41:44,Senator Corker on @FoxNewsSunday re: #NSA: I have asked that the head of the #NSA brief folks from top to bottom.,7,0
371628110958981120,2013-08-25 13:40:20,"Corker re: #Egypt: “No doubt, there will be some suspensions, but we're going to keep that relationship. It is in our national interests.”",6,1
371627954016514048,2013-08-25 13:39:43,"Senator Corker on @FoxNewsSunday re: aid to #Egypt: “I do think it's time for us to recalibrate it, as I've said many times.”",6,2
371626632080941056,2013-08-25 13:34:28,RT @FoxNewsSunday: @SenBobCorker: Congress has had a pass on these kinds of activities for a long time. It's for us to step and take respon…,2,0
371626573205487616,2013-08-25 13:34:14,"RT @FoxNewsSunday: @SenBobCorker ""I think we will respond in a surgical way."" #Syria",3,0
371626502317568000,2013-08-25 13:33:57,"RT @FoxNewsSunday: @SenBobCorker on #Syria chemical attack: ""I think it's very evident that the regime has acted in this way.""",4,0
371624388568694784,2013-08-25 13:25:33,"Corker re: #Syria: “I hope the president… will ask for authorization from Congress to do something in a very surgical and proportional way.""",26,5
371615819274285056,2013-08-25 12:51:30,"REMINDER: Sen. Corker will discuss #Syria, #Egypt and the #NSA this morning on @FoxNewsSunday. http://t.co/sEzVCgZs0g http://t.co/YJo4hLNuBQ",15,0
371347954260398080,2013-08-24 19:07:06,"TUNE IN: Senator Corker will discuss #Syria, #Egypt and the #NSA tomorrow morning on @FoxNewsSunday. Local listings: http://t.co/sEzVCgZs0g.",6,0
371278013712715776,2013-08-24 14:29:11,Retweet to help us wish Senator Corker a very happy birthday! http://t.co/PzFMTHatXZ,33,6
370939686165807104,2013-08-23 16:04:47,"ICYMI: Yesterday, Senator Corker discussed #smartpower at a @USGLC event in Nashville. Watch here: http://t.co/yUXBluJZsk.",5,1
370654635050033153,2013-08-22 21:12:07,"Tennessee students head back to school this month, so we thought we’d share one of Bob Corker’s school pictures. #tbt http://t.co/Ri8jURKfRf",10,3
370630262142418945,2013-08-22 19:35:15,PHOTO: Senator Corker is in Nashville meeting with The @Tennessean editorial board on a wide range of topics. http://t.co/jNaLxDL64w,2,0
370604813882388480,2013-08-22 17:54:07,Corker: “The greatest threat to our ability to lead is our fiscal situation… we must get our fiscal house in order.” http://t.co/goOm3qeALZ,12,4
370602844635664384,2013-08-22 17:46:18,"In Nashville, Sen. Corker discusses how #smartpower helps U.S. security &amp; economic interests. http://t.co/phbQfRqpFK http://t.co/G0VwGQkRoe",4,1
370599811713466368,2013-08-22 17:34:15,LIVE: Senator Corker is discussing how America’s global leadership makes TN strong. http://t.co/phbQfRqpFK cc: @USGLC http://t.co/aBva4sD8GW,5,2
370590817989050368,2013-08-22 16:58:30,RT @USGLC: #LIVESTREAM: @SenBobCorker on how America's global leadership makes Tennessee strong. Tune in: http://t.co/WLrPHIITFD #SmartPower,5,0
369924492241293312,2013-08-20 20:50:46,ICYMI: @FreeBeacon “Sen. Corker Blasts State Department for Reinstating #Benghazi Officials” http://t.co/HRq4Tn0UwB,9,3
369899042207047680,2013-08-20 19:09:38,Senator Corker speaking to business and community leaders at the @blountchamber http://t.co/AVZbMAOP08,2,2
369481648863072257,2013-08-19 15:31:04,Sen. Corker on aid to #Egypt: I think we have national interests there…our aid ought to be tailored towards those national interests.,4,2
369469150738911232,2013-08-19 14:41:24,"Discussing #Egypt on @FoxNews today, Sen. Corker said “our foreign aid is about our national interest &amp; about keeping Americans secure.”",2,1
369138131670274048,2013-08-18 16:46:03,"Corker on @ThisWeekABC calls for U.S. to recalibrate aid to #Egypt, focus on national interests http://t.co/IUk5pmWNpB",5,4
369076258665005056,2013-08-18 12:40:11,TUNE IN: Sen. Corker will be on @ThisWeekABC with @GStephanopoulos this morning. Listings: http://t.co/D7DbK0Kq5Z. http://t.co/YMzUEhfa2g,3,2
368792445141540865,2013-08-17 17:52:25,Senator Corker will be a guest on @ThisWeekABC w/ @GStephanopoulos tomorrow. Local listings: http://t.co/D7DbK0Kq5Z. http://t.co/ao0bZMrPVF,10,4
368773323473170432,2013-08-17 16:36:26,"Back from Middle East, Corker says recent expansion in violence threatens region’s security &amp; U.S. national interest http://t.co/tKgyVB0iA9",4,0
368771550914162688,2013-08-17 16:29:23,"RELEASE: Corker Returns from Middle East Trip to #Turkey, #Iraq and #Jordan http://t.co/tKgyVB0iA9",3,0
368118597001818112,2013-08-15 21:14:47,RELEASE: Senator Corker Statement on Violence in #Egypt: http://t.co/bFsSvPfYPy,7,2
368006872508276738,2013-08-15 13:50:50,"RT @JamesNooga: After calling for cease to operations, @SenBobCorker was informed at least one burn pit in Afghanistan is closed: http://t.…",1,0
367359970611691521,2013-08-13 19:00:16,"“Economists, industry participants, many policy makers, &amp; now the @whitehouse agree: now is the time for #GSEReform.” http://t.co/rNn12fxAgm",1,0
367359680760119296,2013-08-13 18:59:07,Senator Corker &amp; @MarkWarner today in @USNewsOpinion: Building a New Era of Housing Finance http://t.co/rNn12fxAgm.,3,1
367043010346758144,2013-08-12 22:00:47,"At #Kilis camp, refugee leaders continue to be dismayed at lack of U.S. support for opposition – BC  http://t.co/MlLwGpQuk1",4,0
367042561333932032,2013-08-12 21:59:00,2nd visit to #Kilis refugee camp on #Syria border showed excellent support provided by #Turkey – BC http://t.co/XvUDB3aIFT,4,1
367042162782765056,2013-08-12 21:57:25,Valuable visit today to US Patriot battery on Turkish border w/ #Syria. Inspired by our servicemembers – BC http://t.co/X4zdgJp3GF,3,1
367041861333946368,2013-08-12 21:56:13,"Yesterday near #Syria border, Gen. Idriss reiterated need for greater US support to tip balance in the conflict–BC http://t.co/N6XVTYCjrB",3,0
365577134175035393,2013-08-08 20:55:55,@WashingtonPost calls for reforms to mortgage finance system. http://t.co/PV1a656c0f Info on Corker-Warner bill: http://t.co/ieMTuKA0FL,1,0
365562574055546880,2013-08-08 19:58:04,"On @npratc at 4pm ET, Sen. Corker will talk abt declassifying #foreignpolicy. Listen: http://t.co/7bttMI5ady; Read: http://t.co/eUEXIv7L5k",4,0
365182052678643713,2013-08-07 18:46:00,Sen. Corker discussed his #GSEReform bill with the Sumner County Realtors Association. Read more here: http://t.co/ieMTuKA0FL,1,0
365106321017692160,2013-08-07 13:45:05,PHOTO: Sen. Corker spoke about solving our fiscal issues today at the Robertson Country Chamber of Commerce http://t.co/tFWoYgQvQz,3,3
364856216322719745,2013-08-06 21:11:15,Sen. Corker: “Real momentum growing to finally move a structural housing finance reform bill.” #GSEReform http://t.co/WWU0x4DMQ8,5,0
364806205476065280,2013-08-06 17:52:32,Corker attended the Murfreesboro Rotary Club Luncheon &amp; spoke about solving the big problems facing our country http://t.co/aCw8HB7PeI,2,1
363037161097932801,2013-08-01 20:42:59,DID YOU KNOW? A mission trip to Haiti led Senator Corker to public service. #tbt More: http://t.co/6JMzhFpnDJ. http://t.co/QokrYFuknn,6,6
362630047997235202,2013-07-31 17:45:15,"Corker: Immediate Cut Off of Assistance to #Egypt Could Promote Instability, Threaten U.S. and Israel’s Interests http://t.co/bsUPBoDi8I",4,0
362601476918480897,2013-07-31 15:51:43,RT @ForeignPolicy: Sen. Bob Corker: Why America needs to declassify its foreign policy http://t.co/rYECnEr1RV,25,0
362576057519443969,2013-07-31 14:10:43,Corker writes in @ForeignPolicy: “Out in the Open; Why America needs to declassify its foreign policy.” http://t.co/eUEXIv7L5k,25,7
362185733764689920,2013-07-30 12:19:42,TUNE IN: Senator Corker will be on @msnbc's @dailyrundown with @chucktodd this morning at 9:05 a.m. ET.,3,1
361980917549514752,2013-07-29 22:45:50,Watch: Senator Corker will be on @MSNBC's @DailyRundown with @ChuckTodd tomorrow morning at 9:05 a.m. ET,4,1
361647518439841793,2013-07-29 00:41:02,Corker: “[Lois DeBerry's] legacy will be remembered in Memphis and across our state for generations to come.” More: http://t.co/HResexMt8j.,6,2
361273632984535040,2013-07-27 23:55:21,"Thursday, Sen. Corker welcomed Purple Heart recipient Edmond Prater to D.C. for anniversary of #KoreanWarArmistice. http://t.co/oR8saepQME",4,6
360522719814627329,2013-07-25 22:11:29,Yep. Sure did. -BC #tbt #flashbackstache RT @DarrellIssa #tbt Circa 1980. We all had one once. http://t.co/MGWqnTH3Tz http://t.co/8QsyHVavIa,31,18
360406936522461184,2013-07-25 14:31:24,#SFRC hearing today at 10:30 a.m. ET on crisis in #Egypt.  Live stream: http://t.co/lgwinllG3q http://t.co/juuNuoqOMR,5,2
360392029823442946,2013-07-25 13:32:10,"RT @JoeAdlerDC: Sen. Corker on GSE reform: ""The greatest enemy is inaction.""",5,0
360100766649827331,2013-07-24 18:14:47,Senator Corker met with @BBYOInsider “Impact: DC” students at Tenn. Tuesday yesterday. More: http://t.co/oOHkdCGG8j. http://t.co/zfdTRINi9V,6,2
359768791833509890,2013-07-23 20:15:38,"RT @kevcirilli: Testifying at Banking subcomm hearing, FHFA official praises Sens. Bob Corker &amp; Mark Warner for introducing starting-point …",1,0
359412631410458624,2013-07-22 20:40:23,RT @SenatorTomUdall: .@SenBobCorker &amp; I call for @DeptofDefense to halt use of open-air #burnpits in #Afghanistan. #MilitaryMonday #SecDef …,2,0
359010752998285313,2013-07-21 18:03:28,Congratulations to Phil Mickelson for winning the British Open. Great round and a great win. -BC #Lefty,9,3
357512907677913088,2013-07-17 14:51:34,Corker &amp; @MarkWarner discussed #GSEReform at @BPC_Bipartisan this morning. More on their bill: http://t.co/pr4UCoBdud http://t.co/HWO1kgT1Yo,5,1
357462927642603520,2013-07-17 11:32:57,"TUNE IN: At 8:30 a.m. ET, Corker &amp; @MarkWarner will discuss #GSEReform w/ @NickTimiraos at a @BPC_Bipartisan event. http://t.co/d20DOmxqVu",30,1
357258087993835523,2013-07-16 21:59:00,RT @BPC_Bipartisan: Don't have breakfast plans tomorrow? Join us in-person or online as Sens. Corker &amp; Warner talk housing finance reform h…,5,0
357256589402583040,2013-07-16 21:53:03,Senator Corker and @MarkWarner will discuss #GSEReform at an event hosted by @BPC_Bipartisan tomorrow morning. More: http://t.co/d20DOmxqVu.,5,1
357226997547679744,2013-07-16 19:55:27,"Senator Corker met with over 75 Tennesseans this morning, including a @boyscouts troop from Smyrna. Learn more: http://t.co/oOHkdCGG8j.",3,2
356790136811421697,2013-07-15 14:59:32,.@WSJ Letter to Editor: “[T]he Corker-Warner proposal represents a substantial improvement over the prior system” http://t.co/ZrpPKiOaMn,5,2
355736004717580288,2013-07-12 17:10:47,Zandi: Corker-Warner bill a “serious [effort] that would significantly reduce the gov’t’s role in the housing market” http://t.co/PEtFchyExW,5,2
355718869706481664,2013-07-12 16:02:42,ICYMI: Mark Zandi in @WashingtonPost: “It is time for the government to reduce its role in the mortgage business” http://t.co/PEtFchyExW,5,2
355714680959942656,2013-07-12 15:46:03,"Must read in @PostOpinions on president’s “feckless” #Syria policy: ""an extraordinary failure of leadership” –BC http://t.co/CKkchJ6E7g",3,3
355389678754607104,2013-07-11 18:14:36,Corker: #Obama administration must quit delaying decision on troop levels in #Afghanistan after 2014: http://t.co/0onwGp6BTo,3,2
355384853308522499,2013-07-11 17:55:26,Are you following Senator Corker on @instagram? Check out his latest photo from his trip to #Afghanistan here: http://t.co/UNyQAPQYxE.,1,1
355371372245037056,2013-07-11 17:01:52,"RT @TheWilsonCenter: ""I think that public discourse and debate is very important for our country. And I came here to solve our nation's pro…",4,0
355365331214155776,2013-07-11 16:37:52,RT @TheWilsonCenter: Amazing fact from @SenBobCorker: Senate hasn't approved a @USAID budget since 1986 #NatCon http://t.co/lEffAhiq2X,6,0
355365255309819905,2013-07-11 16:37:33,"RT @TheWilsonCenter: .@SenBobCorker: ""When Congress has no ownership"" it prevents the public from being well-informed on foreign policy htt…",3,0
355362628572418048,2013-07-11 16:27:07,Senator Corker is currently discussing #AUMF at an event hosted by @TheWilsonCenter. Tune in: http://t.co/nXFqHdmNPs. http://t.co/RceKBi4VzC,6,2
355353596545605633,2013-07-11 15:51:14,"Today at 12:00 pm ET, Corker will be @TheWilsonCenter to talk #AUMF: reasserting the role of Congress. Live stream: http://t.co/nXFqHdmNPs.",1,3
355324773338857472,2013-07-11 13:56:42,#SFRC hearing today at 10:00 am ET on #Afghanistan http://t.co/Gh6mhQVMh8 Read about Sen. Corker’s 4th trip there: http://t.co/6pbrYL397w,6,2
355128556734521345,2013-07-11 00:57:00,ICYMI: @TimesFreePress op-ed by Senator Corker: Securing the U.S. Border Now http://t.co/2ViVswlUbc,2,1
355105671517192192,2013-07-10 23:26:04,Corker Responds to North American Apparel Retailers Plan to Improve Safety in #Bangladesh Garment Industry http://t.co/RwS9dOW78w,1,2
355047541710139394,2013-07-10 19:35:05,"Corker: “@MarkWarner and I are really proud that @SenatorKirk has joined the eight of us"" in our #GSEReform efforts. http://t.co/rsEQ0NnaYq",6,3
355047053111463936,2013-07-10 19:33:08,ICYMI: @SenatorKirk joins Corker-Warner efforts on bill to wind down #Fannie and #Freddie. Read more: http://t.co/rsEQ0NnaYq. #GSEReform,2,3
354672561604407297,2013-07-09 18:45:02,"Former Senator @JohnSununu in @BostonGlobe: Corker-Warner #GSEReform “plan is bipartisan, substantive, and bold…” http://t.co/Llar8hYZj6",2,1
354648038536523776,2013-07-09 17:07:36,ICYMI: Former Senator @JohnSununu writes in @BostonGlobe about Corker-Warner #GSEReform efforts: http://t.co/Llar8hYZj6,4,2
354606329005998080,2013-07-09 14:21:51,Corker: Secrecy of #Obama administration's plan to arm #Syrian opposition “unacceptable” http://t.co/k2bqHzVH2l,4,2
354563816505352192,2013-07-09 11:32:55,TUNE IN: Senator Corker will be on @SquawkCNBC momentarily to discuss bipartisan #GSEReform efforts and health care,4,0
354351044857303043,2013-07-08 21:27:27,"Corker makes fourth trip to #Afghanistan as U.S. looks to transition, visits with #Tennessee troops http://t.co/6pbrYL397w",5,1
354277404270792704,2013-07-08 16:34:49,"Corker &amp; @SenAlexander: Immigration bill “[secures] our border, ends perpetual amnesty, and encourages job creation.” http://t.co/Wuv1uFRaXB",5,2
354271749392699392,2013-07-08 16:12:21,"Corker, @SenAlexander op-ed in @Tennessean and @LeafChronicle today: Immigration bill would add jobs, secure border http://t.co/Wuv1uFRaXB",5,0
354245063343226880,2013-07-08 14:26:19,"RT @TimPawlenty: #Bipartisan #GSE reform from @MarkWarner &amp; @SenBobCorker protects taxpayers against bailouts, story by @pswagel: http://t.…",11,0
354194593388052480,2013-07-08 11:05:46,"More @pswagel: Corker-Warner “seeks a balance,” ensures private capital is at risk ahead of the guarantee http://t.co/JyU6GDIpYg #GSEReform",2,1
354191579956789248,2013-07-08 10:53:47,".@pswagel via @nyteconomix: Corker-Warner “...provides considerable protection for taxpayers."" http://t.co/JyU6GDIpYg #GSEReform",2,2
354190992787779585,2013-07-08 10:51:27,ICYMI: @pswagel via @nyteconomix: Progress on Housing Finance Reform: http://t.co/JyU6GDIpYg #GSEReform,2,1
353886242024333312,2013-07-07 14:40:29,ICYMI: @TimesFreePress column by @CHAchamber president Ron Harr: Corker’s work on immigration reform is commendable: http://t.co/Eo8Bq69kHE,3,2
353845686283948032,2013-07-07 11:59:20,REMINDER: Sen. Corker will be a guest on @FoxNewsSunday this morning. Local listings: http://t.co/sEzVCgZs0g. #Egypt http://t.co/d4hXtFeX2g,8,1
353675331351224320,2013-07-07 00:42:24,Senator Corker will be a guest on @FoxNewsSunday tomorrow morning. Local listings: http://t.co/sEzVCgZs0g. #Egypt http://t.co/Oqxvzp0Gm9,9,2
352829599039750144,2013-07-04 16:41:46,"Corker: “This Independence Day, I hope Tennesseans will join me in giving thanks for our service men and women…” http://t.co/uTGnEmXHpw",8,3
352125969173196800,2013-07-02 18:05:47,"RT @DW_Grant: Meet the Senate's happiest warrior, @SenBobCorker, who's up to much more than #immigration: http://t.co/NiiJI3koKd #syria #GS…",5,0
352100325945122818,2013-07-02 16:23:54,.@csmonitor: “[Corker is]… taking on enough issues to stuff an ordinary member’s schedule for an entire career.” http://t.co/kKjoChankM,3,0
352099404691419136,2013-07-02 16:20:14,"ICYMI: .@DW_Grant .@csmonitor: “Bob Corker, Senate GOP's tireless dealmaker, looking beyond immigration bill” http://t.co/kKjoChankM",2,2
352095460435042306,2013-07-02 16:04:34,Do #Karzai family discord &amp; donor report mean #KarzaiCash funds Afghan corruption? -BC http://t.co/vrj9RRpJsw http://t.co/oXaCvgILX0,1,0
350384529762025472,2013-06-27 22:45:56,Corker: Nominee for #StateDep IG Long Overdue http://t.co/C1b4JRUAYr,4,1
350367789451710464,2013-06-27 21:39:25,Senator Corker: “This is the toughest border security measure to ever pass the Senate” http://t.co/NUSGuZqbMw,7,1
350272865117020160,2013-06-27 15:22:13,".@politifact: “Legal experts we spoke to said, instead, it gives her discretion about where to build border fencing.” http://t.co/79D8LQo0Ba",1,1
350272404808929280,2013-06-27 15:20:23,.@politifact says claims that Napolitano would not have to build fence as required by #HoevenCorker trigger are FALSE http://t.co/79D8LQo0Ba,1,2
350005480061538304,2013-06-26 21:39:43,Corker: Passing this amendment gets us one step closer to securing our border in a dramatic way http://t.co/RyNP5wg4oJ,6,4
350003946049388544,2013-06-26 21:33:38,ICYMI: #HoevenCorker amendment passes with overwhelming support: http://t.co/RyNP5wg4oJ,1,1
349851623226482690,2013-06-26 11:28:21,.@washingtonpost Fact Check: “…virtually all of the bill —and the amendments— has been available to read for weeks.” http://t.co/TFx1JPZ19f,8,3
349846935747837953,2013-06-26 11:09:43,.@washingtonpost Fact Check: “...complaints of a rushed bill are overblown.” Complaints receive 3 Pinocchios. http://t.co/TFx1JPZ19f,4,1
349651434041647104,2013-06-25 22:12:52,Corker: Bill is “Best opportunity…to finally move beyond the failed GSE model of private gains &amp; public losses.” http://t.co/5Mrtu7K3Bl,4,1
349649220359299073,2013-06-25 22:04:04,"Senators Corker, @MarkWarner &amp; colleagues introduced #GSEReform legislation today. Bill text &amp; summary here: http://t.co/5Mrtu7K3Bl",0,0
