id,created_at,text,retweets,favorites
464464931132563456,2014-05-08 18:00:43,Getting synthetic drugs off our streets is a priority for me. DEA is making sure producers and distributors know that http://t.co/TvqVCuwnns,2,1
464435583813943297,2014-05-08 16:04:06,"Bringing the Lucas Museum to SF would be great for the City—a boon for art, education and tourism. #SF4LucasMuseum http://t.co/T1B7xiGpQp",5,6
464172584196927488,2014-05-07 22:39:02,Read my letter asking @DeptofDefense to halt changes to the way the National Guard conducts firefighting missions. http://t.co/qfrHbxeMW9,4,2
464167266947723264,2014-05-07 22:17:54,.@Cirincione #NuclearSecurity is an important issue. Will continue to press for nonproliferation funding.,3,3
464151731874832384,2014-05-07 21:16:11,Thanks for all your work! RT @LaurenWilkerLLS Leukemia &amp; Lymphoma Society met with the office of @SenFeinstein. http://t.co/rNJKC87ofE,1,3
464142520138870784,2014-05-07 20:39:34,Proud to see my alma mater taking the lead on this very important issue. http://t.co/CD4S8U4jdt @Stanford,6,8
464125364995104769,2014-05-07 19:31:24,"Talking with Californians is a great way to start my day. This morning, I met with 150 to talk about key issues. http://t.co/arYGcpYJhi",3,6
464119102878273536,2014-05-07 19:06:31,We must not allow a safe haven to develop for Boko Haram. The world must not tolerate evil. #BringBackOurGirls http://t.co/xOsCmHrGd0,26,9
464110846646706176,2014-05-07 18:33:43,I support sharing necessary intelligence with Nigerians to #BringBackOurGirls http://t.co/xOsCmHrGd0,9,9
464101878134231043,2014-05-07 17:58:05,"I support whatever actions are necessary to locate, capture &amp; eliminate the Nigerian kidnappers. #BringBackOurGirls http://t.co/xOsCmHrGd0",29,14
464073713538048000,2014-05-07 16:06:10,Proud of the supermoms today as they bring the issue of antibiotic resistance to the forefront. http://t.co/N7IMR0dQ38 #saveabx,14,12
464038431090561024,2014-05-07 13:45:58,RT @SenatorBarb: Today w @SenatorCollins led all 20 Senate women condemning abduction &amp; mistreatment of girls in Nigeria by Boko Haram http…,30,0
463807562387693568,2014-05-06 22:28:34,Quite a thrill to meet Bill Nye @TheScienceGuy to talk space exploration and science education. Thanks for visiting! http://t.co/sSWpltRu5C,19,36
463800507979411456,2014-05-06 22:00:32,"Read my statement on the release of the third U.S. National Climate Assessment, a report on climate change: http://t.co/iFV2UjpQBV",3,4
463786514476834816,2014-05-06 21:04:56,Climate report: Water supply already stressed. Climate change only makes things worse. Read: http://t.co/WPdtBEu3a6 http://t.co/7vVJ3peVhE,17,7
463774444452712448,2014-05-06 20:16:58,Climate report: Still time to act to limit catastrophic temperature increases. Read here: http://t.co/WPdtBEu3a6 http://t.co/cfv4sUz0JN,7,5
463758783806570498,2014-05-06 19:14:44,Climate report: Rapidly rising sea levels would devastate coastal areas like Calif. Read: http://t.co/WPdtBEu3a6 http://t.co/oIV9R3XKGL,16,4
463742281120370688,2014-05-06 18:09:10,Climate report: Extreme temperature increases in store if we sit on our hands. Read here: http://t.co/WPdtBEu3a6 http://t.co/a3sm3iKBOb,20,3
463726646004940800,2014-05-06 17:07:02,"Climate report: If we don’t reduce emissions, drought conditions will be the new normal. Read: http://t.co/WPdtBEu3a6 http://t.co/d3ak6epsL0",15,8
463438159087271936,2014-05-05 22:00:42,"Great meeting with Sacramento @Metro_Chamber on water policy, innovation, higher ed &amp; international trade. #cap2cap14 http://t.co/o8HNELoKQR",6,7
463430923103789056,2014-05-05 21:31:56,Wishing everyone a very happy Cinco de Mayo!,5,5
463407529981378560,2014-05-05 19:58:59,I think the following resources are especially helpful for Hispanic students hoping to take the next step: http://t.co/KiqlNwNQ14,2,3
463407285440880640,2014-05-05 19:58:01,Still work to be done. Only 8.2% of college enrolled Hispanics pursue Science/Engineering degrees. Help for students: http://t.co/KiqlNwNQ14,1,0
463406761702338560,2014-05-05 19:55:56,Glad to see high school graduation rates among Hispanic students are at an all-time high. College enrollment rates also at a record 69%.,7,4
463346233558695936,2014-05-05 15:55:25,"As someone who has loved horses all my life, I was thrilled to see California Chrome win the #KyDerby over the weekend. Hope you saw it!",4,10
462289581086625792,2014-05-02 17:56:39,Glad to see @WhiteHouse is using beautiful cut flowers from California and across the country.  http://t.co/D3iZHaYtmA,5,8
462272706332069888,2014-05-02 16:49:36,Help our foster youth find their forever families and make lasting connections. #NationalFosterCareMonth  http://t.co/edFcBlqLWl,7,2
461942531396476928,2014-05-01 18:57:36,More than 1.4 million Californians signed up for new health insurance thanks to the ACA. More info on your options at http://t.co/NlTAPaD72L,4,2
461623611657551872,2014-04-30 21:50:20,Good news! Cynthia Bashant confirmed for Calif’s Southern District Court. She has been a real leader in San Diego. http://t.co/4NLHEWluCi,4,7
461600952441917441,2014-04-30 20:20:17,"If natural disaster strikes, do you have an action plan? Find out how you can prepare here: http://t.co/DYRw2R11MV. @PrepareAthon",7,6
461547813093253120,2014-04-30 16:49:08,"Disappointed the effort to raise the minimum wage was, once again, blocked by Senate Republicans. #RaiseTheWage",27,12
461536330418515968,2014-04-30 16:03:30,Headed to the Senate floor to vote for the Minimum Wage Fairness Act. We need to #RaiseTheWage so all working Americans get a #FairShot.,6,14
461211766312415232,2014-04-29 18:33:48,"A minimum wage increase would boost the income of more than 63,000 veterans in California and 1 million across the country. #RaiseTheWage",50,17
460911051102777344,2014-04-28 22:38:52,"Senate confirmed Calif’s Michelle Friedland to the 9th circuit court, which now has a full complement of 29 judges. http://t.co/WbXh1N5Lvl",9,6
460856529970012162,2014-04-28 19:02:13,"If true, these comments are disgraceful. Californians deserve better. Such language has no place in society. http://t.co/6lOLEZxRmB",11,11
460822392001290240,2014-04-28 16:46:34,"Working families should not have to wait on Congress any longer. Household incomes are flat, cost-of-living has gone up. #RaiseTheWage",10,8
460820069766139904,2014-04-28 16:37:20,"This week, the Senate will vote on an issue the American public overwhelmingly supports: increasing the minimum wage. #RaiseTheWage",14,12
460813421836263424,2014-04-28 16:10:55,I’m back in Washington and continuing the effort to #RaiseTheWage. I believe all Americans deserve a #FairShot at building a good life.,7,14
459799474433302528,2014-04-25 21:01:52,"Now is the best time to see desert flowers @JoshuaTreeNP, like the beautiful Parish’s Poppy.#NationalParkWeek http://t.co/G98e9CIKcl",9,8
459749475280379905,2014-04-25 17:43:11,Plenty of gorgeous walks along the Pacific Ocean at Pt. Reyes National Seashore. Enjoy a hike for #NationalParkWeek. http://t.co/r61iy0wDJS,11,14
459448002521075712,2014-04-24 21:45:14,Pleased @EPA is on board with the mission to restore water quality and wetlands throughout the San Francisco Bay. http://t.co/westTIrLen,10,10
459431811823575040,2014-04-24 20:40:54,"Central Coast’s @PinnaclesNPS is the newest National Park, 1st since 2004. http://t.co/1BhjZKbWhU #NationalParkWeek http://t.co/jHaKyiOYyL",19,21
459408307917426689,2014-04-24 19:07:30,VETERANS: The @DeptVetAffairs has launched a one-stop shop with job opportunities for returning service members. http://t.co/UcOrUIeUoa,5,5
459379719184867329,2014-04-24 17:13:54,"Thanks to #ACA, small business owners can receive help covering premiums. See if your business qualifies: http://t.co/eifAl54a52",7,2
459072793984765952,2014-04-23 20:54:17,"Get outside for #NationalParkWeek. Visit Half Dome at @YosemiteNPS—4,737 ft high from the bottom of Yosemite Valley! http://t.co/D3Fd7cbJp9",8,13
459050743824400387,2014-04-23 19:26:40,"They may be little, but breast cancer research stamps have a big impact, raising $78.6 million to fight this disease. http://t.co/zIZAsPmkpI",7,5
458695600402604032,2014-04-22 19:55:27,Happy #EarthDay! Celebrate by planning a visit to one of California’s many majestic national parks. So much to see! http://t.co/GLtxM3GNC1,8,8
458663124829081600,2014-04-22 17:46:25,A truly inspiring image. RT @NASA Here's a stunning view of Earth today on #EarthDay at 7:45a ET from #GOES satellite http://t.co/6NcloM0fSQ,14,15
458333227892350977,2014-04-21 19:55:31,"Congratulations to Meb Keflezighi, the first American man to win the Boston Marathon in 31 years. UCLA graduates do big things!",16,28
457179535336034304,2014-04-18 15:31:09,Read more about California’s safe haven law for newborn babies here: http://t.co/2IXjL5iVIS. Every infant deserves to be safe and cared for.,14,5
456542683570270208,2014-04-16 21:20:32,Great visit to the @Livermore_Lab Additive Manufacturing Facility yesterday. Thanks for having me. http://t.co/NhGhgshZoN,9,11
456472493793234944,2014-04-16 16:41:38,Read my letter with @SenatorDurbin and @SenGillibrand to @USDA calling for standards to reduce bacteria in poultry. http://t.co/iYm7oeIAEA,3,3
456132927030853632,2014-04-15 18:12:19,Take a stand against sexual assault. Learn how you can help raise awareness here: http://t.co/CYHD6tKFtn #SAAM,2,7
454640223876841473,2014-04-11 15:20:50,"My heart goes out to those involved in yesterday’s bus crash in Orland, Calif. The victims and families are in my thoughts this morning.",9,5
454346273265819648,2014-04-10 19:52:47,"Wonderful news for Southern California. @Boeing plans to add 1,000 jobs based in Long Beach and Seal Beach. http://t.co/jyEu7P6qYC",11,8
454016497619578880,2014-04-09 22:02:22,"Senate-passed unemployment insurance extension would help more than 35,000 California veterans seeking jobs. House must act. #RenewUI",23,15
454005063657472000,2014-04-09 21:16:56,I’m disappointed Senate Republicans blocked the Paycheck Fairness Act again. The time for #EqualPay for equal work is now.,27,19
453993548187439104,2014-04-09 20:31:11,This week is National Volunteer Week. Plenty of opportunities available to help make your community a better place: http://t.co/j04Vx1JNGl,7,5
453976645209055232,2014-04-09 19:24:01,"Enjoyed breakfast today w/ 150 Californians. Health care, #EqualPay and CA water were among the topics of discussion. http://t.co/wMLpZWqDS4",1,4
453658148348657664,2014-04-08 22:18:25,Watch me talk about the Intelligence Committee’s CIA detention and interrogation report on @MSNBC’s @MitchellReports. http://t.co/GrwCl8Z3v3,17,15
453639454314348544,2014-04-08 21:04:08,Thanks to the president for two executive actions to help fight pay discrimination and strengthen equal pay laws. http://t.co/0ggQ0LrqkR,15,10
453622090202374145,2014-04-08 19:55:08,"Unless Congress acts, the gender pay gap won’t disappear until 2058. Please weigh in! #EqualPay for equal work.",18,10
453607286544797697,2014-04-08 18:56:19,"Urge your senators &amp; representatives to support the Paycheck Fairness Act. Gender pay gap hurts women, families and businesses. #EqualPay",14,12
453598558118477825,2014-04-08 18:21:38,The time has come. Women should be paid the same as men for the same job. Please weigh in! #EqualPay for equal work.,20,17
453560282263343104,2014-04-08 15:49:32,I’ll be on @MSNBC’s @MitchellReports in the noon EST hour to discuss the CIA detention and interrogation report and equal pay for equal work,6,6
453297031386513408,2014-04-07 22:23:28,I’m pleased the Senate voted to renew a crucial lifeline for unemployed Americans. Now the House must act. #RenewUI,56,50
453274912015548417,2014-04-07 20:55:35,Please join me in observing National Crime Victims’ Rights Week. Resources to promote the rights of victims here: http://t.co/iWUSovrwq4,8,7
453244349342826496,2014-04-07 18:54:08,"Senate will vote soon to #RenewUI today. 296,000+ Californians stand to benefit from resumption of unemployment insurance benefits.",35,24
453227002334818304,2014-04-07 17:45:12,Ensuring #EqualPay for equal work helps the entire economy. U.S. economy produces $447.6 billion in additional income if women paid equal.,17,7
453209419900530688,2014-04-07 16:35:20,Women earn 77 cents for every dollar paid to men. I’ll be voting for the Paycheck Fairness Act because I support #EqualPay for equal work.,20,15
452164293140959233,2014-04-04 19:22:22,April is National Child Abuse Prevention Month. Numerous resources available to ensure a child’s safety and security. http://t.co/1s060GXLkA,11,5
452145670351486976,2014-04-04 18:08:22,"Great news: Calif ports of entry to get 455 new @CustomsBorder officers to speed travel &amp; commerce, find drugs/explosives. Vital investment.",4,4
451805352821276673,2014-04-03 19:36:04,Read my statement on the Intelligence Committee’s vote to declassify the CIA detention and interrogation study. http://t.co/TU7KG4IeHN,75,46
451721037550731264,2014-04-03 14:01:02,I am heartbroken by the tragedy at Fort Hood. My thoughts and prayers are with the victims and their families.,13,10
451463106641022976,2014-04-02 20:56:07,I believe that competition is key to bringing down the cost of space launch. Read my letter to the Dept of Defense: http://t.co/OXWJtb39Vv,5,5
451419555676819456,2014-04-02 18:03:03,A big win for California Medicare doctors. Senate passed a bill earlier this week to reimburse docs at fair rates. http://t.co/nkP1Xsey9B,10,7
451125048041287681,2014-04-01 22:32:47,"Introduced bill today w/ @SenatorCardin, @BrianSchatz to offer tax incentives to promote energy efficiency. http://t.co/LJGhrlqSOD",16,7
451106587726606337,2014-04-01 21:19:26,Yet another startling report details dangers of climate change. The evidence is piling up—we must take action. http://t.co/Zcffsg2u70,16,13
450758973017575424,2014-03-31 22:18:08,"Senate just confirmed California’s John Owens for Ninth Circuit Court. Stellar record, well qualified and ready for the job.",10,4
450735487654047744,2014-03-31 20:44:49,"Watch me talk about the missing Malaysian airliner, Ukraine and U.S. intelligence programs on @CNNsotu. http://t.co/QohCxNm1wt",10,1
450715583857041410,2014-03-31 19:25:43,LAST DAY to begin your application for health care coverage through @CoveredCA. Deadline at midnight. http://t.co/bWAc3wxqH7  #GetCovered,17,5
450695359434858496,2014-03-31 18:05:21,"Today we honor Cesar Chavez, a champion for workers and an inspiration for improving human rights worldwide. http://t.co/sQpPaoVthv",13,10
449629685522391041,2014-03-28 19:30:45,3 days left: #GetCovered through @CoveredCA. Open enrollment ends March 31. Check out options healthcare plans here: http://t.co/bWAc3wxqH7,12,7
449608875793469440,2014-03-28 18:08:03,Good news from @US_FDA. Drug companies agree to limit antibiotic use in agriculture. http://t.co/m6MMO380QS,3,7
449314577017470976,2014-03-27 22:38:37,Read a bipartisan letter to the administration calling for immediate steps to capture water from this week’s storm. http://t.co/6I3dpJWXkd,6,2
449307280971157505,2014-03-27 22:09:38,Senate today advanced nomination of Judge Owens for the 9th circuit. Vote on final confirmation scheduled next week. http://t.co/bhvY3aHuQH,7,2
449304281615990784,2014-03-27 21:57:43,"AMBER ALERT: Help find Relisha Rudd, an 8-year-old girl missing from Washington, D.C. http://t.co/BnKbGDNKIy",80,7
449297235466268672,2014-03-27 21:29:43,"50 years ago, a tsunami from the Great Alaska Quake killed 12 in Crescent City, Calif. Remembering the lives lost. http://t.co/FbzzYAZK6G",5,2
449284733089107968,2014-03-27 20:40:02,"Before #ACA, it was common practice for insurance companies to charge women more for coverage. Now, that’s illegal. #ACAworks",23,13
449277142741041153,2014-03-27 20:09:52,"Before #ACA, one-third of young adults lacked health care coverage. Now, they can stay on their parents plan until age 26. #ACAworks",21,15
449268918210002944,2014-03-27 19:37:11,"Before #ACA, seniors paid hundreds for preventive care. Now, 37 million seniors get preventive care for free. #ACAworks",28,8
449261831274909696,2014-03-27 19:09:02,RT @WhiteHouse: BREAKING: More than 6 million people have signed up for private health plans. #GetCoveredNow: http://t.co/0fstLgRCLC http:/…,420,0
449253429865889792,2014-03-27 18:35:39,"The Senate today passed an aid bill for #Ukraine, a message of support to Kiev and a boost for Ukraine’s economy.",4,3
449235623325741057,2014-03-27 17:24:53,Very proud of LA’s Maria Contreras-Sweet. She has all the right tools to be an effective leader at the @SBA. http://t.co/HL1Y0QWDS5,6,1
448948418665533441,2014-03-26 22:23:38,Supreme Court voted unanimously to strengthen law preventing those convicted of domestic violence from having guns. http://t.co/1oco7n6yHn,33,20
448937910352769024,2014-03-26 21:41:53,5 days left: #GetCovered through @CoveredCA. Open enrollment ends March 31. Check out options healthcare plans here: http://t.co/bWAc3wxqH7,14,2
448916689154220032,2014-03-26 20:17:33,Senior AQ figure convicted on conspiracy to kill Americans. Expect Abu Ghayth will spend rest of his life in prison. http://t.co/zWxn5Bf9HA,8,3
448575960997462016,2014-03-25 21:43:37,6 days left: March 31 is the last day to enroll for health insurance through @CoveredCA. More info here: http://t.co/bWAc3wxqH7,4,2
448559558244696064,2014-03-25 20:38:27,Veterans must beware of predatory lending scams targeting those receiving GI Bill benefits. Report incidents here: http://t.co/roQqERWySY,12,3
448526901502812160,2014-03-25 18:28:41,Read my statement on proposed reforms to the NSA call records program: http://t.co/eYFlRP6ZWz,7,3
448192981540286464,2014-03-24 20:21:48,"7 days left: #GetCovered through @CoveredCA. Open enrollment ends March 31. Check out options, healthcare plans here: http://t.co/bWAc3wxqH7",12,4
447087642480738304,2014-03-21 19:09:35,Open to changes to #NSA call records program IF alternatives preserve operational effectiveness. http://t.co/XZhWHO90Ja,7,4
447079575135084546,2014-03-21 18:37:31,Ran into @StephenCurry30 during the @BayAreaCouncil meeting at @warriors HQ in Oakland. #LetsGoWarriors http://t.co/ZjGeJtIp7O,60,182
445962568700817408,2014-03-18 16:38:56,"Happening today: President to award Medals of Honor to 24 vets, 6 w/ CA ties. Thank you for your bravery &amp; patriotism http://t.co/1Jxw7PKJy8",11,14
445667752431599616,2014-03-17 21:07:27,I spoke on the Senate floor last week as part of the @SenateDems all-nighter on climate change. Watch here: http://t.co/LRqdnYIVw2,6,6
445612738174529536,2014-03-17 17:28:50,"RT @60Minutes: Morley Safer explores the new, hardly regulated world of commercial drones: http://t.co/4zybACccd2  #60Minutes http://t.co/J…",67,0
444584434042683392,2014-03-14 21:22:43,"Congratulations to Redding’s Debbie Sprague, selected as 2014 @DoleFoundation veteran caregiver fellow for Calif. http://t.co/nPpbqJuDyK",4,1
444568554936238080,2014-03-14 20:19:37,Introduced a bill yesterday that protects fees paid by inventors to @USPTO from being diverted to other purposes. http://t.co/dAsmVhW3li,4,3
444547679440625665,2014-03-14 18:56:40,Veterans deserve to have their voices heard. My bill improves voter registration services for service members. Info: http://t.co/9U3rUGcdZY,11,10
444221438157791233,2014-03-13 21:20:18,Discussed CA water bond with members of @SF_Chamber today. Very productive meeting. Thanks for visiting Washington! http://t.co/GneUO8i1DX,8,6
444208827106619392,2014-03-13 20:30:12,Open enrollment for health insurance through @CoveredCA ends on March 31. Explore your options here: http://t.co/bWAc3wxqH7,8,2
443879062009028608,2014-03-12 22:39:49,RT @WhiteHouse: Women earn just $0.77 for every $1 men earn. Here's how raising the min wage would help close that gap: http://t.co/sCJesCC…,247,0
443868705630736384,2014-03-12 21:58:40,Pleased president signed @SenatorBoxer’s bill expanding Calif Coastal Nat'l Monument to include Point Arena shoreline http://t.co/DzhkazC4jN,9,12
443828168374239232,2014-03-12 19:17:35,"RT @LAAreaChamber: ""My job is to do everything to make sure this nation is protected."" - Sen. Feinstein #ACCESSDC",6,0
443439677983690752,2014-03-11 17:33:52,"Spoke on the floor of the Senate about Intel Committee’s 6,300 page CIA Detention and Interrogation study. Watch: http://t.co/WkHWZ5uaAH",81,40
443408467538083840,2014-03-11 15:29:51,Read my remarks on the Senate Intelligence Committee’s study of #CIA’s Detention and Interrogation Program: http://t.co/iLdByItJox,70,29
443371893161484288,2014-03-11 13:04:31,Speaking on the Senate floor now about the Intelligence Committee’s report on CIA interrogation and detention. Watch: http://t.co/0Zb8Ge7OR3,32,13
443151047901843456,2014-03-10 22:26:57,.@FERC takes step to guard against attacks on power grid—like the one that nearly knocked out a San Jose substation. http://t.co/zn22dlF2Bc,8,3
443093170948034560,2014-03-10 18:36:58,I’ll be joining many of my colleagues tonight on the Senate floor to discuss the need for urgent action to fight climate change. #Up4Climate,38,42
442019681466322944,2014-03-07 19:31:19,Reminder: Enroll by March 15 for health insurance that begins in April. @CoveredCA. More info: http://t.co/bWAc3wxqH7,5,0
441983219693809664,2014-03-07 17:06:25,"Important agreement between @CFTC,@FERC to share data. Crucial to prevent energy market manipulation we’ve seen in CA http://t.co/ZNJXWA37B2",13,1
441694943980306432,2014-03-06 22:00:55,Intel Committee approved nominees for three key national security posts. Next step: consideration by full Senate http://t.co/5E36ug5obc,4,2
441679394193825792,2014-03-06 20:59:08,Read my letter w/ @SenAlexander to @USDOT urging them to prohibit cell phone conversations on flights: http://t.co/aoVOUcjsDH,5,2
441661766783991808,2014-03-06 19:49:05,Glad the Senate passed a resolution I cosponsored honoring #WorldWildlifeDay. Important we protect biodiversity. http://t.co/pAgph5EVKV,5,7
441643566243512320,2014-03-06 18:36:46,His Holiness the @DalaiLama opened today's Senate session with a terrific prayer. Very inspirational.,7,7
441331355108921344,2014-03-05 21:56:09,Pleased with the Army Corps of Engineers work plan. $370 million for vital California infrastructure projects. http://t.co/1p0AScpflA,1,3
440972226888609792,2014-03-04 22:09:06,President released his 2015 budget request today. It offers roadmap to help working families and invest in California http://t.co/RIWOpkDtAA,11,3
440965355284856833,2014-03-04 21:41:48,Discussed economic development issues with San Bernardino County Board of Supervisors today. Very productive meeting. http://t.co/l1f40Jxz15,4,3
440948985147039744,2014-03-04 20:36:45,Today I spoke with the California @AIPAC delegation about Iran and the Middle East peace process. My 22nd year at the conference. #AIPAC14,12,11
440588016453550080,2014-03-03 20:42:23,Read my statement on the situation in Ukraine: http://t.co/VJLjQwGWKb,10,5
439526039111618560,2014-02-28 22:22:28,".@PeaceCorps week runs through March 1. Join me in recognizing 7,200 Americans for their service. http://t.co/ypfgXDGzd2",36,25
439111410702770178,2014-02-27 18:54:53,"In my view, we ought to do our best to give back to those returning from serving overseas. #Fight4Veterans http://t.co/yqbIxWUWYG",79,39
439089113229455360,2014-02-27 17:26:17,RT @alleghenycol: @SenFeinstein Congrats on receiving the Allegheny College Prize for Civility in Public Life! #CivilityPrize2014 http://t.…,2,0
438810858605776896,2014-02-26 23:00:36,Spoke today with Assn of Calif Water Agencies about the drought in California. A very important issue. Thanks for inviting me. @ACWAWater,8,4
438807074072702977,2014-02-26 22:45:33,Grateful the White House used California flowers (the very best!) at recent State Dinner for French President. http://t.co/x3DnBdcQ7o,7,7
438778533150609408,2014-02-26 20:52:09,"Met w/ Ellen Saracini, widow of United 175 Capt. Saracini. Happy to cosponsor important cockpit security legislation. http://t.co/Nj9Ix4cJQt",4,6
438398522246066176,2014-02-25 19:42:07,I’m chairing a hearing now on the nominations of two key intelligence community officials. Watch LIVE here: http://t.co/8G5UK6xbrF,24,2
438376792072929281,2014-02-25 18:15:46,"Congratulations to Jim Donato and Beth Freeman, my recs to president for California’s Northern District Court. http://t.co/nZU2S1POIm",4,0
438344304575385600,2014-02-25 16:06:40,RT @bradybuzz: Sarah Brady shares why Congress needs to #FinishtheJob and expand #BradyBackgroundChecks  http://t.co/DJ0R5EmJnY via @CNNOpi…,15,0
438083288570552321,2014-02-24 22:49:29,St. Anthony’s soup kitchen is a very special place. 40 million meals served since 1950. A big help to the community. http://t.co/JT8xtCu4MH,11,7
438053674842324993,2014-02-24 20:51:49,"El Chapo, world’s most powerful drug trafficker, is now behind bars. Congratulations to Mexican, US law enforcement. http://t.co/mhMZy5nYJU",7,6
436982767675785216,2014-02-21 21:56:25,Zero water allocation announced by @usbr shows severity of CA drought. My bill immediately assists farms/businesses. http://t.co/X1a0eZwX3K,11,1
436958560161775616,2014-02-21 20:20:13,"Joined @LAMayorsOffice, @RepBecerra, @RepRoybalAllard in LA to announce $670 million for Regional Connector project. http://t.co/LVZaRm74kG",7,4
436944771605880832,2014-02-21 19:25:26,"CA’s Walter Ehlers, last living Medal of Honor recipient from Omaha Beach, passed away. My thanks for your service. http://t.co/J7biJ8OoQE",6,10
436943162045911040,2014-02-21 19:19:02,California’s @Metrolink is 1st commuter rail system in U.S. to use lifesaving positive train control (PTC) technology http://t.co/tqTt36zgTR,6,6
