id,created_at,text,retweets,favorites
524667053257801729,2014-10-21 21:02:28,Cybersecurity month: Dedication to online protection is key for the success of businesses and entrepreneurs. http://t.co/a1yiaFD5Qe,1,5
524315629789011969,2014-10-20 21:46:02,I joined @SenGillibrand and @SenatorDurbin to call on @USDA to implement stronger standards against food pathogens. http://t.co/sDqKZZZi4x,5,9
524309695813517312,2014-10-20 21:22:27,This stunning @NewYorker short film takes a closer look at the devastating effects of the California drought: http://t.co/zKwTqlT9kL,10,7
523219415907983361,2014-10-17 21:10:04,I bet @clairecmc the @SFGiants will win the World Series and wagered a feast of Bay Area favorites. #OrangeOctober http://t.co/sIJX5OdD8a,4,9
523211276068343808,2014-10-17 20:37:43,"It's #NationalMammographyDay. By detecting cancer early, mammograms help save lives. #BreastCancer http://t.co/4cemBizYTy",6,3
523118565764116480,2014-10-17 14:29:19,The @SFGiants win the pennant! Congratulations on another trip to the World Series! #OrangeOctober #OctoberTogether,10,12
522852026838188032,2014-10-16 20:50:11,Proud to join LGBT youth and #GoPurple on #SpiritDay to take a stand against bullying. http://t.co/8m9Dj4Jcn6,13,18
522843356733272066,2014-10-16 20:15:44,Cybersecurity month: Important for consumers to practice safe online habits and protect all devices. http://t.co/Kt7dT2xf9F,3,4
522822703829360641,2014-10-16 18:53:40,.@NewsHour reports @HUDgov count of homeless children likely too low. My bill with @SenRobPortman addresses that. http://t.co/QXHJ4pKLtw,3,2
522488846114906112,2014-10-15 20:47:02,Open enrollment for @MedicareGov starts today. Review your plan at http://t.co/3a9urpMTd2 to ensure it’s the right plan for you.,10,4
522457626937159680,2014-10-15 18:42:59,Preparation is key to earthquake safety. Fewer than 1 in 3 adults participated in a drill last year. http://t.co/9YXXV7drAu #ShakeOut,4,8
522457452848369666,2014-10-15 18:42:18,The Great #ShakeOut is tomorrow at 10:16 a.m. The largest earthquake drill in the world helps us prepare for the worst.,15,3
522407590316482563,2014-10-15 15:24:10,Here are some good ways from the @LAMayorsOffice to reduce your water usage by 20%: http://t.co/WYr90y1jVN,24,13
522407322807967744,2014-10-15 15:23:06,"We all must do our part to cut down on water usage during this historic drought. Great leadership, @LAMayorsOffice. http://t.co/WbacmO2Ktf",5,8
522115805732143104,2014-10-14 20:04:43,A closer look at major faults in the Bay Area. More proof an earthquake early-warning system is needed. From @SFGate: http://t.co/Tn3GrjBpfp,4,3
520654834408906752,2014-10-10 19:19:20,Fleet Week is a great tradition and I'm happy to celebrate in San Francisco. Here is my #SelfieWithAMarine http://t.co/b2QxYfn6H6,20,18
520649436964605952,2014-10-10 18:57:53,.@NYTopinion says Obama administration should consider request to ensure same-sex couples receive equal benefits. http://t.co/DQRam5H1Lq,5,2
520644962510446592,2014-10-10 18:40:06,"Congratulations to Malala Yousafzai and Kailash Satyarthi, tireless champions for global children’s rights. http://t.co/inmrsrK36f",6,12
520639563690426368,2014-10-10 18:18:39,I fully support the president’s designation of the San Gabriel Mountains National Monument: http://t.co/I8elDVdnQr,9,7
520629493434941440,2014-10-10 17:38:38,Cybersecurity month: This week focuses on the secure development of products like phones &amp; tablets. http://t.co/ioxsnknphQ,4,4
520606998115942400,2014-10-10 16:09:15,We need to #RaiseTheWage. Working women are disproportionately affected by a low #MinimumWage. http://t.co/kP9EIMRo3X,22,14
520312364542214144,2014-10-09 20:38:29,Proud to receive a 100% score from @HRC. We must keep moving forward on equality for all. Next up: #RepealDOMA. http://t.co/PAo4lSsFFV #LGBT,8,12
520296803905069056,2014-10-09 19:36:39,RT @WhiteHouse: FACT: The number of uninsured young Americans has dropped by nearly 40% over the past 4 years. #ACAWorks http://t.co/eg1H9M…,621,0
520288775596175360,2014-10-09 19:04:45,I joined 20 senators in calling for strong U.S. support for the people of Hong Kong and their democratic aspirations. http://t.co/DQ1fEOb0P8,17,14
519972391754403841,2014-10-08 22:07:33,Read my letter to the president asking for full and equal treatment for married same-sex couples under federal law. http://t.co/XkYbE4gX4g,11,14
519969450079293440,2014-10-08 21:55:52,"A woman working full time at minimum wage will earn $14,500 annually—$4,000 below poverty line for mom with 2 kids. #WEmatter #RaisetheWage",24,17
519969145887424512,2014-10-08 21:54:39,Congress must act to #RaiseTheWage to ease the burden placed on working moms and their families. #WEmatter. #Igualdadsalarial,6,8
519968609675018241,2014-10-08 21:52:31,Today is Latina Equal Pay Day. California Latinas earn 43.6 cents for every $1 paid to men. Must be addressed. #WEmatter #Igualdadsalarial,22,12
519951394422263808,2014-10-08 20:44:07,Nobel Prize in chemistry awarded to Dr. William Moerner of @Stanford for his groundbreaking work in microscopy. http://t.co/tIu1UhGqFh 3/3,4,8
519951193615765505,2014-10-08 20:43:19,Nobel Prize in physics awarded to Dr. Shuji Nakamura of @UCSantaBarbara for his work to address global warming. http://t.co/8mqtBcrw5N 2/3,7,8
519951017534697472,2014-10-08 20:42:37,Two California professors were awarded Nobel Prizes this week. California universities lead the way in research and innovation. 1/3,6,10
519930187216338944,2014-10-08 19:19:51,We need stricter enforcement to deter manipulation of energy markets. My letter with @SenCarlLevin &amp; @CantwellPress: http://t.co/UTrUO9sq8L,6,6
519869435298217984,2014-10-08 15:18:26,"Well done, @SFGiants! Onto the next round we go! #OrangeOctober #OctoberTogether",7,15
519604416932900867,2014-10-07 21:45:21,RT @Podesta44: Yikes! Check out these 3 @NASA satellite images of water loss in CA #ActOnClimate http://t.co/JESzEZ0jiV,433,0
519590280761061376,2014-10-07 20:49:11,California universities are worldwide leaders in higher education. Two are in top 5 @TimesHigherEd rankings. http://t.co/ZlccEJzhXh,8,5
519566368476127232,2014-10-07 19:14:09,October is National Cybersecurity Awareness Month. Cyber attacks are a top economic and national security threat. http://t.co/fOFl2rBrAZ,11,2
519185769064583168,2014-10-06 18:01:48,The border is more secure than ever. There is no excuse to delay action on immigration reform. Read more in my op-ed. http://t.co/mjOCU95sxu,23,11
519157714493378560,2014-10-06 16:10:19,Important: we must still #RepealDOMA to ensure same-sex couples have equal protection under federal law. Working to gain bipartisan support.,11,13
519157245893181440,2014-10-06 16:08:27,"Another step forward: By letting rulings stand, #SCOTUS today brings marriage equality to up to 11 states. http://t.co/v8SptXmfye",34,21
518118254880231425,2014-10-03 19:19:52,The latest data breach affected 83 million JP Morgan Chase accounts. The Senate must pass cyber info-sharing bill. http://t.co/uu7pqkcI5S,11,11
518087887225516034,2014-10-03 17:19:12,.@RepThompson I agree. Assistance for families is sorely needed so they can rebuild their lives.,1,2
517791289073750017,2014-10-02 21:40:38,Here’s a #TBT to wish the @SFGiants good luck in the postseason. Great win last night! Bring on the @Nationals! http://t.co/6LNgZmjdTZ,17,15
517788365492871168,2014-10-02 21:29:01,Pleased @US_FDA released more data on antibiotic use in agriculture. We must ensure antibiotics are used responsibly. http://t.co/wRphyeIX9g,6,6
517744389435969536,2014-10-02 18:34:16,Great editorial on importance of expanding Pacific marine reserve MT @NYTopinion: Editorial: Obama’s Pacific Monument http://t.co/xfGunQhoZo,4,3
517424708598644736,2014-10-01 21:23:58,Three former @ForestService chiefs explain in the @LATimes why wildfires need to be funded like all other disasters. http://t.co/hRlu8ssZPr,2,3
517417183962755072,2014-10-01 20:54:04,Happy Birthday to President Jimmy Carter who turns 90 today!,24,31
517405427009859585,2014-10-01 20:07:21,Spot-on @NYTopinion piece. We must reduce overuse of antibiotics in health care and agriculture. http://t.co/L5bR9jiTdT #SaveABX,3,4
517391199540617216,2014-10-01 19:10:49,"As transport of oil by train increases in California, we must develop stronger safety standards. My letter: http://t.co/K4Ra3n5HJV",6,2
517372650872913921,2014-10-01 17:57:06,Great to see California companies working with @TechWomen to advance careers of women from Middle East and Africa. http://t.co/Fi9SEFrZaA,15,8
517065431765770240,2014-09-30 21:36:20,24 Calif schools received the @edgov Blue Ribbon for student performance and closing the achievement gap. Great work! http://t.co/YRbqx3Jmr3,3,6
517048157042003968,2014-09-30 20:27:41,Honored to receive Defender of Children Award. Supporting children and families has always been a top priority. http://t.co/xGd7OrnWzo,3,7
516698926938734593,2014-09-29 21:19:58,"A must read from @ChrisMurphyCT on the Super Pollutants Act of 2014, which I am proud to co-sponsor. #ActOnClimate http://t.co/y1Zk4YroO4",5,5
516691273701670912,2014-09-29 20:49:33,I joined @SenatorBoxer @RonWyden and @SenJeffMerkley to call for more safety precautions for trains carrying oil. http://t.co/Dc7CZzvc87,5,6
516683116535361536,2014-09-29 20:17:09,I look forward to continued US-Afghan security cooperation. Terrorist safe havens must be prevented. http://t.co/TV5NEFnjye,3,5
516672501322383360,2014-09-29 19:34:58,Today’s peaceful democratic transition in Afghanistan is an important step for the country’s future. http://t.co/TV5NEFnjye,3,4
516639102356430848,2014-09-29 17:22:15,I applaud @JerryBrownGov for signing legislation into law that will crack down on human trafficking. http://t.co/oOLAh9uuLX,15,11
515600957284315136,2014-09-26 20:37:02,Good news for California tribes who will receive Justice Dept. grants to bolster law enforcement and safety programs. http://t.co/DcYrW4DaeP,7,3
515581418484011008,2014-09-26 19:19:23,Celebrate National Public Lands Day this Saturday. Help out by volunteering or take advantage of zero fees. Info: http://t.co/9kBK57Yan7,6,2
515252433178869760,2014-09-25 21:32:07,"This designation protects coral reefs and marine ecosystems, very vulnerable to effects of climate change. http://t.co/VJ4Hnp1XXP",8,13
515252396575195137,2014-09-25 21:31:58,"Good news: President Obama has expanded the Pacific Remote Islands Marine Nat’l Monument to 490,000 square miles. http://t.co/VJ4Hnp1XXP",12,15
515246933699727360,2014-09-25 21:10:16,Eric Holder has been an outstanding attorney general and I wish him the best. http://t.co/mFVHGO4GyL,8,16
515179906859532288,2014-09-25 16:43:56,Another plan to reduce reliance on fossil fuel and encourage support for clean energy. http://t.co/UNWPGYFgg1,5,3
514889995963076608,2014-09-24 21:31:55,"Wishing all those celebrating Rosh Hashannah a good holiday and a happy, healthy new year. L’shanah tova.",8,9
514887021505282048,2014-09-24 21:20:06,Many of these children are not eligible for federal programs. My bill with @SenRobPortman would fix this problem. http://t.co/ItEOCkRvjz,6,2
514886704919240704,2014-09-24 21:18:51,"Troubling new data released by @USEdGov. Last year, there was a 6% increase in the number of homeless children in public school.",7,2
514874499943378944,2014-09-24 20:30:21,UNSC Resolution adopted today is a good step. We all must work together to reduce threat from foreign terrorists. http://t.co/MmmNlAyytk,3,1
514857857477791744,2014-09-24 19:24:13,"By chairing UNSC meeting, President Obama highlights the real threat of foreign fighters returning to US from Syria. http://t.co/6A2C6ZMaQk",9,6
514824127367364608,2014-09-24 17:10:11,Sobering look at the challenges we face this fire season. Proud of the job @Cal_Fire and @ForestService are doing. http://t.co/Gwnzc7Lzg1,5,2
514532867129765888,2014-09-23 21:52:49,The UC system is examining comprehensive changes to combat sexual violence. Students deserve to be safe. http://t.co/aLHD7j6SNp #ItsOnUs,14,8
514525406070714369,2014-09-23 21:23:10,"Turn in extra, unwanted prescription drugs this Saturday on @DEAnews Nat’l Drug Take Back Day. Drop-off info here: http://t.co/9BHDVoQIY4",5,2
514521261205377024,2014-09-23 21:06:42,We can no longer ignore the realities of climate change. Pleased to see all the action in New York. Read more here: http://t.co/UE0mLYS1XN,14,8
514501794576474112,2014-09-23 19:49:21,All countries must play a role in battling climate change. All of us share a responsibility to #ActOnClimate http://t.co/D3No4bdoHu,13,4
514494224147173379,2014-09-23 19:19:16,President Obama’s address to the UN Climate Summit is an important call to the world to step up and reduce emissions. http://t.co/Ny5zS7MGsO,7,5
514478915373768706,2014-09-23 18:18:26,Today’s federal court sentencing of an al-Qaeda terrorist shows we will continue to capture and punish our enemies. http://t.co/kx8mrtwfvj,5,3
514464418193997824,2014-09-23 17:20:50,Five Arab nations participated or supported airstrikes. Vital that U.S. has strong allies for this mission. http://t.co/aX47MNBpMe,7,4
514464226631766016,2014-09-23 17:20:04,"I strongly support airstrikes in Syria. Critical for president’s strategy to confront ISIL, Khorasan, other groups. http://t.co/aX47MNBpMe",10,6
514167791633838082,2014-09-22 21:42:08,Joined @SenGillibrand and @SenWarren to ask the White House to improve antibiotic resistance tracking efforts. http://t.co/xfQBZUgNDU,7,8
514153422749057025,2014-09-22 20:45:03,Interesting @NYTimes article investigates how climate change will affect certain cities—drastic changes ahead. http://t.co/xFUAi1xjC7,4,2
514101834009817089,2014-09-22 17:20:03,"If you missed it, I was on CBS @FaceTheNation to discuss the threat from ISIS and the issues facing the NFL. http://t.co/jKPW4GWV7g",3,3
513070561371893760,2014-09-19 21:02:08,RT @FaceTheNation: SUNDAY: Senate and House Intelligence Committee chairs @SenFeinstein and @RepMikeRogers will discuss US efforts to defea…,8,0
513066765543546880,2014-09-19 20:47:03,Sunday is the @Peoples_Climate March in NY to kick off the @UN #Climate2014 Summit. Read about why it’s important: http://t.co/3CPUhNt9Xm,14,5
513042595740930048,2014-09-19 19:11:01,"Today, we honor all of our #POWMIA’s past and present. You are not forgotten. Leave no one behind. http://t.co/8ZPtI2hlFh",12,13
513027374976606208,2014-09-19 18:10:32,Proud to cosponsor the Senate Resolution that marks this month as #HispanicHeritageMonth. https://t.co/griWOLBWae,4,8
512734361586651137,2014-09-18 22:46:12,Antibiotics are modern medicine’s greatest achievement. We need a comprehensive plan to preserve their efficacy. http://t.co/jrtvxJHUAB,14,5
512730022507851776,2014-09-18 22:28:58,Joined by @SenatorBoxer and @WaxmanClimate to urge VA to address mismanagement. Our veterans deserve the best. http://t.co/wWmtc0mFmP,5,3
512309160495820800,2014-09-17 18:36:36,"Following a devastating fire, my thoughts are with the people of Weed, Calif. I am monitoring the situation closely. http://t.co/QupLYxSXqa",6,10
512234517588111360,2014-09-17 13:40:00,RT @WhiteHouse: Last year marked the largest one-year drop in child poverty since 1966 → http://t.co/hXerLgDfuw #OpportunityForAll http://t…,252,0
512002412241240064,2014-09-16 22:17:42,Good step by @NASA in awarding contract to @SpaceX &amp; @Boeing to once again transport U.S. astronauts from U.S. soil. http://t.co/wjeb7aeRQW,10,7
511993512481808385,2014-09-16 21:42:20,CA health centers received funds to expand primary care services by hiring qualified health care providers. #ACAWorks http://t.co/WmHvg4CJn7,3,2
511972691671547904,2014-09-16 20:19:36,"Allowing student loan borrowers to refinance at lower interest rates would save borrowers hundreds, if not thousands, of dollars. #FairShot",7,9
511967915210702848,2014-09-16 20:00:37,Burden of student loan debt affects a borrower’s ability to buy a home or plan for retirement. We need to do something about it. #FairShot,10,8
511936333695422465,2014-09-16 17:55:07,Great to welcome the California Credit Union League to my office and present them with a flag flown over the Capitol. http://t.co/qx17OSW6KG,4,15
511912279764631552,2014-09-16 16:19:33,Today I honor the 12 victims killed at the Washington Navy Yard one year ago. We must prevent tragedies like this from happening again.,13,12
511608007940399104,2014-09-15 20:10:28,"RT if you support #EqualPay for equal work. This is an issue that affects everyone, not just women. http://t.co/uRPWg27d0q",31,18
511602002015817728,2014-09-15 19:46:37,The wage gap is harmful to women and families. The Senate must act today for #EqualPay. http://t.co/APC9HNNCjo,18,14
511593289154584578,2014-09-15 19:11:59,Paycheck Fairness Act would build on Lily Ledbetter Act by closing loopholes &amp; strengthening enforcement to ensure #EqualPay for equal work.,10,8
511577364875476992,2014-09-15 18:08:43,This afternoon I will proudly vote “Yes” on the Paycheck Fairness Act to ensure women get #EqualPay for equal work. http://t.co/epbYodYUnr,21,33
510520949763211264,2014-09-12 20:10:54,"For 20 years, @AmeriCorps has enabled Americans to serve their country, make a difference and enrich their lives. http://t.co/eusrS0OT8p",11,9
510450712615337984,2014-09-12 15:31:48,Joined 15 other women Senators to urge the @NFL to institute a zero-tolerance domestic violence policy. http://t.co/fhWnHfED1B,23,17
510185736684204032,2014-09-11 21:58:53,I talked with @MitchellReports this afternoon about President Obama’s plan to confront ISIL. Watch here: http://t.co/LBbaxaOMfv,4,1
510174763038572544,2014-09-11 21:15:16,Let’s help working families get a #FairShot. Congress must act and #RaiseTheWage. http://t.co/lPPQrfb36D,14,6
510164522704048128,2014-09-11 20:34:35,Congress should vote to #RaiseTheWage to boost the entire economy. #FairShot http://t.co/VfcJ9C4w7h,16,14
510150869208555520,2014-09-11 19:40:20,"Greenhouse gases in our atmosphere increased at a record rate in 2013, another sign we must act on climate change. http://t.co/tHP0VWt23w",1,5
510103889556017153,2014-09-11 16:33:39,"13 years ago, our nation was changed forever. We will #NeverForget those who died, and the sacrifices made by so many heroes that day.",19,18
509883407980322816,2014-09-11 01:57:32,"Read my statement on the president’s strategy against ISIL, a critical national security mission: http://t.co/0Yj2iLtDEj",12,12
509880857365319680,2014-09-11 01:47:24,I support the president’s ISIL strategy. He is right to use his authority to go on the offense.,24,27
509812253244526592,2014-09-10 21:14:47,Glad to be part of the @UnitedFresh Washington Conference. Had a great discussion on immigration and Calif drought. http://t.co/dKCj0LviHL,5,2
509795936038821888,2014-09-10 20:09:57,.@JerryBrownGov and @Schwarzenegger are right. California is a world leader in fighting climate change. http://t.co/6RpK9QCNZg #CARoad2Paris,204,103
509759766647042048,2014-09-10 17:46:13,Congress must act. Passing the Paycheck Fairness Act helps our entire economy. It’s time for #EqualPay for equal work.,10,9
509757056078077952,2014-09-10 17:35:27,Why we must pass the Paycheck Fairness Act: Women are primary or co-breadwinners in 2/3 of American families. #EqualPay,10,8
509754472374231042,2014-09-10 17:25:11,Women and their families are hurt by the gender pay gap. The Senate needs to pass the Paycheck Fairness Act today. #EqualPay,17,16
509737690284429313,2014-09-10 16:18:30,"Pleasure to meet with @SDChamber yesterday to discuss immigration, transportation and the regional economy. http://t.co/dwdmij6deK",5,8
509452179401609217,2014-09-09 21:23:59,Please RT to spread awareness about the National Domestic Violence Hotline @NDVH http://t.co/dkmis3vXeF #VAWA,57,12
509447852506894338,2014-09-09 21:06:47,"This week marks the 20th anniv. of the Violence Against Women Act, which has helped millions of women experiencing domestic violence. #VAWA",49,32
509437640429432832,2014-09-09 20:26:13,.@RepMikeRogers and I talked about a way forward on immigration reform Sunday with @CrowleyCNN. Watch here: http://t.co/js7agjjI4O,1,3
509420691343818752,2014-09-09 19:18:52,My op-ed with @RepAdamSchiff in the @LADailyNews highlights the need for an earthquake early-warning system. http://t.co/Id349nX1pQ,2,3
509405144967303168,2014-09-09 18:17:05,Yet another data breach reminds us of the urgent need to take steps to prevent cyber attacks. http://t.co/DOpzka7Crd,6,4
509372399931113472,2014-09-09 16:06:58,RT @SenateHistory: #California became the 31st state in the Union #OTD in 1850 http://t.co/lGgltgJlcQ,26,0
509103830353858561,2014-09-08 22:19:46,I strongly agree with this @SFgate editorial. Congress must fund wildfires like all other emergencies.  http://t.co/PZGcAfxutj,10,9
509088446045224961,2014-09-08 21:18:38,I discussed the need to confront ISIS on @CNNsotu with @crowleyCNN on Sunday. Watch here: http://t.co/FrtbrwPAz2,10,5
509062009535856640,2014-09-08 19:33:35,"ISIS is a vicious, brutal terrorist group with the aim of attacking us. It must be confronted. My op-ed in @USATODAY: http://t.co/V758VuldBm",13,14
507981598231646208,2014-09-05 20:00:25,I will be appearing on @CNNsotu with @CrowleyCNN this Sunday to discuss ISIL and the situation in Iraq and Syria. Be sure to tune in.,7,5
507620710894690304,2014-09-04 20:06:23,.@USDA can take action to reduce rates of Salmonella and Campylobacter. Read more in my op-ed in @foodsafetynews http://t.co/gT9z5YvPYH,12,6
507589695463649280,2014-09-04 18:03:08,"RT @SVLeadershipGrp: .@SenFeinstein updates our members on cybersecurity and answers questions on Ukraine, ISIS &amp; more from @CarlGuardino h…",5,0
507313221632811008,2014-09-03 23:44:32,.@CVS_extra's decision to stop selling tobacco products and launch new quit-smoking programs will benefit public health. #OneGoodReason,23,26
507294101264674816,2014-09-03 22:28:33,.@PerdueChicken has shown that industry can be an effective partner in ensuring antibiotics stewardship. http://t.co/iHdJsdtwis,8,9
507244413958230016,2014-09-03 19:11:07,The Land &amp; Water Conservation Act plays a vital role in our economy. Supports a $646 billion recreation industry and 6 million jobs. #LWCF50,5,10
507229087170297856,2014-09-03 18:10:12,"Proud to recognize 50 years of the Land and Water Conservation Act, which has had a big role protecting California parks and trails. #LWCF50",8,16
506870301188456448,2014-09-02 18:24:31,"If you missed it, I appeared on NBC’s @MeetThePress on Sunday to discuss ISIL and the situation in Ukraine. http://t.co/HcGnyZkD8V",4,6
505098347146117121,2014-08-28 21:03:24,"I continue to be impressed by the resolve of Californians. Just days after a severe quake, Napa is open for business. http://t.co/BUkI4pLaay",33,22
504706578302656512,2014-08-27 19:06:39,"The ability to plan their families is critical to women’s economic security, which is why we must #FixHobbyLobby.",20,23
504373108422508546,2014-08-26 21:01:34,"New report confirms extent of problems at VA. Steps have been taken to fix them, but we have a long way to go. http://t.co/KerEMbTiGV",7,4
504327190193127424,2014-08-26 17:59:06,"When I arrived in Washington, there were 5 women senators. Today—on Women's Equality Day—there are 20. Progress, but work remains. #WEmatter",350,243
504296538991230976,2014-08-26 15:57:18,Congratulations to 21 California health centers receiving additional #ACA funds to support underserved communities. http://t.co/YZNDNRQYTq,15,7
504027348900282368,2014-08-25 22:07:39,This weekend’s Napa earthquake served as yet another reminder of why the West Coast needs an early-warning system. http://t.co/3V2VIczdVU,19,13
504013676186451969,2014-08-25 21:13:19,Thanks for your exemplary service! RT @forestservice: Elite Firefighting Team Ready to Protect Lake Tahoe Basin: http://t.co/TpA7BXiknG,7,7
503578705051283456,2014-08-24 16:24:53,I encourage all in the Bay Area to follow guidance from public officials and safety teams as they respond to this earthquake.,11,3
503575441496891393,2014-08-24 16:11:55,"For information on power outages caused by this morning's earthquake, visit http://t.co/9DHLnxPorj",15,5
503570246692012032,2014-08-24 15:51:17,This morning the Bay Area felt the most powerful quake since Loma Prieta. Hoping those affected stay safe and recover quickly.,37,19
502895807159611394,2014-08-22 19:11:18,Thanks for the mail @CleanAirMoms. We must act on climate change to counter all the negative effects on our children. http://t.co/E39kRqoHnq,14,11
502882452160147456,2014-08-22 18:18:14,Painkillers with hydrocodone are some of the most abused prescription drugs. @DEAnews is working to fight this trend. http://t.co/53sJE5B59d,4,5
502213166747492353,2014-08-20 21:58:44,"Countering ISIL demands coordinated and sustained action by Iraq, U.S. and others. We must help solidify gains. http://t.co/gfhnUX7Ue9",7,10
502211601789771777,2014-08-20 21:52:31,The murder of James Foley and other ISIL terrorist acts must be met with very serious consequences. My statement: http://t.co/gfhnUX7Ue9,17,16
502178740886327296,2014-08-20 19:41:56,Today’s @USDA report is a reminder that we must reform wildfire funding policy. I supported action in this letter: http://t.co/S40Pw4nx0H,5,4
502170895071588352,2014-08-20 19:10:45,Startling new report details the challenge @ForestService faces with the rising costs of fighting wildfires. http://t.co/gG5MRIovxk,3,2
502155701461221376,2014-08-20 18:10:23,Workers should have access to the care they need and make own decisions about their health. Let's #FixHobbyLobby ruling. #NotMyBossBusiness,16,11
502123558475403264,2014-08-20 16:02:40,These @LibraryCongress resources will be helpful for students and teachers as they begin the new school year. http://t.co/dTI9ncz4Wy,6,2
