id,created_at,text,retweets,favorites
322405181365051393,2013-04-11 17:45:59,VIDEO: Started the day with @Morning_Joe. Good conversation on gun violence and the assault weapons ban. Watch here: http://t.co/TH4EOlpH6j,10,5
322095939689000961,2013-04-10 21:17:10,VIDEO: I joined @Lawrence O’Donnell on @msnbc’s @TheLastWord to discuss my assault weapons bill. Watch here: http://t.co/oXIvP51SLs,16,6
321756177279102976,2013-04-09 22:47:05,RT @TheLastWord: GOP senators are threatening to block the vote on new gun control legislation. We'll get reaction from @SenFeinstein at ...,20,0
321683951594909697,2013-04-09 18:00:05,Today is #EqualPayDay: California women make only 85 cents for every dollar made by a man for equal work #TalkPay http://t.co/Z2i80KZvxe,26,2
321316359000711168,2013-04-08 17:39:24,Lady Thatcher was an invaluable ally to the U.S. and the very definition of a strong leader who redefined politics for generations of women.,32,9
319856312047509505,2013-04-04 16:57:42,Congratulations and happy anniversary!  MT @mitchellreports It's #mitchellreports' 5 year anniversary on @msnbc! #AMR5Years,9,3
319836786086002689,2013-04-04 15:40:06,RT @KTVU: Sen. #Feinstein spoke at Commonwealth Club in #SanFrancisco today on NRA 's resistance to gun control http://t.co/g6hIJHXhbH,9,0
319496390201987072,2013-04-03 17:07:30,Deeply concerned about the recent provocative actions taken by North Korea. Read my statement: http://t.co/B1uNBZekgR,10,3
319171622961549312,2013-04-02 19:36:59,Pleased more colleagues on both sides of the aisle support marriage equality. Time to repeal discriminatory #DOMA. http://t.co/u2C9VfOCpq,29,15
316590959288803329,2013-03-26 16:42:21,Proud to support marriage equality as SCOTUS hears challenges to #Prop8 &amp; discriminatory #DOMA. #UnitedforMarriage http://t.co/NqOaJVqumV,54,20
315112088446046211,2013-03-22 14:45:51,"RT @TheLastWord: Talking gun control, @Lawrence says ""it's time to Rewrite those headlines to 'Assault Weapons Ban not dead.' #lastword  ...",82,0
314849411987554304,2013-03-21 21:22:04,"FACT: Affordable Care Act provides 435,000 young adults in Calif. with access to health insurance. http://t.co/zqKQQYP1Lo #ACATurns3",35,14
314841135996604416,2013-03-21 20:49:10,Read my @LATimes op-ed about bringing Al Qaeda terrorists to justice in federal criminal court: http://t.co/ZfdeIIZoUn,9,2
314492638181093376,2013-03-20 21:44:22,Affordable Care Act turns 3 years old this week. Here’s how it benefits #California: http://t.co/zqKQQYP1Lo #ACATurns3,27,8
314101694617223171,2013-03-19 19:50:54,RT @wolfblitzer: The two Intelligence Chairs @SenFeinstein &amp; @RepMikeRogers join me live today in @CNNSitRoom during 6PM ET hour,17,0
312631742634803200,2013-03-15 18:29:50,VIDEO: Joined @WolfBlitzer in the @CNNSitRoom last night to discuss my assault weapons bill.. Watch HERE: http://t.co/SR862KF9W1 #AWB2013,21,11
312312093749690368,2013-03-14 21:19:40,Joining @WolfBlitzer in the @CNNSitRoom at 5:50 p.m. ET to discuss assault weapons. #AWB2013,17,4
312290018116894720,2013-03-14 19:51:57,PHOTO: Met with @Facebook COO @SherylSandberg yesterday. We need more women leaders like her. #LeaningIn http://t.co/8IthdFtuFR,10,10
312253752738476032,2013-03-14 17:27:50,Judiciary Committee passed the Assault Weapons Ban—a big step to get weapons of war off our streets. #AWB2013 http://t.co/qDjpBc5Fbj,85,39
312208834829615105,2013-03-14 14:29:21,"PHOTO: At a Senate Judiciary Committee hearing on gun violence. We'll be voting on my assault weapons bill, #AWB2013 http://t.co/M8OkFhfcgB",17,9
311956737953521666,2013-03-13 21:47:36,I’m fighting to prevent egregious health insurance rate hikes in California. Read more HERE: http://t.co/KnvImw8c6t,17,10
311938911612067841,2013-03-13 20:36:47,PHOTO: THANK YOU @MomsDemand for coming to D.C. &amp; standing up for common sense gun laws. #AWB2013 #MomsTakeTheHill http://t.co/KPQkdY4EWH,25,5
311585612828381186,2013-03-12 21:12:53,"I enjoyed speaking to the @LAAreaChamber this morning about cybersecurity, assault weapons and the effects of sequestration on LA.",3,1
311570653641834497,2013-03-12 20:13:27,Chaired a Senate Intelligence hearing this morning on worldwide threats. Read my opening statement here: http://t.co/ZLjG4nDvTx,5,3
311547884061474816,2013-03-12 18:42:58,Read about the effort to get weapons of war off our streets in today’s @SacBee_News HERE: http://t.co/zQJDUEtprl #AWB2013,4,7
311484941856817152,2013-03-12 14:32:52,"Chairing a Senate Intelligence Committee hearing right now on worldwide threats with DNI, CIA, FBI, DOD. http://t.co/uji3Vnslvs",7,5
310151404759154688,2013-03-08 22:13:51,Happy International Women’s Day! See this @StateDept fact sheet on the advancement of women around the world #IWD http://t.co/xdAY2XBTr4,11,4
310140253023371264,2013-03-08 21:29:33,"VIDEO: Joined @hardball_chris on @Hardball yesterday to discuss John Brennan, the CIA and #drones. Watch HERE: http://t.co/5SOn8lUnyS",3,2
310102449711099904,2013-03-08 18:59:20,VIDEO: Spoke on the Senate floor yesterday about John Brennan’s nomination as CIA director and drones. Watch HERE: http://t.co/0qZmlOlwt7,4,3
309779449631629312,2013-03-07 21:35:50,Joining @hardball_chris on @Hardball at 5 p.m. ET to talk John Brennan/CIA and drones.,3,0
309771927482941440,2013-03-07 21:05:57,Good news: President Obama has signed a new Violence Against Women Act into law. Protects ALL women from domestic violence. #VAWA,30,17
309740846201331713,2013-03-07 19:02:27,Headed to the #Senate floor to speak about the nomination of John Brennan as director of the CIA. Watch HERE: http://t.co/1bVPx32wbW,5,1
309706211211747329,2013-03-07 16:44:49,Senate Judiciary Committee is debating the Assault Weapons Ban and other gun safety legislation today. #AWB2013,12,2
309077796771217411,2013-03-05 23:07:44,PHOTO: Behind the scenes after today's Intelligence Committee vote on the nomination of John Brennan as CIA director: http://t.co/ngoXQCRZWh,4,2
309058892946612224,2013-03-05 21:52:36,Senate Intelligence Committee approves John Brennan for CIA director. http://t.co/E4Nw132LLx,7,1
309035919913123841,2013-03-05 20:21:19,Spoke to @AIPAC today about the important partnership between the United States and Israel. #AIPAC2013,6,1
309008359225425920,2013-03-05 18:31:48,The Senate should confirm Caitlin Halligan for D.C. Circuit Court. Well-qualified candidate with bipartisan support. http://t.co/M31J7hDJG3,12,2
307617848237379584,2013-03-01 22:26:24,"Agree w/ @ShuttleCDRKelly: we must close the gun show loophole, stop criminals from getting weapons w/out bkgd check http://t.co/dwMMgCHzIN",14,5
307524430890938371,2013-03-01 16:15:12,"Led group of 40 senators—joined by 172 in House—urging Supreme Court to strike down unjust, discriminatory #DOMA. http://t.co/5PdwE37kSn",15,10
307280144987467776,2013-03-01 00:04:30,PHOTO: Behind the scenes­­ last night when I spoke to @PiersMorgan on @PiersTonight about assault weapons. #AWB2013 http://t.co/ghHnNnOpWc,4,3
307271645884715008,2013-02-28 23:30:43,Good news! House finally passed Violence Against Women Act.  Everyone deserves protection from domestic violence. #VAWA,16,11
307268164050366464,2013-02-28 23:16:53,VIDEO: Spoke to @PiersMorgan on @PiersTonight last night about assault weapons. WATCH HERE: http://t.co/pUu6v3M6y9,24,12
307263062245793792,2013-02-28 22:56:37,"Held a Senate Judiciary Committee hearing yesterday on assault weapons, gun violence. #AWB2013 Read more HERE: http://t.co/Ys0wnV85Zw",6,0
307258855807655936,2013-02-28 22:39:54,PHOTO: Behind the scenes before yesterday’s Judiciary Committee on assault weapons. #AWB2013 1234567890123456789012 http://t.co/TQ45xQp01U,3,1
306918683702353923,2013-02-28 00:08:11,RT @RepHuffman: Joined @SenatorBoxer @SenFeinstein @RepThompson to ask @WhiteHouse to help us protect beautiful #Mendocino coastline htt ...,13,0
306917343894835200,2013-02-28 00:02:51,Joining @PiersMorgan on @PiersTonight at 9 p.m. EST to discuss my assault weapons bill and sequestration. #AWB2013,16,7
306841921173729280,2013-02-27 19:03:09,PHOTO: Last witnesses at the Senate Judiciary Committee hearing on assault weapons today. #AWB2013 http://t.co/FQ19zgvhgB,6,2
306821346720112640,2013-02-27 17:41:24,"Now testifying: Philadelphia Mayor @Michael_Nutter, former Rep. Sandy Adams (R-Fla.) . #AWB2013",2,1
306820967575998464,2013-02-27 17:39:53,"Now testifying: Nicholas Johnson, Law Professor at Fordham University School of Law, and David Hardy, attorney in Tuscon, Arizona. #AWB2013",0,1
306818685174169601,2013-02-27 17:30:49,"Just testified: Dr. William Begg, EMS Medical Director in Newtown—was on duty when victims of Sandy Hook brought to emergency room. #AWB2013",4,2
306818265802489858,2013-02-27 17:29:09,"Just testified: Neil Heslin, father of Jesse Lewis, murdered in December at Sandy Hook Elementary School. #AWB2013",4,1
306798790378143745,2013-02-27 16:11:46,PHOTO: Senate Judiciary Committee hearing on assault weapons right now. Tune in here: http://t.co/RQ3blHAgu6 #AWB2013 http://t.co/xVWB6g06cJ,15,3
306790266440929280,2013-02-27 15:37:54,RT @usmayors: USCM President @Michael_Nutter meets with @SenFeinstein at #GunHearing. #gunviolence #MayorsStandWithFeinstein http://t.co ...,12,0
306789420110065664,2013-02-27 15:34:32,"Now at witness stand: John Walsh, U.S. Attorney for the District of Colorado and Milwaukee Chief of Police Edward Flynn. #AWB2013",3,1
306781651583791105,2013-02-27 15:03:40,Tune in to the #AWB2013 hearing on @CSPAN HERE: http://t.co/Wl5yoUhlSW,7,3
306779413297631232,2013-02-27 14:54:46,On my way to a Judiciary Committee hearing on assault weapons. #AWB2013.,7,8
306547469729267712,2013-02-26 23:33:06,Honored to receive Allegheny College Prize for Civility in Public Life w/ @GrahamBlog earlier today. @AlleghenyCol http://t.co/frO02qLbL4,9,5
306506991965196290,2013-02-26 20:52:16,I will hold a Judiciary Committee hearing tomorrow on #AWB2013. It’s time to get weapons of war off our streets. http://t.co/yTEtNeYHiy,16,7
306176046418513921,2013-02-25 22:57:12,"VIDEO: I joined @MitchellReports today to discuss #Syria, #cybersecurity and gun safety. #AWB2013 Watch HERE: http://t.co/hw0nwM3t5f",2,3
306168631811788800,2013-02-25 22:27:44,"FACT: There will be no confiscations, no registration in #AWB2013. No legally owned firearm will be taken. None. http://t.co/TE3mqSb1pA",43,10
306156164360589312,2013-02-25 21:38:12,Read my op-ed in the @ocregister and learn the truth about my assault weapons bill. #AWB2013 http://t.co/TE3mqSb1pA,17,10
306103522393477120,2013-02-25 18:09:01,About to join @MitchellReports to talk gun violence and Secretary of State @JohnKerry’s first overseas trip. #AWB2013,3,3
304334899920371714,2013-02-20 21:01:09,Proud to get 100% rating from the League of Conservation Voters (@LCVoters) for my work to protect our environment. http://t.co/sidrYopc,5,6
303991586679824384,2013-02-19 22:16:56,"The looming sequester will have serious consequences to jobs, economy, education, health/safety and national security http://t.co/AsGtq1fP",29,5
303972636281675777,2013-02-19 21:01:38,Sobering report on Chinese military’s efforts to hack U.S. targets. Shows urgent need for cyber security legislation. http://t.co/Zi6Tgwyt,14,4
302169980668108800,2013-02-14 21:38:32,RT @sandyhook: Today we're launching #1MillionHearts for #Newtown. Send a valentine for @SandyHook: http://t.co/j1TtvEdw,123,0
302121579112980480,2013-02-14 18:26:12,PHOTO: Met w/ 1 Million Moms for Gun Control (@1MM4GC)—thank you for the hard work (&amp; my valentines)!  Keep it up. http://t.co/CuhlJGt5,35,15
301798946446123008,2013-02-13 21:04:10,President Obama is right: Americans deserve a vote. @GabbyGiffords deserves a vote. @SandyHook deserves a vote. #NowIsTheTime #AWB2013,53,16
301785750469500929,2013-02-13 20:11:44,886 mayors across the United States have endorsed the Assault Weapons Ban. It’s time to act. #AWB2013 @DemandaPlan http://t.co/hxI2P89P,87,17
301539426570481664,2013-02-13 03:52:56,Just left State of the Union. Read my statement about the speech: http://t.co/YqdQUo9J,16,11
301466569907769344,2013-02-12 23:03:25,"This month we celebrate the history &amp; culture of #BlackHistoryMonth, and today we mark the anniversary of the @NAACP. Happy 104th birthday!",11,5
301459933034082304,2013-02-12 22:37:03,Proud the Senate passed the Violence Against Women Act. Time for the House to act–domestic &amp; sexual violence are not partisan issues. #VAWA,60,16
301436282175901696,2013-02-12 21:03:05,PHOTO: Josh Stepakoff—my #SOTU guest—was only 6 when he was wounded by an assault weapon in a 1999 shooting #AWB2013 http://t.co/LtEIgPbR,9,5
301384338262614017,2013-02-12 17:36:40,Bumpfire replacement stocks allow semi-autos to reach fully automatic rates of fire. They should be outlawed.#AWB2013 http://t.co/2PijtZtO,13,5
299659832187842561,2013-02-07 23:24:06,"Gave @Ravens fans @SenatorBarb &amp; @SenatorCardin winnings from @SenatorBoxer &amp; my #SuperBowl bet. Next year, @49ers! http://t.co/A3kkA651",6,4
299275535505293314,2013-02-06 21:57:02,RT @RepAdamSchiff: Wrote op-ed in @ladailynews with @SenFeinstein and @SenatorBoxer: Helicopters buzzing L.A. County must be regulated h ...,2,0
299246814731849728,2013-02-06 20:02:55,Glad bipartisan Violence Against Women Act passed 1st Senate hurdle on Monday. We should pass it immediately. #VAWA http://t.co/KIrTY4bX,29,11
298912235072393216,2013-02-05 21:53:25,"Making an impact: 47 faith groups made 10,000+ calls to senators demanding an end to gun violence #FaithsCalling http://t.co/u9DkLr0O",30,5
298838846265761793,2013-02-05 17:01:47,Read my statement on the Justice Department’s “Lawfulness of Lethal Operation” memo: http://t.co/e4hCtVrM,13,2
298543699502186496,2013-02-04 21:28:59,Moving video of @SandyHook Elementary students sing “America the Beautiful” at the #SuperBowl: http://t.co/Twng2clR. Please RT for #Newtown,14,2
297459951331340288,2013-02-01 21:42:33,Congratulations to National Medal of Technology and Innovation recipients Dr. Frances Arnold and Dr. Art Rosenfeld! http://t.co/sCTTL8ZQ,4,3
297106377539743744,2013-01-31 22:17:35,"Public supports #AWB2013—doctors, teachers, law enforcement, religious leaders, mayors. Washington should follow suit. http://t.co/BsADz4se",22,6
297092307621146624,2013-01-31 21:21:40,"VIDEO: Joined @WolfBlitzer in the @CNNSitRoom last night to talk about my assault weapons bill, #AWB2013. Watch HERE: http://t.co/tef9f4AC",6,1
296758685668081664,2013-01-30 23:15:58,"FACT: After 1994 AWB, expired 37% of police departments reported an increase in criminal use of assault weapons. http://t.co/fRirwrM1",25,4
296739560837218305,2013-01-30 21:59:59,FACT: 69% of Americans support a ban on assault weapons. Let’s stand up &amp; get weapons of war off our streets. http://t.co/8XiW2eAk #AWB2013,25,6
296722925715873792,2013-01-30 20:53:52,I agree with @GabbyGiffords and @ShuttleCDRKelly: “Too many children are dying. We must do something” about gun violence. #AWB2013,29,2
296715343240519682,2013-01-30 20:23:45,Important Judiciary Committee hearing today on preventing gun violence. We must do something. #AWB2013 http://t.co/Qll7C1pv,13,1
296710860943020032,2013-01-30 20:05:56,RT @wolfblitzer: Joining me today @SenFeinstein on guns. @CNNSitRoom 4-7PM ET Will any serious gun-control legislation really pass?,11,0
296389869758980097,2013-01-29 22:50:26,Secretary Hillary Clinton was an exceptional Secretary of State and a great public servant. Thank you for your service!,44,15
296387609238859777,2013-01-29 22:41:27,Congrats to new Secretary of State @JohnKerry. I can think of no one more qualified &amp; better prepared to be our nation's chief diplomat.,14,3
296364167466717184,2013-01-29 21:08:18,FACT: A DOJ study found that the 1994 Assault Weapons was responsible for a 6.7% DECREASE in total gun murders #AWB2013 http://t.co/3XJCJTtt,36,7
296354238089531392,2013-01-29 20:28:51,California women make an average of 14% less than CA men. Let’s close the wage gap and pass the #PaycheckFairness Act! http://t.co/VDI1iw7F,41,9
296023726544285696,2013-01-28 22:35:30,VIDEO: Spoke with @BobSchieffer on @FacetheNation yesterday about gun policy. Watch here: http://t.co/EZkGzFZo #AWB2013,9,2
296018077001322496,2013-01-28 22:13:03,VIDEO: I joined @CrowleyCNN on @CNNsotu yesterday to talk about my assault weapons bill. Watch here: http://t.co/9jXuyYJB #AWB2013,9,3
296004939421982720,2013-01-28 21:20:51,.@SenatorBoxer and I just bet @SenatorCardin and @SenatorBarb that the @49ers will beat the @Ravens in the Super Bowl. Go @49ers!,16,4
295305060865429504,2013-01-26 22:59:47,Joining @BobSchieffer tomorrow morning to talk about assault weapons and how to stop mass killings. #AWB2013,18,5
295305016317710336,2013-01-26 22:59:37,Tune in to @CNNsotu tomorrow morning. I’ll talk to @CrowleyCNN about my assault weapons bill. #AWB2013,12,3
295304572770066432,2013-01-26 22:57:52,PHOTO: Behind the scenes at my assault weapons press conference yesterday. #AWB2013 http://t.co/0mgHm4GU,6,1
294952430393774081,2013-01-25 23:38:34,I’ll speak with @BobSchieffer on @FacetheNation this Sunday about gun policy and getting weapons of war off our streets. #AWB2013,15,2
294951840431362048,2013-01-25 23:36:13,I’m joining @CrowleyCNN on @CNNsotu on Sunday at 9 a.m. EST to talk about my assault weapons bill. #AWB2013,12,4
294588837206822913,2013-01-24 23:33:46,"Get the facts on my assault weapons bill: http://t.co/5gDl2lVj . This will be an uphill battle, but it’s one worth waging. #AWB2013",82,22
294573508497903616,2013-01-24 22:32:52,PHOTO: Spoke at a press conference about my assault weapons bill earlier today. #AWB2013 http://t.co/kJJy81MR,17,7
294502157309317121,2013-01-24 17:49:20,"Thanks to @RepPerlmutter, @RepEsty, @Michael_Nutter, Commissioner Ramsey, gun violence victims and all others for standing up for #AWB2013",11,2
294501539089879040,2013-01-24 17:46:53,"Thanks to @RepMcCarthyNY, @SenatorDurbin, @ChuckSchumer, @SenBlumenthal, @ChrisMurphyCT for standing up for #AWB2013.",8,1
294497738987540480,2013-01-24 17:31:47,Just concluded press conference on assault weapons bill. Let’s get weapons of war off our streets. RETWEET if you agree. #AWB2013,154,15
294495276230660097,2013-01-24 17:21:59,"Feinstein: Assault weapons do not belong on our streets, in our schools, in our movie theaters. We must say ""enough is enough."" #AWB2013",33,11
294495022416535552,2013-01-24 17:20:59,Feinstein: I will introduce this bill later this afternoon. #AWB2013,8,2
294493468133322754,2013-01-24 17:14:48,Gun violence victims now introducing themselves. #AWB2013,5,3
294493249459089410,2013-01-24 17:13:56,Feinstein: We are honored to be joined today by a group of gun violence victims. #AWB2013,2,1
294492071333597184,2013-01-24 17:09:15,"Commissioner Ramsey now pointing out assault weapons, magazines used in recent gun massacres, including Newtown and Tuscon. #AWB2013",3,2
294490896794267648,2013-01-24 17:04:35,.@Michael_Nutter: This death and destruction must end right now. #AWB2013,5,4
294489686410424322,2013-01-24 16:59:47,Feinstein: Now Philadelphia Mayor @Michael_Nutter and Police Commissioner Charles Ramsey will speak. #AWB2013,3,1
294488964038021121,2013-01-24 16:56:55,.@RepEsty: What happened in Newtown was an unspeakable tragedy. But what happens now is up to us. #AWB2013,19,3
294488264625225728,2013-01-24 16:54:08,.@RepPerlmutter: Our everyday freedoms as Americans are being taken away by acts of gun violence. #AWB2013,19,5
294487381359349760,2013-01-24 16:50:37,"Feinstein: @RepPerlmutter (represents Aurora, Colorado), @RepEsty (represents Newtown, Connecticut) will now speak. #AWB2013",3,3
294486565982445568,2013-01-24 16:47:23,".@ChrisMurphyCT: Kids would be alive today in Newtown if the law we are proposing today were in place on December 14, 2012. #AWB2013",8,4
294485418798379008,2013-01-24 16:42:49,.@SenBlumenthal: I will never forget the sights &amp; sounds of that day in Newtown. This measure would have helped prevent the tragedy #AWB2013,14,3
294484343185866752,2013-01-24 16:38:33,.@ChuckSchumer: None of us want to take away the sidearm that a small business owner needs to feel safe in dangerous neighborhood. #AWB2013,4,3
294483456442916865,2013-01-24 16:35:01,.@SenatorDurbin: We can only do as much as the American people help us do.... We need their support. #AWB2013,5,3
294481844857085952,2013-01-24 16:28:37,"Feinstein: Now speaking: @SenatorDurbin, @ChuckSchumer, @SenBlumenthal, @ChrisMurphyCT #AWB2013",3,2
294481089987227648,2013-01-24 16:25:37,.@RepMcCarthyNY: It can be done... I'm saying to you we can save lives. #AWB2013,5,2
294479440312934400,2013-01-24 16:19:04,Feinstein: @RepMcCarthyNY now speaking. #AWB2013,1,1
294479169490931713,2013-01-24 16:17:59,"Feinstein: The bill will NOT affect hunting or sporting firearms. Instead, the bill protects hunters and sportsmen. #AWB2013",25,3
294478824316485632,2013-01-24 16:16:37,Feinstein: We will prohibit 158 specifically-named military-style firearms. #AWB2013,46,15
294478439409385472,2013-01-24 16:15:05,"Feinstein: Since last AWB expired, 350 people killed w/ assault weapons. I do not intend to sit by while these killings continue. #AWB2013",30,2
294478302045941760,2013-01-24 16:14:33,Feinstein: These military-style weapons have but one purpose: to kill the maximum number of people as quickly as possible. #AWB2013,33,5
294478224031879169,2013-01-24 16:14:14,Feinstein: The common thread in these massacres is that each gunman used semi-automatic assault weapon or large-capacity magazine. #AWB2013,19,3
294477918971764736,2013-01-24 16:13:01,Feinstein: I am incensed that our weak gun law allow mass killings to be carried out again and again and again in our country. #AWB2013,19,8
294477193214566404,2013-01-24 16:10:08,"Feinstein: Gary R. Hall, Dean of Washington National Cathedral, opens this morning with some remarks and a moment of prayer. #AWB2013",1,1
294476597879259136,2013-01-24 16:07:46,Feinstein: Together we are introducing legislation the mass shootings that have devastated families and terrorized communities. #AWB2013,13,5
294476020118089730,2013-01-24 16:05:28,Staff will be livetweeting the press conference. Follow #AWB2013 for more information.,5,2
294474286255706113,2013-01-24 15:58:35,About to introduce my assault weapons legislation. Weapons of war do not belong on our streets. #AWB2013,57,15
294236182315929601,2013-01-24 00:12:27,"RT @ChrisMurphyCT: Tomorrow I will join @SenFeinstein to introduce a ban on assault weapons, inc the one that killed 26 people in #Newtown.",85,0
294236118180847616,2013-01-24 00:12:11,Tomorrow I will introduce my assault weapons legislation. Weapons of war do not belong on our streets. #AWB2013,114,49
293829928481345537,2013-01-22 21:18:09,"Met with some smart students from my alma mater, @SacredHeartSF, this morning. Enjoy your trip to Washington! http://t.co/jW1zba8J",5,8
293827280558497792,2013-01-22 21:07:37,Today is the 40th anniversary of the Supreme Court’s historic #Roe v. Wade decision.  We must protect a woman’s right to choose. #RoeAt40,45,18
293460731653931010,2013-01-21 20:51:05,Celebrating the second Inauguration of President Obama today in Washington.,17,13
293456273993781248,2013-01-21 20:33:22,"Today we remember the life and legacy of a man who changed America—Dr. Martin Luther King, Jr.",9,4
292318317383917569,2013-01-18 17:11:32,Thanks for having me! MT @usmayors Welcome home @SenFeinstein! #uscm2013 http://t.co/gMlLfDQ3,3,1
292281767728144384,2013-01-18 14:46:18,Looking forward to speaking to the U.S. Conference of Mayors about gun violence this morning. #USCM2013 @USMayors,8,4
291669789749936128,2013-01-16 22:14:31,I commend &amp; support President Obama’s gun safety plan. Weapons of war do not belong on our streets. #NowIsTheTime http://t.co/ZcftnUyf,95,26
291303583746506752,2013-01-15 21:59:21,FACT: 40% of gun sales in U.S.–including #assaultweapons—occur w/out bkgd checks. It’s time to act &amp; stop gun violence. http://t.co/rkSz5fRF,34,4
290930624460648448,2013-01-14 21:17:20,We hear you and we won’t forget you @SandyHook. Make the #SandyHookPromise and honor the 26 lives lost one month ago today.,25,7
289859820297801728,2013-01-11 22:22:21,Sorry to hear that my good friend @SenRockefeller—a great senator for West Virginia—will retire at the end of his term.  He will be missed.,4,2
289499447744925696,2013-01-10 22:30:21,I commend @NYGovCuomo for proposing an assault weapons bill to fight gun violence in NY. He’s right: “enough is enough” http://t.co/b8e1rKD4,62,11
289487583656960000,2013-01-10 21:43:13,Another tragic shooting today at Taft Union H.S. in CA—my father’s high school. Thoughts &amp; prayers are with the victims http://t.co/r3TcImjg,15,3
289481735752790017,2013-01-10 21:19:58,So did I! MT @JamieSchmitt: Thank you for reading to my son &amp; his classmates yesterday! He loved it! http://t.co/wNuDYUV1,0,3
289435661096849408,2013-01-10 18:16:53,FACT: 33 Americans are murdered every day with guns. It’s time to do something about gun violence. @DemandAPlan #ResponsibleSolutions,49,7
289131498127388672,2013-01-09 22:08:15,2012 was the hottest year on record in the contiguous United States. #ClimateChange is real and Congress must act. http://t.co/uNWgnxW0,22,4
288746887337635841,2013-01-08 20:39:57,We MUST do something to prevent gun violence. Inaction is not an option—lives are at stake. RETWEET if you agree.,130,12
288739134674202624,2013-01-08 20:09:08,"Two years ago, @GabbyGiffords &amp; 18 others were shot in Tucson. Read her &amp; @ShuttleCDRKelly’s op-ed about gun violence: http://t.co/6Evl1hyl",21,1
