id,created_at,text,retweets,favorites
601150443595702272,2015-05-20 22:20:09,It was great to meet students and faculty representing all 10 University of California campuses this morning. #UCDay http://t.co/N1q8KvC2vI,4,10
601141541999083520,2015-05-20 21:44:46,Good discussion today with members of the British Parliament on the need to close Guantanamo Bay. http://t.co/4gffBZwelZ,10,17
601138565863632896,2015-05-20 21:32:57,I cosponsored a bill to authorize the scientific research that will maintain our nation’s leadership on energy. http://t.co/1AZH6DVuO3,4,10
601124149822623744,2015-05-20 20:35:40,Great start to my day. Discussed what's going on in the Senate over breakfast with 120 Californians. http://t.co/oRmqJXwVnE,3,8
601111520613904385,2015-05-20 19:45:29,Takata airbag recall pertains to 34 million vehicles. Enter your car’s VIN number here to see if you are affected: http://t.co/cWpg9hETsK,17,13
601071228972081152,2015-05-20 17:05:23,"Great news from Los Angeles. With minimum wage increase, city leaders are helping working families. http://t.co/EK2u4RVDlv #RaiseTheWage",12,22
600848669915664385,2015-05-20 02:21:00,"New @FrontlinePBS documentary ""Secrets, Politics and Torture"" is airing now. #ReadTheReport For more info: http://t.co/Ogc7aLOvzb",41,21
600790831608496128,2015-05-19 22:31:11,".@US_FDA rule I pushed for w/ @SenGillibrand, @SenWarren will improve data on antibiotic use in agriculture. http://t.co/sAaw2qZp7j #saveabx",8,9
600771684652752897,2015-05-19 21:15:06,"Pleasure to meet with my good friend John Laird, California Secretary for Natural Resources. http://t.co/fOfmmXQGfz",1,14
600756458653749249,2015-05-19 20:14:35,The House-passed bill contains my provisions with @SenRobPortman and @SenatorKirk. http://t.co/ATuxUwqPdR http://t.co/N7OkgEJ0b8 3/3,2,6
600756015559086081,2015-05-19 20:12:50,Bill holds buyers accountable and cracks down on owners of websites that knowingly advertise commercial sex with minors. 2/3,5,8
600755788353642497,2015-05-19 20:11:56,Great news: The House passed the Justice for Victims of Trafficking Act. The bill is now on it's way to @POTUS. http://t.co/xBobDUV0pN 1/3,18,28
600423182026350592,2015-05-18 22:10:16,"With 100 floor speeches, @SenWhitehouse has shown steady &amp; much-needed leadership pushing Congress to #ActOnClimate. http://t.co/Q51arM5Gk6",13,19
600416917774557184,2015-05-18 21:45:23,We must do more to help victims after rail accidents. Joined @SenBillNelson to call for an increased liability cap. http://t.co/Zmz3EWhAgu,4,10
600403880527147008,2015-05-18 20:53:34,"Happy 50th anniversary to Head Start, a program that has opened doors for so many young children. http://t.co/ZIhTC1Vpgi #HeadStart50",23,22
600359203434291200,2015-05-18 17:56:02,I was on @ThisWeekABC yesterday to talk about the fight against ISIL and the importance of trade. Watch here: http://t.co/BMDRjj0SF6,5,7
599613728766742529,2015-05-16 16:33:47,"Today on #ArmedForcesDay, we thank the men and women who selflessly serve our nation with honor and courage. http://t.co/T7cpdu5BSj",39,35
599310016819163137,2015-05-15 20:26:57,The brave members of our communities who protect &amp; serve are indispensable. We thank you—this #PoliceWeek &amp; every week—for your service.,5,15
599293273870626816,2015-05-15 19:20:25,Introduced an amendment to grant Nepal trade preferences. Would be big boost to Nepal’s post-earthquake recovery. http://t.co/EwHWsyHBgD,8,11
599241114542022656,2015-05-15 15:53:09,Read my @WomensHealthMag op-ed w/ @SenatorCollins about the need to make sure personal care products are safe. http://t.co/BJk5ToZlRi #NWHW,7,9
598956778802536450,2015-05-14 21:03:18,"Further unnecessary delay in installing Positive Train Control, a life-saving technology, is irresponsible. http://t.co/tR0IFbwocu",8,12
598935513672851457,2015-05-14 19:38:48,I’ve worked on Positive Train Control since the 2008 Metrolink crash. We must keep pushing for full implementation. http://t.co/tR0IFbwocu,21,10
598922219390160896,2015-05-14 18:45:59,"Read my statement on #Amtrak188 and the importance of Positive Train Control, a crash-avoidance system. http://t.co/tR0IFbwocu",9,9
598881491226075136,2015-05-14 16:04:08,Glad to see my good friends from the @SF_Chamber here in DC. Had a great discussion about what’s next for the City. http://t.co/viCNTrtafR,2,9
598604778701217792,2015-05-13 21:44:35,"Learn more about Positive Train Control from @NTSB, which has PTC listed on its “most wanted” list for 2015. http://t.co/ofKykFdchp",12,5
598604645108428800,2015-05-13 21:44:03,Positive Train Control is a life-saving technology. We cannot afford further unnecessary delay in its universal implementation.,18,12
598604551747465216,2015-05-13 21:43:41,".@NTSB said that if Positive Train Control technology was in place, it could have prevented the Amtrak accident last night.",14,9
598502003728330752,2015-05-13 14:56:11,Spoke with 200 Californians this morning about some of the state’s most pressing issues. http://t.co/TYm3TXRDCM,8,13
598486043965444097,2015-05-13 13:52:46,"My thoughts and prayers are with all those affected by the horrific Amtrak crash in Philadelphia, especially the families of those killed.",6,18
598221165530849280,2015-05-12 20:20:14,My bill with @SenRonJohnson would reduce financial burden on families adopting children from Dem Rep of the Congo. http://t.co/X5gHz6WyHq,5,9
597875363209998336,2015-05-11 21:26:09,"Republican-passed budget guts investments in areas that create jobs, such as infrastructure and education. http://t.co/4VZKCs0bq7",20,18
597794075048292353,2015-05-11 16:03:08,"If you missed it, I joined @ChuckTodd on @MeetThePress  to discuss the threat posed by ISIL. Watch here: http://t.co/LCM9XtKZ3Z",2,7
597461822535532544,2015-05-10 18:02:53,"To all the mothers and grandmothers in California and throughout the country, happy Mother's Day!",23,32
596794309879398400,2015-05-08 21:50:26,"In the wake of the Corinthian College closures, our first priority must be the needs of the students. http://t.co/drUUbEe8Oe",14,8
596752024248651777,2015-05-08 19:02:24,We must #ActOnClimate. Global average carbon dioxide level now over 400 parts per million and rising. http://t.co/7oczTbefzx,11,11
596695600252526593,2015-05-08 15:18:11,Today’s jobs report brings more good news: U.S. has now experienced 62 straight months of private sector job growth. http://t.co/ApnuKpg0rS,16,15
596395319509782528,2015-05-07 19:24:59,Read my statement on granting the president Trade Promotion Authority: http://t.co/bYA2JSdkSe,5,2
596382803706650625,2015-05-07 18:35:15,"Great honor to visit w/ His Holiness Aram I, Catholicos of the Great House of Cilicia, who gave today’s Senate prayer http://t.co/TgetEJesCd",152,263
596045143465136128,2015-05-06 20:13:30,"Students from Davis, Clovis &amp; Palmdale were a part of the winning team at the #FirstRobotics Competition. Great job! http://t.co/EuCNPKMM3l",7,5
596003461034024960,2015-05-06 17:27:52,"You can support Calif flower growers on Mother's Day by looking for ""Certified American Grown"" http://t.co/7XD3PBBAdL http://t.co/B7ibGbYxhd",14,15
595974764939878400,2015-05-06 15:33:51,Joined 38 Senators to urge @HHSgov to make sure insurers are providing access to contraception as required by law: http://t.co/co30GlQlYG,16,13
595716788970778624,2015-05-05 22:28:45,I voted against the GOP budget resolution today because it sets all the wrong priorities. Read my statement here: http://t.co/RgXUv93ech,19,19
595711070020448256,2015-05-05 22:06:01,".@SenatorLeahy, @SenatorDurbin and I again called on the president to close #Guantanamo. Read our letter here: http://t.co/hsFWaNtRYN",23,18
595695690577227778,2015-05-05 21:04:54,"GOP budget eliminates the estate tax, which only applies to the wealthiest, while hiking taxes for the working-class. http://t.co/lt44wjg5cM",34,17
595684370909888512,2015-05-05 20:19:55,"Republican budget priorities are not only morally wrong, they will stifle our economic growth. http://t.co/lt44wjg5cM http://t.co/D5CwOq8zFp",46,35
595659983473217536,2015-05-05 18:43:01,"GOP budget fails to support working families and low-income children, while giving tax breaks to the wealthiest. http://t.co/lt44wjg5cM",8,6
595652482669359105,2015-05-05 18:13:13,Small businesses are the foundation of the U.S. economy and the biggest incubator for job growth. https://t.co/mg7g9qM5fq #SmallBizWeek,10,3
595644454868013057,2015-05-05 17:41:19,GOP budget sets all the wrong priorities and marks a major step backward for the country. My @HuffingtonPost op-ed: http://t.co/lt44wjg5cM,7,4
595346227857891329,2015-05-04 21:56:16,"Vice Admiral Charles Ray, @USCG Pacific Area Commander, stopped by to discuss keeping our shores safe. http://t.co/rCC3dZyQDS",8,3
595334027848081408,2015-05-04 21:07:47,Congratulations! MT: @SFGate: It's official! @StephenCurry30 2014-15 @NBA MVP! http://t.co/YWi2spo7Q1 http://t.co/LI6YdDxxl7,5,11
595317988221440000,2015-05-04 20:04:03,Fascinating look at how to encourage young women to pursue engineering careers and use their skills for social good. http://t.co/VeAlQSNM0f,7,9
594221386857586688,2015-05-01 19:26:33,May is Asian American &amp; Pacific Islander Heritage Month—a group that has made significant contributions to the nation http://t.co/aDuw19i98Y,27,17
594209316414070784,2015-05-01 18:38:35,The breast cancer research stamp has raised $80 million. Congress must reauthorize it. http://t.co/BOL3vc8xLJ http://t.co/yznlcjCgJc,32,22
593869004667752451,2015-04-30 20:06:18,We need to prioritize safety for crude oil traveling by rail. New bill introduced today is another step forward. http://t.co/MhjUrPK9l3,7,16
593853275650285570,2015-04-30 19:03:48,"Bethlehem Mayor Vera Baboun visited with me yesterday, the city’s first female mayor &amp; a very impressive individual. http://t.co/Z3UpAaO6Ew",11,11
593838862503440384,2015-04-30 18:06:32,We must #RaiseTheWage to help women who are sole or cobreadwinners in so many families across the country. http://t.co/p6pzhwVbd7,50,40
593834933266812928,2015-04-30 17:50:55,Prices of everyday goods continue to increase while wages stagnate. #RaiseTheWage because it’s the right thing to do. http://t.co/WpDyd5UyTM,38,24
593831291549831168,2015-04-30 17:36:27,"Let’s face the facts—today’s minimum wage doesn’t cut it. We must #RaiseTheWage, so American families can thrive. http://t.co/5dcT6GTChm",75,61
593813121925566464,2015-04-30 16:24:15,".@CountyOfSonoma is doing its part on climate change, honored by @EPA for its use of hybrid vehicles. http://t.co/V0FwKSj9vg",4,8
593527534534283264,2015-04-29 21:29:26,My good friend Lt. Gov. @GavinNewsom stopped by this afternoon. Always great to see him! http://t.co/7dWa6lIO7F,9,28
593518165381947393,2015-04-29 20:52:12,"When it comes to combating climate change, California continues to lead. Outstanding move by @JerryBrownGov.  http://t.co/JQW3EtccpP",38,48
593152804258226177,2015-04-28 20:40:23,Mount Madonna School students have been recognized by the @EPA for their work protecting sea turtles. Great job! http://t.co/pcMZyXb8mM,7,13
593068346410725376,2015-04-28 15:04:47,Important day at the Supreme Court. I’m standing with those fighting for marriage equality because #LoveCantWait. http://t.co/2lI7D4FYK4,217,393
592765270487347201,2015-04-27 19:00:28,Read the text of the amicus brief filed by 211 members of Congress on marriage equality. #LoveCantWait http://t.co/vsQJJgRINR,63,57
592764965666316288,2015-04-27 18:59:15,"In March, 211 members of Congress weighed in on marriage equality. Supreme Court hears case tomorrow. #LoveCantWait http://t.co/lfEkXCabmd",154,157
592751465669746691,2015-04-27 18:05:36,Members of the San Joaquin Council of Governments stopped by last week to talk transportation funding. Great meeting! http://t.co/G0FMZRJvgX,3,5
591712787010887681,2015-04-24 21:18:16,Happy #NationalArborDay! These mighty redwoods are an iconic part of California. @RedwoodNPS http://t.co/CrxDx7XrEP,21,35
591702039094304768,2015-04-24 20:35:34,Syrian women have a big role to play in civil society and the political process to end the war. We must support them. http://t.co/yOqsJjNUNc,4,10
591694814783119362,2015-04-24 20:06:51,The humanitarian crisis in Syria is disproportionately affecting women &amp; girls. The U.S. can do more to protect them. http://t.co/yOqsJjNUNc,6,8
591641892456103937,2015-04-24 16:36:33,Somber day as we remember and honor the victims of the Armenian genocide. Let us renew our vow: “Never again.”,24,44
591369129459875840,2015-04-23 22:32:42,There are countless iconic American women who have inspired me and made our country better. Time to see #WomenOn20s. http://t.co/ige2PbDuOy,102,113
591351179805855745,2015-04-23 21:21:22,A #TBT from my days as mayor. Here I am in Yosemite with hard working members of the San Francisco Conservation Corps http://t.co/jywTUGhWnM,5,21
591310971232198656,2015-04-23 18:41:36,History is made with the confirmation of Loretta Lynch as Attorney General. I’m confident she’ll do a stellar job. http://t.co/rJb9tz00o2,34,45
591284447133171712,2015-04-23 16:56:12,Deeply saddened about the deaths of Warren Weinstein and Giovanni Lo Porto. Both men were selfless individuals. http://t.co/RnocdEP7QJ,10,7
591006027451129857,2015-04-22 22:29:51,We must do more to stop child abuse. @Childhelp is saving lives every day. Read my @HuffingtonPost op-ed. http://t.co/v2wlWhyhy0,17,18
591002290208841728,2015-04-22 22:15:00,MT @SenatorShaheen @WomenOn20s started a tremendous grassroots effort 2 put a woman on the $20. Read about the bill http://t.co/rt3t1awvJC,5,11
590998532066250752,2015-04-22 22:00:04,Sex trafficking victims face unspeakable horrors. @SenRobPortman and I are making sure buyers face harsh penalties. http://t.co/ATuxUwIqCr,9,16
590992637106253824,2015-04-22 21:36:39,My amendment w/ @SenatorKirk to stop the commercial exploitation of underage children over the Internet passed 97-2. http://t.co/N7OkgErpjA,10,15
590989844035272705,2015-04-22 21:25:33,Very proud of Granada Hills Charter High School for bringing the 2015 Nat’l Academic Decathlon title to California! http://t.co/LSzO940g1D,6,11
590983222303023105,2015-04-22 20:59:14,Let’s ensure future generations can experience the wonder of places like Yosemite. #EarthDay2015 #ActOnClimate http://t.co/tOLEA3M7CX,47,50
590977547778842625,2015-04-22 20:36:41,Speaking at @ChildHelp’s National Day of Hope Luncheon. Together we can end child sex trafficking. #FiveTooMany http://t.co/JT7gGIFetT,11,19
590968756928700416,2015-04-22 20:01:45,Grateful to Republicans who have said the president needs a full team. Let’s #ConfirmLynch so the new Attorney General can get started.,11,19
590963588250099712,2015-04-22 19:41:13,Loretta Lynch has sterling credentials. I’m particularly impressed with her record prosecuting terrorists as a U.S. attorney. #ConfirmLynch,14,18
590959316468899840,2015-04-22 19:24:15,#EarthDay2015 is an opportunity to recognize that the U.S. is the global leader in wind energy. http://t.co/64VjS1JUi6,20,20
590948165832073216,2015-04-22 18:39:56,RT @NASA: Happy #EarthDay! Here's a recent look at our home planet using data from 6 @NASANPP orbits: http://t.co/9YApBb5ujj http://t.co/QZ…,4284,0
590940354750369793,2015-04-22 18:08:54,A great shot of Lake Tahoe’s Emerald Bay. An #EarthDay reminder that we must protect this pristine natural wonder. http://t.co/EZwl5VNoFC,43,54
590931309654056961,2015-04-22 17:32:57,"Read @JohnKerry’s op-ed in @USAToday. This #EarthDay and every day, let’s work together to #ActOnClimate: http://t.co/GIFUiy14h5",9,15
590911022799654912,2015-04-22 16:12:21,"Be a part of the #EarthDay2015 festivities—throughout the state, Californians are celebrating: http://t.co/OBvv989I3f",12,10
590903912917524482,2015-04-22 15:44:05,"On #EarthDay, I am focused on preserving the California desert, one of our most magnificent landscapes. http://t.co/9FSbwJO9L4",20,29
590646763234713600,2015-04-21 22:42:16,"Given Germanwings tragedy, it’s time for the U.S. to take a close look at cockpit safety &amp; mental health policies. http://t.co/VPZBDvov3P",10,15
590637368115335168,2015-04-21 22:04:56,The Senate must act to confirm our next attorney general. Loretta Lynch has waited long enough. #ConfirmLynch http://t.co/nwIAQCnfyX,35,24
590625283826446337,2015-04-21 21:16:55,The facts are clear—clean energy policies power the economy and benefit middle class families. Read the report: http://t.co/DcglVyVEAb,9,15
590611542120538114,2015-04-21 20:22:19,Loretta Lynch is more than qualified to be our next Attorney General. The time for a confirmation vote is now. #ConfirmLynch,78,54
590595887421906944,2015-04-21 19:20:06,Great meeting with President Hernandez and other Honduran officials. Discussed illicit drug issues and much more. http://t.co/pteggyZfsw,1,6
590575714790940672,2015-04-21 17:59:57,National Crime Victims’ Rights Week: @TheJusticeDept honoring those who fight for victims. Watch live at 2 p.m. EDT: https://t.co/zCTuDQDZwD,2,6
590279515101859840,2015-04-20 22:22:57,We all use personal care products. My bill with @SenatorCollins would ensure they are safe. http://t.co/lFotUz0DRD,11,14
590276893984870400,2015-04-20 22:12:32,.@SenateDems dedicated to making sure hard working middle class families receive tax breaks. #MiddleClassEconomics http://t.co/YWPKq1NECC,17,11
590266306152288256,2015-04-20 21:30:28,RT @latimes: .@DianaMarcum's reporting on life during drought in California's Central Valley won a Pulitzer today. Read it here: http://t.c…,57,0
590266136085815296,2015-04-20 21:29:48,Congratulations to all the talented journalists and writers who were honored today with a @PulitzerPrize. Thanks for your great work.,7,11
590208906904924160,2015-04-20 17:42:23,Plenty of great events in California leading up to #EarthDay2015. See what’s going on in your community: http://t.co/OBvv989I3f,12,11
589098001873907712,2015-04-17 16:08:03,Wonderful to meet with His Holiness the Karmapa this week to discuss important issues facing all Tibetans. @Karmapa17 http://t.co/IJHwYN32Q4,17,28
589079271739695105,2015-04-17 14:53:37,"Positive Train Control saves lives, bottom line. Further unnecessary delays are irresponsible and unacceptable. http://t.co/PhWOhXqWL8",8,8
588787926290554882,2015-04-16 19:35:55,Thanks for the visit and great discussion! MT @NorwayMFA: Excellent discussion on Iran and Russia @borgebrende http://t.co/XzmNY4IncY,2,9
588755042062196737,2015-04-16 17:25:15,"Today, Yom HaShoah, I am honoring the 6 million Jews who perished in the Nazi Holocaust. It’s also a time to renew the vow “Never again.”",15,28
588455901666742272,2015-04-15 21:36:34,Today serves as a day of remembrance for President Lincoln. We are forever grateful for his contributions to America. http://t.co/3BzDmvBVSZ,13,21
588416280354521089,2015-04-15 18:59:08,Good news: Senate acted to protect Medicare access and fund children’s health insurance &amp; community health centers. http://t.co/SqZVwpiWqV,10,12
588400762662813696,2015-04-15 17:57:28,A devastating result of wildlife trafficking. We must take action to increase penalties for these heinous crimes: http://t.co/QVmq8jNUoZ,10,5
588373282526781440,2015-04-15 16:08:16,Today is Tax Day—remember to file your federal and state taxes. Helpful resources from the @IRSnews here: http://t.co/KseT2Ou1Px,10,4
588100110904594433,2015-04-14 22:02:47,Discussing the challenges facing California’s educators with the Association of California School Administrators. http://t.co/sZXktaZ9VM,5,11
588078322686504960,2015-04-14 20:36:12,"Let’s work together to eliminate the earnings gap—the average woman loses $420,000 over her lifetime. #EqualPayDay http://t.co/irlEjuVrW2",44,35
588065183580475392,2015-04-14 19:44:00,"Unfair wages paid to women are harmful to families, communities and society. My statement on #EqualPayDay: http://t.co/NWt6SnApXL",22,21
588047899185041410,2015-04-14 18:35:19,"Excellent briefing for senators on Iran. @ErnestMoniz, a nuclear scientist, outlining the technical aspects of the agreement was key.",22,16
588039641284096001,2015-04-14 18:02:30,"Critics are wrong, the wage gap isn't due to women’s choices. Women still make less than men working the exact same job.  #EqualPayDay",96,93
588027972025720833,2015-04-14 17:16:08,"Wage gap more harmful to certain groups. Calif. Latinas earn $.44 for every $1 men earn, an annual gap of nearly $39,000. #EqualPayDay",47,32
588025370118643712,2015-04-14 17:05:47,"In 1963, women earned $.59 for every $1 earned by men. In 2015, that figure is $.78 per $1. We must do more for equality. #EqualPayDay",94,57
588015354762420224,2015-04-14 16:26:00,Women are the sole or co-breadwinners in two-thirds of American families. They deserve to be paid fairly. #EqualPayDay,437,433
587975830086778880,2015-04-14 13:48:56,.@JillFilipovic looks at how the women of the Senate work together &amp; the challenges faced by women in public office. http://t.co/bjbssbuwsD,12,7
587734661243215873,2015-04-13 21:50:37,I agree with Secretary Moniz: the framework agreement with Iran represents an important step toward a safer world. http://t.co/rWVazGbu04,24,23
587721402393952257,2015-04-13 20:57:56,"Debate on Iran “must be informed by clarity on the specifics of the…technical parameters,” says @ErnestMoniz. http://t.co/rWVazGbu04",5,6
587701889728413696,2015-04-13 19:40:24,"As one of our nation’s top nuclear scientists, @ErnestMoniz knows what it takes to prevent a nuclear-armed Iran. http://t.co/rWVazGbu04",28,23
587688349974028288,2015-04-13 18:46:36,.@ErnestMoniz makes a very strong argument in @WashingtonPost. Iran’s 4 pathways to a bomb will be blocked. http://t.co/rWVazGbu04,12,10
587667306790137856,2015-04-13 17:22:58,.@ErnestMoniz’s op-ed gives the definitive interpretation of the framework nuclear agreement with Iran. Must read: http://t.co/rWVazGbu04,11,8
587646975610355713,2015-04-13 16:02:11,RT @ErnestMoniz: The #IranDeal is a strong step toward a safer world. My Op-Ed in today's @WashingtonPost → http://t.co/OYseD896FU,109,0
586225342106460160,2015-04-09 17:53:07,I've always enjoyed my conversations with @BobSchieffer on @FaceTheNation. His Sunday interviews are tough but fair. I wish him the best.,4,14
585947525238038528,2015-04-08 23:29:11,".@RepLoisCapps has fought tirelessly to improve health care, education and protect the environment. I wish her the best in retirement.",10,12
585910992799981569,2015-04-08 21:04:01,The framework deal blocks Iran from overtly or covertly producing a nuclear bomb. https://t.co/AX1ngqK6hC http://t.co/UASsFfDJYg,57,38
585896625547124737,2015-04-08 20:06:55,National Public Health Week reminds us that we can all work together for healthier communities. More info here: http://t.co/R1ySwNalGP,3,4
585544721235312642,2015-04-07 20:48:35,.@WSJ looks at the serious effect of judge shortages on Eastern District of Calif. Working to address this problem. http://t.co/HqQ9s8rD6o,11,6
585536754914041857,2015-04-07 20:16:55,Good news: @NTSB is calling for strong safety rules for oil traveling by rail. http://t.co/d0Ielx4jj8,3,7
585197355525353472,2015-04-06 21:48:16,"Opening Day is here! Looking forward to another great season from the world champs, our @SFGiants!",11,17
585150135602176001,2015-04-06 18:40:38,Yesterday I discussed the nuclear negotiations with Iran and California’s drought on @CNNsotu. Watch here: https://t.co/yZYdKhgn8u,10,18
584166830287233024,2015-04-04 01:33:20,Deeply saddened by the passing of Sarah Brady. She and her late husband Jim were tenacious advocates for stronger gun laws.,105,132
584116109177151490,2015-04-03 22:11:47,Chag Sameach to everyone in the U.S. and around the world observing Passover tonight.,20,27
584099059910205440,2015-04-03 21:04:02,I’ll be joining Jim @Acosta on @CNNsotu to discuss the Iran nuclear deal and California’s drought this Sunday at 9:00 am ET &amp; PT,10,9
584090630013513728,2015-04-03 20:30:32,RT @CNNsotu: SUNDAY: @SenFeinstein joins @Acosta on @CNNsotu about the #IranDeal. 9aET &amp; PT on @cnn http://t.co/CvASFM2EAm,16,0
584070282773733376,2015-04-03 19:09:41,"When it comes to providing innovative financial aid packages, @Stanford leads the way. Proud of my alma mater. http://t.co/IuaCxszEKd",9,15
584056810182676480,2015-04-03 18:16:09,Great analysis by former Deputy Secretary of State Bill Burns on next steps for Iranian nuclear talks. http://t.co/MEiBA8CZT6,13,6
584041051700224000,2015-04-03 17:13:32,"Sec. @JohnKerry: With framework in place, vital milestone was reached in nuclear deal, but there is more work ahead. http://t.co/8do9wkHTfx",10,13
583754691948994560,2015-04-02 22:15:38,.@DeptVetAffairs is providing $30 million to support low-income veterans and their families in Los Angeles. http://t.co/zx78BQ2ndp,8,9
583743389587341312,2015-04-02 21:30:44,"I’ll continue my support of the P5+1 negotiators, who have extracted significant concessions from Iran. http://t.co/8naN3F0qNg",84,119
583737841303363584,2015-04-02 21:08:41,P5+1 negotiators have made significant progress toward a final agreement with Iran. My statement here: http://t.co/8naN3F0qNg,40,29
583720151901691904,2015-04-02 19:58:23,The appalling terrorist attack in Kenya is truly heartbreaking. The international community must intensify efforts to root out such evil.,23,17
583661257498165248,2015-04-02 16:04:22,Autism affects 1 in 68 American kids. More research and support for families needed. #LIUB http://t.co/SVJzgjHBeP http://t.co/ntzuimNxtK,57,62
583369684533264384,2015-04-01 20:45:45,All children have the right to be safe and we can help prevent abuse. Learn more about #ChildAbusePreventionMonth: http://t.co/nuCnQSX27B,18,18
