id,created_at,text,retweets,favorites
601190027737968640,2015-05-21 00:57:26,"Last year, Congress gave #VA secretary the authority to fire employees. This is what he’s done with it:
https://t.co/q74cyUsaNE",33,22
601170396742864896,2015-05-20 23:39:26,Strategic investments in R&amp;D will help ensure that we don’t forfeit our global leadership to China http://t.co/WU8A6mYgck #jobs,13,22
601169008340160512,2015-05-20 23:33:55,Every life is precious. That's why we're passing #bipartisan solutions to #EndTrafficking http://t.co/mELLX0JIl1,22,39
601167908362944513,2015-05-20 23:29:33,America’s leadership in the world is driven by our ability to innovate http://t.co/WU8A6mYgck #jobs,21,23
601166091897933825,2015-05-20 23:22:20,House passes two more bills to ensure America remains a nation of innovators http://t.co/WU8A6mYgck #4jobs,12,17
601164518077702145,2015-05-20 23:16:04,"Pres Obama owes the American people &amp; our #veterans a real, long-term plan to fix the VA. http://t.co/AFVUr6yfjZ",27,25
601157847607554048,2015-05-20 22:49:34,Pres Obama should withdraw his irresponsible #AUMF &amp; start over with a real overarching strategy to defeat #ISIL http://t.co/Y3uKyj3Kkm,23,30
601154733907259392,2015-05-20 22:37:12,Leading by example: we’ve cut House spending by nearly 14 percent. http://t.co/yWp95oqJTV,14,22
601150878519795713,2015-05-20 22:21:52,"“If anyone bled red, white, and blue, it was that guy.” http://t.co/walKqMUZ6p #FighterAces",12,18
601147916082896896,2015-05-20 22:10:06,"Congress can act to hold #VA accountable, but only @POTUS can change the culture from within. http://t.co/AFVUr6yfjZ",16,23
601145018670190592,2015-05-20 21:58:35,"Our #veterans don't need another promise or a pledge. They need a real plan to fix the #VA.
https://t.co/i10r1YjjEc",22,28
601142163389440000,2015-05-20 21:47:15,".@HillaryClinton Prove you want your emails out. Turn over your private server to an independent, third party. http://t.co/vokiG1sNPc",89,75
601137557229961216,2015-05-20 21:28:56,"This #CongressionalGoldMedal honors not just what the #FighterAces did, but how they did it – with daring &amp; devotion http://t.co/walKqMUZ6p",8,7
601136074698665985,2015-05-20 21:23:03,These fighter pilots were the best of the best. Today they received our highest honor. http://t.co/walKqMUZ6p #CongressionalGoldMedal,19,21
601133414503309313,2015-05-20 21:12:29,What’s going on at the #VA isn’t run-of-the-mill incompetence. It’s arrogance.  http://t.co/AFVUr6yfjZ,28,25
601118232129499138,2015-05-20 20:12:09,If only the #VA did half as good a job taking care of our #veterans as they do their own bureaucrats. http://t.co/AFVUr6yfjZ,35,49
601101247832268801,2015-05-20 19:04:40,STARTING NOW: #CongressionalGoldMedal ceremony honoring American #FighterAces. WATCH: https://t.co/U5i7eu1xu7,10,13
601099252417351680,2015-05-20 18:56:44,Hillary Clinton’s lawyer said the address hrod17@clintonemail.com didn’t exist before 2013. There’s only one problem… http://t.co/PzqDGqv4o2,24,24
601096309492326401,2015-05-20 18:45:02,Told Charlotte Ivancic we needed a permanent doc fix. She got it done. http://t.co/8bd7qrxAJf http://t.co/z2ba0zJz0Q,7,20
601091768545869824,2015-05-20 18:27:00,WATCH LIVE on http://t.co/A6cLrW5xAP at 3 PM ET: #CongressionalGoldMedal ceremony honoring American #FighterAces,5,11
601086233515839489,2015-05-20 18:05:00,"It’s arrogance at the #VA that allows our #veterans to be lied to, ignored &amp; left to die. http://t.co/AFVUr6yfjZ https://t.co/LA7s7Rx1QE",30,27
601083506983337988,2015-05-20 17:54:10,Former Secretary of State Hillary Clinton says “I want those emails out.” Here’s how she can prove it: http://t.co/PzqDGqv4o2 #Benghazi,26,22
601081356534337536,2015-05-20 17:45:37,Grateful to have Jo-Marie St. Martin on staff. “Nerves of steel” indeed. http://t.co/zCJfCksXP4 http://t.co/KC0SjEdRxE,14,27
601079168714055680,2015-05-20 17:36:55,Only one person fired for manipulating #veterans wait lists at the #VA? http://t.co/AFVUr6yfjZ What the hell happened to the rest of them?,55,37
601076776404656128,2015-05-20 17:27:25,Editorial boards &amp; outside experts agree: it’s time for President Obama to rethink the strategy against #ISIL → http://t.co/KcufSjaXJj #Iraq,14,17
601072855586050048,2015-05-20 17:11:50,Spoke out on the House floor today for #VAaccountability. The VA is failing our #veterans. http://t.co/AFVUr6yfjZ https://t.co/LA7s7Rx1QE,19,22
601067695824629760,2015-05-20 16:51:20,First called for House audits in the ‘90s. Here’s a glimpse of what things were like back then → https://t.co/PAQWyiacTs #TBT,9,10
601064051091894272,2015-05-20 16:36:51,"RT @RepByrne: ""House passes bills to boost veterans' assistance"" via @TheHill http://t.co/cKXpbQIRK2",10,0
601062066468814848,2015-05-20 16:28:58,The people’s House is holding itself accountable just as any good business would. http://t.co/p72S9ZKB1W,8,13
601060776649064448,2015-05-20 16:23:50,RT @McClatchyDC: Experts: U.S. claims Ramadi a mere setback are ‘delusional’ http://t.co/yMbLP5fwy0,19,0
601059154309021696,2015-05-20 16:17:24,Proud to have so many invaluable women on staff. These are just two who do great work: http://t.co/8bd7qrxAJf http://t.co/zCJfCksXP4,16,27
601056845395001345,2015-05-20 16:08:13,"Our focus has to be on helping the middle class get ahead, not just get by: http://t.co/EN6F7sbVG8",10,26
601055464760201217,2015-05-20 16:02:44,On the House floor. Going to speak about ongoing scandal at the VA. WATCH: http://t.co/OP6IhElpLJ #veterans,11,15
601052783689768960,2015-05-20 15:52:05,"The best of the best, #FighterAces risked it all to defend freedom. We'll honor them with a #CongressionalGoldMedal → http://t.co/vldwoz1rRM",12,18
601049710405799937,2015-05-20 15:39:52,A big step forward to protect the innocent &amp; most vulnerable http://t.co/mELLX0JIl1 #EndTrafficking,9,15
601048056281354240,2015-05-20 15:33:18,"“Just to be here, to have survived 800 hours of combat, 339 missions, and somehow downed five MiG-21s…” http://t.co/1ES6cR4dBk #FighterAces",5,8
601043930113810432,2015-05-20 15:16:54,"The House received another clean financial audit. http://t.co/p72S9ZKB1W Further proof we’re keeping our word, protecting taxpayer dollars.",20,19
601039013286387712,2015-05-20 14:57:22,The terrorist threat is growing faster than what we &amp; our allies can do to stop it. http://t.co/Y3uKyj3Kkm The president needs a real plan.,21,25
601034916080525312,2015-05-20 14:41:05,".@RepKevinBrady’s R&amp;D tax credit bill makes it easier for businesses to invest, innovate, &amp; create more jobs http://t.co/EN6F7sbVG8",12,15
601031623795159041,2015-05-20 14:28:00,We've taken bipartisan action to #EndTrafficking – monstrous crimes that must be stopped. http://t.co/mELLX0JIl1,17,22
601027458696126464,2015-05-20 14:11:27,Today Congress will honor American #FighterAces with a #CongressionalGoldMedal for their bravery in the sky → http://t.co/vldwoz1rRM,19,21
601019178187923456,2015-05-20 13:38:33,We’re on track to save taxpayers $2.1 trillion. This is how it all started → http://t.co/yWp95oqJTV,16,15
601015703802613760,2015-05-20 13:24:44,“And from there on it was a fancy ride.” http://t.co/1ES6cR4dBk,5,5
601012310363209728,2015-05-20 13:11:15,"When it comes to defeating #ISIL terrorists, hope is NOT a strategy. http://t.co/Y3uKyj3Kkm http://t.co/5qkI9yUtYd",61,47
601006082346082304,2015-05-20 12:46:30,“…The recognition of it does put you in an elite level in Air Force fighter pilots.” http://t.co/1ES6cR4dBk,6,4
601002323368910849,2015-05-20 12:31:34,Fear not: we’re working to make it easier to go sledding on @uscapitol grounds. http://t.co/yWp95oqJTV #SledFreeOrDie,13,18
601000711346855936,2015-05-20 12:25:10,Agree with @RosLehtinen &amp; @MarioDB that the president has established dangerous precedent with #Cuba policy. https://t.co/YszUFne1mF,22,14
600998570272108544,2015-05-20 12:16:39,"Beyond the dollars &amp; cents, we’re doing more with less, just as hardworking families are every day. http://t.co/BAU6RRXcAS",6,10
600996202944016384,2015-05-20 12:07:15,"“Aviation is dangerous, but if you love it you survive. I’m a survivor.” http://t.co/1ES6cR4dBk",11,12
600818271416414208,2015-05-20 00:20:13,RT @GOPLeader: This week the House will advance American innovation by voting to end Washington roadblocks to change #InnovationWeek http:/…,17,0
600808022903005184,2015-05-19 23:39:29,Glad to have you back. MT @RepLouBarletta: Back at work for the people of PA-11! Thank you for the well wishes! http://t.co/Npw6FZBMRH,18,13
600803863747256320,2015-05-19 23:22:58,"Pres Obama has had since August 8, 2014, to nominate a special envoy for religious minorities in the #MiddleEast. http://t.co/rorWA7UDXI",20,15
600797882023845888,2015-05-19 22:59:12,Former Secretary of State Hillary Clinton needs to turn over her private email server to a neutral 3rd party examiner http://t.co/k7HbnYpeFJ,55,52
600789841312391169,2015-05-19 22:27:14,Some of America’s bravest come to Washington tomorrow → http://t.co/1ES6cR4dBk #CongressionalGoldMedal,21,18
600784792167305217,2015-05-19 22:07:11,"The House passed a short-term highway extension, providing additional time to work toward long-term agreement. http://t.co/ovxKWpnc8w",14,11
600781702710075392,2015-05-19 21:54:54,Fiscal responsibility starts at home: we’ve cut the cost of Congress by $782 million. http://t.co/BAU6RRXcAS http://t.co/XA6FruioDA,36,37
600780285005946880,2015-05-19 21:49:16,"Revealed: “Hillary Received Memo Describing #Benghazi As Planned Terror Attack Within Hours,” reports @DailyCaller http://t.co/nfle4TpeMv",88,43
600772123490164736,2015-05-19 21:16:50,Pure evil: #BokoHaram rapes women to “create a new generation of Islamist militants” in #Nigeria http://t.co/uzUwp5mp0W,27,16
600765711976374273,2015-05-19 20:51:22,Thanks @RosLehtinen &amp; @MarioDB for meeting today to discuss #Cuba policy. http://t.co/lFgslJkbJh,16,24
600761635758841856,2015-05-19 20:35:10,This bill boosts funding for the Capitol Police &amp; protects the public’s access to the @uscapitol → http://t.co/yWp95oqJTV,7,9
600760222773194752,2015-05-19 20:29:33,"#Iran has imprisoned a @WashingtonPost reporter, @jrezaian, for nearly a year. http://t.co/ISaO1wiPRl",24,15
600755696209035264,2015-05-19 20:11:34,"#AmirHekmati, a Marine veteran, is the longest-held American prisoner in #Iran http://t.co/lVayMLCKUE #FreeAmirNow",53,34
600754188780371969,2015-05-19 20:05:34,"An American Christian, pastor #SaeedAbedini, spent another birthday imprisoned in #Iran http://t.co/zFAZMp5o3G #SaveSaaed @NaghmehAbedini",145,81
600751323106058240,2015-05-19 19:54:11,“American Fighter Aces Fly Into History – Once Again” http://t.co/BHlkwuoYpl via @museumofflight #CongressionalGoldMedal,10,8
600748571965530114,2015-05-19 19:43:15,The @HouseBenghazi Select Committee led by @TGowdySC continues to seek the truth about #Benghazi. https://t.co/q3OXUFNOAL,28,21
600746709862330368,2015-05-19 19:35:51,Investments in basic research are critical to boosting US competitiveness. Here’s how @LamarSmithTX21’s bill helps: http://t.co/EN6F7stwxG,8,11
600744216474550272,2015-05-19 19:25:57,Now is the time to #EndTrafficking. http://t.co/mELLX0JIl1 http://t.co/1KeCn0V9hm,43,39
600739012358320129,2015-05-19 19:05:16,"We’ve kept our pledge to cut the cost of Congress, saving taxpayers $782 million. http://t.co/yWp95oqJTV",15,18
600731587194523649,2015-05-19 18:35:46,"Today, Congress acted to #EndTrafficking &amp; help heal the wounds of the victims of these horrific crimes: http://t.co/mELLX0JIl1",17,21
600728676486008832,2015-05-19 18:24:12,"Three more pro-growth, pro-innovation bills #4jobs are slated for action in the House http://t.co/EN6F7sbVG8",15,11
600720710575751169,2015-05-19 17:52:32,"""The fall of Ramadi was avoidable"" #Iraq  https://t.co/CAV5eRR4pu",28,23
600719705247195136,2015-05-19 17:48:33,The president’s #AUMF calls for less authority than he has today. That’s irresponsible. http://t.co/Y3uKyj3Kkm https://t.co/zv5wTvxZgN #ISIL,17,10
600706258455425026,2015-05-19 16:55:07,Democrat: “alarm bells should be going off” in the White House over #ISIL http://t.co/fuvyY9FNMS,19,26
600704549297487873,2015-05-19 16:48:19,"Thank you to our #Ohio veterans, we appreciate your service to our country. Welcome to DC today! #HonorFlight   https://t.co/nVUaA9dwa3",12,22
600700258696454144,2015-05-19 16:31:16,We're putting Americans' priorities first with bills to support our troops &amp; give Congress a say in any #Iran deal http://t.co/Y3uKyj3Kkm,44,26
600696311952887808,2015-05-19 16:15:35,It was a mistake for Pres Obama to abandon gains in #Iraq. He must not make the same mistake in #Afghanistan. #ISIL  https://t.co/TZrB8ZdOOr,35,26
600694673624150016,2015-05-19 16:09:05,.@HoustonPolice Officer #RichardMartin was killed in the line of duty. Please keep his family in your prayers. http://t.co/seCb0tIyZk #Texas,31,30
600693306767572992,2015-05-19 16:03:39,"Good news via @advocate360 about #Ohio’s @usaerobotix, a guest at the 2015 #OH08 Farm Forum about tech &amp; agriculture: http://t.co/bNYzOPlVpr",13,13
600690444398403584,2015-05-19 15:52:16,"Pres Obama just signed the Rafael Ramos &amp; Wenjian Liu National #BlueAlert Act, which the House passed last week. http://t.co/s07T4v3gAo",29,23
600683434911145984,2015-05-19 15:24:25,"With new gains made by #ISIL in Ramadi, #Iraq, we know that hope is not a strategy → http://t.co/Y3uKyj3Kkm",14,11
600680542271602688,2015-05-19 15:12:56,Here are 7 things to like about this bill to fund the nation’s legislative branch → http://t.co/yWp95oqJTV,4,10
600676121341009920,2015-05-19 14:55:22,"Hillary Clinton used more than 1 private email address during her time as Sec of State, contradicting previous claims http://t.co/eNHc7JGJLg",58,23
600671985379704832,2015-05-19 14:38:55,The Islamic State “has solidified its foothold in #Libya” http://t.co/rBF0Q3l7ft #ISIL,18,12
600670842058584064,2015-05-19 14:34:23,RT @PostWorldNews: The fall of Ramadi exposes Obama’s weak Islamic State strategy. By Editorial Board http://t.co/t0gHUHqj1K,25,0
600667108553396224,2015-05-19 14:19:33,FACT: Republicans have cut the cost of Congress by $782 million. http://t.co/yWp95oqJTV http://t.co/uTuiKkCQpa,42,42
600664802663464960,2015-05-19 14:10:23,HAPPENING NOW → @HouseGOP leaders’ press conference https://t.co/QJAZ4ausYJ,8,10
600658485437661185,2015-05-19 13:45:17,What is the #CongressionalGoldMedal? Go behind the scenes &amp; find out: https://t.co/QAA0khwnLF,18,8
600654350181085187,2015-05-19 13:28:51,"LIVE @ 10 AM ET on http://t.co/POy0Jf7TOz: Press conference with @GOPLeader, @SteveScalise, @RepLynnJenkins, @CathyMcMorris, @LamarSmithTX21",6,4
600646377878757376,2015-05-19 12:57:10,"More #VA accountability, more job training, more #smallbiz jobs for our #veterans: http://t.co/UW8aQjlku1",21,18
600442925764448256,2015-05-18 23:28:43,"The least we owe our veterans is a #VA that serves their needs, and an economy that values their service http://t.co/UW8aQjlku1",31,39
600441717519720448,2015-05-18 23:23:55,House passes several bills to increase #VA accountability &amp; help create more economic opportunities for our vets http://t.co/UW8aQjlku1,31,36
600415547101159424,2015-05-18 21:39:56,"#OH08 residents can visit district offices in West Chester, Troy &amp; Springfield http://t.co/1CKlesSbSW #Ohio",7,9
600413442500141057,2015-05-18 21:31:34,"#ISIL “likely killed up to 500 Iraqi civilians &amp; soldiers &amp; forced 8,000 people to flee from their homes” http://t.co/ZT3ThqZ9jE #Iraq",52,22
600410530449338369,2015-05-18 21:20:00,Members of Congress have “stepped up their oversight of the VA … as a result of continued problems” http://t.co/QGsZumYVMs,22,17
600408919467565056,2015-05-18 21:13:36,"RT @rollcall: After Ramadi, Boehner Calls on Obama to Change Course on ISIL http://t.co/8TmwIttHJB via @StevenTDennis",20,0
600405897555357696,2015-05-18 21:01:35,"#TPA4USjobs “ought to be utterly uncontroversial,” write @NRO editors http://t.co/QgxLLbTG0M",12,14
600403909883002880,2015-05-18 20:53:41,RT @RepTomPrice: Eye opening breakdown of the IRS targeting Americans and the deception that has followed. http://t.co/LDjseNEcSF,44,0
600402462617505792,2015-05-18 20:47:56,This week we’ll present a #CongressionalGoldMedal in recognition of American Fighter Aces http://t.co/SlFaoIjdjG,13,12
600399412733542400,2015-05-18 20:35:49,Members of Congress are only as strong as the staff that surrounds them. http://t.co/1CKlesSbSW http://t.co/SxSYMJq19A,26,25
600397804180283392,2015-05-18 20:29:26,Today the House will consider the Justice for Victims of Trafficking Act. http://t.co/6rDRAqYFpE #EndTrafficking,28,17
600388203669901313,2015-05-18 19:51:17,"With threat from #ISIL growing, Obama admin steps up warnings of potential terrorist attacks on American soil http://t.co/NcJjxwjAeY",35,22
600380583492063232,2015-05-18 19:21:00,Hoping Democrats will put politics aside so we can deliver a defense bill worthy of our troops &amp; their families. http://t.co/7WbhIKYGlM,31,32
600370960437530624,2015-05-18 18:42:45,RT @FreeBeacon: Robert Gates: Clinton’s Use of Personal Email for Govt Business ‘Concerning’ and ‘Risky’ http://t.co/CHKCmhIBCy http://t.co…,62,0
600369999857987584,2015-05-18 18:38:56,"With #TPA4USjobs ""Republicans can kill a bad deal; without it, they have effectively no chance of endorsing a good 1” http://t.co/QgxLLbTG0M",15,14
600367639165304833,2015-05-18 18:29:34,The Islamic State's 'brutal' assault on other faiths: #ISIL “is threatening Christians … to an unprecedented extent” http://t.co/yRBhBc0WgR,31,17
600362532524716034,2015-05-18 18:09:16,"God bless Marines killed in #Nepal:
Dustin Lukasiewicz
Ward Johnson
Eric Seaman
Sara Medina
Jacob Hug
Chris Norgren
http://t.co/gh2wS6YmpR",127,107
600359521144414208,2015-05-18 17:57:18,The Islamic State has seized control of a key city in #Iraq. http://t.co/JV1W0qPLSE #ISIL,25,14
600352210573209601,2015-05-18 17:28:15,"RT @HerreraBeutler: Washington Post ran a Warren/de Blasio op-ed on “American Dream,” yet refused my response--but you can read it here: ht…",24,0
600347225978437632,2015-05-18 17:08:27,Here’s why Democrats voted against the national defense bill: http://t.co/7WbhIKYGlM #NDAA,24,21
600344007957446656,2015-05-18 16:55:40,Former Deputy CIA Director: “foreign intelligence services…have everything” on Hillary Clinton’s private email server http://t.co/XGATxuSvKt,33,30
600339641724698625,2015-05-18 16:38:19,Why is President Obama ignoring problems hurting our #veterans?  https://t.co/AKvHkqwnPB,31,21
600337024848134146,2015-05-18 16:27:55,"“Yes to Trade-Promotion Authority,” write @NRO editors http://t.co/QgxLLbTG0M #TPA4USJobs",7,11
600335298107695104,2015-05-18 16:21:03,Democrats voted against increasing troop pay &amp; benefits because they want more domestic spending. http://t.co/7WbhIKYGlM #NDAA,55,22
600310658903707649,2015-05-18 14:43:08,This is our only way to stop a bad deal with #Iran → http://t.co/ObcWIvUFgD,24,23
600284900697219072,2015-05-18 13:00:47,More bipartisan legislation is headed to President Obama’s desk. http://t.co/ObcWIvUFgD #Iran,39,26
600097401454600193,2015-05-18 00:35:44,RT @SenJohnMcCain: Delivered Weekly #GOP Address today on economic &amp; nat'l security need to pass trade legislation - watch: https://t.co/Lx…,34,0
600096907386585088,2015-05-18 00:33:46,"Similar to #AmberAlerts, #BlueAlerts will help distribute time-sensitive info to quickly apprehend violent criminals: http://t.co/s07T4v3gAo",31,32
600079056957116416,2015-05-17 23:22:50,Signed the #Iran Nuclear Agreement Review Act. http://t.co/ObcWIwcg8b Gives Congress a say on any deal. http://t.co/PF6LT9Hh9z,58,82
600069828636999682,2015-05-17 22:46:10,Sanctions will target the financial network #Hezbollah uses to carry out #Iran’s orders. http://t.co/EHrAvxf9zm,169,50
600045118947753986,2015-05-17 21:07:59,On Friday the House passed legislation to reinforce our mission against #ISIL  http://t.co/SA2vse3xAo,24,22
600033428755652609,2015-05-17 20:21:32,We have one goal: stop a bad deal with #Iran. http://t.co/6VQtFxu4pY http://t.co/wjc5r2FokF,163,74
599735208976490497,2015-05-17 00:36:31,"Yesterday, the House passed #NDAA to give our troops the support they deserve. #ArmedForcesDay http://t.co/eGtmM4Jf2k",61,72
599734473572364290,2015-05-17 00:33:35,Next stop for this bill → the president's desk: http://t.co/SVk1imtX3s http://t.co/kFUiVjnAki,19,38
599728425268617216,2015-05-17 00:09:33,“over time #ISIS’s capabilities will grow. This is what a long-term safe haven in #Iraq &amp; #Syria would give” #ISIL http://t.co/siwHQrIe1m,46,20
599723745297768448,2015-05-16 23:50:57,"Humbled to meet &amp; thank our service members in Baghdad, #Iraq last month. #ArmedForcesDay https://t.co/UsmBqaEg5h",31,50
599720228017287168,2015-05-16 23:36:59,"To all those who serve &amp; protect, thank you. #NationalPoliceWeek #PoliceWeek http://t.co/ROqJznOxgK",91,118
599716584022749186,2015-05-16 23:22:30,"To all at @XavierUniv celebrating graduation today, a big congratulations. #AlmaMater #LetsGoX https://t.co/xn8S62T5eQ",17,30
599713847281381376,2015-05-16 23:11:37,Today is #ArmedForcesDay. Thank you to all those who have answered the call to serve – our true American heroes. https://t.co/o1PfEcsJ4J,84,93
599705426788229120,2015-05-16 22:38:10,Congratulations to all #RedHawks graduating from @MiamiUniversity today. Well done &amp; best of luck. #LoveandHonor,21,31
599646429066436608,2015-05-16 18:43:44,This is a step forward for an alert system when a law enforcement official is injured or killed in the line of duty: http://t.co/s07T4v3gAo,19,27
599616453873160192,2015-05-16 16:44:37,Full statement on fight against #ISIL --&gt; http://t.co/SA2vse3xAo Its assault on Ramadi is a threat to stability in #Iraq.,19,18
599615127407714304,2015-05-16 16:39:21,We owe gratitude &amp; continued support to all involved in this successful mission against #ISIL. http://t.co/SA2vse3xAo,27,35
599588581347307521,2015-05-16 14:53:52,Democrats’ sudden opposition to the defense bill is indefensible. http://t.co/l3L3VS0CvA #NDAA,32,28
599580341985275904,2015-05-16 14:21:07,"For those who lose loved ones in the line of duty—be they police, firefighters or EMTs—this is the right thing to do: http://t.co/SVk1imtX3s",34,42
599302099978035201,2015-05-15 19:55:29,RT @CongCulberson: Thank you to the men and women in law enforcement who risk their lives to protect ours. #PoliceWeek http://t.co/LbRCsL8q…,98,0
599298875531362306,2015-05-15 19:42:41,Democrats chose to vote against funding our troops without a single serious policy concern. http://t.co/l3L3VS0CvA #NDAA #FY16NDAA,37,23
599296721814945793,2015-05-15 19:34:07,"To those who risk their lives, we offer our humble thanks for your bravery, sacrifice &amp; devotion. http://t.co/nFYcl4RHJ8 #PoliceWeek",55,53
599295170799099904,2015-05-15 19:27:57,Great job by Chairman Thornberry &amp; @HASCRepublicans on #FY16NDAA. They’ve done right by our troops. http://t.co/l3L3VS0CvA @MacTXPress,13,12
599294253718773760,2015-05-15 19:24:19,RT @RepDianeBlack: The facts are on our side in the fight to defend the unborn. Read my op-ed in @WashTimes: http://t.co/0quzlfXyao #TheyFe…,22,0
599291801338523648,2015-05-15 19:14:34,Thank you @RepErikPaulsen for your leadership on passing the Don’t Tax Our Fallen Heroes Act. http://t.co/SVk1imtX3s http://t.co/EwgJGz8TR2,34,26
599285827718520833,2015-05-15 18:50:50,That respect for life my parents had – that sanctity and dignity – is everything. https://t.co/qDxSMz5RvW #ProLife #TheyFeelPain,18,28
599283203887800320,2015-05-15 18:40:24,Proud to sign #HR606 to ensure public safety officers won’t have death benefits taxed if killed in the line of duty. http://t.co/SVk1imtX3s,30,37
599281358444306432,2015-05-15 18:33:04,"Congress must have a role in reviewing any potential deal the president tries to cut with #Iran, &amp; now, it will. http://t.co/6VQtFxu4pY",46,48
599279641501773824,2015-05-15 18:26:15,The @WashingtonPost lists “9 big takeaways from memo accusing VA of making a ‘mockery’ of spending rules” http://t.co/DlCGGMsmhP,23,16
599276410864279553,2015-05-15 18:13:25,Former deputy director of the CIA: #ISIL “is a danger on U.S. soil” http://t.co/siwHQrIe1m,25,13
599274623860121601,2015-05-15 18:06:18,"“The @StateDept has not produced 1 single piece of paper responsive to"" @HouseBenghazi's request months ago http://t.co/DPZVc5D7ZT #Benghazi",28,19
599272099723747328,2015-05-15 17:56:17,The #BlueAlert Act bears the names of fallen officers as a tribute to their sacrifice http://t.co/s07T4v3gAo #PoliceWeek #NationalPoliceWeek,12,21
599270206125568000,2015-05-15 17:48:45,RT @SenateSAA: Flags at the #Capitol and across the country fly at half staff today for #PeaceOfficersMemorialDay. #PoliceWeek http://t.co/…,123,0
599265561353310209,2015-05-15 17:30:18,Our gratitude &amp; respect for law enforcement should always be evident. http://t.co/nFYcl4RHJ8 #NationalPoliceWeek #PoliceWeek,40,37
599263765318782976,2015-05-15 17:23:10,#Iran cannot be trusted. https://t.co/6hUPETm92t,218,88
599260970037411840,2015-05-15 17:12:03,"Signed the #BlueAlert Act, which will help law enforcement quickly apprehend violent criminals http://t.co/s07T4v3gAo http://t.co/uvUeQlFcfC",40,31
599259276251688960,2015-05-15 17:05:19,Unborn babies can feel pain by 20 weeks (5 months) in the womb. https://t.co/5bbD2fqaTO #ProLife #TheyFeelPain  https://t.co/Kbtyl2nUuN,62,63
599254522624610304,2015-05-15 16:46:26,$6 billion a year? Where is Pres Obama’s long-term plan for reforming the broken VA? http://t.co/FGAfIgsUmr http://t.co/9gVUN3djP4,34,31
